"math/0507494","Lieven Le Bruyn","Lieven Le Bruyn and Stijn Symens","Partial Desingularizations Arising from Non-Commutative Algebras",,,,,"math.RA",,"  Let X be a singular affine normal variety with coordinate ring R and assume
that there is an R-order admitting a stability structure such that the scheme
of relevant semistable representations is smooth, then we construct a partial
desingularization of X with classifiable remaining singularities. In dimension
3 this explains the omnipresence of conifold singularities in partial
desingularizations of quotient singularities. In higher dimensions we have a
small list of singularity types generalizing the role of the conifold
singularity.
","[{""version"":""v1"",""created"":""Sat, 23 Jul 2005 19:43:14 GMT""}]","2007-05-23"
"math/0507496","Kiran S. Kedlaya","Kiran S. Kedlaya","The p-adic local monodromy theorem for fake annuli","38 pages; v4: refereed version, some typos fixed",,,,"math.NT math.AG",,"  We establish a generalization of the p-adic local monodromy theorem (of
Andre, Mebkhout, and the author) in which differential equations on rigid
analytic annuli are replaced by differential equations on so-called fake
annuli. The latter correspond loosely to completions of a Laurent polynomial
ring with respect to a monomial valuation. The result represents a step towards
a higher-dimensional version of the p-adic local monodromy theorem (the
""problem of semistable reduction""); it can also be viewed as a slightly novel
presentation of the original p-adic local monodromy theorem.
","[{""version"":""v1"",""created"":""Sun, 24 Jul 2005 15:57:15 GMT""},{""version"":""v2"",""created"":""Mon, 8 Aug 2005 14:12:07 GMT""},{""version"":""v3"",""created"":""Mon, 10 Apr 2006 21:47:21 GMT""},{""version"":""v4"",""created"":""Sat, 11 Nov 2006 01:41:12 GMT""}]","2007-05-23"
"nlin/0507050","Andrey A. Sukhorukov","Andrey A. Sukhorukov","Soliton dynamics in deformable nonlinear lattices","5 pages, 4 figures","Phys. Rev. E 74, 026606 (2006);
  http://link.aps.org/abstract/PRE/v74/e026606","10.1103/PhysRevE.74.026606",,"nlin.PS",,"  We describe wave propagation and soliton localization in photonic lattices
which are induced in a nonlinear medium by an optical interference pattern,
taking into account the inherent lattice deformations at the soliton location.
We obtain exact analytical solutions and identify the key factors defining
soliton mobility, including the effects of gap merging and lattice imbalance,
underlying the differences with discrete and gap solitons in conventional
photonic structures.
","[{""version"":""v1"",""created"":""Sun, 24 Jul 2005 13:56:34 GMT""}]","2007-05-23"
"nucl-th/0507052","Pei Junchen","J.C. Pei, F.R. Xu, P.D. Stevenson","Density distributions of superheavy nuclei","7 pages, 10 figures","Phys.Rev. C71 (2005) 034302","10.1103/PhysRevC.71.034302",,"nucl-th",,"  We employed the Skyrme-Hartree-Fock model to investigate the density
distributions and their dependence on nuclear shapes and isospins in the
superheavy mass region. Different Skyrme forces were used for the calculations
with a special comparison to the experimental data in $^{208}$Pb. The
ground-state deformations, nuclear radii, neutron skin thicknesses and
$\alpha$-decay energies were also calculated. Density distributions were
discussed with the calculations of single-particle wavefunctions and shell
fillings. Calculations show that deformations have considerable effects on the
density distributions, with a detailed discussion on the $^{292}$120 nucleus.
Earlier predictions of remarkably low central density are not supported when
deformation is allowed for.
","[{""version"":""v1"",""created"":""Sun, 24 Jul 2005 03:51:29 GMT""}]","2009-11-11"
"physics/0507171","Gordon Chalmers Dr","Gordon Chalmers","A Format for Instantons and Their Characterizations","15 pages, LaTeX, 5 figures",,,,"physics.gen-ph",,"  A characterization of instanton contributions to gauge field theory is given.
The dynamics of instantons with the gluon field is given in terms of
'classical' instanton contributions, i.e. on the same footing as tree
amplitudes in field theory. This paramaterization depends on the kinematics of
the local instanton operators and their coupling dependence. A primary
advantage of this 'classical' formulation is that the weak-strong duality and
its relations with the perturbative sector are possibly made more manifest.
","[{""version"":""v1"",""created"":""Sat, 23 Jul 2005 19:01:27 GMT""}]","2007-05-23"
"physics/0507173","Anthonie Muller","Anthonie W. J. Muller and Dirk Schulze-Makuch","Sorption heat engines: simple inanimate negative entropy generators","17 pages, 8 figures, 105 references; Accepted by Physica A",,"10.1016/j.physa.2005.12.003",,"physics.gen-ph physics.chem-ph",,"  The name 'sorption heat engines' is proposed for simple negative entropy
generators that are driven by thermal cycling and work on alternating
adsorption and desorption. These generators are in general not explicitly
recognized as heat engines. Their mechanism is applicable to the fields of
engineering, physics, chemistry, geology, and biology, in particular the origin
of life. Four kinds of sorption heat engines are distinguished depending on the
occurrence of changes in the adsorbent or adsorbate during the thermal cycle.
","[{""version"":""v1"",""created"":""Sat, 23 Jul 2005 17:53:59 GMT""},{""version"":""v2"",""created"":""Wed, 27 Jul 2005 02:59:58 GMT""},{""version"":""v3"",""created"":""Sat, 20 Aug 2005 04:37:38 GMT""},{""version"":""v4"",""created"":""Sun, 18 Dec 2005 03:27:16 GMT""}]","2009-11-11"
"quant-ph/0507229","Angelo Carollo","Angelo Carollo, Marcelo Franca Santos and Vlatko Vedral","Coherent evolution via reservoir driven holonomy","4 pages","Phys. Rev. Lett. 96, 020403 (2006)","10.1103/PhysRevLett.96.020403",,"quant-ph",,"  We show that in the limit of strongly interacting environment a system
initially prepared in a Decoherence Free Subspace (DFS) coherently evolves in
time, adiabatically following the changes of the DFS. If the reservoir cyclicly
evolves in time, the DFS states acquire an holonomy.
","[{""version"":""v1"",""created"":""Sat, 23 Jul 2005 20:49:14 GMT""},{""version"":""v2"",""created"":""Thu, 19 Jan 2006 07:50:16 GMT""}]","2009-11-11"
"quant-ph/0507230","Iman Marvian","Iman Marvian","Quantum mechanical description of measurement and the basic properties
  of state transformation","6 pages",,,,"quant-ph",,"  In this paper, without any priori assumption about the post-measurement state
of system, we will examine how this state is restricted by assuming each of
these following assumptions. First, by using this reasonable assumption that
two successive measurements should be describable as one measurement. Second,
by assuming the impossibility of faster than light signaling, ""No-signaling
condition"". However, only by using these assumptions it is not possible to
obtain the usual projection postulate. Instead, by means of a simple lemma, we
will show that the density operator of system after a measurement is a linear
function of the density operator determined by the usual post-measurement
postulate. Furthermore we will show this linear function has a Kraus
representation. Finally, we will discuss about the physical meaning of this
consequence.
","[{""version"":""v1"",""created"":""Sun, 24 Jul 2005 09:09:56 GMT""},{""version"":""v2"",""created"":""Mon, 19 Sep 2005 17:32:47 GMT""}]","2007-05-23"
"quant-ph/0507231","Daniel Lehmann","Daniel Lehmann, Kurt Engesser and Dov M. Gabbay","Algebras of Measurements: the logical structure of Quantum Mechanics","Submitted, 30 pages","International Journal of Theoretical Physics, 45(4) April 2006,
  pages 698-723","10.1007/s10773-006-9062-y","TR 2005-91 Leibniz Center for Research in Computer Science, Hebrew
  Un. Jerusalem","quant-ph cs.AI",,"  In Quantum Physics, a measurement is represented by a projection on some
closed subspace of a Hilbert space. We study algebras of operators that
abstract from the algebra of projections on closed subspaces of a Hilbert
space. The properties of such operators are justified on epistemological
grounds. Commutation of measurements is a central topic of interest. Classical
logical systems may be viewed as measurement algebras in which all measurements
commute. Keywords: Quantum measurements, Measurement algebras, Quantum Logic.
PACS: 02.10.-v.
","[{""version"":""v1"",""created"":""Sun, 24 Jul 2005 12:33:58 GMT""},{""version"":""v2"",""created"":""Thu, 8 Dec 2005 13:50:45 GMT""}]","2007-05-23"
"quant-ph/0507232","William Munro","Kae Nemoto and W. J. Munro","Universal quantum computation on the power of quantum non-demolition
  measurements",,"Phys. Lett A 344, 104 (2005)","10.1016/j.physleta.2005.06.060",,"quant-ph",,"  In this paper we investigate the linear and nonlinear models of optical
quantum computation and discuss their scalability and efficiency. We show how
there are significantly different scaling properties in single photon
computation when weak cross-Kerr nonlinearities are allowed to supplement the
usual linear optical set. In particular we show how quantum non-demolition
measurements are an efficient resource for universal quantum computation.
","[{""version"":""v1"",""created"":""Sun, 24 Jul 2005 13:53:27 GMT""},{""version"":""v2"",""created"":""Mon, 13 Mar 2006 22:24:06 GMT""}]","2009-11-11"
