"math/0507497","Ira M. Gessel","Ira M. Gessel and Seunghyun Seo","A refinement of Cayley's formula for trees","20 pages","Electronic J. Combin. 11, no. 2 (2004-6), R27",,,"math.CO",,"  A proper vertex of a rooted tree with totally ordered vertices is a vertex
that is less than all its proper descendants. We count several kinds of labeled
rooted trees and forests by the number of proper vertices. Our results are all
expressed in terms of the polynomials P_n(a,b,c)=
c(a+(n-1)b+c)(2a+(n-2)b+c)...((n-1)a+b+c) which reduce to (n+1)^{n-1} for
a=b=c=1.
  Our study of proper vertices was motivated by A. Postnikov's hook length
formula for binary trees (arXiv:math.CO/0507163), which was also proved by W.
Y. C. Chen and L. L. M. Yang (arXiv:math.CO/0507163) and generalized by R. R.
X. Du and F. Liu (arXiv:math.CO/0501147). Our approach gives a new proof of Du
and Liu's results and gives new hook length formulas.
  We also find an interpretation of the polynomials P_n(a,b,c) in terms of
parking functions: we count parking functions according to the number of cars
that park in their preferred parking spaces.
","[{""version"":""v1"",""created"":""Sun, 24 Jul 2005 19:20:52 GMT""}]","2013-04-02"
"math/0507499","Rutwig C. Stursberg","R. Campoamor-Stursberg","Symplectic forms on six dimensional real solvable Lie algebras I","16 pages, 8 tables. Various misprints corrected, references updated",,,,"math.DG math-ph math.MP",,"  We analyze symplectic forms on six dimensional real solvable and
non-nilpotent Lie algebras. More precisely, we obtain all those algebras
endowed with a symplectic form that decompose as the direct sum of two ideals
or are indecomposable solvable algebras with a four dimensional nilradical.
","[{""version"":""v1"",""created"":""Sun, 24 Jul 2005 19:46:25 GMT""},{""version"":""v2"",""created"":""Thu, 3 Aug 2006 10:47:28 GMT""}]","2007-05-23"
"math/0507500","Christian `lapinou' Haase","Christian Haase and Benjamin Nill","Lattices generated by skeletons of reflexive polytopes","6 pages, 5 figures",,,,"math.CO math.AG",,"  Lattices generated by lattice points in skeletons of reflexive polytopes are
essential in determining the fundamental group and integral cohomology of
Calabi-Yau hypersurfaces. Here we prove that the lattice generated by all
lattice points in a reflexive polytope is already generated by lattice points
in codimension two faces. This answers a question of J. Morgan.
","[{""version"":""v1"",""created"":""Sun, 24 Jul 2005 20:55:42 GMT""}]","2007-05-23"
"math/0507501","Alexandru Dimca","Alexandru Dimca","On the connectivity of some complete intersections",,"in: The second Japanese-Australian Workshop on Real and Complex
  Singularities, RIMS K\^oky\^uroku 1610, pp.11-17(2008).",,,"math.AG math.AT",,"  We show that the complement of a degree $d$ hypersurface in a projective
complete intersection, whose defining equations have degrees strictly larger
than $d$, has a rational connectivity higher than expected. The key new feature
is that a positivity result replaces the usual transversality conditions needed
to get such connectivity results.
","[{""version"":""v1"",""created"":""Mon, 25 Jul 2005 06:42:33 GMT""}]","2010-02-05"
"math/0507502","Andrew Booker","Andrew R. Booker","Artin's conjecture, Turing's method and the Riemann hypothesis","37 pages, 5 figures","Experimental Mathematics 15 (2006), no. 4, 385-407",,,"math.NT math.GR",,"  We present a group-theoretic criterion under which one may verify the Artin
conjecture for some (non-monomial) Galois representations, up to finite height
in the complex plane. In particular, the criterion applies to S5 and A5
representations. Under more general conditions, the technique allows for the
possibility of verifying the Riemann hypothesis for Dedekind zeta functions of
non-abelian extensions of Q. In addition, we discuss two methods for locating
zeros of arbitrary L-functions. The first uses the explicit formula and
techniques (developed jointly with Andreas Strombergsson) for computing with
trace formulae. The second method generalizes that of Turing for verifying the
Riemann hypothesis. In order to apply it we develop a rigorous algorithm for
computing general L-functions on the critical line via the Fast Fourier
Transform. Finally, we present some numerical results testing Artin's
conjecture for S5 representations, and the Riemann hypothesis for Dedekind zeta
functions of S5 and A5 fields.
","[{""version"":""v1"",""created"":""Mon, 25 Jul 2005 07:01:18 GMT""}]","2013-08-15"
"math/0507503","Lieven Le Bruyn","Jan Adriaenssens and Lieven Le Bruyn","Trees of semi-simple algebras",,,,,"math.RA",,"  To a tree of semi-simple algebras we associate a qurve (or formally smooth
algebra) S. We introduce a Zariski- and etale quiver describing the finite
dimensional representations of S. In particular, we show that all quotient
varieties of the etale quiver have a natural Poisson structure induced by a
double Poisson algebra structure on a certain universal localization of its
path algebra. Explicit calculations are included for the group algebras of the
arithmetic groups (P)SL2(Z) and GL2(Z) but the methods apply as well to
congruence subgroups.
","[{""version"":""v1"",""created"":""Mon, 25 Jul 2005 07:03:16 GMT""}]","2007-05-23"
"math/0507504","Anna Melnikov","Anna Melnikov","On Orbital variety closures in sl_n. III Geometric properties","34 pages","Journal of Algebra, 305, 2006, pp. 68-97",,,"math.RT math.CO",,"  This is the third paper in the series. Here we define a few combinatorial
orders on Young tableaux. The first order is obtained from induced Duflo order
by the extension with the help of Vogan T_{\alpha, \beta} procedure. We call it
Duflo-Vogan order. The second order is obtained from the generalization of
Spaltenstein's construction by consideration of an orbital variety as a double
chain of nilpotent orbits. We call it the chain order. Again, we use Vogan's
T_{\alpha, \beta} procedure, however, this time to restrict the chain order. We
call it Vogan-chain order. The order on Young tableaux defined by the inclusion
of orbital variety closures is called a geometric order and the order on Young
tableaux defined by inverse inclusion of primitive ideals is called an
algebraic order.
  We get the following relations between the orders: Duflo-Vogan order is an
extension of the induced Duflo order; the algebraic order is an extension of
Duflo-Vogan order; the geometric order is an extension of the algebraic order;
Vogan-chain order is an extension of the geometric order; and, finally, the
chain order is an extension of Vogan-chain order. The computationsshow that
Duflo-Vogan and Vogan-chain orders coincide on sl_n for n<10 and in n=10 there
is one case (up to T_{\alpha,\beta} procedure and transposition) where
Vogan-chain order is a proper extension of Duflo-Vogan order. In this only case
the algebraic order coincides with Vogan-chain order. These computations permit
us to conjecture that in sl_n the algebraic order coincides with the geometric
order. As well we conjecture that the combinatorics of both the inclusions on
primitive ideals and on orbital variety closures is defined by Vogan-chain
order on Young tableaux.
","[{""version"":""v1"",""created"":""Mon, 25 Jul 2005 07:12:48 GMT""}]","2007-05-23"
"math/0507505","Adrien Dubouloz","Adrien Dubouloz (IF)","Additive group actions on Danielewski varieties and the Cancellation
  Problem","12p",,,,"math.AG",,"  The cancellation problem asks if two complex algebraic varieties X and Y of
the same dimension such that X\times\mathbb{C} and Y\times\mathbb{C} are
isomorphic are isomorphic. Iitaka and Fujita established that the answer is
positive for a large class of varieties of any dimension. In 1989, Danielewski
constructed a famous counter-example using smooth affine surfaces with additive
group actions. His construction was further generalized by Fieseler and Wilkens
to describe a larger class of affine surfaces. Here we construct higher
dimensional analogues of these surfaces. We study algebraic actions of the
additive group \mathbb{C}\_{+} on certain of these varieties, and we obtain
counter-examples to the cancellation problem in any dimension n\geq2 .
","[{""version"":""v1"",""created"":""Mon, 25 Jul 2005 08:12:12 GMT""}]","2007-05-23"
"math/0507506","Ahmed Hegazi Prof","A. S. Hegazi, W.Morsi and M.Mansour","Differential calculus on Hopf Group Coalgebra",,,,,"math.QA math.DG",,"  In this paper we construct the Differential calculus on the Hopf Group
Coalgebra introduced by Turaev [10]. We proved that the concepts introduced by
S.L.Woronowicz in constructing Differential calculus on Hopf Compact Matrix
Pseudogroups (Quantum Groups)[7] can be adapted to serve again in our
construction.
","[{""version"":""v1"",""created"":""Mon, 25 Jul 2005 09:48:30 GMT""}]","2007-05-23"
"math/0507507","Toby Gee","Toby Gee","Companion Forms Over Totally Real Fields, II","8 pages. Essentially final version, appeared in Duke Math. Journal
  136 (2007), no. 2. This version does not incorporate any minor changes (e.g.
  typographical changes) made in proof",,,,"math.NT","http://arxiv.org/licenses/nonexclusive-distrib/1.0/","  We prove a companion forms theorem for mod l Hilbert modular forms. This work
generalises results of Gross and Coleman--Voloch for modular forms over Q, and
gives a new proof of their results in many cases. The methods used are
completely different to previous work in this area, and rely on modularity
lifting theorems and the general theory of deformations of Galois
representations.
","[{""version"":""v1"",""created"":""Mon, 25 Jul 2005 10:08:53 GMT""},{""version"":""v2"",""created"":""Fri, 3 Sep 2010 23:01:31 GMT""}]","2010-09-07"
"math/0507508","Fabrizio M. E. Catanese","Fabrizio Catanese (Bayreuth University), Paola Frediani (Pavia
  University)","Deformation in the large of some complex manifolds, II","23 pages, to appear in the AMS Series 'Contemporary Mathematics',in
  the Proceedings of the 10th anniversary (2004) Conference for the Mathematics
  Institute at East China Normal University",,,,"math.CV math.AG",,"  The compact complex manifolds considered in this article are principal torus
bundles over a torus. We consider the Kodaira Spencer map of the complete
Appell Humbert family (introduced by the first author in Part I) and are able
to show that we obtain in this way a connected component of the space of
complex structures each time that the base dimension is two, the fibre
dimension is one, and a suitable topological condition is verified.
","[{""version"":""v1"",""created"":""Mon, 25 Jul 2005 12:55:10 GMT""}]","2007-05-23"
"math/0507509","Margaret Combs","E. Odell and Th. Schlumprecht","A universal reflexive space for the class of uniformly convex Banach
  spaces","v.2 (3 January 2007) 13 pages, amslatex","Math. Ann. 335 (2006), no. 4, 901--916",,,"math.FA",,"  We show that there exists a separable reflexive Banach space into which every
separable uniformly convex Banach space isomorphically embeds. This solves a
problem of J. Bourgain. We also give intrinsic characterizations of separable
reflexive Banach spaces which embed into a reflexive space with a block
$q$-Hilbertian and/or a block $p$-Besselian finite dimensional decomposition.
","[{""version"":""v1"",""created"":""Mon, 25 Jul 2005 13:17:27 GMT""},{""version"":""v2"",""created"":""Wed, 3 Jan 2007 16:35:39 GMT""}]","2007-06-13"
"math/0507510","Giuseppe Melfi","Giuseppe Melfi and Susana Faria","LAD Regression and Nonparametric Methods for Detecting Outliers and
  Leverage Points",,"Student, 5 (2006), 265-272",,,"math.ST stat.TH",,"  The detection of influential observations for the standard least squares
regression model is a question that has been extensively studied. LAD
regression diagnostics offers alternative approaches whose main feature is the
robustness. In this paper a new approach for nonparametric detection of
influencial observations in LAD regression models is presented and compared
with other classical methods of diagnostics.
","[{""version"":""v1"",""created"":""Mon, 25 Jul 2005 13:25:35 GMT""}]","2014-10-03"
"math/0507511","Hao Pan","Hao Pan","A q-analogue of Lehmer's congruence","16 pages",,,,"math.NT math.CO",,"  We establish the q-analogue of a classical congruence of Lehmer. Also, the
q-analogues of two congruences of Morley and Granville are given.
","[{""version"":""v1"",""created"":""Mon, 25 Jul 2005 13:39:18 GMT""},{""version"":""v2"",""created"":""Tue, 9 Aug 2005 06:20:13 GMT""},{""version"":""v3"",""created"":""Wed, 17 Aug 2005 06:36:42 GMT""}]","2007-05-23"
"math/0507512","Wende Liu Professor","Wende Liu and Yongzheng Zhang","Derivations for the even parts of modular Lie superalgebras $W$ and $S$
  of Cartan type","52 pages","Int. J. Algebra Comput. 17(4) (2007) 661-714",,,"math.RA",,"  Let $\mathbb{F}$ be the underlying base field of characteristic $p>3 $ and
denote by $\mathcal{W}$ and $\mathcal{S}$ the even parts of the
finite-dimensional generalized Witt Lie superalgebra $W$ and the special Lie
superalgebra $S,$ respectively. We first give the generator sets of the Lie
algebras $\mathcal{W}$ and $\mathcal{S}.$ Using certain properties of the
canonical tori of $\mathcal{W}$ and $\mathcal{S},$ we then determine the
derivation algebra of $\mathcal{W}$ and the derivation space of $\mathcal{S} $
to $\mathcal{W},$ where $\mathcal{W}$ is viewed as $\mathcal{S} $-module by
means of the adjoint representation. As a result, we describe explicitly the
derivation algebra of $\mathcal{S}.$ Furthermore, we prove that the outer
derivation algebras of $\mathcal{W}$ and $\mathcal{S} $ are abelian Lie
algebras or metabelian Lie algebras with explicit structure. In particular, we
give the dimension formulae of the derivation algebras and outer derivation
algebras of $\mathcal{W}$ and $\mathcal{S}.$ Thus we may make a comparison
between the even parts of the (outer) superderivation algebras of $W$ and $S$
and the (outer) derivation algebras of the even parts of $W$ and $S,$
respectively.
","[{""version"":""v1"",""created"":""Mon, 25 Jul 2005 14:20:51 GMT""}]","2018-07-27"
"math/0507513","Patrick Le Meur","Patrick Le Meur (I3M)","The universal cover of an algebra without double bypass","This text (21 pages) gives detailed proofs of the results announced
  in a previous note of the author (The fundamental group of a triangular
  algebra without double bypasses) and extends the study of this previous note
  to the Galois coverings of an algebra","Journal of Algebra 312, 1 (2007) 330--353","10.1016/j.jalgebra.2006.10.035",,"math.RT",,"  Let A be a basic finite dimensional and connected algebra over an
algebraically closed field k with zero characteristic. If the ordinary quiver
of A has no double bypasses, we show that A admits a Galois covering which
satisfies a universal property with respect to the Galois coverings of A. This
universal property is similar to the one of the universal cover of a connected
topological space.
","[{""version"":""v1"",""created"":""Mon, 25 Jul 2005 14:48:29 GMT""},{""version"":""v2"",""created"":""Sat, 26 Nov 2005 19:57:57 GMT""},{""version"":""v3"",""created"":""Fri, 22 Sep 2006 14:47:01 GMT""},{""version"":""v4"",""created"":""Fri, 17 Nov 2006 15:05:29 GMT""}]","2008-09-29"
"math/0507514","Pavel Etingof","Pavel Etingof, Andre Henriques, Joel Kamnitzer, Eric Rains","The cohomology ring of the real locus of the moduli space of stable
  curves of genus 0 with marked points","43 pages, 4 figures; This is a revised version, containing more
  detailed explanations",,,,"math.AT math.QA",,"  We compute the Poincare polynomial and the cohomology algebra with rational
coefficeints of the manifold M_n of real points of the moduli space of
algebraic curves of genus 0 with n labeled points. This cohomology is a
quadratic algebra, and we conjecture that it is Koszul. We also compute the
2-local torsion in the cohomology of M_n. As was shown by E. Rains in
arXiv:math/0610743 the cohomology of M_n does not have odd torsion, so that the
above determines the additive structure of the integral homology and
cohomology. Further, we prove that the rational homology operad of M_n is the
operad of 2-Gerstenhaber algebras, which is closely related to the Hanlon-Wachs
operad of 2-Lie algebras (generated by a ternary bracket). Finally, using
Drinfeld's theory of quantization of coboundary Lie quasibialgebras, we show
that a large series of representations of the quadratic dual Lie algebra L_n of
H^*(M_n,Q) (associated to such quasibialgebras) factors through the the natural
projection of L_n to the associated graded Lie algebra of the prounipotent
completion of the fundamental group of M_n. This leads us to conjecture that
the said projection is an isomorphism, which would imply a formula for lower
central series ranks of the fundamental group. On the other hand, we show that
the spaces M_n are not formal starting from n=6.
","[{""version"":""v1"",""created"":""Mon, 25 Jul 2005 14:55:29 GMT""},{""version"":""v2"",""created"":""Wed, 16 May 2007 15:28:28 GMT""}]","2007-05-23"
"nlin/0507051","Miguel Onorato","Sergey Nazarenko and Miguel Onorato","Wave turbulence and vortices in Bose-Einstein condensation",,,"10.1016/j.physd.2006.05.007",,"nlin.CD",,"  We report a numerical study of turbulence and Bose-Einstein condensation
within the two-dimmensional Gross-Pitaevski model with repulsive interaction.
In presence of weak forcing localized around some wave number in the Fourier
space, we observe three qualitatively different evolution stages. At the
initial stage a thermodynamic energy equipartition spectrum forms at both
smaller and larger scales with respect to the forcing scale. This agrees with
predictions of the the four-wave kinetic equation of the Wave Turbulence (WT)
theory. At the second stage, WT breaks down at large scales and the
interactions become strongly nonlinear. Here, we observe formation of a gas of
quantum vortices whose number decreases due to an annihilation process helped
by the acoustic component. This process leads to formation of a coherent-phase
Bose-Einstein condensate. After such a coherent-phase condensate forms,
evolution enters a third stage characterised by three-wave interactions of
acoustic waves that can be described again using the WT theory.
","[{""version"":""v1"",""created"":""Mon, 25 Jul 2005 07:03:59 GMT""}]","2015-06-26"
"nlin/0507052","Cencini Massimo","M. Chinappi, M. Cencini and A. Vulpiani","Thin front propagation in random shear flows","5 Revtex4 pages, 4 figures included","Phys. Rev. E 73, 016308 (2006)","10.1103/PhysRevE.73.016308",,"nlin.CD physics.chem-ph physics.flu-dyn",,"  Front propagation in time dependent laminar flows is investigated in the
limit of very fast reaction and very thin fronts, i.e. the so-called
geometrical optics limit. In particular, we consider fronts evolving in time
correlated random shear flows, modeled in terms of Ornstein-Uhlembeck
processes. We show that the ratio between the time correlation of the flow and
an intrinsic time scale of the reaction dynamics (the wrinkling time $t_w$) is
crucial in determining both the front propagation speed and the front spatial
patterns. The relevance of time correlation in realistic flows is briefly
discussed in the light of the bending phenomenon, i.e. the decrease of
propagation speed observed at high flow intensities.
","[{""version"":""v1"",""created"":""Mon, 25 Jul 2005 09:43:03 GMT""}]","2009-11-11"
"nlin/0507053","Stefano Musacchio","M. Cencini, A. Mazzino, S. Musacchio and A. Vulpiani","Large-scale effects on meso-scale modeling for scalar transport","19 pages, 8 figures",,"10.1016/j.physd.2006.07.007",,"nlin.CD",,"  The transport of scalar quantities passively advected by velocity fields with
a small-scale component can be modeled at meso-scale level by means of an
effective drift and an effective diffusivity, which can be determined by means
of multiple-scale techniques. We show that the presence of a weak large-scale
flow induces interesting effects on the meso-scale scalar transport. In
particular, it gives rise to non-isotropic and non-homogeneous corrections to
the meso-scale drift and diffusivity. We discuss an approximation that allows
us to retain the second-order effects caused by the large-scale flow. This
provides a rather accurate meso-scale modeling for both asymptotic and
pre-asymptotic scalar transport properties. Numerical simulations in model
flows are used to illustrate the importance of such large-scale effects.
","[{""version"":""v1"",""created"":""Mon, 25 Jul 2005 14:34:59 GMT""}]","2009-11-11"
"nucl-th/0507053","Jerome Margueron","J. Margueron (IPNO), Nguyen Van Giai (IPNO), J. Navarro (IFIC)","Nuclear response functions in homogeneous matter with finite range
  effective interactions","9 pages, 9 figures","Phys.Rev. C72 (2005) 034311","10.1103/PhysRevC.72.034311",,"nucl-th",,"  The question of nuclear response functions in a homogeneous medium is
examined. A general method for calculating response functions in the random
phase approximation (RPA) with exchange is presented. The method is applicable
for finite-range nuclear interactions. Examples are shown in the case of
symmetric nuclear matter described by a Gogny interaction. It is found that the
convergence of the results with respect to the multipole truncation is quite
fast. Various approximation schemes such as the Landau approximation, or the
Landau approximation for the exchange terms only, are discussed in comparison
with the exact results.
","[{""version"":""v1"",""created"":""Mon, 25 Jul 2005 08:23:57 GMT""}]","2007-05-23"
"nucl-th/0507054","D. N. Basu","P. Roy Chowdhury, C. Samanta, D.N. Basu","Alpha decay half-lives of new superheavy elements","7 pages","Phys.Rev. C73 (2006) 014612","10.1103/PhysRevC.73.014612",,"nucl-th",,"  The lifetimes of $\alpha$ decays of the recently produced isotopes of the
elements 112, 114, 116 and the element $^{294}118$ and of some decay products
have been calculated theoretically within the WKB approximation using
microscopic $\alpha$-nucleus interaction potentials. These nuclear potentials
have been obtained by folding the densities of the $\alpha$ and the daughter
nuclei with the M3Y effective interaction, supplemented by a zero-range
pseudo-potential for exchange along with the density dependence. Spherical
charge distributions have been used for calculating the Coulomb interaction
potentials. These calculations provide reasonable estimates for the observed
$\alpha$ decay lifetimes and thus provide reliable predictions for other
superheavies.
","[{""version"":""v1"",""created"":""Mon, 25 Jul 2005 12:30:21 GMT""},{""version"":""v2"",""created"":""Thu, 22 Dec 2005 13:22:13 GMT""}]","2007-05-23"
"nucl-th/0507056","Arnau Rios","Arnau Rios (1), Artur Polls (1), Herbert M\""uther (2) ((1) Dept. d'ECM
  - Universitat de Barcelona, (2) Institut f\""ur Theoretische Physik,
  Universit\""at T\""ubingen)","Sum rules of single-particle spectral functions in hot asymmetric
  nuclear matter","REVTEX4 - 17 pages, 3 tables, 4 figures",,,,"nucl-th",,"  The neutron and proton single-particle spectral functions in asymmetric
nuclear matter fulfill energy weighted sum rules. The validity of these sum
rules within the self-consistent Green's function approach is investigated. The
various contributions to these sum rules and their convergence as a function of
energy provide information about correlations induced by the realistic
interaction between the nucleons. These features are studied as a function of
the asymmetry of nuclear matter.
","[{""version"":""v1"",""created"":""Mon, 25 Jul 2005 15:36:35 GMT""}]","2007-05-23"
"physics/0507174","Paolo Maestro","P.S. Marrocchesi, H.S. Ahn, M.G. Bagliesi, A. Basti, G. Bigongiari, A.
  Castellina, M.A. Ciocci, A. Di Virgilio, T. Lomtatze, O. Ganel, K. C. Kim,
  M.H. Lee, F. Ligabue, L. Lutz, P. Maestro, A. Malinine, M. Meucci, V.
  Millucci, F. Morsani, E.S. Seo, R. Sina, J. Wu, Y.S. Yoon, R. Zei, S.-Y. Zinn","Beam test calibration of the balloon-borne imaging calorimeter for the
  CREAM experiment","4 pages, 4 figures. To be published in the Proceedings of 29th
  International Cosmic Ray Conference (ICRC 2005), Pune, India, August 3-10,
  2005",,,,"physics.ins-det",,"  CREAM (Cosmic Ray Energetics And Mass) is a multi-flight balloon mission
designed to collect direct data on the elemental composition and individual
energy spectra of cosmic rays. Two instrument suites have been built to be
flown alternately on a yearly base. The tungsten/Sci-Fi imaging calorimeter for
the second flight, scheduled for December 2005, was calibrated with electron
and proton beams at CERN. A calibration procedure based on the study of the
longitudinal shower profile is described and preliminary results of the beam
test are presented.
","[{""version"":""v1"",""created"":""Sun, 24 Jul 2005 21:15:05 GMT""}]","2007-05-23"
"physics/0507175","Phay Ho","Phay J. Ho and J. H. Eberly","Classical Effects of Laser Pulse Duration on Strong-field Double
  Ionization",,,"10.1103/PhysRevLett.95.193002",,"physics.atom-ph physics.optics",,"  We use classical electron ensembles and the aligned-electron approximation to
examine the effect of laser pulse duration on the dynamics of strong-field
double ionization. We cover the range of intensities $10^{14}-10^{16} W/cm^2$
for the laser wavelength 780 nm. The classical scenario suggests that the
highest rate of recollision occurs early in the pulse and promotes double
ionization production in few-cycle pulses. In addition, the purely classical
ensemble calculation predicts an exponentially decreasing recollision rate with
each subsequent half cycle. We confirm the exponential behavior by trajectory
back-analysis.
","[{""version"":""v1"",""created"":""Mon, 25 Jul 2005 04:16:24 GMT""}]","2007-05-23"
