"gr-qc/0507105","Rajesh Nayak K","K. Rajesh Nayak, S. Koshti, S. V. Dhurandhar and J-Y. Vinet","Reducing the flexing of the arms of LISA",,,,,"gr-qc astro-ph",,"  The joint NASA-ESA mission LISA relies crucially on the stability of the
three spacecraft constellation. All three spacecraft are on heliocentric and
weakly eccentric orbits forming a stable triangle. It has been shown that for
certain spacecraft orbits, the arms keep constant distances to the first order
in the eccentricities. However, exact orbitography shows the so-called
`breathing modes' of the arms where the arms slowly change their lengths over
the time-scale of a year. In this paper we analyse the breathing modes (the
flexing of the arms) with the help of the geodesic deviation equations to
octupole order which are shown to be equivalent to higher order
Clohessy-Wiltshire equations. We show that the flexing of the arms of LISA as
given by the `exact' solution of Keplerian orbits, which gives constant
armlengths to the first order in eccentricity and whose maximum flexing
amplitude is $\sim 115,000$ km, can be improved, by tilting the plane of the
LISA triangle slightly from the proposed orientation of $60^\circ$ with the
ecliptic to obtain a maximum flexing amplitude of $\sim 48,000$ km, reducing it
by a factor of $\sim 2.4$. The reduction factor is even larger if we consider
the corresponding Doppler shifts, for which the reduction factor reaches almost
a factor of 6. We solve the second order equations and obtain the general
solution. We then use the general solution to establish the optimality of the
solutions that we have found.
","[{""version"":""v1"",""created"":""Mon, 25 Jul 2005 15:29:25 GMT""}]","2007-05-23"
"hep-lat/0507036","Antonio Gonz\'alez-Arroyo","Antonio Gonzalez-Arroyo and Robert Kirchner","Adjoint modes as probes of gauge field structure","Latex file. 29 pages and 12 figures","JHEP 0601 (2006) 029","10.1088/1126-6708/2006/01/029","FTUAM-05-7; IFT-UAM/CSIC-05-22","hep-lat",,"  We show how zero-modes and quasi-zero-modes of the Dirac operator in the
adjoint representation can be used to construct an estimate of the action
density distribution of a pure gauge field theory, which is less sensitive to
the ultraviolet fluctuations of the field. This can be used to trace the
topological structures present in the vacuum. The construction relies on the
special properties satisfied by the supersymmetric zero-modes.
","[{""version"":""v1"",""created"":""Mon, 25 Jul 2005 01:17:38 GMT""}]","2009-11-11"
"hep-ph/0507274","Maria Argyrou","M. Argyrou, A. Katsikatsou and I. Malamos","Refinements in Effective Potential Calculations in the MSSM","13 pages LateX, 3 eps figures. Revisions to text, comments and
  relevant references added","Mod.Phys.Lett.A21:3009-3020,2006","10.1142/S0217732306022353","UA-NPPS/BSM-05/01","hep-ph",,"  The one-loop effective potential is a powerful tool in studying the
electroweak symmetry breaking of supersymmetric theories, whose precise
calculation may have important phenomenological consequences. In this work, we
are correctly treating the contribution of the Higgs sector to the effective
potential and refine the radiative corrections to the Higgs mixing parameter
$\mu$, which is known to affect greatly the supersymmetric spectrum. Working at
the average stop scale to minimize the effect of the stop sector, we find
additional corrections which can play a dominant role in the Focus Point region
of the parameter space of the MSSM. The comparison of our results with those of
the literature is discussed. We also discuss the gauge dependence of the
effective potential and its effect on the $\mu$ parameter in analyses where
this is determined from the 1-loop minimization conditions of the effective
potential.
","[{""version"":""v1"",""created"":""Sun, 24 Jul 2005 21:34:58 GMT""},{""version"":""v2"",""created"":""Fri, 9 Sep 2005 11:05:48 GMT""},{""version"":""v3"",""created"":""Fri, 17 Feb 2006 13:26:55 GMT""}]","2008-11-26"
"hep-ph/0507275","A. V. Luchinsky","V. V. Braguta, A. K. Likhoded, A. V. Luchinsky","Excited charmonium mesons production in e^+e^- annihilation at
  \sqrt{s}=10.6 GeV","7 pages; 2 figures, some refrences added","Phys.Rev. D72 (2005) 074019","10.1103/PhysRevD.72.074019",,"hep-ph",,"  In this paper the production of excited vector and pseudoscalar charmonium
mesons in $\epem$ annihilation is analyzed in the framework of light cone. In
particular the cross sections $\epem \to \psi(2S)\eta_c(1S),
\psi(1S)\eta_c(2S),\psi(2S)\eta_c(2S)$ have been calculated. It is shown, that
contrary to NRQCD the cross sections calculated in the framework of light cone
agree with experimental data.
","[{""version"":""v1"",""created"":""Mon, 25 Jul 2005 08:28:50 GMT""},{""version"":""v2"",""created"":""Wed, 27 Jul 2005 05:21:14 GMT""}]","2009-11-11"
"hep-ph/0507276","Claudia Hoehne","C. Hoehne, F. Puehlhofer, R. Stock","System-size dependence of strangeness production in high-energy A+A
  collisions and percolation of strings",,"Phys.Lett.B640:96-100,2006","10.1016/j.physletb.2006.07.042",,"hep-ph",,"  We argue that the shape of the system-size dependence of strangeness
production in nucleus-nucleus collisions can be understood in a picture that is
based on the formation of clusters of overlapping strings. A string percolation
model combined with a statistical description of the hadronization yields a
quantitative agreement with the data at $\sqrt{s_{NN}}=17.3$ GeV. The model is
also applied to RHIC energies.
","[{""version"":""v1"",""created"":""Mon, 25 Jul 2005 13:11:04 GMT""}]","2008-11-26"
"hep-ph/0507277","Valery Lyubovitskij","Y. Dong, Amand Faessler, Th. Gutsche, J. Kuckei, V.E. Lyubovitskij, K.
  Pumsa-ard, P. Shen","Nucleon polarizabilities in the perturbative chiral quark model","25 pages, 18 figures, 2 tables","J.Phys.G32:203-220,2006","10.1088/0954-3899/32/2/011",,"hep-ph",,"  The nucleon polarizabilities alpha(E) and beta(M) are studied in the context
of the perturbative chiral quark model. We demonstrate that meson cloud effects
are sufficient to explain the electric polarizability of nucleon. Contributions
of excite quark states to the paramagnetic polarizability are dominant and
cancel the diamagnetic polarizability arising from the chiral field. The
obtained results are compared to data and other theoretical predictions.
","[{""version"":""v1"",""created"":""Mon, 25 Jul 2005 11:34:32 GMT""}]","2009-07-09"
"hep-ph/0507278","Steven D. Bass","Steven D. Bass, R.J. Crewther, F.M. Steffens and A.W. Thomas","Running couplings for the simultaneous decoupling of heavy quarks","12 pages, 1 figure, version to appear in PLB. Pages 8-11 and Fig. 1
  are new, with consequent changes to the abstract, page 2, and the references.
  We show that our multi-scale renormalization group is needed to achieve
  anomaly cancellation in t,b decoupling from the weak neutral current, and
  extend it to include large momenta","Phys.Lett.B634:249-254,2006","10.1016/j.physletb.2006.01.064","ADP-05-21/T631","hep-ph",,"  Scale-invariant running couplings are constructed for several quarks being
decoupled together, without reference to intermediate thresholds.
Large-momentum scales can also be included. The result is a multi-scale
generalization of the renormalization group applicable to any order.
Inconsistencies in the usual decoupling procedure with a single running
coupling can then be avoided, e.g. when cancelling anomalous corrections from
t,b quarks to the axial charge of the proton.
","[{""version"":""v1"",""created"":""Mon, 25 Jul 2005 13:00:35 GMT""},{""version"":""v2"",""created"":""Tue, 24 Jan 2006 12:18:37 GMT""}]","2010-03-26"
"hep-ph/0507279","Osamu Seto","Nobuchika Okada and Osamu Seto","Thermal leptogenesis in brane world cosmology","9 pages, final version","Phys.Rev. D73 (2006) 063505","10.1103/PhysRevD.73.063505","KEK-TH-1019","hep-ph astro-ph",,"  The thermal leptogenesis in brane world cosmology is studied. In brane world
cosmology, the expansion law is modified from the four-dimensional standard
cosmological one at high temperature regime in the early universe. As a result,
the well-known upper bound on the lightest light neutrino mass induced by the
condition for the out-of-equilibrium decay of the lightest heavy neutrino,
$\tilde{m}_1 \lesssim 10^{-3}$ eV, can be moderated to be $\tilde{m}_1 \lesssim
10^{-3} {eV} \times (M_1/T_t)^2 $ in the case of $T_t \leq M_1$ with the
lightest heavy neutrino mass ($M_1$) and the ``transition temperature''
($T_t$), at which the modified expansion law in brane world cosmology is
smoothly connecting with the standard one. This implies that the degenerate
mass spectrum of the light neutrinos can be consistent with the thermal
leptogenesis scenario. Furthermore, as recently pointed out, the gravitino
problem in supersymmetric case can be solved if the transition temperature is
low enough $T_t \lesssim 10^{6-7}$ GeV. Therefore, even in the supersymmetric
case, thermal leptogenesis scenario can be successfully realized in brane world
cosmology.
","[{""version"":""v1"",""created"":""Mon, 25 Jul 2005 13:35:53 GMT""},{""version"":""v2"",""created"":""Tue, 28 Mar 2006 13:15:34 GMT""}]","2009-11-11"
"hep-ph/0507280","Claudio Gatti","C. Gatti","Monte Carlo simulation for radiative kaon decays","11 pages, 1 figure","Eur.Phys.J.C45:417-420,2006","10.1140/epjc/s2005-02435-2",,"hep-ph",,"  For high precision measurements of K decays, the presence of radiated photons
cannot be neglected. The Monte Carlo simulations must include the radiative
corrections in order to compute the correct event counting and efficiency
calculations. In this paper we briefly describe a method for simulating such
decays.
","[{""version"":""v1"",""created"":""Mon, 25 Jul 2005 14:12:29 GMT""},{""version"":""v2"",""created"":""Tue, 26 Jul 2005 06:52:28 GMT""}]","2009-01-07"
"hep-ph/0507281","Jean-Rene Cudell","J.R. Cudell, F. Bissey, J. Cugnon, M. Jaminon, J.P. Lansberg, and P.
  Stassart","A toy model for generalised parton distributions","11 pages, presented at HADRONIC PHYSICS (HLPR 2004): Joint
  Meeting-Heidelberg-Liege-Paris-Rostock, Spa, Belgium, 16-18 December 2004, 11
  pages, 11 figures, LaTeX","AIP Conf.Proc. 775 (2005) 61","10.1063/1.1961043",,"hep-ph",,"  We give the results of a simple model for the diagonal and off-diagonal
valence quark distributions of a pion. We show that structure can be
implemented in a gauge-invariant manner. This explicit model questions the
validityof the momentum sum rule, and gives an explicit counter-example to the
Wandzura-Wilczek ansatz for twist-3 GPD's.
","[{""version"":""v1"",""created"":""Mon, 25 Jul 2005 14:19:00 GMT""}]","2007-05-23"
"hep-ph/0507283","Ben Allanach","B.C. Allanach and C.G. Lester","Multi-Dimensional mSUGRA Likelihood Maps","19 pages, 9 figures. v3 fixes typo in Eq (3) and explicitly states
  that the proposal function is assumed to be symmetric","Phys.Rev.D73:015013,2006","10.1103/PhysRevD.73.015013","DAMTP-2005-64","hep-ph astro-ph hep-ex",,"  We calculate the likelihood map in the full 7 dimensional parameter space of
the minimal supersymmetric standard model (MSSM) assuming universal boundary
conditions on the supersymmetry breaking terms. Simultaneous variations of m_0,
A_0, M_{1/2}, tan beta, m_t, m_b and alpha_s(M_Z) are applied using a Markov
chain Monte Carlo algorithm. We use measurements of b -> s gamma, (g-2)_mu and
Omega_{DM} h^2 in order to constrain the model. We present likelihood
distributions for some of the sparticle masses, for the branching ratio of
B_s^0 -> mu^+ mu^- and for m_{stau}-m_{chi_1^0}. An upper limit of 2.10^{-8} on
this branching ratio might be achieved at the Tevatron, and would rule out 29%
of the currently allowed likelihood. If one allows for non thermal-neutralino
components of dark matter, this fraction becomes 35%. The mass ordering allows
the important cascade decay squark_L -> chi_2^0 -> slepton_R -> chi_1^0 with a
likelihood of 24+/-4%. The stop coannihilation region is highly disfavoured,
whereas the light Higgs region is marginally disfavoured.
","[{""version"":""v1"",""created"":""Mon, 25 Jul 2005 15:48:35 GMT""},{""version"":""v2"",""created"":""Fri, 29 Jul 2005 17:12:10 GMT""},{""version"":""v3"",""created"":""Fri, 12 Aug 2005 09:54:25 GMT""},{""version"":""v4"",""created"":""Mon, 24 Oct 2005 13:36:47 GMT""},{""version"":""v5"",""created"":""Thu, 12 Jan 2006 05:58:48 GMT""},{""version"":""v6"",""created"":""Thu, 9 Feb 2006 20:11:24 GMT""},{""version"":""v7"",""created"":""Wed, 19 Apr 2006 16:39:39 GMT""},{""version"":""v8"",""created"":""Tue, 29 May 2007 13:56:00 GMT""},{""version"":""v9"",""created"":""Wed, 18 Jul 2007 13:30:44 GMT""}]","2008-11-26"
"hep-th/0507232","Georgios Kraniotis","C.-M. Chen, G. V. Kraniotis, V. E. Mayes, D. V. Nanopoulos, J. W.
  Walker","A K-theory Anomaly Free Supersymmetric Flipped SU(5) Model from
  Intersecting Branes","17 Pages, LaTeX","Phys.Lett. B625 (2005) 96-105","10.1016/j.physletb.2005.08.042","ACT-04-05, MIFP-05-17","hep-th",,"  We construct an N=1 supersymmetric three-family flipped SU(5) model from type
IIA orientifolds on $T^6/(\Z_2\times \Z_2)$ with D6-branes intersecting at
general angles. The model is constrained by the requirement that Ramond-Ramond
tadpoles cancel, the supersymmetry conditions, and that the gauge boson coupled
to the $U(1)_X$ factor does not get a string-scale mass via a generalised
Green-Schwarz mechanism. The model is further constrained by requiring
cancellation of K-theory charges. The spectrum contains a complete grand
unified and electroweak Higgs sector, however the latter in a non-minimal
number of copies. In addition, it contains extra matter both in bi-fundamental
and vector-like representations as well as two copies of matter in the
symmetric representation of SU(5).
","[{""version"":""v1"",""created"":""Mon, 25 Jul 2005 15:40:42 GMT""}]","2009-11-11"
"hep-th/0507235","Lee Smolin","Lee Smolin","The case for background independence","Latex, 46 pages, no figures",,,,"hep-th",,"  The aim of this paper is to explain carefully the arguments behind the
assertion that the correct quantum theory of gravity must be background
independent. We begin by recounting how the debate over whether quantum gravity
must be background independent is a continuation of a long-standing argument in
the history of physics and philosophy over whether space and time are
relational or absolute. This leads to a careful statement of what physicists
mean when we speak of background independence. Given this we can characterize
the precise sense in which general relativity is a background independent
theory. The leading background independent approaches to quantum gravity are
then discussed, including causal set models, loop quantum gravity and dynamical
triangulations and their main achievements are summarized along with the
problems that remain open. Some first attempts to cast string/M theory into a
background independent formulation are also mentioned.
  The relational/absolute debate has implications also for other issues such as
unification and how the parameters of the standard models of physics and
cosmology are to be explained. The recent issues concerning the string theory
landscape are reviewed and it is argued that they can only be resolved within
the context of a background independent formulation. Finally, we review some
recent proposals to make quantum theory more relational.
","[{""version"":""v1"",""created"":""Mon, 25 Jul 2005 15:47:31 GMT""}]","2007-05-23"
"hep-th/0507236","Paolo Amore Dr","Paolo Amore","Non perturbative series for the calculation of one loop integrals at
  finite temperature","8 pages, 2 figures, proceedings of the 8-th International Conference
  ""Path Integrals. From Quantum Information to Cosmology""",,,,"hep-th",,"  The calculation of one loop integrals at finite temperature requires the
evaluation of certain series, which converge very slowly or can even be
divergent. Here we review a new method, recently devised by the author, for
obtaining accelerated analytical expressions for these series. The fundamental
properties of the new series are studied and an application to a physical
example is considered. The relevance of the method to other physical problems
is also discussed.
","[{""version"":""v1"",""created"":""Mon, 25 Jul 2005 15:21:36 GMT""}]","2007-05-23"
"hep-th/0507237","Peter Kazinski","P.O. Kazinski","Effective dynamics of an electrically charged string with a current","14 pages, 3 figures, format changed, minor changes","Zh.Eksp.Teor.Fiz. 128 (2005) 312-321; J.Exp.Theor.Phys. 101 (2005)
  270-279","10.1134/1.2047792",,"hep-th",,"  Equations of motion for an electrically charged string with a current in an
external electromagnetic field with regard to the first correction due to the
self-action are derived. It is shown that the reparametrization invariance of
the free action of the string imposes constraints on the possible form of the
current. The effective equations of motion are obtained for an absolutely
elastic charged string in the form of a ring (circle). Equations for the
external electromagnetic fields that admit stationary states of such a ring are
revealed. Solutions to the effective equations of motion of an absolutely
elastic charged ring in the absence of external fields as well as in an
external uniform magnetic field are obtained. In the latter case, the frequency
at which one can observe radiation emitted by the ring is evaluated. A model of
an absolutely nonstretchable charged string with a current is proposed. The
effective equations of motion are derived within this model, and a class of
solutions to these equations is found.
","[{""version"":""v1"",""created"":""Mon, 25 Jul 2005 05:47:44 GMT""},{""version"":""v2"",""created"":""Tue, 26 Jul 2005 02:23:03 GMT""},{""version"":""v3"",""created"":""Thu, 22 Sep 2005 02:11:43 GMT""}]","2014-11-18"
"hep-th/0507238","Gerardo Cristofano","Gerardo Cristofano, Vincenzo Marotta, Adele Naddeo, Giuliano Niccoli","Topological order and magnetic flux fractionalization in Josephson
  junction ladders with Mobius boundary conditions: a twisted CFT description","19 pages, 3 figures, to appear in Proceedings of PI-2005, 8-th
  International Conference on Path Integrals. From Quantum Information to
  Cosmology",,,"DSF-T-31/2005, INFN-NA-31/2005","hep-th",,"  We propose a CFT description for a closed one-dimensional fully frustrated
ladder of quantum Josephson junctions with Mobius boundary conditions (see
cond-mat/0503555; we show how such a system can develop topological order
thanks to flux fractionalization. Such a property is crucial for its
implementation as a ""protected"" solid state qubit.
","[{""version"":""v1"",""created"":""Mon, 25 Jul 2005 10:14:28 GMT""}]","2007-05-23"
"hep-th/0507239","Oriol Pujolas","Oriol Pujolas and Misao Sasaki","Vacuum destabilization from Kaluza-Klein modes in an inflating brane","15 pages, 2 eps figures. Notation improved, references added","JCAP 0509:002,2005","10.1088/1475-7516/2005/09/002","YITP-05-39","hep-th",,"  We discuss the effects from the Kaluza-Klein modes in the brane world
scenario when an interaction between bulk and brane fields is included. We
focus on the bulk inflaton model, where a bulk field $\Psi$ drives inflation in
an almost $AdS_5$ bulk bounded by an inflating brane. We couple $\Psi$ to a
brane scalar field $\phi$ representing matter on the brane. The bulk field
$\Psi$ is assumed to have a light mode, whose mass depends on the expectation
value of $\phi$. To estimate the effects from the KK modes, we compute the
1-loop effective potential $V_\eff(\phi)$. With no tuning of the parameters of
the model, the vacuum becomes (meta)stable -- $V_\eff(\phi)$ develops a true
vacuum at a nonzero $\phi$. In the true vacuum, the light mode of $\Psi$
becomes heavy, degenerates with the KK modes and decays. We comment on some
implications for the bulk inflaton model. Also, we clarify some aspects of the
renormalization procedure in the thin wall approximation, and show that the
fluctuations in the bulk and on the brane are closely related.
","[{""version"":""v1"",""created"":""Mon, 25 Jul 2005 11:50:09 GMT""},{""version"":""v2"",""created"":""Fri, 5 Aug 2005 08:24:12 GMT""}]","2009-10-09"
"math-ph/0507061","Francis Valiquette","Francis Valiquette and Pavel Winternitz","Discretization of partial differential equations preserving their
  physical symmetries","29 pages, 3 figures",,"10.1088/0305-4470/38/45/004",,"math-ph math.MP nlin.SI",,"  A procedure for obtaining a ""minimal"" discretization of a partial
differential equation, preserving all of its Lie point symmetries is presented.
""Minimal"" in this case means that the differential equation is replaced by a
partial difference scheme involving N difference equations, where N is the
number of independent and dependent variable. We restrict to one scalar
function of two independent variables. As examples, invariant discretizations
of the heat, Burgers and Korteweg-de Vries equations are presented. Some exact
solutions of the discrete schemes are obtained.
","[{""version"":""v1"",""created"":""Mon, 25 Jul 2005 01:49:30 GMT""},{""version"":""v2"",""created"":""Fri, 5 Aug 2005 01:51:52 GMT""}]","2009-11-11"
"math-ph/0507062","Laszlo Feher","L. Feher, B.G. Pusztai","Spin Calogero models obtained from dynamical r-matrices and geodesic
  motion","25 pages, with minor stylistic changes and updated references in v2","Nucl.Phys. B734 (2006) 304-325","10.1016/j.nuclphysb.2005.11.025",,"math-ph hep-th math.MP math.QA nlin.SI",,"  We study classical integrable systems based on the Alekseev-Meinrenken
dynamical r-matrices corresponding to automorphisms of self-dual Lie algebras,
${\cal G}$. We prove that these r-matrices are uniquely characterized by a
non-degeneracy property and apply a construction due to Li and Xu to associate
spin Calogero type models with them. The equation of motion of any model of
this type is found to be a projection of the natural geodesic equation on a Lie
group $G$ with Lie algebra ${\cal G}$, and its phase space is interpreted as a
Hamiltonian reduction of an open submanifold of the cotangent bundle $T^*G$,
using the symmetry arising from the adjoint action of $G$ twisted by the
underlying automorphism. This shows the integrability of the resulting systems
and gives an algorithm to solve them. As illustrative examples we present new
models built on the involutive diagram automorphisms of the real split and
compact simple Lie algebras, and also explain that many further examples fit in
the dynamical r-matrix framework.
","[{""version"":""v1"",""created"":""Mon, 25 Jul 2005 09:15:53 GMT""},{""version"":""v2"",""created"":""Wed, 7 Dec 2005 12:37:19 GMT""}]","2009-11-11"
"math-ph/0507063","Gian Michele Graf","L. Cattaneo, G. M. Graf, W. Hunziker","A general resonance theory based on Mourre's inequality","17 pages",,"10.1007/s00023-005-0261-5",,"math-ph math.MP",,"  We study the perturbation of bound states embedded in the continuous spectrum
which are unstable by the Fermi Golden Rule. The approach to resonance theory
based on spectral deformation is extended to a more general class of quantum
systems characterized by Mourre's inequality and smoothness of the resolvent.
Within the framework of perturbation theory it is still possible to give a
definite meaning to the notion of complex resonance energies and of
corresponding metastable states. The main result is a quasi-exponential decay
estimate up to a controlled error of higher order in perturbation theory.
","[{""version"":""v1"",""created"":""Mon, 25 Jul 2005 12:54:26 GMT""}]","2009-11-11"
"math-ph/0507064","S. Fournais","S. Fournais and B. Helffer","On the third critical field in Ginzburg-Landau theory",,,"10.1007/s00220-006-0006-4",,"math-ph math.MP math.SP",,"  Using recent results by the authors on the spectral asymptotics of the
Neumann Laplacian with magnetic field, we give precise estimates on the
critical field, $H_{C_3}$, describing the appearance of superconductivity in
superconductors of type II. Furthermore, we prove that the local and global
definitions of this field coincide. Near $H_{C_3}$ only a small part, near the
boundary points where the curvature is maximal, of the sample carries
superconductivity. We give precise estimates on the size of this zone and decay
estimates in both the normal (to the boundary) and parallel variables.
","[{""version"":""v1"",""created"":""Mon, 25 Jul 2005 13:05:12 GMT""}]","2009-11-11"
"math/0507495","Hao Pan","Ling-Ling Shi and Hao Pan","A q-analogue of Wolstenholme's harmonic series congruence","4 pages",,,,"math.NT math.CO",,"  We establish a q-analogue of Wolstenholme's harmonic series congruence.
","[{""version"":""v1"",""created"":""Mon, 25 Jul 2005 00:53:23 GMT""}]","2007-05-23"
