"astro-ph/0512288","J.-P. Macquart","Jean-Pierre Macquart, Geoff Bower","Understanding the Radio Variability of Sgr A*","Ap.J. accepted, high-resolution version at
  http://www.aoc.nrao.edu/~jmacquar/SgrA.pdf","Astrophys.J.641:302-318,2006","10.1086/500317",,"astro-ph",,"  We determine the characteristics of the 7mm to 20cm wavelength radio
variability in Sgr A* on time scales from days to three decades. The amplitude
of the intensity modulation is between 30 and 39% at all wavelengths. Analysis
of uniformly sampled data with proper accounting of the sampling errors
associated with the lightcurves shows that Sgr A* exhibits no 57- or 106-day
quasi-periodic oscillations, contrary to previous claims. The cause of the
variability is investigated by examining a number of plausible scintillation
models, enabling those variations which could be attributed to interstellar
scintillation to be isolated from those that must be intrinsic to the source.
Thin-screen scattering models do not account for the variability amplitude on
most time scales. However, models in which the scattering region is extended
out to a radius of 50-500pc from the Galactic Center account well for the broad
characteristics of the variability on >4-day time scales. The ~ 10% variability
on <4-day time scales at 0.7-3cm appears to be intrinsic to the source. The
degree of scintillation variability expected at millimeter wavelengths depends
sensitively on the intrinsic source size; the variations, if due to
scintillation, would require an intrinsic source size smaller than that
expected.
","[{""version"":""v1"",""created"":""Mon, 12 Dec 2005 12:16:34 GMT""}]","2009-11-13"
"astro-ph/0512289","Vincenzo Ripepi","V. Ripepi, S. Bernabei, M. Marconi, F. Palla, A. Arellano Ferro, A.
  Bonanno, P. Ferrara, A. Frasca, X.J. Jiang, S.-L. Kim, S. Marinoni, G.
  Mignemi, M.J.P.F.G. Monteiro, T.D. Oswalt, P. Reegen, R.Janulis, E.
  Rodriguez, A. Rolland, A. Ruoppo, L. Terranegra, K. Zwintz","A multisite photometric campaign on the Pre-Main-Sequence delta Scuti
  pulsator IP Per","10 pages 11 figures, accepted for publication on A&A",,"10.1051/0004-6361:20054164",,"astro-ph",,"  We present the results of a photometric multisite campaign on the $\delta$
Scuti Pre-Main-Sequence star IP Per. Nine telescopes have been involved in the
observations, with a total of about 190 hours of observations over 38 nights.
Present data confirms the multiperiodic nature of this star and leads to the
identification of at least nine pulsational frequencies. Comparison with the
predictions of linear non-adiabatic radial pulsation models allowed us to
identify only five of the nine observed frequencies, and to constrain the
position of IP Per in the HR diagram. The latter is in good agreement with the
empirical determination of the stellar parameters obtained by Miroshnichenko et
al. (2001). An initial interpretation of the observed frequencies using the
Aarhus non-radial pulsation code suggests that three frequencies could be
associated with non-radial ($l$=2) modes. Finally, we present new evolutionary
and pulsation models at lower metallicity (Z=0.008) to take into account the
possibility that IP Per is metal deficient, as indicated by Miroshnichenko et
al. (2001).
","[{""version"":""v1"",""created"":""Mon, 12 Dec 2005 13:06:40 GMT""}]","2009-11-11"
"astro-ph/0512290","Ana Elia Garc\'ia P\'erez","A.E. Garc\'ia P\'erez, M. Asplund, F. Primas, P.E. Nissen and B.
  Gustafsson","Oxygen abundances in metal-poor subgiants as determined from [O I], O I
  and OH lines","Accepted for publication in A&A",,"10.1051/0004-6361:20053181",,"astro-ph",,"  The debate on the oxygen abundances of metal-poor stars has its origin in
contradictory results obtained using different abundance indicators. To achieve
a better understanding of the problem we have acquired high quality spectra
with the Ultraviolet and Visual Echelle Spectrograph at VLT, with a
signal-to-noise of the order of 100 in the near ultraviolet and 500 in the
optical and near infrared wavelength range. Three different oxygen abundance
indicators, OH ultraviolet lines around 310.0 nm, the [OI] line at 630.03 nm
and the OI lines at 777.1-5 nm were observed in the spectra of 13 metal-poor
subgiants with -3.0<=[Fe/H]<=-1.5. Oxygen abundances were obtained from the
analysis of these indicators which was carried out assuming local thermodynamic
equilibrium and plane-parallel model atmospheres. Abundances derived from OI
were corrected for departures from local thermodynamic equilibrium. Stellar
parameters were computed using Teff-vs-color calibrations based on the infrared
flux method and Balmer line profiles, Hipparcos parallaxes and FeII lines.
[O/Fe] values derived from the forbidden line at 630.03 nm are consistent with
an oxygen/iron ratio that varies linearly with [Fe/H] as
[O/Fe]}=-0.09(+/-0.08)[Fe/H]+0.36(+/-0.15). Values based on the OI triplet are
on average 0.19+/-0.22 dex(s.d.) higher than the values based on the forbidden
line while the agreement between OH ultraviolet lines and the forbidden line is
much better with a mean difference of the order of -0.09+/-0.25 dex(s.d.). In
general, our results follow the same trend as previously published results with
the exception of the ones based on OH ultraviolet lines. In that case our
results lie below the values which gave rise to the oxygen abundance debate for
metal-poor stars.
","[{""version"":""v1"",""created"":""Mon, 12 Dec 2005 13:23:01 GMT""}]","2016-08-16"
"astro-ph/0512292","Gennaro D'Angelo Dr.","Steve H. Lubow and Gennaro D'Angelo","Gas Flow Across Gaps in Protoplanetary Disks","10 pages, 3 figures, 1 table. To appear in The Astrophysical Journal","Astrophys.J. 641 (2006) 526-533","10.1086/500356","STScI Eprint #1707","astro-ph",,"  We analyze the gas accretion flow through a planet-produced gap in a
protoplanetary disk. We adopt the alpha disk model and ignore effects of
planetary migration. We develop a semi-analytic, one-dimensional model that
accounts for the effects of the planet as a mass sink and also carry out
two-dimensional hydrodynamical simulations of a planet embedded in a disk. The
predictions of the mass flow rate through the gap based on the semi-analytic
model generally agree with the hydrodynamical simulations at the 25% level.
Through these models, we are able to explore steady state disk structures and
over large spatial ranges. The presence of an accreting Jupiter-mass planet
significantly lowers the density of the disk within a region of several times
the planet's orbital radius. The mass flow rate across the gap (and onto the
central star) is typically 10% to 25% of the mass accretion rate outside the
orbit of the planet, for planet-to-star mass ratios that range from 5e-5 to
1e-3.
","[{""version"":""v1"",""created"":""Mon, 12 Dec 2005 14:46:55 GMT""}]","2016-06-20"
"astro-ph/0512293","Ana Elia Garc\'ia P\'erez","A.E. Garc\'ia P\'erez and F. Primas","Li and Be depletion in metal-poor subgiants","Accepted for publication in A&A",,"10.1051/0004-6361:20053182",,"astro-ph",,"  A sample of metal-poor subgiants has been observed with the UVES spectrograph
at the Very Large Telescope and abundances of Li and Be have been determined.
Typical signal-to-noise per spectral bin values for the co-added spectra are of
the order of 500 for the Li I line (670.78 nm) and 100 for the Be II doublet
lines (313.04 nm). The spectral analysis of the observations was carried out
using the Uppsala suite of codes and MARCS (1D-LTE) model atmospheres with
stellar parameters from photometry, parallaxes, isochrones and Fe II lines.
Abundance estimates of the light elements were corrected for departures from
local thermodynamic equilibrium in the line formation. Effective temperatures
and Li abundances seem to be correlated and Be abundances correlate with [O/H].
Standard models predict Li and Be abundances approximately one order of
magnitude lower than main-sequence values which is in general agreement with
the observations. On average, our observed depletions seem to be 0.1 dex
smaller and between 0.2 and 0.4 dex larger (depending on which reference is
taken) than those predicted for Li and Be, respectively. This is not surprising
since the initial Li abundance, as derived from main-sequence stars on the
Spite plateau, may be systematically in error by 0.1 dex or more, and
uncertainties in the spectrum normalisation and continuum drawing may affect
our Be abundances systematically.
","[{""version"":""v1"",""created"":""Mon, 12 Dec 2005 15:09:32 GMT""}]","2016-08-16"
"astro-ph/0512294","Charles R. Cowley","C. R. Cowley and G. M. Wahlgren","Abundances of Vanadium and Bromine in 3 Cen A: Additional Odd-Z
  Anomalies","4 Pages, 2 tables, 2 figures; accepted by Astronomy and Astrophysics",,"10.1051/0004-6361:20053995",,"astro-ph",,"  We report abundance excesses of 1.2 and 2.6 dex, respectively, for vanadium
and bromine in the hot, peculiar star 3 Cen A. Abundances for these two odd-Z
elements have not been previously reported for this star. Taken with previous
work, they strengthen the case of the origin of the abundance peculiarities by
diffusion.
","[{""version"":""v1"",""created"":""Mon, 12 Dec 2005 15:49:10 GMT""}]","2009-11-11"
"cond-mat/0512221","Andrey Larionov","A.V. Larionov, V.E. Bisti, M. Bayer, J. Hvam, and K. Soerensen","Coherent spin dynamics of an interwell excitons gas in GaAs/AlGaAs
  coupled quantum wells","8 pages, 9 figures",,"10.1103/PhysRevB.73.235329",,"cond-mat.mes-hall",,"  The spin dynamics of an interwell excitons gas has been investigated in n-i-n
GaAs/AlGaAs coupled quantum wells (CQWs). In these heterostructures the
electron and the hole are spatially separated in neighboring quantum wells by a
narrow AlAs barrier, when an electric field is applied. The time evolution
kinetics of the interwell exciton photoluminescence has been measured under
resonant excitation of the 1sHH intrawell exciton, using a pulsed tunable
laser. The formation of a collective exciton phase in time and the temperature
dependence of its spin relaxation rate have been studied. The spin relaxation
rate of the interwell excitons is strongly reduced in the collective phase.
This observation provides evidence for the coherence of the indirect excitons
collective phase at temperatures below a critical $T_c$.
","[{""version"":""v1"",""created"":""Mon, 12 Dec 2005 14:07:28 GMT""}]","2009-11-11"
"cond-mat/0512226","G. -H. Gweon","E. Rollings, G.-H. Gweon, S. Y. Zhou, B. S. Mun, J. L. McChesney, B.
  S. Hussain, A. V. Fedorov, P. N. First, W. A. de Heer, and A. Lanzara","Synthesis and characterization of atomically-thin graphite films on a
  silicon carbide substrate",,,"10.1016/j.jpcs.2006.05.010",,"cond-mat.mtrl-sci cond-mat.mes-hall",,"  This paper reports the synthesis and detailed characterization of graphite
thin films produced by thermal decomposition of the (0001) face of a 6H-SiC
wafer, demonstrating the successful growth of single crystalline films down to
approximately one graphene layer. The growth and characterization were carried
out in ultrahigh vacuum (UHV) conditions. The growth process and sample quality
were monitored by low-energy electron diffraction, and the thickness of the
sample was determined by core level x-ray photoelectron spectroscopy.
High-resolution angle-resolved photoemission spectroscopy shows constant energy
map patterns, which are very sharp and fully momentum-resolved, but nonetheless
not resolution limited. We discuss the implications of this observation in
connection with scanning electron microscopy data, as well as with previous
studies.
","[{""version"":""v1"",""created"":""Sun, 11 Dec 2005 19:27:44 GMT""},{""version"":""v2"",""created"":""Mon, 2 Oct 2006 21:20:03 GMT""}]","2009-11-11"
"cond-mat/0512228","Nathalie Olivi-Tran","F.Lallet, R.Bachelet, A.Dauger and N.Olivi-Tran","Monte Carlo approach of the islanding of polycrystalline thin films","20 pages, 7 figures","Phys Rev B vol.74 (2006) 075411","10.1103/PhysRevB.74.075411",,"cond-mat.mtrl-sci cond-mat.stat-mech",,"  We computed by a Monte Carlo method derived from the Solid on Solid model,
the evolution of a polycrystalline thin film deposited on a substrate during
thermal treatment. Two types of substrates have been studied: a single
crystalline substrate with no defects and a single crystalline substrate with
defects. We obtain islands which are either flat (i.e. with a height which does
not overcome a given value) or grow in height like narrow towers. A good
agreement was found regarding the morphology of numerical nanoislands at
equilibrium, deduced from our model, and experimental nanoislands resulting
from the fragmentation of YSZ thin films after thermal treatment.
","[{""version"":""v1"",""created"":""Mon, 12 Dec 2005 14:58:16 GMT""}]","2009-11-11"
"cond-mat/0512229","Huanwen Tang","Zhongzhi Zhang and Lili Rong","General model for Apollonian networks","5 pages, 2 figures",,,,"cond-mat.stat-mech cond-mat.other",,"  We introduce a general deterministic model for Apollonian Networks in an
iterative fashion. The networks have small-world effect and scale-free
topology. We calculate the exact results for the degree exponent, the
clustering coefficient and the diameter. The major points of our results
indicate that (a) the degree exponent can be adjusted in a wide range, (b) the
clustering coefficient of each individual vertex is inversely proportional to
its degree and the average clustering coefficient of all vertices approaches to
a nonzero value in the infinite network order, and (c) the diameter grows
logarithmically with the number of network vertices.
","[{""version"":""v1"",""created"":""Sun, 11 Dec 2005 16:03:13 GMT""}]","2007-05-23"
"cond-mat/0512230","Mahmood Mahmoodian","M. M. Mahmoodian, L. S. Braginskii, M. V. Entin","Properties of 1D two-barrier quantum pump with harmonically oscillating
  barriers","7 pages, 8 figures","Physical Review B vol. 74, p.125317 (2006)","10.1103/PhysRevB.74.125317",,"cond-mat.mes-hall",,"  We study a one-dimensional quantum pump composed of two oscillating
delta-functional barriers. The linear and non-linear regimes are considered.
The harmonic signal applied to any or both barriers causes the stationary
current. The direction and value of the current depend on the frequency,
distance between barriers, value of stationary and oscillating parts of barrier
potential and the phase shift between alternating voltages.
","[{""version"":""v1"",""created"":""Sun, 11 Dec 2005 16:15:35 GMT""}]","2009-11-11"
"cond-mat/0512231","Rashid Nazmitdinov Giyasovich","Manuel Valin-Rodriguez and Rashid G. Nazmitdinov","Interplay between Zeeman interaction and spin-orbit coupling in a
  two-dimensional semiconductor system","5 pages","Phys. Rev. B 73, 235306 (2006)","10.1103/PhysRevB.73.235306",,"cond-mat.mes-hall",,"  We analyse the interplay between Dresselhaus, Bychkov-Rashba, and Zeeman
interactions in a two-dimensional semiconductor quantum system under the action
of a magnetic field. When a vertical magnetic field is considered, we predict
that the interplay results in an effective cyclotron frequency that depends on
a spin-dependent contribution. For in-plane magnetic fields, we found that the
interplay induces an anisotropic effective gyromagnetic factor that depends on
the orientation of the applied field as well as on the orientation of the
electron momentum.
","[{""version"":""v1"",""created"":""Sun, 11 Dec 2005 17:52:41 GMT""}]","2015-06-25"
"cond-mat/0512232","Arthur Gubeskys","Arthur Gubeskys, Boris A. Malomed, and Ilya M. Merhasin","Alternate solitons: Nonlinearly-managed one- and two-dimensional
  solitons in optical lattices","10 pages + 16 figures","Studies in Applied Mathematics, Volume 115, Issue 2, Page 255-277,
  Aug 2005",,,"cond-mat.other nlin.PS",,"  We consider a model of Bose-Einstein condensates which combines a stationary
optical lattice (OL) and periodic change of the sign of the scattering length
(SL) due to the Feshbach-resonance management. Ordinary solitons and ones of
the gap type being possible, respectively, in the model with constant negative
and positive SL, an issue of interest is to find solitons alternating, in the
case of the low-frequency modulation, between shapes of both types, across the
zero-SL point. We find such \textit{alternate solitons} and identify their
stability regions in the 2D and 1D models. Three types of the dynamical regimes
are distinguished: stable, unstable, and semi-stable. In the latter case, the
soliton sheds off a conspicuous part of its initial norm before relaxing to a
stable regime. In the 2D case, the threshold (minimum number of atoms)
necessary for the existence of the alternate solitons is essentially higher
than its counterparts for the ordinary and gap solitons in the static model. In
the 1D model, the alternate solitons are also found only above a certain
threshold, while the static 1D models have no threshold. In the 1D case, stable
antisymmetric alternate solitons are found too. Additionally, we consider a
possibility to apply the variational approximation (VA) to the description of
stationary gap solitons, in the case of constant positive SL. It predicts the
solitons in the first finite bandgap very accurately, and does it reasonably
well in the second gap too. In higher bands, the VA predicts a border between
tightly and loosely bound solitons.
","[{""version"":""v1"",""created"":""Sun, 11 Dec 2005 17:54:43 GMT""}]","2007-05-23"
"cond-mat/0512233","Wei Fa","Wei Fa and Jinming Dong","Possible Ground-State Structure of Au26: a Highly Symmetric Tube-Like
  Cage","11 pages, 3 figures, and 1 table",,"10.1063/1.2179071",,"cond-mat.mtrl-sci cond-mat.other",,"  A surprising stability of the tube-like AuN (N = 26-28) has been shown using
the scalar relativistic all-electron density functional theory calculations,
forming another powerful candidate for the lowest-energy AuN competing with
those previously suggested space-filled structures. Unlike the icosahedral
""golden"" fullerene Au32, these tube-like gold clusters may be closely related
to the synthesized single-wall gold nanotubes (SWGNT). The ground-state Au26
has a hollow tube-like structure constructed from the (6, 0) SWGNT, yielding a
high-symmetry D6d cage, based upon which the most stable Au27 and Au28 can be
obtained by capped one and two atoms, respectively.
","[{""version"":""v1"",""created"":""Sun, 11 Dec 2005 18:04:54 GMT""}]","2009-11-11"
"cond-mat/0512235","Ryan Toonen","Ryan C. Toonen, Hua Qin, Andreas K. Huettel, Srijit Goswami, Daniel W.
  van der Weide, Karl Eberl, Robert H. Blick","Jahn-Teller / Kondo Interplay in a Three-Terminal Quantum Dot","4 pages, 4 figures",,,,"cond-mat.mes-hall",,"  In quantum dot circuits, screening electron clouds in strongly-coupled leads
will hybridize with the states of the artificial atom. Using a three-terminal
geometry, we directly probe the atomic structure of a quantum dot with Kondo
coupling. Our measurements reveal that this hybrid system behaves as a
non-linear entity with orbital degeneracy. Geometric distortion reduces the
symmetry, lowers the energy, and lifts the degeneracy--the Jahn-Teller effect.
","[{""version"":""v1"",""created"":""Sun, 11 Dec 2005 20:28:15 GMT""},{""version"":""v2"",""created"":""Mon, 25 Sep 2006 18:44:30 GMT""},{""version"":""v3"",""created"":""Tue, 26 Sep 2006 17:31:48 GMT""}]","2007-05-23"
"cond-mat/0512236","Jian Zi","Chun Xu, Dezhuan Han, Xin Wang, Xiaohan Liu, and Jian Zi","Extrinsic photonic crystals","4 pages, 4 figures; submitted to Phys. Rev. B",,,,"cond-mat.mtrl-sci",,"  Doped semiconductors are intrinsically homogeneous media. However, by
applying an external magnetic field that has a spatially periodic variation,
doped semiconductors can behave extrinsically like conventional photonic
crystals. We show this possibility theoretically by calculating the photonic
band structures of a doped semiconductor under an external, spatially periodic
magnetic field. Homogeneous media, behaving like conventional photonic crystals
under some external, spatially periodic fields, define a new kind of photonic
crystals: extrinsic photonic crystals. The proposed extrinsic photonic crystals
could not only extend the concept of photonic crystals but also lead to the
control of the dispersion and propagation of electromagnetic waves in a unique
way: simply manipulating the externally applied fields.
","[{""version"":""v1"",""created"":""Mon, 12 Dec 2005 01:08:21 GMT""}]","2007-05-23"
"cond-mat/0512237","Armen Allahverdyan","A.E. Allahverdyan, Zh.S. Gevorkian, Chin-Kun Hu and Th.M.
  Nieuwenhuizen","Adhesion Induced DNA Naturation","4 pages, 1 figure",,"10.1103/PhysRevLett.96.098302",,"cond-mat.soft cond-mat.stat-mech",,"  DNA adsorption and naturation is modeled via two interacting flexible
homopolymers coupled to a solid surface. DNA denatures if the entropy gain for
unbinding the two strands overcomes the loss of binding energy. When adsorbed
to a surface, the entropy gain is smaller than in the bulk, leading to a
stronger binding and, upon neglecting self-avoidance, absence of a denatured
phase. Now consider conditions where the binding potentials are too weak for
naturation, and the surface potential too weak to adsorb single strands. In a
variational approach it is shown that their combined action may lead to a
naturated adsorbed phase. Conditions for the absence of naturation and
adsorption are derived too. The phase diagram is constructed qualitatively.
","[{""version"":""v1"",""created"":""Mon, 12 Dec 2005 00:46:23 GMT""}]","2009-11-11"
"cond-mat/0512238","Antti O. Niskanen","Antti O. Niskanen, Yasunobu Nakamura, Jaw-Shen Tsai","Tunable coupling scheme for flux qubits at the optimal point","8 pages, 6 figures, minor changes",,"10.1103/PhysRevB.73.094506",,"cond-mat.mes-hall cond-mat.supr-con",,"  We discuss a practical design for tunably coupling a pair of flux qubits via
the quantum inductance of a third high-frequency qubit. The design is
particularly well suited for realizing a recently proposed microwave-induced
parametric coupling scheme. This is attractive because the qubits can always
remain at their optimal points. Furthermore, we will show that the resulting
coupling also has an optimal point where it is insensitive to low-frequency
flux noise. This is an important feature for the coherence of coupled qubits.
The presented scheme is an experimentally realistic way of carrying out
two-qubit gates and should be easily extended to multiqubit systems.
","[{""version"":""v1"",""created"":""Mon, 12 Dec 2005 02:06:21 GMT""},{""version"":""v2"",""created"":""Tue, 24 Jan 2006 07:44:53 GMT""}]","2009-11-11"
"cond-mat/0512239","Hideo Aoki","Y. Nishi, P.A. Maksym, D.G. Austing, T. Hatano, L.P. Kouwenhoven, H.
  Aoki, and S. Tarucha","Intermediate Low Spin States in a Few-electron Quantum Dot in the
  $\nu\le 1$ Regime","4 pages, 4 figures",,"10.1103/PhysRevB.74.033306",,"cond-mat.mes-hall",,"  We study the effects of electron-electron interactions in a circular
few-electron vertical quantum dot in such a strong magnetic field that the
filling factor $\nu\le 1$. We measure excitation spectra and find ground state
transitions beyond the maximum density droplet ($\nu=1$) region. We compare the
observed spectra with those calculated by exact diagonalization to identify the
ground state quantum numbers, and find that intermediate low-spin states occur
between adjacent spin-polarized magic number states.
","[{""version"":""v1"",""created"":""Mon, 12 Dec 2005 06:16:28 GMT""}]","2009-11-11"
"cond-mat/0512240","Patrick Reichart","P. Reichart, D. Spemann, A. Hauptner, A. Bergmaier, V. Hable, R.
  Hertenberger, C. Greubel, A. Setzer, G. Dollinger, D.N. Jamieson, T. Butz, P.
  Esquinazi","3D-Hydrogen Analysis of Ferromagnetic Microstructures in Proton
  Irradiated Graphite","accepted for publication in Nucl. Instr. and Meth",,"10.1016/j.nimb.2006.04.014",,"cond-mat.mtrl-sci",,"  Recently, magnetic order in highly oriented pyrolytic graphite (HOPG) induced
by proton broad- and microbeam irradiation was discovered. Theoretical models
propose that hydrogen could play a major role in the magnetism mechanism. We
analysed the hydrogen distribution of pristine as well as irradiated HOPG
samples, which were implanted to micrometer-sized spots as well as extended
areas with various doses of 2.25 MeV protons at the Leipzig microprobe LIPSION.
For this we used the sensitive 3D hydrogen microscopy system at the Munich
microprobe SNAKE. The background hydrogen level in pristine HOPG is determined
to be less than 0.3 at-ppm. About 4.8e15 H-atoms/cm^2 are observed in the
near-surface region (4 um depth resolution). The depth profiles of the implants
show hydrogen located within a confined peak at the end of range, in agreement
with SRIM Monte Carlo simulations, and no evidence of diffusion broadening
along the c-axis. At sample with microspots, up to 40 at-% of the implanted
hydrogen is not detected, providing support for lateral hydrogen diffusion.
","[{""version"":""v1"",""created"":""Mon, 12 Dec 2005 06:50:08 GMT""}]","2009-11-11"
