"cond-mat/0512242","Heon-Jung Kim","Heon-Jung Kim, Hyun-Sook Lee, Byeongwon Kang, Woon-Ha Yim, Younghun
  Jo, Myung-Hwa Jung, and Sung-Ik Lee","Comparison of $H_{c2}(T,\theta)$ in Mg$_{1-x}$Al$_x$B$_2$ single
  crystals with the dirty-limit two-gap theory",,,,,"cond-mat.supr-con",,"  We studied the temperature and the angular dependences of the upper critical
field ($H_{c2}(T,\theta$)) of Mg$_{1-x}$Al$_x$B$_2$ single crystals ($x = 0.12$
and 0.21) and compared with the dirty-limit two-gap theory. We found that
$H_{c2}(T,\theta)$'s were well described in a unified way by this theory. The
obtained values of the parameters indicated that as the Al concentration was
increased, anisotropic impurity scattering increased, making the $\sigma$ bands
less anisotropic. Accordingly, the temperature dependence of the anisotropy
ratio of $H_{c2}$ ($\gamma_H$) systematically decreased, and for $x=0.21$,
$\gamma_H$ was nearly constant. Our results imply that Mg$_{1-x}$Al$_x$B$_2$
single crystals are in dirty-limit and that two-gap nature survives until $x =
0.21$.
","[{""version"":""v1"",""created"":""Mon, 12 Dec 2005 08:27:03 GMT""}]","2007-05-23"
"cond-mat/0512243","Lode Pollet","Lode Pollet, Matthias Troyer, Kris Van Houcke, Stefan M. A. Rombouts","Phase diagram of Bose-Fermi mixtures in one-dimensional optical lattices","5 pages, 5 figures, replaced with published version","Phys. Rev. Lett. 96, 190402 (2006)","10.1103/PhysRevLett.96.190402",,"cond-mat.stat-mech",,"  The ground state phase diagram of the one-dimensional Bose-Fermi Hubbard
model is studied in the canonical ensemble using a quantum Monte Carlo method.
We focus on the case where both species have half filling in order to maximize
the pairing correlations between the bosons and the fermions. In case of equal
hopping we distinguish between phase separation, a Luttinger liquid phase and a
phase characterized by strong singlet pairing between the species. True
long-range density waves exist with unequal hopping amplitudes.
","[{""version"":""v1"",""created"":""Mon, 12 Dec 2005 09:15:14 GMT""},{""version"":""v2"",""created"":""Tue, 13 Dec 2005 08:41:11 GMT""},{""version"":""v3"",""created"":""Tue, 23 May 2006 13:20:09 GMT""}]","2007-05-23"
"cond-mat/0512244","Kai Schmidt","Kai P. Schmidt and G\""otz S. Uhrig","Hardcore Magnons in the S=1/2 Heisenberg Model on the Square Lattice","4 pages, 3 figures","Physical Review B 73, 172407 (2006)","10.1103/PhysRevB.73.172407",,"cond-mat.str-el cond-mat.supr-con",,"  We propose a versatile approach to treat commonly arising constraints. It is
illustrated for interacting magnons of the Heisenberg antiferromagnet on a
square lattice. For systems of $L\times L$ sites a non-perturbative continuous
unitary transformation (CUT) is used to derive an effective Hamiltonian
conserving the number of magnons. They are bosonic particles with a hardcore
constraint which is captured by a local, repulsive interaction U. The limits
$U\to\infty$ and $L\to\infty$ are achieved by extrapolation. The residual spin
gap $\Delta_1$ is smaller than 0.01J reflecting the gapless nature of the
magnons. The one-magnon dispersion displays all known characteristics.
","[{""version"":""v1"",""created"":""Mon, 12 Dec 2005 09:53:12 GMT""},{""version"":""v2"",""created"":""Thu, 22 Dec 2005 15:35:45 GMT""}]","2009-11-11"
"cond-mat/0512245","Valentin Irkhin","V. Yu. Irkhin and M. I. Katsnelson","Spin-polarized scanning tunneling microscopy of half-metallic
  ferromagnets: Non-quasiparticle contributions","13 pages, 6 figures","Phys. Rev. B73, 104429 (2006)","10.1103/PhysRevB.73.104429",,"cond-mat.str-el",,"  The role of the many-body (spin-polaronic) effects in the scanning tunneling
spectroscopy of half-metallic ferromagnets (HMF) is considered. It is shown
that the non-quasiparticle (NQP) states exist in the majority or minority spin
gap in the presence of arbitrary external potential and, in particular, at the
surfaces and interfaces. Energy dependence of the NQP density of states is
obtained in various models of HMF, an important role of the hybridization
nature of the energy gap being demonstrated. The corresponding temperature
dependence of spin polarization is calculated. It is shown that the NQP states
result in a sharp bias dependence of the tunneling conductance near zero bias.
Asymmetry of the NQP states with respect to the Fermi energy provides an
opportunity to separate phonon and magnon peaks in the inelastic spectroscopy
by STM.
","[{""version"":""v1"",""created"":""Mon, 12 Dec 2005 10:03:09 GMT""}]","2009-11-11"
"cond-mat/0512246","Kirill Nagaev","Kirill E. Nagaev","Semiclassical noise beyond the second cumulant",,"Proceedings of SPIE, Vol. 5843, Fluctuations and Noise in
  Materials II, P. Svedlindh, D. Popovic, and M. B. Weissman, Eds., May 2005,
  p. 91","10.1117/12.609328",,"cond-mat.stat-mech cond-mat.mes-hall",,"  We show how the semiclassical Langevin method can be extended to calculations
of higher-than-second cumulants of noise. These cumulants are affected by
indirect correlations between the fluctuations, which may be considered as
""noise of noise."" We formulate simple diagrammatic rules for calculating the
higher cumulants and apply them to mesoscopic diffusive contacts and chaotic
cavities. As one of the application of the method, we analyze the frequency
dependence of the third cumulant of current in these systems and show that it
contains additional peculiarities as compared to the second cumulant. The
effects of environmental feedback in measurements of the third cumulant are
also discussed in terms of this method.
","[{""version"":""v1"",""created"":""Mon, 12 Dec 2005 10:43:52 GMT""},{""version"":""v2"",""created"":""Sat, 25 Mar 2006 12:29:08 GMT""}]","2009-11-11"
"cond-mat/0512247","Raffaele Resta","R. Resta","Polarization fluctuations in insulators and metals: New and old theories
  merge","4 pages, no figure","Phys. Rev. Lett. 96, 137601 (2006)","10.1103/PhysRevLett.96.137601",,"cond-mat.mtrl-sci cond-mat.other",,"  The ground-state fluctuation of polarization P is finite in insulators and
divergent in metals, owing to the SWM sum rule [I. Souza, T. Wilkens, and R. M.
Martin, Phys. Rev. B 62, 1666 (2000)]. This is a virtue of periodic (i.e.
transverse) BCs. I show that within any other boundary conditions the P
fluctuation is finite even in metals, and a generalized sum rule applies. The
boundary-condition dependence is a pure correlation effect, not present at the
independent-particle level. In the longitudinal case div P = -rho, and one
equivalently addresses charge fluctuations: the generalized sum rule reduces
then to a well known result of many-body theory.
","[{""version"":""v1"",""created"":""Mon, 12 Dec 2005 12:17:13 GMT""},{""version"":""v2"",""created"":""Mon, 10 Jul 2006 14:52:35 GMT""}]","2009-11-11"
"cond-mat/0512248","Mikko Karttunen","P. Nikunen, I. Vattulainen, M. Karttunen","Reptational dynamics in dissipative particle dynamics simulations of
  polymer melts",,,,,"cond-mat.soft",,"  Understanding the complex viscoelastic properties of polymeric liquids
remains a challenge in materials science and soft matter physics. Here, we
present a simple and computationally efficient criterion for the topological
constraints in polymeric liquids using the Dissipative Particle Dynamics (DPD).
The same approach is also applicable in other soft potential models. For short
chains the model correctly reproduces Rouse-like dynamics whereas for longer
chains the dynamics becomes reptational as the chain length is increased -
something that is not attainable using standard DPD or other coarse-grained
soft potential methods. Importantly, no new length scales or forces need to be
added.
","[{""version"":""v1"",""created"":""Mon, 12 Dec 2005 13:03:14 GMT""}]","2007-05-23"
"cond-mat/0512249","Pawel Bryk","Pawel Bryk","Effective interactions in colloid - semipermeable membrane systems","8 pages, 7 figures, submitted",,,,"cond-mat.soft cond-mat.stat-mech",,"  We investigate effective interactions between a colloidal particle, immersed
in a binary mixture of smaller spheres, and a semipermeable membrane. The
colloid is modeled as a big hard sphere and the membrane is represented as an
infinitely thin surface which is fully permeable to one of the smaller spheres
and impermeable to the other one. Within the framework of the density
functional theory we evaluate the depletion potentials, and we consider two
different approximate theories - the simple Asakura-Oosawa approximation and
the accurate White-Bear version of the fundamental measure theory. The
effective potentials are compared with the corresponding potentials for a hard,
nonpermeable wall. Using statistical-mechanical sum rules we argue that the
contact value of the depletion potential between a colloid and a semipermeable
membrane is smaller in magnitude than the potential between a colloid and a
hard wall. Explicit calculations confirm that the colloid-semipermeable
membrane effective interactions are generally weaker than these near a hard
nonpermeable wall. This effect is more pronounced for smaller osmotic
pressures. The depletion potential for a colloidal particle inside a
semipermeable vesicle is stronger than the potential for the colloidal particle
located outside of a vesicle. We find that the asymptotic decay of the
depletion potential for the semipermeable membrane is similar to that for the
nonpermeable wall and reflects the asymptotics of the total correlation
function of the corresponding binary mixture of smaller spheres. Our results
demonstrate that the ability of the membrane to change its shape constitutes an
important factor in determining the effective interactions between the
semipermeable membrane and the colloidal macroparticle.
","[{""version"":""v1"",""created"":""Mon, 12 Dec 2005 14:01:17 GMT""}]","2007-05-23"
"cond-mat/0512250","Jaeyoung Sung","Jaeyoung Sung","Reply to Note on cond-mat/0510270: Jarzynski equation for adiabatically
  stretched rotor","15 manuscript pages, 1 figure",,,,"cond-mat.stat-mech",,"  Although the analysis in cond-mat/0510270 is correct, this doesn't mean
Jarzynski relation holds always for an arbitrary process. There exists a
sufficient and necessary condition for Jarzynski relation to hold for an
adiabatic parameter switching process. In contradiction to recent assertions,
the validity condition of Jarzynski relation for an adiabatic process is not
always satisfied.
","[{""version"":""v1"",""created"":""Mon, 12 Dec 2005 14:08:45 GMT""}]","2007-05-23"
"cond-mat/0512251","Jean-Francois Berret","Jean-Francois Berret, Nicolas Schonbeck, Florence Gazeau, Delphine El
  Kharrat, Olivier Sandre, Annie Vacher, Marc Airiau","Controlled Clustering of Superparamagnetic Nanoparticles using Block
  Copolymers : Design of New Contrast Agents for Magnetic Resonance Imaging","7 figures, 7 pages, 52 references","J. Am. Chem. Soc., 128 (5), 1755 -1761, 2006","10.1021/ja0562999",,"cond-mat.soft cond-mat.mtrl-sci",,"  When polyelectrolyte-neutral block copolymers are mixed in aqueous solutions
with oppositely charged species, stable complexes are found to form
spontaneously. The mechanism is based on electrostatics, and on the
compensation between the opposite charges. Electrostatic complexes exhibit a
core-shell microstructure. In the core, the polyelectrolyte blocks and the
oppositely charged species are tightly bound and form a dense coacervate
microphase. The shell is made of the neutral chains and surrounds the core. In
this paper, we report on the structural and magnetic properties of such
complexes made from 6.3 nm diameter superparamagnetic nanoparticles (maghemite
gamma-Fe2O3) and cationic-neutral copolymers. The copolymers investigated are
poly(trimethylammonium ethylacrylate methylsulfate)-b-poly(acrylamide), with
molecular weights 5000-b-30000 gmol-1 and 110000-b-30000 gmol-1. The mixed
copolymer-nanoparticle aggregates were characterized by a combination of light
scattering and cryo-transmission electron microscopy. Their hydrodynamic
diameters were found in the range 70 - 150 nm and their aggregation numbers
(number of nanoparticles per aggregate) between several tens to several
hundreds. In addition, Magnetic Resonance Spin-Echo measurements show that the
complexes have a better contrast in Magnetic Resonance Imaging than single
nanoparticles, and that these complexes could be used for biomedical
applications.
","[{""version"":""v1"",""created"":""Mon, 12 Dec 2005 15:57:11 GMT""}]","2007-09-10"
"cs/0512038","Aris L. Moustakas","Aris L. Moustakas, Steven H. Simon and Thomas L. Marzetta","Capacity of Differential versus Non-Differential Unitary Space-Time
  Modulation for MIMO channels","submitted to IEEE Trans. Information Theory Jan. 2004; current
  version addresses referees' minor comments; 13 pages",,,,"cs.IT cond-mat.stat-mech math-ph math.IT math.MP",,"  Differential Unitary Space-Time Modulation (DUSTM) and its earlier
nondifferential counterpart, USTM, permit high-throughput MIMO communication
entirely without the possession of channel state information (CSI) by either
the transmitter or the receiver. For an isotropically random unitary input we
obtain the exact closed-form expression for the probability density of the
DUSTM received signal, which permits the straightforward Monte Carlo evaluation
of its mutual information. We compare the performance of DUSTM and USTM through
both numerical computations of mutual information and through the analysis of
low- and high-SNR asymptotic expressions. In our comparisons the symbol
durations of the equivalent unitary space-time signals are both equal to T, as
are the number of receive antennas N. For DUSTM the number of transmit antennas
is constrained by the scheme to be M = T/2, while USTM has no such constraint.
If DUSTM and USTM utilize the same number of transmit antennas at high SNR's
the normalized mutual information of the differential and the nondifferential
schemes expressed in bits/sec/Hz are asymptotically equal, with the
differential scheme performing somewhat better, while at low SNR's the
normalized mutual information of DUSTM is asymptotically twice the normalized
mutual information of USTM. If, instead, USTM utilizes the optimum number of
transmit antennas then USTM can outperform DUSTM at sufficiently low SNR's.
","[{""version"":""v1"",""created"":""Mon, 12 Dec 2005 13:39:23 GMT""}]","2007-07-13"
"cs/0512045","Xuan-Ha Vu","Xuan-Ha Vu, Marius-Calin Silaghi, Djamila Sam-Haroud and Boi Faltings","Branch-and-Prune Search Strategies for Numerical Constraint Solving","43 pages, 11 figures",,,"LIA-REPORT-2006-007","cs.AI",,"  When solving numerical constraints such as nonlinear equations and
inequalities, solvers often exploit pruning techniques, which remove redundant
value combinations from the domains of variables, at pruning steps. To find the
complete solution set, most of these solvers alternate the pruning steps with
branching steps, which split each problem into subproblems. This forms the
so-called branch-and-prune framework, well known among the approaches for
solving numerical constraints. The basic branch-and-prune search strategy that
uses domain bisections in place of the branching steps is called the bisection
search. In general, the bisection search works well in case (i) the solutions
are isolated, but it can be improved further in case (ii) there are continuums
of solutions (this often occurs when inequalities are involved). In this paper,
we propose a new branch-and-prune search strategy along with several variants,
which not only allow yielding better branching decisions in the latter case,
but also work as well as the bisection search does in the former case. These
new search algorithms enable us to employ various pruning techniques in the
construction of inner and outer approximations of the solution set. Our
experiments show that these algorithms speed up the solving process often by
one order of magnitude or more when solving problems with continuums of
solutions, while keeping the same performance as the bisection search when the
solutions are isolated.
","[{""version"":""v1"",""created"":""Sun, 11 Dec 2005 19:47:42 GMT""},{""version"":""v2"",""created"":""Tue, 8 May 2007 22:59:01 GMT""}]","2007-05-23"
"cs/0512046","Georgios Mertzios","George B. Mertzios","A polynomial algorithm for the k-cluster problem on interval graphs","12 pages, 5 figures",,,,"cs.DS",,"  This paper deals with the problem of finding, for a given graph and a given
natural number k, a subgraph of k nodes with a maximum number of edges. This
problem is known as the k-cluster problem and it is NP-hard on general graphs
as well as on chordal graphs. In this paper, it is shown that the k-cluster
problem is solvable in polynomial time on interval graphs. In particular, we
present two polynomial time algorithms for the class of proper interval graphs
and the class of general interval graphs, respectively. Both algorithms are
based on a matrix representation for interval graphs. In contrast to
representations used in most of the previous work, this matrix representation
does not make use of the maximal cliques in the investigated graph.
","[{""version"":""v1"",""created"":""Sun, 11 Dec 2005 23:13:44 GMT""},{""version"":""v2"",""created"":""Tue, 20 Dec 2005 00:02:45 GMT""},{""version"":""v3"",""created"":""Fri, 11 Jan 2008 15:05:23 GMT""}]","2011-11-09"
"gr-qc/0512061","Jos\'e Gaite","Jose Gaite","Stability of Self-Similar Spherical Accretion","Contribution to Spanish Relativity Meeting (ERE) 2005, held in
  Oviedo, AIP Conference Proceedings, based on astro-ph/0511624, 4 pages","AIPConf.Proc.841:433-436,2006","10.1063/1.2218207",,"gr-qc astro-ph",,"  Spherical accretion flows are simple enough for analytical study, by solution
of the corresponding fluid dynamic equations. The solutions of stationary
spherical flow are due to Bondi. The questions of the choice of a physical
solution and of stability have been widely discussed. The answer to these
questions is very dependent on the problem of boundary conditions, which vary
according to whether the accretor is a compact object or a black hole. We
introduce a particular, simple form of stationary spherical flow, namely,
self-similar Bondi flow, as a case with physical interest in which analytic
solutions for perturbations can be found. With suitable no
matter-flux-perturbation boundary conditions, we will show that acoustic modes
are stable in time and have no spatial instability at r=0. Furthermore, their
evolution eventually becomes ergodic-like and shows no trace of instability or
of acquiring any remarkable pattern.
","[{""version"":""v1"",""created"":""Mon, 12 Dec 2005 11:09:24 GMT""}]","2009-11-11"
"gr-qc/0512064","Nadja Magalh\~aes Sim\~ao","Nadja S. Magalhaes, Rubem M. Marinho Jr., Odylio D. Aguiar, C. Frajuca","Can lightning be a noise source for a spherical gravitational wave
  antenna?","5 pages, 6 figures","Phys.Rev. D72 (2005) 102003","10.1103/PhysRevD.72.102003",,"gr-qc",,"  The detection of gravitational waves is a very active research field at the
moment. In Brazil the gravitational wave detector is called Mario SCHENBERG.
Due to its high sensitivity it is necessary to model mathematically all known
noise sources so that digital filters can be developed that maximize the
signal-to-noise ratio. One of the noise sources that must be considered are the
disturbances caused by electromagnetic pulses due to lightning close to the
experiment. Such disturbances may influence the vibrations of the antenna's
normal modes and mask possible gravitational wave signals. In this work we
model the interaction between lightning and SCHENBERG antenna and calculate the
intensity of the noise due to a close lightning stroke in the detected signal.
We find that the noise generated does not disturb the experiment significantly.
","[{""version"":""v1"",""created"":""Sun, 11 Dec 2005 16:15:29 GMT""}]","2009-11-11"
"gr-qc/0512065","Jorge Pullin","Rodolfo Gambini and Jorge Pullin","Consistent discretizations as a road to quantum gravity","17 Pages, Draft chapter contributed to the book ""Approaches to
  quantum gravity"", being prepared by Daniele Oriti for Cambridge University
  Press",,,"LSU-REL-121105","gr-qc",,"  We present a brief description of the ``consistent discretization'' approach
to classical and quantum general relativity. We exhibit a classical simple
example to illustrate the approach and summarize current classical and quantum
applications. We also discuss the implications for the construction of a well
defined quantum theory and in particular how to construct a quantum continuum
limit.
","[{""version"":""v1"",""created"":""Sun, 11 Dec 2005 21:10:34 GMT""}]","2007-05-23"
"gr-qc/0512066","Volker Perlick","Volker Perlick","On totally umbilic submanifolds of semi-Riemannian manifolds","7 pages; written version of talk given at World Congress on Nonlinear
  Analysis 2004, Orlando, Florida","Nonlinear Analysis 63/5-7 (2005) e511-e518",,,"gr-qc",,"  The notion of being totally umbilic is considered for non-degenerate and
degenerate submanifolds of semi-Riemanian manifolds. After some remarks on the
general case, timelike and lightlike totally umbilic submanifolds of Lorentzian
manifolds are discussed, along with their physical interpretation in view of
general relativity. In particular, the mathematical notion of totally umbilic
submanifolds is linked to the notions of photon surfaces and of null strings
which have been used in the physics literature.
","[{""version"":""v1"",""created"":""Sun, 11 Dec 2005 21:57:21 GMT""}]","2007-05-23"
"gr-qc/0512067","J. Ponce de Leon","J. Ponce de Leon","Extra symmetry in the field equations in 5D with spatial spherical
  symmetry","Typos corrected. Accepted for publication in Classical and Quantum
  Gravity","Class.Quant.Grav.23:3043-3052,2006","10.1088/0264-9381/23/9/017",,"gr-qc",,"  We point out that the field equations in 5D, with spatial spherical symmetry,
possess an extra symmetry that leaves them invariant. This symmetry corresponds
to certain simultaneous interchange of coordinates and metric coefficients. As
a consequence a single solution in 5D can generate very different scenarios in
4D, ranging from static configurations to cosmological situations. A new
perspective emanates from our work. Namely, that different astrophysical and
cosmological scenarios in 4D might correspond to the same physics in 5D. We
present explicit examples that illustrate this point of view.
","[{""version"":""v1"",""created"":""Mon, 12 Dec 2005 07:15:04 GMT""},{""version"":""v2"",""created"":""Fri, 3 Mar 2006 15:48:27 GMT""}]","2014-11-17"
"gr-qc/0512068","Ernest Matagne","E. Matagne","Algebraic decomposition of the electromagnetic constitutive tensor. A
  step toward pre-metric based gravitation?","12 pages, PDF only","Annalen Phys.17:17-27,1997","10.1002/andp.200710272",,"gr-qc",,"  It is known that the electromagnetic constitutive tensor can be algebraically
decomposed in three parts: the so-called principal part, the axion part and the
skewon part (see gr-qc/0506042). The aim of this paper is to provide a deeper
decomposition of the principal part.
","[{""version"":""v1"",""created"":""Mon, 12 Dec 2005 10:04:19 GMT""},{""version"":""v2"",""created"":""Tue, 22 Jan 2008 10:01:19 GMT""}]","2011-07-19"
"hep-ex/0512027","Sergey Serednyakov I","S.I.Serednyakov, M.N.Achasov, K.I.Beloborodov, A.G.Bogdanchikov,
  A.V.Bozhenok, A.D.Bukin, D.A.Bukin, T.V.Dimova, V.P.Druzhinin, V.B.Golubev,
  A.A.Korol, S.V.Koshuba, E.V.Pakhtusova, Yu.M.Shatunov, V.A.Sidorov,
  Z.K.Silagadze, A.N.Skrinsky, Yu.A.Tikhonov, A.V.Vasiljev","New results on e+e- -> hadrons exclusive cross sections from experiments
  with SND detector at VEPP-2M e+e- collider in the energy range
  sqrt(s)=0.4-1.4 GeV","4 pages, 7 figures, contribution to the proceedings of International
  Europhysics Conference on High Energy physics, 2005, Lisbon, Portugal",,,,"hep-ex",,"  New results of the e+e- -> pi+pi-, K+K-, K_SK_L, pi0/gamma, eta0/gamma
processes cross section measurements are presented. The results are based on
the 30 pb^-1 data, accumulated by SND detector at VEPP-2M e+e- collider in the
energy range sqrt(s)=0.4-1.4 GeV during 1995-2000 years. The comparison with
existing experimental data shows that the measurement accuracy is close to or
better than the world average. For the e+e- -> pi+pi- process the accuracy is
about 0.01. This is important for calculation of hadronic contribution into the
muon anomalous magnetic moment.
","[{""version"":""v1"",""created"":""Mon, 12 Dec 2005 05:41:19 GMT""}]","2009-04-25"
