"cond-mat/0512692","Enrico Prati","Enrico Prati, Marco Fanciulli, Giorgio Ferrari, Marco Sampietro","Effect of the Triplet State on the Random Telegraph Signal in Si
  n-MOSFETs","3.3 pages, 3 figures",,"10.1103/PhysRevB.74.033309",,"cond-mat.mes-hall",,"  We report on the static magnetic field dependence of the random telegraph
signal (RTS) in a submicrometer silicon n-metal-oxide-semiconductor
field-effect transistor. Using intense magnetic fields and $^{3}$He
temperatures, we find that the characteristic time ratio changes by 3 orders of
magnitude when the field increases from 0 to 12 T. Similar behaviour is found
when the static field is either in-plane or perpendicular to the two
dimensional electron gas. The experimental data can be explained by considering
a model which includes the triplet state of the trapping center and the
polarization of the channel electron gas.
","[{""version"":""v1"",""created"":""Thu, 29 Dec 2005 00:42:33 GMT""}]","2009-11-11"
"cond-mat/0512693","Qiang Gu","Qiang Gu","Ferromagnetic phase transition in spinor Bose gases","20 pages, 3 figures, Book chapter in ""Progress in Ferromagnetic
  Research, Edited by V.N. Murray (Nova Science Publishers, New York, 2005)","Progress in Ferromagnetism Research, edited by V.N. Murray (Nova
  Science, New York, 2006)Chap. 6",,,"cond-mat.other cond-mat.supr-con",,"  The achievement in cooling alkali atomic gases, such as $^{87}$Rb, $^{23}$Na
and $^{7}$Li, to quantum degeneracy opens up a way to study magnetism in spinor
bosons, because these constituent atoms usually have a hyperfine spin degree of
freedom. This article reviews several basic problems related to the
ferromagnetic phase transition in spinor atomic Bose gases from a theoretical
perspective. After a brief discussion on various possible origins of the
ferromagnetic interaction, the phase diagram of the ferromagnetically coupled
spinor bosons is investigated. It is found that the ferromagnetic transition
occurs always above Bose-Einstein condensation and the Bose condensate is fully
polarized. The low-lying collective excitations of the spinor condensate,
including spin and density modes, are discussed. The spectrum of the density
mode is of the Bogliubov form and the spin wave spectrum has a $k^2$-formed
dispersion relation at long wavelengths. The spin-wave stiffness coefficient
contains contribut
","[{""version"":""v1"",""created"":""Thu, 29 Dec 2005 06:32:11 GMT""}]","2011-11-09"
"cond-mat/0512694","Li Yang","Li Yang, Jian Wu, Wenhui Duan, and Bing-Lin Gu","Modulating transmission properties of nanoscale transistors by dipole
  effects near contacts","9 pages, 4 figures, submitted to PRL",,"10.1063/1.2405383",,"cond-mat.mtrl-sci",,"  We theoretically demonstrate that a dipole layer on the electrode can
modulate the transmission properties of nanoscale devices by influencing the
contact properties, through first principles simulations on carbon nanotube
based field effect transistors. The dipole layer is realized by potassium
adsorption on Au electrodes, which shifts the electrostatic potential at the
near contact region significantly. The dipoles parallel to the direction of the
bias voltage may act as a supplement to the effect of gate voltages, while the
perpendicular dipoles may modify the interface barrier of the contacts.
","[{""version"":""v1"",""created"":""Thu, 29 Dec 2005 06:39:52 GMT""}]","2009-11-11"
"cond-mat/0512695","Jesus Cuevas","J. Cuevas, P.G. Kevrekidis, D.J. Frantzeskakis, A.R. Bishop","Polarobreathers in soft potentials","7 pages, 10 figures","Physical Review B 74 (2006) 064304","10.1103/PhysRevB.74.064304",,"cond-mat.soft nlin.PS",,"  We consider polarons in models of coupled electronic and vibrational degrees
of freedom, in the presence of a soft nonlinear inter-particle potential (Morse
potential). In particular, we focus on a a bound state of a polaron with a
breather, a so-called ``polarobreather''. We analyze the existence of this
branch based on frequency resonance conditions and illustrate its stability
using Floquet spectrum techniques. Multi-site solutions of this type are also
obtained both in the stationary case (two-site polarons) and in the breathing
case (two-site polarobreathers). We also obtain a different branch of
solutions, namely a polaronic nanopteron.
","[{""version"":""v1"",""created"":""Thu, 29 Dec 2005 08:21:32 GMT""}]","2015-05-25"
"cond-mat/0512696","Jaime Merino","J. Merino (1), B. J. Powell (2) and R. H. McKenzie (2) ((1)
  Universidad Autonoma de Madrid, (2) University of Queensland)","Ferromagnetism, paramagnetism and a Curie-Weiss metal in an electron
  doped Hubbard model on a triangular lattice","24 pages, 15 figures; accepted for publication in Phys. Rev. B","Phys. Rev. B 73, 235107 (2006)","10.1103/PhysRevB.73.235107",,"cond-mat.str-el",,"  Motivated by the unconventional properties and rich phase diagram of NaxCoO2
we consider the electronic and magnetic properties of a two-dimensional Hubbard
model on an isotropic triangular lattice doped with electrons away from
half-filling. Dynamical mean-field theory (DMFT) calculations predict that for
negative inter-site hopping amplitudes (t<0) and an on-site Coulomb repulsion,
U, comparable to the bandwidth, the system displays properties typical of a
weakly correlated metal. In contrast, for t>0 a large enhancement of the
effective mass, ferromagnetism and a Curie-Weiss magnetic susceptibility are
found in a broad electron doping range. Our observation of Nagaoka
ferromagnetism is consistent with the A-type antiferromagnetism (i.e.
ferromagnetic layers stacked antiferromagnetically) observed in neutron
scattering experiments on NaxCoO2. We propose that `Curie-Weiss metal' phase
observed in NaxCoO2 is a consequence of the crossover from ``bad metal'' with
incoherent quasiparticles at temperatures T>T* and Fermi liquid behavior with
enhanced parameters below T*, where T* is a low energy coherence scale induced
by strong local Coulomb electron correlations. We propose a model which
contains the charge ordering phenomena observed in the system which, we
propose, drives the system close to the Mott insulating phase even at large
dopings.
","[{""version"":""v1"",""created"":""Thu, 29 Dec 2005 10:03:40 GMT""},{""version"":""v2"",""created"":""Thu, 4 May 2006 14:43:24 GMT""}]","2009-11-11"
"cond-mat/0512697","Carlo M. Canali","L. Michalak, C.M. Canali, and V.G. Benza","Electron-magnon coupling and nonlinear tunneling transport in magnetic
  nanoparticles","4 pages, 2 figures","Phys. Rev. Lett. 97, 096804 (2006)","10.1103/PhysRevLett.97.096804",,"cond-mat.mes-hall",,"  We present a theory of single-electron tunneling transport through a
ferromagnetic nanoparticle in which particle-hole excitations are coupled to
spin collective modes. The model employed to describe the interaction between
quasiparticles and collective excitations captures the salient features of a
recent microscopic study. Our analysis of nonlinear quantum transport in the
regime of weak coupling to the external electrodes is based on a rate-equation
formalism for the nonequilibrium occupation probability of the nanoparticle
many-body states. For strong electron-boson coupling, we find that the
tunneling conductance as a function of bias voltage is characterized by a large
and dense set of resonances. Their magnetic field dependence in the large-field
regime is linear, with slopes of the same sign. Both features are in agreement
with recent tunneling experiments.
","[{""version"":""v1"",""created"":""Thu, 29 Dec 2005 10:04:09 GMT""},{""version"":""v2"",""created"":""Tue, 23 Jan 2007 10:49:33 GMT""}]","2009-11-11"
"cond-mat/0512698","Gianguido C. Cianci","Gianguido C. Cianci, Rachel E. Courtland and Eric R. Weeks","Correlations of Structure and Dynamics in an Aging Colloidal Glass","Submitted to Solid State Communications","Solid State Comm. 139, 599-604 (2006)","10.1016/j.ssc.2006.04.039",,"cond-mat.soft",,"  We study concentrated colloidal suspensions, a model system which has a glass
transition. Samples in the glassy state show aging, in that the motion of the
colloidal particles slows as the sample ages from an initial state. We study
the relationship between the static structure and the slowing dynamics, using
confocal microscopy to follow the three-dimensional motion of the particles.
The structure is quantified by considering tetrahedra formed by quadruplets of
neighboring particles. We find that while the sample clearly slows down during
aging, the static properties as measured by tetrahedral quantities do not vary.
However, a weak correlation between tetrahedron shape and mobility is observed,
suggesting that the structure facilitates the motion responsible for the sample
aging.
","[{""version"":""v1"",""created"":""Thu, 29 Dec 2005 11:41:52 GMT""}]","2007-05-23"
"cond-mat/0512699","Abdollah Langari","R. Jafari and A. Langari","Second order quantum renormalisation group of XXZ chain with next
  nearest neighbour interactions","10 pages, 4 figures and 1 table","Physica A, Vol. 364, p213-222 (2006).","10.1016/j.physa.2005.09.048",,"cond-mat.stat-mech cond-mat.str-el",,"  We have extended the application of quantum renormalisation group (QRG) to
the anisotropic Heisenberg model with next-nearest neighbour (n-n-n)
interaction. The second order correction has to be taken into account to get a
self similar renormalized Hamiltonian in the presence of n-n-n-interaction. We
have obtained the phase diagram of this model which consists of three different
phases, i.e, spin-fluid, dimerised and Ne'el types which merge at the
tri-critical point. The anisotropy of the n-n-n-term changes the phase diagram
significantly. It has a dominant role in the Ne'el-dimer phase boundary. The
staggered magnetisation as an order parameter defines the border between
fluid-Ne'el and Ne'el-dimer phases. The improvement of the second order RG
corrections on the ground state energy of the Heisenberg model is presented.
Moreover, the application of second order QRG on the spin lattice model has
been discussed generally. Our scheme shows that higher order corrections lead
to an effective Hamiltonian with infinite range of interactions.
","[{""version"":""v1"",""created"":""Thu, 29 Dec 2005 12:42:59 GMT""}]","2009-11-11"
"cond-mat/0512700","Jes\'us Mosqueira","L. Cabo, F. Soto, M. Ruibal, J. Mosqueira, F. Vidal","Anomalous precursor diamagnetism at low reduced magnetic fields and the
  role of Tc inhomogeneities in the superconductors Pb55In45 and underdoped
  La1.9Sr0.1CuO4","25 pages, including 6 figures and 1 table. Typos corrected. Compacted","Phys. Rev. B 73, 184520 (2006)","10.1103/PhysRevB.73.184520",,"cond-mat.supr-con",,"  The magnetic field dependence of the magnetization was measured above the
superconducting transition in a high-Tc underdoped cuprate La1.9Sr0.1CuO4 and
in a low-Tc alloy (Pb55In45). Near the superconducting transition [typically
for (T-Tc)/Tc<0.05] and under low applied magnetic field amplitudes [typically
for H/Hc2(0)<0.01, where Hc2(0) is the corresponding upper critical field
extrapolated to T=0 K] the magnetization of both samples presents a diamagnetic
contribution much larger than the one predicted by the Gaussian Ginzburg-Landau
(GGL) approach for superconducting fluctuations. These anomalies have been
already observed in cuprate compounds by various groups and attributed to
intrinsic effects associated with the own nature of these high-Tc
superconductors. However, we will see here that our results in both high and
low-Tc superconductors may be explained quantitatively, and consistently with
the GGL behavior observed at higher fields, by just taking into account the
presence in the samples of an uniform distribution of Tc inhomogeneities. These
Tc inhomogeneities, which may be in turn associated with stoichiometric
inhomogeneities, were estimated from independent measurements of the
temperature dependence of the field-cooled magnetic susceptibility under low
applied magnetic fields.
","[{""version"":""v1"",""created"":""Thu, 29 Dec 2005 13:16:45 GMT""},{""version"":""v2"",""created"":""Mon, 5 Jun 2006 17:47:32 GMT""}]","2009-11-11"
"cond-mat/0512701","Sergey Syzranov","S. V. Syzranov, Yu. Makhlin","Dephasing of Josephson qubits close to optimal points","4 pages, 1 figure, accepted for publication in JETP Lett",,,,"cond-mat.mes-hall",,"  Decoherence of Josephson qubits can be substantially reduced by tuning their
parameters to optimal operation points, with only quadratic coupling to
fluctuations. We analyze dephasing due to 1/f noise for a two-level system,
detuned from an optimal point, i.e., the crossover to the linear-coupling
regime, both for free induction decay and for spin-echo experiments. Influence
of several noise sources is also discussed.
","[{""version"":""v1"",""created"":""Thu, 29 Dec 2005 14:07:20 GMT""}]","2007-05-23"
"cond-mat/0512702","Pierre Lombardo","P. Lombardo, R. Hayn, G.I. Japaridze","Insulator-metal-insulator transition and selective spectral weight
  transfer in a disordered strongly correlated system","submitted to Phys. Rev. B","Phys. Rev. B 74, 085116 (2006)","10.1103/PhysRevB.74.085116",,"cond-mat.str-el",,"  We investigate the metal insulator transitions at finite temperature for the
Hubbard model with diagonal alloy disorder. We solve the dynamical mean field
theory equations with the non crossing approximation and we use the coherent
potential approximation to handle disorder. The excitation spectrum is given
for various correlation strength $U$ and disorder. Two successive metal
insulator transitions are observed at integer filling values as $U$ is
increased. An important selective transfer of spectral weight arises upon
doping. The strong influence of the temperature on the low energy dynamics is
studied in details.
","[{""version"":""v1"",""created"":""Thu, 29 Dec 2005 14:46:05 GMT""}]","2009-11-11"
"cond-mat/0512703","Chin-Kun Hu","N. Sh. Izmailian, V. B. Priezzhev, Philippe Ruelle, and Chin-Kun Hu","Logarithmic Conformal Field Theory and Boundary Effects in the Dimer
  Model","4 pages, 1 figure","Phys. Rev. Lett. 95, 260602 (2005)","10.1103/PhysRevLett.95.260602",,"cond-mat.stat-mech",,"  We study the finite-size corrections of the dimer model on $\infty \times N$
square lattice with two different boundary conditions: free and periodic. We
find that the finite-size corrections in a crucial way depend on the parity of
$N$; we also show that such unusual finite-size behavior can be fully explained
in the framework of the $c=-2$ logarithmic conformal field theory.
","[{""version"":""v1"",""created"":""Thu, 29 Dec 2005 15:09:07 GMT""},{""version"":""v2"",""created"":""Mon, 2 Jan 2006 08:47:19 GMT""}]","2009-11-11"
"cs/0512103","Louis Mello","Louis Mello","The Fibonacci Sequence Mod m",,,,,"cs.OH",,"  This paper proposes a computational method for obtaining the length of the
cycle that arises from the Fibonacci series taken mod m (some number) and mod p
(some prime number).
","[{""version"":""v1"",""created"":""Wed, 28 Dec 2005 18:21:08 GMT""}]","2011-11-09"
"cs/0512104","Robert Burger PhD","John Robert Burger","Reversible CAM Processor Modeled After Quantum Computer Behavior",,,,,"cs.AR quant-ph",,"  Proposed below is a reversible digital computer modeled after the natural
behavior of a quantum system. Using approaches usually reserved for idealized
quantum computers, the Reversible CAM, or State Vector Parallel (RSVP)
processor can easily find keywords in an unstructured database (that is, it can
solve a needle in a haystack problem). The RSVP processor efficiently solves a
SAT (Satisfiability of Boolean Formulae) problem; also it can aid in the
solution of a GP (Global Properties of Truth Table) problem. The power delay
product of the RSVP processor is exponentially lower than that of a standard
CAM programmed to perform similar operations.
","[{""version"":""v1"",""created"":""Wed, 28 Dec 2005 19:59:10 GMT""}]","2007-05-23"
"gr-qc/0512160","Emanuele Berti","Emanuele Berti, Vitor Cardoso, Clifford M. Will","On gravitational-wave spectroscopy of massive black holes with the space
  interferometer LISA","44 pages, 21 figures, 10 tables. Minor changes to match version in
  press in Phys. Rev. D","Phys.Rev.D73:064030,2006","10.1103/PhysRevD.73.064030",,"gr-qc astro-ph hep-th",,"  Newly formed black holes are expected to emit characteristic radiation in the
form of quasi-normal modes, called ringdown waves, with discrete frequencies.
LISA should be able to detect the ringdown waves emitted by oscillating
supermassive black holes throughout the observable Universe. We develop a
multi-mode formalism, applicable to any interferometric detectors, for
detecting ringdown signals, for estimating black hole parameters from those
signals, and for testing the no-hair theorem of general relativity. Focusing on
LISA, we use current models of its sensitivity to compute the expected
signal-to-noise ratio for ringdown events, the relative parameter estimation
accuracy, and the resolvability of different modes. We also discuss the extent
to which uncertainties on physical parameters, such as the black hole spin and
the energy emitted in each mode, will affect our ability to do black hole
spectroscopy.
","[{""version"":""v1"",""created"":""Thu, 29 Dec 2005 02:27:13 GMT""},{""version"":""v2"",""created"":""Tue, 21 Mar 2006 15:41:15 GMT""}]","2008-11-26"
"gr-qc/0512161","Yun-Song Piao","Yun-Song Piao","Scalar Perturbation Spectra in an Emergent Cosmological Island","5 pages, 1 eps figure, typos corrected, more comments and
  clarifications are added according to the suggestions of referees, to publish
  in PRD","Phys.Rev. D74 (2006) 043509","10.1103/PhysRevD.74.043509",,"gr-qc hep-ph hep-th",,"  The possibility that the universe may have a fundamental and positive
cosmological constant has motivated an interesting cosmological model, in which
initially the universe is in a cosmological constant sea, then the local
quantum fluctuations violating the null energy condition create some islands
with matter and radiation, which under certain conditions might corresponds to
our observable universe. We in this note study the perturbation spectra of
scalar fields not affecting the evolution of background during the fluctuation.
We will examine whether they can be interesting, and responsible for the
structure formation of observable universe.
","[{""version"":""v1"",""created"":""Thu, 29 Dec 2005 03:55:06 GMT""},{""version"":""v2"",""created"":""Tue, 25 Jul 2006 07:26:40 GMT""}]","2009-11-11"
"gr-qc/0512162","Danielsson","Ulf H. Danielsson","Quantum gravitational proton decay at high temperature","3 pages",,,,"gr-qc",,"  One of the most important challenges of contemporary physics is to find
experimental signatures of quantum gravity. It is expected that quantum
gravitational effects lead to proton decay but on time scales way beyond what
is of any relevance to experiments. At non-zero temperatures there are reasons
to believe that the situation is much more favourable. We will argue that at
the temperatures and densities reached at present and future fusion facilities
there is a realistic possibility that proton decay could be detectable.
","[{""version"":""v1"",""created"":""Thu, 29 Dec 2005 14:26:31 GMT""}]","2007-05-23"
"hep-ex/0512072","Daniela Bortoletto","CDF collaboration","A Search for Scalar Bottom Quarks from Gluino Decays in $\bar{p}p$
  Collisions at $\sqrt{s}=1.96$ TeV",,"Phys.Rev.Lett.96:171802,2006","10.1103/PhysRevLett.96.171802","FERMILAB-PUB-05-553-E","hep-ex",,"  We searched for scalar bottom quarks in 156 pb$^{-1}$ of {\bf $\bar{p}p$}
collisions at {\bf $\sqrt{s}=1.96$} TeV recorded by the CDF II experiment at
the Tevatron. Scalar bottom quarks can be produced from gluino decays in
R-parity conserving models of supersymmetry when the mass of the gluino exceeds
that of the scalar bottom quark. Then, a scalar bottom quark can decay into a
bottom quark and a neutralino. To search for this scenario, we investigated
events with large missing transverse energy and at least three jets, two or
more of which were identified as containing a secondary vertex from the
hadronization of $b$ quarks. We found four candidate events, where $2.6\pm 0.7$
are expected from standard model processes, and placed 95% confidence level
lower limits on gluino and scalar bottom quark masses of up to 280 and
$240\gevm$, respectively.
","[{""version"":""v1"",""created"":""Wed, 28 Dec 2005 17:27:35 GMT""}]","2012-08-27"
"hep-ex/0512073","Stefano Bianco","Stefano Bianco (Laboratori Nazionali di Frascati dell'INFN)","Spectroscopy of D Mesons","Invited review talk delivered at HADRON05, Rio de Janeiro (Brasil),
  August 2005.9 pages, 6 figures. Fixed two wrong references",,"10.1063/1.2176465","Frascati preprint LNF-05/28(P)","hep-ex",,"  The scenario of heavy quark meson spectroscopy underwent recently a major
revolution, after the observation of BABAR and CLEO, confirmed by BELLE, of
$\DsJ$ L=1 excited states, and by further evidences by SELEX. These
experimental results have cast doubts on the incarnations of the ideas of Heavy
Quark Effective Theory in heavy quark spectroscopy. I shall review the status
of experimental data, discuss implications and sketch an outlook.
","[{""version"":""v1"",""created"":""Thu, 29 Dec 2005 02:23:01 GMT""},{""version"":""v2"",""created"":""Mon, 9 Jan 2006 15:51:57 GMT""},{""version"":""v3"",""created"":""Sun, 12 Feb 2006 20:26:50 GMT""}]","2009-11-11"
"hep-ex/0512074","G. Bauer","A.Abulencia, D.Acosta, J.Adelman, et al (CDF Collaboration)","Measurement of the Dipion Mass Spectrum in X(3872) -> J/Psi Pi+ Pi-
  Decays","7 pages, 4 figures -- Submitted to Phys. Rev. Lett","Phys.Rev.Lett.96:102002,2006","10.1103/PhysRevLett.96.102002","FERMILAB-PUB-05/535-E","hep-ex",,"  We measure the dipion mass spectrum in X(3872)--> J/Psi Pi+ Pi- decays using
360 pb-1 of pbar-p collisions at 1.96 TeV collected with the CDF II detector.
The spectrum is fit with predictions for odd C-parity (3S1, 1P1, and 3DJ)
charmonia decaying to J/Psi Pi+ Pi-, as well as even C-parity states in which
the pions are from Rho0 decay. The latter case also encompasses exotic
interpretations, such as a D0-D*0Bar molecule. Only the 3S1 and J/Psi Rho
hypotheses are compatible with our data. Since 3S1 is untenable on other
grounds, decay via J/Psi Rho is favored, which implies C=+1 for the X(3872).
Models for different J/Psi-Rho angular momenta L are considered. Flexibility in
the models, especially the introduction of Rho-Omega interference, enable good
descriptions of our data for both L=0 and 1.
","[{""version"":""v1"",""created"":""Thu, 29 Dec 2005 04:32:21 GMT""}]","2010-05-12"
"hep-ph/0512356","Tony Gherghetta","Brian Batell, Tony Gherghetta","Localized U(1) Gauge Fields, Millicharged Particles, and Holography","26 pages, 1 figure","Phys.Rev.D73:045016,2006","10.1103/PhysRevD.73.045016",,"hep-ph hep-th",,"  We consider U(1) gauge fields in a slice of AdS_5 with bulk and boundary mass
parameters. The zero mode of a bulk U(1) gauge field can be localized either on
the UV or IR brane. This leads to a simple model of millicharged particles in
which fermions can have arbitrarily small electric charge. In the electroweak
sector we also discuss phenomenological implications of a localized U(1)_Y
gauge boson. Using the AdS/CFT correspondence we present the 4D holographic
interpretation of the 5D model. In particular the photon is shown to be a
composite particle when localized near the IR brane, whereas it is elementary
when localized near the UV brane. In the dual interpretation the
``millicharge'' results from an elementary fermion coupling to a composite
photon via a vector current with large anomalous dimension.
","[{""version"":""v1"",""created"":""Wed, 28 Dec 2005 18:34:13 GMT""}]","2008-11-26"
"hep-ph/0512357","Alexandre Gavrilik","Alexandre M. Gavrilik","Combined Analysis of Two- and Three-Particle Correlations in q,p-Bose
  Gas Model","Published in SIGMA (Symmetry, Integrability and Geometry: Methods and
  Applications) at http://www.emis.de/journals/SIGMA/","SIGMA 2:074,2006","10.3842/SIGMA.2006.074",,"hep-ph cond-mat.stat-mech hep-th nucl-ex nucl-th",,"  q-deformed oscillators and the q-Bose gas model enable effective description
of the observed non-Bose type behavior of the intercept (""strength"")
$\lambda^{(2)}\equiv C^{(2)}(K,K)-1$ of two-particle correlation function
$C^{(2)}(p_1,p_2)$ of identical pions produced in heavy-ion collisions. Three-
and n-particle correlation functions of pions (or kaons) encode more
information on the nature of the emitting sources in such experiments. And so,
the q-Bose gas model was further developed: the intercepts of n-th order
correlators of q-bosons and the n-particle correlation intercepts within the
q,p-Bose gas model have been obtained, the result useful for quantum optics,
too. Here we present the combined analysis of two- and three-pion correlation
intercepts for the q-Bose gas model and its q,p-extension, and confront with
empirical data (from CERN SPS and STAR/RHIC) on pion correlations. Similar to
explicit dependence of $\lambda^{(2)}$ on mean momenta of particles (pions,
kaons) found earlier, here we explore the peculiar behavior, versus mean
momentum, of the 3-particle correlation intercept $\lambda^{(3)}(K)$. The whole
approach implies complete chaoticity of sources, unlike other joint
descriptions of two- and three-pion correlations using two phenomenological
parameters (e.g., core-halo fraction plus partial coherence of sources).
","[{""version"":""v1"",""created"":""Thu, 29 Dec 2005 02:31:25 GMT""},{""version"":""v2"",""created"":""Tue, 3 Jan 2006 16:30:17 GMT""},{""version"":""v3"",""created"":""Tue, 7 Nov 2006 18:55:30 GMT""},{""version"":""v4"",""created"":""Tue, 7 Nov 2006 23:19:11 GMT""}]","2008-12-19"
