"hep-ph/0512359","Zhenjun Xiao","Zhenjun Xiao, Huihui Cheng and Linxia L\""u","Exclusive $B \to V \gamma$ decays in the T2HDM","RevTex file, 25 pages, 12 eps figures",,,"NJNU-TH-2005-26","hep-ph",,"  By employing the QCD factorization approach for the exclusive $B \to V
\gamma$ decays, we calculated the new physics contributions to the branching
ratios, CP asymmetries, isospin and U-spin symmetry breaking of $B \to
K^*\gamma$ and $B \to \rho \gamma$ decays, induced by the charged Higgs penguin
diagrams appeared in the top-quark two-Higgs-doublet model(T2HDM). Within the
considered parameter space, we found that (a) a charged-Higgs boson with a mass
larger than 300 GeV are always allowed by the date of $B \to V \gamma$ decay,
and such lower limit on $\mhp$ are comparable with those obtained from the
inclusive $B \to X_s \gamma$ decay; (b) the CP asymmetry of $B \to \rho \gamma$
in the T2HDM can be as large as 10% in magnitude and has a strong dependence on
the angle $\theta$ and the CKM angle $\gamma$; (c) the isospin symmetry
breakings of $B \to V \gamma$ decays in the T2HDM are generally small in size:
around 6% for $B \to K^* \gamma$ decay and less than 20% for $B \to \rho
\gamma$ decay; and (d) the U-spin symmetry breaking $\Delta U(K^*,\rho)$ in the
T2HDM is also small in size, only about 8% of the branching ratio $\calb (B \to
\rho^0 \gamma)$.
","[{""version"":""v1"",""created"":""Thu, 29 Dec 2005 11:09:46 GMT""}]","2007-05-23"
"hep-ph/0512360","Frank Deppisch","F. Deppisch (DESY), T. S. Kosmas (Ioannina U.), J. W. F. Valle
  (Valencia U. IFIC)","Enhanced mu-e conversion in nuclei in the inverse seesaw model","17 pages, Latex, 5 figures","Nucl.Phys.B752:80-92,2006","10.1016/j.nuclphysb.2006.06.032","IFIC/05-66","hep-ph nucl-th",,"  We investigate nuclear mu-e conversion in the framework of an effective
Lagrangian arising from the inverse seesaw model of neutrino masses. We
consider lepton flavour violation interactions that arise from short range
(non-photonic) as well as long range (photonic) contributions. Upper bounds for
the LFV parameters characterizing mu-e conversion are derived in the inverse
seesaw model Lagrangian using the available limits on the mu-e conversion
branching ratio, as well as the expected sensitivities of upcoming experiments.
We comment on the relative importance of these two types of contributions and
their relationship with the measured solar neutrino mixing angle theta_12 and
the dependence on theta_13. Finally we show how the LFV mu-e conversion and the
mu -> e gamma rates are strongly correlated in this model.
","[{""version"":""v1"",""created"":""Thu, 29 Dec 2005 11:27:13 GMT""}]","2009-09-17"
"hep-ph/0512361","Eulogio Oset","E. Oset, V.K. Magas and Ramos","On the nature of the Lambda(1405) as a superposition of two states","Contribution to the PANIC05 Conference, Santa Fe, October 2005",,"10.1142/9789812773333_0052","FTUV-05-1229, IFIC-05-1229","hep-ph",,"  We use recent data on the $K^- p \to \pi^0 \pi^0 \Sigma^0$ reaction with the
$\pi^0 \Sigma^0$ mass distribution of forming the $\Lambda(1405)$ with a peak
at 1420 MeV and a relatively narrow width of $\Gamma = 38$ MeV, together with
those of the $\pi^- p \to K^0 \pi \Sigma$ reaction to show that there are two
$\Lambda(1405)$ states instead of one as so far assumed.
","[{""version"":""v1"",""created"":""Thu, 29 Dec 2005 12:10:58 GMT""}]","2017-08-23"
"hep-ph/0512362","Michael Maziashvili","Michael Maziashvili","Particle escape into extra space","3 pages","Phys.Lett.B635:36-38,2006","10.1016/j.physletb.2006.02.032",,"hep-ph",,"  We focus on escape of a spin integer particle the challenge for which is of
course that the corresponding field equation contains the second order time
derivative and, in general, may be problematic for interpreting the
extra-dimensional part of the field as a wave function for the KK modes as it
is usually regarded.
","[{""version"":""v1"",""created"":""Thu, 29 Dec 2005 13:23:08 GMT""},{""version"":""v2"",""created"":""Mon, 20 Feb 2006 09:16:29 GMT""}]","2010-11-05"
"hep-th/0512317","Jean-Paul Blaizot","J.P. Blaizot, R. Mendez-Galain, N. Wschebor","Non perturbative renormalisation group and momentum dependence of
  $n$-point functions (I)","48 pages, 15 figures A few minor corrections. A reference added","Phys.Rev.E74:051116,2006","10.1103/PhysRevE.74.051116","ECT_05_24","hep-th cond-mat.other",,"  We present an approximation scheme to solve the Non Perturbative
Renormalization Group equations and obtain the full momentum dependence of the
$n$-point functions. It is based on an iterative procedure where, in a first
step, an initial ansatz for the $n$-point functions is constructed by solving
approximate flow equations derived from well motivated approximations. These
approximations exploit the derivative expansion and the decoupling of high
momentum modes. The method is applied to the O($N$) model. In leading order,
the self energy is already accurate both in the perturbative and the scaling
regimes. A stringent test is provided by the calculation of the shift $\Delta
T_c$ in the transition temperature of the weakly repulsive Bose gas, a quantity
which is particularly sensitive to all momentum scales. The leading order
result is in agreement with lattice calculations, albeit with a theoretical
uncertainty of about 25%.
","[{""version"":""v1"",""created"":""Wed, 28 Dec 2005 17:17:12 GMT""},{""version"":""v2"",""created"":""Thu, 23 Mar 2006 07:52:27 GMT""}]","2008-11-26"
"hep-th/0512330","Ruslan Metsaev","R.R.Metsaev","Light-cone formulation of conformal field theory adapted to AdS/CFT
  correspondence","12 pages, LaTeX-2e, v2: typos corrected, following Phys.Lett.B
  referee's advice the title is changed","Phys.Lett.B636:227-233,2006","10.1016/j.physletb.2006.03.052","FIAN/TD/11-05","hep-th",,"  Light-cone formulation of conformal field theory in space-time of arbitrary
dimension is developed. Conformal fundamental and shadow fields with arbitrary
conformal dimension and arbitrary spin are studied. Representation of conformal
algebra generators on space of conformal fundamental and shadow fields in terms
of spin operators which enter in light-cone gauge formulation of field dynamics
in AdS space is found. As an example of application of light-cone formalism we
discuss AdS/CFT correspondence for massive arbitrary spin AdS fields and
corresponding boundary CFT fields at the level of two point function.
","[{""version"":""v1"",""created"":""Wed, 28 Dec 2005 17:10:39 GMT""},{""version"":""v2"",""created"":""Thu, 1 Jun 2006 15:40:15 GMT""}]","2008-11-26"
"hep-th/0512331","Dionisio Bazeia","D. Bazeia, F.A. Brito, L. Losano","Relaxing to a three dimensional brane junction","RevTex, 5 pages; version to appear in Europhys. Lett","Europhys.Lett.D76:374-380,2006","10.1209/epl/i2006-10292-4",,"hep-th gr-qc hep-ph",,"  We suggest a mechanism which leads to 3+1 space-time dimensions. The Universe
assumed to have nine spatial dimensions is regarded as a special nonlinear
oscillatory system -- a kind of Einstein solid. There are p-brane solutions
which manifest as phase oscillations separating different phase states. The
presence of interactions allows for bifurcations of higher dimensional spaces
to lower dimensional ones in the form of brane junctions. We argue this is a
natural way to select lower dimensions.
","[{""version"":""v1"",""created"":""Wed, 28 Dec 2005 18:37:29 GMT""},{""version"":""v2"",""created"":""Sat, 4 Mar 2006 14:30:55 GMT""},{""version"":""v3"",""created"":""Fri, 15 Sep 2006 13:23:14 GMT""}]","2011-01-25"
"hep-th/0512332","Erick J. Weinberg","Erick J. Weinberg","New bounce solutions and vacuum tunneling in de Sitter spacetime","7 pages, 3 comments","Proceedings of the 11th International Symposium on Particles,
  Strings and Cosmology (PASCOS 2005), Gyeongju, Korea, 30 May - 4 Jun 2005,
  eds. K.Choi, J.E.Kim, and D.Son, AIP Conf. Proc. Vol. 805, p259","10.1063/1.2149708","CU-TP-1133","hep-th",,"  I describe a class of oscillating bounce solutions to the Euclidean field
equations for gravity coupled to a scalar field theory with multiple vacua. I
discuss their implications for vacuum tunneling transitions and for elucidating
the thermal nature of de Sitter spacetime.
","[{""version"":""v1"",""created"":""Thu, 29 Dec 2005 02:25:22 GMT""}]","2009-11-11"
"hep-th/0512333","Arvind Rajaraman","Arvind Rajaraman","On the supersymmetric completion of the $R^4$ term in M-theory","14 pages, latex","Phys.Rev.D74:085018,2006","10.1103/PhysRevD.72.125008",,"hep-th",,"  We examine the question of finding the supersymmetric completion of the $R^4$
term in M-theory. Using superfield methods, we present an eight derivative
action in eight dimensions that has 32 preserved supersymmetries. We show also
that this action has a hidden eleven-dimensional Lorentz invariance. It can
thus be uplifted to give the complete set of bosonic terms in the M-theory
eight derivative action.
","[{""version"":""v1"",""created"":""Thu, 29 Dec 2005 06:15:38 GMT""}]","2008-11-26"
"hep-th/0512334","Bhabani Prasad Mandal Dr.","R. P. Malik (CAS, Phys. Deptt., BHU) and Bhabani Prasad Mandal
  (Banaras Hindu University)","Augmented Superfield Approach To Exact Nilpotent Symmetries For Matter
  Fields In Non-Abelian Theory","LaTeX file, 19 pages, journal-version","Eur.Phys.J.C47:219-226,2006","10.1140/epjc/s2006-02542-6",,"hep-th",,"  We derive the nilpotent (anti-)BRST symmetry transformations for the Dirac
(matter) fields of an interacting four (3+1)-dimensional 1-form non-Abelian
gauge theory by applying the theoretical arsenal of augmented superfield
formalism where (i) the horizontality condition, and (ii) the equality of a
gauge invariant quantity, on the six (4, 2)-dimensional supermanifold, are
exploited together. The above supermanifold is parameterized by four bosonic
spacetime coordinates x^\mu (with \mu = 0,1,2,3) and a couple of Grassmannian
variables \theta and \bar{\theta}. The on-shell nilpotent BRST symmetry
transformations for all the fields of the theory are derived by considering the
chiral superfields on the five (4, 1)-dimensional super sub-manifold and the
off-shell nilpotent symmetry transformations emerge from the consideration of
the general superfields on the full six (4, 2)-dimensional supermanifold.
Geometrical interpretations for all the above nilpotent symmetry
transformations are also discussed in the framework of augmented superfield
formalism.
","[{""version"":""v1"",""created"":""Thu, 29 Dec 2005 08:33:45 GMT""},{""version"":""v2"",""created"":""Fri, 17 Mar 2006 07:59:14 GMT""},{""version"":""v3"",""created"":""Thu, 27 Jul 2006 05:47:22 GMT""}]","2009-01-07"
"hep-th/0512336","Andrew Hodges","Andrew Hodges","Twistor diagrams for all tree amplitudes in gauge theory: a
  helicity-independent formalism","18 pages, pdf only. Minor corrections made and citation added,
  January 2006",,,,"hep-th",,"  We give a new formalism for pure gauge-theoretic scattering at tree-amplitude
level. We first describe a generalization of the Britto-Cachazo-Feng recursion
relation in which a significant restriction is removed. We then use twistor
diagrams to express all tree amplitudes in a form independent of helicity. A
formal procedure involving anticommuting elements is required. We illustrate
the results with specific calculations of interest, up to 8 interacting fields.
","[{""version"":""v1"",""created"":""Thu, 29 Dec 2005 13:00:18 GMT""},{""version"":""v2"",""created"":""Wed, 11 Jan 2006 14:19:20 GMT""}]","2007-05-23"
"hep-th/0512337","Roberto Tateo","Patrick Dorey, Anna Lishman, Chaiho Rim, Roberto Tateo","Reflection factors and exact g-functions for purely elastic scattering
  theories","45 pages, 7 figures. v2: minor typos corrected, 3 new references and
  some further discussion of the massless boundary flows included","Nucl.Phys.B744:239-276,2006","10.1016/j.nuclphysb.2006.02.043","DCPT-05/63","hep-th cond-mat.stat-mech math-ph math.MP",,"  We discuss reflection factors for purely elastic scattering theories and
relate them to perturbations of specific conformal boundary conditions, using
recent results on exact off-critical g-functions. For the non-unitary cases, we
support our conjectures using a relationship with quantum group reductions of
the sine-Gordon model. Our results imply the existence of a variety of new
flows between conformal boundary conditions, some of them driven by
boundary-changing operators.
","[{""version"":""v1"",""created"":""Thu, 29 Dec 2005 13:02:30 GMT""},{""version"":""v2"",""created"":""Tue, 24 Jan 2006 15:55:15 GMT""}]","2008-11-26"
"hep-th/0512338","Patricio Gaete","Patricio Gaete and Clovis Wotzasek","Physical and mathematical evidences for a negative-rank tensor","7 pages","Phys.Lett.B634:545-551,2006","10.1016/j.physletb.2006.02.027","USM-TH-178","hep-th",,"  We propose and study the properties of a new potential demanded by the
self-consistency of the duality scheme in electromagnetic-like field theories
of totally anti-symmetric tensors in diverse dimensions. Physical implications
of this new potential is manifest under the presence of scalar condensates in
the Julia-Toulouse mechanism for the nucleation of topological defects with
consequences for the confinement phenomenon.
","[{""version"":""v1"",""created"":""Thu, 29 Dec 2005 14:00:07 GMT""}]","2008-11-26"
"hep-th/0512339","Brihaye Yves","Y. Brihaye, T. Delsate","Skyrmion and Skyrme-Black holes in de Sitter spacetime","11 pages, 4 figures","Mod.Phys.Lett.A21:2043-2054,2006","10.1142/S0217732306021426",,"hep-th",,"  Numerical arguments are presented for the existence of regular and black hole
solutions of the Einstein-Skyrme equations with a positive cosmological
constant. These classical configurations approach asymptotically the de Sitter
spacetime. The main properties of the solutions and the differences with
respect to the asymptotically flat ones are discussed. It particular our
results suggest that, for a positive cosmological constant, the mass evaluated
as timelike infinity in infinite. Special emphasis is set to De Sitter black
holes Skyrmions which display two horizons.
","[{""version"":""v1"",""created"":""Thu, 29 Dec 2005 15:27:13 GMT""},{""version"":""v2"",""created"":""Fri, 19 May 2006 11:14:33 GMT""}]","2009-11-11"
"math-ph/0512091","Tobias Schlegelmilch","Tobias Schlegelmilch","Local Scattering Operators for P(\phi)_2 Models and the Time-dependent
  Schr\""odinger Equation","Ph.D. thesis, 121 pages",,,"DESY-THESIS-2005-036","math-ph math.MP",,"  We establish the existence of Bogoliubov's local scattering operators for
P(\phi)_2 models of constructive quantum field theory in a nonperturbative way.
To this end, we use the technique of evolution semigroups to prove a new result
on wellposedness of the Cauchy problem for the time-dependent Schr\""odinger
equation under very general assumptions.
","[{""version"":""v1"",""created"":""Thu, 29 Dec 2005 02:29:16 GMT""}]","2007-05-23"
"math-ph/0512092","Milena Radnovic","Vladimir Dragovic and Milena Radnovic","On Closed Geodesics on Ellipsoids","9 pages",,,,"math-ph math.AG math.MP",,"  Closed geodesic lines on an ellipsoid in d-dimensional Euclidean space are
considered. Explicit algebro-geometric condition for closedness of such a
geodesic is given. The obtained condition is discussed in light of
theta-functions theory and compared with some recent related results.
","[{""version"":""v1"",""created"":""Thu, 29 Dec 2005 11:47:41 GMT""}]","2007-05-23"
"math/0512592","Jason Behrstock","Jason Behrstock, Cornelia Drutu, Lee Mosher","Thick metric spaces, relative hyperbolicity, and quasi-isometric
  rigidity","To appear in Mathematische Annalen","Mathematische Annalen, vol. 344, (2009), 543--595.",,,"math.GT math.GR","http://arxiv.org/licenses/nonexclusive-distrib/1.0/","  We study the geometry of nonrelatively hyperbolic groups. Generalizing a
result of Schwartz, any quasi-isometric image of a non-relatively hyperbolic
space in a relatively hyperbolic space is contained in a bounded neighborhood
of a single peripheral subgroup. This implies that a group being relatively
hyperbolic with nonrelatively hyperbolic peripheral subgroups is a
quasi-isometry invariant. As an application, Artin groups are relatively
hyperbolic if and only if freely decomposable.
  We also introduce a new quasi-isometry invariant of metric spaces called
metrically thick, which is sufficient for a metric space to be nonhyperbolic
relative to any nontrivial collection of subsets. Thick finitely generated
groups include: mapping class groups of most surfaces; outer automorphism
groups of most free groups; certain Artin groups; and others. Nonuniform
lattices in higher rank semisimple Lie groups are thick and hence nonrelatively
hyperbolic, in contrast with rank one which provided the motivating examples of
relatively hyperbolic groups. Mapping class groups are the first examples of
nonrelatively hyperbolic groups having cut points in any asymptotic cone,
resolving several questions of Drutu and Sapir about the structure of
relatively hyperbolic groups. Outside of group theory, Teichmuller spaces for
surfaces of sufficiently large complexity are thick with respect to the
Weil-Peterson metric, in contrast with Brock--Farb's hyperbolicity result in
low complexity.
","[{""version"":""v1"",""created"":""Thu, 29 Dec 2005 06:38:46 GMT""},{""version"":""v2"",""created"":""Mon, 2 Jan 2006 16:43:25 GMT""},{""version"":""v3"",""created"":""Mon, 23 Jan 2006 21:07:51 GMT""},{""version"":""v4"",""created"":""Sat, 1 Jul 2006 05:03:52 GMT""},{""version"":""v5"",""created"":""Sat, 15 Nov 2008 02:15:21 GMT""}]","2010-04-13"
"math/0512623","Antun Milas","Antun Milas, Eric Mortenson, and Ken Ono","Number theoretic properties of Wronskians of Andrews-Gordon series","13 pages, AMS-LaTeX","International Journal of Number Theory, 4 (2008), 323-337",,,"math.QA math.NT",,"  For positive integers $1\leq i\leq k$, we consider the arithmetic properties
of quotients of Wronskians in certain normalizations of the Andrews-Gordon
$q$-series $$ \prod_{1\leq n\not \equiv 0,\pm i\pmod{2k+1}}\frac{1}{1-q^n}. $$
This study is motivated by their appearance in conformal field theory, where
these series are essentially the irreducible characters of $(2,2k+1)$ Virasoro
minimal models. We determine the vanishing of such Wronskians, a result whose
proof reveals many partition identities. For example, if $P_{b}(a;n)$ denotes
the number of partitions of $n$ into parts which are not congruent to $0, \pm
a\pmod b$, then for every positive integer $n$ we have $$ P_{27}(12;
n)=P_{27}(6;n-1) + P_{27}(3;n-2). $$ We also show that these quotients classify
supersingular elliptic curves in characteristic $p$. More precisely, if
$2k+1=p$, where $p\geq 5$ is prime, and the quotient is non-zero, then it is
essentially the locus of characteristic $p$ supersingular $j$-invariants in
characteristic $p$.
","[{""version"":""v1"",""created"":""Wed, 28 Dec 2005 16:05:14 GMT""}]","2008-04-23"
"math/0512624","Murray Gerstenhaber","Murray Gerstenhaber","A selection principle in deformation quantization",,,,,"math.QA math-ph math.MP",,"  Deformation quantization produces families of mathematically equivalent
quantization procedures from which one must select the physically meaningful
ones. As a selection principle we propose that the procedure must allow enough
`observable' energy distributions, i.e., ones for which no pure quantum state
will appear with negative probability and must further have the property that
for these the uncertainty in the probability distribution of the quantum states
must not exceed that of the original distribution. For the simple harmonic
oscillator we show that this allows only the classic Groenewold-Moyal
(skew-symmetric) form.
","[{""version"":""v1"",""created"":""Wed, 28 Dec 2005 19:02:18 GMT""}]","2007-05-23"
"math/0512625","Simon Donaldson","S. K. Donaldson","Some numerical results in complex differential geometry",,,,,"math.DG math.NA",,"  The first part of this paper discusses general procedures for finding
numerical approximations to distinguished Kahler metrics, such as Calabi-Yau
metrics, on complex projective manifolds. These procedures are closely related
to ideas from Geometric Invariant Theory, and to the asymptotics of high powers
of positive line bundles. In the core of the paper these ideas are illustrated
by detailed numerical results for a particular K3 surface.
","[{""version"":""v1"",""created"":""Wed, 28 Dec 2005 18:38:38 GMT""}]","2007-05-23"
"math/0512626","Roberto Pinciroli","Roberto Pinciroli","Countable Borel equivalence relations and quotient Borel spaces","15 pages",,,,"math.LO",,"  We consider countable Borel equivalence relations on quotient Borel spaces.
We prove a generalization of the Feldman-Moore representation theorem, but
provide some examples showing that other very simple properties of countable
equivalence relations on standard Borel spaces may fail in the context of
nonsmooth quotients.
","[{""version"":""v1"",""created"":""Wed, 28 Dec 2005 18:44:59 GMT""}]","2007-05-23"
"math/0512627","Mark Burgin","M. Burgin","Fuzzy Continuity in Scalable Topology",,,,,"math.GN math-ph math.MP",,"  In this work, topological spaces are enriched by additional structures in
order to give a more realistic representation of real life phenomena and
computational processes and at the same time, to provide for utilization of the
powerful technique developed in topology. The suggested approach is based on
the concept of a discontinuity structure or scale Q in a topological space X.
This structure serves as a scale for the initial topology on X. Problems of
science and engineering need such a scale because all measurements and the
majority of computations are performed in a definite scale and problems of
scalability are important both for physical theories and computational
algorithms. Taking a mapping of a topological space X with the discontinuity
structure Q into a topological space Y with a discontinuity structure R, we
define (Q,R)-continuity, weak (Q,R)-continuity, and R-continuity of this
mapping. Fuzzy continuous functions, which are studied in neoclassical
analysis, are examples of R-continuous mappings. Different properties of
scales, Q-open, Q-closed sets, and (Q,R)-continuous mappings are obtained.
","[{""version"":""v1"",""created"":""Wed, 28 Dec 2005 19:43:52 GMT""}]","2007-05-23"
"math/0512628","Carlos Castano-Bernard","Carlos Castano-Bernard","On the 2-divisibility of certain Heenger points","10 pages, 3 tables",,,,"math.NT",,"  Let E be an elliptic curve defined over the rationals and let N be its
conductor. Assume N is prime. In this paper we give numerical evidence that
suggests some conjectures on the 2-divisibility of certain sums of Heenger
points on E of discriminant D dividing 4N. One of these conjectures suggests a
possible link between the parity of the eigenvalue a_A(2) and the parity of the
Shafarevich-Tate group of certain elliptic curves A of square conductor.
","[{""version"":""v1"",""created"":""Wed, 28 Dec 2005 20:10:50 GMT""}]","2007-05-23"
"math/0512629","Delfim F. M. Torres","Abderrahmane El Hachimi, Moulay Rchid Sidi Ammi, Delfim F. M. Torres","Existence and uniqueness of solutions for a nonlocal parabolic
  thermistor-type problem","To be presented at the ""13th IFAC Workshop on Control Applications of
  Optimisation"", 26-28 April 2006, Paris - Cachan, France. Accepted
  (19-12-2005) for the Proceedings, IFAC publication, Elsevier Ltd, Oxford, UK","Int. J. Tomogr. Stat., Vol. 5, No. W07, 2007, pp. 150--154.",,"CM05/I-55","math.AP",,"  In this paper we prove existence and uniqueness of solutions to a nonlocal
parabolic problem which generalizes the electric heating problem of a
conducting body.
","[{""version"":""v1"",""created"":""Thu, 29 Dec 2005 02:11:32 GMT""}]","2007-05-23"
"math/0512630","Jozef H. Przytycki","Jozef H. Przytycki","Khovanov Homology: categorification of the Kauffman bracket relation","79 pages, 73 figures, Chapter X of the Book ""KNOTS: From
  combinatorics of knot diagrams to combinatorial topology based on knots",,,,"math.GT math.AT",,"  Khovanov homology offers a nontrivial generalization of Jones polynomial of
links in R^3 (and of Kauffman bracket skein module of some 3-manifolds). In
this chapter (Chapter X) we define Khovanov homology of links in R^3 and
generalize the construction into links in an I-bundle over a surface. We use
Viro's approach to construction of Khovanov homology and utilize the fact that
one works with unoriented diagrams (unoriented framed links) in which case
there is a simple description of Khovanov long exact sequence of homology.
Khovanov homology, over the field Q, is a categorification of the Jones
polynomial (i.e. one represents the Jones polynomial as the generating function
of Euler characteristics). However, for integral coefficients Khovanov homology
almost always has torsion. The first part of the chapter is devoted to the
construction of torsion in Khovanov homology. In the second part we analyze the
thickness of Khovanov homology and reduced Khovanov homology. In the last part
we generalize Khovanov homology to links in $I$-bundles over surfaces and
demonstrate that for oriented surfaces we categorify the element of the
Kauffman bracket skein module represented by the considered link.
","[{""version"":""v1"",""created"":""Thu, 29 Dec 2005 02:12:12 GMT""}]","2007-05-23"
