"cond-mat/0502286","Ulrich Wulf","U. Wulf and V. V. Skalozub","Pulse Propagation in Resonant Tunneling II","10 pages, 5 figures, continuation of cond-mat/0409396",,,,"cond-mat.mes-hall",,"  We consider the analytically solvable model of a Gaussian pulse tunneling
through a transmission resonance with a general Fano characteristic. It is
demonstrated that the transmitted pulse contains enough information to
determine uniquely all parameters defining the Fano resonance. This is in
contrast to the measurement of the static conductance. Our analytical model is
in agreement with numerical data published recently for the limit of a
Breit-Wigner resonance. We identify two opposite pulse propagation regimes: if
the resonance is broad compared to the energetic width of the incident Gaussian
pulse a weakly deformed and slightly delayed transmitted Gaussian pulse is
found. In the opposite limit of a narrow resonance the dying out of the
transmitted pulse is dominated by the slow exponential decay characteristic of
a quasi-bound state with a long life time. In this regime we find
characteristic interference oscillations.
","[{""version"":""v1"",""created"":""Fri, 11 Feb 2005 15:19:59 GMT""}]","2007-05-23"
"cs/0502054","Ion Mandoiu","Ion I. Mandoiu, Claudia Prajescu, Dragos Trinca","Improved Tag Set Design and Multiplexing Algorithms for Universal Arrays",,,,,"cs.DS",,"  In this paper we address two optimization problems arising in the design of
genomic assays based on universal tag arrays. First, we address the universal
array tag set design problem. For this problem, we extend previous formulations
to incorporate antitag-to-antitag hybridization constraints in addition to
constraints on antitag-to-tag hybridization specificity, establish a
constructive upper bound on the maximum number of tags satisfying the extended
constraints, and propose a simple greedy tag selection algorithm. Second, we
give methods for improving the multiplexing rate in large-scale genomic assays
by combining primer selection with tag assignment. Experimental results on
simulated data show that this integrated optimization leads to reductions of up
to 50% in the number of required arrays.
","[{""version"":""v1"",""created"":""Thu, 10 Feb 2005 20:20:53 GMT""}]","2007-05-23"
"gr-qc/0502046","Ian G. Moss","M. Giammatteo and I.G. Moss","Gravitational quasinormal modes for Kerr Anti-de Sitter black holes","20 pages, 13 figures, ReVTeX","Class.Quant.Grav.22:1803-1824,2005","10.1088/0264-9381/22/9/021",,"gr-qc",,"  We investigate the quasinormal modes for gravitational perturbations of
rotating black holes in four dimensional Anti-de Sitter (AdS) spacetime. The
study of the quasinormal frequencies related to these modes is relevant to the
AdS/CFT correspondence. Although results have been obtained for Schwarzschild
and Reissner-Nordstrom AdS black holes, quasinormal frequencies of Kerr-AdS
black holes are computed for the first time. We solve the Teukolsky equations
in AdS spacetime, providing a second order and a Pade approximation for the
angular eigenvalues associated to the Teukolsky angular equation. The
transformation theory and the Regge-Wheeler-Zerilli equations for Kerr-AdS are
obtained.
","[{""version"":""v1"",""created"":""Thu, 10 Feb 2005 16:19:45 GMT""},{""version"":""v2"",""created"":""Fri, 11 Feb 2005 10:07:45 GMT""}]","2010-11-19"
"gr-qc/0502047","B. V. Ivanov","Boyko V. Ivanov","On the gravitational field induced by static electromagnetic sources","18 pages, Revtex4",,,,"gr-qc",,"  It is argued that static electromagnetic sources induce
Weyl-Majumdar-Papapetrou solutions for the spacetime metric. The acceleration
in such fields has a term many orders of magnitude stronger than usual
perturbative terms. Two electrostatic and two magnetostatic examples are given.
","[{""version"":""v1"",""created"":""Thu, 10 Feb 2005 19:18:49 GMT""}]","2007-05-23"
"gr-qc/0502048","John W. Barrett","John W. Barrett","Feynman diagams coupled to three-dimensional quantum gravity","7 pages. v2: minor corrections, added ref","Class.Quant.Grav. 23 (2006) 137-142","10.1088/0264-9381/23/1/008",,"gr-qc hep-th",,"  A framework for quantum field theory coupled to three-dimensional quantum
gravity is proposed. The coupling with quantum gravity regulates the Feynman
diagrams. One recovers the usual Feynman amplitudes in the limit as the
cosmological constant tends to zero.
","[{""version"":""v1"",""created"":""Thu, 10 Feb 2005 20:11:54 GMT""},{""version"":""v2"",""created"":""Fri, 11 Feb 2005 15:01:29 GMT""}]","2009-11-11"
"gr-qc/0502049","Yavuz Nutku","Y. Nutku","Electrovac $pp$-waves",,"Class.Quant.Grav. 22 (2005) L43-L46","10.1088/0264-9381/22/9/L01",,"gr-qc",,"  New exact solutions of the Einstein-Maxwell field equations that describe
$pp$-waves are presented.
","[{""version"":""v1"",""created"":""Thu, 10 Feb 2005 20:17:40 GMT""},{""version"":""v2"",""created"":""Sat, 19 Feb 2005 09:02:16 GMT""}]","2009-11-11"
"gr-qc/0502050","Nikolai V. Mitskievich","Vladimir N. Efremov, Nikolai V. Mitskievich, Alfonso M. Hernandez
  Magdaleno and Ramona Serrano Bautista","Topological gravity on plumbed V-cobordisms","29 pages","Class.Quant.Grav. 22 (2005) 3725-3744","10.1088/0264-9381/22/17/022",,"gr-qc",,"  An ensemble of cosmological models based on generalized BF-theory is
constructed where the role of vacuum (zero-level) coupling constants is played
by topologically invariant rational intersection forms (cosmological-constant
matrices) of 4-dimensional plumbed V-cobordisms which are interpreted as
Euclidean spacetime regions. For these regions describing topology changes, the
rational and integer intersection matrices are calculated. A relation is found
between the hierarchy of certain elements of these matrices and the hierarchy
of coupling constants of the universal (low-energy) interactions.
  PACS numbers: 0420G, 0240, 0460
","[{""version"":""v1"",""created"":""Fri, 11 Feb 2005 05:30:15 GMT""},{""version"":""v2"",""created"":""Sat, 12 Feb 2005 00:21:03 GMT""}]","2009-11-11"
"gr-qc/0502051","Paolo Zampetti","Dino Boccaletti, Francesco Catoni, Roberto Cannata, Paolo Zampetti","Integrating the geodesic equations in the Schwarzschild and Kerr
  space-times using Beltrami's ""geometrical"" method","12 pages; corrected typos, journal-ref added","General Relativity and Gravitation, 37(12) (2005) 2261","10.1007/s10714-005-0203-z",,"gr-qc",,"  We revisit a little known theorem due to Beltrami, through which the
integration of the geodesic equations of a curved manifold is accomplished by a
method which, even if inspired by the Hamilton-Jacobi method, is purely
geometric. The application of this theorem to the Schwarzschild and Kerr
metrics leads straightforwardly to the general solution of their geodesic
equations. This way of dealing with the problem is, in our opinion, very much
in keeping with the geometric spirit of general relativity. In fact, thanks to
this theorem we can integrate the geodesic equations by a geometrical method
and then verify that the classical conservation laws follow from these
equations.
","[{""version"":""v1"",""created"":""Fri, 11 Feb 2005 10:20:47 GMT""},{""version"":""v2"",""created"":""Thu, 3 Apr 2008 12:57:01 GMT""}]","2008-04-03"
"gr-qc/0502052","Leor Barack","Leor Barack and Curt Cutler","Confusion Noise from Extreme-Mass-Ratio Inspirals","6 pages, 6 eps figures. A summary version of gr-qc/0409010; based on
  a talk delivered at the 5th International LISA Symposium (Noordwijk, July
  2004)",,,,"gr-qc",,"  Captures of compact objects (COs) by massive black holes in galactic nuclei
(aka ``extreme-mass-ratio inspirals'') will be an important source for LISA.
However, a large fraction of captures will not be individually resolvable, and
so will constitute a source of ``confusion noise,'' obscuring other types of
sources. Here we estimate the shape and overall magnitude of the spectrum of
confusion noise from CO captures. The overall magnitude depends on the capture
rates, which are rather uncertain, so we present results for a plausible range
of rates. We show that the impact of capture confusion noise on the total LISA
noise curve ranges from insignificant to modest, depending on these rates.
Capture rates at the high end of estimated ranges would raise LISA's overall
(effective) noise level by at most a factor $\sim 2$. While this would somewhat
decrease LISA's sensitivity to other classes of sources, it would be a pleasant
problem for LISA to have, overall, as it would also imply that detection rates
for CO captures were at nearly their maximum possible levels (given LISA's
baseline design).
","[{""version"":""v1"",""created"":""Fri, 11 Feb 2005 11:29:01 GMT""}]","2007-05-23"
"gr-qc/0502053","Eugen Radu","Yves Brihaye and Eugen Radu","Nutty dyons","12 pages, 4 figures, discussion extended, typos corrected","Phys.Lett. B615 (2005) 1-13","10.1016/j.physletb.2005.04.016",,"gr-qc hep-th",,"  We argue that the Einstein-Yang-Mills-Higgs theory presents nontrivial
solutions with a NUT charge. These solutions approach asymptotically the
Taub-NUT spacetime and generalize the known dyon black hole configurations. The
main properties of the solutions and the differences with respect to the
asymptotically flat case are discussed. We find that a nonabelian magnetic
monopole placed in the field of gravitational dyon necessarily acquires an
electric field, while the magnetic charge may take arbitrary values.
","[{""version"":""v1"",""created"":""Fri, 11 Feb 2005 12:11:07 GMT""},{""version"":""v2"",""created"":""Wed, 6 Apr 2005 09:09:24 GMT""}]","2009-11-11"
"gr-qc/0502054","Gianluca Gemme","R. Ballantini, Ph. Bernard, S. Calatroni, E. Chiaveri, A. Chincarini,
  R.P. Croce, S. Cuneo, V. Galdi, G. Gemme, R. Losito, R. Parodi, E. Picasso,
  V. Pierro, I.M. Pinto, A. Podesta', R. Vaccarone","Microwave apparatus for gravitational waves observation","42 pages, 28 figures","INFN Technical Note INFN/TC-05/05, (2005)",,,"gr-qc",,"  In this report the theoretical and experimental activities for the
development of superconducting microwave cavities for the detection of
gravitational waves are presented.
","[{""version"":""v1"",""created"":""Fri, 11 Feb 2005 13:14:38 GMT""}]","2007-05-23"
"hep-ph/0502094","Iain W. Stewart","Christian W. Bauer, Dan Pirjol, Ira Z. Rothstein, Iain W. Stewart","On Differences Between SCET and QCDF for B->pi pi Decays","7 pages","Phys.Rev. D72 (2005) 098502","10.1103/PhysRevD.72.098502","CALT 68-2540, MIT-CTP 3603","hep-ph",,"  We give a detailed description of the differences between the factorization
and results derived from SCET and QCDF for decays B -> M1 M2. This serves as a
reply to a comment about our work ""B-> M1 M2: Factorization, charming penguins,
strong phases, and polarization"" [1] made by the authors in [2]. We disagree
with their criticisms.
","[{""version"":""v1"",""created"":""Thu, 10 Feb 2005 16:03:35 GMT""}]","2013-05-29"
"hep-ph/0502095","Alessandro Strumia","Guido Marandella, Christian Schappacher, Alessandro Strumia","Supersymmetry and precision data after LEP2","16 pages","Nucl.Phys.B715:173-189,2005","10.1016/j.nuclphysb.2005.03.001",,"hep-ph",,"  We study one loop supersymmetric corrections to precision observables. Adding
LEP2 e ebar --> f fbar cross sections to the data-set removes previous hints
for SUSY and the resulting constraints are in some cases stronger than direct
bounds on sparticle masses. We consider specific models: split SUSY, CMSSM,
gauge mediation, anomaly and radion mediation. Beyond performing a complete
one-loop analysis, we also develop a simple approximation, based on the Shat,
That, W, Y `universal' parameters. SUSY corrections give W,Y > 0 and mainly
depend on the left-handed slepton and squark masses, on M_2 and on mu.
","[{""version"":""v1"",""created"":""Thu, 10 Feb 2005 18:34:08 GMT""}]","2009-10-09"
"hep-ph/0502096","Alessandro Strumia","Guido Marandella, Christian Schappacher, Alessandro Strumia","Little-Higgs corrections to precision data after LEP2","16 pages. Final version: new model proposed and analyzed","Phys.Rev.D72:035014,2005","10.1103/PhysRevD.72.035014",,"hep-ph",,"  We reconsider little-Higgs corrections to precision data. In five models with
global symmetries SU(5), SU(6), SO(9) corrections are (although not explicitly)
of `universal' type. We get simple expressions for the Shat, That, W, Y
parameters, which summarize all effects. In all models Shat > (W+Y)/2 and That,
W, Y\ge 0. Results differ from previous analyses, which are sometimes
incomplete, sometimes incorrect, and because we add LEP2 e ebar --> f fbar
cross sections to the data set. Depending on the model the constraint on f
ranges between 2 and 20 TeV.
  We next study the `simplest' little-Higgs model (and propose a new related
model) which is not `universal' and affects precision data due to the presence
of an extra Z' vector. By restricting the data-set to the most accurate
leptonic data we show how corrections to precision data generated by a generic
Z' can be encoded in four effective Shat, That, W, Y parameters, giving their
expressions.
","[{""version"":""v1"",""created"":""Thu, 10 Feb 2005 18:34:08 GMT""},{""version"":""v2"",""created"":""Mon, 13 Jun 2005 13:23:48 GMT""}]","2009-10-09"
"hep-ph/0502102","Piyabut Burikham","Piyabut Burikham","Remarks on Limits on String Scale from Proton Decay and Low-Energy
  amplitudes in Braneworld Scenario","14 pages","JHEP 0502:030,2005","10.1088/1126-6708/2005/02/030","MADPH-05-1414","hep-ph",,"  We discuss IR limit of four-fermion scattering amplitudes in braneworld
models including intersecting-branes and SUSY SU(5) GUT version of it. With
certain compactification where instanton effect is negligible, grand
unification condition in D6-D6 intersecting-branes scenario subject to
experimental constraint on proton decay provides possibility for upper limit on
the string scale, $M_S$, through relationship between the string coupling,
$g_s$, and the string scale. We discuss how IR divergence is related to number
of twisted fields we have to introduce into intersection region and how it can
change IR behaviour of tree-level amplitudes in various intersecting-branes
models. Using number of twisted fields, we identify some intersecting-branes
models whose tree-level amplitudes are purely stringy in nature and
automatically proportional to $g_s/M^2_{S}$ at low energy. They are
consequently suppressed by the string scale. For comparison, we also derive
limit on the lower bound of the string scale from experimental constraint on
proton decay induced from purely stringy contribution in the coincident-branes
model, the limit is about $10^5$ TeV.
","[{""version"":""v1"",""created"":""Thu, 10 Feb 2005 17:41:40 GMT""}]","2010-02-03"
"hep-ph/0502103","Gennady Kozlov","G.A.Kozlov","New features of two-particle correlations","10 pages, 1 figure","Phys.Part.Nucl. 36 (2005) S190-S197",,,"hep-ph",,"  We show that a recently proposed derivation of Bose-Einstein correlations
(BEC) by means of thermal Quantum Field Theory, supplemented by operator-field
evolution of Langevin type, allows a deeper understanding of a possible
coherent behaviour of the emitting source and a clear identification of the
origin of the observed shape of the 2-particle BEC function $C_2(Q)$. We
explain the origin of the dependence of the measured correlation radius on the
hadron mass. The lower bound of the particle source size is estimated.
","[{""version"":""v1"",""created"":""Thu, 10 Feb 2005 18:46:28 GMT""}]","2007-05-23"
"hep-ph/0502104","Bennie F. L. Ward","B.F.L. Ward (1) ((1) Department of Physics, Baylor University, Waco,
  TX, USA)","Black Holes and Massive Elementary Particles in Resummed Quantum Gravity","11 pages, 1 figure; to appear in ""Black Holes: Research and
  Development"", 2005",,,"BU-HEPP-04-06","hep-ph",,"  Einstein's general theory of relativity poses many problems to the quantum
theory of point particle fields. Among them is the fate of a massive point
particle. Since its rest mass exists entirely within its Schwarzschild radius,
in the classical solutions of Einstein's theory, the respective system should
be a black hole. We address this issue using exact results in a new approach to
quantum gravity based upon well-tested resummation methods in point particle
quantum field theory. We show that the classical conclusion is obviated by
quantum loop effects. We show that our new approach already passes two
theoretical checks with the published literature; for, it reproduces known
results on the one-loop correction to the graviton self-energy in scaler matter
coupled to Einstein's gravity as analyzed by 't Hooft and Veltman and it is
consistent with the asymptotic safety results of Bonnanno and Reuter on the
behavior of Newton's constant in the deep Euclidean regime. Indeed, our
approach is consistent with the black hole phenomenology of the latter authors,
including their results on the final state of the Hawking radiation for an
originally massive black hole. Further black hole related phenomenological
implications are also discussed.
","[{""version"":""v1"",""created"":""Thu, 10 Feb 2005 22:12:47 GMT""}]","2007-05-23"
"hep-ph/0502105","John F. Gunion","Radovan Dermisek and John F. Gunion","Escaping the Large Fine Tuning and Little Hierarchy Problems in the Next
  to Minimal Supersymmetric Model and h-> aa Decays","4 pages, 4 figures, revised to conform with PRL published version","Phys.Rev.Lett.95:041801,2005","10.1103/PhysRevLett.95.041801",,"hep-ph hep-ex",,"  We demonstrate that the NMSSM can have small fine tuning and modest light
stop mass while still evading all experimental constraints. For small tan(beta)
[large tan(beta)], the relevant scenarios are such that there is always (often)
a SM-like Higgs boson that decays to two lighter -- possibly much lighter --
pseudoscalar Higgses.
","[{""version"":""v1"",""created"":""Fri, 11 Feb 2005 01:35:06 GMT""},{""version"":""v2"",""created"":""Thu, 14 Jul 2005 17:09:59 GMT""}]","2014-11-18"
"hep-ph/0502106","Pankaj Jain","Pankaj Jain and John P. Ralston","Supersymmetry and the Lorentz Fine Tuning Problem","9 pages, 1 figure","Phys.Lett. B621 (2005) 213-218","10.1016/j.physletb.2005.06.055",,"hep-ph gr-qc hep-th",,"  If physics at the Planck scale requires new conceptions of space-time, then
generic renormalizable field theories predict observable violations of Lorentz
invariance in the low energy sector. The little recognized ``Lorentz Fine
Tuning Problem'' comes from logarithmic loop corrections which are not
suppressed to the enormous extent commonly assumed. Fine-tuning of parameters
at the Planck scale is one possible but unpalatable solution. Here we show that
violation of Lorentz invariance is highly suppressed in a supersymmetric
theory, the Wess-Zumino model. We conjecture that supersymmetry may be further
motivated by yet another fine tuning problem of ordinary quantum field
theories.
","[{""version"":""v1"",""created"":""Fri, 11 Feb 2005 09:47:32 GMT""},{""version"":""v2"",""created"":""Thu, 19 May 2005 03:56:20 GMT""}]","2010-04-05"
"hep-ph/0502107","Andrei Kataev","S.I. Alekhin (IHEP, Protvino), A.L. Kataev (INR, Moscow), S.A. Kulagin
  (INR, Moscow) and M.V. Osipenko (INFN, Sezione di Genova, Genova and INP of
  MSU, Moscow)","Evaluation of the isospin asymmetry of the nucleon structure functions
  with CLAS++","5 pages, 4 figures, presented at BARYONS04 Conference, Palaiseau,
  France, October 2004, submitted to the Proceedings)","Nucl.Phys.A755:345-349,2005","10.1016/j.nuclphysa.2005.03.036",,"hep-ph",,"  The possibility to estimate the isospin symmetry breaking effects in the
non-perturbative part of F_2 structure function of the chargeg lN
deep-pnelastic scattering, which will provide CLAS++ dewtector of the upgraded
TJNAF machine at $Q^2\approx 2 GeV^2$, is discussed. The problems of the
Gottfried sum rule extraction are also considered.
","[{""version"":""v1"",""created"":""Fri, 11 Feb 2005 12:57:52 GMT""}]","2014-11-18"
"hep-ph/0502108","Vincenzo Barone","Vincenzo Barone (U. Piemonte Orientale and INFN, Alessandria, Italy)","Understanding transversity: present and future","9 pages, 1 figure, plenary talk at SPIN 2004 (Trieste), to be
  published in the Proceedings",,"10.1142/9789812701909_0002",,"hep-ph",,"  I review the present state of knowledge concerning transversity distributions
and related observables. In particular, I discuss the phenomenology of
transverse asymmetries in e p\uparrow, p p\uparrow, p\uparrow p\uparrow and
pbar \uparrow p\uparrow scattering, and the perspectives of ongoing and future
research.
","[{""version"":""v1"",""created"":""Fri, 11 Feb 2005 11:29:48 GMT""}]","2017-08-23"
"hep-ph/0502109","Ajit Mohan Srivastava","Biswanath Layek, Ajit M. Srivastava, Soma Sanyal","Excited hadrons as a signal for quark-gluon plasma formation","19 pages, RevTex, no figures, minor changes","Int.J.Mod.Phys.A21:3421-3440,2006","10.1142/S0217751X06033088",,"hep-ph hep-ex nucl-ex nucl-th",,"  At the quark-hadron transition, when quarks get confined to hadrons, certain
orbitally excited states, namely those which have excitation energies above the
respective $L = 0$ states of the same order as the transition temperature
$T_c$, may form easily because of thermal velocities of quarks at the
transition temperature. We propose that the ratio of multiplicities of such
excited states to the respective $L = 0$ states can serve as an almost model
independent signal for the quark-gluon plasma formation in relativistic
heavy-ion collisions. For example, the ratio $R^*$ of multiplicities of
$D_{SJ}^{*\pm}(2317)(J^P = 0^+)$ and $D_S^{*\pm}(2112)(J^P = 1^-)$ when plotted
with respect to the center of mass energy of the collision $\sqrt{s}$ (or vs.
centrality/number of participants), should show a jump at the value of
$\sqrt{s}$ beyond which the QGP formation occurs. This should happen
irrespective of the shape of the overall plot of $R^*$ vs. $\sqrt{s}$. Recent
data from RHIC on $\Lambda^*/\Lambda$ vs. N$_{part}$ for large values of
N$_{part}$ may be indicative of such a behavior, though there are large error
bars. We give a list of several other such candidate hadronic states.
","[{""version"":""v1"",""created"":""Fri, 11 Feb 2005 12:08:55 GMT""},{""version"":""v2"",""created"":""Mon, 14 Feb 2005 02:58:08 GMT""}]","2010-11-05"
"hep-ph/0502110","Thomas Gehrmann","A. Gehrmann-De Ridder, T. Gehrmann, E.W.N. Glover","Gluon-Gluon Antenna Functions from Higgs Boson Decay","12 pages","Phys.Lett.B612:49-60,2005","10.1016/j.physletb.2005.03.003","ZU-TH 02/05, IPPP/05/03","hep-ph",,"  Antenna functions describe the infrared singular behaviour of colour-ordered
QCD matrix elements due to the emission of unresolved partons inside an antenna
formed by two hard partons. In this paper, we show that antenna functions for
hard gluon-gluon pairs can be systematically derived from the effective
Lagrangian describing Higgs boson decay into gluons, and compute the the
infrared structure of the colour-ordered Higgs boson decay matrix elements at
NLO and NNLO.
","[{""version"":""v1"",""created"":""Fri, 11 Feb 2005 13:05:05 GMT""}]","2008-11-26"
"hep-ph/0502111","Evgeni Andriyash","E.A.Andriyash, G.G.Ovanesyan, M.I.Vysotsky","The value of B_K from the experimental data on CP-violation in K-mesons
  and up-to-date values of CKM matrix parameters","12 pages, 1 figure","Phys.Atom.Nucl. 69 (2006) 286-292","10.1134/S106377880602013X",,"hep-ph",,"  The difference between induced by box diagram quantity \tilde \epsilon and
experimentally measured value of \epsilon is determined and used to obtain the
value of \tilde \epsilon with high precision. Present day knowledge of CKM
matrix elements (including B-factory data), allows us to obtain from the
Standard Model expression for \tilde \epsilon the value of parameter B_K: B_K =
0.89 \pm0.16. It turns out to be very close to the result of vacuum insertion,
B_K = 1.
","[{""version"":""v1"",""created"":""Fri, 11 Feb 2005 13:43:00 GMT""}]","2009-11-11"
"hep-ph/0502112","Helmut Eberl Dr.","H. Eberl, T. Gajdosik, W. Majerotto, B. Schrausser","CP-violating asymmetry in chargino decay into neutralino and W boson","14 pages, 6 figures, version to be published in PLB","Phys.Lett. B618 (2005) 171-181","10.1016/j.physletb.2005.05.033","HEPHY-PUB 804/05, FI 2005-01","hep-ph",,"  In the MSSM with complex parameters, loop corrections to $\cha_i^\pm \to
\neu_j^0 W^\pm$ lead to a CP violating asymmetry $\ACP = (\Gamma(\cha_i^+ \to
\neu_j^0 W^+) - \Gamma(\cha_i^- \to \neu_j^0 W^-))/ (\Gamma(\cha_i^+ \to
\neu_j^0 W^+) + \Gamma(\cha_i^- \to \neu_j^0 W^-))$. We calculate this
asymmetry at full one-loop level. We perform a detailed numerical analysis for
$\cha_1^\pm \to \neu_1^0 W^\pm$ and $\cha_2^\pm \to \neu_1^0 W^\pm$ analyzing
the dependence on the parameters and phases involved. Asymmetries of several
percent are obtained. We also discuss the feasability of measuring these
asymmtries at LHC.
","[{""version"":""v1"",""created"":""Fri, 11 Feb 2005 15:26:34 GMT""},{""version"":""v2"",""created"":""Fri, 3 Jun 2005 09:23:13 GMT""}]","2010-04-05"
