"astro-ph/0502234","Peter Schuecker","Peter Schuecker","New Cosmology with Clusters of Galaxies","32 pages, 10 figures, invited review at the joint conference of the
  Czech Astron. Society and the Astron. Gesell. To appear in Reviews in Modern
  Astronomy 18 on ""From Cosmolgical Structures to the Milky Way"", ed. S. Roeser",,"10.1002/3527608966.ch4",,"astro-ph",,"  The review summarizes present and future applications of galaxy clusters to
cosmology with emphasis on nearby X-ray clusters. The discussion includes the
density of dark matter, the normalization of the matter power spectrum,
neutrino masses, and especially the equation of state of the dark energy, the
interaction between dark energy and ordinary matter, gravitational holography,
and the effects of extra-dimensions.
","[{""version"":""v1"",""created"":""Fri, 11 Feb 2005 07:26:48 GMT""}]","2015-06-24"
"astro-ph/0502235","Frederic Thevenin","G. Tsarevsky (CSIRO, ASC), J.A. De Freitas Pacheco (LCCASSPMF), N.
  Kardashev (ASC), P. De Laverny (LCCASSPMF), Fr\'ed\'eric Th\'evenin
  (LCCASSPMF), O. B. Slee (CSIRO), R.A. Stathakis (AAO), E. Barsukova (SAO), V.
  Goransky (SAI), B. Komberg (ASC)","A Search for Very Active Stars in the Galaxy","to appear in A&A, 7 figures",,"10.1051/0004-6361:20042274",,"astro-ph",,"  We report the first results of a systematic search near the plane of the
Galaxy for the so called very active stars (VAS), which are characterized by a
hard X-ray spectrum and activity in the radio domain. Candidates with hard
X-ray binary-like spectra have been selected from the Bright ROSAT Source
Catalogue in the Zone of Avoidance ($| b | < 20{^o}$) and were tentatively
identified in GB6/PMM/NVSS radio surveys. Most of them were observed with the
ATCA and VLA. Precise radio coordinates have led to unambiguous optical
identification for 60 candidates, and a sub-sample of five of themhas been
observed with the VLT. Also some discovery and confirmatory spectra were
obtained with the AAT (4-m) and BTA (6-m). Spectroscopy with moderate
dispersion, made with the FORS1 spectrograph of the VLT has revealed two
stellar objects (one of them, VASC J1628-41, is definitivelya binary VAS), one
new AGN and two featureless spectrum sources. One of these objects, VASC
J1353-66, shows a marginal evidence of proper motion, which, if confirmed,
would imply the discovery of a new type of galactic source.
","[{""version"":""v1"",""created"":""Fri, 11 Feb 2005 07:50:37 GMT""},{""version"":""v2"",""created"":""Fri, 18 Feb 2005 16:39:26 GMT""}]","2016-08-16"
"astro-ph/0502236","Gisella Clementini","Marcella Marconi (1), Gisella Clementini (2)((1)INAF-Oss. Astron.
  Capodimonte, Napoli, (2)INAF-Oss. Astron. Bologna)","A ""pulsational"" distance determination for the Large Magellanic Cloud","24 pages, including 4 figures and 5 tables. In press on AJ, May 2005
  issue",,"10.1086/429525",,"astro-ph",,"  We present results from the theoretical modelling of the observed B,V light
curves of 14 RR Lyrae stars in the Large Magellanic Cloud. The sample includes
7 fundamental and 7 first overtone pulsators covering the metallicity range
from -2.12 to -0.79 dex in [Fe/H], with average value of -1.54 dex. Masses,
intrinsic luminosities, effective temperatures, and reddenings were derived by
fitting high accuracy multiband light curves available for these RR Lyrae stars
to nonlinear convective pulsation models. Individual distance moduli were
determined for each variable, they lead to an average distance modulus for the
Large Magellanic Cloud of (m-M)o= 18.54 +/-0.02 (sigm= 0.09 mag, standard
deviation of the average), in good agreement with the ""long"" astronomical
distance scale.
","[{""version"":""v1"",""created"":""Fri, 11 Feb 2005 10:14:18 GMT""}]","2009-11-10"
"astro-ph/0502237","Joao Magueijo","Kate Land and Joao Magueijo","The axis of evil","Small corrections introduced","Phys.Rev.Lett. 95 (2005) 071301","10.1103/PhysRevLett.95.071301","Imperial-TP","astro-ph gr-qc hep-ph",,"  We examine previous claims for a preferred axis at $(b,l)\approx (60,-100)$
in the cosmic radiation anisotropy, by generalizing the concept of multipole
planarity to any shape preference (a concept we define mathematically).
Contrary to earlier claims, we find that the amount of power concentrated in
planar modes for $\ell=2,3$ is not inconsistent with isotropy and Gaussianity.
The multipoles' alignment, however, is indeed anomalous, and extends up to
$\ell=5$ rejecting statistical isotropy with a probability in excess of 99.9%.
There is also an uncanny correlation of azimuthal phases between $\ell=3$ and
$\ell=5$. We are unable to blame these effects on foreground contamination or
large-scale systematic errors. We show how this reappraisal may be crucial in
identifying the theoretical model behind the anomaly.
","[{""version"":""v1"",""created"":""Fri, 11 Feb 2005 12:10:56 GMT""},{""version"":""v2"",""created"":""Tue, 22 Feb 2005 13:46:09 GMT""}]","2009-11-10"
"astro-ph/0502238","Giovanna Tinetti","G. Tinetti (NAI-NRC/Caltech), V. S. Meadows (Caltech), D. Crisp (JPL),
  W. Fong (Caltech), N. Kiang (GISS), E. Fishbein (JPL), T. Velusamy (JPL), E.
  Bosc (JPL) and M. Turnbull (Carnegie Washington)","Disk-averaged Spectra & light-curves of Earth","34 pages, 19 figures. submitted to Astrobiology",,,,"astro-ph",,"  We are using computer models to explore the observational sensitivity to
changes in atmospheric and surface properties, and the detectability of
biosignatures, in the globally averaged spectra and light-curves of the Earth.
Using AIRS (Atmospheric Infrared Sounder) data, as input for atmospheric and
surface properties, we have generated spatially resolved high-resolution
synthetic spectra using the SMART radiative transfer model, for a variety of
conditions, from the UV to the far-IR (beyond the range of current Earth-based
satellite data). We have then averaged over the visible disk for a number of
different viewing geometries to quantify the sensitivity to surface types and
atmospheric features as a function of viewing geometry, and spatial and
spectral resolution.
  These results have been processed with an instrument simulator to improve our
understanding of the detectable characteristics of Earth-like planets as viewed
by the first generation extrasolar terrestrial planet detection and
characterization missions (Terrestrial Planet Finder/Darwin and Life finder).
The wavelength range of our results are modelled over are applicable to both
the proposed visible coronograph and mid-infrared interferometer TPF
architectures.
  We have validated this model against disk-averaged observations by the Mars
Global Surveyor Thermal Emission Spectrometer (MGS TES).
  This model was also used to analyze Earth-shine data for detectability of
planetary characteristics and biosignatures in disk-averaged spectra.
","[{""version"":""v1"",""created"":""Fri, 11 Feb 2005 14:44:50 GMT""}]","2016-08-30"
"cond-mat/0502266","Evgenij Vdovin","E. E. Vdovin, Yu. N. Khanin, L. Eaves, M. Henini, G. Hill","Spin splitting of X-related donor impurity states in an AlAs barrier",,,"10.1103/PhysRevB.71.195320",,"cond-mat.mes-hall cond-mat.other",,"  We use magnetotunneling spectroscopy to observe the spin splitting of the
ground state of an X-valley-related Si-donor impurity in an AlAs barrier. We
determine the absolute magnitude of the effective Zeeman spin splitting factors
of the impurity ground state to be g$_{I}$= 2.2 $\pm $ 0.1. We also investigate
the spatial form of the electron wave function of the donor ground state, which
is anisotropic in the growth plane.
","[{""version"":""v1"",""created"":""Thu, 10 Feb 2005 16:56:06 GMT""}]","2009-11-11"
"cond-mat/0502267","Roger Folch","R. Folch and M. Plapp","Quantitative phase-field modeling of two-phase solidification","37 pages, 18 figures, submitted to Phys. Rev. E",,"10.1103/PhysRevE.72.011602",,"cond-mat.mtrl-sci cond-mat.soft cond-mat.stat-mech",,"  A phase-field model that allows for quantitative simulations of low-speed
eutectic and peritectic solidification under typical experimental conditions is
developed. Its cornerstone is a smooth free-energy functional, designed so that
the stable solutions connecting any two phases are completely free of the third
phase. For the simplest choice of this functional, the equations of motion for
each of the two solid-liquid interfaces can be mapped to the standard
phase-field model of single-phase solidification, and all thin-interface
corrections to the dynamics of the solid-liquid interfaces can be eliminated.
This means that simulation results become independent of the thickness W of the
diffuse interfaces. As a consequence, accurate results can be obtained using
values of W much larger than the physical interface thickness, which makes
simulations for realistic experimental parameters feasible. Convergence of the
simulation outcome with decreasing W is explicitly demonstrated. The results
are also compared to a boundary-integral formulation of the corresponding
free-boundary problem. Excellent agreement is found, except in the immediate
vicinity of bifurcation points, where differences arise. These differences
reveal that, in contrast to the standard assumptions of the free-boundary
problem, out of equilibrium the diffuse trijunction region of the phase-field
model can (i) slightly deviate from Young's law for the contact angles, and
(ii) advance in a direction that forms a finite angle with the solid-solid
interface at each instant. While the deviation (i) extrapolates to zero in the
limit of vanishing interface thickness, the small angle in (ii) remains roughly
constant, which indicates that it might be a genuine physical effect, present
even for an atomic-scale interface thickness.
","[{""version"":""v1"",""created"":""Thu, 10 Feb 2005 19:13:29 GMT""}]","2009-11-11"
"cond-mat/0502268","Marie-Bernadette Lepetit","Marie-Bernadette Lepetit (LPQ)","How to determine model Hamiltonians for strongly correlated materials",,"Recent Research Developments in Quantum Chemistry 3 (2002) 143",,,"cond-mat.str-el",,"  The present paper reviews recent achievements on the ab initio determination
of effective model Hamiltonians aimed at the description of strongly correlated
materials. These models (Heisenberg, $t-J$, extended Hubbard, Kondo, etc) are
crucial to solid state physicists for the description and understanding of the
electronic remarkable properties such as magnetic orders, photo-induced
magnetism, transport properties, high $t\_c$ super conductivity, etc. We will
see how the association and the control of embedding techniques, fragment
spectroscopy, effective or intermediate Hamiltonian theories, provides a
systematic and well controlled method for the determination of trustworthy
models Hamiltonians.
","[{""version"":""v1"",""created"":""Thu, 10 Feb 2005 19:54:52 GMT""}]","2007-05-23"
"cond-mat/0502269","Matt Mackie","Matt Mackie","Coherent Population Trapping in a Feshbach-Resonant Cesium Condensate","4 pages, 2 figs., 18+ refs",,,,"cond-mat.other",,"  Recent experiments with Feshbach-resonant cesium Bose-Einstein condensates
have led to unexplained molecule formation: a sudden switch of the magnetic
field to its resonance value, followed by a finite hold time and another sudden
switch to magnetic field values below threshold, converts about a third of the
initial condensate atoms into molecules. Based on a model of coherent
conversion between an atomic condensate, a molecular condensate, and
magnetodissociated noncondensate atom pairs of equal and opposite momentum, we
find that population trapping is strongly implicated as the physical mechanism
responsible for molecule formation in switch experiments.
","[{""version"":""v1"",""created"":""Thu, 10 Feb 2005 20:45:27 GMT""}]","2007-05-23"
"cond-mat/0502270","Kun Yang","Kun Yang","Quantum Theory of Pomeranchuck Transition in Two Dimensional Fermi
  Liquids via High Dimensional Bosonization","4 pages",,,,"cond-mat.str-el",,"  We use high dimensional bosonization to derive an effective field theory that
describes the Pomeranchuck transition in two-dimensional Fermi liquids. The
bosonization approach explicitly retains all low-energy degrees of freedom of
the system. The resultant theory has dynamical exponent z=2 at tree level and
upper critical dimension d_c=2, thus in 2D the system is at the upper critical
dimension. These results differ from those of an earlier study based on
integrating out fermions.
","[{""version"":""v1"",""created"":""Thu, 10 Feb 2005 21:05:18 GMT""}]","2007-05-23"
"cond-mat/0502271","Peter Mayer","Peter Mayer, Peter Sollich, Ludovic Berthier and Juan P. Garrahan","Dynamic Heterogeneity in the Glauber-Ising chain","18 pages, 4 figures","J. Stat. Mech. (2005) P05002","10.1088/1742-5468/2005/05/P05002",,"cond-mat.stat-mech",,"  In a recent paper [P. Mayer et al., Phys. Rev. Lett. 93, 115701 (2004)] it
was shown, by means of experiments, theory and simulations, that coarsening
systems display dynamic heterogeneity analogous to that of glass formers. Here,
we present a detailed analysis of dynamic heterogeneities in the Glauber-Ising
chain. We discuss how dynamic heterogeneity in Ising systems must be measured
through connected multi-point correlation functions. We show that in the
coarsening regime of the Ising chain these multi-point functions reveal the
growth of spatial correlations in the dynamics, beyond what can be inferred
from standard two-point correlations. They have non-trivial scaling properties,
which we interpret in terms of the diffusion-annihilation dynamics of domain
walls. In the equilibrium dynamics of the Ising chain, on the other hand,
connected multi-point functions vanish exactly and dynamic heterogeneity is not
observed. Our results highlight the similarities between coarsening systems and
glass formers.
","[{""version"":""v1"",""created"":""Thu, 10 Feb 2005 21:40:30 GMT""}]","2007-05-23"
"cond-mat/0502273","David Hawthorn","D. G. Hawthorn, S. Y. Li, M. Sutherland, Etienne Boaknin, R. W. Hill,
  C. Proust, F. Ronning, M. A. Tanatar, Johnpierre Paglione, Louis Taillefer,
  D. Peets, Ruixing Liang, D. A. Bonn, W. N. Hardy and N. N. Kolesnikov","Doping dependence of the superconducting gap in Tl_2Ba_2CuO_{6+delta}
  from heat transport","7 pages, 4 figures","Phys. Rev. B 75, 104518 (2007)","10.1103/PhysRevB.75.104518",,"cond-mat.str-el cond-mat.supr-con",,"  We present low-temperature thermal conductivity measurements on the cuprate
Tl_2Ba_2CuO_{6+delta} throughout the overdoped regime. In the T -> 0 limit, the
thermal conductivity due to d-wave nodal quasiparticles provides a bulk
measurement of the superconducting gap, Delta. We find Delta to decrease with
increasing doping, with a magnitude consistent with spectroscopic measurements
(photoemission and tunneling). This argues for a pure and simple d-wave
superconducting state in the overdoped region of the phase diagram, which
appears to extend into the underdoped regime down to a hole concentration of
0.1 hole/Cu. As hole concentration is decreased, the gap-to-Tc ratio increases,
showing that the suppression of the superconducting transition temperature Tc
(relative to the gap) begins in the overdoped regime.
","[{""version"":""v1"",""created"":""Fri, 11 Feb 2005 00:10:58 GMT""},{""version"":""v2"",""created"":""Fri, 15 Dec 2006 17:57:01 GMT""},{""version"":""v3"",""created"":""Mon, 2 Apr 2007 03:34:15 GMT""}]","2007-05-23"
"cond-mat/0502274","Constantino Tsallis","Constantino Tsallis, Murray Gell-Mann and Yuzuru Sato","Asymptotically scale-invariant occupancy of phase space makes the
  entropy Sq extensive","15 pages, including 9 figures and 8 Tables. The new version is
  considerably enlarged with regard to the previous ones. New examples and new
  references have been included","Proc.Nat.Acad.Sci. 102 (2005) 15377-15382","10.1073/pnas.0503807102",,"cond-mat.stat-mech",,"  Phase space can be constructed for $N$ equal and distinguishable subsystems
that could be (probabilistically) either {\it weakly} (or {\it ""locally""})
correlated (e.g., independent, i.e., uncorrelated), or {\it strongly} (or {\it
globally}) correlated. If they are locally correlated, we expect the
Boltzmann-Gibbs entropy $S_{BG} \equiv -k \sum_i p_i \ln p_i$ to be {\it
extensive}, i.e., $S_{BG}(N)\propto N $ for $N \to\infty$. In particular, if
they are independent, $S_{BG}$ is {\it strictly additive}, i.e., $S_{BG}(N)=N
S_{BG}(1), \forall N$. However, if the subsystems are globally correlated, we
expect, for a vast class of systems, the entropy $S_q\equiv k [1- \sum_i
p_i^q]/(q-1)$ (with $S_1=S_{BG}$) for some special value of $q\ne1$ to be the
one which extensive (i.e., $S_q(N)\propto N $ for $N \to\infty$).
","[{""version"":""v1"",""created"":""Fri, 11 Feb 2005 00:49:26 GMT""},{""version"":""v2"",""created"":""Sat, 7 May 2005 01:15:22 GMT""},{""version"":""v3"",""created"":""Sun, 24 Jul 2005 14:39:38 GMT""}]","2009-11-11"
"cond-mat/0502276","Ralf Bulla","Sabine Tornow, Ning-Hua Tong, and Ralf Bulla","Electron Transfer in Donor-Acceptor Systems: Many-Particle Effects and
  Influence of Electronic Correlations","4 pages, 4 figures","Europhys. Lett. 73, 913 (2006)","10.1209/epl/i2005-10479-1",,"cond-mat.str-el",,"  We investigate electron transfer processes in donor-acceptor systems with a
coupling of the electronic degrees of freedom to a common bosonic bath. The
model allows to study many-particle effects and the influence of the local
Coulomb interaction U between electrons on donor and acceptor sites. Using the
non-perturbative numerical renormalization group approach we find distinct
differences between the electron transfer characteristics in the single- and
two-particle subspaces. We calculate the critical electron-boson coupling
alpha_c as a function of $U$ and show results for density-density correlation
functions in the whole parameter space. The possibility of many-particle
(bipolaronic) and Coulomb-assisted transfer is discussed.
","[{""version"":""v1"",""created"":""Fri, 11 Feb 2005 09:12:31 GMT""}]","2007-05-23"
"cond-mat/0502277","Lucien Lemmens","Burhan Bakar and L.F. Lemmens","Blocking temperature in magnetic nano-clusters","RevTex with BibTex 6 figures","Phys. Rev. E 71, 046109 (2005)","10.1103/PhysRevE.71.046109",,"cond-mat.stat-mech",,"  A recent study of nonextensive phase transitions in nuclei and nuclear
clusters needs a probability model compatible with the appropriate Hamiltonian.
For magnetic molecules a representation of the evolution by a Markov process
achieves the required probability model that is used to study the probability
density function (PDF) of the order parameter, i.e. the magnetization. The
existence of one or more modes in this PDF is an indication for the
superparamagnetic transition of the cluster. This allows us to determine the
factors that influence the blocking temperature, i.e. the temperature related
to the change of the number of modes in the density. It turns out that for our
model, rather than the evolution of the system implied by the Hamiltonian, the
high temperature density of the magnetization is the important factor for the
temperature of the transition. We find that an initial probability density
function with a high entropy leads to a magnetic cluster with a high blocking
temperature.
","[{""version"":""v1"",""created"":""Fri, 11 Feb 2005 10:06:19 GMT""}]","2009-11-11"
"cond-mat/0502278","Eric Lutz","Eric Lutz","Analytical results for a Fokker-Planck equation in the small noise limit","5 pages, 4 figures",,"10.1119/1.1949632",,"cond-mat.stat-mech",,"  We present analytical results for the lowest cumulants of a stochastic
process described by a Fokker-Planck equation with nonlinear drift. We show
that, in the limit of small fluctuations, the mean, the variance and the
covariance of the process can be expressed in compact form with the help of the
Lambert W function. As an application, we discuss the interplay of noise and
nonlinearity far from equilibrium.
","[{""version"":""v1"",""created"":""Fri, 11 Feb 2005 10:15:14 GMT""}]","2009-11-11"
"cond-mat/0502279","Jochen Wosnitza","N. Kozlova, J. Hagel, M. Doerr, J. Wosnitza, D. Eckert, K.-H. Mueller,
  L. Schultz, I. Opahle, S. Elgazzar, Manuel Richter, G. Goll, G. Zwicknagl, T.
  Yoshino, T. Takabatake","Magnetic-field induced band-structure change in CeBiPt","4 pages, 4 figures","Physical Review Letters 95, 086403 (2005)","10.1103/PhysRevLett.95.086403",,"cond-mat.str-el",,"  We report on a field-induced change of the electronic band structure of
CeBiPt as evidenced by electrical-transport measurements in pulsed magnetic
fields. Above ~25 T, the charge-carrier concentration increases nearly 30% with
a concomitant disappearance of the Shubnikov-de Haas signal. These features are
intimately related to the Ce 4f electrons since for the non-4f compound LaBiPt
the Fermi surface remains unaffected. Electronic band-structure calculations
point to a 4f-polarization-induced change of the Fermi-surface topology.
","[{""version"":""v1"",""created"":""Fri, 11 Feb 2005 10:46:43 GMT""}]","2007-05-23"
"cond-mat/0502280","Alessandro Vezzani","R. Burioni, D. Cassi, P. Sodano, A. Trombettoni, A. Vezzani","Topological Filters for Solitons in Coupled Waveguides Networks",,"Phys. Rev. E 73, 066624 (2006)","10.1103/PhysRevE.73.066624",,"cond-mat.stat-mech",,"  We study the propagation of discrete solitons on chains of coupled optical
waveguides where finite networks of waveguides are inserted at some points. By
properly selecting the topology of these networks, it is possible to control
the transmission of traveling solitons: we show here that inhomogeneous
waveguide networks may be used as filters for soliton propagation. Our results
provide a first step in the understanding of the interplay/competition between
topology and nonlinearity for soliton dynamics in optical fibers.
","[{""version"":""v1"",""created"":""Fri, 11 Feb 2005 12:54:09 GMT""},{""version"":""v2"",""created"":""Fri, 20 May 2005 18:08:19 GMT""}]","2007-05-23"
"cond-mat/0502283","Karl Renk","K. F. Renk, A. Meier, B. I. Stahl, A. Glukhovskoy, M. Jain, H. Appel,
  W. Wegscheider","Operation of a Bloch oscillator","9 pages, 4 figures",,,,"cond-mat.mes-hall cond-mat.mtrl-sci",,"  We report the operation of a Bloch oscillator. The active medium was a
staticvoltage driven, doped GaAs/AlAs superlattice which was
electromagnetically coupled to a resonator. The oscillator produced tuneable
microwave radiation (frequency ~ 60 GHz; power ~ 0.5 mW; efficiency ~ 4 %). The
gain (~ 10^4 /cm) was due to the nonlinearity mediated by miniband electrons.
We also present a theory of the oscillator. The Bloch oscillator should in
principle be feasible for generation of radiation up to frequencies of 10 THz
and more.
","[{""version"":""v1"",""created"":""Fri, 11 Feb 2005 15:48:04 GMT""}]","2007-05-23"
"cond-mat/0502284","Karl Renk","K. F. Renk, B. I. Stahl, A. Rogl, T. Janzen, D. G. Pavel'ev, Yu. I.
  Koshurinov, V. Ustinov, A. Zhukov","Terahertz superlattice parametric oscillator","10 pages, 4 figures",,"10.1103/PhysRevLett.95.126801",,"cond-mat.mes-hall cond-mat.mtrl-sci",,"  We report a GaAs/AlAs superlattice parametric oscillator. It was pumped by a
microwave field (power few mW) and produced 3rd harmonic radiation (frequency
near 300 GHz). The nonlinearity of the active superlattice was due to Bragg
reflections of conduction electrons at the superlattice planes. A theory of the
nonlinearity indicates that parametric oscillation should be possible up to
frequencies above 10 THz. The active superlattice may be the object of further
studies of predicted extraordinary nonlinearities for THz fields.
","[{""version"":""v1"",""created"":""Fri, 11 Feb 2005 15:09:38 GMT""}]","2009-11-11"
"cond-mat/0502285","Francesco Piazza","Maria Eleftheriou, Stefano Lepri, Roberto Livi, Francesco Piazza","Stretched--exponential relaxation in arrays of coupled rotators","13 Figures",,"10.1016/j.physd.2005.04.014",,"cond-mat.other",,"  We consider the non--equilibrium dynamics of a chain of classical rotators
coupled at its edges to an external reservoir at zero temperature. We find that
the energy is released in a strongly discontinuous fashion, with sudden jumps
alternated with long stretches during which dissipation is extremely weak. The
jumps mark the disappearance of strongly localized structures, akin to the
rotobreather solutions of the Hamiltonian model, which act as insulating
boundaries of a hot central core. As a result of this complex kinetics, the
ensemble--averaged energy follows a stretched exponential law until a residual
pseudo--stationary state is attained, where the hot core has reduced to a
single localized object.
  We give a statistical description of the relaxation pathway and connect it to
the properties of return periods of rare events in correlated time series. This
approach sheds some light into the microscopic mechanism underlying the slow
dynamics of the system.
  Finally, we show that the stretched exponential law remains unaltered in the
presence of isotopic disorder.
","[{""version"":""v1"",""created"":""Fri, 11 Feb 2005 15:13:42 GMT""}]","2009-11-11"
