"nucl-th/0502058","Masatsugu Isse","M. Isse (1), A. Ohnishi (1), N. Otuka (2), P. K. Sahu (3), Y. Nara (4)
  ((1) Hokkaido Univ., (2) JAERI, (3) IOP, (4) Frankfurt Univ.)","Mean-Field Effects on Collective Flows in High-Energy Heavy-Ion
  Collisions at 2-158A GeV energies","16 pages, 14 figures. Results and discussions are corrected","Phys.Rev. C72 (2005) 064908","10.1103/PhysRevC.72.064908",,"nucl-th",,"  Collective flows in heavy-ion collisions from AGS ($(2-11)A$ GeV) to SPS
($(40,158)A$ GeV) energies are investigated in a nonequilibrium transport model
with nuclear mean-field (MF). Sideward $<p_x>$, directed $v_1$, and elliptic
flows $v_2$ are systematically studied with different assumptions on the
nuclear equation of state (EOS). We find that momentum dependence in the
nuclear MF is important for the understanding of the proton collective flows at
AGS and SPS energies. Calculated results with momentum dependent MF
qualitatively reproduce the experimental data of proton sideward, directed, and
elliptic flows in a incident energy range of $(2-158)A$ GeV.
","[{""version"":""v1"",""created"":""Sun, 20 Feb 2005 15:16:35 GMT""},{""version"":""v2"",""created"":""Sun, 13 Mar 2005 10:12:11 GMT""},{""version"":""v3"",""created"":""Tue, 27 Sep 2005 14:51:31 GMT""}]","2016-09-08"
"physics/0502102","Zaza Melikishvili G.","Z. V. Jaliashvili, T.D. Medoidze, Z. G. Melikishvili, K. M.
  Mardaleishvili and J. J. Ramsden","Real time noninvasive cancer diagnostics","2 figures",,,,"physics.med-ph",,"  Laser illumination of tissue results in a characteristic fluorescence
emission spectrum whose features depend on the type of tissue, viz., healthy,
adenoma or malignant. Hence measurement of the fluorescence is potentially a
rapid and reliable diagnostic method. We have applied the technique to thyroid
tissues and found that judicious normalization of the fluorescence spectrum
reveals a close correlation between spectral shape and tissue type. Hence the
pathological state of the tissue can be unambiguously identified from the
laser-induced fluorescence spectrum. The method is rapid and portable and is
therefore eminently suitable for use during operations.
","[{""version"":""v1"",""created"":""Sun, 20 Feb 2005 07:53:47 GMT""}]","2007-05-23"
"physics/0502103","Thomas E. Coan","Thomas Coan, Tiankuan Liu and Jingbo Ye","A Compact Apparatus for Muon Lifetime Measurement and Time Dilation
  Demonstration in the Undergraduate Laboratory","5 pages, 2 figures","Am.J.Phys. 74 (2006) 161-164","10.1119/1.2135319",,"physics.ins-det physics.ed-ph",,"  We describe a compact apparatus that automatically measures the charge
averaged lifetime of atmospheric muons in plastic scintillator using low-cost,
low-power electronics and that measures the stopping rate of atmospheric muons
as a function of altitude to demonstrate relativistic time dilation. The
apparatus is designed for the advanced undergraduate physics laboratory and is
suitable for field measurements.
","[{""version"":""v1"",""created"":""Sat, 19 Feb 2005 23:00:09 GMT""}]","2015-06-26"
"physics/0502106","Burra Sidharth Gautam","B.G.Sidharth","Noncommutative spacetime effects and gravitation","8 pages, based on two papers accepted for publication in
  Int.J.Mod.Phys.E",,,,"physics.gen-ph",,"  In recent years Quantum Superstrings and Quantum Gravity approaches have come
to rely on non differenciable spacetime manifolds. These throw up a
noncommutative spacetime geometry and we consider the origin of mass and a
related modification of the Dirac equation in this context. This also throws
some light on gravitation itself.
","[{""version"":""v1"",""created"":""Sun, 20 Feb 2005 02:27:23 GMT""}]","2007-05-23"
"q-bio/0502020","Gavin E. Crooks","Gavin E. Crooks, Richard E. Green and Steven E. Brenner","Pairwise alignment incorporating dipeptide covariation",,"Bioinformatics 21 3704-3710 (2005)","10.1093/bioinformatics/bti616",,"q-bio.BM q-bio.PE",,"  Motivation: Standard algorithms for pairwise protein sequence alignment make
the simplifying assumption that amino acid substitutions at neighboring sites
are uncorrelated. This assumption allows implementation of fast algorithms for
pairwise sequence alignment, but it ignores information that could conceivably
increase the power of remote homolog detection. We examine the validity of this
assumption by constructing extended substitution matrixes that encapsulate the
observed correlations between neighboring sites, by developing an efficient and
rigorous algorithm for pairwise protein sequence alignment that incorporates
these local substitution correlations, and by assessing the ability of this
algorithm to detect remote homologies. Results: Our analysis indicates that
local correlations between substitutions are not strong on the average.
Furthermore, incorporating local substitution correlations into pairwise
alignment did not lead to a statistically significant improvement in remote
homology detection. Therefore, the standard assumption that individual residues
within protein sequences evolve independently of neighboring positions appears
to be an efficient and appropriate approximation.
","[{""version"":""v1"",""created"":""Sat, 19 Feb 2005 23:19:16 GMT""},{""version"":""v2"",""created"":""Thu, 28 Jul 2005 21:56:50 GMT""}]","2014-05-27"
"quant-ph/0502122","Christian Lunkes","C. Lunkes, C. Brukner, V. Vedral","Natural multiparticle entanglement in a Fermi gas","Replaced with revised edition","Phys. Rev. Lett. 95, 030503 (2005)","10.1103/PhysRevLett.95.030503",,"quant-ph",,"  We investigate multipartite entanglement in a non-interacting fermion gas, as
a function of fermion separation, starting from the many particle fermion
density matrix. We prove that all multiparticle entanglement can be built only
out of two-fermion entanglement. Although from the Pauli exclusion principle we
would always expect entanglement to decrease with fermion distance, we
surprisingly find the opposite effect for certain fermion configurations. The
von Neumann entropy is found to be proportional to the volume for a large
number of particles even when they are arbitrarily close to each other. We will
illustrate our results using different configurations of two, three, and four
fermions at zero temperature although all our results can be applied to any
temperature and any number of particles.
","[{""version"":""v1"",""created"":""Sun, 20 Feb 2005 12:32:44 GMT""},{""version"":""v2"",""created"":""Mon, 29 Aug 2005 16:33:14 GMT""}]","2009-11-11"
