"cond-mat/0504421","Changqing Jin","Wen Yu, Linyan Li and Changqing Jin","Pressure induced metallization of Cu3N",,,"10.1007/s10853-005-0638-3",,"cond-mat.mtrl-sci",,"  We employed accurate full potential density-functional theory and linearized
augmented plane wave method to investigate the electronic properties and
possible phase transitions of Cu3N under high pressure. The anti perovskite
structure Cu3N is a semiconductor with a small indirect band gap at ambient
pressure. The band gap becomes narrower with increasing pressure, and the
semi-conducting anti ReO3 structure undergoes a semiconductor to semimetal
transition at pressure around 8.0 GPa. At higher pressure, a subsequent
semimetal to metal transition could take place above 15GPa with a structural
transition from anti ReO3 to Cu3Au structure.
","[{""version"":""v1"",""created"":""Mon, 18 Apr 2005 03:34:26 GMT""}]","2009-11-11"
"cond-mat/0504423","Julian Poulter Prof.","J. Poulter and J.A. Blackman","An exact algorithm for spin correlation functions of the two dimensional
  +/-J Ising spin glass in the ground state","Latex file with 5 figures (postscipt). Submitted to PRB","Phys. Rev. B vol. 72, 104422 (2005)","10.1103/PhysRevB.72.104422",,"cond-mat.dis-nn",,"  We introduce an exact algorithm for the computation of spin correlation
functions for the two dimensional +/-J Ising spin glass in the ground state.
Unlike with the transfer matrix method, there is no particular restriction on
the shape of the lattice sample, and unlike Monte Carlo based methods it avoids
extrapolation from finite temperatures. The computational requirements depend
only on the number and distribution of frustrated plaquettes.
","[{""version"":""v1"",""created"":""Mon, 18 Apr 2005 04:35:47 GMT""}]","2007-05-23"
"cond-mat/0504424","Olivier Fruchart","Olivier Fruchart (LLN)","Epitaxial self-organization: from surfaces to magnetic materials","13 pages, submitted in 2004. Part of a Special Issue about
  Self-organization on surfaces, published in C. R. Physique","Comptes Rendus Physique 6 (2005) 61","10.1016/j.crhy.2004.11.007",,"cond-mat.other",,"  Self-organization of magnetic materials is an emerging and active field. An
overview of the use of self-organization for magnetic purposes is given, with a
view to illustrate aspects that cannot be covered by lithography. A first set
of issues concerns the quantitative study of low-dimensional magnetic phenomena
(1D and 0D). Such effects also occur in microstructured and
lithographically-patterned materials but cannot be studied in these because of
the complexity of such materials. This includes magnetic ordering, magnetic
anisotropy and superparamagnetism. A second set of issues concerns the
possibility to directly use self-organization in devices. Two sets of examples
are given: first, how superparamagnetism can be fought by fabricating thick
self-organized structures, and second, what new or improved functionalities can
be expected from self-organized magnetic systems, like the tailoring of
magnetic anisotropy or controlled dispersion of properties.
","[{""version"":""v1"",""created"":""Mon, 18 Apr 2005 05:40:15 GMT""}]","2007-05-23"
"cond-mat/0504425","Anton Ramsak","J. Mravlje, A. Ramsak, and T. Rejec","Conductance of deformable molecules with interaction","4 pages, color figures","Phys. Rev. B 72, 121403(R) (2005)","10.1103/PhysRevB.72.121403",,"cond-mat.mes-hall",,"  Zero temperature linear response conductance of molecules with Coulomb
interaction and with various types of phonon modes is analysed together with
local occupation, local moment, charge fluctuations and fluctuations of
molecular deformation. Deformation fluctuations are quantitatively related to
charge fluctuations which exhibit similarity also to static charge
susceptibility.
","[{""version"":""v1"",""created"":""Mon, 18 Apr 2005 12:22:24 GMT""}]","2009-11-11"
"cond-mat/0504427","Pierre-Olivier Jubert","M. Klaui, P.-O. Jubert, R. Allenspach, A. Bischof, J. A. C. Bland, G.
  Faini, U. Rudiger, C. A. F. Vaz, L. Vila, C. Vouille","Direct observation of domain-wall configurations transformed by spin
  currents","5 pages, 3 figures","Phys. Rev. Lett. 95, 026601 (2005)","10.1103/PhysRevLett.95.026601",,"cond-mat.other",,"  Direct observations of current-induced domain-wall propagation by
spin-polarized scanning electron microscopy are reported. Current pulses move
head-to-head as well as tail-to-tail walls in sub-micrometer Fe_{20}Ni_{80}
wires in the direction of the electron flow, and a decay of the wall velocity
with the number of injected current pulses is observed. High-resolution images
of the domain walls reveal that the wall spin structure is transformed from a
vortex to a transverse configuration with subsequent pulse injections. The
change in spin structure is directly correlated with the decay of the velocity.
","[{""version"":""v1"",""created"":""Mon, 18 Apr 2005 08:59:04 GMT""},{""version"":""v2"",""created"":""Mon, 11 Jul 2005 08:29:40 GMT""}]","2009-11-11"
"cond-mat/0504428","Enis Tuncer","Enis Tuncer and J. Ross Macdonald","Comparison of methods for estimating continuous distributions of
  relaxation times","4 pages and 4 figures",,"10.1063/1.2188053",,"cond-mat.mtrl-sci cond-mat.dis-nn",,"  The nonparametric estimation of the distribution of relaxation times approach
is not as frequently used in the analysis of dispersed response of dielectric
or conductive materials as are other immittance data analysis methods based on
parametric curve fitting techniques. Nevertheless, such distributions can yield
important information about the physical processes present in measured
material. In this letter, we apply two quite different numerical inversion
methods to estimate the distribution of relaxation times for glassy \lila\
dielectric frequency-response data at $225 \kelvin$. Both methods yield unique
distributions that agree very closely with the actual exact one accurately
calculated from the corrected bulk-dispersion Kohlrausch model established
independently by means of parametric data fit using the corrected modulus
formalism method. The obtained distributions are also greatly superior to those
estimated using approximate functions equations given in the literature.
","[{""version"":""v1"",""created"":""Mon, 18 Apr 2005 09:47:27 GMT""}]","2009-11-11"
"cond-mat/0504429","K. Razi Naqvi","K. Razi Naqvi","On the diffusion coefficient of a photon migrating through a turbid
  medium: a fresh look from a broader perspective","4 pages; typos corrected",,,,"cond-mat.other",,"  Does the diffusion coefficient of a photon depend on time $t$ or the
probability of absorption $k$? To find an answer to the question, photon
transport in a medium of infinite extent is analyzed using the method of
moments. It is pointed out that if $D$ is defined so as to make it depend on
$t$ or $k$, it will also depend on the experimental conditions; that the
parameter $k$ which enters the stationary diffusion equation is in general
different from that entering the transient version; and that a hitherto unused
non-Markovian partial differential equation may be used for treating photon
transport.
","[{""version"":""v1"",""created"":""Mon, 18 Apr 2005 10:47:27 GMT""},{""version"":""v2"",""created"":""Thu, 9 Jun 2005 12:43:35 GMT""}]","2007-05-23"
"cond-mat/0504430","Serdar Sakarya","S. Sakarya, N.H. van Dijk, and E. Bruck","Determination of the magnetic domain size in the ferromagnetic
  superconductor UGe2 by three dimensional neutron depolarization","7 pages, 4 figure, 1 table","Phys. Rev. B 71, 174417 (2005)","10.1103/PhysRevB.71.174417",,"cond-mat.str-el",,"  Three dimensional neutron depolarization measurements have been carried out
on single-crystalline UGe2 between 4 K and 80 K in order to determine the
average ferromagnetic domain size d. It is found that below T_C = 52K uniaxial
ferromagnetic domains are formed with an estimated magnetic domain size of d =
4 - 5 micrometer.
","[{""version"":""v1"",""created"":""Mon, 18 Apr 2005 11:26:52 GMT""}]","2009-11-11"
"cond-mat/0504431","Rubin Pavel","N. Kristoffel, T. Ord and P. Rubin","Cuprate interband model and doping dependence of the coherence length","15 pages, 3 Postscript figures",,,,"cond-mat.supr-con",,"  The free energy expansion of a two-band pair-transfer superconductor is
developed. A critical in temperature and a noncritical coherence length appear.
The effective in-plane $\xi_{ab}$, $H_{c2}\sp c\sim \xi_{ab}\sp{-2}$ and the
thermodynamic critical magnetic field ($H_{c0}$) on the whole hole doping ($p$)
scale are calculated for a ""typical'' cuprate. A doping-prepared bare spectrum
with normal state gaps quenched by doping has been used. The coherence length
$\xi_{ab}$ falls with $p$ first rapidly. A moderate enhancement starts when the
""cold'' defect band overlap with the valence band is reached. At overdoping
$\xi_{ab}$ rises markedly. The $H_{c2}\sp c$ curve shows a maximum before
$T_{cmax}$. The bell-like $H_{c0}$-curve follows closely $T_c$, superconducting
gaps, and superfluid density. The theoretical $\xi_{ab}(p)$ nonmonotonic curve
on the whole doping scale agrees with a recent experimental finding.
","[{""version"":""v1"",""created"":""Mon, 18 Apr 2005 11:38:10 GMT""},{""version"":""v2"",""created"":""Tue, 14 Jun 2005 08:36:28 GMT""}]","2007-05-23"
"cond-mat/0504432","Johannes Frantti","Johannes Frantti","Comment on ``Comparison of the $Cc$ and $R3c$ space groups for the
  superlattice phase of Pb(Zr$_{0.52}$Ti$_{0.48}$)O$_3$''","4 pages, 2 figures",,,,"cond-mat.mtrl-sci",,"  The two-phase (space groups $Cc$ and $Cm$) structural model recently proposed
for the modeling of the neutron powder diffaction pattern collected on
Pb(Zr$_x$Ti$_{1-x}$)O$_3$ (PZT) sample with $x\approx 0.52$ [R. Ranjan, A. K.
Singh, Ragini, and D. Pandey. \textit{Phys. Rev. B} \textbf{71}, 092101 (2005)]
is shown to neglect the $hkl$ dependent (anisotropic) line broadening. The most
serious problem with this model is that it assigns octahedral tilts to a wrong
phase. Instead of correctly taking the anisotropic line broadening into
account, this model used low symmetry phases to minimize the residuals during
Rietveld refinement. The essential features of a model taking the $hkl$
dependent line broadening into account are summarized. It has already been
reported that once the anisotropic line broadening, revealed by high resolution
neutron powder diffraction instrument, is correctly taken into account the
model with $R3c$ and $Cm$ space group symmetries describes all Bragg peaks and
their intensities well [J. Frantti, S. Eriksson, S. Hull, V. Lantto, H.
Rundl\""of, and M. Kakihana. \textit{J. Phys.: Condens. Matter} \textbf{15},
6031 (2003).]. It was further shown that the $Cm+R3c$ model is consistent with
the structural features observed at other compositions and temperatures, which
is particularly important in the vicinity of the phase boundary. Also problems
related to sample preparation and data collection are pointed out.
","[{""version"":""v1"",""created"":""Mon, 18 Apr 2005 11:51:05 GMT""},{""version"":""v2"",""created"":""Mon, 4 Jul 2005 06:47:26 GMT""}]","2007-05-23"
"cond-mat/0504433","Maxim Kharitonov","M. Yu. Kharitonov and M. V. Feigel'man","Enhancement of Superconductivity in Disordered Films by Parallel
  Magnetic Field","4 pages, 2 figures","JETP Lett. 82, 421 (2005) [Pis'ma Zh. Eksp. Teor. Fiz. 82, 473
  (2005)]","10.1134/1.2142869",,"cond-mat.supr-con cond-mat.mes-hall",,"  We show that the superconducting transition temperature T_c(H) of a very thin
highly disordered film with strong spin-orbital scattering can be increased by
parallel magnetic field H. This effect is due to polarization of magnetic
impurity spins which reduces the full exchange scattering rate of electrons;
the largest effect is predicted for spin-1/2 impurities. Moreover, for some
range of magnetic impurity concentrations the phenomenon of {\it
superconductivity induced by magnetic field} is predicted: superconducting
transition temperature T_c(H) is found to be nonzero in the range of magnetic
fields $0 < H^* <= H <= H_c$.
","[{""version"":""v1"",""created"":""Mon, 18 Apr 2005 13:51:24 GMT""}]","2009-11-11"
"cond-mat/0504434","Martin Oettel","M. Oettel, A. Dominguez, and S. Dietrich","Attractions between charged colloids at water interfaces","8 pages, 1 figure, revised version (one paragraph added) accepted in
  JPCM","J. Phys.: Condens. Matter 17 (2005) L337","10.1088/0953-8984/17/32/L02",,"cond-mat.soft",,"  The effective potential between charged colloids trapped at water interfaces
is analyzed. It consists of a repulsive electrostatic and an attractive
capillary part which asymptotically both show dipole--like behavior. For
sufficiently large colloid charges, the capillary attraction dominates at large
separations.
  The total effective potential exhibits a minimum at intermediate separations
if the Debye screening length of water and the colloid radius are of comparable
size.
","[{""version"":""v1"",""created"":""Mon, 18 Apr 2005 13:37:22 GMT""},{""version"":""v2"",""created"":""Mon, 1 Aug 2005 06:44:10 GMT""}]","2016-08-31"
"cond-mat/0504435","Nicole Helbig","N.N. Lathiotakis, N. Helbig, E.K.U. Gross","Open shells in reduced-density-matrix-functional theory","4 pages, 2 figures, corrected typos","Physical Review A 72, 030501(R) (2005)","10.1103/PhysRevA.72.030501",,"cond-mat.str-el",,"  Reduced-density-matrix-functional theory is applied to open-shell systems. We
introduce a spin-restricted formulation by appropriately expressing approximate
correlation-energy functionals in terms of spin-dependent occupation numbers
and spin-independent natural orbitals. We demonstrate that the additional
constraint of total-spin conservation is indispensable for the proper treatment
of open-shell systems. The formalism is applied to the first-row open-shell
atoms. The obtained ground-state energies are in very good agreement with the
exact values as well as other state of the art quantum chemistry calculations
","[{""version"":""v1"",""created"":""Mon, 18 Apr 2005 13:37:43 GMT""},{""version"":""v2"",""created"":""Fri, 22 Apr 2005 14:46:57 GMT""},{""version"":""v3"",""created"":""Wed, 3 Aug 2005 21:14:59 GMT""}]","2007-05-23"
"cond-mat/0504436","Nicole Helbig","N. Helbig, N.N. Lathiotakis, M. Albrecht, E.K.U. Gross","Discontinuity of the chemical potential in
  reduced-density-matrix-functional theory","9 pages, 3 figures, version as published","Europhys. Lett. 77, 67003 (2007)","10.1209/0295-5075/77/67003",,"cond-mat.str-el",,"  We present a novel method for calculating the fundamental gap. To this end,
reduced-density-matrix-functional theory is generalized to fractional particle
number. For each fixed particle number, $M$, the total energy is minimized with
respect to the natural orbitals and their occupation numbers. This leads to a
function, $E_{\mathrm{tot}}^M$, whose derivative with respect to the particle
number has a discontinuity identical to the gap. In contrast to density
functional theory, the energy minimum is generally not a stationary point of
the total-energy functional. Numerical results, presented for alkali atoms, the
LiH molecule, the periodic one-dimensional LiH chain, and solid Ne, are in
excellent agreement with CI calculations and/or experimental data.
","[{""version"":""v1"",""created"":""Mon, 18 Apr 2005 13:45:25 GMT""},{""version"":""v2"",""created"":""Fri, 22 Apr 2005 13:38:33 GMT""},{""version"":""v3"",""created"":""Mon, 7 May 2007 11:09:37 GMT""}]","2009-11-11"
"cond-mat/0504437","Rene Roij van","Jos Zwanikken and rene van Roij","The sediment of mixtures of charged colloids: segregation and
  inhomogeneous electric fields",,,"10.1209/epl/i2005-10096-0",,"cond-mat.soft",,"  We theoretically study sedimentation-diffusion equilibrium of dilute binary,
ternary, and polydisperse mixtures of colloidal particles with different
buoyant masses and/or charges. We focus on the low-salt regime, where the
entropy of the screening ions drives spontaneous charge separation and the
formation of an inhomogeneous macroscopic electric field. The resulting
electric force lifts the colloids against gravity, yielding highly
nonbarometric and even nonmonotonic colloidal density profiles. The most
profound effect is the phenomenon of segregation into layers of colloids with
equal mass-per-charge, including the possibility that heavy colloidal species
float onto lighter ones.
","[{""version"":""v1"",""created"":""Mon, 18 Apr 2005 14:00:45 GMT""}]","2009-11-11"
"cond-mat/0504438","Eran Bouchbinder","Eran Bouchbinder and Itamar Procaccia","Non-universality in Micro-branching Instabilities in Rapid Fracture: the
  Role of Material Properties","4 pages, 6 figures, PRL submitted","Phys. Rev. E (Rapid Communication) 72, 055103 (2005)","10.1103/PhysRevE.72.055103",,"cond-mat.mtrl-sci",,"  In spite of the apparent similarity of micro-branching instabilities in
different brittle materials, we propose that the physics determining the
typical length- and time-scales characterizing the post-instability patterns
differ greatly from material to material. We offer a scaling theory connecting
the pattern characteristics to material properties (like molecular weight) in
brittle plastics like PMMA, and stress the fundamental differences with
patterns in glass which are crucially influenced by 3-dimensional dynamics. In
both cases the present ab-initio theoretical models are still too far from
reality, disregarding some fundamental physics of the phenomena.
","[{""version"":""v1"",""created"":""Mon, 18 Apr 2005 14:18:50 GMT""}]","2009-11-11"
"cond-mat/0504439","Ali Naji","Ali Naji and Roland R. Netz","Attraction of like-charged macroions in the strong-coupling limit","16 pages, 10 figures","Eur. Phys. J. E 13, 43 (2004)",,,"cond-mat.soft",,"  Like-charged macroions attract each other as a result of strong electrostatic
correlations in the presence of multivalent counterions or at low temperatures.
We investigate the effective electrostatic interaction between i) two
like-charged rods and ii) two like-charged spheres using the recently
introduced strong-coupling theory, which becomes asymptotically exact in the
limit of large coupling parameter (i.e. for large counterion valency, low
temperature, or high surface charge density on macroions). Since we deal with
curved surfaces, an additional parameter, referred to as Manning parameter, is
introduced, which measures the ratio between the radius of curvature of
macroions to the Gouy-Chapman length and controls the counterion-condensation
process that directly affects the effective interactions. For sufficiently
large Manning parameters (weakly-curved surfaces), we find a strong long-ranged
attraction between two macroions that form a closely-packed bound state with
small surface-to-surface separation of the order of the counterion diameter in
agreement with recent simulations. For small Manning parameters (highly-curved
surfaces), on the other hand, the equilibrium separation increases and the
macroions unbind from each other as the confinement volume increases to
infinity. This occurs via a continuous universal unbinding transition for two
charged rods at a threshold Manning parameter of 2/3, while the transition is
discontinuous for spheres because of a pronounced potential barrier at
intermediate distances.
","[{""version"":""v1"",""created"":""Mon, 18 Apr 2005 15:02:16 GMT""}]","2007-05-23"
"cond-mat/0504440","Ali Naji","Heiko Ahrens, Stephan Foerster, Christiane A. Helm, N. Arun Kumar, Ali
  Naji, Roland R. Netz, Christian Seidel","Non-linear Osmotic Brush Regime: Experiments, Simulations and Scaling
  Theory","18 pages, 6 figures","J. Phys. Chem. B 108, 16870 (2004)",,,"cond-mat.soft",,"  We experimentally and theoretically consider highly condensed planar brushes
made of charged polymers. Using x-ray reflectivity on polyelectrolytes which
are anchored at the water-air interface, it is shown that such strongly
stretched brushes show a slight but detectable height variation upon lateral
compression. This stands in contrast to the well-accepted scaling relation in
the so-called osmotic brush regime, which predicts the brush height to be
independent of the grafting density. Similar effects are seen in simulations on
highly compressed charged brushes. Scaling arguments which go beyond the linear
approximation for the entropy of confined counterions and for weak
chain-stretching are able to explain those findings on a semi-quantitative
level.
","[{""version"":""v1"",""created"":""Mon, 18 Apr 2005 15:31:11 GMT""}]","2007-05-23"
"cond-mat/0504441","Steven C. Erwin","Steven C. Erwin and C. Stephen Hellberg","Phase transition at finite temperature in one dimension: Adsorbate
  ordering in Ba/Si(111)3x2","11 pages + 4 figures. Surf. Sci. Lett. (in press)",,"10.1016/j.susc.2005.04.026",,"cond-mat.mtrl-sci cond-mat.stat-mech",,"  We demonstrate that the Ba-induced Si(111)3x2 reconstruction is a physical
realization of a one-dimensional antiferromagnetic Ising model with long-range
Coulomb interactions. Monte Carlo simulations performed on a corresponding
Coulomb-gas model, which we construct based on density-functional calculations,
reveal an adsorbate-ordering phase transition at finite temperature. We show
numerically that this unusual one-dimensional phase transition should be
detectable by low-energy electron diffraction.
","[{""version"":""v1"",""created"":""Mon, 18 Apr 2005 15:35:45 GMT""}]","2009-11-11"
"cond-mat/0504443","J. Mira","A. Fondado, J. Mira, J. Rivas","Power-law decay in first-order relaxation processes","to appear in Phys. Rev. B; 4 figures",,"10.1103/PhysRevB.72.024302",,"cond-mat.mtrl-sci",,"  Starting from a simple definition of stationary regime in first-order
relaxation processes, we obtain that experimental results are to be fitted to a
power-law when approaching the stationary limit. On the basis of this result we
propose a graphical representation that allows the discrimination between
power-law and stretched exponential time decays. Examples of fittings of
magnetic, dielectric and simulated relaxation data support the results.
","[{""version"":""v1"",""created"":""Mon, 18 Apr 2005 15:43:18 GMT""}]","2009-11-11"
"cond-mat/0504444","Mark Ancliff","M. Ancliff and B. A. Muzykantskii","A minimal approach for the local statistical properties of a
  one-dimensional disordered wire","10 pages, 0 figures","J. Phys. A: Math. Gen. 38 (2005) 5751-5760","10.1088/0305-4470/38/25/010",,"cond-mat.mes-hall",,"  We consider a one-dimensional wire in gaussian random potential. By treating
the spatial direction as imaginary time, we construct a `minimal'
zero-dimensional quantum system such that the local statistical properties of
the wire are given as products of statistically independent matrix elements of
the evolution operator of the system. The space of states of this quantum
system is found to be a particular non-unitary, infinite dimensional
representation of the pseudo-unitary group, U(1,1). We show that our
construction is minimal in a well defined sense, and compare it to the
supersymmetry and Berezinskii techniques.
","[{""version"":""v1"",""created"":""Mon, 18 Apr 2005 15:48:34 GMT""}]","2009-11-11"
"cond-mat/0504445","Sander van Smaalen","Sander van Smaalen, Lukas Palatinus and Andreas Schonleber","Incommensurate interactions and non-conventional spin-Peierls transition
  in TiOBr","5 pages including 3 figures and 1 table","Phys. Rev. B 72, 020105(R), 2005","10.1103/PhysRevB.72.020105",,"cond-mat.other",,"  Temperature-dependent x-ray diffraction of the low-dimensional spin 1/2
quantum magnet TiOBr shows that the phase transition at T_{c2} = 47.1 (4) K
corresponds to the development of an incommensurate superstructure. Below
T_{c1} = 26.8 \pm 0.3 K the incommensurate modulation locks in into a two-fold
superstructure similar to the low-temperature spin-Peierls state of TiOCl.
Frustration between intra- and interchain interations within the spin-Peierls
scenario, and competition between two-dimensional magnetic order and
one-dimensional spin-Peierls order are discussed as possible sources of the
incommensurability.
","[{""version"":""v1"",""created"":""Mon, 18 Apr 2005 15:57:28 GMT""}]","2007-05-23"
"cs/0504079","Boris Ryabko","Boris Ryabko, Jaakko Astola","Prediction of Large Alphabet Processes and Its Application to Adaptive
  Source Coding","submitted",,,,"cs.IT math.IT",,"  The problem of predicting a sequence $x_1,x_2,...$ generated by a discrete
source with unknown statistics is considered. Each letter $x_{t+1}$ is
predicted using information on the word $x_1x_2... x_t$ only. In fact, this
problem is a classical problem which has received much attention. Its history
can be traced back to Laplace. We address the problem where each $x_i$ belongs
to some large (or even infinite) alphabet. A method is presented for which the
precision is greater than for known algorithms, where precision is estimated by
the Kullback-Leibler divergence. The results can readily be translated to
results about adaptive coding.
","[{""version"":""v1"",""created"":""Sun, 17 Apr 2005 16:32:03 GMT""},{""version"":""v2"",""created"":""Thu, 21 Apr 2005 17:42:23 GMT""}]","2009-09-29"
