"hep-ph/0504152","Georg Raffelt","Georg G. Raffelt","Axions: Recent searches and new limits","Contribution to XI International Workshop on ""Neutrino Telescopes""
  (22-25 Feb 2005, Venice, Italy)",,,"MPP-2005-29","hep-ph",,"  The CERN Axion Solar Telescope (CAST) experiment searches for solar axions by
the ""helioscope"" method. First results imply an upper limit on the axion-photon
coupling of g_a-gamma < 1.16 x 10^-10 GeV^-1 (95% CL) for m_a < 0.02 eV, in
this mass range superseding the previous energy-loss limit from globular
cluster stars. By virtue of a variable-pressure helium filling of the magnetic
transition region, CAST II will extend the sensitivity to axion masses up to
about 1 eV, for the first time testing realistic axion parameters in a
laboratory experiment. In this mass range axions would contribute a cosmic hot
dark matter component. New structure-formation limits imply that m_a < 1-2 eV.
For the particular case of hadronic axions with a standard axion-pion coupling,
the present-day cosmic axion density would be about 50 cm^-3 and the cosmic
mass limit is m_a < 1.05 eV (95% CL). We also comment on the axion
interpretation of the anomalous signature observed in the PVLAS experiment.
","[{""version"":""v1"",""created"":""Mon, 18 Apr 2005 13:20:14 GMT""},{""version"":""v2"",""created"":""Mon, 2 May 2005 18:45:05 GMT""}]","2007-05-23"
"hep-ph/0504153","Walter Grimus","W. Grimus, L. Lavoura","S3 x Z2 model for neutrino mass matrices","13 pages, 3 figures, final version for publication in JHEP","JHEP0508:013,2005","10.1088/1126-6708/2005/08/013","UWThPh-2005-5","hep-ph",,"  We propose a model for lepton mass matrices based on the seesaw mechanism, a
complex scalar gauge singlet and a horizontal symmetry $S_3 \times
\mathbbm{Z}_2$. In a suitable weak basis, the charged-lepton mass matrix and
the neutrino Dirac mass matrix are diagonal, but the vacuum expectation value
of the scalar gauge singlet renders the Majorana mass matrix of the
right-handed neutrinos non-diagonal, thereby generating lepton mixing. When the
symmetry $S_3$ is not broken in the scalar potential, the effective
light-neutrino Majorana mass matrix enjoys $\mu$--$\tau$ interchange symmetry,
thus predicting maximal atmospheric neutrino mixing together with $U_{e3} = 0$.
A partial and less predictive form of $\mu$--$\tau$ interchange symmetry is
obtained when the symmetry $S_3$ is softly broken in the scalar potential.
Enlarging the symmetry group $S_3 \times \mathbbm{Z}_2$ by an additional
discrete electron-number symmetry $\mathbbm{Z}_2^{(e)}$, a more predicitive
model is obtained, which is in practice indistinguishable from a previous one
based on the group $D_4$.
","[{""version"":""v1"",""created"":""Mon, 18 Apr 2005 15:54:03 GMT""},{""version"":""v2"",""created"":""Tue, 2 Aug 2005 13:54:03 GMT""}]","2009-11-11"
"hep-th/0504141","Takashi Torii","Takashi Torii and Hideki Maeda","Spacetime structure of static solutions in Gauss-Bonnet gravity: charged
  case","20 pages, 10 figures","Phys.Rev.D72:064007,2005","10.1103/PhysRevD.72.064007",,"hep-th gr-qc",,"  We have studied spacetime structures of static solutions in the
$n$-dimensional Einstein-Gauss-Bonnet-Maxwell-$\Lambda$ system. Especially we
focus on effects of the Maxwell charge. We assume that the Gauss-Bonnet
coefficient $\alpha$ is non-negative and $4{\tilde \alpha}/\ell^2\leq 1$ in
order to define the relevant vacuum state. Solutions have the
$(n-2)$-dimensional Euclidean sub-manifold whose curvature is $k=1,~0$, or -1.
In Gauss-Bonnet gravity, solutions are classified into plus and minus branches.
In the plus branch all solutions have the same asymptotic structure as those in
general relativity with a negative cosmological constant. The charge affects a
central region of the spacetime. A branch singularity appears at the finite
radius $r=r_b>0$ for any mass parameter. There the Kretschmann invariant
behaves as $O((r-r_b)^{-3})$, which is much milder than divergent behavior of
the central singularity in general relativity $O(r^{-4(n-2)})$. Some charged
black hole solutions have no inner horizon in Gauss-Bonnet gravity. Although
there is a maximum mass for black hole solutions in the plus branch for $k=-1$
in the neutral case, no such maximum exists in the charged case. The solutions
in the plus branch with $k=-1$ and $n\geq6$ have an ""inner"" black hole, and
inner and the ""outer"" black hole horizons. Considering the evolution of black
holes, we briefly discuss a classical discontinuous transition from one black
hole spacetime to another.
","[{""version"":""v1"",""created"":""Mon, 18 Apr 2005 03:06:56 GMT""}]","2014-11-18"
"math/0504346","Rui Pedro Carpentier","Rui Pedro Carpentier","Representations of non-singular planar tangles by operators","61 pages, 32 figures",,,,"math.GT math.CT",,"  In this paper we study how to distinguish two embeddings of a finite
collection of disjoint circles into the plane up to planar isotopy. We adopt
the spirit of the approach by V. Turaev, Operator Invariants of Tangles, Math.
USSR-Izv. 35 (1990), 411--444, by considering a category of planar tangles and
representing it in an ``algebraic'' category. From this we can extract a
numerical invariant for embeddings of a finite collection of disjoint circles
and this invariant is, up to certain choices, complete.
","[{""version"":""v1"",""created"":""Sun, 17 Apr 2005 22:28:46 GMT""}]","2007-05-23"
"math/0504347","Benoit Dherin","Benoit Dherin","The Universal Generating Function of Analytical Poisson Structures","15 pages, 2 figures, shorter version, introductive part removed",,"10.1007/s11005-005-0034-6",,"math.SG math-ph math.MP",,"  The notion of generating functions of Poisson structures was first studied in
math.SG/0312380.They are special functions which induce, on open subsets of
$\R^d$, a Poisson structure together with the local symplectic groupoid
integrating it. A universal generating function was provided in terms of a
formal power series coming from Kontsevich star product. The present article
proves that this universal generating function converges for analytical Poisson
structures and compares the induced local symplectic groupoid with the phase
space of Karasev--Maslov.
","[{""version"":""v1"",""created"":""Sun, 17 Apr 2005 17:51:49 GMT""},{""version"":""v2"",""created"":""Tue, 10 May 2005 17:14:43 GMT""},{""version"":""v3"",""created"":""Thu, 23 Jun 2005 12:51:00 GMT""}]","2009-11-11"
"math/0504348","Guadalupe Lozano","Nicholas M. Ercolani (Dept. of Mathematics, University of Arizona,
  Tucson, AZ, USA), Guadalupe I. Lozano (Dept. of Mathematics, University of
  Michigan, Ann Arbor, MI, USA)","A Bi-Hamiltonian Structure for the Integrable, Discrete Non-Linear
  Schrodinger System","33 pages",,"10.1016/j.physd.2006.04.014",,"math.SG math.DS",,"  This paper shows that the Ablowitz-Ladik hierarchy of equations (a well-known
integrable discretization of the Non-linear Schrodinger system) can be
explicitly viewed as a hierarchy of commuting flows which: (a) are Hamiltonian
with respect to both a standard, local Poisson operator J and a new non-local,
skew, almost Poisson operator K, on the appropriate space; (b) can be
recursively generated from a recursion operator R (obtained by composing K and
the inverse of J.) In addition, the proof of these facts relies upon two new
pivotal resolvent identities which suggest a general method for uncovering
bi-Hamiltonian structures for other families of discrete, integrable equations.
","[{""version"":""v1"",""created"":""Sun, 17 Apr 2005 18:12:55 GMT""}]","2009-11-11"
"math/0504349","Mark Sapir","A.Yu. Olshanskii","Groups with quadratic-non-quadratic Dehn functions","16 pages",,,,"math.GR math.GT",,"  We construct a finitely presented group $G$ with non-quadratic Dehn function
$f$ majorizable by a quadratic function on arbitrary long intervals.
","[{""version"":""v1"",""created"":""Sun, 17 Apr 2005 19:20:31 GMT""}]","2007-05-23"
"math/0504350","Mark Sapir","A.Yu. Olshanskii, M. V. Sapir","A finitely presented group with two non-homeomorphic asymptotic cones","6 pages",,,,"math.GR",,"  We give an example of a finitely presented group $G$ with two
non-$\pi_1$-equivalent asymptotic cones.
","[{""version"":""v1"",""created"":""Sun, 17 Apr 2005 19:26:15 GMT""}]","2007-05-23"
"math/0504351","Joel David Hamkins","Joel David Hamkins (The City University of New York) and Alexei
  Miasnikov (The City University of New York)","The halting problem is decidable on a set of asymptotic probability one","10 pages",,,,"math.LO",,"  The halting problem for Turing machines is decidable on a set of asymptotic
probability one. Specifically, there is a set B of Turing machine programs such
that (i) B has asymptotic probability one, so that as the number of states n
increases, the proportion of all n-state programs that are in B goes to one;
(ii) B is polynomial time decidable; and (iii) the halting problem H intersect
B is polynomial time decidable. The proof is sensitive to the particular
computational model.
","[{""version"":""v1"",""created"":""Mon, 18 Apr 2005 01:01:05 GMT""}]","2007-05-23"
"math/0504352","Yang Han","Yang Han and Yunge Xu","Hochschild (co)homology of exterior algebras","21 pages",,,,"math.RA math.RT",,"  The minimal projective bimodule resolutions of the exterior algebras are
explicitly constructed. They are applied to calculate the Hochschild
(co)homology of the exterior algebras. Thus the cyclic homology of the exterior
algebras can be calculated in case the underlying field is of characteristic
zero. Moreover, the Hochschild cohomology rings of the exterior algebras are
determined by generators and relations.
","[{""version"":""v1"",""created"":""Mon, 18 Apr 2005 03:34:45 GMT""},{""version"":""v2"",""created"":""Fri, 18 Nov 2005 03:11:18 GMT""}]","2007-05-23"
"math/0504353","Alexander Isaev","A. V. Isaev","Analogues of Rossi's map and E. Cartan's classification of homogeneous
  strongly pseudoconvex 3-dimensional hypersurfaces","19 pages",,,,"math.CV math.DG",,"  We introduce analogues of a map due to Rossi and show how they can be used to
explicitly determine all covers of certain homogeneous strongly pseudoconvex
3-dimensional hypersurfaces that appear in the classification obtained by E.
Cartan in 1932.
","[{""version"":""v1"",""created"":""Mon, 18 Apr 2005 07:41:45 GMT""},{""version"":""v2"",""created"":""Mon, 29 Aug 2005 00:41:00 GMT""},{""version"":""v3"",""created"":""Tue, 20 Sep 2005 23:42:25 GMT""},{""version"":""v4"",""created"":""Mon, 24 Oct 2005 21:46:29 GMT""}]","2007-05-23"
"math/0504354","Helge Glockner","Helge Glockner","Locally compact groups built up from p-adic Lie groups, for p in a given
  set of primes","25 pages, LaTeX; v2: A counterexample has been added which shows that
  (as desired) the two construction principles yield different classes of
  groups",,,,"math.GR",,"  We analyze the structure of locally compact groups which can be built up from
p-adic Lie groups, for p in a given set of primes. In particular, we calculate
the scale function and determine tidy subgroups for such groups, and use them
to recover the primes needed to build up the group.
","[{""version"":""v1"",""created"":""Mon, 18 Apr 2005 10:01:03 GMT""},{""version"":""v2"",""created"":""Sun, 4 Sep 2005 00:15:39 GMT""}]","2007-05-23"
"math/0504355","Dhananjay Mehendale","Dhananjay P. Mehendale","Some Observations on the 3x+1 Problem","5 pages",,,,"math.GM",,"  We present some interesting observations on the 3x+1 problem. We propose a
new algorithm which eliminates certain steps while we check the action of 3x+1
procedure on a number. Also, we propose a reason why many numbers follow a
similar pattern during execution of 3x+1 algorithm. We advocate towards the end
(a heuristic argument) that the 3x+1 conjecture is more likely to be true than
false.
","[{""version"":""v1"",""created"":""Mon, 18 Apr 2005 10:22:04 GMT""}]","2007-05-23"
"math/0504356","Jose Ignacio Cogolludo","Jose Ignacio Cogolludo and Vincent Florens","Twisted Alexander polynomials of Plane Algebraic Curves","16 pages, no figures",,,,"math.GT math.AG",,"  We consider the Alexander polynomial of a plane algebraic curve twisted by a
linear representation. We show that it divides the product of the polynomials
of the singularity links, for unitary representations. Moreover, their quotient
is given by the determinant of its Blanchfield intersection form. Specializing
in the classical case, this gives a geometrical interpretation of Libgober's
divisibility Theorem. We calculate twisted polynomials for some algebraic
curves and show how they can detect Zariski pairs of equivalent Alexander
polynomials and that they are sensitive to nodal degenerations.
","[{""version"":""v1"",""created"":""Mon, 18 Apr 2005 10:35:22 GMT""},{""version"":""v2"",""created"":""Thu, 11 Aug 2005 11:18:29 GMT""}]","2007-05-23"
"math/0504357","Wieslaw Kubi\'s","Wieslaw Kubi\'s, Matatyahu Rubin","Extension and reconstruction theorems for the Urysohn universal metric
  space","Final and shortened version, 25 pages, to appear in Czechoslovak
  Math. J","Czechoslovak Math. J. 60(135) (2010), no. 1, 1--29","10.1007/s10587-010-0001-y",,"math.MG","http://arxiv.org/licenses/nonexclusive-distrib/1.0/","  We prove some extension theorems involving uniformly continuous maps of the
universal Urysohn space. We also prove reconstruction theorems for certain
groups of autohomeomorphisms of this space and of its open subsets.
","[{""version"":""v1"",""created"":""Mon, 18 Apr 2005 11:03:43 GMT""},{""version"":""v2"",""created"":""Wed, 30 Sep 2009 16:48:53 GMT""}]","2012-10-23"
"math/0504358","Yuri B. Suris","Alexander I. Bobenko, Yuri B. Suris","Discrete differential geometry. Consistency as integrability","A preliminary version of a book. 157 pp; See
  http://www.ams.org/bookstore-getitem/item=GSM-%5C98 for the final version
  appeared as: A.I. Bobenko, Yu.B. Suris. Discrete Differential Geometry.
  Integrable Structure. Graduate Studies in Mathematics, Vol. 98. AMS, 2008","A.I. Bobenko, Yu.B. Suris. Discrete Differential Geometry.
  Integrable Structure. Graduate Studies in Mathematics, Vol. 98. AMS, 2008.
  xxiv+404 pp",,,"math.DG math.CV nlin.SI",,"  A new field of discrete differential geometry is presently emerging on the
border between differential and discrete geometry. Whereas classical
differential geometry investigates smooth geometric shapes (such as surfaces),
and discrete geometry studies geometric shapes with finite number of elements
(such as polyhedra), the discrete differential geometry aims at the development
of discrete equivalents of notions and methods of smooth surface theory.
Current interest in this field derives not only from its importance in pure
mathematics but also from its relevance for other fields like computer
graphics. Recent progress in discrete differential geometry has lead, somewhat
unexpectedly, to a better understanding of some fundamental structures lying in
the basis of the classical differential geometry and of the theory of
integrable systems. The goal of this book is to give a systematic presentation
of current achievements in this field.
","[{""version"":""v1"",""created"":""Mon, 18 Apr 2005 11:16:37 GMT""}]","2009-11-19"
"math/0504359","Niko Naumann","Claus Diem, N. Naumann","On the Structure of the Weil Restriction of Abelian Varieties","This is now the paper appeared in print","J. Ramanujan Math. Soc. 18, no 2, 2003, 1-22",,,"math.AG",,"  We give a description of endomorphism rings of Weil restrictions of abelian
varieties with respect to finite Galois extensions. The results are applied to
study the isogeny decomposition of Weil restrictions.
","[{""version"":""v1"",""created"":""Mon, 18 Apr 2005 11:37:14 GMT""},{""version"":""v2"",""created"":""Sun, 7 Aug 2005 19:10:03 GMT""}]","2007-05-23"
"math/0504360","Samuel Boissiere","Samuel Boissiere and Alessandra Sarti","Contraction of excess fibres between the McKay correspondences in
  dimensions two and three","21 pages",,,,"math.AG",,"  The quotient singularities of dimensions two and three obtained from
polyhedral groups and the corresponding binary polyhedral groups admit natural
resolutions of singularities as Hilbert schemes of regular orbits whose
exceptional fibres over the origin reveal similar properties. We construct a
morphism between these two resolutions, contracting exactly the excess part of
the exceptional fibre. This construction is motivated by the study of some
pencils of K3-surfaces arising as minimal resolutions of quotients of nodal
surfaces with high symmetries.
","[{""version"":""v1"",""created"":""Mon, 18 Apr 2005 13:03:52 GMT""}]","2007-05-23"
"math/0504361","Ken Dykema","Ken Dykema","Multilinear function series and transforms in free probability theory","54 pages. (In the revised version, only minor changes were made.)",,,,"math.OA math.CO math.RA",,"  The algebra Mul[[B]] of formal multilinear function series over an algebra B
and its quotient SymMul[[B]] are introduced, as well as corresponding
operations of formal composition. In the setting of Mul[[B]], the unsymmetrized
R- and T-transforms of random variables in B-valued noncommutative probability
spaces are introduced. These satisfy properties analogous to the usual R- and
T-transforms, (the latter being just the reciprocal of the S-transform), but
describe all moments of a random variable, not only the symmetric moments. The
partially ordered set of noncrossing linked partitions is introduced and is
used to prove properties of the unsymmetrized T-transform.
","[{""version"":""v1"",""created"":""Mon, 18 Apr 2005 13:24:07 GMT""},{""version"":""v2"",""created"":""Sun, 5 Jun 2005 15:02:05 GMT""}]","2007-05-23"
"math/0504362","Guyan Robertson","Guyan Robertson","Abelian subalgebras of von Neumann algebras from flat tori in locally
  symmetric spaces",,"J. Funct. Anal., 230 (2006), 419-431",,,"math.OA math.DG",,"  Consider a compact locally symmetric space $M$ of rank $r$, with fundamental
group $\Gamma$. The von Neumann algebra $\vn(\Gamma)$ is the convolution
algebra of functions $f\in\ell_2(\Gamma)$ which act by left convolution on
$\ell_2(\Gamma)$. Let $T^r$ be a totally geodesic flat torus of dimension $r$
in $M$ and let $\Gamma_0\cong\bb Z^r$ be the image of the fundamental group of
$T^r$ in $\Gamma$. Then $\vn(\Gamma_0)$ is a maximal abelian $\star$-subalgebra
of $\vn(\Gamma)$ and its unitary normalizer is as small as possible. If $M$ has
constant negative curvature then the Puk\'anszky invariant of $\vn(\Gamma_0)$
is $\infty$.
","[{""version"":""v1"",""created"":""Mon, 18 Apr 2005 14:46:41 GMT""}]","2013-02-25"
"math/0504363","Hadi Salmasian","Hadi Salmasian","A notion of rank for unitary representations of reductive groups based
  on Kirillov's orbit method",,,,,"math.RT",,"  We introduce a new notion of rank for unitary representations of semisimple
groups over a local field of characteristic zero. The theory is based on
Kirillov's method of orbits for nilpotent groups over local fields. When the
semisimple group is classical, we prove that the new theory is essentially
equivalent to Howe's theory of N-rank.
","[{""version"":""v1"",""created"":""Mon, 18 Apr 2005 15:11:35 GMT""},{""version"":""v2"",""created"":""Mon, 21 Aug 2006 16:27:43 GMT""}]","2007-05-23"
"nlin/0504037","Sergei Sakovich","Sergei Sakovich","Enlarged spectral problems and nonintegrability","11 pages","Phys. Lett. A 345 (2005) 63-68","10.1016/j.physleta.2005.06.114",,"nlin.SI math-ph math.AP math.MP",,"  The method of obtaining new integrable coupled equations through enlarging
spectral problems of known integrable equations, which was recently proposed by
W.-X. Ma, can produce nonintegrable systems as well. This phenomenon is
demonstrated and explained by the example of the enlarged spectral problem of
the Korteweg - de Vries equation.
","[{""version"":""v1"",""created"":""Mon, 18 Apr 2005 11:23:16 GMT""},{""version"":""v2"",""created"":""Tue, 21 Jun 2005 13:21:27 GMT""}]","2007-05-23"
"nucl-ex/0504014","Terry Mart","R. Lawall, J. Barth, C. Bennhold, K.-H. Glander, S. Goers, J.
  Hannappel, N. Joepen, F. Klein, E. Klempt, T. Mart, D. Menze, M. Ostrick, E.
  Paul, I. Schulday, W.J. Schwille, F.W. Wieland, C. Wu","Measurement of the reaction gamma p --> K0 Sigma+ at photon energies up
  to 2.6 GeV","15 pages, 18 figures, to appear in Eur. Phys. J. A","Eur.Phys.J. A24 (2005) 275-286","10.1140/epja/i2005-10002-x",,"nucl-ex hep-ph nucl-th",,"  The reaction gamma p --> K0 Sigma+ was measured in the photon energy range
from threshold up to 2.6 GeV with the SAPHIR detector at the electron stretcher
facility, ELSA, in Bonn. Results are presented on the reaction cross section
and the polarization of the Sigma+ as a function of the kaon production angle
in the centre-of-mass system, cos(Theta_K^{c.m.}), and the photon energy. The
cross section is lower and varies less with photon energy and kaon production
angle than that of gamma p --> K+ Sigma0. The Sigma+ is polarized predominantly
at cos(Theta_K^{c.m.}) \approx 0. The data presented here are more precise than
previous ones obtained with SAPHIR and extend the photon energy range to higher
values. They are compared to isobar model calculations.
","[{""version"":""v1"",""created"":""Mon, 18 Apr 2005 04:44:35 GMT""}]","2007-05-23"
"nucl-th/0504056","Thomas Roth","Th. Roth, M. Buballa and J. Wambach","Medium modifications of antikaons in dense matter","29 pages, 35 figures; v2: additional curves for symmetric matter in
  Figs 14,15; references added",,,,"nucl-th",,"  We investigate the modification of antikaons in isospin symmetric and
asymmetric nuclear matter. Using the leading s-wave couplings of the SU(3)
chiral meson-baryon Lagrangian we solve the coupled channel kaon-nucleon
scattering equation selfconsistently. The in-medium antikaon propagator is
calculated for different densities and different proton/neutron ratios. The
spectral function of the antikaon is found to be broadened strongly, and its
mass is shifted downward significantly. However, comparing the effective
in-medium mass of the antikaon to the relevant charge chemical potential of
neutron star matter, we find that kaon condensation is unlikely to occur in
neutron stars.
","[{""version"":""v1"",""created"":""Mon, 18 Apr 2005 14:02:54 GMT""},{""version"":""v2"",""created"":""Wed, 4 May 2005 13:20:51 GMT""}]","2007-05-23"
"physics/0504113","Paul Griffin","P. F. Griffin, K. J. Weatherill, S. G. MacLeod, R. M. Potvliege, and
  C. S. Adams","Spatially selective loading of an optical lattice by light-shift
  engineering using an auxiliary laser field","4 pages, 5 figures",,"10.1088/1367-2630/8/1/011",,"physics.atom-ph",,"  We report on a method of light-shift engineering where an auxiliary laser is
used to tune the atomic transition frequency. The technique is used to
selectively load a specific region of an optical lattice. The results are
explained by calculating the differential light-shift of each hyperfine state.
We conclude that the remarkable spatial selectivity of light-shift engineering
using an auxiliary laser provides a powerful technique to prepare ultra-cold
trapped atoms for experiments on quantum gases and quantum information
processing.
","[{""version"":""v1"",""created"":""Mon, 18 Apr 2005 14:56:29 GMT""},{""version"":""v2"",""created"":""Thu, 9 Jun 2005 18:28:49 GMT""}]","2009-11-11"
"physics/0504114","Andrea Petrucci","F. Cardone (1), R. Mignani (2 and 3), W. Perconti (4), A. Petrucci
  (2), R. Scrimaglio (4) ((1) Istituto per lo Studio dei Materiali
  Nanostrutturati (ISMN-CNR) Roma Italy, (2) Dipartimento di Fisica Edoardo
  Amaldi University of Roma Tre Italy, (3) INFN Sezione di Roma Tre, (4)
  Dipartimento di Fisica University of L Aquila Italy)","The shadow of light: Lorentz invariance and complementarity principle in
  anomalous photon behaviour",,,"10.1142/S0217979206033735",,"physics.gen-ph",,"  We review the results of two double-slit-like experiments in the infrared
range, which evidence an anomalous behaviour of photon systems under particular
(energy and space) constraints. These outcomes (independently confirmed by
crossing photon beam experiments in both the optical and the microwave range)
apparently rule out the Copenhagen interpretation of the quantum wave, i.e. the
probability wave, by admitting an interpretation in terms of the Einstein-de
Broglie-Bohm hollow wave for photons. Moreover, these experiments support the
interpretation of the hollow wave as a deformation of the Minkowski space-time
geometry. We stress the implications of these experimental results and of their
interpretation for the concept of action-at-a-distance, the Einstein
relativistic correlation and the Bohr principle of complementarity.
","[{""version"":""v1"",""created"":""Sun, 17 Apr 2005 23:26:33 GMT""},{""version"":""v2"",""created"":""Thu, 21 Apr 2005 22:20:04 GMT""}]","2009-11-11"
"physics/0504115","Alicija Kupliauskiene","A. Kupliauskiene, V. Tutlys","General expression for the dielectronic recombination cross section of
  polarized ions with polarized electrons","4 pages","Nuclear Instruments and Methods in Physics Research B, v. 235,
  257-260 (2005)","10.1016/j.nimb.2005.03.185",,"physics.atom-ph physics.plasm-ph",,"  A general expression for the differential cross section of dielectronic
recombination (DR) of polarized electrons and polarized ions is derived by
using usual atomic theory methods and is represented in the form of multiple
expansions over spherical tensors. The ways of the application of the general
expressions suitable for the specific experimental conditions are outlined by
deriving asymmetry parameters of angular distribution of DR radiation in the
case of nonpolarized and polarized ions and electrons.
","[{""version"":""v1"",""created"":""Mon, 18 Apr 2005 06:12:33 GMT""}]","2009-11-11"
