"astro-ph/0504382","Boris Gaensicke","B.T. Gaensicke, P. Szkody, S.B. Howell, E.M. Sion","The accreting white dwarfs in BW Scl, BC UMa and SW UMa","ApJ accepted, 6 figures","Astrophys.J. 629 (2005) 451-460","10.1086/431271",,"astro-ph",,"  We have observed the short-period dwarf novae BW Scl, BC UMa and SW UMa using
the Hubble Space Telescope/Space Telescope Imaging Spectrograph. In all three
systems, the white dwarf is the dominant source of far-ultraviolet flux, even
though in BC UMa and SW UMa an additional continuum component contributes ~10%
and ~20% of the 1400A flux, respectively. Fitting the data with detailed white
dwarf model spectra, we determine the effective temperatures to be 14800+-900K
(BW Scl), 15200+-1000K (BC UMa), and 13900+-900K (SW UMa). The additional
continuum component in BC UMa and SW UMa is equally well described by either a
blackbody or a power law, which could be associated with emission from the hot
spot or from an optically thin accretion disk (or an optically thin layer on
top of a colder optically thick disk), respectively. Modelling the narrow metal
lines detected in the STIS spectra results in sub-solar abundances of carbon,
oxygen and silicon for all three systems, and also suggests substantial
supra-solar abundances of aluminium. The narrow absorption line profiles imply
low white dwarf rotation rates, v sin(i)<=300km/s for the three white dwarfs.
SW UMa is the only system that shows significant short-term variability in the
far-ultraviolet range, which is primarily associated with the observed emission
lines.
","[{""version"":""v1"",""created"":""Mon, 18 Apr 2005 11:10:38 GMT""}]","2009-11-11"
"astro-ph/0504383","Jinn-Ouk Gong","Jinn-Ouk Gong","Breaking scale invariance from a singular inflaton potential","20 pages, 9 figures; Discussion expanded and references added;
  Miscellaneous typos corrected","JCAP 0507 (2005) 015","10.1088/1475-7516/2005/07/015","KAIST-TH/2005-06","astro-ph gr-qc hep-ph",,"  In this paper we break the scale invariance of the primordial power spectrum
of curvature perturbations of inflation. Introducing a singular behaviour due
to spontaneous symmetry breaking in the inflaton potential, we obtain fully
analytic expressions of scale dependent oscillation and a modulation in power
on small scale in the primordial spectrum. And we give the associated cosmic
microwave background and matter power spectra which we can observe now and
discuss the signature of the scale dependence. We also address the possibility
of whether some inflationary model with featured potential might mimic the
predictions of the scale invariant power spectrum. We present some examples
which illustrate such degeneracies.
","[{""version"":""v1"",""created"":""Mon, 18 Apr 2005 12:11:10 GMT""},{""version"":""v2"",""created"":""Wed, 22 Jun 2005 10:12:13 GMT""},{""version"":""v3"",""created"":""Thu, 28 Jul 2005 03:13:32 GMT""}]","2009-11-11"
"astro-ph/0504384","Abhas Mitra","Abhas Mitra","Comments on the proposal of Dark Energy Stars by Chapline","comments on astro-ph/0503200, 10 pages, last 3 more typos removed",,,,"astro-ph",,"  We point out that the contentions of Chapline (astro-ph/0503200)[1] that (i)
General Relativity (GR) is in conflict with Quantum Mechanics (QM) and (ii) GR
fails even on macroscopic length scales are incorrect and based on (i)
misunderstanding of GR and (ii) completely misconceived ``thought
experiments''. Even without introduction of any QM, GR actually does not allow
formation of any Event Horizon and is competent to figure out the actual nature
of the supposed Black Hole candidates. The resultant picture is not in conflict
with QM at all.
","[{""version"":""v1"",""created"":""Mon, 18 Apr 2005 12:57:09 GMT""},{""version"":""v2"",""created"":""Tue, 19 Apr 2005 06:35:48 GMT""},{""version"":""v3"",""created"":""Wed, 20 Apr 2005 08:42:29 GMT""}]","2007-05-23"
"astro-ph/0504385","Ovidiu Vaduvescu","Ovidiu Vaduvescu, Marshall L. McCall","dEs and the dI Fundamental Plane","To appear in the Proceedings of the IAU Colloquium 198, H. Jerjen &
  B. Binggeli",,"10.1017/S1743921305003893",,"astro-ph",,"  Despite much work, the connection between dwarf elliptical galaxies (dEs) and
dwarf irregulars (dIs) remains unclear. Recently, we found that the surface
brightness profiles (SBPs) of dIs in the near-infrared can be well fitted with
a hyperbolic secant (sech) function. From sech fits, a tight relationship was
derived between the absolute magnitude, central surface brightness, and 21cm
line widths, which amounts to a fundamental plane for dIs. Here we examine how
closely dEs fit into the dI fundamental plane using published data for 22 dEs
in the Virgo cluster and the Local Group. Over a 9 mag interval in absolute
magnitude the dEs fall in the plane defined by the dIs. The outstanding overlap
suggests more than a casual relationship between the two classes.
","[{""version"":""v1"",""created"":""Mon, 18 Apr 2005 13:11:19 GMT""}]","2009-11-11"
"astro-ph/0504386","Eric van der Swaluw","Eric van der Swaluw, Jan-Willem Blokland and Rony Keppens","Convective magneto-rotational instabilities in accretion disks","10 pages, 9 figures, Accepted for publication in Astronomy &
  Astrophysics",,"10.1051/0004-6361:20042603",,"astro-ph",,"  We present a study of instabilities occuring in thick magnetized accretion
disks. We calculate the growth rates of these instabilities and characterise
precisely the contribution of the magneto-rotational and the convective
mechanism. All our calculations are performed in radially stratified disks in
the cylindrical limit. The numerical calculations are performed using the
appropriate local dispersion equation solver discussed in Blokland et al.
(2005). A comparison with recent results by Narayan et al. (2002) shows
excellent agreement with their approximate growth rates only if the disks are
weakly magnetized. However, for disks close to equipartition, the dispersion
equation from Narayan et al. (2002) loses its validity. Our calculations allow
for a quantitative determination of the increase of the growth rate due to the
magneto-rotational mechanism. We find that the increase of the growth rate for
long wavelength convective modes caused by this mechanism is almost neglible.
On the other hand, the growth rate of short wavelength instabilities can be
significantly increased by this mechanism, reaching values up to 60%.
","[{""version"":""v1"",""created"":""Mon, 18 Apr 2005 13:19:47 GMT""}]","2009-11-11"
"astro-ph/0504387","James Binney","James Binney (Oxford University)","Rotation and anisotropy of galaxies revisited","6 pages submitted to MNRAS","Mon.Not.Roy.Astron.Soc. 363 (2005) 937-942","10.1111/j.1365-2966.2005.09495.x",,"astro-ph",,"  The use of the tensor virial theorem (TVT) as a diagnostic of anisotropic
velocity distributions in galaxies is revisited. The TVT provides a rigorous
global link between velocity anisotropy, rotation and shape, but the quantities
appearing in it are not easily estimated observationally. Traditionally use has
been made of a centrally averaged velocity dispersion and the peak rotation
velocity. Although this procedure cannot be rigorously justified, tests on
model galaxies show that it works surprisingly well. With the advent of
integral-field spectroscopy it is now possible to establish a rigorous
connection between the TVT and observations. The TVT is reformulated in terms
of sky-averages, and the new formulation is tested on model galaxies.
","[{""version"":""v1"",""created"":""Mon, 18 Apr 2005 13:22:16 GMT""}]","2009-11-11"
"astro-ph/0504388","Paolo Coppi","Rafal Moderski, Marek Sikora, Paolo S. Coppi, and Felix A. Aharonian","Klein-Nishina Effects in the Spectra of Non-Thermal Sources Immersed in
  External Radiation Fields","36 pages, 10 figures. MNRAS LaTeX. Abtract slightly shortened.
  Submitted to Monthly Notices","Erratum-ibid. 364 (2005) 1488","10.1111/j.1365-2966.2005.09494.x",,"astro-ph",,"  We study Klein-Nishina (KN) effects in the spectrum produced by a steady
state, non-thermal source where rapidly accelerated electrons cool by emitting
synchrotron radiation and Compton upscattering ambient photons produced outside
the source. We focus on the case where the radiation density inside the source
exceeds that of the magnetic field. We show that the KN reduction in the
electron Compton cooling rate causes the steady-state electron spectrum to
harden at energies above \gamma_{KN}, where \gamma_{KN}= 1/4\epsilon_0 and
\epsilon_0=h\nu_0/m_ec^2 is the characteristic ambient photon energy. The
source synchrotron spectrum thus shows a high-energy ``bump'' or excess even
though the electron acceleration spectrum has no such excess. In contrast, the
low-energy Compton gamma-ray spectrum shows little distortion because the
electron hardening compensates for the KN decline in the scattering rate. For
sufficiently high electron energies, however, Compton cooling becomes so
inefficient that synchrotron cooling dominates -- an effect omitted in most
previous studies. The hardening of the electron distribution thus stops,
leading to a rapid decline in Compton gamma-ray emission, i.e., a strong
spectral break whose location does not depend on the maximum electron energy.
This break can limit the importance of Compton gamma-ray pair production on
ambient photons and implies that a source's synchrotron luminosity may exceed
its Compton luminosity even though the source magnetic field energy density is
smaller than the ambient radiation energy density. We discuss the importance of
these KN effects in blazars, micro-quasars, and pulsar binaries.
","[{""version"":""v1"",""created"":""Mon, 18 Apr 2005 14:20:42 GMT""}]","2009-11-11"
"astro-ph/0504389","Brigitte K\""onig","Regina E. Schulte-Ladbeck, Brigitte K\""onig, Brian Cherinka","Chemical Abundances in SFG and DLA","6 pages, 3 figures, conference proceedings IAU 199",,,,"astro-ph",,"  We investigate the chemical abundances of local star-forming galaxies which
cause Damped Lyman Alpha lines. A metallicity versus redshift diagram is
constructed, on which the chemical abundances of low-redshift star-forming
galaxy populations are compared with those of high-redshift Damped Lyman Alpha
systems. We disucss two types of experiments on individual star-forming
galaxies. In the first, the Damped Lyman Alpha line is created against an
internal ultraviolet light source generated by a star-forming cluster or a
supernova explosion. In the second, the Damped Lyman Alpha line is seen against
a background Quasar. The metallicities measured from ionized gas in the
star-forming regions, and neutral gas in the Damped Lyman Alpha systems, are
compared with one another on a case-by-case basis. We highlight the occurrence
of the star-forming galaxy/Quasar pair SBS 1543+593/HS 1543+5921, where the
emission- and absorption-line derived abundances give the same result. We argue
that we therefore can in principle, interpret Damped Lyman Alpha system
metallicities as an extension of star-forming galaxy metallicities to higher
redshifts, supporting that gas-rich galaxies had lower chemical abundances when
the were younger.
","[{""version"":""v1"",""created"":""Mon, 18 Apr 2005 14:44:23 GMT""},{""version"":""v2"",""created"":""Fri, 22 Apr 2005 14:25:40 GMT""}]","2007-05-23"
"astro-ph/0504390","Rachid Ouyed","R. Ouyed (Dept. of Physics&Astronomy, University of Calgary, Alberta,
  Canada, and CITA, University of Toronto, Toronto, Canada), M. J. Hamp (Dept.
  of Engineering Physics, McMaster University, Hamilton, Canada) and S. C.
  Woodworth (Dept. of Engineering Physics, McMaster University, Hamilton,
  Canada)","Cooling of Quark Stars in the Color Superconductive Phase: Effect of
  Photons from Glueball decay","7 journal pages, 4 figures, accepted for publication in MNRAS (more
  discussions on photon cooling versus neutrino cooling before and after
  pairing of quarks)","Mon.Not.Roy.Astron.Soc.367:231-237,2006","10.1111/j.1365-2966.2005.09940.x",,"astro-ph",,"  The cooling history of a quark star in the color superconductive phase is
investigated. Here we specifically focus on the 2-flavour color (2SC) phase
where novel process of photon generation via glueball (GLB) decay have been
already investigated (Ouyed & Sannino 2001). The picture we present here can in
principle be generalized to quark stars entering a superconductive phase where
similar photon generation mechanisms are at play. As much as 10^{45}-10^{47}
erg of energy is provided by the GLB decay in the 2SC phase. The generated
photons slowly diffuse out of the quark star keeping it hot and radiating as a
black-body (with possibly a Wien spectrum in gamma-rays) for millions of years.
We discuss hot radio-quiet isolated neutron stars in our picture (such as RX
J185635-3754 and RX J0720.4-3125) and argue that their nearly blackbody spectra
(with a few broad features) and their remarkably tiny hydrogen atmosphere are
indications that these might be quark stars in the color superconductive phase
where some sort of photon generation mechanism (reminiscent of the GLB decay)
has taken place. Fits to observed data of cooling compact stars favor models
with superconductive gaps of Delta_2SC = 15-35 MeV and densities
rho_2SC=(2.5-3.0)rho_N (rho_N being the nuclear matter saturation density) for
quark matter in the 2SC phase. If correct, our model combined with more
observations of isolated compact stars could provide vital information to
studies of quark matter and its exotic phases.
","[{""version"":""v1"",""created"":""Mon, 18 Apr 2005 14:41:46 GMT""},{""version"":""v2"",""created"":""Thu, 1 Dec 2005 20:24:22 GMT""}]","2009-11-11"
"astro-ph/0504392","Chris Churchill","Christopher W. Churchill (NMSU), Glenn G. Kacprzak (NMSU), Charles C.
  Steidel (Caltech)","MgII Absorption through Intermediate Redshift Galaxies","18 pages; 8 figures; review talk for IAU 199: Probing Galaxies
  through Quasar Absorption Lines",,"10.1017/S1743921305002401",,"astro-ph",,"  The current status and remaining questions of MgII absorbers are reviewed
with an eye toward new results incorporating high quality Hubble Space
Telescope images of the absorbing galaxies. In the end, we find that our
current picture of extended gaseous regions around galaxies at earlier epochs
is in need of some revision; MgII absorbing ""halos"" appear to be patchier and
their geometry less regular than previously inferred. We also find that the
so-called ""weak"" MgII absorbers are associated with normal galaxies over a wide
range of impact parameters, suggesting that this class of absorber does not
strictly select low surface brightness, dwarf galaxies, or IGM material. We
emphasize the need for a complete survey of the galaxies in quasar fields, and
the importance of obtaining rotation curves of confirmed absorbing galaxies.
","[{""version"":""v1"",""created"":""Mon, 18 Apr 2005 15:35:21 GMT""}]","2009-11-11"
"cond-mat/0504400","Maria Fyta","M. G. Fyta and P. C. Kelires","Simulations of composite carbon films with nanotube inclusions","3 pages, 3 figures, to appear in Appl. Phys. Lett",,"10.1063/1.1924881",,"cond-mat.mtrl-sci",,"  We study the interfacial structure, stability, and elastic properties of
composite carbon films containing nanotubes. Our Monte Carlo simulations show
that Van der Waals forces play a vital role in shaping up the interfacial
geometry, producing a curved graphitic wall surrounding the tubes. The most
stable structures are predicted to have intermediate densities, high
anisotropies, and increased elastic moduli compared to pure amorphous carbon
films.
","[{""version"":""v1"",""created"":""Mon, 18 Apr 2005 12:17:09 GMT""}]","2009-11-11"
"cond-mat/0504412","Andrew Norris","Andrew N. Norris","Dynamics of thermoelastic thin plates: A comparison of four theories","2 figures, 1 table","J. Thermal Stresses, 29(2), 169 -195, 2006.","10.1080/01495730500257482",,"cond-mat.mtrl-sci",,"  Four distinct theories describing the flexural motion of thermoelastic thin
plates are compared. The theories are due to Chadwick, Lagnese and Lions,
Simmonds, and Norris. Chadwick's theory requires a 3D spatial equation for the
temperature but is considered the most accurate as the others are derivable
from it by different approximations. Attention is given to the damping of
flexural waves. Analytical and quantitative comparisons indicate that the
Lagnese and Lions model with a 2D temperature equation captures the essential
features of the thermoelastic damping, but contains systematic inaccuracies.
These are attributable to the approximation for the first moment of the
temperature used in deriving the Lagnese and Lions equation. Simmonds' model
with an explicit formula for temperature in terms of plate deflection is the
simplest of all but is accurate only at low frequency, where the damping is
linearly proportional to the frequency. It is shown that the Norris model,
which is almost as simple as Simmond's, is as accurate as the more precise but
involved theory of Chadwick.
","[{""version"":""v1"",""created"":""Sun, 17 Apr 2005 17:22:39 GMT""}]","2007-05-23"
"cond-mat/0504414","Ali Naji","Ali Naji, Roland R. Netz and Christian Seidel","Non-linear Osmotic Brush Regime: Simulations and mean-field theory","14 pages, 8 figures; shorter and revised version of Eur. Phys. J. E
  12, 223 (2003)","Eur. Phys. J. E 12, 223 (2003)",,,"cond-mat.soft",,"  We investigate polyelectrolyte brushes in the osmotic regime using both
theoretical analysis and molecular dynamics simulation techniques. In the
simulations at moderate Bjerrum length, we observe that the brush height varies
weakly with grafting density, in contrast to the accepted scaling law, which
predicts a brush thickness independent of the grafting density. We show that
such behavior can be explained by considering lateral electrostatic effects
(within the non-linear Poisson-Boltzmann theory) combined with the coupling
between lateral and longitudinal degrees of freedom due to the conserved
polymer volume (which are neglected in scaling arguments). We also take the
non-linear elasticity of polyelectrolyte chains into consideration, which makes
significant effects as chains are almost fully stretched in the osmotic regime.
It is shown that all these factors lead to a non-monotonic behavior for the
brush height as a function of the grafting density. At large grafting
densities, the brush height increases with increasing the grafting density due
to the volume constraint. At small grafting densities, we obtain a
re-stretching of the chains for decreasing grafting density, which is caused by
lateral electrostatic contributions and the counterion-condensation process at
polyelectrolyte chains. These results are obtained assuming all counterions to
be trapped within the brush, which is valid for sufficiently long chains of
large charge fraction.
","[{""version"":""v1"",""created"":""Mon, 18 Apr 2005 14:25:16 GMT""}]","2007-05-23"
"cond-mat/0504415","Olivier Fruchart","Olivier Fruchart (LLN)","Self-organization on surfaces: foreword","Foreword of the Editor to Special Issue on Self-organization on
  surfaces","Comptes Rendus Physique 6 (2005) 3","10.1016/j.crhy.2004.11.009",,"cond-mat.other",,"  After decades of work, the growth of continuous thin films, i.e.,
two-dimensional structures, is progressively becoming a technological issue
more than a field of fundamental research. Incidentally self-organization of
nanostructures on surfaces is now an important field of research, i.e.,
structures of dimensionality one or zero, with a steep rise of attention in the
past five years. Whereas self-organization was initially motivated by potential
applications, it has up to now essentially contributed to the advancement of
fundamental science in low dimensions, as model systems could be produced that
could not have been fabricated by lithography. This Special Issue aims at
giving a cross-community timely overview of the field. The Issue gathers a
broad panel of articles covering various self-organization mechanisms, specific
structural characterization, physical properties, and current trends in
extending the versatility of growth. The materials mostly covered here are
semiconductors and magnetic materials.
","[{""version"":""v1"",""created"":""Sun, 17 Apr 2005 19:36:10 GMT""}]","2007-05-23"
"cond-mat/0504416","Wolfgang Wernsdorfer","W. Wernsdorfer, D. Mailly, G. A. Timco, and R. E. P. Winpenny","Resonant photon absorption and hole burning in Cr7Ni antiferromagnetic
  rings","4 pages, 5 figures",,"10.1103/PhysRevB.72.060409",,"cond-mat.mes-hall cond-mat.mtrl-sci",,"  Presented are magnetization measurements on a crystal of Cr7Ni
antiferromagnetic rings. Irradiation with microwaves at frequencies between 1
and 10 GHz leads to observation of very narrow resonant photon absorption lines
which are mainly broadened by hyperfin interactions. A two-pulse hole burning
technique allowed us to estimate the characteristic energy diffusion time.
","[{""version"":""v1"",""created"":""Sun, 17 Apr 2005 20:21:28 GMT""}]","2009-11-11"
"cond-mat/0504417","Tomohiro Sasamoto","T. Sasamoto","Spatial correlations of the 1D KPZ surface on a flat substrate","11 pages, 2 figures",,"10.1088/0305-4470/38/33/L01",,"cond-mat.stat-mech math-ph math.MP",,"  We study the spatial correlations of the one-dimensional KPZ surface for the
flat initial condition. It is shown that the multi-point joint distribution for
the height is given by a Fredholm determinant, with its kernel in the scaling
limit explicitly obtained. This may also describe the dynamics of the largest
eigenvalue in the GOE Dyson's Brownian motion model. Our analysis is based on a
reformulation of the determinantal Green's function for the totally ASEP in
terms of a vicious walk problem.
","[{""version"":""v1"",""created"":""Mon, 18 Apr 2005 02:41:45 GMT""}]","2009-11-11"
"cond-mat/0504418","David Head","D. A. Head","A mean field description of jamming in non-cohesive frictionless
  particulate systems","9 pages, 3 figs; additional clarification of different elastic moduli
  exponents, plus typo fix. To appear in PRE",,"10.1103/PhysRevE.72.021303",,"cond-mat.mtrl-sci cond-mat.dis-nn",,"  A theory for kinetic arrest in isotropic systems of repulsive,
radially-interacting particles is presented that predicts exponents for the
scaling of various macroscopic quantities near the rigidity transition that are
in agreement with simulations, including the non-trivial shear exponent. Both
statics and dynamics are treated in a simplified, one-particle level
description, and coupled via the assumption that kinetic arrest occurs on the
boundary between mechanically stable and unstable regions of the static
parameter diagram. This suggests the arrested states observed in simulations
are at (or near) an elastic buckling transition. Some additional numerical
evidence to confirm the scaling of microscopic quantities is also provided.
","[{""version"":""v1"",""created"":""Mon, 18 Apr 2005 01:49:43 GMT""},{""version"":""v2"",""created"":""Mon, 20 Jun 2005 03:21:49 GMT""}]","2009-11-11"
"cond-mat/0504419","Yasuhiro Asano","Y. Asano","Spin Current in p-wave Superconducting Rings","4pages","Physical Review B 72, 092508 (2005).","10.1103/PhysRevB.72.092508",,"cond-mat.supr-con",,"  A formula of the spin current in mesoscopic superconductors is derived from
the mean-field theory of superconductivity. The spin flow is generated by the
spatial fluctuations of $\vec{d}$ which represents a spin state of spin-triplet
superconductors. We discuss a possibility of the circulating spin current in
isolated p-wave superconducting rings at the zero magnetic field. The direction
of the spin current depends on topological numbers which characterize the
spatial configuration of $\vec{d}$ on the ring.
","[{""version"":""v1"",""created"":""Mon, 18 Apr 2005 01:52:02 GMT""},{""version"":""v2"",""created"":""Mon, 25 Jul 2005 02:29:46 GMT""}]","2009-11-11"
"cond-mat/0504420","Yun Song","Yun Song and Liang-Jian Zou","Effects of interorbital hopping on orbital fluctuations and
  metal-insulator transitions: Extended linearized dynamical mean-field theory","7 pages, 6 figures","Phys. Rev. B 72, 085114 (2005)","10.1103/PhysRevB.72.085114",,"cond-mat.str-el",,"  We study the effects of interorbital hopping on orbital fluctuations and
Mott-Hubbard metal-insulator transition (MIT) in the two-orbital Hubbard model
within the extended linearized dynamical mean-field theory. By mapping the
model onto an effective model with different bandwidths through the canonical
transformation, we find that at half-filling, the increases of the interorbital
Coulomb interaction $U^{\prime}$ and the Hund's coupling $J$ drive the MIT, and
the critical $J_{c}$ for MIT increases with the lift of the inter-orbital
hopping integral $t_{ab}$. Meanwhile at quarter filling and in the strong
correlation regime, the system without $t_{ab}$ exhibits MIT with the
decreasing of $J$, and favors the orbital liquid ground state. However, the
system transits from metal to insulator with the increasing of t$_{ab}$,
accompanied with the rising of the orbital order parameter. These results show
the important role of the interorbital hopping in the orbital fluctuation and
orbital ordering.
","[{""version"":""v1"",""created"":""Mon, 18 Apr 2005 02:25:48 GMT""},{""version"":""v2"",""created"":""Sat, 13 Aug 2005 03:10:37 GMT""}]","2009-11-11"
