"cond-mat/0504496","Anna Rodina","A. V. Rodina and A. Yu. Alekseev","Least action principle for envelope functions in abrupt heterostructures","4 pages, 1 figure",,"10.1103/PhysRevB.73.115312",,"cond-mat.mtrl-sci",,"  We apply the envelope function approach to abrupt heterostructures starting
with the least action principle for the microscopic wave function. The
interface is treated nonperturbatively, and our approach is applicable to
mismatched heterostructure. We obtain the interface connection rules for the
multiband envelope function and the short-range interface terms which consist
of two physically distinct contributions. The first one depends only on the
structure of the interface, and the second one is completely determined by the
bulk parameters. We discover new structure inversion asymmetry terms and new
magnetic energy terms important in spintronic applications.
","[{""version"":""v1"",""created"":""Wed, 20 Apr 2005 13:28:33 GMT""}]","2009-11-11"
"cond-mat/0504497","C. Y. Chen","C.Y.Chen (Beijing University of Aeronautics and Astronautics, PRC)","Nonexistence of time reversibility in statistical physics","10 pages, 5 figures, latex",,,,"cond-mat.stat-mech",,"  Contrary to the customary thought prevailing for long, the time reversibility
associated with beam-to-beam collisions does not really exist. Related facts
and consequences are presented. The discussion, though involving simple
mathematics and physics only, is well-related to the foundation of statistical
theory.
","[{""version"":""v1"",""created"":""Wed, 20 Apr 2005 01:24:53 GMT""},{""version"":""v2"",""created"":""Tue, 14 Jun 2005 07:37:00 GMT""},{""version"":""v3"",""created"":""Sat, 12 Nov 2005 08:34:23 GMT""}]","2007-05-23"
"cond-mat/0504498","Belim Sergey","S.V. Belim","Influence of Striction Effects on the Multicritical Behavior of
  Homogeneous Systems","3 pages","JETP Lett., 75,9,p.547-550(2002)",,,"cond-mat.stat-mech",,"  A field-theoretical description of the behavior of homogeneous, elastically
isotropic, compressible systems characterized by two order parameters at the
bicritical and tetracritical points is presented. For three-dimensional
Ising-like systems, a similar description is performed in the two-loop
approximation in three dimensions. The renormalization group equations are
analyzed, and fixed points corresponding to different types of multicritical
behavior are determined. It is shown that the effect of elastic strains causes
a change from a bicritical behavior to a tetracritical one and leads to the
appearance of a wide variety of multicritical points.
","[{""version"":""v1"",""created"":""Wed, 20 Apr 2005 04:08:03 GMT""}]","2007-05-23"
"cond-mat/0504499","Chandrabhas Narayana","Md. Motin Seikh, A.K. Sood and Chandrabhas Narayana","Electronic and vibrational Raman spectroscopy of
  Nd$_{0.5}$Sr$_{0.5}$MnO$_3$ through the phase transitions","10 pages, 3 figures published in Pramana - Journal of Physics","Pramana - Journal of Physics Vol. 64, No. 1, January 2005 pp.
  119-128",,,"cond-mat.mtrl-sci",,"  Raman scattering experiments have been carried out on single crystals of
Nd$_{0.5}$Sr$_{0.5}$MnO$_3$ as a function of temperature in the range of 320-50
K, covering the paramagnetic insulator-ferromagnetc metal transition at 250 K
and the charge-ordering antiferromagnetic transition at 150 K. The diffusive
electronic Raman scattering response is seen in the paramagnetic phase which
continue to exist even in the ferromagnetic phase, eventually disappearing
below 150 K. We understand the existence of diffusive response in the
ferromagnetic phase to the coexistence of the different electronic phases. The
frequency and linewidth of the phonons across the transitions show significant
changes, which cannot be accounted for only by anharmonic interactions.
","[{""version"":""v1"",""created"":""Wed, 20 Apr 2005 04:09:16 GMT""}]","2007-05-23"
"cond-mat/0504500","Matsukawa Michiaki","M. Matsukawa, K. Akasaka, H. Noto, R. Suryanarayanan, et al","Resistive relaxation in field-induced insulator-metal transition of a
  (La$_{0.4}$Pr$_{0.6}$)$_{1.2}$Sr$_{1.8}$Mn$_{2}$O$_{7}$ bilayer manganite
  single crystal","6 pages,5 figures",,"10.1103/PhysRevB.72.064412",,"cond-mat.str-el cond-mat.mtrl-sci",,"  We have investigated the resistive relaxation of a
(La$_{0.4}$Pr$_{0.6}$)$_{1.2}$Sr$_{1.8}$Mn$_{2}$O$_{7}$ single crystal, in
order to examine the slow dynamics of the field-induced insulator to metal
transition of bilayered manganites. The temporal profiles observed in remanent
resistance follow a stretched exponential function accompanied by a slow
relaxation similar to that obtained in magnetization and magnetostriction data.
We demonstrate that the remanent relaxation in magnetotransport has a close
relationship with magnetic relaxation that can be understood in the framework
of an effective medium approximation by assuming that the first order parameter
is proportional to the second order one.
","[{""version"":""v1"",""created"":""Wed, 20 Apr 2005 04:14:36 GMT""}]","2009-11-11"
"cond-mat/0504501","Nicola Pugno","N. Pugno and R. Ruoff","Dynamic Quantized Fracture Mechanics",,,,,"cond-mat.mtrl-sci",,"  A new quantum action-based theory, Dynamic Quantized Fracture Mechanics
(DQFM), is presented that modifies continuum-based dynamic fracture mechanics.
The crack propagation is assumed as quantized in both space and time. The
static limit case corresponds to Quantized Fracture Mechanics (QFM), that we
have recently developed to predict the strength of nanostructures.
","[{""version"":""v1"",""created"":""Wed, 20 Apr 2005 12:15:41 GMT""}]","2007-05-23"
"cond-mat/0504502","Eugene Pivovarov","Michael M. Fogler and Eugene Pivovarov","Spin exchange in quantum rings and wires in the Wigner-crystal limit","7 pages, 2 figures. Changes in the text and figures to improve
  readability; added references","J. Phys.: Condens. Matter 18, L7-L13 (2006)","10.1088/0953-8984/18/1/L02",,"cond-mat.str-el",,"  We present a controlled method for computing the exchange coupling in
strongly correlated one-dimensional electron systems. It is based on the
asymptotically exact relation between the exchange constant and the
pair-correlation function of spinless electrons. Explicit results are obtained
for thin quantum rings with realistic Coulomb interactions, by calculating this
function via a many-body instanton approach.
","[{""version"":""v1"",""created"":""Wed, 20 Apr 2005 08:26:11 GMT""},{""version"":""v2"",""created"":""Wed, 20 Apr 2005 20:47:36 GMT""},{""version"":""v3"",""created"":""Thu, 5 May 2005 16:51:47 GMT""},{""version"":""v4"",""created"":""Mon, 10 Oct 2005 22:25:51 GMT""}]","2007-05-23"
"cond-mat/0504503","Yue Yu","Xiancong Lu, Jinbin Li and Yue Yu","Slave particle approach to the finite temperature properties of
  ultracold Bose gases in optical lattices","27 pages, 8 figures, final version for publication","Phys. Rev. A 73, 043607 (2006)","10.1103/PhysRevA.73.043607",,"cond-mat.stat-mech",,"  By using slave particle (slave boson and slave fermion) technique on the
Bose-Hubbard model, we study the finite temperature properties of ultracold
Bose gases in optical lattices. The phase diagrams at finite temperature are
depicted by including different types of slave particles and the effect of the
finite types of slave particles is estimated. The superfluid density is
evaluated using the Landau second order phase transition theory. The atom
density, excitation spectrum and dispersion curve are also computed at various
temperatures, and how the Mott-insulator evolves as the temperature increases
is demonstrated. For most quantities to be calculated, we find that there are
no qualitatively differences in using the slave boson or the slave fermion
approaches. However, when studying the stability of the mean field state, we
find that in contrast to the slave fermion approach, the slave boson mean field
state is not stable. Although the slave boson mean field theory gives a
qualitatively correct phase boundary, it corresponds to a local maximum of
Landau free energy and can not describe the second order phase transition
because the coefficient $a_4$ of the fourth order term is always negative in
the free energy expansion.
","[{""version"":""v1"",""created"":""Wed, 20 Apr 2005 07:35:40 GMT""},{""version"":""v2"",""created"":""Wed, 19 Apr 2006 08:46:47 GMT""}]","2009-11-11"
"cond-mat/0504504","Mohammed Allalen","M. Allalen, H. Bouzar and T. Mehaddene","Saddle-point energies and Monte Carlo simulation of the long-range order
  relaxation in CoPt","8 pages, 4 figures; to appear in Eur. Phys. J. B","Eur. Phys. J. B 45 (2005) 443-448","10.1140/epjb/e2005-00206-4",,"cond-mat.mtrl-sci",,"  We present atomic-scale computer simulations in equiatomic L1$_0$-CoPt where
Molecular Dynamics and Monte Carlo techniques have both been applied to study
the vacancy-atom exchange and kinetics relaxation. The atomic potential is
determined using a Tight-Binding formalism within the Second-Moment
Approximation. It is used to evaluate the different saddle-point energies
involved in a vacancy-atom exchange between nearest-neighbour sites. The
potential and the saddle-point energies have been used to simulate the
relaxation of the long-range order in CoPt using a Monte Carlo technique. A
vacancy migration energy of $0.73\pm 0.15 eV$ and an order-disorder transition
temperature of 935 K have been found.
","[{""version"":""v1"",""created"":""Wed, 20 Apr 2005 13:08:42 GMT""},{""version"":""v2"",""created"":""Thu, 21 Apr 2005 07:18:25 GMT""}]","2009-11-11"
"cond-mat/0504505","Priya Mahadevan Dr","Priya Mahadevan, J.M. Osorio-Guillen and Alex Zunger","Origin of transition metal clustering tendencies in GaAs based dilute
  magnetic semiconductors","To appear in Appl. Phys. Lett",,"10.1063/1.1921359",,"cond-mat.mtrl-sci",,"  While isovalent doping of GaAs (e.g. by In) leads to a repulsion between the
solute atoms, two Cr, Mn, or Fe atoms in GaAs are found to have lower energy
than the well-separated pair, and hence attract each other. The strong bonding
interaction between levels with t2 symmetry on the transition metal (TM) atoms
results in these atoms exhibiting a strong tendency to cluster. Using
first-principles calculations, we show that this attraction is maximal for Cr,
Mn and Fe while it is minimal for V. The difference is attributed to the
symmetry of the highest occupied levels. While the intention is to find
possible choices of spintronic materials that show a reduced tendency to
cluster, one finds that the conditions that minimize clustering tendencies also
minimize the stabilization of the magnetic state.
","[{""version"":""v1"",""created"":""Wed, 20 Apr 2005 07:53:38 GMT""}]","2009-11-11"
"cond-mat/0504506","Zuo-Zi Chen","Zuo-Zi Chen, Haizhou Lu, Rong L\""u, and Bang-fen Zhu","Phonon-assisted Kondo Effect in a Single-Molecule Transistor out of
  Equilibrium","12 pages, 6 figures","J. Phys.: Condens. Matter 18 (2006) 5435-5446","10.1088/0953-8984/18/23/015",,"cond-mat.mes-hall",,"  The joint effect of the electron-phonon interaction and Kondo effect on the
nonequilibrium transport through the single molecule transistor is investigated
by using the improved canonical transformation scheme and extended equation of
motion approach. Two types of Kondo phonon-satellites with different asymmetric
shapes are fully confirmed in the spectral function, and are related to the
electron spin singlet or hole spin singlet, respectively. Moreover, when a
moderate Zeeman splitting is caused by a local magnetic field, the Kondo
satellites in the spin resolved spectral function are found disappeared on one
side of the main peak, which is opposite for different spin component. All
these peculiar signatures that manifest themselves in the nonlinear
differential conductance, are explained with a clear physics picture.
","[{""version"":""v1"",""created"":""Wed, 20 Apr 2005 08:05:02 GMT""},{""version"":""v2"",""created"":""Thu, 8 Jun 2006 19:46:02 GMT""}]","2016-08-16"
"cond-mat/0504508","Minh Toan Ngo","Ngo Minh Toan, Davide Marenduzzo and Cristian Micheletti","Inferring the diameter of a biopolymer from its stretching response","Revtex, 9 pages, 5 figures, to appear in the Biophysical Journal",,"10.1529/biophysj.104.058081",,"cond-mat.soft cond-mat.stat-mech q-bio.BM",,"  We investigate the stretching response of a thick polymer model by means of
extensive stochastic simulations. The computational results are synthesized in
an analytic expression that characterizes how the force versus elongation curve
depends on the polymer structural parameters: its thickness and granularity
(spacing of the monomers). The expression is used to analyze experimental data
for the stretching of various different types of biopolymers: polypeptides,
polysaccharides and nucleic acids. Besides recovering elastic parameters (such
as the persistence length) that are consistent with those obtained from
standard entropic models, the approach allows to extract viable estimates for
the polymers diameter and granularity. This shows that the basic structural
polymer features have such a profound impact on the elastic behaviour that they
can be recovered with the sole input of stretching measurements.
","[{""version"":""v1"",""created"":""Wed, 20 Apr 2005 08:44:33 GMT""}]","2009-11-11"
"cond-mat/0504509","Stefano Ciliberti","S.Ciliberti, M.Mezard, R.Zecchina","Lossy data compression with random gates",,"Phys. Rev. Lett. 95, 038701 (2005)","10.1103/PhysRevLett.95.038701",,"cond-mat.dis-nn",,"  We introduce a new protocol for a lossy data compression algorithm which is
based on constraint satisfaction gates. We show that the theoretical capacity
of algorithms built from standard parity-check gates converges exponentially
fast to the Shannon's bound when the number of variables seen by each gate
increases. We then generalize this approach by introducing random gates. They
have theoretical performances nearly as good as parity checks, but they offer
the great advantage that the encoding can be done in linear time using the
Survey Inspired Decimation algorithm, a powerful algorithm for constraint
satisfaction problems derived from statistical physics.
","[{""version"":""v1"",""created"":""Wed, 20 Apr 2005 08:46:56 GMT""}]","2009-11-11"
"cond-mat/0504510","Manfred Bayer","C. Bardot, M. Schwab, M. Bayer, S. Fafard, Z. Wasilewski, P. Hawrylak","Exciton lifetime in InAs/GaAs quantum dot molecules",,,"10.1103/PhysRevB.72.035314",,"cond-mat.mes-hall",,"  The exciton lifetimes $T_1$ in arrays of InAs/GaAs vertically coupled quantum
dot pairs have been measured by time-resolved photoluminescence. A considerable
reduction of $T_1$ by up to a factor of $\sim$ 2 has been observed as compared
to a quantum dots reference, reflecting the inter-dot coherence. Increase of
the molecular coupling strength leads to a systematic decrease of $T_1$ with
decreasing barrier width, as for wide barriers a fraction of structures shows
reduced coupling while for narrow barriers all molecules appear to be well
coupled. The coherent excitons in the molecules gain the oscillator strength of
the excitons in the two separate quantum dots halving the exciton lifetime.
This superradiance effect contributes to the previously observed increase of
the homogeneous exciton linewidth, but is weaker than the reduction of $T_2$.
This shows that as compared to the quantum dots reference pure dephasing
becomes increasingly important for the molecules.
","[{""version"":""v1"",""created"":""Wed, 20 Apr 2005 10:39:46 GMT""}]","2009-11-11"
"cond-mat/0504511","Armen Sedrakian","Armen Sedrakian, Jordi Mur-Petit, Artur Polls, Herbert M\""uther","Pairing in a two-component ultracold Fermi gas: phases with broken space
  symmetries","9 pages, uses RevTex4, v2: minor changes, matches published version","Phys.Rev.A72:013613,2005","10.1103/PhysRevA.72.013613",,"cond-mat.supr-con nucl-th",,"  We explore the phase diagram of a two-component ultracold atomic Fermi gas
interacting with zero-range forces in the limit of weak-coupling. We focus on
the dependence of the pairing gap and the free energy on the variations in the
number densities of the two species while the total density of the system is
held fixed. As the density asymmetry is increased, the system exhibits a
transition from a homogenous Bardeen-Cooper-Schrieffer (BCS) phase to phases
with spontaneously broken global space symmetries. One such realization is the
deformed Fermi surface superfluidity (DFS) which exploits the possibility of
deforming the Fermi-surfaces of the species into ellipsoidal form at zero total
momentum of Cooper pairs. The critical asymmetries at which the transition from
the DFS to the unpaired state occurs are larger than those for the BCS phase.
In this precritical region the DFS phase lowers the condensation energy of the
asymmetric BCS state. We compare quantitatively the DFS phase to another
realization of superconducting phases with broken translational symmetry - the
single plane wave Larkin-Ovchinnikov-Fulde-Ferrell (LOFF)phase, which is
characterized by a non-vanishing center-of-mass momentum of the Cooper pairs.
The possibility of the detection of the DFS phase in the time-of-flight
experiments is discussed and quantified for the case of $^6$Li atoms trapped in
two different hyperfine states.
","[{""version"":""v1"",""created"":""Wed, 20 Apr 2005 10:21:48 GMT""},{""version"":""v2"",""created"":""Thu, 14 Jul 2005 10:31:56 GMT""}]","2009-11-06"
"cond-mat/0504512","Christina Papenfuss","A.Palumbo, C. Papenfuss and P. Rogolino","A mesoscopic approach to diffusion phenomena in mixtures",,,,,"cond-mat.stat-mech cond-mat.mtrl-sci",,"  The mesosocpic concept is applied to the theory of mixtures. The aim is to
investigate the diffusion phenomenon from a mesoscopic point of view. The
domain of the field quantities is extended by the set of mesoscopic variables,
here the velocities of the components. Balance equations on this enlarged space
are the equations of motion for the mesoscopic fields. Moreover, local
distribution functions of the velocities are introduced as a statistical
element, and an equation of motion for this distribution function is derived.
  From this equation of motion differential equations for the diffusion fluxes,
and also for higher order fluxes are obtained. These equations are of balance
type, as it is postulated in Extended Thermodynamics. The resulting evolution
equation for the diffusion flux generalizes the Fick's law.
","[{""version"":""v1"",""created"":""Wed, 20 Apr 2005 10:30:46 GMT""}]","2007-05-23"
"cond-mat/0504513","Christophe Texier","Alain Comtet, Jean Desbois and Christophe Texier","Functionals of the Brownian motion, localization and metric graphs","Review article. 50 pages, 21 eps figures. Version 2: section 5.5 and
  conclusion added. Several references added","J. Phys. A: Math. Gen. 38, R341-R383 (2005)","10.1088/0305-4470/38/37/R01",,"cond-mat.dis-nn cond-mat.mes-hall nlin.CD quant-ph",,"  We review several results related to the problem of a quantum particle in a
random environment.
  In an introductory part, we recall how several functionals of the Brownian
motion arise in the study of electronic transport in weakly disordered metals
(weak localization).
  Two aspects of the physics of the one-dimensional strong localization are
reviewed : some properties of the scattering by a random potential (time delay
distribution) and a study of the spectrum of a random potential on a bounded
domain (the extreme value statistics of the eigenvalues).
  Then we mention several results concerning the diffusion on graphs, and more
generally the spectral properties of the Schr\""odinger operator on graphs. The
interest of spectral determinants as generating functions characterizing the
diffusion on graphs is illustrated.
  Finally, we consider a two-dimensional model of a charged particle coupled to
the random magnetic field due to magnetic vortices. We recall the connection
between spectral properties of this model and winding functionals of the planar
Brownian motion.
","[{""version"":""v1"",""created"":""Wed, 20 Apr 2005 10:47:20 GMT""},{""version"":""v2"",""created"":""Fri, 7 Oct 2005 07:35:48 GMT""}]","2007-05-23"
"cond-mat/0504514","Francesco Giazotto","F. Giazotto, M. Governale, U. Zuelicke, and F. Beltram","Andreev reflection and cyclotron motion at superconductor --
  normal-metal interfaces","8 pages, 6 figures","Phys. Rev. B 72, 054518 (2005)","10.1103/PhysRevB.72.054518",,"cond-mat.mes-hall cond-mat.supr-con",,"  We investigate Andreev reflection at the interface between a superconductor
and a two--dimensional electron system (2DES) in an external magnetic field
such that cyclotron motion is important in the latter. A finite Zeeman
splitting in the 2DES and the presence of diamagnetic screening currents in the
superconductor are incorporated into a microscopic theory of Andreev edge
states, which is based on the Bogoliubov--de Gennes formalism. The
Andreev--reflection contribution to the interface conductance is calculated.
The effect of Zeeman splitting is most visible as a double--step feature in the
conductance through clean interfaces. Due to a screening current, conductance
steps are shifted to larger filling factors and the formation of Andreev edge
states is suppressed below a critical filling factor.
","[{""version"":""v1"",""created"":""Wed, 20 Apr 2005 11:04:14 GMT""}]","2007-05-23"
"cond-mat/0504516","Hank Miller","A.M. Teweldeberhan, A.R. Plastino and H.G. Miller","On the Cut-Off Prescriptions Associated with Power-Law Generalized
  Thermostatistics",,,"10.1016/j.physleta.2005.06.026",,"cond-mat.stat-mech cond-mat.other",,"  We revisit the cut-off prescriptions which are needed in order to specify
completely the form of Tsallis' maximum entropy distributions. For values of
the Tsallis entropic parameter $q>1$ we advance an alternative cut-off
prescription and discuss some of its basic mathematical properties. As an
illustration of the new cut-off prescription we consider in some detail the
$q$-generalized quantum distributions which have recently been shown to
reproduce various experimental results related to high $T_c$ superconductors.
","[{""version"":""v1"",""created"":""Wed, 20 Apr 2005 11:49:15 GMT""}]","2009-11-11"
"cond-mat/0504517","Mika Sillanpaa","M. A. Sillanpaa, T. Lehtinen, A. Paila, Yu. Makhlin, L. Roschier, P.
  J. Hakonen","Direct Observation of Josephson Capacitance","4 pages","Phys. Rev. Lett. 95, 206806 (2005)","10.1103/PhysRevLett.95.206806",,"cond-mat.mes-hall cond-mat.supr-con",,"  The effective capacitance has been measured in the split Cooper pair box
(CPB) over its phase-gate bias plane. Our low-frequency reactive measurement
scheme allows to probe purely the capacitive susceptibility due to the CPB band
structure. The data are quantitatively explained using parameters determined
independently by spectroscopic means. In addition, we show in practice that the
method offers an efficient way to do non-demolition readout of the CPB quantum
state.
","[{""version"":""v1"",""created"":""Wed, 20 Apr 2005 11:55:29 GMT""},{""version"":""v2"",""created"":""Fri, 13 Jan 2006 16:21:47 GMT""}]","2009-11-11"
"cond-mat/0504518","Nicola Pugno","N. Pugno and R. Ruoff","Nanoscale Weibull Statistics",,,"10.1063/1.2158491",,"cond-mat.mtrl-sci",,"  In this paper a modification of the classical Weibull Statistics is developed
for nanoscale applications. It is called Nanoscale Weibull Statistics. A
comparison between Nanoscale and classical Weibull Statistics applied to
experimental results on fracture strength of carbon nanotubes clearly shows the
effectiveness of the proposed modification. A Weibull's modulus around 3 is,
for the first time, deduced for nanotubes. The approach can treat (also) a
small number of structural defects, as required for nearly defect free
structures (e.g., nanotubes) as well as a quantized crack propagation (e.g., as
a consequence of the discrete nature of matter), allowing to remove the
paradoxes caused by the presence of stress-intensifications.
","[{""version"":""v1"",""created"":""Wed, 20 Apr 2005 12:06:38 GMT""}]","2009-11-11"
"cond-mat/0504519","Maurits Haverkort","S. I. Csiszar, M. W. Haverkort, Z. Hu, A. Tanaka, H. H. Hsieh, H.-J.
  Lin, C. T. Chen, T. Hibma, and L. H. Tjeng","Controlling orbital moment and spin orientation in CoO layers by strain",,"Phys. Rev. Lett. 95, 187205 (2005)","10.1103/PhysRevLett.95.187205",,"cond-mat.str-el",,"  We have observed that CoO films grown on different substrates show dramatic
differences in their magnetic properties. Using polarization dependent x-ray
absorption spectroscopy at the Co L$_{2,3}$ edges, we revealed that the
magnitude and orientation of the magnetic moments strongly depend on the strain
in the films induced by the substrate. We presented a quantitative model to
explain how strain together with the spin-orbit interaction determine the 3d
orbital occupation, the magnetic anisotropy, as well as the spin and orbital
contributions to the magnetic moments. Control over the sign and direction of
the strain may therefore open new opportunities for applications in the field
of exchange bias in multilayered magnetic films.
","[{""version"":""v1"",""created"":""Wed, 20 Apr 2005 12:10:47 GMT""}]","2007-05-23"
