"cond-mat/0504520","Maurits Haverkort","S. I. Csiszar, M. W. Haverkort, T. Burnus, Z. Hu, A. Tanaka, H. H.
  Hsieh, H.-J. Lin, C. T. Chen, J. C. Cezar, N. B. Brookes, T. Hibma, and L. H.
  Tjeng","Aligning spins in antiferromagnetic films using antiferromagnets",,,,,"cond-mat.str-el","http://arxiv.org/licenses/nonexclusive-distrib/1.0/","  We have explored the possibility to orient spins in antiferromagnetic thin
films with low magnetocrystalline anisotropy via the exchange coupling to
adjacent antiferromagnetic films with high magnetocrystalline anisotropy. We
have used MnO as a prototype for a system with negligible single-ion
anisotropy. We were able to control its spin direction very effectively by
growing it as a film on antiferromagnetic CoO films with different
predetermined spin orientations. This result may pave the way for tailoring
antiferromagnets with low magnetocrystalline anistropy for applications in
exchange bias systems. Very detailed information concerning the exchange
coupling and strain effects was obtained from the Mn $L_{2,3}$ soft x-ray
absorption spectroscopy.
","[{""version"":""v1"",""created"":""Wed, 20 Apr 2005 13:49:46 GMT""},{""version"":""v2"",""created"":""Thu, 12 Jun 2008 10:36:57 GMT""}]","2008-06-12"
"cond-mat/0504521","Boris Mavrin N.","B. N. Mavrin, M. V. Koldaeva, R. M. Zakalukin, T. N. Turskaya","Fourier-Raman spectra of alkali metal and thallium hydrogen phthalate
  single crystals","8 pages including 3 figures and 3 tables",,,,"cond-mat.mtrl-sci",,"  Polarized Fourier-Raman spectra of K, Rb and Tl hydrogen phthalates are
studied at the 1064 nm excitation. The frequencies of internal vibrations in
hydrogen phthalates are assigned to vibrations of orthophenylene and carboxyl
groups. A substitution of K for Rb and Tl gave rise to a small low-frequency
shift of vibrations. It is observed the multiband structure of the stretching
OH-vibrations due to the fermi-resonance interactions. A number of additional
bands are found in the spectra of deuterium potassium acid phthalate. It is
suggested that only the partial substitution of hydrogen atoms for deuterium
takes place in both orthophenylene and carboxyl groups.
","[{""version"":""v1"",""created"":""Wed, 20 Apr 2005 14:05:46 GMT""}]","2007-05-23"
"cond-mat/0504522","Claudio Castellano","Claudio Castellano","Effect of network topology on the ordering dynamics of voter models","7 pages, 4 figures; to appear in the Proceedings of the 8th Granada
  Seminar - Computational and Statistical Physics","AIP Conf. Proc. 779, 114 (2005)","10.1063/1.2008600",,"cond-mat.stat-mech",,"  We introduce and study the reverse voter model, a dynamics for spin variables
similar to the well-known voter dynamics. The difference is in the way
neighbors influence each other: once a node is selected and one among its
neighbors chosen, the neighbor is made equal to the selected node, while in the
usual voter dynamics the update goes in the opposite direction. The reverse
voter dynamics is studied analytically, showing that on networks with degree
distribution decaying as k^{-nu}, the time to reach consensus is linear in the
system size N for all nu>2. The consensus time for link-update voter dynamics
is computed as well. We verify the results numerically on a class of
uncorrelated scale-free graphs.
","[{""version"":""v1"",""created"":""Wed, 20 Apr 2005 14:25:18 GMT""}]","2009-11-11"
"cond-mat/0504523","Jeffrey Sokoloff","J. B. Sokoloff and I. Webman","Theory of De-Pinning of Monolayer Films Adsorbed on a Quartz Crystal
  Microbalance","4 pages, one figure",,,,"cond-mat.mtrl-sci",,"  In quartz crystal microbalance (QCM) studies of the friction between an
adsorbed monolayer film and a metallic substrate, the films are observed to
slide relative to the substrate under inertial forces of order $10^{-14}dyn$
per film atom, a force much smaller than all theoretical estimates of the force
that surface defects are capable of exerting. In this letter we propose, in
order to resolve this issue, that if the defect potentials have a range of
greater than an atomic spacing, the net force on a relatively stiff film due to
the defects is likely to be extremely small. Line defects (e.g., step and facet
edges and grain boundaries) as well as more localized defects (e.g., vacancies)
are considered.
","[{""version"":""v1"",""created"":""Wed, 20 Apr 2005 15:48:11 GMT""}]","2007-05-23"
"cs/0504087","Rahul Jain","Rahul Jain","Improved direct sum theorem in classical communication complexity","Withdrawn due to critical error",,,,"cs.OH",,"  Withdrawn due to critical error.
","[{""version"":""v1"",""created"":""Tue, 19 Apr 2005 21:53:09 GMT""},{""version"":""v2"",""created"":""Thu, 21 Apr 2005 17:11:36 GMT""},{""version"":""v3"",""created"":""Thu, 21 Apr 2005 21:00:46 GMT""}]","2007-05-23"
"gr-qc/0504085","Clifford M. Will","Clifford M. Will","Special Relativity: A Centenary Perspective","24 pages, 4 figures, to be published in the proceedings of the 2005
  Seminaire Poincare held in Paris, 09 April 2005","Einstein, 1905-2005: Poincare Seminar 2005, ed. T. Damour, O.
  Darrigol, B. Duplantier and V. Rivasseau (Birkhauser, Basel 2006), pp. 33-58","10.1007/3-7643-7436-5_2",,"gr-qc",,"  This article is a partly pedagogical, partly historical and partly technical
review of special relativity and its experimental foundations, in honor of the
centenary of Einstein's annus mirabilis.
","[{""version"":""v1"",""created"":""Tue, 19 Apr 2005 16:10:03 GMT""}]","2015-06-25"
"gr-qc/0504086","Clifford M. Will","Clifford M. Will","Was Einstein Right? Testing Relativity at the Centenary","21 pages, 3 figures, to be published in ""100 Years of Relativity:
  Spacetime Structure - Einstein and Beyond"", ed. Abhay Ashtekar (World
  Scientific, Singapore)","Annalen Phys.15:19-33,2005","10.1002/andp.200510170",,"gr-qc",,"  We review the experimental evidence for Einstein's special and general
relativity. A variety of high precision null experiments verify the weak
equivalence principle and local Lorentz invariance, while gravitational
redshift and other clock experiments support local position invariance.
Together these results confirm the Einstein Equivalence Principle which
underlies the concept that gravitation is synonymous with spacetime geometry,
and must be described by a metric theory. Solar system experiments that test
the weak-field, post-Newtonian limit of metric theories strongly favor general
relativity. The Binary Pulsar provides tests of gravitational-wave damping and
of strong-field general relativity. Recently discovered binary pulsar systems
may provide additional tests. Future and ongoing experiments, such as the
Gravity Probe B Gyroscope Experiment, satellite tests of the Equivalence
principle, and tests of gravity at short distance to look for extra spatial
dimensions could constrain extensions of general relativity. Laser
interferometric gravitational-wave observatories on Earth and in space may
provide new tests of gravitational theory via detailed measurements of the
properties of gravitational waves.
","[{""version"":""v1"",""created"":""Tue, 19 Apr 2005 16:20:55 GMT""}]","2011-07-19"
"gr-qc/0504087","Elizabeth Winstanley","Anne-Marie Barlow, Daniel Doherty and Elizabeth Winstanley","Thermodynamics of de Sitter black holes with a conformally coupled
  scalar field","9 pages, 2 figures, REVTEX. Minor changes, accepted for publication
  in Phys. Rev. D","Phys.Rev.D72:024008,2005","10.1103/PhysRevD.72.024008",,"gr-qc hep-th",,"  We study the thermodynamics of de Sitter black holes with a conformally
coupled scalar field. The geometry is that of the ``lukewarm''
Reissner-Nordstrom-de Sitter black holes, with the event and cosmological
horizons at the same temperature. This means that the region between the event
and cosmological horizons can form a regular Euclidean instanton. The entropy
is modified by the non-minimal coupling of the scalar field to the geometry,
but can still be derived from the Euclidean action, provided suitable
modifications are made to deal with the electrically charged case. We use the
first law as derived from the isolated horizons formalism to compute the local
horizon energies for the event and cosmological horizons.
","[{""version"":""v1"",""created"":""Tue, 19 Apr 2005 18:31:41 GMT""},{""version"":""v2"",""created"":""Wed, 29 Jun 2005 09:43:36 GMT""}]","2011-07-19"
"gr-qc/0504088","Winfried Zimdahl","Winfried Zimdahl, Julio C. Fabris","Chaplygin gas with non-adiabatic pressure perturbations","16 pages, comments and references added, accepted for publication in
  Class.Quantum Grav","Class.Quant.Grav. 22 (2005) 4311-4324","10.1088/0264-9381/22/20/011",,"gr-qc astro-ph hep-th",,"  Perturbations in a Chaplygin gas, characterized by an equation of state $p =
-A/\rho$, may acquire non-adiabatic contributions if spatial variations of the
parameter $A$ are admitted. This feature is shown to be related to a specific
internal structure of the Chaplygin gas. We investigate how perturbations of
this type modify the adiabatic sound speed and influence the time dependence of
the gravitational potential which gives rise to the Integrated Sachs-Wolfe
effect in the anisotropy spectrum of the cosmic microwave background.
","[{""version"":""v1"",""created"":""Tue, 19 Apr 2005 20:48:09 GMT""},{""version"":""v2"",""created"":""Tue, 6 Sep 2005 10:38:13 GMT""}]","2009-11-11"
"gr-qc/0504089","Andrzej Woszczyna","Marek Demianski, Zdzislaw A. Golda, Andrzej Woszczyna","Evolution of density perturbations in a realistic universe","19 pages, 4 figures","Gen.Rel.Grav. 37 (2005) 2063-2082","10.1007/s10714-005-0180-2",,"gr-qc",,"  Prompted by the recent more precise determination of the basic cosmological
parameters and growing evidence that the matter-energy content of the universe
is now dominated by dark energy and dark matter we present the general solution
of the equation that describes the evolution of density perturbations in the
linear approximation. It turns out that as in the standard CDM model the
density perturbations grow very slowly during the radiation dominated epoch and
their amplitude increases by a factor of about 4000 in the matter and later
dark energy dominated epoch of expansion of the universe.
","[{""version"":""v1"",""created"":""Wed, 20 Apr 2005 10:32:29 GMT""}]","2009-11-11"
"gr-qc/0504090","Kourosh Nozari","Kourosh Nozari and Tahereh Azizi","Coherent States of Harmonic Oscillator and Generalized Uncertainty
  Principle","12 pages, no figure","Int.J.Quant.Inf. 3 (2005) 623-632","10.1142/S0219749905001468",,"gr-qc",,"  In this paper dynamics and quantum mechanical coherent states of a simple
harmonic oscillator are considered in the framework of Generalized Uncertainty
Principle(GUP). Equations of motion for simple harmonic oscillator are derived
and some of their new implications are discussed. Then coherent states of
harmonic oscillator in the case of GUP are compared with relative situation in
ordinary quantum mechanics. It is shown that in the framework of GUP there is
no considerable difference in definition of coherent states relative to
ordinary quantum mechanics. But, considering expectation values and variances
of some operators, based on quantum gravitational arguments one concludes that
although it is possible to have complete coherency and vanishing broadening in
usual quantum mechanics, gravitational induced uncertainty destroys complete
coherency in quantum gravity and it is not possible to have a monochromatic ray
in principle.
","[{""version"":""v1"",""created"":""Wed, 20 Apr 2005 11:12:37 GMT""}]","2007-05-23"
"hep-ex/0504036","Marcel Demarteau","W. Cooper, C. Daly, M. Demarteau, J. Fast, K. Hanagaki, M. Johnson, W.
  Kuykendall, H. Lubatti, M. Matulik, A. Nomerotski, B. Quinn, J. Wang","Electrical Properties of Carbon Fiber Support Systems","20 pages, 11 figures, submitted to NIM","Nucl.Instrum.Meth.A550:127-138,2005","10.1016/j.nima.2005.04.087","FERMILAB-PUB-05-074-E","hep-ex",,"  Carbon fiber support structures have become common elements of detector
designs for high energy physics experiments. Carbon fiber has many mechanical
advantages but it is also characterized by high conductivity, particularly at
high frequency, with associated design issues. This paper discusses the
elements required for sound electrical performance of silicon detectors
employing carbon fiber support elements. Tests on carbon fiber structures are
presented indicating that carbon fiber must be regarded as a conductor for the
frequency region of 10 to 100 MHz. The general principles of grounding
configurations involving carbon fiber structures will be discussed. To
illustrate the design requirements, measurements performed with a silicon
detector on a carbon fiber support structure at small radius are presented. A
grounding scheme employing copper-kapton mesh circuits is described and shown
to provide adequate and robust detector performance.
","[{""version"":""v1"",""created"":""Tue, 19 Apr 2005 18:05:36 GMT""}]","2008-11-26"
"hep-ex/0504037","Till A. Kirsten","GNO COLLABORATION: M. Altmann, M. Balata, P. Belli, E. Bellotti, R.
  Bernabei, E. Burkert, C. Cattadori, R. Cerulli, M. Chiarini, M. Cribier, S.
  d'Angelo, G. Del Re, K. H. Ebert, F. v. Feilitzsch, N. Ferrari, W. Hampel, F.
  X. Hartmann, E. Henrich, G. Heusser, F. Kaether, J. Kiko, T. Kirsten, T.
  Lachenmaier, J. Lanfranchi, M. Laubenstein, K. Luetzenkirchen, K. Mayer, P.
  Moegel, D. Motta, S. Nisi, J. Oehm, L. Pandola, F. Petricca, W. Potzel, H.
  Richter, S. Schoenert, M. Wallenius, M. Wojcik, L. Zanotti","Complete results for five years of GNO solar neutrino observations","22 pages incl. 9 Figures and 8 Tables. to appear in: Physics Letters
  B (accepted April 13, 2005) PACS: 26.65.+t ; 14.60.Pq","Phys.Lett.B616:174-190,2005","10.1016/j.physletb.2005.04.068","MPI-K 2005-008","hep-ex astro-ph",,"  We report the complete GNO solar neutrino results for the measuring periods
GNO III, GNO II, and GNO I. The result for GNO III (last 15 solar runs) is
[54.3 + 9.9 - 9.3 (stat.)+- 2.3 (syst.)] SNU (1 sigma) or [54.3 + 10.2 - 9.6
(incl. syst.)] SNU (1 sigma) with errors combined. The GNO experiment is now
terminated after altogether 58 solar exposure runs that were performed between
May 20, 1998 and April 9, 2003. The combined result for GNO (I+II+III) is [62.9
+ 5.5 - 5.3 (stat.) +- 2.5 (syst.)] SNU (1 sigma) or [62.9 + 6.0 - 5.9] SNU (1
sigma) with errors combined in quadrature. Overall, gallium based solar
observations at LNGS (first in GALLEX, later in GNO) lasted from May 14, 1991
through April 9, 2003. The joint result from 123 runs in GNO and GALLEX is
[69.3 +- 5.5 (incl. syst.)] SNU (1 sigma). The distribution of the individual
run results is consistent with the hypothesis of a neutrino flux that is
constant in time. Implications from the data in particle- and astrophysics are
reiterated.
","[{""version"":""v1"",""created"":""Tue, 19 Apr 2005 20:55:38 GMT""}]","2008-11-26"
"hep-ex/0504038","Joachim Spengler","Joachim Spengler (Max-Planck-Institut fuer Kernphysik, Heidelberg,
  Germany)","Search for Pentaquarks with HERA-B","9 pages, 6 figures, write-up of talk presented at Cracow Epiphany
  Conference on Hadron Spectroscopy 2005","Acta Phys.Polon. B36 (2005) 2223-2232",,,"hep-ex",,"  A large data set of proton-nucleus collisions at sqrt(s) =41.6 GeV has been
searched for Theta+ and Xi(1862) pentaquark candidates. In 2x10**8 inelastic
events we find no evidence for narrow signals (sigma=5 MeV/c**2) in the Theta+
--> pK0s and Xi--(1862) --> Xi- pi- channels. Upper limits on production cross
sections at mid-rapidity and on ratios of production cross sections to those of
well established resonances are presented.
","[{""version"":""v1"",""created"":""Wed, 20 Apr 2005 12:19:15 GMT""}]","2007-05-23"
"hep-ex/0504039","Fernando Martinez-Vidal","B. Aubert, et al, BABAR Collaboration","Measurement of the Cabibbo-Kobayashi-Maskawa angle gamma in B-+ ->
  D(*)K-+ decays with a Dalitz analysis of D -> K0s pi- pi+","7 pages, 3 figures. Accepted by Phys. Rev. Lett","Phys.Rev.Lett.95:121802,2005","10.1103/PhysRevLett.95.121802","SLAC-PUB-11127, BABAR-PUB-05/010","hep-ex",,"  We report on a measurement of the Cabibbo-Kobayashi-Maskawa CP-violating
phase gamma through a Dalitz analysis of neutral D decays to K0s pi- pi+ in the
processes B-+ -> D(*)K-+, D* -> D pi0, D gamma. Using a sample of 227 million
BBbar pairs collected by the BaBar detector, we measure the amplitude ratios rB
= 0.12+/-0.08+/-0.03+/-0.04 and rB* = 0.17+/-0.10+/-0.03+/-0.03, the relative
strong phases deltaB = 104+/-45+17-21+16-24, and deltaB*= -64+/-41+14-12+/-15
between the amplitudes A(B- -> Dbar(*)0 K-) and A(B- -> D(*)0 K-), and gamma =
70+/-31+12-10+14-11. The first error is statistical, the second is the
experimental systematic uncertainty and the third reflects the Dalitz model
uncertainty. The results for the strong and weak phases have a two-fold
ambiguity.
","[{""version"":""v1"",""created"":""Wed, 20 Apr 2005 12:38:24 GMT""},{""version"":""v2"",""created"":""Sat, 10 Sep 2005 12:24:13 GMT""}]","2010-03-19"
"hep-lat/0504016","Mithat Unsal","Mithat Unsal","Compact Gauge Fields for Supersymmetric Lattices","15 pages, 2 figures. Minor changes","JHEP0511:013,2005","10.1088/1126-6708/2005/11/013","BUHEP 05-07","hep-lat hep-th",,"  We show that a large class of Euclidean extended supersymmetric lattice gauge
theories constructed in [hep-lat/0302017 - hep-lat/0503039] can be regarded as
compact formulations by using the polar decomposition of the complex link
fields. In particular, the gauge part of the supersymmetric lattice action is
the standard Wilson action. This formulation facilitates the construction of
gauge invariant operators.
","[{""version"":""v1"",""created"":""Tue, 19 Apr 2005 16:32:19 GMT""},{""version"":""v2"",""created"":""Sun, 30 Oct 2005 03:58:23 GMT""}]","2009-11-11"
"hep-ph/0504170","Piyush Kumar","Jacob L. Bourjaily, Gordon L. Kane, Piyush Kumar, Ting T. Wang","Outside the mSUGRA Box",,,,,"hep-ph hep-ex hep-th",,"  Most studies of the potential for discovery of superpartners at the Fermilab
Tevatron or CERN LHC have focused on the so-called mSUGRA (minimal supergravity
mediated supersymmetry breaking) model, not because it is well motivated but
because it has a minimal number of parameters. If signals are seen that could
be superpartners, most analyses will attempt to interpret them in the mSUGRA
framework since the needed software and computational tools exist. With only a
few signal channels, and initially large statistical and systematic errors, it
is very likely that an mSUGRA interpretation will look all right even if it is
not. We present an approach to studying any potential signals of new physics in
``inclusive signature space'' that sensitively tests any proposed
interpretation, and apply it to the mSUGRA case. The approach also has
significant experimental advantages, reducing the sensitivity to jet energy
corrections, dependence on beam luminosity, and other systematics. Basically,
if one (or more) instances of reported data lies outside certain bounded
regions of inclusive signature space characteristic of the physics being
tested, that physics is excluded for any parameters. The approach can be used
to study supersymmetry breaking and to point to the form of the underlying
theory even without detailed measurements of a number of important parameters
which will be difficult or impossible to measure at hadron colliders.
","[{""version"":""v1"",""created"":""Tue, 19 Apr 2005 20:12:04 GMT""}]","2007-05-23"
"hep-ph/0504171","Javier Ferrandis","Javier Ferrandis","Is the beta phase maximal ?","1 figure","Phys.Lett.B620:137-142,2005","10.1016/j.physletb.2005.06.034","LBNL-47452","hep-ph hep-ex",,"  The current experimental determination of the absolute values of the CKM
elements indicates that 2|Vub / Vcb/ Vus| = (1-z) with z given by z = 0.19 +(-)
0.14. This fact implies that irrespective of the form of the quark Yukawa
matrices, the measured value of the SM CP phase beta is approximately the
maximum allowed by the measured absolute values of the CKM elements. This is
beta = pi/6 - z/sqrt{3} for gamma = pi/3 + z/sqrt{3}, which implies alpha =
pi/2. Alternatively, assuming that beta is exactly maximal and using the
experimental measurement, sin(2beta) = 0.726 +(-) 0.037, the phase gamma is
predicted to be gamma = pi/2 - beta = 66.3 +(-) 1.7. The maximality of beta, if
confirmed by the near-future experiments, may give us some clues as to the
origin of CP violation.
","[{""version"":""v1"",""created"":""Wed, 20 Apr 2005 01:19:07 GMT""},{""version"":""v2"",""created"":""Wed, 27 Apr 2005 21:11:38 GMT""},{""version"":""v3"",""created"":""Mon, 6 Jun 2005 20:32:50 GMT""}]","2014-11-18"
"hep-ph/0504172","Masaki Yasue","Ichiro Aizawa, Teruyuki Kitabayashi, Masaki Yasue","Neutrino Mass Textures with Maximal CP Violation","10 pages, RevTex, no figures, references updated, version to appear
  in Phys. Rev. D","Phys.Rev.D72:055014,2005","10.1103/PhysRevD.72.055014","TOKAI-HEP/TH-0502","hep-ph",,"  We have found three types of neutrino mass textures, which give maximal
CP-violation as well as maximal atmospheric neutrino mixing. These textures are
described by six real mass parameters: one specified by two complex flavor
neutrino masses and two constrained ones and the others specified by three
complex flavor neutrino masses. In each texture, we calculate mixing angles and
masses as well as Majorana CP phases.
","[{""version"":""v1"",""created"":""Wed, 20 Apr 2005 07:16:09 GMT""},{""version"":""v2"",""created"":""Thu, 28 Apr 2005 01:44:04 GMT""},{""version"":""v3"",""created"":""Tue, 10 May 2005 10:04:51 GMT""},{""version"":""v4"",""created"":""Tue, 5 Jul 2005 08:32:51 GMT""},{""version"":""v5"",""created"":""Thu, 1 Sep 2005 01:55:59 GMT""},{""version"":""v6"",""created"":""Sun, 11 Sep 2005 02:35:42 GMT""}]","2014-11-18"
"hep-ph/0504173","Anirban Kundu","Anirban Kundu, Soumitra Nandi, Jyoti Prasad Saha","New Physics in b --> s bar(s) s Decay","9 pages, 3 encapsulated figures, minor changes in the text,
  conclusions unchanged, a few references added, version to appear in PLB","Phys.Lett. B622 (2005) 102-111","10.1016/j.physletb.2005.06.082","CU-PHYSICS-08/2005","hep-ph",,"  We perform a model-independent analysis of the data on branching ratios and
CP asymmetries of $B\to\phi K$ and $B\to\eta^{(')} K^{(*)}$ modes. The present
data is encouraging to look for indirect evidences of physics beyond the
Standard Model. We investigate the parameter spaces for different possible
Lorentz structures of the new physics four-Fermi interaction. It is shown that
if one takes the data at $1\sigma$ confidence level, only one particular
Lorentz structure is allowed. Possible consequences for the $B_s$ system are
also discussed.
","[{""version"":""v1"",""created"":""Wed, 20 Apr 2005 07:11:22 GMT""},{""version"":""v2"",""created"":""Thu, 30 Jun 2005 05:41:07 GMT""}]","2009-11-11"
"hep-ph/0504174","Munshi Golam Mustafa Dr.","Munshi G. Mustafa, Purnendu Chakraborty and Markus H Thoma","Dynamical screening in a quark gluon plasma","4 pages (including 2 figures) prepared with J. Phys. G format for
  conference proceedings: Talk given in the 5th International Conference on
  Physics and Astrophysics of Quark Gluon Plasma (ICPAQGP - 2005) held in
  Kolkata, INDIA, during February 8-12, 2005",,"10.1088/1742-6596/50/1/066",,"hep-ph astro-ph nucl-th",,"  We calculate the screening potential of a fast parton moving through a
quark-gluon plasma in the framework of semi-classical transport theory. We
found an anisotropic potential showing a minimum in the direction of the parton
velocity. Possible consequences of this potential on binary states in a
quark-gluon plasma are discussed.
","[{""version"":""v1"",""created"":""Wed, 20 Apr 2005 09:37:28 GMT""}]","2015-06-25"
"hep-ph/0504175","Philipp Hagler","M. Diehl, Ph. Hagler","Spin densities in the transverse plane and generalized transversity
  distributions","23 pages, 6 eps-figures","Eur.Phys.J.C44:87-101,2005","10.1140/epjc/s2005-02342-6",,"hep-ph hep-lat",,"  We show how generalized quark distributions in the nucleon describe the
density of polarized quarks in the impact parameter plane, both for
longitudinal and transverse polarization of the quark and the nucleon. This
density representation entails positivity bounds including chiral-odd
distributions, which tighten the known bounds in the chiral-even sector. Using
the quark equations of motion, we derive relations between the moments of
chiral-odd generalized parton distributions of twist two and twist three. We
exhibit the analogy between polarized quark distributions in impact parameter
space and transverse momentum dependent distribution functions.
","[{""version"":""v1"",""created"":""Wed, 20 Apr 2005 13:08:02 GMT""}]","2009-01-07"
