"math/0504437","Tornike Kadeishvili","Tornike Kadeishvili","On the homology theory of fibre spaces","8 pages. This is the English version of the paper published
  originally in Russian","Uspekhi Mat. Nauk 35:3 (1980), 183-188",,,"math.AT",,"  The $A(\inft)$-algebra structure in homology of a DG-algebra is constructed.
This structure is unique up to isomorphism of $A(\infty)$ algebras. Connection
of this structure with Massey products is indicated. The notion of
$A(\infty)$-module over an $A(\infty)$-algebra is introduced and such a
structure is constructed in homology of a DG-modules over a DG-algebra. The
theory of twisted tensor products is generalized from the case of DG-algebras
to the case of $A(\infty)$-algebras. These algebraic results are used to
describe homology of classifying spaces, cohomology of loop spaces, and
homology of fibre bundles.
","[{""version"":""v1"",""created"":""Thu, 21 Apr 2005 18:22:34 GMT""}]","2007-05-23"
"math/0504438","Alexey Muranov","Alexey Muranov","On torsion-free groups with finite regular file bases","version 3: 40 pages, 12 figures, typos corrected, converted to LaTeX;
  v2: 38 pages, 12 figures, improved readability; v1: 40 pages, 12 figures","Trans. Amer. Math. Soc. 359 (2007), no. 8, 3609--3645","10.1090/S0002-9947-07-04256-0",,"math.GR",,"  The following question was asked by V. V. Bludov in The Kourovka Notebook in
1995: If a torsion-free group $G$ has a finite system of generators $a_1$, ...,
$a_n$ such that every element of $G$ has a unique presentation in the form
$a_1^{k_1}... a_n^{k_n}$ where $k_i\in\mathbb Z$, is it true that $G$ is
virtually polycyclic? The answer is ``not always.'' A counterexample is
constructed in this paper as a group presented by generators and defining
relations.
","[{""version"":""v1"",""created"":""Thu, 21 Apr 2005 18:28:44 GMT""},{""version"":""v2"",""created"":""Thu, 9 Feb 2006 21:38:40 GMT""},{""version"":""v3"",""created"":""Fri, 20 Apr 2007 12:12:04 GMT""}]","2022-03-28"
"math/0504439","C\'esar Rosales","Manuel Ritor\'e and C\'esar Rosales","Rotationally invariant hypersurfaces with constant mean curvature in the
  Heisenberg group H^n","16 pages, 1 figure",,,,"math.DG math.MG",,"  In this paper we study sets in the $n$-dimensional Heisenberg group $\hhn$
which are critical points, under a volume constraint, of the sub-Riemannian
perimeter associated to the distribution of horizontal vector fields in $\hhn$.
We define a notion of mean curvature for hypersurfaces and we show that the
boundary of a stationary set is a constant mean curvature (CMC) hypersurface.
Our definition coincides with previous ones.
  Our main result describes which are the CMC hypersurfaces of revolution in
$\hhn$. The fact that such a hypersurface is invariant under a compact group of
rotations allows us to reduce the CMC partial differential equation to a system
of ordinary differential equations. The analysis of the solutions leads us to
establish a counterpart in the Heisenberg group of the Delaunay classification
of constant mean curvature hypersurfaces of revolution in the Euclidean space.
Hence we classify the rotationally invariant isoperimetric sets in $\hhn$.
","[{""version"":""v1"",""created"":""Thu, 21 Apr 2005 18:28:46 GMT""}]","2007-05-23"
"math/0504440","Pierre Bayard","Pierre Bayard","Entire spacelike hypersurfaces of prescribed scalar curvature in
  Minkowski space","21 pages; revised version; to appear in Calc. of Var. and PDE's",,,,"math.DG math.AP",,"  We prove existence and uniqueness of entire spacelike hypersurfaces in the
Minkowski space with prescribed negative scalar curvature, and with given
values at infinity which stay at a bounded distance of a lightcone.
","[{""version"":""v1"",""created"":""Thu, 21 Apr 2005 20:02:09 GMT""},{""version"":""v2"",""created"":""Tue, 20 Sep 2005 18:28:54 GMT""}]","2007-05-23"
"math/0504441","Peter A. Storm","Yair Glasner, Juan Souto, and Peter Storm","Finitely generated subgroups of lattices in PSL(2,C)",,,,,"math.GT math.GR",,"  Let G be a lattice in PSL(2,C). The pro-normal topology on G is defined by
taking all cosets of non-trivial normal subgroups as a basis. This topology is
finer than the pro-finite topology, but it is not discrete. We prove that every
finitely generated subgroup H<G is closed in the pro-normal topology. As a
corollary we deduce that if M is a maximal subgroup of a lattice in PSL(2,C)
then either M is finite index or M is not finitely generated.
","[{""version"":""v1"",""created"":""Thu, 21 Apr 2005 20:59:21 GMT""}]","2007-05-23"
"math/0504442","Dmitry Pelinovsky","M. Chugunova, D. Pelinovsky","Block-diagonalization of the linearized coupled-mode system","16 pages, 2 figuresn",,"10.1137/050629781",,"math.DS math.NA",,"  We consider the Hamiltonian coupled-mode system that occur in nonlinear
optics, photonics, and atomic physics. Spectral stability of gap solitons is
determined by eigenvalues of the linearized coupled-mode system, which is
equivalent to a four-by-four Dirac system with sign-indefinite metric. In the
special class of symmetric nonlinear potentials, we construct a block-diagonal
representation of the linearized equations, when the spectral problem reduces
to two coupled two-by-two Dirac systems. The block-diagonalization is used in
numerical computations of eigenvalues that determine stability of gap solitons.
","[{""version"":""v1"",""created"":""Thu, 21 Apr 2005 21:05:28 GMT""}]","2009-11-11"
"math/0504443","Daniel C. Reuman","Ulrich Goertz, Thomas J. Haines, Robert E. Kottwitz, Daniel C. Reuman","Dimensions of some affine Deligne-Lusztig varieties","51 pages, 12 figures",,,,"math.AG math.GR",,"  This paper concerns the dimensions of certain affine Deligne-Lusztig
varieties, both in the affine Grassmannian and in the affine flag manifold.
Rapoport conjectured a formula for the dimensions of the varieties X_mu(b) in
the affine Grassmannian. We prove his conjecture for b in the split torus; we
find that these varieties are equidimensional; and we reduce the general
conjecture to the case of superbasic b. In the affine flag manifold, we prove a
formula that reduces the dimension question for X_x(b) with b in the split
torus to computations of dimensions of intersections of Iwahori orbits with
orbits of the unipotent radical. Calculations using this formula allow us to
verify a conjecture of Reuman in many new cases, and to make progress toward a
generalization of his conjecture.
","[{""version"":""v1"",""created"":""Fri, 22 Apr 2005 15:47:00 GMT""}]","2007-05-23"
"math/0504444","Alexander Barvinok","Alexander Barvinok","Computing the Ehrhart quasi-polynomial of a rational simplex","21 pages",,,,"math.CO math.MG",,"  We present a polynomial time algorithm to compute any fixed number of the
highest coefficients of the Ehrhart quasi-polynomial of a rational simplex.
Previously such algorithms were known for integer simplices and for rational
polytopes of a fixed dimension. The algorithm is based on the formula relating
the kth coefficient of the Ehrhart quasi-polynomial of a rational polytope to
volumes of sections of the polytope by affine lattice subspaces parallel to
k-dimensional faces of the polytope. We discuss possible extensions and open
questions.
","[{""version"":""v1"",""created"":""Thu, 21 Apr 2005 22:30:02 GMT""}]","2007-05-23"
"math/0504445","Ilya Kapovich","Ilya Kapovich and Tatiana Nagnibeda","The Patterson-Sullivan embedding and minimal volume entropy for outer
  space","An updated version","Geom. Funct. Anal. vol. 17 (2007), no. 4, pp. 1201-1236","10.1007/s00039-007-0621-z",,"math.GR math.GT",,"  Motivated by Bonahon's result for hyperbolic surfaces, we construct an
analogue of the Patterson-Sullivan-Bowen-Margulis map from the Culler-Vogtmann
outer space $CV(F_k)$ into the space of projectivized geodesic currents on a
free group. We prove that this map is a topological embedding. We also prove
that for every $k\ge 2$ the minimum of the volume entropy of the universal
covers of finite connected volume-one metric graphs with fundamental group of
rank $k$ and without degree-one vertices is equal to $(3k-3)\log 2$ and that
this minimum is realized by trivalent graphs with all edges of equal lengths,
and only by such graphs.
","[{""version"":""v1"",""created"":""Thu, 21 Apr 2005 22:54:25 GMT""},{""version"":""v2"",""created"":""Thu, 26 May 2005 19:09:41 GMT""},{""version"":""v3"",""created"":""Tue, 14 Feb 2006 09:03:21 GMT""}]","2010-05-19"
"math/0504446","Masakazu Teragaito","Mikami Hirasawa and Masakazu Teragaito","Crosscap numbers of 2-bridge knots","17 pages, 7 figures",,,,"math.GT",,"  We present a practical algorithm to determine the minimal genus of
non-orientable spanning surfaces for 2-bridge knots, called the crosscap
numbers. We will exhibit a table of crosscap numbers of 2-bridge knots up to
12crossings (all 362 of them).
","[{""version"":""v1"",""created"":""Fri, 22 Apr 2005 02:17:08 GMT""}]","2007-05-23"
"math/0504447","Justin Smith","J. Smith","On asymptotic dimension of countable abelian groups","9 pages, 1 figure, AMSTeX",,,,"math.GR math.GT",,"  We compute the asymptotic dimension of the rationals given with an invariant
proper metric. Also, we show that a countable torsion abelian group taken with
an invariant proper metric has asymptotic dimension zero.
","[{""version"":""v1"",""created"":""Fri, 22 Apr 2005 05:41:27 GMT""}]","2007-05-23"
"math/0504448","Alexander Polishchuk","Alexander Polishchuk","Lie symmetries of the Chow group of a Jacobian and the tautological
  subring","AMSLatex, 15 pages",,,,"math.AG",,"  Let $J$ be the Jacobian of a smooth projective curve. We define a natural
action of the Lie algebra of polynomial Hamiltonian vector fields on the plane,
vanishing at the origin, on the Chow group of $J$ with rational coefficients.
Using this action we obtain some relations between tautological cycles on $J$.
","[{""version"":""v1"",""created"":""Fri, 22 Apr 2005 05:53:38 GMT""},{""version"":""v2"",""created"":""Fri, 22 Apr 2005 21:53:05 GMT""},{""version"":""v3"",""created"":""Wed, 4 May 2005 17:18:35 GMT""}]","2007-05-23"
"math/0504449","Arnaud Beauville","Arnaud Beauville","Orthogonal bundles on curves and theta functions",,,,,"math.AG",,"  Let M be the moduli space of SO(r)-bundles on a curve, and L the determinant
bundle on M. We define an isomorphism of H^0(M,L) onto the dual of the space of
r-th order theta functions on the Jacobian of C. This isomorphism identifies
the map M -->|L|* defined by the linear system |L| with the map M -->|r Theta|
which associates to a quadratic bundle (E,q) the Theta divisor of the vector
bundle E . The two components M+ and M- of M are mapped into the subspaces of
even and odd theta functions respectively. Finally we discuss the analogous
question for Sp(2r)-bundles.
","[{""version"":""v1"",""created"":""Fri, 22 Apr 2005 08:46:01 GMT""}]","2007-05-23"
"math/0504450","Massimo Fonte","Alberto Bressan and Massimo Fonte","An Optimal Transportation Metric for Solutions of the Camassa-Holm
  Equation","29 pages, 3 figures",,,,"math.AP",,"  In this paper we construct a global, continuous flow of solutions to the
Camassa-Holm equation on the entire space $H^1$. Our solutions are
conservative, in the sense that the total energy $\int (u^2+u_x^2) dx$ remains
a.e. constant in time. Our new approach is based on a distance functional
$J(u,v)$, defined in terms of an optimal transportation problem, which
satisfies ${d\over dt} J(u(t), v(t))\leq \kappa\cdot J(u(t),v(t))$ for every
couple of solutions. Using this new distance functional, we can construct
arbitrary solutions as the uniform limit of multi-peakon solutions, and prove a
general uniqueness result.
","[{""version"":""v1"",""created"":""Fri, 22 Apr 2005 09:09:14 GMT""},{""version"":""v2"",""created"":""Wed, 4 May 2005 14:26:44 GMT""}]","2007-05-23"
"math/0504451","Kei Morii","Kei Morii","A Fourier restriction theorem for hypersurfaces which are graphs of
  certain real polynomials",,,,,"math.AP math.CA",,"  We will extend the Fourier restriction inequality for quadratic hypersurfaces
obtained by Strichartz. We will consider the case where the hypersurface is a
graph of a certain real polynomial which is a sum of one-dimensional monomials.
It is essential to examine the decay of a one-dimensional oscillatory
","[{""version"":""v1"",""created"":""Fri, 22 Apr 2005 10:00:34 GMT""}]","2007-05-23"
"math/0504452","Mark Veraar","Jan van Neerven and Mark Veraar","On the action of Lipschitz functions on vector-valued random sums","8 pages, to appear in Archiv der Mathematik (Basel)",,,,"math.FA math.PR",,"  Let $X$ be a Banach space and let $(\xi_j)_{j\ge 1}$ be an i.i.d. sequence of
symmetric random variables with finite moments of all orders. We prove that the
following assertions are equivalent:
  (1). There exists a constant $K$ such that $$ \Bigl(\E\Big\|\sum_{j=1}^n
\xi_j f(x_j)\Big\|^2\Bigr)^{\frac12} \leq K \n f\n_{\rm Lip}
\Bigl(\E\Big\|\sum_{j=1}^n \xi_j x_j\Big\|^2\Bigr)^{\frac12} $$ for all
Lipschitz functions $f:X\to X$ satisfying $f(0)=0$ and all finite sequences
$x_1,...,x_n$ in $X$.
  (2). $X$ is isomorphic to a Hilbert space.
","[{""version"":""v1"",""created"":""Fri, 22 Apr 2005 10:45:16 GMT""}]","2007-05-23"
"math/0504453","Cristiana Bertolin","Cristiana Bertolin","Realizations of Biextensions","This paper has been withdrawn by the author because it is a section
  of the paper ""Multilinear morphisms between 1-motives""",,,,"math.NT",,"  Let k be a field of characteristic 0 and M(k) is the category of 1-motives
over k. We prove that Biext^1(M_1,M_2;M_3)=Hom_{MR(k)}(T(M_1)\otimes T(M_2),
T(M_3))
","[{""version"":""v1"",""created"":""Fri, 22 Apr 2005 10:55:00 GMT""},{""version"":""v2"",""created"":""Thu, 22 Jul 2010 12:44:39 GMT""}]","2010-07-23"
"math/0504454","Eiji Onodera","Eiji Onodera","Bilinear estimates associated to the Schr\""odinger equation with a
  nonelliptic principal part","final version","Z. Anal. Anwendungen 27 (2008), pp.1-10",,,"math.CA math.AP",,"  We discuss bilinear estimates of tempered distributions in the Fourier
restriction spaces for the two-dimensional Sch\""odinger equation whose
principal part is the d'Alembertian. We prove that the bilinear estimates hold
if and only if the tempered distributions are functions.
","[{""version"":""v1"",""created"":""Fri, 22 Apr 2005 11:09:13 GMT""},{""version"":""v2"",""created"":""Wed, 19 Dec 2007 06:34:00 GMT""}]","2007-12-19"
"math/0504455","Julie Clutterbuck","Julie Clutterbuck","Parabolic equations with continuous initial data","Author's thesis, submitted to the Australian National University,
  2004. 117 pages",,,,"math.AP",,"  The aim of this thesis is to derive new gradient estimates for parabolic
equations. The gradient estimates found are independent of the regularity of
the initial data. This allows us to prove the existence of solutions to
problems that have non-smooth, continuous initial data. We include existence
proofs for problems with both Neumann and Dirichlet boundary data. The class of
equations studied is modelled on mean curvature flow for graphs. It includes
anisotropic mean curvature flow, and other operators that have no uniform
non-degeneracy bound. We arrive at similar estimates by three different paths:
a 'double coordinate' approach, an approach examining the intersections of a
solution and a given barrier, and a classical geometric approach.
","[{""version"":""v1"",""created"":""Fri, 22 Apr 2005 12:14:17 GMT""}]","2007-05-23"
"math/0504456","Erik Koelink","Jacob S. Christiansen and Erik Koelink","Self-adjoint difference operators and classical solutions to the
  Stieltjes--Wigert moment problem","22 pages; section 2 rewritten, to appear in Journal of Approximation
  Theory","J. Approx. Theory 140 (2006), 1-26",,,"math.CA math.FA",,"  The Stieltjes-Wigert polynomials, which correspond to an indeterminate moment
problem on the positive half-line, are eigenfunctions of a second order
q-difference operator. We consider the orthogonality measures for which the
difference operator is symmetric in the corresponding weighted $L^2$-spaces.
These measures are exactly the solutions to the q-Pearson equation.In the case
of discrete and absolutely continuous measures the difference operator is
essentially self-adjoint, and the corresponding spectral decomposition is given
explicitly. In particular, we find an orthogonal set of q-Bessel functions
complementing the Stieltjes-Wigert polynomials to an orthogonal basis for
$L^2(\mu)$ when $\mu$ is a discrete orthogonality measure solving the q-Pearson
equation. To obtain the spectral decomposition of the difference operator in
case of an absolutely continuous orthogonality measure we use the results from
the discrete case combined with direct integral techniques.
","[{""version"":""v1"",""created"":""Fri, 22 Apr 2005 12:01:54 GMT""},{""version"":""v2"",""created"":""Mon, 12 Dec 2005 07:53:47 GMT""}]","2010-11-03"
"math/0504457","Joaquim Roe","Joaquim Ro\'e","Maximal rank for planar singularities of multiplicity two","17 pages, 2 figures; minor corrections over published version
  (numerical conditions in Thm 4.3 and Cor 4.6)","J. Alg. 302 (2006), 37-54","10.1016/j.jalgebra.2005.12.014",,"math.AG","http://arxiv.org/licenses/nonexclusive-distrib/1.0/","  We prove that general unions of singularity schemes of multiplicity two in
the projective plane have maximal rank.
","[{""version"":""v1"",""created"":""Fri, 22 Apr 2005 12:08:37 GMT""},{""version"":""v2"",""created"":""Fri, 12 Jun 2009 14:50:37 GMT""}]","2009-06-12"
"math/0504458","Ulrich Bunke","Ulrich Bunke and Ingo Schroeder","Twisted K-Theory and TQFT","57 pages",,,,"math.KT math.DG",,"  The goal of the present paper is the calculation of the equivariant twisted
K-theory of a compact Lie group which acts on itself by conjugations, and
elements of a TQFT-structure on the twisted K-groups. These results are
originally due to D.S.Freed, M.J.Hopkins and C.Teleman. In this paper we redo
their calculations in the framework of topological and differentiable stacks.
We also show how moduli spaces of flat connections on surfaces give rise to
trivializations of twists.
","[{""version"":""v1"",""created"":""Fri, 22 Apr 2005 12:37:57 GMT""}]","2007-05-23"
"math/0504459","Etienne Blanchard","Etienne Blanchard","Amalgamated free products of C*-bundles","Final version To appear in the Proceedings of the Edinburgh
  Mathematical Society",,,,"math.OA",,"  Given two unital continuous C*-bundles A and B over the same Hausdorff
compact base space X, we study the continuity properties of their different
amalgamated free products over C(X).
","[{""version"":""v1"",""created"":""Fri, 22 Apr 2005 12:52:51 GMT""},{""version"":""v2"",""created"":""Sun, 24 Apr 2005 14:25:28 GMT""},{""version"":""v3"",""created"":""Mon, 11 Dec 2006 07:56:36 GMT""},{""version"":""v4"",""created"":""Thu, 22 Nov 2007 09:54:36 GMT""}]","2007-11-22"
"math/0504460","Jian Zhou","Jian Zhou","On a deformed topological vertex","33 pages",,,,"math.AG math-ph math.MP",,"  We introduce a deformed topological vertex and use it to define deformations
of the topological string partition functions of some local Calabi-Yau
geometries. We also work out some examples for which such deformations satisfy
a deformed Gopakumar-Vafa integrality and can be identified with the
equivariant indices of some naturally defined bundles on the framed moduli
spaces.
","[{""version"":""v1"",""created"":""Fri, 22 Apr 2005 12:55:47 GMT""}]","2007-05-23"
"math/0504461","Achim Sch\""adle","Achim Sch\""adle, Mar\'ia L\'opez-Fern\'andez, Christian Lubich","Fast and oblivious convolution quadrature",,"SISC Vol. 28 (2), 421-438, (2006)","10.1137/050623139",,"math.NA",,"  We give an algorithm to compute $N$ steps of a convolution quadrature
approximation to a continuous temporal convolution using only $O(N \log N)$
multiplications and $O(\log N)$ active memory. The method does not require
evaluations of the convolution kernel, but instead $O(\log N)$ evaluations of
its Laplace transform, which is assumed sectorial.
  The algorithm can be used for the stable numerical solution with
quasi-optimal complexity of linear and nonlinear integral and
integro-differential equations of convolution type. In a numerical example we
apply it to solve a subdiffusion equation with transparent boundary conditions.
","[{""version"":""v1"",""created"":""Fri, 22 Apr 2005 12:56:36 GMT""}]","2011-11-10"
"math/0504462","Jan Obloj","Jan Obloj (PMA)","A complete characterization of local martingales which are functions of
  Brownian motion and its maximum",,,,,"math.PR",,"  We prove the max-martingale conjecture given in recent article with Marc Yor.
We show that for a continuous local martingale $(N\_t:t\ge 0)$ and a function
$H:R x R\_+\to R$, $H(N\_t,\sup\_{s\leq t}N\_s)$ is a local martingale if and
only if there exists a locally integrable function $f$ such that
$H(x,y)=\int\_0^y f(s)ds-f(y)(x-y)+H(0,0)$. This implies readily, via Levy's
equivalence theorem, an analogous result with the maximum process replaced by
the local time at 0.
","[{""version"":""v1"",""created"":""Fri, 22 Apr 2005 13:17:04 GMT""}]","2007-05-23"
"math/0504463","Haisheng Li Dr.","William J. Cook, Haisheng Li, and Kailash C. Misra","A recurrence relation for characters of highest weight integrable
  modules for affine Lie algebras","A new title and a lot of changes in exposition, final version to
  appear in Communications in Contemporary Mathematics",,,,"math.QA",,"  Using certain results for the vertex operator algebras associated with affine
Lie algebras we obtain recurrence relations for the characters of integrable
highest weight irreducible modules for an affine Lie algebra. As an application
we show that in the simply-laced level 1 case, these recurrence relations give
the known characters, whose principal specializations naturally give rise to
some multisum Macdonald identities.
","[{""version"":""v1"",""created"":""Fri, 22 Apr 2005 13:49:58 GMT""},{""version"":""v2"",""created"":""Tue, 12 Dec 2006 15:19:37 GMT""}]","2007-05-23"
"math/0504464","Nicolas Petrelis","Nicolas P\'etr\'elis (LMRS)","Polymer pinning at an interface","20 pages",,,,"math.PR",,"  In this article, I study the localization transition of an hydrophobic
homopolymer in interaction with an interface between oil and water. To that aim
I consider a model in which the trajectories of a simple random walk play the
role of the possible configurations of the polymer. The chain gains an
energetic factor for every monomer it puts in the oil and receives a random
price of positive average each time it touches the origin. So a competition
arises between this two effects to know wether the chain is delocalized in the
oil or if it stays localized in the neighborhood of the interface. As usual a
critical curve divides the phase spaces in a localized and a delocalized area,
and the point of my paper is to develop a new strategy to bound this critical
curve by below. To achieve this result I take into account the fact that the
polymer can target the sites where it comes back to the origin to receive
prices as high as possible.
","[{""version"":""v1"",""created"":""Fri, 22 Apr 2005 14:26:14 GMT""}]","2016-08-16"
"math/0504465","Peter Vermeire","Peter Vermeire","Moduli of Reflexive Sheaves on Smooth Projective 3-folds","17 pages. Entire paper rewritten - discusses relationship between
  moduli spaces of reflexive rank 2 sheaves and the Hilbert scheme of curves;
  brief mention of Donaldson-Thomas invariants",,,,"math.AG",,"  We compute the expected dimension of the moduli space of torsion-free rank 2
sheaves at a point corresponding to a stable reflexive sheaf and give
conditions for the existence of a perfect tangent-obstruction complex on a
class of smooth projective threefolds; this class includes Fano and Calabi-Yau
threefolds. We also explore both local and global relationships between moduli
spaces of reflexive rank 2 sheaves and the Hilbert scheme of curves.
","[{""version"":""v1"",""created"":""Fri, 22 Apr 2005 14:35:49 GMT""},{""version"":""v2"",""created"":""Thu, 8 Sep 2005 13:30:35 GMT""},{""version"":""v3"",""created"":""Thu, 17 Aug 2006 23:48:29 GMT""}]","2007-05-23"
"math/0504466","Achim Sch\""adle","Mar\'ia L\'opez-Fern\'andez, Christian Lubich, Cesar Palencia, Achim
  Sch\""adle","Fast Runge-Kutta approximation of inhomogeneous parabolic equations",,"Numer. Math., Vol. 102, (2), 277 - 291, (2005)","10.1007/s00211-005-0624-3",,"math.NA",,"  The result after $N$ steps of an implicit Runge-Kutta time discretization of
an inhomogeneous linear parabolic differential equation is computed, up to
accuracy $\epsilon$, by solving only $$O\Big(\log N \log \frac1\epsilon \Big)
$$ linear systems of equations. We derive, analyse, and numerically illustrate
this fast algorithm.
","[{""version"":""v1"",""created"":""Fri, 22 Apr 2005 14:39:51 GMT""}]","2011-11-10"
"math/0504467","Peter Vermeire","Peter Vermeire","The Cohomology of Reflexive Sheaves on Smooth Projective 3-folds","11 pages",,,,"math.AG",,"  We study the cohomology of reflexive rank 2 sheaves on smooth projective
threefolds. Applications are given to the moduli space of reflexive sheaves.
","[{""version"":""v1"",""created"":""Fri, 22 Apr 2005 14:41:21 GMT""}]","2007-05-23"
"math/0504468","Peter Jorgensen","Peter Jorgensen","Finite Cohen-Macaulay type and smooth non-commutative schemes","14 pages",,,,"math.RA",,"  A commutative local Cohen-Macaulay ring R of finite Cohen-Macaulay type is
known to be an isolated singularity; that is, Spec(R)-m is smooth.
  This paper proves a non-commutative analogue. Namely, if A is a
(non-commutative) graded AS Cohen-Macaulay algebra which is FBN and has finite
Cohen-Macaulay type, then the non-commutative projective scheme determined by A
is smooth.
","[{""version"":""v1"",""created"":""Fri, 22 Apr 2005 15:14:51 GMT""}]","2007-05-23"
