"math/0503303","Margaret Readdy A.","Richard Ehrenborg and Margaret A. Readdy","Classification of the factorial functions of Eulerian binomial and
  Sheffer posets","23 pages. Minor revisions throughout. Most noticeable is title
  change. To appear in JCTA","Journal of Combinatorial Theory Series A 114 (2007), no 2,
  339--359","10.1016/j.jcta.2006.06.003",,"math.CO",,"  We give a complete classification of the factorial functions of Eulerian
binomial posets. The factorial function B(n) either coincides with $n!$, the
factorial function of the infinite Boolean algebra, or $2^{n-1}$, the factorial
function of the infinite butterfly poset. We also classify the factorial
functions for Eulerian Sheffer posets. An Eulerian Sheffer poset with binomial
factorial function $B(n) = n!$ has Sheffer factorial function D(n) identical to
that of the infinite Boolean algebra, the infinite Boolean algebra with two new
coatoms inserted, or the infinite cubical poset. Moreover, we are able to
classify the Sheffer factorial functions of Eulerian Sheffer posets with
binomial factorial function $B(n) = 2^{n-1}$ as the doubling of an upside down
tree with ranks 1 and 2 modified.
  When we impose the further condition that a given Eulerian binomial or
Eulerian Sheffer poset is a lattice, this forces the poset to be the infinite
Boolean algebra $B_X$ or the infinite cubical lattice $C_X^{< \infty}$. We also
include several poset constructions that have the same factorial functions as
the infinite cubical poset, demonstrating that classifying Eulerian Sheffer
posets is a difficult problem.
","[{""version"":""v1"",""created"":""Tue, 15 Mar 2005 19:17:59 GMT""},{""version"":""v2"",""created"":""Wed, 24 May 2006 20:24:13 GMT""}]","2017-05-30"
"math/0503305","Carolina Araujo","Carolina Araujo","Rationally connected varieties","19 pages, 3 figures, lecture notes from the 2004 Summer Research
  Conference on Algebraic Geometry at Snowbird",,,"A325 / 2004","math.AG",,"  This is an expository paper on rationally connected varieties. The aim is to
provide an introduction to the subject, as well as to discuss a recent result
by T. Graber, J. Harris and J. Starr. The paper is based on the talk I gave at
the 2004 Summer Research Conference on Algebraic Geometry at Snowbird.
","[{""version"":""v1"",""created"":""Tue, 15 Mar 2005 16:06:50 GMT""}]","2007-05-23"
"math/0503306","Kosta Dosen","K. Dosen and Z. Petric","Coherence for Star-Autonomous Categories","28 pages",,,,"math.CT math.LO",,"  This paper presents a coherence theorem for star-autonomous categories
exactly analogous to Kelly's and Mac Lane's coherence theorem for symmetric
monoidal closed categories. The proof of this theorem is based on a categorial
cut-elimination result, which is presented in some detail.
","[{""version"":""v1"",""created"":""Tue, 15 Mar 2005 16:52:38 GMT""},{""version"":""v2"",""created"":""Fri, 2 Dec 2005 17:19:41 GMT""}]","2007-05-23"
"math/0503307","Alain Goupil","Alain Goupil and Cedric Chauve","Combinatorial operators for Kronecker powers of representations of
  $\S_n$","9 pages",,,,"math.RT math.CO",,"  We present combinatorial operators for the expansion of the Kronecker product
of irreducible representations of the symmetric group. These combinatorial
operators are defined in the ring of symmetric functions and act on the Schur
functions basis. This leads to a combinatorial description of the Kronecker
powers of the irreducible representations indexed with the partition (n-1,1)
which specializes the concept of oscillating tableaux in Young's lattice
previously defined by S. Sundaram. We call our specialization {\it Kronecker
tableaux}. Their combinatorial analysis leads to enumerative results for the
multiplicity of any irreducible representation in the Kronecker powers of the
form ${\c^{(n-1,1)}}^{\otimes k}$.
","[{""version"":""v1"",""created"":""Tue, 15 Mar 2005 16:53:48 GMT""}]","2016-09-07"
"math/0503308","Niko Naumann","Niko Naumann","Comodule categories and the geometry of the stack of formal groups","Title changed, includes an expository section on (algebraic) stacks;
  essentially in final form, to appear in Adv. Math",,,,"math.AT math.AG",,"  We generalise recent results of M. Hovey and N. Strickland on comodule
categories for Landweber exact algebras using the formalism of algebraic
stacks.
","[{""version"":""v1"",""created"":""Tue, 15 Mar 2005 17:01:37 GMT""},{""version"":""v2"",""created"":""Wed, 14 Feb 2007 12:47:51 GMT""}]","2007-05-23"
"math/0503309","Shulamit Solomon","S. Solomon","Orthogonal linear group-subgroup pairs with the same invariants","27 pages, a part of PhD thesis",,,,"math.RT",,"  The main theorem of Galois theory states that there are no finite
group-subgroup pairs with the same invariants. On the other hand, if we
consider complex linear reductive groups instead of finite groups, the
analogous statement is no longer true: There exist counterexample
group-subgroup pairs with the same invariants. However, it's possible to
classify all these counterexamples for certain types of groups. In [16], we
provided the classification for connected complex irreducible groups, and, in
this paper, for connected complex orthogonal groups, i.e., groups that preserve
some non-degenerate quadratic form.
","[{""version"":""v1"",""created"":""Tue, 15 Mar 2005 18:40:51 GMT""}]","2007-05-23"
"math/0503310","Georgia Benkart","Georgia Benkart and Sarah Witherspoon","Quantum Group Actions, Twisting Elements, and Deformations of Algebras","revised version -- incorporates some minor changes over previous
  arXiv version",,,,"math.QA math.RA math.RT",,"  We construct twisting elements for module algebras of restricted
two-parameter quantum groups from factors of their R-matrices. We generalize
the theory of Giaquinto and Zhang to universal deformation formulas for
categories of module algebras and give examples arising from R-matrices of
two-parameter quantum groups.
","[{""version"":""v1"",""created"":""Tue, 15 Mar 2005 20:05:27 GMT""},{""version"":""v2"",""created"":""Thu, 8 Dec 2005 21:09:04 GMT""}]","2007-05-23"
"math/0503311","Eduardo D. Sontag","Eduardo D. Sontag","A Remark on Monotone I/O Systems","Related papers in http://www.math.rutgers.edu/~sontag/",,,,"math.OC",,"  This note remarks that small-gain results for a negative feedback loop around
a monotone system can be seen as consequences of results concerning an extended
monotone system.
","[{""version"":""v1"",""created"":""Tue, 15 Mar 2005 20:48:35 GMT""}]","2007-05-23"
"math/0503312","Thomas Aubriot","Thomas Aubriot (IRMA)","Classification of Galois objects of Uq(g) up to homotopy equivalence","To appear in Communications in Algebra. In French","Communication in Algebra 35, 12 (2007) 3919--3936","10.1080/00927870701509446",,"math.QA",,"  For any Drinfeld-Jimbo quantum enveloping algebra Uq(g) and for any family
$\lambda =(\lambda \_{ij})\_{1\leq i < j\leq t} \in k^{\star}$ of invertible
elements of the base field, we explicitly construct a Galois object
$A\_{\lambda}$ of Uq(g) by generators and relations and we prove that any
Galois object of Uq(g) is homotopic to a unique object of type $A\_{\lambda}$.
","[{""version"":""v1"",""created"":""Tue, 15 Mar 2005 20:55:23 GMT""},{""version"":""v2"",""created"":""Tue, 23 Aug 2005 12:25:13 GMT""},{""version"":""v3"",""created"":""Thu, 12 Oct 2006 14:18:34 GMT""}]","2008-01-10"
"math/0503313","Robert L. Foote","Ralph Alexander, I. D. Berg, Robert L. Foote","Integral-Geometric Formulas for Perimeter in S^2, H^2, and Hilbert
  Planes","26 Pages, 12 Figures. To appear in the Rocky Mountain Journal of
  Mathematics",,,,"math.DG math.MG",,"  We develop two types of integral formulas for the perimeter of a convex body
K in planar geometries. We derive Cauchy-type formulas for perimeter in planar
Hilbert geometries. Specializing to H^2 we get a formula that appears to be
new. We show that it implies the standard Cauchy-Santalo formula involving a
central angle from an origin and the distance to the corresponding support
line. The Minkowski formula for perimeter in E^2 involves polar coordinates and
the geodesic curvature of the boundary of K. We generalize this to S^2 and H^2.
In E^2 the Cauchy and Minkowski formulas are locally equivalent in the sense
that the integrands are pointwise equal. In contrast, their generalizations in
H^2 and S^2 are not locally equivalent.
","[{""version"":""v1"",""created"":""Tue, 15 Mar 2005 22:10:12 GMT""}]","2007-05-23"
"math/0503314","Lancelot F. James","Lancelot F. James","A note on exact likelihoods of the Carr-Wu models for leverage effects
  and volatility in financial economics",,,,,"math.ST math.PR q-fin.ST stat.TH",,"  Recently Carr and Wu (2004, 2005) and also Huang and Wu (2004) show that most
stochastic processes used in traditional option pricing models can be cast as
special cases of time-changed L\'evy processes. In particular these are models
which can be tailored to exhibit correlated jumps in both the log price of
assets and the instantaneous volatility. Naturally similar to a recent work of
Barndorff-Nielsen and Shephard (2001a, b), such models may be used in a
likelihood based framework. These likelihoods are based on the unobserved
integrated volatility, rather than the instantaneous volatility. James (2005)
establishes general results for the likelihood and estimation of a large class
of such models which include possible leverage effects. In this note we show
that exact expressions for likelihood models based on generalizations of Carr
and Wu (2005) and Huang and Wu (2005), follow essentially from the arguments in
Theorem 5.1 in James (2005) with some slight modification. This serves to
formally verify a claim made by James (2005).
","[{""version"":""v1"",""created"":""Wed, 16 Mar 2005 03:15:40 GMT""},{""version"":""v2"",""created"":""Wed, 16 Mar 2005 22:00:21 GMT""}]","2008-12-10"
"math/0503315","Sergei Loktev","B. Feigin, A.N. Kirillov, S. Loktev","Combinatorics and Geometry of Higher Level Weyl Modules","15 pages, LaTeX","AMS Transl., Ser. 2, 221 (2007)",,"ITEP-TH-17/05","math.QA math.CO math.RT",,"  A higher level analog of Weyl modules over multi-variable currents is
proposed. It is shown that the sum of their dual spaces form a commutative
algebra. The structure of these modules and the geometry of the projective
spectrum of this algebra is studied for the currents of dimension one and two.
Along the way we prove some particular cases of the conjectures in [FL1] and
propose a generalization of the notion of parking function representations.
","[{""version"":""v1"",""created"":""Wed, 16 Mar 2005 08:15:56 GMT""},{""version"":""v2"",""created"":""Fri, 22 Apr 2005 13:50:42 GMT""},{""version"":""v3"",""created"":""Tue, 10 Jan 2006 20:00:12 GMT""}]","2010-12-15"
"math/0503316","Dhananjay Mehendale","Dhananjay P. Mehendale","The Reconstruction of Graphs","39 pages. Typos corrected. A new Section 17 is added which offers a
  new smart proof for reconstruction conjecture",,,,"math.GM","http://arxiv.org/licenses/nonexclusive-distrib/1.0/","  In this paper we discuss reconstruction problems for graphs. We develop some
new ideas like isomorphic extension of isomorphic graphs, partitioning of
vertex sets into sets of equivalent points, subdeck property, etc. and develop
an approach to deal with reconstruction problem. We then discuss complete sets
of invariants for graphs and reconstruction conjecture. We then begin with
development of few equivalent formulations of reconstruction conjecture. In the
last section we briefly elaborate the formulation due to Harary its exact
demand and finally proceed to give a different proof of reconstruction
conjecture using reconstructibility of graph from its spanning trees and
reconstructibility of tree from its pendant point deleted deck of subtrees.
This last proof can be used to develop a systematic procedure to reconstruct
unique graph from its deck.
","[{""version"":""v1"",""created"":""Wed, 16 Mar 2005 06:14:59 GMT""},{""version"":""v2"",""created"":""Thu, 20 Oct 2011 11:38:53 GMT""}]","2011-10-21"
"math/0503317","Aleksandar Ivic","Aleksandar Ivi\'c","On exponential sums with Hecke series at central points","31 pages","Functiones et Approximatio 37(2007), 7-35",,,"math.NT",,"  Upper bound estimates for the exponential sum $$ \sum_{K<\kappa_j\le K'<2K}
\alpha_j H_j^3(1/2) \cos(\k_j\log({4{\rm e}T\over \kappa_j})) \qquad(T^\epsilon
\le K \le T^{1/2-\epsilon}) $$ are considered, where $\alpha_j =
|\rho_j(1)|^2(\cosh\pi\kappa_j)^{-1}$, and $\rho_j(1)$ is the first Fourier
coefficient of the Maass wave form corresponding to the eigenvalue $\lambda_j =
\kappa_j^2 + {1\over4}$ to which the Hecke series $H_j(s)$ is attached. The
problem is transformed to the estimation of a classical exponential sum
involving the binary additive divisor problem. The analogous exponential sums
with $H_j(\hf)$ or $H_j^2(\hf)$ replacing $H_j^3(1/2)$ are also considered. The
above sum is conjectured to be $\ll_\epsilon K^{3/2+\epsilon}$, which is proved
to be true in the mean square sense.
","[{""version"":""v1"",""created"":""Wed, 16 Mar 2005 07:30:57 GMT""},{""version"":""v2"",""created"":""Thu, 12 May 2005 14:43:28 GMT""},{""version"":""v3"",""created"":""Thu, 15 Sep 2005 10:26:15 GMT""}]","2008-11-06"
"math/0503318","Rafe Mazzeo","Eugenie Hunsicker and Rafe Mazzeo","Harmonic forms on manifolds with edges",,,,,"math.DG",,"  Let $(X,g)$ be a compact Riemannian stratified space with simple edge
singularity. Thus a neighbourhood of the singular stratum is a bundle of
truncated cones over a lower dimensional compact smooth manifold. We calculate
the various polynomially weighted de Rham cohomology spaces of $X$, as well as
the associated spaces of harmonic forms. In the unweighted case, this is
closely related to recent work of Cheeger and Dai \cite{CD}. Because the metric
$g$ is incomplete, this requires a consideration of the various choices of
ideal boundary conditions at the singular set. We also calculate the space of
$L^2$ harmonic forms for any complete edge metric on the regular part of $X$.
","[{""version"":""v1"",""created"":""Wed, 16 Mar 2005 07:39:06 GMT""}]","2007-05-23"
"math/0503319","Marie-Annick Guillemer","Dario Benedetto (UNIVERSITA Di Roma), Fran\c{c}ois Castella (IRMAR),
  Raffaele Esposito (UNIVERSITA Di L'Aquila - Italie), M. Pulvirenti
  (UNIVERSITA Di Roma)","On The Weak-Coupling Limit for Bosons and Fermions",,,,"2004-52","math.AP math-ph math.MP",,"  In this paper we consider a large system of Bosons or Fermions. We start with
an initial datum which is compatible with the Bose-Einstein, respectively
Fermi-Dirac, statistics. We let the system of interacting particles evolve in a
weak-coupling regime. We show that, in the limit, and up to the second order in
the potential, the perturbative expansion expressing the value of the
one-particle Wigner function at time $t$, agrees with the analogous expansion
for the solution to the Uehling-Uhlenbeck equation. This paper follows in
spirit the companion work [\rcite{BCEP}], where the authors investigated the
weak-coupling limit for particles obeying the Maxwell-Boltzmann statistics:
here, they proved a (much stronger) convergence result towards the solution of
the Boltzmann equation.
","[{""version"":""v1"",""created"":""Wed, 16 Mar 2005 08:59:30 GMT""}]","2007-05-23"
"math/0503320","Huaizhong Zhao","Salah-Eldin A Mohammed, Tusheng Zhang, Huaizhong Zhao","The Stable Manifold Theorem for Semilinear Stochastic Evolution
  Equations and Stochastic Partial Differential Equations I: The Stochastic
  Semiflow","65 pages, 1 figure","Memoirs of the American Mathematical Society, Vol.196 (2008), No.
  917, pp.1-105.",,,"math.PR math.DS",,"  The main objective of this work is to characterize the pathwise local
structure of solutions of semilinear stochastic evolution equations (see's) and
stochastic partial differential equations (spde's) near stationary solutions.
Such characterization is realized through the long-term behavior of the
solution field near stationary points. The analysis falls in two parts I, II.
In Part I (this paper), we prove a general existence and compactness theorem
for $C^k$-cocycles of semilinear see's and spde's. Our results cover a large
class of semilinear see's as well as certain semilinear spde's with
non-Lipschitz terms such as stochastic reaction diffusion equations and the
stochastic Burgers equation with additive infinite-dimensional noise. In Part
II of this work ([M-Z-Z]), we establish a local stable manifold theorem for
non-linear see's and spde's.
","[{""version"":""v1"",""created"":""Wed, 16 Mar 2005 09:57:04 GMT""}]","2008-09-19"
"math/0503321","Huaizhong Zhao","Salah-Eldin A. Mohammed, Tusheng Zhang, Huaizhong Zhao","The Stable Manifold Theorem for Semilinear Stochastic Evolution
  Equations and Stochastic Partial Differential Equations II: Existence of
  stable and unstable manifolds","47 pages, 3 figures","Memoirs of the American Mathematical Society, Vol.196 (2008), No.
  917, pp.1-105.",,,"math.PR math.DS",,"  This article is a sequel to [M.Z.Z.1] aimed at completing the
characterization of the pathwise local structure of solutions of semilinear
stochastic evolution equations (see's) and stochastic partial differential
equations (spde's) near stationary solutions. Stationary solution are viewed as
random points in the infinite-dimensional state space, and the characterization
is expressed in terms of the almost sure long-time behavior of trajectories of
the equation in relation to the stationary solution. More specifically, we
establish local stable manifold theorems for semilinear see's and spde's
(Theorems 4.1-4.4). These results give smooth stable and unstable manifolds in
the neighborhood of a hyperbolic stationary solution of the underlying
stochastic equation. The stable and unstable manifolds are stationary, live in
a stationary tubular neighborhood of the stationary solution and are
asymptotically invariant under the stochastic semiflow of the see/spde. The
proof uses infinite-dimensional multiplicative ergodic theory techniques and
interpolation arguments (Theorem 2.1).
","[{""version"":""v1"",""created"":""Wed, 16 Mar 2005 10:12:25 GMT""}]","2008-09-19"
"math/0503322","Jos\'e Agapito","Jos\'e Agapito","Weighted Brianchon-Gram decomposition","9 pages, 7 figures, to appear in the Canadian Mathematical Bulletin",,,,"math.CO",,"  We give in this note a weighted version of Brianchon-Gram's decomposition for
a simple polytope. This weighted version is a direct consequence of the
ordinary Brianchon-Gram formula.
","[{""version"":""v1"",""created"":""Wed, 16 Mar 2005 10:31:08 GMT""}]","2007-05-23"
"math/0503323","Ignacio de Gregorio","Ignacio de Gregorio","Deformations of functions and F-manifolds","LaTeX2e, 9 pages",,,,"math.AG",,"  We study functions on isolated singularities and prove some results of type
Milnor number = Tjurina number. We use them to endow the base space of their
miniversal deformation with the structure of F-manifold.
","[{""version"":""v1"",""created"":""Wed, 16 Mar 2005 11:40:45 GMT""}]","2007-05-23"
"math/0503324","Jan Schroer","Christof Gei{\ss}, Bernard Leclerc, Jan Schr\""oer","Rigid modules over preprojective algebras","34 pages. Final Version.To appear in Invent. Math. Minor changes","Invent. Math. 165 (2006), no. 3, 589--632","10.1007/s00222-006-0507-y",,"math.RT math.RA",,"  Let $\la$ be a preprojective algebra of simply laced Dynkin type $\Delta$. We
study maximal rigid $\la$-modules, their endomorphism algebras and a mutation
operation on these modules. This leads to a representation-theoretic
construction of the cluster algebra structure on the ring $\C[N]$ of polynomial
functions on a maximal unipotent subgroup $N$ of a complex Lie group of type
$\Delta$. As an application we obtain that all cluster monomials of $\C[N]$
belong to the dual semicanonical basis.
","[{""version"":""v1"",""created"":""Wed, 16 Mar 2005 12:46:13 GMT""},{""version"":""v2"",""created"":""Thu, 29 Sep 2005 11:50:23 GMT""},{""version"":""v3"",""created"":""Tue, 14 Feb 2006 08:52:49 GMT""}]","2019-03-05"
"math/0503325","Jan Wiegerinck","Evgeny Poletsky and Jan Wiegerinck","Graphs with multiple sheeted pluripolar hulls","12 pages",,,,"math.CV",,"  In this paper we study the pluripolar hulls of analytic sets. In particular,
we show that hulls of graphs of analytic functions can be multiple sheeted and
sheets can be separated by a set of zero dimension.
","[{""version"":""v1"",""created"":""Wed, 16 Mar 2005 13:29:37 GMT""}]","2007-05-23"
"math/0503326","Viet-Anh Nguyen","Peter Pflug and Viet-Anh Nguyen","Boundary cross theorem in dimension 1","43 pages, to appear in ""Annales Polonici Mathematici"". This is the
  revised version of our article put on Arxiv in March 2005",,,,"math.CV",,"  Let $X, Y$ be two complex manifolds of dimension 1 which are countable at
infinity, let $D\subset X,$ $ G\subset Y$ be two open sets, let $A$ (resp. $B$)
be a subset of $\partial D$ (resp. $\partial G$), and let $W$ be the 2-fold
cross $((D\cup A)\times B)\cup (A\times(B\cup G)).$ Suppose in addition that
$D$ (resp. $G$) is {\it Jordan-curve-like on $A$} (resp. $B$) and that $A$ and
$B$ are {\it of positive length}. We determine the ""envelope of holomorphy""
$\hat{W}$ of $W$ in the sense that any function locally bounded on $W,$
measurable on $A\times B,$ and separately holomorphic on $(A\times G) \cup
(D\times B)$ ""extends"" to a function holomorphic on the interior of $\hat{W}.$
","[{""version"":""v1"",""created"":""Wed, 16 Mar 2005 14:01:02 GMT""},{""version"":""v2"",""created"":""Wed, 11 Oct 2006 08:47:48 GMT""},{""version"":""v3"",""created"":""Sun, 29 Oct 2006 18:19:05 GMT""}]","2007-05-23"
"math/0503327","V\'it Jel\'inek","Vit Jelinek","Dyck paths and pattern-avoiding matchings","18 pages, 4 figures, important references added","European Journal of Combinatorics, vol. 28 (1), 202-213, 2007","10.1016/j.ejc.2005.07.013",,"math.CO",,"  How many matchings on the vertex set V={1,2,...,2n} avoid a given
configuration of three edges? Chen, Deng and Du have shown that the number of
matchings that avoid three nesting edges is equal to the number of matchings
avoiding three pairwise crossing edges. In this paper, we consider other
forbidden configurations of size three. We present a bijection between
matchings avoiding three crossing edges and matchings avoiding an edge nested
below two crossing edges. This bijection uses non-crossing pairs of Dyck paths
of length 2n as an intermediate step.
  Apart from that, we give a bijection that maps matchings avoiding two nested
edges crossed by a third edge onto the matchings avoiding all configurations
from an infinite family, which contains the configuration consisting of three
crossing edges. We use this bijection to show that for matchings of size n>3,
it is easier to avoid three crossing edges than to avoid two nested edges
crossed by a third edge.
  In this updated version of this paper, we add new references to papers that
have obtained analogous results in a different context.
","[{""version"":""v1"",""created"":""Wed, 16 Mar 2005 14:15:36 GMT""},{""version"":""v2"",""created"":""Tue, 26 Jun 2007 13:44:27 GMT""}]","2007-06-26"
"math/0503328","Luka Grubisic","Luka Grubisic","On eigenvalue and eigenvector estimates for nonnegative definite
  operators","28 pages and 1 figure",,,,"math.SP math.NA",,"  In this article we further develop a perturbation approach to the
Rayleigh--Ritz approximations from our earlier work. We both sharpen the
estimates and extend the applicability of the theory to nonnegative definite
operators . The perturbation argument enables us to solve two problems in one
go: We determine which part of the spectrum of the operator is being
approximated by the Ritz values and compute the approximation estimates. We
also present a Temple--Kato like inequality which --unlike the original
Temple--Kato inequality-- applies to any test vectors from the quadratic form
domain of the operator.
","[{""version"":""v1"",""created"":""Wed, 16 Mar 2005 14:39:34 GMT""}]","2007-05-23"
"math/0503329","Christian Meyer","Christian Meyer","The mirror quintic as a quintic","7 pages",,,,"math.AG",,"  The general quintic hypersurface in ${\mathbb P}^4$ is the most famous
example of a Calabi--Yau threefold for which mirror symmetry has been
investigated in detail. There is a description of the mirror as a hypersurface
in a certain weighted projective space. In this note we present a model for the
mirror which is again (the resolution of) a quintic hypersurface in ${\mathbb
P}^4$. We also deal with the special members in the respective families. They
lead to rigid Calabi--Yau threefolds with interesting arithmetical properties.
  In the last section we try to find a similarly nice model for the mirror of
the complete intersection of two cubics in ${\mathbb P}^5$. We also formulate a
general question about mirror models.
","[{""version"":""v1"",""created"":""Wed, 16 Mar 2005 15:42:39 GMT""}]","2007-05-23"
"math/0503330","Antoine Musitelli","Pierre de la Harpe and Antoine Musitelli","Expanding graphs, Ramanujan graphs, and 1-factor perturbations",,,,,"math.CO",,"  We construct (k+-1)-regular graphs which provide sequences of expanders by
adding or substracting appropriate 1-factors from given sequences of k-regular
graphs. We compute numerical examples in a few cases for which the given
sequences are from the work of Lubotzky, Phillips, and Sarnak (with k-1 the
order of a finite field). If k+1 = 7, our construction results in a sequence of
7-regular expanders with all spectral gaps at least about 1.52.
","[{""version"":""v1"",""created"":""Wed, 16 Mar 2005 15:35:16 GMT""}]","2007-05-23"
