"astro-ph/0503320","Matthew Hayes","M. Hayes (1), G. Ostlin (1), J.M. Mas-Hesse (2), D. Kunth (3), C.
  Leitherer (4), A. Petrosian (5) ((1) Stockholm Observatory, Sweden, (2)
  CSIC-INTA, Spain, (3) I.A.P., France, (4) STScI, USA, (5) B.A.O., Armenia)","HST/ACS Lyman alpha imaging of the nearby starburst ESO338-IG04","To appear in A&A. 15 pages, 9 images. Version with high-resolution
  images can be found at ftp://ftp.astro.su.se/matthew/papers/lya_e338.pdf
  (pdf) or ftp://ftp.astro.su.se/matthew/papers/lya_e338.ps.gz (.ps.gz)",,"10.1051/0004-6361:20052702",,"astro-ph",,"  ESO338-IG04 is a well known, local, luminous Blue Compact Galaxy. It has a
complex morphology and contains a central young starburst with compact young
star clusters. The galaxy was imaged using HST/ACS in the Lyman alpha line and
continuum. Using the Starburst99 synthetic spectra and other imaging data from
HST/WFPC2 we developed a technique that allows us to make the first
photometrically valid continuum subtraction for the LYa line. Our results are
in qualitative agreement with the models of LYa escape being regulated by
kinematical properties of the interstellar medium. The line-only image shows
LYa in both emission and absorption. Notably, emission is seen from central
bright young clusters and is in spatial agreement with the features present in
a longslit spectrum taken with HST/STIS. Diffuse LYa emission regions are seen
surrounding the central starburst where photons escape after one or more
resonant scatterings in HI. These regions dominate the total LYa output.
Photometry reveals a total LYa flux of 194 x 10^-14 erg/s/cm^2. Inside an
artificial aperture matching that of the IUE satelite, we measure a LYa flux
and equivalent width consistent with previous studies using the IUE. Analysis
of parameter dependencies show our technique to be largely parameter
independent, producing LYa maps indistinguishable from one another by eye and
with fluxes consistent with one another to better than 50%. By comparison of
LYa fluxes with Ha fluxes of a previous study, we estimate that each observed
LYa photon has undergone ~2 additional scatterings. We see that LYa line
closely correlate with other tracers of kinematics.
","[{""version"":""v1"",""created"":""Tue, 15 Mar 2005 16:46:13 GMT""}]","2009-11-10"
"astro-ph/0503321","Hasan Yuksel","Shin'ichiro Ando, John F. Beacom, Hasan Yuksel","Detection of Neutrinos from Supernovae in Nearby Galaxies","4 pages, 3 figures; revised version, accepted for publication in
  Physical Review Letters","Phys.Rev.Lett. 95 (2005) 171101","10.1103/PhysRevLett.95.171101","UTAP-521","astro-ph hep-ph nucl-th",,"  While existing detectors would see a burst of many neutrinos from a Milky Way
supernova, the supernova rate is only a few per century. As an alternative, we
propose the detection of ~ 1 neutrino per supernova from galaxies within 10
Mpc, in which there were at least 9 core-collapse supernovae since 2002. With a
future 1-Mton scale detector, this could be a faster method for measuring the
supernova neutrino spectrum, which is essential for calibrating numerical
models and predicting the redshifted diffuse spectrum from distant supernovae.
It would also allow a > 10^4 times more precise trigger time than optical data
alone for high-energy neutrinos and gravitational waves.
","[{""version"":""v1"",""created"":""Tue, 15 Mar 2005 18:56:12 GMT""},{""version"":""v2"",""created"":""Mon, 29 Aug 2005 17:56:59 GMT""}]","2009-11-10"
"astro-ph/0503322","Martin G. H. Krause","Martin Krause","Galactic Wind Shells and High Redshift Radio Galaxies On the Nature of
  Associated Absorbers","9 pages, 8 figures, accepted by A&A",,"10.1051/0004-6361:20042450",,"astro-ph",,"  A jet is simulated on the background of a galactic wind headed by a radiative
bow shock. The wind shell, which is due to the radiative bow shock, is
effectively destroyed by the impact of the jet cocoon, thanks to
Rayleigh-Taylor instabilities. Associated strong HI absorption, and possibly
also molecular emission, in high redshift radio galaxies which is observed
preferentially in the smaller ones may be explained by that model, which is an
improvement of an earlier radiative bow shock model. The model requires
temperatures of $\approx 10^6$ K in the proto-clusters hosting these objects,
and may be tested by high resolution spectroscopy of the Ly$\alpha$ line. The
simulations show that -- before destruction -- the jet cocoon fills the wind
shell entirely for a considerable time with intact absorption system.
Therefore, radio imaging of sources smaller than the critical size should
reveal the round central bubbles, if the model is correct.
","[{""version"":""v1"",""created"":""Tue, 15 Mar 2005 18:33:23 GMT""}]","2009-11-10"
"astro-ph/0503323","Chris Brook","C. B. Brook, H. Martel, B. K. Gibson, & D. Kawata","Evolving Disks in Cold Dark Matter Cosmology","Poster Presentation at ""The XXII Texas Symposium on Relativistic
  Astrophysics"", at Stanford University, Dec. 2004, (TSRA04-1402) 5 pages,
  LaTeX, 8 ps figures",,,,"astro-ph",,"  Despite having entered the era of ""precision cosmology,"" the formation of
galaxies within the favored CDM cosmological paradigm remains problematic. By
relating our N-body/smooth particle hydro-dynamical simulation to an extensive
range of Galactic and extragalactic observations, we shed light on the
formation and evolution of the Milky Way and other late type galaxies. In light
of recent observations of the stellar populations of extragalactic thick disks,
we examine the proposal that the thick disk formed in a high redshift period
characterized by gas rich merging. We show such a scenario to be consistent
with color observations. We then follow the evolution of structural parameters
of the subsequently formed disk galaxy, from redshift ~1 to the present.
Consistent with observation, little evolution in the ratio of scale-height to
scale-length is found in our simulated galaxy, despite its somewhat chaotic
origins. The simulated galaxy in this report forms part of a larger study of a
suite of galaxies, with which these issues are to be studied in detail.
","[{""version"":""v1"",""created"":""Tue, 15 Mar 2005 19:10:50 GMT""}]","2007-05-23"
"astro-ph/0503324","Schuyler D. van Dyk","S.D. Van Dyk (Spitzer Science Center/Caltech), A.V. Filippenko, R.
  Chornock, W. Li (UC Berkeley), and P. Challis (CfA)","Supernova 1954J (Variable 12) in NGC 2403 Unmasked","13 pages, 10 figures, to appear in the 2005 June PASP",,"10.1086/430238",,"astro-ph",,"  We have confirmed that the precursor star of the unusual Supernova 1954J
(also known as Variable 12) in NGC 2403 survived what appears to have been a
super-outburst, similar to the 1843 Great Eruption of eta Carinae in the
Galaxy. The apparent survivor has changed little in brightness and color over
the last eight years, and a Keck spectrum reveals characteristics broadly
similar to those of eta Car. This is further suggested by our identification of
the actual outburst-surviving star in high-resolution images obtained with the
Advanced Camera for Surveys on the Hubble Space Telescope. We reveal this
``supernova impostor'' as a highly luminous (M_V^0 ~ -8.0 mag), very massive
(M_initial >~ 25 Msun) eruptive star, now surrounded by a dusty (A_V ~ 4 mag)
nebula, similar to eta Car's famous Homunculus.
","[{""version"":""v1"",""created"":""Tue, 15 Mar 2005 19:16:22 GMT""}]","2009-11-10"
"astro-ph/0503325","George Svetlichny","George Svetlichny","Do Black Holes Produce Phantom Energy?","13 pages, LaTeX, v2 purely stylistic changes",,,,"astro-ph gr-qc",,"  We conjecture that black holes, whether accreting matter or not, can also
lose mass to phantom energy production. Such a process can be made plausible in
theories that allow for non-local connections between short and long wavelength
modes. If true, observational data should show an exchange of energy from
matter to phantom at some cosmic epoch, and we discuss a simple model. Some
remarks on an appropriate quantum gravity theory and related issues are also
presented.
","[{""version"":""v1"",""created"":""Tue, 15 Mar 2005 19:16:33 GMT""},{""version"":""v2"",""created"":""Wed, 16 Mar 2005 13:23:35 GMT""}]","2007-05-23"
"astro-ph/0503326","Martin Cohen","Martin Cohen, Anne J. Green, Mallory S.E. Roberts, Marilyn R. Meade,
  Brian Babler, Remy Indebetouw, Barbara A. Whitney, Christer Watson, Mark
  Wolfire, Mike J. Wolff, John S. Mathis, Edward B. Churchwell","G313.3+00.3: A New Planetary Nebula discovered by the Australia
  Telescope Compact Array and the Spitzer Space Telescope","18 pages, LaTeX (aastex), incl. 8 PostScript (eps) figures and 1
  table. Accepted by ApJ (Part 1)","Astrophys.J. 627 (2005) 446-453","10.1086/430251",,"astro-ph",,"  We present a new planetary nebula, first identified in images from the
Australia Telescope Compact Array, although not recognized at that time. Recent
observations with the Spitzer Space Telescope during the GLIMPSE Legacy program
have rediscovered the object. The high-resolution radio and infrared images
enable the identification of the central star or its wind, the recognition of
the radio emission as thermal, and the probable presence of polycylic aromatic
hydrocarbons in and around the source. These lead to the conclusion that
G313.3+00.3 is a planetary nebula. This object is of particular interest
because it was discovered solely through radio and mid-infrared imaging,
without any optical (or near-infrared) confirmation, and acts as a proof of
concept for the discovery of many more highly extinguished planetary nebulae.
G313.3+00.3 is well-resolved by both the instruments with which it was
identified, and suffers extreme reddening due to its location in the
Scutum-Crux spiral arm.
","[{""version"":""v1"",""created"":""Tue, 15 Mar 2005 20:49:57 GMT""}]","2009-11-10"
"astro-ph/0503327","Christopher Davis","C.J. Davis, M.D. Smith, T.M. Gledhill, W.P. Varricatt","Near-Infrared echelle spectroscopy of Proto-Planetary Nebulae: probing
  the fast wind in H2","17 pages, 13 figures","Mon.Not.Roy.Astron.Soc. 360 (2005) 104-118","10.1111/j.1365-2966.2005.09018.x",,"astro-ph",,"  Echelle spectroscopy of H2, [FeII] and Br-gamma line emission from a very
young planetary nebula, IRAS 21282+5050, and from four proto-planetary nebulae,
IRAS 19343+2926 (M 1-92), IRAS 17150-3224 (AFGL 6815), IRAS 17423-1755 (Hen
3-1475), and IRAS 17441-2411 is presented. H2 line emission is detected in
discrete shock fronts in the lobes of each nebula, regardless of source
spectral type. In IRAS 17150-3224 we also uncover possible signs of rotation,
as would be expected if the H2 features were excited in a magneto-centrifugal
disk wind. [FeII] emission was detected in only one source, M 1-92. The H2 and
[FeII] observations of M 1-92, and the complex H2 profiles in IRAS 21282+5050,
are explained using the shock models of Smith and collaborators. J-type bow
models are adequate in each case, i.e. a strongly-magnetised wind is not
required. Finally, Br-gamma is detected in each of the five targets; in
absorption in the G-type PPN though in emission in the O and B-type sources.
Br-gamma emission is detected predominantly toward the near-IR continuum peak
in each PPN. Low peak velocities, though very broad profile widths, are
measured in each target. The emission must therefore derive from ionised
regions in a fast wind very close to the central star, or, in the late-type
sources, from absorption in an equatorial torus.
","[{""version"":""v1"",""created"":""Tue, 15 Mar 2005 21:49:36 GMT""}]","2009-11-10"
"astro-ph/0503328","Tina Kahniashvili","Tina Kahniashvili, Eckhard von Toerne, Natalia A. Arhipova, and Bharat
  Ratra","Neutrino Mass Limit from Galaxy Cluster Number Density Evolution","6 pages, 2 figures and references added, accepted for publication in
  Phys. Rev. D","Phys.Rev. D71 (2005) 125009","10.1103/PhysRevD.71.125009",,"astro-ph hep-ex hep-ph",,"  Measurements of the evolution with redshift of the number density of massive
galaxy clusters are used to constrain the energy density of massive neutrinos
and so the sum of neutrino masses $\sum m_\nu$. We consider a spatially-flat
cosmological model with cosmological constant, cold dark matter, baryonic
matter, and massive neutrinos. Accounting for the uncertainties in the
measurements of the relevant cosmological parameters we obtain a limit of $\sum
m_\nu$ $<$ 2.4 eV (95 % C.L.).
","[{""version"":""v1"",""created"":""Tue, 15 Mar 2005 22:48:13 GMT""},{""version"":""v2"",""created"":""Mon, 30 May 2005 16:36:19 GMT""}]","2009-11-10"
"astro-ph/0503330","Brian O'Shea","Brian W. O'Shea, Tom Abel, Dan Whalen, Michael L. Norman","Forming a Primordial Star in a Relic HII Region","4 pages, 2 figures. Some revisions, including enhanced discussion of
  angular momentum issues. Asrophysical Journal, accepted","Astrophys.J. 628 (2005) L5-L8","10.1086/432683","LA-UR-05-0898","astro-ph",,"  There has been considerable theoretical debate over whether photoionization
and supernova feedback from the first Population III stars facilitate or
suppress the formation of the next generation of stars. We present results from
an Eulerian adaptive mesh refinement simulation demonstrating the formation of
a primordial star within a region ionized by an earlier nearby star. Despite
the higher temperatures of the ionized gas and its flow out of the dark matter
potential wells, this second star formed within 23 million years of its
neighbor's death. The enhanced electron fraction within the HII region
catalyzes rapid molecular hydrogen formation that leads to faster cooling in
the subsequent star forming halos than in the first halos. This ""second
generation"" primordial protostar has a much lower accretion rate because,
unlike the first protostar, it forms in a rotationally supported disk of
approx. 10-100 solar masses. This is primarily due to the much higher angular
momentum of the halo in which the second star forms. In contrast to previously
published scenarios, such configurations may allow binaries or multiple systems
of lower mass stars to form. These first high resolution calculations offer
insight into the impact of feedback upon subsequent populations of stars and
clearly demonstrate how primordial chemistry promotes the formation of
subsequent generations of stars even in the presence of the entropy injected by
the first stars into the IGM.
","[{""version"":""v1"",""created"":""Tue, 15 Mar 2005 23:32:48 GMT""},{""version"":""v2"",""created"":""Mon, 13 Jun 2005 16:01:58 GMT""}]","2009-11-10"
"astro-ph/0503331","Roger W. Romani","Roger W. Romani, Oleg Kargaltsev, George G. Pavlov","The Vela Pulsar in the Ultraviolet","14 pages, 7 figures, to appear in the Astrophysical Journal","Astrophys.J. 627 (2005) 383-389","10.1086/430269",,"astro-ph",,"  We describe time-tagged observations of the Vela pulsar (PSR B0833-45) with
the HST STIS MAMA-UV detectors. Using an optimal extraction technique, we
obtain a NUV light curve and crude FUV phase-resolved spectra. The pulse is
dominated by complex non-thermal emission at all phases. We obtain approximate
spectral indices for the brightest pulse components, relate these to pulsations
observed in other wavebands, and constrain the thermal surface emission from
the neutron star. An upper limit on the Rayleigh-Jeans component at UV pulse
minimum suggests a rather low mean surface temperature T_eff^\infty <4.6 x 10^5
(d_{300}/R_{14.2})^2 K. If confirmed by improved phase-resolved spectroscopy,
this observation has significant impact on our understanding of neutron star
interiors.
","[{""version"":""v1"",""created"":""Tue, 15 Mar 2005 23:42:14 GMT""}]","2009-11-10"
"astro-ph/0503332","Troels Haugb{\o}lle","T. Haugboelle, C. B. Hededal, J. T. Frederiksen, A. Nordlund","Collisionless Plasma Shocks. Field Generation and Particle Acceleration","To appear in Proceedings of the 22nd Texas Symposium on Relativistic
  Astrophysics, Stanford University, December 2004 (TSRA04) 3 pages, 3 figures",,,,"astro-ph",,"  Gamma ray bursts are among the most energetic events in the known universe. A
highly relativistic fireball is ejected. In most cases the burst itself is
followed by an afterglow, emitted under deceleration as the fireball plunges
through the circum-stellar media. To interpret the observations of the
afterglow emission, two physical aspects need to be understood: 1) The origin
and nature of the magnetic field in the fireball and 2) the particle velocity
distribution function behind the shock. Both are necessary in existing
afterglow models to account for what is believed to be synchrotron radiation.
To answer these questions, we need to understand the microphysics at play in
collisionless shocks. Using 3D particle-in-cell simulations we can gain insight
in the microphysical processes that take place in such shocks. We discuss the
results of such computer experiments. It is shown how a Weibel-like two-stream
plasma instability is able to create a strong transverse intermittent magnetic
field and points to a connected mechanism for in situ particle acceleration in
the shock region.
","[{""version"":""v1"",""created"":""Wed, 16 Mar 2005 15:57:03 GMT""}]","2007-05-23"
"astro-ph/0503333","Luis F. Rodriguez","L. F. Rodriguez, G. Garay, K. J. Brooks, D. Mardones","High Angular Resolution Observations of the Collimated Jet Source
  Associated with a Massive Protostar in IRAS 16547-4247","9 pages, 2 figures","Astrophys.J. 626 (2005) 953-958","10.1086/430268",,"astro-ph",,"  A triple radio source recently detected in association with the luminous
infrared source IRAS 16547-4247 has been studied with high angular resolution
and high sensitivity with the Very Large Array at 3.6 and 2 cm. Our
observations confirm the interpretation that the central object is a thermal
radio jet, while the two outer lobes are most probably heavily obscured HH
objects. The thermal radio jet is resolved angularly for the first time and
found to align closely with the outer lobes. The opening angle of the thermal
jet is estimated to be $\sim 25^\circ$, confirming that collimated outflows can
also be present in massive protostars. The proper motions of the outer lobes
should be measurable over timescales of a few years. Several fainter sources
detected in the region are most probably associated with other stars in a young
cluster.
","[{""version"":""v1"",""created"":""Wed, 16 Mar 2005 00:15:21 GMT""}]","2009-11-10"
"astro-ph/0503334","Dr. Michael A. Nowak","Michael Nowak, Joern Wilms, Sebastian Heinz, Guy Pooley, Katja
  Pottschmidt, Stephane Corbel","Is the `IR Coincidence' Just That?","To Appear in the July 2005 Astrophysical Journal; 9 Pages, uses
  emulateapj.sty","Astrophys.J. 626 (2005) 1006-1014","10.1086/430137",,"astro-ph",,"  (Abridged) Motch (1985) suggested that in the hard state of GX 339-4 the soft
X-ray power-law extrapolated backward in energy agrees with the IR flux. Corbel
& Fender (2002) showed that the hard state radio power-law extrapolated forward
in energy meets the extrapolated X-ray power-law at an IR break, which was
explicitly observed twice in GX 339-4. This `IR coincidence' has been cited as
further evidence that a jet might make a significant contribution to the X-rays
in hard state systems. We explore this hypothesis with a series of simultaneous
radio/X-ray observations of GX 339-4, taken during its 1997, 1999, and 2002
hard states. We fit these spectra, in detector space, with a simple, but
remarkably successful, doubly broken power-law that requires an IR spectral
break. For these observations, the break position and the integrated radio/IR
flux have stronger dependences upon the X-rays than the simplest jet
predictions. If one allows for a softening of the X-ray power law with
increasing flux, then the jet model agrees with the correlation. We also find
evidence that the radio/X-ray fcorrelation previously observed in GX 339-4
shows a `parallel track' for the 2002 hard state. The slope of the 2002
correlation is consistent with prior observations; however, the radio amplitude
is reduced. We then examine the correlation in Cyg X-1 through the use of radio
data, obtained with the Ryle radio telescope, and RXTE data, from the ASM and
pointed observations. We again find evidence of `parallel tracks', and here
they are associated with `failed transitions' to the soft state. We also find
that for Cyg X-1 the radio flux is more fundamentally correlated with the hard
X-ray flux.
","[{""version"":""v1"",""created"":""Wed, 16 Mar 2005 02:40:09 GMT""}]","2009-11-10"
"astro-ph/0503335","Katsuaki Asano","Katsuaki Asano, Ryo Yamazaki, and Naoshi Sugiyama","Possibility of Ultra High-Energy Cosmic Rays from the Giant Flare in SGR
  1806-20","8 pages, 2figures","Publ.Astron.Soc.Jap. 58 (2006) L7-L10","10.1093/pasj/58.1.L7",,"astro-ph",,"  On 2004 December 27, a giant flare from the soft gamma repeater 1806$-$20 was
observed. The radiation mechanism of the initial peak of the flare would be
controversial. In this letter we point out that very high-energy cosmic rays
would be produced in the case that the flare was caused by internal shocks, as
is usually considered for gamma-ray bursts. The highest energy of cosmic rays
can reach $10^{19}$ eV, if the Lorentz factor of the shocks is sufficiently
high. Future observations of cosmic rays will inform us about the mechanism of
the giant flare.
","[{""version"":""v1"",""created"":""Wed, 16 Mar 2005 04:02:41 GMT""},{""version"":""v2"",""created"":""Thu, 17 Mar 2005 02:45:35 GMT""},{""version"":""v3"",""created"":""Tue, 24 May 2005 03:52:58 GMT""},{""version"":""v4"",""created"":""Tue, 10 Jan 2006 04:41:03 GMT""}]","2015-06-24"
"astro-ph/0503336","Sergio Mendoza","M.Huarte Espinosa, S. Mendoza","Hydrodynamical scaling laws for astrophysical jets","3 pages. To be published in the proceedings of the ""XXII Texas
  Symposium on Relativistic Astrophysics""",,,,"astro-ph",,"  The idea of a unified model for all astrophysical jets has been considered
for some time now. We present here some hydrodynamical scaling laws relevant
for all type of astrophysical jets, analogous to those of Sams et al. (1996).
We use Buckingham's Pi theorem of dimensional analysis to obtain a family of
dimensional relations among the physical quantities associated with the jets.
","[{""version"":""v1"",""created"":""Wed, 16 Mar 2005 05:48:26 GMT""}]","2007-05-23"
"astro-ph/0503337","W. J. de Wit","W.J. de Wit (LAOG, Arcetri), L. Testi (Arcetri), F. Palla (Arcetri),
  H. Zinnecker (AIP)","The Origin of Massive O-type Field Stars. Part II: Field O stars as
  runaways","9 pages, 4 figures. Accepted for publication in A&A","Astron.Astrophys. 425 (2004) 937-948","10.1051/0004-6361:20042489",,"astro-ph",,"  In two papers we try to confirm that all Galactic high-mass stars are formed
in a cluster environment, by excluding that O-type stars found in the Galactic
field actually formed there. In de Wit et al. (2004) we presented deep K-band
imaging of 5 arcmin fields centred on 43 massive O-type field stars that
revealed that the large majority of these objects are single objects. In this
contribution we explore the possibility that the field O stars are dynamically
ejected from young clusters, by investigating their peculiar space velocity
distribution, their distance from the Galactic plane, and their spatial
vicinity to known young stellar clusters. We (re-)identify 22 field O-type
stars as candidate runaway OB-stars. The statistics show that ~4% of all O-type
stars with V < 8 can be considered as formed outside a cluster environment.
Most are spectroscopically single objects, some are visual binaries. The
derived percentage for O-type stars that form isolated in the field based on
our statistical analyses is in agreement with what is expected from
calculations adopting a universal cluster richness distribution with power
index of beta = 1.7, assuming that the cluster richness distribution is
continuous down to the smallest clusters containing one single star.
","[{""version"":""v1"",""created"":""Wed, 16 Mar 2005 09:01:19 GMT""}]","2009-11-10"
"astro-ph/0503338","Yun-Ming Dong","Yun-Ming Dong, Yi-Ping Qin","Distributions of the Hardness Ratio of short and Long Gamma-Ray Bursts
  in Different Time Intervals within the First 2 Seconds","Accepted for publication in MNRAS, 11 pages, 5 figures","Mon.Not.Roy.Astron.Soc.358:1267-1272,2005","10.1111/j.1365-2966.2005.08746.x/abs/",,"astro-ph",,"  In the present paper, we investigated the distribution of hardness ratio (HR)
for short and long gamma-ray bursts (GRBs) in different time scales for the
first two seconds. After including and subtracting the background count, we
performed a Kolmogorov--Smirnov (K-S) test to the HR distributions of the two
classes of GRBs in each time interval. Our analysis shows that the
probabilities of the KS test to the distributions are very small, suggesting
that the two classes of bursts are unlikely to arise from the same HR
distributions, and indicating that they probably originate from the different
physical processes and central engine. In addition, we found that the hardness
ratio of short bursts within the time interval of 0$-$0.96 seconds changes
hard-to-soft, on the other hand long bursts do not. The two kinds of bursts
have different characteristics in the first 2 seconds which might be associated
with different physical mechanisms.
","[{""version"":""v1"",""created"":""Wed, 16 Mar 2005 09:53:14 GMT""}]","2008-11-26"
