"hep-ph/0503149","Seung-Il Nam","Seung-Il Nam (RCNP, Osaka University, Japan and Department of Physics
  & NuRI, Pusan National University, Republic of Korea), Atsushi Hosaka (RCNP,
  Osaka University, Japan) and Hyun-Chul Kim (Department of Physics & NuRI,
  Pusan National University, Republic of Korea)","Lambda(1520,3/2^-) photoproduction reaction via gamma N -> K
  Lambda(1520)","16 pages, 31 figures","Phys.Rev.D71:114012,2005","10.1103/PhysRevD.71.114012","PNU-NTG-6/2005","hep-ph",,"  We investigate Lambda(1520,3/2^-,D_03) photoproduction via the gamma N -> K
Lambda^* reaction process. Using effective Lagrangians, we compute the total
and differential cross sections as well as the dependence on the momentum
transfer for the photoproduction at the tree-level. We employ two different
form factors: The four-dimensional gauge-invariant type and the three
dimensional one depending on the external momenta. We find that the total cross
sections for the proton target are well reproduced as compared with the
experimental data. It turns out that the total cross sections for the neutron
target are significantly smaller than those for the proton target. We also
compare the present results with the gamma N -> bar{K} Theta^+ reaction in
order to extract information of Theta^+. Finally the role of K^*--exchange in
the production reaction is discussed.
","[{""version"":""v1"",""created"":""Wed, 16 Mar 2005 02:12:54 GMT""},{""version"":""v2"",""created"":""Thu, 7 Jul 2005 07:34:29 GMT""}]","2009-12-17"
"hep-ph/0503150","Yoshihiko Kondo","Yoshihiko Kondo, Osamu Morimatsu and Tetsuo Nishikawa","Coupled QCD sum rules for positive and negative-parity nucleons","14pages, 2figures","Nucl.Phys. A764 (2006) 303-312","10.1016/j.nuclphysa.2005.09.003","KEK-TH-1010","hep-ph",,"  A new approach of the QCD sum rule is proposed in which positive and
negative-parity baryons couple with each other. With positive and
negative-parity states explicitly taken into account, sum rules are derived by
means of the dispersion relation in energy. The method is applied to the
nucleon channel and the parity splitting of the nucleon resonance states is
studied. It is found that the obtained sum rules have a very good Borel
stability. This suggests that the ansatz for the spectral function in the
present sum rule approximates the physical spectrum better than the usual
lowest pole plus continuum ansatz. The predicted masses of the positive and
negative nucleons reproduce the experimental ones fairly well. Especially, the
mass difference is extremely close to the experimental value.
","[{""version"":""v1"",""created"":""Wed, 16 Mar 2005 09:08:06 GMT""},{""version"":""v2"",""created"":""Wed, 23 Mar 2005 05:18:11 GMT""},{""version"":""v3"",""created"":""Fri, 1 Apr 2005 08:20:51 GMT""}]","2009-11-11"
"hep-ph/0503151","Guy Raz","Gerhard Buchalla, Gudrun Hiller, Yosef Nir, Guy Raz","The Pattern of CP Asymmetries in $b\to s$ Transitions","20 pages, 3 figures, 6 tables. v3: Discussion of higher order
  corrections extended; Version appearing in JHEP","JHEP 0509:074,2005","10.1088/1126-6708/2005/09/074",,"hep-ph",,"  New CP violating physics in $b\to s$ transitions will modify the CP
asymmetries in B decays into final CP eigenstates ($\phi K_S$, $\eta^\prime
K_S$, $\pi^0 K_S$, $\omega K_S$, $\rho^0 K_S$ and $\eta K_S$) from their
Standard Model values. In a model independent analysis, the pattern of
deviations can be used to probe which Wilson coefficients get a significant
contribution from the new physics. We demonstrate this idea using several
well-motivated models of new physics, and apply it to current data.
","[{""version"":""v1"",""created"":""Wed, 16 Mar 2005 09:38:32 GMT""},{""version"":""v2"",""created"":""Tue, 10 May 2005 19:43:13 GMT""},{""version"":""v3"",""created"":""Thu, 6 Oct 2005 09:24:58 GMT""}]","2009-11-11"
"hep-ph/0503152","Stefano Moretti Dr","S. Moretti, M.R. Nolten and D.A. Ross (Southampton University)","Weak corrections and high $E_T$ jets at Tevatron","4 pages, 4 figures, no significant changes from v2, version to appear
  in PRD","Phys.Rev.D74:097301,2006","10.1103/PhysRevD.74.097301","SHEP-05-06","hep-ph",,"  We calculate one-loop (purely) Weak (W) corrections of ${\cal
O}(\alpha_{\mathrm{S}}^2\alpha_{\mathrm{W}})$ to the partonic cross section of
two jets at Tevatron and prove that they can be larger than the tree-level
${\cal O}(\alpha_{\mathrm{S}}\alpha_{\mathrm{EW}})$ and ${\cal
O}(\alpha_{\mathrm{EW}}^2)$ Electro-Weak (EW) ones. At high transverse energy
of the jets, all such corrections may lead to detectable effects of, e.g., -10%
or so, with respect to the leading-order (LO) QCD term of ${\cal
O}(\alpha_{\mathrm{S}}^2)$, for the highest value so far probed by Run 2,
depending on the factorisation/renormalisation scale. Besides, they increase
significantly with jet transverse energy. Hence, our results show that EW
corrections may be needed to fit the Standard Model (SM) to present and future
Tevatron jet data.
","[{""version"":""v1"",""created"":""Wed, 16 Mar 2005 11:39:42 GMT""},{""version"":""v2"",""created"":""Mon, 19 Jun 2006 16:09:16 GMT""},{""version"":""v3"",""created"":""Tue, 17 Oct 2006 17:02:04 GMT""}]","2008-11-26"
"hep-ph/0503153","Arnd Brandenburg","A. Brandenburg, Z.G. Si","Top quark pair production and decay at a polarized photon collider","12 pages, 6 figures, some references added","Phys.Lett. B615 (2005) 68-78","10.1016/j.physletb.2005.04.003","DESY 05-043, SDU-HEP200501","hep-ph",,"  Top quark pair production by (polarized) gamma gamma collisions offers an
interesting testing ground of the Standard Model and its extensions. In this
Letter we present results for differential cross sections of top quark pair
production and decay including QCD radiative corrections. We take into account
the full dependence on the top quark spins. We give analytic and numerical
results for single and double differential angular distributions of t tbar
decay products which are due to top quark polarizations and spin correlations
in the intermediate state.
","[{""version"":""v1"",""created"":""Wed, 16 Mar 2005 12:31:39 GMT""},{""version"":""v2"",""created"":""Fri, 18 Mar 2005 13:43:10 GMT""},{""version"":""v3"",""created"":""Sat, 2 Apr 2005 11:02:32 GMT""}]","2009-11-11"
"hep-ph/0503154","Markus H. Thoma","Markus H. Thoma","Erratum ""The Quark-Gluon-Plasma Liquid""","Erratum for J. Phys. G 31 (2005) L7 (hep-ph/0409213)","J.Phys.G31:L7,2005; Erratum-ibid.G31:539,2005","10.1088/0954-3899/31/1/L02 10.1088/0594-3899/31/5/c01",,"hep-ph nucl-th physics.plasm-ph",,"  An error in the calculation of the Coulomb coupling parameter of the
quark-gluon plasma is corrected.
","[{""version"":""v1"",""created"":""Wed, 16 Mar 2005 13:43:37 GMT""}]","2010-11-26"
"hep-ph/0503155","Michael Lublinsky","Alex Kovner and Michael Lublinsky","Dense-Dilute Duality at work: dipoles of the target","18 pages, Explanations added. Version to appear in PRD","Phys.Rev. D72 (2005) 074023","10.1103/PhysRevD.72.074023",,"hep-ph",,"  We explore the properties of the QCD high energy evolution in the limit of a
dilute target. Using the recently established property of selfduality of the
evolution operator (hep-ph/0502119), we show how to properly define the target
gluon and dipole creation operators in terms of dual Wilson lines (dual eikonal
factors). We explain how to expand these operators in terms of the functional
derivatives of the color charge density, in the situation when they act on the
eikonal factors of the projectile partons. We explicitly calculate the
expansion of the high energy evolution operator to fourth order in the
functional derivatives. Our result is infrared and ultraviolet finite, but does
not coincide with the formula given in hep-ph/0501088. We resolve this
discrepancy by showing that the identification of the dipole creation and
annihilation operators used in hep-ph/0501088 is incomplete, and provide the
required corrections to these definitions. The use of the corrected operators
in the calculational framework of hep-ph/0501088 reproduces our result. We also
prove that there is no discrepancy between the expansion of the JIMWLK equation
and the dualization of the expansion of the weak field limit.
","[{""version"":""v1"",""created"":""Wed, 16 Mar 2005 14:56:24 GMT""},{""version"":""v2"",""created"":""Wed, 28 Sep 2005 01:40:38 GMT""}]","2009-11-11"
"hep-ph/0503156","Benoit Vanderheyden","Benoit Vanderheyden and A. D. Jackson","Temperature dependence in random matrix models with pairing condensates","8 pages, revtex4. v2: typos corrected in references","Phys.Rev. D72 (2005) 016003","10.1103/PhysRevD.72.016003",,"hep-ph",,"  We address a number of issues raised by a manuscript of Klein, Toublan, and
Verbaarschot (hep-ph/0405180) in which the authors introduce a random matrix
model for QCD with two colors, two flavors, and fermions in the fundamental
representation. Their inclusion of temperature terms differs from the approach
adopted in previous work on this problem (Phys. Rev. D 64, 074016 (2001).) We
demonstrate that the two approaches are related by a transformation that leaves
the thermodynamic potential invariant and which therefore has no effect on
physical observables.
","[{""version"":""v1"",""created"":""Wed, 16 Mar 2005 15:56:06 GMT""},{""version"":""v2"",""created"":""Mon, 21 Mar 2005 12:15:04 GMT""}]","2009-11-11"
"hep-th/0503119","Niels Nielsen K.","P.M.Glerfoss, J.Hylsberg, N.K.Nielsen","Instanton constraints in supersymmetric gauge theories I. Supersymmetric
  QCD","28 pages",,,,"hep-th",,"  A previous analysis of possible constraints of Yang-Mills instantons in the
presence of spontaneous symmetry breaking is extended to supersymmetric QCD. It
is again found that a constraint is necessary for the gauge field in second and
fourth order of the gauge breaking parameter v. While the supersymmetric zero
mode is well behaved to all orders, the lifted superconformal and quark zero
modes show nonpermissible behaviour, but only at first order in v.
","[{""version"":""v1"",""created"":""Tue, 15 Mar 2005 16:29:43 GMT""}]","2007-05-23"
"hep-th/0503120","Niels Nielsen K.","N.K. Nielsen","Instanton constraints in supersymmetric gauge theories II. N=2
  Yang-Mills theory","27 pages",,,,"hep-th",,"  The analysis in previous publications of the instanton constraints required
to produce a finite action of the theory is carried out also for N=2
supersymmetric Yang-Mills theory.
","[{""version"":""v1"",""created"":""Tue, 15 Mar 2005 16:32:34 GMT""}]","2007-05-23"
"hep-th/0503122","Gianguido Dall'Agata","Gianguido Dall'Agata, Riccardo D'Auria and Sergio Ferrara","Compactifications on twisted tori with fluxes and free differential
  algebras","Latex, 9 pages. v2: section 5 expanded, typos corrected","Phys.Lett. B619 (2005) 149-154","10.1016/j.physletb.2005.04.005","CERN-TH/2005-046","hep-th",,"  We describe free differential algebras for non-abelian one and two form gauge
potentials in four dimensions deriving the integrability conditions for the
corresponding curvatures. We show that a realization of these algebras occurs
in M-theory compactifications on twisted tori with constant four-form flux, due
to the presence of antisymmetric tensor fields in the reduced theory.
","[{""version"":""v1"",""created"":""Tue, 15 Mar 2005 18:09:20 GMT""},{""version"":""v2"",""created"":""Thu, 17 Mar 2005 18:19:28 GMT""}]","2010-04-05"
"hep-th/0503123","Ricardo Schiappa","Ricardo Schiappa and Niclas Wyllard","D-Brane Boundary States in the Pure Spinor Superstring","42 pages","JHEP 0507 (2005) 070","10.1088/1126-6708/2005/07/070","CERN-PH-TH/2005-039","hep-th",,"  We study the construction of D-brane boundary states in the pure spinor
formalism for the quantisation of the superstring. This is achieved both via a
direct analysis of the definition of D-brane boundary states in the pure spinor
conformal field theory, as well as via comparison between standard RNS and pure
spinor descriptions of the superstring. Regarding the map between RNS and pure
spinor formulations of the superstring, we shed new light on the tree level
zero mode saturation rule. Within the pure spinor formalism we propose an
explicit expression for the D-brane boundary state in a flat spacetime
background. While the non-zero mode sector mostly follows from a simple
understanding of the pure spinor conformal field theory, the zero mode sector
requires a deeper analysis which is one of the main points in this work. With
the construction of the boundary states at hand, we give a prescription for
calculating scattering amplitudes in the presence of a D-brane. Finally, we
also briefly discuss the coupling to the world-volume gauge field and show that
the D-brane low-energy effective action is correctly reproduced.
","[{""version"":""v1"",""created"":""Tue, 15 Mar 2005 20:45:43 GMT""}]","2009-11-11"
"hep-th/0503124","Frederik Denef","Frederik Denef, Michael R. Douglas, Bogdan Florea, Antonella Grassi,
  Shamit Kachru","Fixing All Moduli in a Simple F-Theory Compactification","68 pages, 19 figures; v2: references added","Adv.Theor.Math.Phys.9:861-929,2005",,,"hep-th",,"  We discuss a simple example of an F-theory compactification on a Calabi-Yau
fourfold where background fluxes, together with nonperturbative effects from
Euclidean D3 instantons and gauge dynamics on D7 branes, allow us to fix all
closed and open string moduli. We explicitly check that the known higher order
corrections to the potential, which we neglect in our leading approximation,
only shift the results by a small amount. In our exploration of the model, we
encounter interesting new phenomena, including examples of transitions where D7
branes absorb O3 planes, while changing topology to preserve the net D3 charge.
","[{""version"":""v1"",""created"":""Tue, 15 Mar 2005 20:24:17 GMT""},{""version"":""v2"",""created"":""Wed, 11 May 2005 21:32:10 GMT""}]","2008-11-26"
"hep-th/0503127","Bernard Piette","V.B. Kopeliovich, B. Piette and W.J. Zakrzewski","Mass terms in the Skyrme Model","28 pages, 5 figures, 6 tables","Phys.Rev. D73 (2006) 014006","10.1103/PhysRevD.73.014006",,"hep-th",,"  We consider various forms of the mass term that can be used in the Skyrme
model and their implications on the properties of baryonic states. We show
that, with an appropriate choice for the mass term, without changing the
asymptotic behaviour of the profile functions at large $r$, we can considerably
reduce or increase the mass term's contribution to the classical mass of the
solitons. We find that multibaryon configurations can be classically bound at
large baryon numbers for some choices of this mass term.
","[{""version"":""v1"",""created"":""Wed, 16 Mar 2005 08:18:58 GMT""}]","2009-11-11"
"hep-th/0503129","Klaus Behrndt","Klaus Behrndt","Stabilization of moduli by fluxes","22 pages, added refs., to appear in proceedings of: ``Strings and
  Cosmology'', (Texas A&M University, March 2004) and the RTN workshop: ``The
  quantum structure of space-time and ...'' (Kolymbari, Crete, September 2004)","AIP Conf.Proc. 743 (2005) 251-268; Fortsch.Phys. 53 (2005) 861-865","10.1002/prop.200410208",,"hep-th",,"  In order to lift the continuous moduli space of string vacua, non-trivial
fluxes may be the essential input. In this talk I summarize aspects of two
approaches to compactifications in the presence of fluxes: (i) generalized
Scherk-Schwarz reductions and gauged supergravity and (ii) the description of
flux-deformed geometries in terms of G-structures and intrinsic torsion.
","[{""version"":""v1"",""created"":""Wed, 16 Mar 2005 14:19:52 GMT""},{""version"":""v2"",""created"":""Tue, 29 Mar 2005 11:01:53 GMT""}]","2009-11-11"
"hep-th/0503130","Christian Korff","Christian Korff","A Q-Operator Identity for the Correlation Functions of the Infinite XXZ
  Spin-Chain","19 pages, conclusions added","J.Phys.A38:6641-6658,2005","10.1088/0305-4470/38/30/002",,"hep-th cond-mat.stat-mech math-ph math.MP",,"  An explicit construction for Q-operators of the finite XXZ spin-chain with
twisted boundary conditions is presented. The massless and the massive regime
is considered as well as the root of unity case. It is explained how these
results yield an alternative expression for the trace function employed in the
description of the correlation functions of the inhomogeneous XXZ model on the
infinite lattice by Boos, Jimbo, Miwa, Smirnov and Takeyama(hep-th/0412191).
","[{""version"":""v1"",""created"":""Wed, 16 Mar 2005 11:41:14 GMT""},{""version"":""v2"",""created"":""Wed, 20 Jul 2005 16:47:03 GMT""}]","2014-11-18"
"hep-th/0503131","Damiano Anselmi","Damiano Anselmi","Infinite reduction of couplings in non-renormalizable quantum field
  theory","40 pages; v2: more explanatory comments; appeared in JHEP","JHEP 0508 (2005) 029","10.1088/1126-6708/2005/08/029","IFUP-TH 2005/08","hep-th",,"  I study the problem of renormalizing a non-renormalizable theory with a
reduced, eventually finite, set of independent couplings. The idea is to look
for special relations that express the coefficients of the irrelevant terms as
unique functions of a reduced set of independent couplings lambda, such that
the divergences are removed by means of field redefinitions plus
renormalization constants for the lambda's. I consider non-renormalizable
theories whose renormalizable subsector R is interacting and does not contain
relevant parameters. The ""infinite"" reduction is determined by i) perturbative
meromorphy around the free-field limit of R, or ii) analyticity around the
interacting fixed point of R. In general, prescriptions i) and ii) mutually
exclude each other. When the reduction is formulated using i), the number of
independent couplings remains finite or slowly grows together with the order of
the expansion. The growth is slow in the sense that a reasonably small set of
parameters is sufficient to make predictions up to very high orders. Instead,
in case ii) the number of couplings generically remains finite. The infinite
reduction is a tool to classify the irrelevant interactions and address the
problem of their physical selection.
","[{""version"":""v1"",""created"":""Wed, 16 Mar 2005 13:11:36 GMT""},{""version"":""v2"",""created"":""Sat, 6 Aug 2005 10:09:02 GMT""}]","2009-11-11"
"hep-th/0503132","Hinnerk Albert","Hinnerk Albert","Instantons in the non-linear sigma model","9 pages",,,,"hep-th",,"  This is a review to classify all finite energy solutios of the two
dimensional non-linear sigma model. These solutions could be important in
understanding the vacuum structure of the non-linear sigma model.
","[{""version"":""v1"",""created"":""Wed, 16 Mar 2005 14:03:51 GMT""},{""version"":""v2"",""created"":""Wed, 30 Mar 2005 12:01:24 GMT""}]","2007-05-23"
"hep-th/0503133","Ludwik Turko","J. Cleymans, K. Redlich, L. Turko","Thermodynamic limit and semi--intensive quantities","11 pages, 2 figures In v2 figures are added and corresponding
  editorial changes are done. Paper will be published in Journal of Physics G","J.Phys. G31 (2005) 1421-1435","10.1088/0954-3899/31/12/004",,"hep-th",,"  The properties of statistical ensembles with abelian charges close to the
thermodynamic limit are discussed. The finite volume corrections to the
probability distributions and particle density moments are calculated. Results
are obtained for statistical ensembles with both exact and average charge
conservation. A new class of variables (semi--intensive variables) which differ
in the thermodynamic limit depending on how charge conservation is implemented
in the system is introduced. The thermodynamic limit behavior of these
variables is calculated through the next to leading order finite volume
corrections to the corresponding probability density distributions.
","[{""version"":""v1"",""created"":""Wed, 16 Mar 2005 15:42:05 GMT""},{""version"":""v2"",""created"":""Mon, 26 Sep 2005 13:59:01 GMT""}]","2007-05-23"
"hep-th/0503134","Jerzy Lukierski","A. Bette (Royal Inst.Tech. Sodertalje, Sweden), J. Lukierski (Wroclaw
  Univ.), C. Miquel-Espanya (Dept. Fis.Teor. IFIC, Univ. de Valencia)","Two-Twistor Space, Commuting Composite Minkowski Coordinates and
  Particle Dynamics","LaTeX 2e, 14 pages. To be published in the Proceedings of XIX-th Max
  Born Symposium ""Fundamental Interactions and Twistor-Like Methods"", September
  2004, American Institute of Physics, Proceedings Series",,"10.1063/1.1923329",,"hep-th",,"  We employ the modification of the basic Penrose formula in twistor theory,
which allows to introduce commuting composite space-time coordinates. It
appears that in the course of such modification the internal symmetry SU(2) of
two-twistor system is broken to U(1). We consider the symplectic form on
two-twistor space, permitting to interpret its 16 real components as a
phase-space. After a suitable change of variables such a two-twistor phase
space is split into three mutually commuting parts, describing respectively the
standard relativistic phase space (8 degrees of freedom), the spin sector (6
degrees of freedom) and the canonical pair angle-charge describing the electric
charge sector (2 degrees of freedom). We obtain a geometric framework providing
a twistor-inspired 18-dimensional extended relativistic phase space
$\mathcal{M}^{18}$. In such a space we propose the action only with first class
constraints, describing the relativistic particle characterized by mass, spin
and electric charge.
","[{""version"":""v1"",""created"":""Wed, 16 Mar 2005 15:43:24 GMT""}]","2009-11-11"
"math-ph/0503039","Charles Suggs","R. Jackiw","Topology in Physics","9 pages, 5 figures",,"10.1142/9789812772879_0003","MIT-CTP-3608","math-ph cond-mat.mes-hall math.MP physics.class-ph",,"  The phenomenon of quantum number fractionalization is explained. The
relevance of non-trivial phonon field topology is emphasized.
","[{""version"":""v1"",""created"":""Tue, 15 Mar 2005 16:00:59 GMT""}]","2017-08-23"
"math-ph/0503040","Giuseppe Scolarici dr","G. Marmo, G. Scolarici, A. Simoni, F. Ventriglia","Alternative structures and bi-Hamiltonian systems on a Hilbert space","11 pages","J.Phys. A38 (2005) 3813-3822","10.1088/0305-4470/38/17/007",,"math-ph hep-th math.MP quant-ph",,"  We discuss transformations generated by dynamical quantum systems which are
bi-unitary, i.e. unitary with respect to a pair of Hermitian structures on an
infinite-dimensional complex Hilbert space. We introduce the notion of
Hermitian structures in generic relative position. We provide few necessary and
sufficient conditions for two Hermitian structures to be in generic relative
position to better illustrate the relevance of this notion. The group of
bi-unitary transformations is considered in both the generic and non-generic
case. Finally, we generalize the analysis to real Hilbert spaces and extend to
infinite dimensions results already available in the framework of
finite-dimensional linear bi-Hamiltonian systems.
","[{""version"":""v1"",""created"":""Tue, 15 Mar 2005 16:04:05 GMT""}]","2009-11-11"
"math-ph/0503041","Timur Tudorovskiy","V. V. Belov, S. Yu. Dobrokhotov, T. Ya. Tudorovskiy","Operator Separation Of Variables For Adiabatic Problems In Quantum And
  Wave Mechanics","57 pages",,,,"math-ph math.MP",,"  We study linear problems of mathematical physics in which the adiabatic
approximation is used in the wide sense. Using the idea that all these problems
can be treated as problems with operator-valued symbol, we propose a general
regular scheme of adiabatic approximation based on operator methods. This
scheme is a generalization of the Born-Oppenheimer and Maslov methods, the
Peierls substitution, etc. The approach proposed in this paper allows one to
obtain ""effective"" reduced equations for a wide class of states inside terms
(i.e., inside modes, subregions of dimensional quantization, etc.) with the
possible degeneration taken into account.
","[{""version"":""v1"",""created"":""Tue, 15 Mar 2005 19:47:35 GMT""}]","2007-05-23"
"math-ph/0503042","Giovanni Gallavotti","Giovanni Gallavotti","CKN theory of singularities of weak solutions of the Navier-Stokes
  equations","38 pages, Lectures","Lecture notes in Physics, 1871, p. 45--100,2006, Springer, (ed.
  M.Cannone,T. Miyakawa)",,,"math-ph math.MP",,"  The lectures are devoted to a complete exposition of the theory of
singularities of the Navier Stokes equations solution studied by Leray, in a
simple geometrical setting in which the fluid is enclosed in a container $\O$
with periodic boundary conditions and side size $L$. The theory is due to the
work of Scheffer, Caffarelli, Kohn, Nirenberg and is called here CKN-theory as
it is inspired by the work of the last three authors which considerably
improved the earlier estimates of Scheffer.
","[{""version"":""v1"",""created"":""Wed, 16 Mar 2005 13:53:19 GMT""}]","2008-10-08"
