"quant-ph/0511119","Martin Plenio","Oscar Dahlsten and Martin B. Plenio","Exact entanglement probability distribution of bi-partite randomised
  stabilizer states","7 pages, 2 figures, replaced with published version","Quant. Inf. Comp. 6, 527 (2006)",,,"quant-ph",,"  We study the entanglement properties of random pure stabilizer states in
spin-1/2 particles. For two contiguous groups of spins of arbitrary size we
obtain a compact and exact expression for the probability distribution for the
entanglement values between the two sets. This allows for exact derivations of
the average entanglement and the degree of concentration of measure around this
average. We also give simple bounds on these quantities. We find that for large
systems the average entanglement is near maximal and the measure is
concentrated around it.
","[{""version"":""v1"",""created"":""Sat, 12 Nov 2005 19:39:20 GMT""},{""version"":""v2"",""created"":""Fri, 9 Feb 2007 15:47:35 GMT""}]","2007-05-23"
"quant-ph/0511120","L. F. Santos","Lorenza Viola and Emanuel Knill","Random decoupling schemes for quantum dynamical control and error
  suppression","9 pages, no figures","Physical Review Letters, 94, 060502 (2005)","10.1103/PhysRevLett.94.060502",,"quant-ph",,"  We present a general control-theoretic framework for constructing and
analyzing random decoupling schemes, applicable to quantum dynamical control of
arbitrary finite-dimensional composite systems. The basic idea is to design the
control propagator according to a random rather than deterministic path on a
group. We characterize the performance of random decoupling protocols, and
identify control scenarios where they can significantly weaken time scale
requirements as compared to cyclic counterparts. Implications for reliable
quantum computation are discussed.
","[{""version"":""v1"",""created"":""Sat, 12 Nov 2005 19:47:29 GMT""}]","2009-11-11"
"quant-ph/0511121","L. F. Santos","Lea F. Santos and Lorenza Viola","Dynamical control of qubit coherence: Random versus deterministic
  schemes","21 pages, 15 figures, to appear in Physical Review A, 72 (2005)",,"10.1103/PhysRevA.72.062303",,"quant-ph",,"  We revisit the problem of switching off unwanted phase evolution and
decoherence in a single two-state quantum system in the light of recent results
on random dynamical decoupling methods [L. Viola and E. Knill, Phys. Rev. Lett.
{\bf 94}, 060502 (2005)]. A systematic comparison with standard cyclic
decoupling is effected for a variety of dynamical regimes, including the case
of both semiclassical and fully quantum decoherence models. In particular,
exact analytical expressions are derived for randomized control of decoherence
from a bosonic environment. We investigate quantitatively control protocols
based on purely deterministic, purely random, as well as hybrid design, and
identify their relative merits and weaknesses at improving system performance.
We find that for time-independent systems, hybrid protocols tend to perform
better than pure random and may improve over standard asymmetric schemes,
whereas random protocols can be considerably more stable against fluctuations
in the system parameters. Beside shedding light on the physical requirements
underlying randomized control, our analysis further demonstrates the potential
for explicit control settings where the latter may significantly improve over
conventional schemes.
","[{""version"":""v1"",""created"":""Sat, 12 Nov 2005 19:52:11 GMT""}]","2009-11-11"
