"hep-th/0509052","Nikolaos Prezas","Gianguido Dall'Agata and Nikolaos Prezas","Scherk-Schwarz reduction of M-theory on G2-manifolds with fluxes","43 pages, Latex; v3 typos corrected, one reference added, JHEP
  version","JHEP 0510:103,2005","10.1088/1126-6708/2005/10/103",,"hep-th",,"  We analyse the 4-dimensional effective supergravity theories obtained from
the Scherk--Schwarz reduction of M-theory on twisted 7-tori in the presence of
4-form fluxes. We implement the appropriate orbifold projection that preserves
a G2-structure on the internal 7-manifold and truncates the effective field
theory to an N=1, D=4 supergravity. We provide a detailed account of the
effective supergravity with explicit expressions for the Kaehler potential and
the superpotential in terms of the fluxes and of the geometrical data of the
internal manifold. Subsequently, we explore the landscape of vacua of M-theory
compactifications on twisted tori, where we emphasize the role of geometric
fluxes and discuss the validity of the bottom-up approach. Finally, by reducing
along isometries of the internal 7-manifold, we obtain superpotentials for the
corresponding type IIA backgrounds.
","[{""version"":""v1"",""created"":""Wed, 7 Sep 2005 20:17:44 GMT""},{""version"":""v2"",""created"":""Thu, 29 Sep 2005 14:31:48 GMT""},{""version"":""v3"",""created"":""Thu, 27 Oct 2005 15:17:40 GMT""}]","2010-12-03"
"hep-th/0509053","Alexander Kalloniatis","M. Ghiotti (CSSM, Adelaide), A.C. Kalloniatis (CSSM, Adelaide), A.G.
  Williams (CSSM, Adelaide)","Landau gauge Jacobian and BRST symmetry","11 pages, uses elsart.cls style file","Phys.Lett.B628:176-182,2005","10.1016/j.physletb.2005.09.015","ADP-05-13/T623","hep-th",,"  We propose a generalisation of the Faddeev-Popov trick for Yang-Mills fields
in the Landau gauge. The gauge-fixing is achieved as a genuine change of
variables. In particular the Jacobian that appears is the modulus of the
standard Faddeev-Popov determinant. We give a path integral representation of
this in terms of auxiliary bosonic and Grassman fields extended beyond the
usual set for standard Landau gauge BRST. The gauge-fixing Lagrangian density
appearing in this context is local and enjoys a new extended BRST and anti-BRST
symmetry though the gauge-fixing Lagrangian density in this case is not BRST
exact.
","[{""version"":""v1"",""created"":""Thu, 8 Sep 2005 05:16:10 GMT""}]","2010-03-04"
"hep-th/0509054","Alon Faraggi","Alon E. Faraggi","Fictitious Extra Dimensions","9 pages. Standard Latex & ws-procs9x6. typos corrected. to appear in
  the proceedings of the fourth International Conference on Quantum Theory and
  Symmetries, 15-21/8/2005, Varna, Bulgaria",,,"LTH-661","hep-th hep-ph",,"  String theory requires additional degrees of freedom to maintain world-sheet
reparameterisation invariance at the quantum level. These are often interpreted
as extra dimensions, beyond the 4 space-time. I discuss a class of
quasi-realistic string models in which all the untwisted geometrical moduli are
projected out by GSO projections. In these models the extra dimensions are
fictitious, and do not correspond to physical dimensions in a low energy
effective field theory. This raises the possibility that extra dimensions are
fictitious in phenomenologically viable string vacua. I propose that
self-duality in the gravitational quantum phase-space provides the criteria for
the string vacuum selection.
","[{""version"":""v1"",""created"":""Thu, 8 Sep 2005 11:31:53 GMT""}]","2007-05-23"
"hep-th/0509055","Jean Iliopoulos","E. G. Floratos and J. Iliopoulos","Gauge theories and non-commutative geometry","12 pages","Phys.Lett.B632:566-570,2006","10.1016/j.physletb.2005.10.081","LPTENS-05/27","hep-th",,"  It is shown that a $d$-dimensional classical SU(N) Yang-Mills theory can be
formulated in a $d+2$-dimensional space, with the extra two dimensions forming
a surface with non-commutative geometry. In this paper we present an explicit
proof for the case of the torus and the sphere.
","[{""version"":""v1"",""created"":""Thu, 8 Sep 2005 12:09:08 GMT""}]","2008-11-26"
"hep-th/0509056","Eugen Radu","Vanush Paturyan, Eugen Radu and D. H. Tchrakian","Solitons and soliton-antisoliton pairs of a Goldstone model in 3+1
  dimensions","13 pages, 5 figures","J.Phys. A39 (2006) 3817-3828","10.1088/0305-4470/39/14/022",,"hep-th",,"  We study finite energy static solutions to a global symmetry breaking model
in 3+1 dimensions described by an isovector scalar field. The basic features of
two different types of configurations are discussed, one of them corresponding
to axially symmetric multisolitons with topological charge $n$, and the other
one to unstable soliton-antisoliton pairs with zero topological charge.
","[{""version"":""v1"",""created"":""Thu, 8 Sep 2005 13:26:06 GMT""},{""version"":""v2"",""created"":""Wed, 8 Feb 2006 10:18:56 GMT""}]","2009-11-11"
"math/0509133","Wenhua Zhao","Wenhua Zhao","Noncommutative Symmetric Systems over Associative Algebras","A connection of NCS systems with combinatorial Hopf algebras of M.
  Aguiar, N. Bergeron and F. Sottile has been added in Remark 2.17. Latex, 32
  pages","J. Pure Appl. Algebra, 210 (2007), no. 2, 363--382",,,"math.CO math.QA",,"  This paper is the first of a sequence papers ([Z4]--[Z7]) on the {\it
${\mathcal N}$CS $(\text{noncommutative symmetric})$ systems} over differential
operator algebras in commutative or noncommutative variables ([Z4]); the
${\mathcal N}$CS systems over the Grossman-Larson Hopf algebras ([GL],[F]) of
labeled rooted trees ([Z6]); as well as their connections and applications to
the inversion problem ([BCW],[E4]) and specializations of NCSFs ([Z5],[Z7]). In
this paper, inspired by the seminal work [GKLLRT] on NCSFs (noncommutative
symmetric functions), we first formulate the notion {\it ${\mathcal N}$CS
systems} over associative $\mathbb Q$-algebras. We then prove some results for
${\mathcal N}$CS systems in general; the ${\mathcal N}$CS systems over
bialgebras or Hopf algebras; and the universal ${\mathcal N}$CS system formed
by the generating functions of certain NCSFs in [GKLLRT]. Finally, we review
some of the main results that will be proved in the followed papers [Z4], [Z6]
and [Z7] as some supporting examples for the general discussions given in this
paper.
","[{""version"":""v1"",""created"":""Wed, 7 Sep 2005 18:53:26 GMT""},{""version"":""v2"",""created"":""Tue, 31 Jul 2007 05:15:09 GMT""}]","2009-02-02"
"math/0509134","Wenhua Zhao","Wenhua Zhao","Differential Operator Specializations of Noncommutative Symmetric
  Functions","Latex, 33 pages. Some mistakes and misprints have been corrected","Adv. Math. 214 (2007), no. 2, 639-665",,,"math.CO math.QA",,"  Let $K$ be any unital commutative $\mathbb Q$-algebra and $z=(z_1, ..., z_n)$
commutative or noncommutative free variables. Let $t$ be a formal parameter
which commutes with $z$ and elements of $K$. We denote uniformly by $\kzz$ and
$\kttzz$ the formal power series algebras of $z$ over $K$ and $K[[t]]$,
respectively. For any $\alpha \geq 1$, let $\cDazz$ be the unital algebra
generated by the differential operators of $\kzz$ which increase the degree in
$z$ by at least $\alpha-1$ and $ \ataz $ the group of automorphisms
$F_t(z)=z-H_t(z)$ of $\kttzz$ with $o(H_t(z))\geq \alpha$ and $H_{t=0}(z)=0$.
First, for any fixed $\alpha \geq 1$ and $F_t\in \ataz$, we introduce five
sequences of differential operators of $\kzz$ and show that their generating
functions form a $\mathcal N$CS (noncommutative symmetric) system [Z4] over the
differential algebra $\cDazz$. Consequently, by the universal property of the
$\mathcal N$CS system formed by the generating functions of certain NCSFs
(noncommutative symmetric functions) first introduced in [GKLLRT], we obtain a
family of Hopf algebra homomorphisms $\cS_{F_t}: {\mathcal N}Sym \to \cDazz$
$(F_t\in \ataz)$, which are also grading-preserving when $F_t$ satisfies
certain conditions. Note that, the homomorphisms $\cS_{F_t}$ above can also be
viewed as specializations of NCSFs by the differential operators of $\kzz$.
Secondly, we show that, in both commutative and noncommutative cases, this
family $\cS_{F_t}$ (with all $n\geq 1$ and $F_t\in \ataz$) of differential
operator specializations can distinguish any two different NCSFs. Some
connections of the results above with the quasi-symmetric functions ([Ge],
[MR], [S]) are also discussed.
","[{""version"":""v1"",""created"":""Wed, 7 Sep 2005 19:18:04 GMT""},{""version"":""v2"",""created"":""Sun, 28 Oct 2007 22:15:45 GMT""}]","2007-10-30"
"math/0509135","Wenhua Zhao","Wenhua Zhao","Noncommutative Symmetric Functions and the Inversion Problem","Latex, 33 pages. Some misprints have been corrected","Internat. J. Algebra Comput., 18 (2007), no. 5, 869--899.",,,"math.CV math.CO",,"  Let $K$ be any unital commutative $\bQ$-algebra and $z=(z_1, z_2, ..., z_n)$
commutative or noncommutative variables. Let $t$ be a formal central parameter
and $\kttzz$ the formal power series algebra of $z$ over $K[[t]]$. In
\cite{GTS-II}, for each automorphism $F_t(z)=z-H_t(z)$ of $\kttzz$ with
$H_{t=0}(z)=0$ and $o(H(z))\geq 1$, a \cNcs (noncommutative symmetric) system
(\cite{GTS-I}) $\Oft$ has been constructed. Consequently, we get a Hopf algebra
homomorphism $\cSft: \cNsf \to \cDzz$ from the Hopf algebra $\cNsf$
(\cite{G-T}) of NCSF's (noncommutative symmetric functions). In this paper, we
first give a list for the identities between any two sequences of differential
operators in the \cNcs system $\Oft$ by using some identities of NCSF's derived
in \cite{G-T} and the homomorphism $\cSft$. Secondly, we apply these identities
to derive some formulas in terms of differential operator in the system $\Oft$
for the Taylor series expansions of $u(F_t)$ and $u(F_t^{-1})$ $(u(z)\in
\kttzz)$; the D-Log and the formal flow of $F_t$ and inversion formulas for the
inverse map of $F_t$. Finally, we discuss a connection of the well-known
Jacobian conjecture with NCSF's.
","[{""version"":""v1"",""created"":""Wed, 7 Sep 2005 19:41:18 GMT""},{""version"":""v2"",""created"":""Fri, 9 Sep 2005 18:22:01 GMT""}]","2009-02-02"
"math/0509136","Wenhua Zhao","Wenhua Zhao","A Noncommutative Symmetric System over the Grossman-Larson Hopf Algebra
  of Labeled Rooted Trees","Latex, 30 pages. Following the referees' suggestions, several places
  have been improved. In particular, some diagrams of rooted trees have been
  added. To appear in J. Alg. Comb","J. Alg. Comb. 28 (2008), 235--260.","10.1007/s10801-007-0100-5",,"math.CO math.QA",,"  In this paper, we construct explicitly a noncommutative symmetric (${\mathcal
N}$CS) system over the Grossman-Larson Hopf algebra of labeled rooted trees. By
the universal property of the ${\mathcal N}$CS system formed by the generating
functions of certain noncommutative symmetric functions, we obtain a
specialization of noncommutative symmetric functions by labeled rooted trees.
Taking the graded duals, we also get a graded Hopf algebra homomorphism from
the Connes-Kreimer Hopf algebra of labeled rooted forests to the Hopf algebra
of quasi-symmetric functions. A connection of the coefficients of the third
generating function of the constructed ${\mathcal N}$CS system with the order
polynomials of rooted trees is also given and proved.
","[{""version"":""v1"",""created"":""Wed, 7 Sep 2005 19:48:25 GMT""},{""version"":""v2"",""created"":""Thu, 15 Mar 2007 23:50:00 GMT""},{""version"":""v3"",""created"":""Sun, 28 Oct 2007 20:34:45 GMT""}]","2009-02-02"
"math/0509138","Wenhua Zhao","Wenhua Zhao","NCS Systems over Differential Operator Algebras and the Grossman-Larson
  Hopf Algebras of Labeled Rooted Trees","Latex, 35 pages. Some misprints have been corrected",,,,"math.CO math.QA",,"  Let $K$ be any unital commutative $\bQ$-algebra and $W$ any non-empty subset
of $\bN^+$. Let $z=(z_1, ..., z_n)$ be commutative or noncommutative free
variables and $t$ a formal central parameter. % Denote uniformly by $\kzz$ and
$\kttzz$ the formal power series algebras % of $z$ over $K$ and $K[[t]]$,
respectively. Let $\cDazz$ $(\alpha\geq 1)$ be the unital algebra generated by
the differential operators of $\kzz$ which increase the degree in $z$ by at
least $\alpha-1$ and $ \ataz $ the group of automorphisms $F_t(z)=z-H_t(z)$ of
$\kttzz$ with $o(H_t(z))\geq \alpha$ and $H_{t=0}(z)=0$. First, we study a
connection of the \cNcs systems $\Omega_{F_t}$ $(F_t\in \ataz)$ (\cite{GTS-I},
\cite{GTS-II}) over the differential operators algebra $\cDazz$ and the \cNcs
system $\Omega_\bT^W$ (\cite{GTS-IV}) over the Grossman-Larson Hopf algebra
$\cH_{GL}^W$ (\cite{GL}, \cite{F1}, \cite{F2}) of $W$-labeled rooted trees. We
construct a Hopf algebra homomorphism $\mathcal A_{F_t}: \cH_{GL}^W \to \cDazz$
$(F_t\in \ataz)$ such that $\mathcal A_{F_t}^{\times 5}(\Omega_\bT^W)
=\Omega_{F_t}$. Secondly, we generalize the tree expansion formulas for the
inverse map (\cite{BCW}, \cite{Wr3}), the D-Log and the formal flow (\cite{WZ})
of $F_t$ in the commutative case to the noncommutative case. Thirdly, we prove
the injectivity of the specialization $\cT:{\mathcal N}Sym \to
\cH_{GL}^{\bN^+}$ (\cite{GTS-IV}) of NCSF's (noncommutative symmetric
functions) (\cite{G-T}). Finally, we show the family of the specializations
$\cS_{F_t}$ of NCSF's with all $n\geq 1$ and the polynomial automorphisms
$F_t=z-H_t(z)$ with $H_t(z)$ homogeneous and the Jacobian matrix $JH_t$
strictly lower triangular can distinguish any two different NCSF's. The graded
dualized versions of the main results above are also discussed.
","[{""version"":""v1"",""created"":""Wed, 7 Sep 2005 19:56:11 GMT""},{""version"":""v2"",""created"":""Fri, 9 Sep 2005 18:22:52 GMT""}]","2007-05-23"
"math/0509157","Christian Krattenthaler","J. M. Brunat (Universitat Poli\`ecnica de Catalunya, Barcelona), C.
  Krattenthaler (Universit\'e Claude Bernard Lyon-I), A. Lascoux (Universit\'e
  de Marne-la-Vall\'ee) and A. Montes (Universitat Polit\`ecnica de Catalunya,
  Barcelona)","Some composition determinants","AmS-LaTeX, 9 pages; minor improvements","Linear Algebra Appl. 416 (2006), 355-364.",,,"math.CO math.CA",,"  We compute two parametric determinants in which rows and columns are indexed
by compositions, where in one determinant the entries are products of binomial
coefficients, while in the other the entries are products of powers. These
results generalize previous determinant evaluations due to the first and third
author [SIAM J. Matrix Anal. Appl. 23 (2001), 459--471] and [""A polynomial
generalization of the power-compositions determinant,"" Linear Multilinear
Algebra (to appear)], and they prove two conjectures of the second author
[""Advanced determinant calculus: a complement,"" preliminary version].
","[{""version"":""v1"",""created"":""Wed, 7 Sep 2005 16:05:37 GMT""},{""version"":""v2"",""created"":""Tue, 18 Oct 2005 09:08:16 GMT""},{""version"":""v3"",""created"":""Mon, 24 Oct 2005 09:19:56 GMT""},{""version"":""v4"",""created"":""Wed, 2 Nov 2005 14:49:39 GMT""}]","2007-05-23"
"math/0509158","Daan Krammer","Daan Krammer","Horizontal configurations of points in link complements","14 pages, 5 figures, uses pstricks","in Proc. European Congress Math. 2004, EMS (2005), 233--245",,,"math.GT",,"  For any tangle $T$ (up to isotopy) and integer $k\geq 1$ we construct a group
$F(T)$ (up to isomorphism). It is the fundamental group of the configuration
space of $k$ points in a horizontal plane avoiding the tangle, provided the
tangle is in what we call Heegaard position. This is analogous to the first
half of Lawrence's homology construction of braid group representations. We
briefly discuss the second half: homology groups of $F(T)$.
","[{""version"":""v1"",""created"":""Wed, 7 Sep 2005 17:49:20 GMT""}]","2007-05-23"
"math/0509159","Andrew Toms","Andrew S. Toms","Dimension growth for $C^*$-algebras","26 pages; minor revisions; to appear in Adv. Math",,,,"math.OA",,"  We introduce the growth rank of a C*-algebra, a (N \cup {\infty})-valued
invariant which measures how far an algebra is from absorbing the Jiang-Su
algebra Z tensorially. We prove that its range is exhausted by simple nuclear
C*-algebras, and obtain in the process a well developed theory of unbounded
dimension growth for approximately homogeneous (AH) algebras. Another
consequence of the range result is the existence of a simple, nuclear, and
non-Z-stable C*-algebra which is not tensorially prime. The properties of the
growth rank suggest a universal property which may be considered inside any
class of unital and nuclear C*-algebras. We prove that Z satisfies this
property inside a class of locally subhomogeneous algebras.
","[{""version"":""v1"",""created"":""Wed, 7 Sep 2005 18:14:50 GMT""},{""version"":""v2"",""created"":""Wed, 31 Jan 2007 21:13:16 GMT""}]","2007-05-23"
"math/0509160","Jon A. Wellner","Fadoua Balabdaoui (University of Goettingen), Jon A. Wellner
  (University of Washington)","Conjecture of error boundedness in a new Hermite interpolation problem
  via splines of odd-degree","28 pages. Submitted to Experimental Mathematics. See also
  http://www.stat.washington.edu/www/research/reports/2004/tr480.pdf
  http://www.stat.washington.edu/jaw/RESEARCH/PAPERS/available.html",,,"UWStat 2004, tr480","math.ST math.NA stat.TH",,"  We present a Hermite interpolation problem via splines of odd-degree which,
to the best knowledge of the authors, has not been considered in the literature
on interpolation via odd-degree splines. In this new interpolation problem, we
conjecture that the interpolation error is bounded in the supremum norm
independently of the locations of the knots. Given an integer k greater than or
equal to 3, our spline interpolant is of degree 2k-1 and with 2k-4 (interior)
knots. Simulations were performed to check the validity of the conjecture. We
present strong numerical evidence in support of the conjecture for k=3, ..., 10
when the interpolated function belongs to C^{(2k)}[0,1], the class of 2k-times
continuously differentiable functions on [0,1]. In this case, the worst
interpolation error is proved to be attained by the perfect spline of degree 2k
with the same knots as the spline interpolant. This interpolation problem
arises naturally in nonparametric estimation of a multiply monotone density via
Least Squares and Maximum Likehood methods.
","[{""version"":""v1"",""created"":""Wed, 7 Sep 2005 18:28:06 GMT""},{""version"":""v2"",""created"":""Thu, 8 Sep 2005 01:42:44 GMT""}]","2007-06-13"
"math/0509161","Tony Pantev","Oren Ben-Bassat, Jonathan Block, Tony Pantev","Non-commutative tori and Fourier-Mukai duality","80 pages, LaTeX2e","Compos.Math.143:423-475,2007","10.1112/S0010437X06002636",,"math.AG hep-th math.QA",,"  The classical Fourier-Mukai duality establishes an equivalence of categories
between the derived categories of sheaves on dual complex tori. In this article
we show that this equivalence extends to an equivalence between two dual
objects. Both of these are generalized deformations of the complex tori. In one
case, a complex torus is deformed formally in a non-commutative direction
specified by a holomorphic Poisson structure. In the other, the dual complex
torus is deformed in a B-field direction to a formal gerbe. We show these two
deformations are Fourier-Mukai equivalent.
","[{""version"":""v1"",""created"":""Wed, 7 Sep 2005 19:09:28 GMT""}]","2019-03-18"
"math/0509162","Jaydeb Sarkar","T. Bhattacharyya, J. Eschmeier, J. Sarkar","On c.n.c. commuting contractive tuples","18 pages, revised version, to appear in Proc. Math. Sci., Indian
  Acad. Sci",,,,"math.OA",,"  The characteristic function has been an important tool for studying
completely non unitary contractions on Hilbert spaces. In this note, we
consider completely non-coisometric contractive tuples of commuting operators
on a Hilbert space $\clh$. We show that the characteristic function, which is
now an operator valued analytic function on the open Euclidean unit ball in
$\mathbb{C}^n$, is a complete unitary invariant for such a tuple. We prove that
the characteristic function satisfies a natural transformation law under
biholomorphic mappings of the unit ball. We also characterize all
operator-valued analytic functions which arise as characteristic functions of
pure commuting contractive tuples.
","[{""version"":""v1"",""created"":""Wed, 7 Sep 2005 18:36:43 GMT""},{""version"":""v2"",""created"":""Wed, 12 Apr 2006 18:43:00 GMT""}]","2007-05-23"
"math/0509163","Burak Erdogan","Michael Christ, M. Burak Erdogan","Mixed norm estimates for certain generalized Radon transforms","13 pages",,,,"math.CA",,"  In this paper we investigate the mapping properties in Lebesgue-type spaces
of certain generalized Radon transforms defined by integration over curves.
","[{""version"":""v1"",""created"":""Wed, 7 Sep 2005 19:22:28 GMT""}]","2007-05-23"
"math/0509164","Edgar Martinez-Moro","M. Borges-Quintana, M.A. Borges-Trenard, P. Fitzpatrick, E.
  Martinez-Moro","Groebner bases and combinatorics for binary codes","Submitted to Appl. Algebra Engrg. Comm. Comput",,,,"math.CO math.AC",,"  In this paper we introduce a binomial ideal derived from a binary linear
code. We present some applications of a Gr\""obner basis of this ideal with
respect to a total degree ordering. In the first application we give a decoding
method for the code. By associating the code with the set of cycles in a graph,
we can solve the problem of finding all codewords of minimal length (minimal
cycles in a graph), and show how to find a minimal cycle basis. Finally we
discuss some results on the computation of the Gr\""obner basis.
","[{""version"":""v1"",""created"":""Thu, 8 Sep 2005 11:09:00 GMT""}]","2007-05-23"
"math/0509165","Daan Krammer","Daan Krammer","A class of Garside groupoid structures on the pure braid group","Final version. To appear in Transactions AMS. 32 pages, 19 figures,
  uses pstricks",,,,"math.GR",,"  We construct a class of Garside groupoid structures on the pure braid groups,
one for each function (called labelling) from the punctures to the integers
greater than 1. The object set of the groupoid is the set of ball
decompositions of the punctured disk; the labels are the perimeters of the
regions. Our construction generalises Garside's original Garside structure, but
not the one by Birman-Ko-Lee. As a consequence, we generalise the Tamari
lattice ordering on the set of vertices of the associahedron.
","[{""version"":""v1"",""created"":""Wed, 7 Sep 2005 20:32:03 GMT""},{""version"":""v2"",""created"":""Fri, 9 Sep 2005 10:22:33 GMT""},{""version"":""v3"",""created"":""Tue, 27 Sep 2005 16:50:52 GMT""},{""version"":""v4"",""created"":""Tue, 4 Apr 2006 23:30:31 GMT""}]","2007-05-23"
"math/0509166","Jonathan C. Mattingly","Yuri Bakhtin and Jonathan C. Mattingly","Stationary Solutions of Stochastic Differential Equation with Memory and
  Stochastic Partial Differential Equations","35 Pages",,,,"math.PR math-ph math.CA math.DS math.MP",,"  We explore Ito stochastic differential equations where the drift term
possibly depends on the infinite past. Assuming the existence of a Lyapunov
function, we prove the existence of a stationary solution assuming only minimal
continuity of the coefficients. Uniqueness of the stationary solution is proven
if the dependence on the past decays sufficiently fast. The results of this
paper are then applied to stochastically forced dissipative partial
differential equations such as the stochastic Navier-Stokes equation and
stochastic Ginsburg-Landau equation.
","[{""version"":""v1"",""created"":""Wed, 7 Sep 2005 21:08:31 GMT""}]","2016-09-07"
"math/0509167","Serguei Samborski","Serguei Samborski","Set-valued differentiation as an operator",,,,,"math.OC",,"  We introduce real vector spaces composed of set-valued maps on an open set.
They are also complete metric spaces, lattices, commutative rings. The set of
differentiable functions is a dense subset of these spaces and the classical
gradient may be extended in these spaces as a closed operator. If a function f
belongs to the domain of such extension, then f is locally lipschitzian and the
values of extended gradient coincide with the values of Clarke's gradient.
However, unlike Clarke's gradient, our generalized gradient is a linear
operator.
","[{""version"":""v1"",""created"":""Wed, 7 Sep 2005 21:28:17 GMT""}]","2007-05-23"
"math/0509168","Siman Wong","Siman Wong","On torsion sections of elliptic fibrations",,,,,"math.NT math.AG",,"  Let E be an elliptic curve over the function field Q(t). Suppose that for
every number field L\not=Q and every element tau\in L such that the
specialization E_tau is smooth, the curve E_tau has a non-trivial torsion point
over L. We show that E has a non-trivial torsion point over Q(t). This provides
evidence in support of a question of Graber-Harris-Mazur-Starr on rational
pseudo-sections of arithmetic surjective morphisms.
","[{""version"":""v1"",""created"":""Wed, 7 Sep 2005 21:37:03 GMT""}]","2007-05-23"
"math/0509169","Keiko Kawamuro","Keiko Kawamuro","Non-sharpness of the Morton-Franks-Williams inequality",,,,,"math.GT",,"  We give conditions on a knot on which the Morton-Franks-Williams inequality
is not sharp. As applications, we show infinitely many examples of knots where
the inequality is not sharp and also prove (by giving examples) that the
deficit of the inequality can be arbitrarily large.
","[{""version"":""v1"",""created"":""Wed, 7 Sep 2005 21:39:01 GMT""},{""version"":""v2"",""created"":""Sat, 28 Jan 2006 22:45:22 GMT""}]","2007-05-23"
