"cond-mat/0509541","Canet L\'eonie","L\'eonie Canet","Strong-Coupling Fixed Point of the Kardar-Parisi-Zhang Equation","Revised version, see abstract",,,,"cond-mat.stat-mech","http://arxiv.org/licenses/nonexclusive-distrib/1.0/","  {\em NOTE: This paper presented the first attempt to tackle the
Kardar-Parisi-Zhang (KPZ) equation using non-perturbative renormalisation group
(NPRG) methods. It exploited the most natural and frequently used approximation
scheme within the NPRG framework, namely the derivative expansion (DE).
However, the latter approximation turned out to yield unphysical critical
exponents in dimensions $d\ge 2$ and, furthermore, hinted at very poor
convergence properties of the DE. The author has since realized that in fact,
this approximation may not be valid for the KPZ problem, because of the very
nature of the KPZ interaction, which is not {\em potential} but {\em
derivative}. The probable failure of the DE is a very unusual -- and
instructive -- feature within the NPRG framework. As such, the original work,
unpublished, is left available on the arXiv and can be found below.
  Added note: the key to deal with the KPZ problem using NPRG lies in not
truncating the momentum dependence of the correlation functions, which is
investigated in a recent work {\em arXiv:0905.1025}.}
  We present a new approach to the Kardar-Parisi-Zhang (KPZ) equation based on
the non-perturbative renormalisation group (NPRG). The NPRG flow equations
derived here, at the lowest order of the derivative expansion, provide a stable
strong-coupling fixed point in all dimensions $d$, embedding in particular the
exact results in $d=0$ and $d=1$. However, it yields at this order unreliable
dynamical and roughness exponents $z$ and $\chi$ in higher dimensions, which
suggests that a richer approximation is needed to investigate the property of
the rough phase in $d \ge 2$.
","[{""version"":""v1"",""created"":""Wed, 21 Sep 2005 12:49:06 GMT""},{""version"":""v2"",""created"":""Sat, 28 Jan 2006 12:38:36 GMT""},{""version"":""v3"",""created"":""Fri, 17 Mar 2006 08:44:44 GMT""},{""version"":""v4"",""created"":""Thu, 7 May 2009 13:30:48 GMT""}]","2009-05-07"
"cond-mat/0509542","Massimo Capone","M. Capone, P. Carta, S. Ciuchi","Polaron Crossover and Bipolaronic Metal-Insulator Transition in the
  Holstein model at half-filling","19 pages, 15 figures","Phys. Rev. B 74, 045106 (2006)","10.1016/j.physb.2005.01.236",,"cond-mat.str-el cond-mat.supr-con",,"  The evolution of the properties of a finite density electronic system as the
electron-phonon coupling is increased are investigated in the
  Holstein model using the Dynamical Mean-Field Theory (DMFT).
  We compare the spinless fermion case, in which only isolated polarons can be
formed, with the spinful model in which the polarons can bind and form
bipolarons. In the latter case, the bipolaronic binding occurs through a
metal-insulator transition. In the adiabatic regime in which the phonon energy
is small with respect to the electron hopping we compare numerically exact DMFT
results with an analytical scheme inspired by the Born-Oppenheimer procedure.
Within the latter approach,a truncation of the phononic Hilbert space leads to
a mapping of the original model onto an Anderson spin-fermion model. In the
anti-adiabatic regime (where the phonon energy exceeds the electronic scales)
the standard treatment based on Lang-Firsov canonical transformation allows to
map the original model on to an attractive Hubbard model in the spinful case.
The separate analysis of the two regimes supports the numerical evidence that
polaron formation is not necessarily associated to a metal-insulator
transition, which is instead due to pairing between the carriers. At the
polaron crossover the Born-Oppenheimer approximation is shown to break down due
to the entanglement of the electron-phonon state.
","[{""version"":""v1"",""created"":""Wed, 21 Sep 2005 12:54:08 GMT""}]","2016-08-31"
"cond-mat/0509543","Michael Lorke","M. Lorke, T. R. Nielsen, J. Seebeck, P. Gartner, F. Jahnke","Influence of carrier-carrier and carrier-phonon correlations on optical
  absorption and gain in quantum-dot systems","12 pages, 10 figures",,"10.1103/PhysRevB.73.085324",,"cond-mat.mes-hall",,"  A microscopic theory is used to study the optical properties of semiconductor
quantum dots. The dephasing of a coherent excitation and line-shifts of the
interband transitions due to carrier-carrier Coulomb interaction and
carrier-phonon interaction are determined from a quantum kinetic treatment of
correlation processes. We investigate the density dependence of both mechanisms
and clarify the importance of various dephasing channels involving the
localized and delocalized states of the system.
","[{""version"":""v1"",""created"":""Wed, 21 Sep 2005 13:23:21 GMT""},{""version"":""v2"",""created"":""Mon, 6 Feb 2006 12:30:39 GMT""}]","2009-11-11"
"cond-mat/0509544","Eduard V. Deviatov","E.V. Deviatov, V.T. Dolgopolov, A. Lorke, W. Wegscheider, A.D. Wieck","Experimental investigation of the edge states structure at fractional
  filling factors","5 pages, 5 figures included. Submitted to JETP Letters",,,,"cond-mat.mes-hall",,"  We experimentally study electron transport between edge states in the
fractional quantum Hall effect regime. We find an anomalous increase of the
transport across the 2/3 incompressible fractional stripe in comparison with
theoretical predictions for the smooth edge potential profile. We interpret our
results as a first experimental demonstration of the intrinsic structure of the
incompressible stripes arising at the sample edge in the fractional quantum
Hall effect regime.
","[{""version"":""v1"",""created"":""Wed, 21 Sep 2005 13:23:37 GMT""}]","2007-05-23"
"cond-mat/0509545","Stefan Schumacher","N. Baer, S. Schulz, S. Schumacher, P. Gartner, G. Czycholl, and F.
  Jahnke","Optical properties of self-organized wurtzite InN/GaN quantum dots: A
  combined atomistic tight-binding and full configuration interaction
  calculation","3 pages, 2 figures",,"10.1063/1.2139621",,"cond-mat.other",,"  In this work we investigate the electronic and optical properties of
self-assembled InN/GaN quantum dots. The one-particle states of the
low-dimensional heterostructures are provided by a tight-binding model that
fully includes the wurtzite crystal structure on an atomistic level. Optical
dipole and Coulomb matrix elements are calculated from these one-particle wave
functions and serve as an input for full configuration interaction
calculations. We present multi-exciton emission spectra and discuss in detail
how Coulomb correlations and oscillator strengths are changed by the
piezoelectric fields present in the structure. Vanishing exciton and biexciton
ground state emission for small lens-shaped dots is predicted.
","[{""version"":""v1"",""created"":""Wed, 21 Sep 2005 13:25:36 GMT""}]","2016-08-31"
"cond-mat/0509546","Marko W\""olki","Marko Woelki, Andreas Schadschneider and Michael Schreckenberg","Asymmetric exclusion processes with shuffled dynamics",,,"10.1088/0305-4470/39/1/003",,"cond-mat.stat-mech",,"  The asymmetric simple exclusion process (ASEP) with periodic boundary
conditions is investigated for shuffled dynamics. In this type of update, in
each discrete timestep the particles are updated in a random sequence. Such an
update is important for several applications, e.g. for certain models of
pedestrian flow in two dimensions. For the ASEP with shuffled dynamics and a
related truncated process exact results are obtained for deterministic motion
(p=1). Since the shuffled dynamics is intrinsically stochastic, also this case
is nontrivial. For the case of stochastic motion (0<p<1) it is shown that, in
contrast to all other updates studied previously, the ASEP with shuffled update
does not have a product measure steady state. Approximative formulas for the
steady state distribution and fundamental diagram are derived that are in very
good agreement with simulation data.
","[{""version"":""v1"",""created"":""Wed, 21 Sep 2005 14:25:38 GMT""}]","2015-06-25"
"cond-mat/0509547","Michael Sutherland","Mike Sutherland, P.D.A. Mann, Christoph Bergemann, Shingo Yonezawa,
  Yoshiteru Maeno","Nearly free electrons in the layered oxide superconductor Ag5Pb2O6","4 pages, 3 figures",,"10.1103/PhysRevLett.96.097008",,"cond-mat.supr-con",,"  We present first measurements of quantum oscillations in the layered oxide
superconductor
  Ag5Pb2O6. From a detailed angular and temperature dependent study of the dHvA
effect we determine the electronic structure and demonstrate that the electron
masses are very light, m^* is approximately equalt to 1.2 m_e. The Fermi
surface we observe is essentially that expected of nearly-free electrons -
establishing
  Ag5Pb2O6 as the first known example of a monovalent, nearly-free electron
superconductor at ambient pressure.
","[{""version"":""v1"",""created"":""Wed, 21 Sep 2005 14:26:26 GMT""}]","2016-08-31"
"cond-mat/0509548","Sarah K\""oster","Sarah K\""oster, Holger Stark, Thomas Pfohl, and Jan Kierfeld","Fluctuations of Single Confined Actin Filaments","This paper has been withdrawn","Biophysical Reviews and Letter Vol. 2, No. 2 (2007) 155-166","10.1142/S1793048007000374",,"cond-mat.soft",,"  This paper withdrawn since it has been published in an updated version in
Biophysical Reviews and Letter Vol. 2, No. 2 (2007) 155-166
","[{""version"":""v1"",""created"":""Wed, 21 Sep 2005 14:46:13 GMT""},{""version"":""v2"",""created"":""Wed, 18 Jul 2007 19:26:24 GMT""}]","2007-07-18"
"cond-mat/0509549","Wenxian Zhang","Wenxian Zhang, D. L. Zhou, M. -S. Chang, M. S. Chapman, and L. You","Dynamical instability and domain formation in a spin-1 Bose condensate","RevTex4, 4 pages with 3 color eps figure, to appear in Phys. Rev.
  Lett","Phys. Rev. Lett. 95, 180403 (2005)","10.1103/PhysRevLett.95.180403",,"cond-mat.other",,"  We interpret the recently observed spatial domain formation in spin-1 atomic
condensates as a result of dynamical instability. Within the mean field theory,
a homogeneous condensate is dynamically unstable (stable) for ferromagnetic
(antiferromagnetic) atomic interactions. We find this dynamical instability
naturally leads to spontaneous domain formation as observed in several recent
experiments for condensates with rather small numbers of atoms. For trapped
condensates, our numerical simulations compare quantitatively to the
experimental results, thus largely confirming the physical insight from our
analysis of the homogeneous case.
","[{""version"":""v1"",""created"":""Wed, 21 Sep 2005 14:53:03 GMT""}]","2009-11-11"
"cond-mat/0509550","Roger Haydock","Nigel Goldenfeld and Roger Haydock","Phase Diagram for Anderson Disorder: beyond Single-Parameter Scaling","51 pages including 4 figures, revised 30 November 2005","Physical Review B, vol. 73, 045118 (2006) 10 pages","10.1103/PhysRevB.73.045118",,"cond-mat.str-el cond-mat.dis-nn",,"  The Anderson model for independent electrons in a disordered potential is
transformed analytically and exactly to a basis of random extended states
leading to a variant of augmented space. In addition to the widely-accepted
phase diagrams in all physical dimensions, a plethora of additional, weaker
Anderson transitions are found, characterized by the long-distance behavior of
states. Critical disorders are found for Anderson transitions at which the
asymptotically dominant sector of augmented space changes for all states at the
same disorder. At fixed disorder, critical energies are also found at which the
localization properties of states are singular. Under the approximation of
single-parameter scaling, this phase diagram reduces to the widely-accepted one
in 1, 2 and 3 dimensions. In two dimensions, in addition to the Anderson
transition at infinitesimal disorder, there is a transition between two
localized states, characterized by a change in the nature of wave function
decay.
","[{""version"":""v1"",""created"":""Wed, 21 Sep 2005 15:02:00 GMT""},{""version"":""v2"",""created"":""Wed, 30 Nov 2005 18:40:10 GMT""}]","2007-05-23"
"cond-mat/0509551","Martin Evans","J. R. Raymond and M. R. Evans","Flocking Regimes in a Simple Lattice Model","24 pages 7 figures","Physical Review E, Vol. 73, 036112 (2006)","10.1103/PhysRevE.73.036112",,"cond-mat.stat-mech",,"  We study a one-dimensional lattice flocking model incorporating all three of
the flocking criteria proposed by Reynolds [Computer Graphics vol.21 4 (1987)]:
alignment, centring and separation. The model generalises that introduced by O.
J. O' Loan and M. R. Evans [J. Phys. A. vol. 32 L99 (1999)]. We motivate the
dynamical rules by microscopic sampling considerations. The model exhibits
various flocking regimes: the alternating flock, the homogeneous flock and
dipole structures. We investigate these regimes numerically and within a
continuum mean-field theory.
","[{""version"":""v1"",""created"":""Wed, 21 Sep 2005 15:12:56 GMT""}]","2007-05-23"
"cond-mat/0509552","Dmitry Kovrizhin","D.L. Kovrizhin, V. Yushankhai, L. Siurakshina","Bose-Einstein condensation of magnons in Cs$_{2}$CuCl$_{4}$: a dilute
  gas limit near the saturation magnetic field",,,"10.1103/PhysRevB.74.134417",,"cond-mat.str-el",,"  Based on a realistic spin Hamiltonian for a frustrated quasi-two dimensional
spin-1/2 antiferromagnet Cs$_{2}$CuCl$_{4}$, a three-dimensional spin ordering
in the applied magnetic field $B$ near the saturation value $B_{c}$ is studied
within the magnon Bose-Einstein condensation (BEC) scenario. With the use of a
hard-core boson formulation of the spin model, a strongly anysotropic magnon
dispersion in Cs$_{2}$CuCl$_{4}$ is calculated. In the dilute magnon limit near
$B_{c}$, the hard-core boson constraint is resulted in an effective magnon
interaction which is treated in the Hartree-Fock approximation. The critical
temperature $T_{c}$ is calculated as a function of a magnetic field $B$ and
compared with the phase boundary $T_{c}(B) $ experimentally determined in
Cs$_{2}$CuCl$_{4}$ [Phys. Rev. Lett. \textbf{95}, 127202 (2005)].
","[{""version"":""v1"",""created"":""Wed, 21 Sep 2005 15:47:20 GMT""}]","2009-11-11"
"cond-mat/0509553","Oscar Iglesias","Oscar Iglesias, Xavier Batlle, Amilcar Labarta","Microscopic origin of exchange bias in core/shell nanoparticles","5 pages, 4 figures included. Final version, accepted in Phys. Rev. B
  (Brief Report)","Phys. Rev. B 72, 212401-1/212401-4 (Brief Report) (2005)","10.1103/PhysRevB.72.212401",,"cond-mat.mtrl-sci",,"  We report the results of Monte Carlo simulations with the aim to clarify the
microscopic origin of exchange bias in the magnetization hysteresis loops of a
model of individual core/shell nanoparticles. Increase of the exchange coupling
across the core/shell interface leads to an enhancement of exchange bias and to
an increasing asymmetry between the two branches of the loops which is due to
different reversal mechanisms. A detailed study of the magnetic order of the
interfacial spins shows compelling evidence that the existence of a net
magnetization due to uncompensated spins at the shell interface is responsible
for both phenomena and allows to quantify the loop shifts directly in terms of
microscopic parameters with striking agreement with the macroscopic observed
values.
","[{""version"":""v1"",""created"":""Wed, 21 Sep 2005 15:55:00 GMT""},{""version"":""v2"",""created"":""Fri, 4 Nov 2005 10:58:54 GMT""}]","2007-05-23"
"cs/0509064","Neri Merhav","Neri Merhav","On joint coding for watermarking and encryption","Submitted to IEEE Transactions on Information Theory",,,,"cs.IT cs.CR math.IT",,"  In continuation to earlier works where the problem of joint information
embedding and lossless compression (of the composite signal) was studied in the
absence \cite{MM03} and in the presence \cite{MM04} of attacks, here we
consider the additional ingredient of protecting the secrecy of the watermark
against an unauthorized party, which has no access to a secret key shared by
the legitimate parties. In other words, we study the problem of joint coding
for three objectives: information embedding, compression, and encryption.Our
main result is a coding theorem that provides a single--letter characterization
of the best achievable tradeoffs among the following parameters: the distortion
between the composite signal and the covertext, the distortion in
reconstructing the watermark by the legitimate receiver, the compressibility of
the composite signal (with and without the key), and the equivocation of the
watermark, as well as its reconstructed version, given the composite signal. In
the attack--free case, if the key is independent of the covertext, this coding
theorem gives rise to a {\it threefold} separation principle that tells that
asymptotically, for long block codes, no optimality is lost by first applying a
rate--distortion code to the watermark source, then encrypting the compressed
codeword, and finally, embedding it into the covertext using the embedding
scheme of \cite{MM03}. In the more general case, however, this separation
principle is no longer valid, as the key plays an additional role of side
information used by the embedding unit.
","[{""version"":""v1"",""created"":""Wed, 21 Sep 2005 00:44:22 GMT""}]","2007-07-13"
"cs/0509065","Cheng Qi","Qi Cheng and Elizabeth Murray","On Deciding Deep Holes of Reed-Solomon Codes",,,,,"cs.IT math.IT",,"  For generalized Reed-Solomon codes, it has been proved \cite{GuruswamiVa05}
that the problem of determining if a received word is a deep hole is
co-NP-complete. The reduction relies on the fact that the evaluation set of the
code can be exponential in the length of the code -- a property that practical
codes do not usually possess. In this paper, we first presented a much simpler
proof of the same result. We then consider the problem for standard
Reed-Solomon codes, i.e. the evaluation set consists of all the nonzero
elements in the field. We reduce the problem of identifying deep holes to
deciding whether an absolutely irreducible hypersurface over a finite field
contains a rational point whose coordinates are pairwise distinct and nonzero.
By applying Schmidt and Cafure-Matera estimation of rational points on
algebraic varieties, we prove that the received vector $(f(\alpha))_{\alpha \in
\F_q}$ for Reed-Solomon $[q,k]_q$, $k < q^{1/7 - \epsilon}$, cannot be a deep
hole, whenever $f(x)$ is a polynomial of degree $k+d$ for $1\leq d < q^{3/13
-\epsilon}$.
","[{""version"":""v1"",""created"":""Wed, 21 Sep 2005 15:52:01 GMT""}]","2007-07-13"
"gr-qc/0509080","J. Daniel Christensen","J. Wade Cherrington, J. Daniel Christensen","Positivity in Lorentzian Barrett-Crane Models of Quantum Gravity","13 pages","Class.Quant.Grav. 23 (2006) 721-736","10.1088/0264-9381/23/3/011",,"gr-qc",,"  The Barrett-Crane models of Lorentzian quantum gravity are a family of spin
foam models based on the Lorentz group. We show that for various choices of
edge and face amplitudes, including the Perez-Rovelli normalization, the
amplitude for every triangulated closed 4-manifold is a non-negative real
number. Roughly speaking, this means that if one sums over triangulations,
there is no interference between the different triangulations. We prove
non-negativity by transforming the model into a ``dual variables'' formulation
in which the amplitude for a given triangulation is expressed as an integral
over three copies of hyperbolic space for each tetrahedron. Then we prove that,
expressed in this way, the integrand is non-negative. In addition to implying
that the amplitude is non-negative, the non-negativity of the integrand is
highly significant from the point of view of numerical computations, as it
allows statistical methods such as the Metropolis algorithm to be used for
efficient computation of expectation values of observables.
","[{""version"":""v1"",""created"":""Tue, 20 Sep 2005 18:00:41 GMT""}]","2009-11-11"
"gr-qc/0509081","Gaurav Khanna","Seth Connors, Gaurav Khanna","Approximate pre-classical solutions in loop quantum cosmology","10 pages, 5 figures","Class.Quant.Grav.23:2919-2926,2006","10.1088/0264-9381/23/9/009",,"gr-qc",,"  In this paper we introduce a numerical approximation technique to obtain
pre-classical solutions to models of loop quantum gravity. In particular, we
apply the technique to vacuum Bianchi I cosmological models and recover known
solutions. We also present a pre-classical solution to the Bianchi I LRS model
with cosmological constant, which has not appeared elsewhere.
","[{""version"":""v1"",""created"":""Tue, 20 Sep 2005 21:14:19 GMT""}]","2014-11-17"
"gr-qc/0509082","Jonas Mureika","J. R. Mureika","Gravitationally-Induced Quantum Superpopsition Reduction with Large
  Extra Dimensions","22 pp; 1 postscript figure Expanded version of previous submission To
  appear in Phys Rev D","Phys.Rev.D73:064012,2006","10.1103/PhysRevD.73.064012",,"gr-qc quant-ph",,"  A gravity-driven mechanism (``objective reduction'') proposed to explain
quantum state reduction is analyzed in light of the possible existence of large
extra dimensions in the ADD scenario. By calculating order-of-magnitude
estimates for nucleon superpositions, it is shown that if the mechanism at
question is correct, constraints may be placed on the number and size of extra
dimensions. Hence, measurement of superposition collapse times ({\it e.g.}
through diffraction or reflection experiments) could represent a new probe of
extra dimensions. The influence of a time-dependent gravitational constant on
the gravity-driven collapse scheme with and without the presence of extra
dimensions is also discussed.
","[{""version"":""v1"",""created"":""Tue, 20 Sep 2005 23:12:36 GMT""},{""version"":""v2"",""created"":""Mon, 27 Feb 2006 19:20:42 GMT""}]","2008-11-26"
"gr-qc/0509083","Brendan Foster","Brendan Z. Foster, Ted Jacobson","Post-Newtonian parameters and constraints on Einstein-aether theory","19 pages; v2: corrected typos","Phys.Rev. D73 (2006) 064015","10.1103/PhysRevD.73.064015",,"gr-qc astro-ph hep-th",,"  We analyze the observational and theoretical constraints on ``Einstein-aether
theory"", a generally covariant theory of gravity coupled to a dynamical, unit,
timelike vector field that breaks local Lorentz symmetry. The results of a
computation of the remaining post-Newtonian parameters are reported. These are
combined with other results to determine the joint post-Newtonian,
vacuum-Cerenkov, nucleosynthesis, stability, and positive-energy constraints.
All of these constraints are satisfied by parameters in a large two-dimensional
region in the four-dimensional parameter space defining the theory.
","[{""version"":""v1"",""created"":""Tue, 20 Sep 2005 23:26:13 GMT""},{""version"":""v2"",""created"":""Wed, 8 Feb 2006 15:57:40 GMT""}]","2009-11-11"
"gr-qc/0509084","Yasufumi Kojima","Yasufumi Kojima and Kentaro Takami","Tidal effects on magnetic gyration of a charged particle in Fermi
  coordinates","10 pages, 12 figures","Class.Quant.Grav. 23 (2006) 609-616","10.1088/0264-9381/23/3/004",,"gr-qc",,"  We examine the gyration motion of a charged particle, viewed from a reference
observer falling along the Z axis into a Schwarzschild black hole. It is
assumed that the magnetic field is constant and uniform along the Z axis, and
that the particle has a circular orbit in the X-Y plane far from the
gravitational source. When the particle as well as the reference observer
approaches the black hole, its orbit is disrupted by the tidal force. The final
plunging velocity increases in the non-relativistic case, but decreases if the
initial circular velocity exceeds a critical value, which is approximately
0.7c. This toy model suggests that disruption of a rapidly rotating star due to
a velocity-dependent tidal force may be quite different from that of a
non-relativistic star. The model also suggested that collapse of the orbit
after the disruption is slow in general, so that the particle subsequently
escapes outside the valid Fermi coordinates.
","[{""version"":""v1"",""created"":""Wed, 21 Sep 2005 06:23:38 GMT""},{""version"":""v2"",""created"":""Thu, 22 Sep 2005 09:16:17 GMT""},{""version"":""v3"",""created"":""Thu, 12 Jan 2006 00:27:56 GMT""}]","2009-11-11"
"gr-qc/0509085","Timothy Clifton","John D. Barrow and T. Clifton","Exact cosmological solutions of scale-invariant gravity theories","7 pages, 1 figure","Class.Quant.Grav. 23 (2006) L1","10.1088/0264-9381/23/1/L01",,"gr-qc astro-ph hep-th",,"  We have found new anisotropic vacuum solutions for the scale-invariant
gravity theories which generalise Einstein's general relativity to a theory
derived from the Lagrangian $R^{1+\delta}$. These solutions are expanding
universes of Kasner form with an initial spacetime singularity at $t=0 $ and
exist for $-1/2<\delta <1/4$ but possess different Kasner index relations to
the classic Kasner solution of general relativity to which they reduce when
$\delta =0$. These solutions are unperturbed by the introduction of
non-comoving perfect-fluid matter motions if $p<\rho $ on approach to the
singularity and should not exhibit an infinite sequence of chaotic Mixmaster
oscillations when $\delta >0$.
","[{""version"":""v1"",""created"":""Wed, 21 Sep 2005 12:20:33 GMT""}]","2009-11-11"
