"math-ph/0509046","Tommaso Isola","P. Gibilisco, T. Isola","Uncertainty Principle and Quantum Fisher Information","12 pages (approx.). v2. Same as accepted version",,,,"math-ph math.MP math.ST stat.TH",,"  We show that an inequality recently proved by Kosaki and
Yanagi-Furuichi-Kuriyama [arXiv:quant-ph/0501152] has a natural geometric
interpretation in terms of monotone metrics associated to Wigner-Yanase-Dyson
information. Moreover we give a counterexample showing that the inequality does
not hold for every monotone metric of this type.
","[{""version"":""v1"",""created"":""Wed, 21 Sep 2005 09:44:43 GMT""},{""version"":""v2"",""created"":""Fri, 10 Feb 2006 18:01:11 GMT""}]","2011-11-10"
"math-ph/0509047","Detlev Buchholz","Detlev Buchholz and Wojciech Dybalski","Scattering in relativistic quantum field theory: basic concepts, tools,
  and results","15 pages, no figures. v2: A revised and updated version of a review
  article for the second edition of the Encyclopedia of Mathematical Physics,
  projected by Elsevier. With regard to the previous edition in 2006, also one
  of the authors as well as the title have changed",,,,"math-ph hep-th math.MP math.SP","http://arxiv.org/licenses/nonexclusive-distrib/1.0/","  We provide an overview of basic concepts, tools, and results of quantum field
theoretical scattering theory. This article is prepared for the second edition
of the Encyclopedia of Mathematical Physics, edited by M. Bojowald and R.J.
Szabo, to be published by Elsevier.
","[{""version"":""v1"",""created"":""Wed, 21 Sep 2005 11:00:24 GMT""},{""version"":""v2"",""created"":""Sat, 13 May 2023 16:10:34 GMT""}]","2023-05-16"
"math/0509456","Marco Fontana","Marco Fontana and Mi Hee Park","On the Star Class Group of a Pullback","J. Algebra (to appear)",,,,"math.AC",,"  For the domain $R$ arising from the construction $T, M,D$, we relate the star
class groups of $R$ to those of $T$ and $D$. More precisely, let $T$ be an
integral domain, $M$ a nonzero maximal ideal of $T$, $D$ a proper subring of
$k:=T/M$, $\phi: T\to k$ the natural projection, and let $R={\phi}^{-1}(D)$.
For each star operation $\ast$ on $R$, we define the star operation $\ast_\phi$
on $D$, i.e., the ``projection'' of $\ast$ under $\phi$, and the star operation
${(\ast)}_{_{T}}$ on $T$, i.e., the ``extension'' of $\ast$ to $T$. Then we
show that, under a mild hypothesis on the group of units of $T$, if $\ast$ is a
star operation of finite type, $0\to \Cl^{\ast_{\phi}}(D) \to \Cl^\ast(R) \to
\Cl^{{(\ast)}_{_{T}}}(T)\to 0$ is split exact. In particular, when $\ast =
t_{R}$, we deduce that the sequence $ 0\to \Cl^{t_{D}}(D) {\to} \Cl^{t_{R}}(R)
{\to}\Cl^{(t_{R})_{_{T}}}(T) \to 0 $ is split exact. The relation between
${(t_{R})_{_{T}}}$ and $t_{T}$ (and between $\Cl^{(t_{R})_{_{T}}}(T)$ and
$\Cl^{t_{T}}(T)$) is also investigated.
","[{""version"":""v1"",""created"":""Tue, 20 Sep 2005 16:49:43 GMT""}]","2007-05-23"
"math/0509457","Eric Rowell","Eric C. Rowell","Generating functions for ranks of pre-modular categories","This paper is for the convenience of other researchers and is not
  intended for ""stand-alone"" publication",,,,"math.QA math.CO",,"  We derive generating functions for the ranks of pre-modular categories
associated to quantum groups at roots of unity.
","[{""version"":""v1"",""created"":""Tue, 20 Sep 2005 20:35:41 GMT""}]","2007-05-23"
"math/0509458","Krzysztof Burdzy","Itai Benjamini, Krzysztof Burdzy and Zhen-Qing Chen","Shy couplings",,,,,"math.PR",,"  A pair of Markov processes is called a Markov coupling if both processes have
the same transition probabilities and the pair is also a Markov process. We say
that a coupling is ``shy'' if the processes never come closer than some
(random) strictly positive distance from each other. We investigate whether shy
couplings exist for several classes of Markov processes.
","[{""version"":""v1"",""created"":""Tue, 20 Sep 2005 22:25:22 GMT""}]","2007-05-23"
"math/0509459","Joseph A. Wolf","Joseph A. Wolf","Spherical Functions on Euclidean Space","10 pages",,,,"math.RT math.CA math.DG",,"  We study special functions on euclidean spaces from the viewpoint of
riemannian symmetric spaces. Here the euclidean space $E^n = G/K$ where $G$ is
the semidirect product $R^n \cdot K$ of the translation group with a closed
subgroup $K$ of the orthogonal group O(n). We give exact parameterizations of
the space of $(G,K)$--spherical functions by a certain affine algebraic
variety, and of the positive definite ones by a real form of that variety. We
give exact formulae for the spherical functions in the case where $K$ is
transitive on the unit sphere in $E^n$.
","[{""version"":""v1"",""created"":""Tue, 20 Sep 2005 22:54:24 GMT""}]","2007-05-23"
"math/0509460","Hsiang-Ping Huang","Hsiang-Ping Huang","Some endomorphisms of II_1 factors",,,,,"math.OA math.FA",,"  For any finite dimensional C^*-algebra A, we give an endomorphism \Phi of the
hyperfinite II_1 factor R of finite Jones index such that: for all k \in
\mathbb {N}, \Phi^k (R)' \cap R= \otimes^k A. The Jones index [R: \Phi (R)]=
(rank (A))^2, here rank (A) is the dimension of the maximal abelian subalgebra
of A.
","[{""version"":""v1"",""created"":""Tue, 20 Sep 2005 23:29:39 GMT""}]","2007-05-23"
"math/0509461","Hsiang-Ping Huang","Hsiang-Ping Huang","Some endomorphisms of II_1 factors: part II",,,,,"math.OA math.FA",,"  For any finite dimensional C^*-algebra A with a trace vector \vec s whose
entries are rational numbers, we give an endomorphism \Phi of the hyperfinite
II_1 factor R such that: for all k \in \mathbb {N}, \Phi^k (R)' \cap R=
\otimes^k A. The canonical trace \tau on R extends the trace vector \vec s on
A. Therefore the minimal projection is not necessarily equivalent to each
other.
","[{""version"":""v1"",""created"":""Tue, 20 Sep 2005 23:37:46 GMT""}]","2007-05-23"
"math/0509462","Laurentiu Maxim","Constance Leidy, Laurentiu Maxim","Higher-order Alexander invariants of plane algebraic curves","a new section 'Examples' is added","Int. Math. Res. Not., Volume 2006 (2006), Article ID 12976, 23
  pages",,,"math.AT math.AG math.GT",,"  We define new higher-order Alexander modules $\mathcal{A}_n(C)$ and
higher-order degrees $\delta_n(C)$ which are invariants of the algebraic planar
curve $C$. These come from analyzing the module structure of the homology of
certain solvable covers of the complement of the curve $C$. These invariants
are in the spirit of those developed by T. Cochran in \cite{C} and S. Harvey in
\cite{H} and \cite{Har}, which were used to study knots, 3-manifolds, and
finitely presented groups, respectively. We show that for curves in general
position at infinity, the higher-order degrees are finite. This provides new
obstructions on the type of groups that can arise as fundamental groups of
complements to affine curves in general position at infinity.
","[{""version"":""v1"",""created"":""Wed, 21 Sep 2005 00:36:46 GMT""},{""version"":""v2"",""created"":""Sun, 4 Dec 2005 09:44:25 GMT""}]","2012-04-03"
"math/0509463","Marc Levine","Marc Levine (Northeastern University)","Motivic Tubular Neighborhoods","This version repairs an error from the original version, yielding a
  monodromy sequence for theories with rational coefficients which satisfy an
  ""alternating"" condition. There are additional minor corrections and
  improvements",,,,"math.AG math.AT",,"  We construct motivic versions of the classical tubular neighborhood and the
punctured tubular neighborhood, and give applications to the construction of
tangential base-points for mixed Tate motives, algebraic gluing of curves with
boundary components, and limit motives.
","[{""version"":""v1"",""created"":""Wed, 21 Sep 2005 01:01:06 GMT""},{""version"":""v2"",""created"":""Fri, 23 Sep 2005 01:58:52 GMT""},{""version"":""v3"",""created"":""Tue, 25 Oct 2005 13:33:34 GMT""}]","2007-05-23"
"math/0509464","Gady Kozma","Gideon Amir, Itai Benjamini and Gady Kozma","Excited random walk against a wall","16 pages. Revised as per referee remarks. To appear in Probab. Theory
  Related Fields",,,,"math.PR",,"  We analyze random walk in the upper half of a three dimensional lattice which
goes down whenever it encounters a new vertex, a.k.a. excited random walk. We
show that it is recurrent with an expected number of returns of square-root log
n.
","[{""version"":""v1"",""created"":""Wed, 21 Sep 2005 01:23:36 GMT""},{""version"":""v2"",""created"":""Thu, 27 Oct 2005 00:55:19 GMT""},{""version"":""v3"",""created"":""Fri, 27 Oct 2006 09:07:03 GMT""}]","2007-05-23"
"math/0509465","Wadim Zudilin","Wadim Zudilin (Moscow)","Quadratic transformations and Guillera's formulae for $1/\pi^2$","LaTeX, 5 pages; submitted for publication","Mat. Zametki 81 (2007), no. 3, 335--340; English transl., Math.
  Notes 81 (2007), no. 3, 297--301","10.1134/S0001434607030030",,"math.CA math.NT",,"  We prove two new series of Ramanujan type for $1/\pi^2$.
","[{""version"":""v1"",""created"":""Wed, 21 Sep 2005 06:41:44 GMT""},{""version"":""v2"",""created"":""Sun, 30 Apr 2006 12:32:11 GMT""}]","2009-02-24"
"math/0509466","Wolfgang Krieger","Wolfgang Krieger","On Lambda-Graph Systems for Subshifts of Subshifts","11 pages, minor changes",,,,"math.DS",,"  Kengo Matsumoto has introduced lambda-graph systems and strong shift
equivalence of lambda-graph systems [Doc.Math.4 (1999), 285-340]. We associate
to a subshift of a subshift a lambda-graph system. The strong shift equivalence
class of the associated lambda-graph system is an invariant of subsystem
equivalence. Wolfgang Krieger and Kengo Matsumoto have introduced the
lambda$-entropy of a lambda-graph system and have shown its invariance under
strong shift equivalence [Ergod.Th.&Dynam.Sys. 24 (2004) 1155 - 1172]. A
separation entropy of a subshift of a subshift is introduced as the
lambda-entropy of the associated lambda-graph system.
","[{""version"":""v1"",""created"":""Wed, 21 Sep 2005 06:57:41 GMT""},{""version"":""v2"",""created"":""Sat, 30 Dec 2006 16:01:51 GMT""}]","2007-05-23"
"math/0509467","Salvador Hernandez","Salvador Hern\'andez, Ta-Sun Wu","Some new results on the Chu duality of discrete groups",,,,,"math.GN math.GR",,"  This paper deals mainly with the Chu duality of discrete groups. Among other
results, we give sufficient conditions for an $FC$ group to satisfy Chu duality
and characterize when the Chu quasi-dual and the Takahashi quasi-dual of a
group $G$ coincide. As a consequence, it follows that when $G$ is a weak sum of
a family of finite simple groups, if the exponent of the groups in the family
is bounded then $G$ satisfies Chu duality; on the other hand, if the exponent
of the groups goes to infinite then the Chu quasi-dual of $G$ coincide with its
Takahashi quasi-dual. We also present examples of discrete groups whose Chu
quasi-duals are not locally compact and examples of discrete Chu reflexive
groups which contain non-trivial sequences converging in the Bohr topology of
the groups. Our results systematize some previous work and answer some open
questions in the subject.
","[{""version"":""v1"",""created"":""Wed, 21 Sep 2005 07:43:00 GMT""}]","2007-05-23"
"math/0509468","Stefan Gerhold","S. Gerhold and M. Kauers","A Computer Proof of Turan's Inequality",,,,,"math.CA math.CO",,"  We show how Turan's inequality $P_n(x)^2-P_{n-1}(x)P_{n+1}(x)\geq 0$ for
Legendre polynomials and related inequalities can be proven by means of a
computer procedure. The use of this procedure simplifies the daily work with
inequalities. For instance, we have found the stronger inequality
$|x|P_n(x)^2-P_{n-1}(x)P_{n+1}(x)\geq 0$, $-1\leq x\leq 1$, effortlessly with
the aid of our method.
","[{""version"":""v1"",""created"":""Wed, 21 Sep 2005 07:47:58 GMT""}]","2007-05-23"
"math/0509469","Dimitry Leites","Pavel Grozman, Dimitry Leites","Lie superalgebra structures in H*(g; g)","6 pages, LaTeX","Czech. J. Phys. v. 54, 2004, no. 11, 1313--1319","10.1007/s10582-004-9794-y",,"math.RT",,"  On a given manifold M, the Nijenhuis bracket makes the superspace of
vector-valued differential forms into a Lie superalgebra that can be
interpreted as the centralizer of the exterior differential considered as a
vector field on the supermanifold associated with the de Rham bundle on M. A
similar bracket introduces structures of DG Lie superalgebra in the superspaces
of cochains and cohomology with coefficients in the adjoint module for any Lie
superalgebra. We use a Mathematica--based package SuperLie (already proven
useful in various problems) to explicitly describe these Lie superalgebras for
some simple finite dimensional Lie superalgebras and their ``relatives'' (the
nontrivial central extensions or derivation algebras of the considered simple
ones).
","[{""version"":""v1"",""created"":""Wed, 21 Sep 2005 09:00:56 GMT""}]","2015-06-26"
"math/0509470","Burkhard Zimmermann","George E. Andrews, Arnold Knopfmacher and Burkhard Zimmermann","On the Number of Distinct Multinomial Coefficients","16 pages, to be published in the Journal of Number Theory","Journal of Number Theory, Volume 118, Issue 1, May 2006, Pages
  15-30","10.1016/j.jnt.2005.08.012",,"math.CO math.AC",,"  We study M(n), the number of distinct values taken by multinomial
coefficients with upper entry n, and some closely related sequences. We show
that both pP(n)/M(n) and M(n)/p(n) tend to zero as n goes to infinity, where
pP(n) is the number of partitions of n into primes and p(n) is the total number
of partitions of n. To use methods from commutative algebra, we encode
partitions and multinomial coefficients as monomials.
","[{""version"":""v1"",""created"":""Wed, 21 Sep 2005 09:59:38 GMT""}]","2007-05-23"
"math/0509471","Svante Janson","Svante Janson","Congruence properties of depths in some random trees","23 pages",,,,"math.PR math.CO",,"  Consider a random recusive tree with n vertices. We show that the number of
vertices with even depth is asymptotically normal as n tends to infinty. The
same is true for the number of vertices of depth divisible by m for m=3, 4 or
5; in all four cases the variance grows linearly. On the other hand, for m at
least 7, the number is not asymptotically normal, and the variance grows faster
than linear in n. The case m=6 is intermediate: the number is asymptotically
normal but the variance is of order n log n.
  This is a simple and striking example of a type of phase transition that has
been observed by other authors in several cases. We prove, and perhaps explain,
this non-intuitive behavious using a translation to a generalized Polya urn.
  Similar results hold for a random binary search tree; now the number of
vertices of depth divisible by m is asymptotically normal for m at most 8 but
not for m at least 9, and the variance grows linearly in the first case both
faster in the second. (There is no intermediate case.)
  In contrast, we show that for conditioned Galton-Watson trees, including
random labelled trees and random binary trees, there is no such phase
transition: the number is asymptotically normal for every m.
","[{""version"":""v1"",""created"":""Wed, 21 Sep 2005 10:05:20 GMT""}]","2007-05-23"
"math/0509472","Dimitry Leites","Irina Shchepochkina","How to realize Lie algebras by vector fields","17 pages, LaTeX",,"10.1007/s11232-006-0078-5",,"math.RT",,"  An algorithm for embedding finite dimensional Lie algebras into Lie algebras
of vector fields (and Lie superalgebras into Lie superalgebras of vector
fields) is offered in a way applicable over ground fields of any
characteristic. The algorithm is illustrated by reproducing Cartan's
interpretations of the Lie algebra of G(2) as the Lie algebra that preserves
certain non-integrable distributions. Similar algorithm and interpretation are
applicable to other exceptional simple Lie algebras, as well as to all
non-exceptional simple ones and many non-simple ones, and to many Lie
superalgebras.
","[{""version"":""v1"",""created"":""Wed, 21 Sep 2005 10:13:15 GMT""}]","2009-11-11"
"math/0509473","Peter Jorgensen","Peter Jorgensen","Wrong way recollement for schemes","6 pages",,,,"math.AG",,"  A recollement of triangulated categories makes it possible to view one such
category as being glued together from two others.
  The prototypical example is that D(X), a suitable derived category of sheaves
on the topological space X, has a recollement in terms of D(Z) and D(U) when Z
is a closed subset of X and U is the open complement.
  This note gives a different, ""wrong way"" recollement in the scheme case.
","[{""version"":""v1"",""created"":""Wed, 21 Sep 2005 10:31:32 GMT""}]","2007-05-23"
"math/0509474","Gabriele Nebe","Gabriele Nebe","Kneser-Hecke-operators in coding theory",,,,,"math.NT",,"  The Kneser-Hecke-operator is a linear operator defined on the complex vector
space spanned by the equivalence classes of a family of self-dual codes of
fixed length. It maps a linear self-dual code $C$ over a finite field to the
formal sum of the equivalence classes of those self-dual codes that intersect
$C$ in a codimension 1 subspace. The eigenspaces of this self-adjoint linear
operator may be described in terms of a coding-theory analogue of the Siegel
$\Phi $-operator.
","[{""version"":""v1"",""created"":""Wed, 21 Sep 2005 11:43:11 GMT""},{""version"":""v2"",""created"":""Tue, 18 Jul 2006 10:34:53 GMT""}]","2007-05-23"
"math/0509475","Margherita Barile Prof.","Margherita Barile","Certain minimal varieties are set-theoretic complete intersections",,"Commun. Algebra, 35 (2007), 2082-2095","10.1080/00927870701302099",,"math.AG math.AC",,"  We present a class of homogeneous ideals which are generated by monomials and
binomials of degree two and are set-theoretic complete intersections. This
class includes certain reducible varieties of minimal degree and, in
particular, the presentation ideals of the fiber cone algebras of monomial
varieties of codimension two.
","[{""version"":""v1"",""created"":""Wed, 21 Sep 2005 11:50:22 GMT""}]","2007-06-28"
"math/0509476","Wujie Shi","Guohua Qian and Wujie Shi","A Characterization of $L_2(2^f)$ in Terms of Character Zeros","11 pages",,,,"math.GR",,"  The aim of this paper is to classify the finite nonsolvable groups in which
every irreducible character of even degree vanishes on at most two conjugacy
classes. As a corollary, it is shown that $L_2(2^f)$ are the only nonsolvable
groups in which every irreducible character of even degree vanishes on just one
conjugacy class.
","[{""version"":""v1"",""created"":""Wed, 21 Sep 2005 12:24:01 GMT""}]","2007-05-23"
"math/0509477","Laurent Mazet","Laurent Mazet","Lignes de divergence pour les graphes a courbure moyenne constante","24 pages, 4 figures",,,,"math.DG",,"  This paper is devoted to the study of convergence of sequences of solutions
to the constant mean curvature H equation. The convergence domain is defined.
The main Theorem characterizes the complement of this convergence domain: it
shows that circle arcs of curvature 2H compose this complement. We then give
results which allow us to use this theorem.
","[{""version"":""v1"",""created"":""Wed, 21 Sep 2005 12:26:04 GMT""}]","2007-05-23"
"math/0509478","David Wood","Prosenjit Bose, Jurek Czyzowicz, Zhicheng Gao, Pat Morin, David R.
  Wood","Simultaneous Diagonal Flips in Plane Triangulations","A short version of this paper will be presented at SODA 2006","J. Graph Theory 54(4):307-330, 2007","10.1002/jgt.20214",,"math.CO cs.CG",,"  Simultaneous diagonal flips in plane triangulations are investigated. It is
proved that every $n$-vertex triangulation with at least six vertices has a
simultaneous flip into a 4-connected triangulation, and that it can be computed
in O(n) time. It follows that every triangulation has a simultaneous flip into
a Hamiltonian triangulation. This result is used to prove that for any two
$n$-vertex triangulations, there exists a sequence of $O(\log n)$ simultaneous
flips to transform one into the other. The total number of edges flipped in
this sequence is O(n). The maximum size of a simultaneous flip is then studied.
It is proved that every triangulation has a simultaneous flip of at least
${1/3}(n-2)$ edges. On the other hand, every simultaneous flip has at most
$n-2$ edges, and there exist triangulations with a maximum simultaneous flip of
${6/7}(n-2)$ edges.
","[{""version"":""v1"",""created"":""Wed, 21 Sep 2005 12:45:55 GMT""},{""version"":""v2"",""created"":""Wed, 26 Apr 2006 10:17:53 GMT""}]","2008-09-09"
"math/0509479","Laurent Mazet","Laurent Mazet","Some uniqueness results for constant mean curvature graphs","21 pages, 3 figures",,,,"math.DG",,"  The aim of this paper is to give two uniqueness results for the Dirichlet
problem associated to the constant mean curvature equation. We study constant
mean curvature graphs over strips of R^2. The proofs are based on height
estimates and the study of the asymptotic behaviour of solutions to the
Dirichlet problem.
","[{""version"":""v1"",""created"":""Wed, 21 Sep 2005 12:58:54 GMT""}]","2007-05-23"
"math/0509480","Nina C. Snaith","J.B. Conrey and N.C. Snaith","Applications of the L-functions ratios conjectures",,"Proc. Lon. Math. Soc., Volume 93, No 3, 2007, pages 594--646",,"AIM 2005-25","math.NT",,"  In upcoming papers by Conrey, Farmer and Zirnbauer there appear conjectural
formulas for averages, over a family, of ratios of products of shifted
L-functions. In this paper we will present various applications of these ratios
conjectures to a wide variety of problems that are of interest in number
theory, such as lower order terms in the zero statistics of L-functions,
mollified moments of L-functions and discrete averages over zeros of the
Riemann zeta function. In particular, using the ratios conjectures we easily
derive the answers to a number of notoriously difficult computations.
","[{""version"":""v1"",""created"":""Wed, 21 Sep 2005 14:02:44 GMT""},{""version"":""v2"",""created"":""Fri, 20 Jul 2007 15:26:35 GMT""}]","2011-11-09"
"math/0509481","Viktor Abramov","V. Abramov","On a graded q-differential algebra","6 pages, submitted to the Proceedings of the ""International
  Conference on High Energy and Mathematical Physics"", Morocco, Marrakech,
  April 2005",,"10.2991/jnmp.2006.13.s.1",,"math.QA math.DG",,"  Given a unital associatve graded algebra we construct the graded
q-differential algebra by means of a graded q-commutator, where q is a
primitive N-th root of unity. The N-th power (N>1) of the differential of this
graded q-differential algebra is equal to zero. We use our approach to
construct the graded q-differential algebra in the case of a reduced quantum
plane which can be endowed with a structure of a graded algebra. We consider
the differential d satisfying d to power N equals zero as an analog of an
exterior differential and study the first order differential calculus induced
by this differential.
","[{""version"":""v1"",""created"":""Wed, 21 Sep 2005 14:07:59 GMT""}]","2015-06-26"
"math/0509482","El rhalami Aziz male","A.Hajji","Forme Equivalente \`a la Condition $\Delta_2 $ et Certains r\'esultats
  de s\'eparations dans les Espaces Modulaires","11p,pas de figure",,,,"math.FA",,"  In this paper, we present an equivalent form of the $\Delta_2 $-condition
which allow us to redefine the topological vector space structure of a modular
spaces using the filter base. We show also the characterization of closed
subsets (in the sens of this topology) of a modular spaces which permit us to
establish some separation results in modular spaces
","[{""version"":""v1"",""created"":""Wed, 21 Sep 2005 15:04:08 GMT""}]","2007-05-23"
"math/0509483","Jan Schroer","Christof Gei{\ss}, Bernard Leclerc, Jan Schr\""oer","Semicanonical bases and preprojective algebras II: A multiplication
  formula","22 pages. Generalization of the multiplication formula from
  preprojective algebras of Dynkin type to arbitrary preprojective algebras","Compos. Math. 143 (2007), no. 5, 1313--1334","10.1112/S0010437X07002977",,"math.RT math.RA",,"  Let $n$ be a maximal nilpotent subalgebra of a complex symmetric Kac-Moody
Lie algebra. Lusztig has introduced a basis of U(n) called the semicanonical
basis, whose elements can be seen as certain constructible functions on
varieties of nilpotent modules over a preprojective algebra of the same type as
$n$. We prove a formula for the product of two elements of the dual of this
semicanonical basis, and more generally for the product of two evaluation forms
associated to arbitrary modules over the preprojective algebra. This formula
plays an important role in our work on the relationship between semicanonical
bases, representation theory of preprojective algebras, and Fomin and
Zelevinsky's theory of cluster algebras. It was inspired by recent results of
Caldero and Keller.
","[{""version"":""v1"",""created"":""Wed, 21 Sep 2005 15:06:54 GMT""},{""version"":""v2"",""created"":""Mon, 27 Mar 2006 14:47:33 GMT""},{""version"":""v3"",""created"":""Mon, 29 Jan 2007 08:30:58 GMT""}]","2019-03-05"
"math/0509484","Kobi Snitz","Kobi Snitz","Average Representation Numbers For Spinor Genera","a restatement of the result in terms of spinor genera",,,,"math.NT",,"  In this paper we establish a formula for the average of representation
numbers of ternary quadratic forms in a spinor genus over a totally real number
field.
  The significant fact about the formula is the fact that it is given in terms
of local quantities. Such a formula has already been established by Kneser,
Hsia, and Schulze-Pillot, by a different method.
","[{""version"":""v1"",""created"":""Wed, 21 Sep 2005 15:15:37 GMT""},{""version"":""v2"",""created"":""Thu, 13 Oct 2005 12:20:40 GMT""},{""version"":""v3"",""created"":""Tue, 15 Nov 2005 18:25:55 GMT""},{""version"":""v4"",""created"":""Wed, 30 Aug 2006 11:13:55 GMT""}]","2007-05-23"
