"astro-ph/0509620","John Stephen","J. B. Stephen, L. Bassani, A. Malizia, A. Bazzano, P. Ubertini, A.J.
  Bird, A.J. Dean, F. Lebrun and R. Walter","Using the ROSAT Catalogues to find counterparts for the second
  IBIS/ISGRI Survey Sources","6 pages, 4 figures and 2 tables. To be published in Astronomy &
  Astrophysics",,"10.1051/0004-6361:20053958",,"astro-ph",,"  The second IBIS/ISGRI survey has produced a catalogue containing 209 hard
X-ray sources visible down to a flux limit of around 1 milliCrab. The point
source location accuracy of typically 1-3 arcminutes has allowed the
counterparts for most of these sources to be found at other wavelengths. In
order to help identify the remaining objects, we have used the
cross-correlation recently found between the ISGRI catalogue and the ROSAT All
Sky Survey Bright Source Catalogue. In this way, for ISGRI sources which have a
counterpart in soft X-rays, we can use the much smaller ROSAT error box to
search for identifications. For this second survey, we find 114 associations
with the number expected by chance to be ~2. Of these sources, 8 are in the
list of unidentified objects and, using the smaller ROSAT error boxes, we can
find tentative counterparts for five of them. We have performed the same
analysis for the ROSAT Faint Source Catalogue, finding a further nine
associations with ISGRI unidentified sources from a total of 29 correlations,
and, notwithstanding the poorer location accuracy of these sources and higher
chance coincidence possibility, we have managed to find a counterpart for
another source. Finally, we have used the ROSAT HRI catalogue to search the
ISGRI error boxes and find 5 more X-ray objects, of which two are neither in
the bright or faint source catalogues, and for which we have managed to find
optical/near infrared associations. This makes a total of 19 objects with X-ray
counterparts for which we have found possible identifications for nine, most of
which are extragalactic.
","[{""version"":""v1"",""created"":""Wed, 21 Sep 2005 08:52:12 GMT""}]","2009-11-11"
"astro-ph/0509621","Carlo Luciano Bianco","Carlo Luciano Bianco, Remo Ruffini","Exact versus approximate solutions in Gamma-Ray Burst afterglows","4 pages, 2 figures, to appear on ApJ Letters","Astrophys.J.633:L13-L16,2005","10.1086/498146",,"astro-ph",,"  We have recently obtained the exact analytic solutions of the relativistic
equations relating the radial and time coordinate of a relativistic thin
uniform shell expanding in the interstellar medium in the fully radiative and
fully adiabatic regimes. We here re-examine the validity of the constant-index
power-law relations between the Lorentz gamma factor and its radial coordinate,
usually adopted in the current Gamma-Ray Burst (GRB) literature on the grounds
of an ""ultrarelativistic"" approximation. Such expressions are found to be
mathematically correct but only approximately valid in a very limited range of
the physical and astrophysical parameters and in an asymptotic regime which is
reached only for a very short time, if any, and are shown to be not applicable
to GRBs.
","[{""version"":""v1"",""created"":""Wed, 21 Sep 2005 09:08:27 GMT""}]","2009-11-13"
"astro-ph/0509622","Cheongho Han","S.-J. Chung (1), D. Kim (1) The Angstrom Collaboration: M.J. Darnley
  (2), J.P. Duke (2), A. Gould (4), C. Han (1), Y.-B. Jeon (3), E. Kerins (2),
  A. Newsam (2), B.-G. Park (3) ((1) Chungbuk Natl. Univ., Korea, (2) Liverpool
  John Moores University, (3)Korea Astronomy and Space Science Institute, (4)
  OSU)","The possibility of detecting planets in the Andromeda Galaxy","total 8 pages, including 8 figures, ApJ, submitted",,"10.1086/506930",,"astro-ph",,"  The Angstrom Project is using a global network of 2m-class telescopes to
conduct a high cadence pixel microlensing survey of the bulge of the Andromeda
Galaxy (M31), with the primary aim of constraining its underlying bulge mass
distribution and stellar mass function. Here we investigate the feasibility of
using such a survey to detect planets in M31. We estimate the efficiency of
detecting signals for events induced by planetary systems as a function of
planet/star mass ratio and separation, source type and background M31 surface
brightness. We find that for planets of a Jupiter-mass or above that are within
the lensing zone (~1 -3 AU) detection is possible above 3 $\sigma$, with
detection efficiencies ~3% for events associated with giant stars, which are
the typical source stars of pixel-lensing surveys. A dramatic improvement in
the efficiency of ~40 -- 60% is expected if follow-up observations on an 8m
telescope are made possible by a real-time alert system.
","[{""version"":""v1"",""created"":""Wed, 21 Sep 2005 09:30:53 GMT""}]","2012-08-27"
"astro-ph/0509623","Tuomas Savolainen","T. Savolainen (1), K. Wiik (1), E. Valtaoja (1) and M. Tornikoski (2)
  ((1) Tuorla Observatory, University of Turku, (2) Metsahovi Radio
  Observatory, Helsinki University of Technology)","Multifrequency VLBA Monitoring of 3C 273 during the INTEGRAL Campaign in
  2003 - I. Kinematics of the Parsec Scale Jet from 43 GHz Data","Accepted for publication in Astronomy & Astrophysics, 16 pages, 15
  figures","Astron.Astrophys. 446 (2006) 71-85","10.1051/0004-6361:20053753",,"astro-ph",,"  In this first of a series of papers describing polarimetric multifrequency
Very Long Baseline Array (VLBA) monitoring of 3C 273 during a simultaneous
campaign with the INTEGRAL gamma-ray satellite in 2003, we present 5 Stokes I
images and source models at 7 mm. We show that a part of the inner jet (1-2
milliarcseconds from the core) is resolved in a direction transverse to the
flow, and we analyse the kinematics of the jet within the first 10 mas. Based
on the VLBA data and simultaneous single-dish flux density monitoring, we
determine an accurate value for the Doppler factor of the parsec scale jet, and
using this value with observed proper motions, we calculate the Lorentz factors
and the viewing angles for the emission components in the jet. Our data
indicates a significant velocity gradient across the jet with the components
travelling near the southern edge being faster than the components with more
northern path. We discuss our observations in the light of jet precession model
and growing plasma instabilities.
","[{""version"":""v1"",""created"":""Wed, 21 Sep 2005 09:41:12 GMT""}]","2016-08-30"
"astro-ph/0509624","Cristiano da Rocha","Cristiano Da Rocha (IAG/Uni-Goe, DAS/INPE), Claudia Mendes de Oliveira
  (IAG/USP) and Bodo L. Ziegler (IAG/Uni-Goe)","Intra-Group Light in Hickson Compact Groups - A Wavelet Approach","Small update on the associated institutions list",,,,"astro-ph",,"  A diffuse component of intra-group light can be observed in compact groups of
galaxies. This component is presumably due to stellar material tidally stripped
from the member galaxies of the group, which gets trapped in the group
potential. It represents an efficient tool for the determination of the stage
of dynamical evolution of such structures and for mapping the gravitational
potential of the group. Detecting this kind of low surface brightness structure
(about 1% above the sky level) is a difficult task, which is subject to many
problems like the modeling of stars and galaxy and sky subtraction. To overcome
these problems, we apply a new method, the wavelet technique OV\_WAV, with
which these low surface brightness structures can be revealed and analyzed by
separating different components according to their spatial characteristic sizes
(allowing the study of the point sources, galaxies and diffuse envelope
separately). We have analyzed 3 of the of the Hickson Compact Groups Catalogue
(HCG 79, HCG 88 and HCG 95) and were able to detect this diffuse component in
two of the studied groups: HCG 79, where the diffuse light corresponds to
$46\pm11%$ of the total B band luminosity and HCG 95, where the fraction is
$11\pm26%$. HCG 88 had no component detected, as expected by its estimated
early evolutionary stage.
","[{""version"":""v1"",""created"":""Wed, 21 Sep 2005 10:25:56 GMT""},{""version"":""v2"",""created"":""Mon, 21 Nov 2005 19:59:12 GMT""}]","2007-05-23"
"astro-ph/0509625","G.C. Anupama Dr.","G. C. Anupama, D. K. Sahu, J. Deng, K. Nomoto, N. Tominaga, M. Tanaka,
  P. A. Mazzali, T. P. Prabhu","The peculiar type Ib supernova 2005bf: explosion of a massive He star
  with a thin hydrogen envelope?","13 pages, 4 figures. Accepted for publication in ApJ (Letters)","Astrophys.J.631:L125-L128,2005","10.1086/497336",,"astro-ph",,"  We present BVRI photometry and optical spectroscopy of SN 2005bf near light
maximum. The maximum phase is broad and occurred around 2005 May 7, about forty
days after the shock breakout. SN 2005bf has a peak bolometric magnitude
M_{bol}=-18.0\pm 0.2: while this is not particularly bright, it occurred at an
epoch significantly later than other SNe Ibc, indicating that the SN possibly
ejected ~0.31 M_{sun} of 56Ni, which is more than the typical amount. The
spectra of SN 2005bf around maximum are very similar to those of the Type Ib
SNe 1999ex and 1984L about 25-35 days after explosion, displaying prominent He
I, Fe II, Ca II H & K and the near-IR triplet P Cygni lines. Except for the
strongest lines, He I absorptions are blueshifted by <~6500 km/s, and Fe II by
\~7500-8000 km/s. No other SNe Ib have been reported to have their Fe II
absorptions blueshifted more than their He I absorptions. Relatively weak
H-alpha and very weak H-beta may also exist, blueshifted by ~15,000 km/s. We
suggest that SN 2005bf was the explosion of a massive He star, possibly with a
trace of a hydrogen envelope.
","[{""version"":""v1"",""created"":""Wed, 21 Sep 2005 11:13:53 GMT""}]","2016-08-30"
"astro-ph/0509626","Yang Xiaohu","Xiaohu Yang (UMass, SHAO), H.J. Mo (UMass), Frank C. van den Bosch
  (ETH, MPIA)","Observational Evidence for an Age Dependence of Halo Bias","4 pages, 4 figures, Accepted for publication in ApJ Letters. Figures
  3 and 4 replaced. The bias dependence on the central galaxy luminosity is
  omitted due to its sensitivity to the mass model","Astrophys.J.638:L55-L58,2006","10.1086/501069",,"astro-ph",,"  We study the dependence of the cross-correlation between galaxies and galaxy
groups on group properties. Confirming previous results, we find that the
correlation strength is stronger for more massive groups, in good agreement
with the expected mass dependence of halo bias. We also find, however, that for
groups of the same mass, the correlation strength depends on the star formation
rate (SFR) of the central galaxy: at fixed mass, the bias of galaxy groups
decreases as the SFR of the central galaxy increases. We discuss these findings
in light of the recent findings by Gao et al (2005) that halo bias depends on
halo formation time, in that halos that assemble earlier are more strongly
biased. We also discuss the implication for galaxy formation, and address a
possible link to galaxy conformity, the observed correlation between the
properties of satellite galaxies and those of their central galaxy.
","[{""version"":""v1"",""created"":""Wed, 21 Sep 2005 12:31:55 GMT""},{""version"":""v2"",""created"":""Wed, 11 Jan 2006 02:04:10 GMT""}]","2009-11-13"
"astro-ph/0509627","Stefano Andreon","S. Andreon","Some thoughts and some new results about the Butcher-Oemler effect","Conference proceedings: ""The fabulous destiny of galaxies: Bridging
  past and present"", Marseille, June 2005",,,,"astro-ph",,"  These short notes collect some thoughts about the way Butcher-Oemler-like and
evolutionary studies are performed. We emphasize the shortcomings of several
overlooked technical ingredients in the above type of studies, with the hope of
making a useful cookbook for future works. We also briefly report new results
of an ongoing Butcher-Oemler study at intermediate redshift.
","[{""version"":""v1"",""created"":""Wed, 21 Sep 2005 12:35:48 GMT""}]","2007-05-23"
"astro-ph/0509628","Olivier Le Fevre","O. Le Fevre, S. Paltani, S. Arnouts, S. Charlot, S. Foucaud, O.
  Ilbert, H. J. McCracken, G. Zamorani, and the VIMOS VLT Deep Survey team","A large population of galaxies 9 to 12 billion years back in the history
  of the Universe","Published in Nature, 22 September 2005","Nature 437:519,2005","10.1038/nature03979",,"astro-ph",,"  To understand the evolution of galaxies, we need to know as accurately as
possible how many galaxies were present in the Universe at different epochs.
Galaxies in the young Universe have hitherto mainly been identified using their
expected optical colours, but this leaves open the possibility that a
significant population remains undetected because their colours are the result
of a complex mix of stars, gas, dust or active galactic nuclei. Here we report
the results of a flux-limited I-band survey of galaxies at look-back times of 9
to 12 billion years. We find 970 galaxies with spectroscopic redshifts between
1.4 and 5. This population is 1.6 to 6.2 times larger than previous estimates,
with the difference increasing towards brighter magnitudes. Strong ultraviolet
continua (in the rest frame of the galaxies) indicate vigorous star formation
rates of more than 10 to 100 solar masses per year. As a consequence, the
cosmic star formation rate is higher than previously measured at redshifts of 3
to 4.
","[{""version"":""v1"",""created"":""Wed, 21 Sep 2005 12:48:34 GMT""}]","2016-08-30"
"astro-ph/0509629","Aaron Price","A. Price, L. Cohen, J. Mattei, N. Craig","A Needs Analysis Study of Amateur Astronomers For the National Virtual
  Observatory","Accepted in JAAVSO/eJAAVSO",,,,"astro-ph",,"  Through a combination of qualitative and quantitative processes, a survey was
conducted of the amateur astronomy community to identify outstanding needs
which the National Virtual Observatory (NVO) could fulfill. This is the final
report of that project, which was conducted by The American Association of
Variable Star Observers (AAVSO) on behalf of the SEGway Project at the Center
for Science Educations @ Space Sciences Laboratory, UC Berkeley.
","[{""version"":""v1"",""created"":""Wed, 21 Sep 2005 13:42:52 GMT""}]","2007-05-23"
"astro-ph/0509630","Martin Lopez-Corredoira","M. Lopez-Corredoira, C. M. Gutierrez","Research on candidates for non-cosmological redshifts","18 pages, to be published in the proceedings of the conference
  ""Crisis in Cosmology I"", 23 to 25 June 2005, Moncao (Portugal)","AIP Conf.Proc.822:75-92,2006","10.1063/1.2189124",,"astro-ph",,"  (Abridged:) The paradox of apparent optical associations of galaxies with
very different redshifts, the so-called anomalous redshift problem, is around
35 years old, but is still without a clear solution and is surprisingly ignored
by most of the astronomical community. Statistical correlations among the
positions of these galaxies have been pointed out by several authors.
Gravitational lensing by dark matter has been proposed as the cause of these
correlations, although this seems to be insufficient to explain them and does
not work at all for correlations with the brightest and nearest galaxies. Some
of these cases may be just fortuitous associations in which background objects
are close in the sky to a foreground galaxy, although the statistical mean
correlations remain to be explained and some lone objects have very small
probabilities of being a projection of background objects.
  The sample of discordant redshift associations given in Arp's atlas is indeed
quite large, and most of the objects remain to be analysed thoroughly. For
about 5 years, we have been running a project to observe some of these cases in
detail, and some new anomalies have been added to those already known; For
instance, in some exotic configurations such as NGC 7603 or NEQ3, which can
even show bridges connecting four object with very different redshifts. Not
only QSOs but also emission-line galaxies in general are found to take part in
this kind of event. Other cases are analyzed: MCG 7-25-46, GC 0248+430, B2
1637+29, VV172 and Stephan's Quintet.
","[{""version"":""v1"",""created"":""Wed, 21 Sep 2005 14:08:21 GMT""},{""version"":""v2"",""created"":""Mon, 26 Sep 2005 13:13:44 GMT""}]","2009-11-13"
"astro-ph/0509631","Marcio Catelan","M. Catelan (1), H. A. Smith (2), B. J. Pritzl (3), J. Borissova (4),
  C. Cacciari (5), R. Contreras (1), T. M. Corwin (6), N. De Lee (2), M. E.
  Escobar (1), A. C. Layden (7), C. Navarro (1), G. Prieto (1), R. Salinas
  (1,8), P. B. Stetson (9), A. V. Sweigart (10), E. Vidal (1), M. Zoccali (1),
  and M. Zorotovic (1) ((1) PUC-Chile, (2) Michigan State; (3) Macalester, (4)
  ESO-Chile, (5) INAF-Bologna, (6) UNC at Charlotte, (7) Bowling Green, (8)
  Concepcion, (9) DAO-HIA, Canada, (10) NASA/GSFC)","Completing the Census of (Bright) Variable Stars in Galactic Globular
  Clusters","4 pages, 4 figures. MSAIt, in press",,,,"astro-ph",,"  We present a long-term project aimed at completing the census of (bright)
variable stars in Galactic globular clusters. While our main aim is to obtain a
reliable assessment of the populations of RR Lyrae and type II Cepheid stars in
the Galactic globular cluster system, due attention is also being paid to other
types of variables, including SX Phoenicis stars, long-period variables, and
eclipsing binaries.
","[{""version"":""v1"",""created"":""Wed, 21 Sep 2005 14:21:51 GMT""}]","2007-05-23"
"astro-ph/0509632","Alexander Stroeer","A. Stroeer, A. Vecchio, G. Nelemans","LISA astronomy of double white dwarf binary systems","accepted for publication in ApJLetters","Astrophys.J.633:L33-L36,2005","10.1086/498147",,"astro-ph gr-qc",,"  The Laser Interferometer Space Antenna (LISA) will provide the largest
observational sample of (interacting) double white dwarf binaries, whose
evolution is driven by radiation reaction and other effects, such as tides and
mass transfer. We show that, depending on the actual physical parameters of a
source, LISA will be able to provide very different quality of information: for
some systems LISA can test unambiguously the physical processes driving the
binary evolution, for others it can simply detect a binary without allowing us
to untangle the source parameters and therefore shed light on the physics at
work. We also highlight that simultaneous surveys with GAIA and/or optical
telescopes that are and will become available can radically improve the quality
of the information that can be obtained.
","[{""version"":""v1"",""created"":""Wed, 21 Sep 2005 14:41:48 GMT""}]","2009-11-13"
"astro-ph/0509633","Guillaume Dubus","Guillaume Dubus","Gamma-ray absorption in massive X-ray binaries","10 pages, 10 figures, accepted by A&A",,"10.1051/0004-6361:20054233",,"astro-ph",,"  Gamma-ray emission in the TeV range has been detected by HESS from two X-ray
binaries: PSR B1259-63 and LS 5039. In both, the early-type star provides large
numbers of target photons for pair-production with TeV gamma-rays. This results
in a modulation of the gamma-ray flux as the relative positions of the
gamma-ray source and companion star change with orbital phase. The lightcurve
and spectrum of absorption provide useful diagnostics for the location and
nature of gamma-ray emission. The expected orbital variations of the absorption
spectrum and flux are calculated for LS 5039, PSR B1259-63 and LSI +61 303, a
system similar to LS 5039 but still undetected at TeV energies. In LS 5039,
emission close to a black hole or a neutron star primary is considered. In both
cases, the flux above 250 GeV drops by more than an order-of-magnitude near
periastron due to absorption. A black hole yields a clear spectral signature in
the average spectrum at 400 GeV. A neutron star yields more variability, with
the spectral feature moving from 200 GeV to 2 TeV. The absorbed fraction of the
flux can be as small as 20%, allowing for an almost direct view of the
intrinsic spectrum. Low variability requires emission on large scales, more
than 0.7 AU away to have <50% absorption in a jet. Such predictions are
essential to distinguish between variability due to the gamma-ray emission
process from that due to absorption. A modulation in LS 5039 would provide a
novel way to constrain the gamma-ray source. Its absence would imply that
gamma-ray emission occurs on large scales.
","[{""version"":""v1"",""created"":""Wed, 21 Sep 2005 15:03:18 GMT""},{""version"":""v2"",""created"":""Mon, 30 Jan 2006 14:49:33 GMT""}]","2009-11-11"
"astro-ph/0509634","David Neufeld","D. A. Neufeld (JHU), P. Schilke (MPIfR), K. M. Menten (MPIfR), M. G.
  Wolfire (U Md), J. H. Black (Onsala), F. Schuller (MPIfR), H. Muller (Koln),
  S. Thorwirth (MPIfR), R. Gusten (MPIfR), S. Philipp (MPIfR)","First astronomical detection of the CF+ ion","2 pages, 1 figure (uses iaus.sty), to appear in IAU Symposium No.
  231, Astrochemistry - Recent Successes and Current Challenges, eds. D. C.
  Lis, G. A. Blake & E. Herbst (Cambridge Univ. Press)",,"10.1017/S1743921306007150",,"astro-ph",,"  We report the first astronomical detection of the CF+ (fluoromethylidynium)
ion obtained by recent observations of its J = 1 - 0 (102.6 GHz), J = 2 - 1
(205.2 GHz), and J = 3 - 2 (307.7 GHz) pure rotational emissions toward the
Orion Bar. Our search for CF+, carried out using the IRAM 30m and APEX 12m
telescopes, was motivated by recent theoretical models that predict CF+
abundances of a few x E-10 in UV-irradiated molecular regions where C+ is
present. The measurements confirm the predictions. They provide support for our
current theories of interstellar fluorine chemistry, which suggest that
hydrogen fluoride should be ubiquitous in interstellar gas clouds.
","[{""version"":""v1"",""created"":""Wed, 21 Sep 2005 15:11:22 GMT""}]","2016-08-30"
"astro-ph/0509635","Galletti Pascal","P. Galletti (CEA-Saclay), T. Foglizzo (CEA-Saclay)","The Advective-Acoustic instability in type II Supernovae","4 pages, 3 figures, conference : SF2A-2005 (Semaine de
  l'Astrophysique Francaise)",,,,"astro-ph",,"  The puzzle of birth velocities of pulsars (pulsar kicks) could be solved by
an asymmetric explosion of type II Supernovae. We propose a simple
hydrodynamical mechanism in order to explain this asymmetry, through the
advective-acoustic cycle (Foglizzo 2002) : during the phase of stalled shock,
an instability based on the cycle between advected perturbations (entropy /
vorticity) and acoustic perturbations can develop between the shock and the
surface of the nascent neutron star. Eigenfrequencies are computed numerically,
improving the calculation of Houck & Chevalier (1992). The linear instability
is dominated by a mode l=1, as observed in the numerical simulations of Blondin
et al. (2003) and Scheck et al. (2004). The frequency dependence of the growth
rate reveals the presence of the advective-acoustic cycle.
","[{""version"":""v1"",""created"":""Wed, 21 Sep 2005 15:18:14 GMT""},{""version"":""v2"",""created"":""Mon, 26 Sep 2005 10:44:12 GMT""}]","2007-05-23"
"astro-ph/0509636","Frederick D. Seward","F. D. Seward, P. Gorenstein, and R. K. Smith","CHANDRA Observations of the X-ray Halo around the Crab Nebula","26 pages, 12 figures, accepted by ApJ","Astrophys.J.636:873-880,2006","10.1086/498105",,"astro-ph",,"  Two Chandra observations have been used to search for thermal X-ray emission
from within and around the Crab Nebula. Dead-time was minimized by excluding
the brightest part of the Nebula from the field of view. A dust-scattered halo
comprising 5% of the strength of the Crab is clearly detected with surface
brightness measured out to a radial distance of 18 arcminutes. Coverage is 100%
at 4 arcminutes, 50% at 12 arcminutes, and 25% at 18 arcminutes. The observed
halo is compared with predictions based on 3 different interstellar grain
models and one can be adjusted to fit the observation. This dust halo and
mirror scattering form a high background region which has been searched for
emission from shock-heated material in an outer shell. We find no evidence for
such emission. We can set upper limits a factor of 10-1000 less than the
surface brightness observed from outer shells around similar remnants. The
upper limit for X-ray luminosity of an outer shell is about 10e34 erg/s.
Although it is possible to reconcile our observation with an 8-13 solar mass
progenitor, we argue that this is unlikely.
","[{""version"":""v1"",""created"":""Wed, 21 Sep 2005 15:32:37 GMT""}]","2009-11-13"
"astro-ph/0509637","Nimesh Patel","Nimesh A. Patel, Salvador Curiel, T. K. Sridharan, Qizhou Zhang, Todd
  R. Hunter, Paul T. P. Ho, Jose M. Torrelles, James M. Moran, Jose F. Gomez &
  Guillem Anglada","A disk of dust and molecular gas around a high-mass protostar",,"Nature 437 (2005) 109","10.1038/nature04011",,"astro-ph",,"  The processes leading to the birth of low-mass stars such as our Sun have
been well studied, but the formation of high-mass (> 8 x Sun's mass) stars has
heretofore remained poorly understood. Recent observational studies suggest
that high-mass stars may form in essentially the same way as low-mass stars,
namely via an accretion process, instead of via merging of several low-mass (<
8 Msun) stars. However, there is as yet no conclusive evidence. Here, we report
the discovery of a flattened disk-like structure observed at submillimeter
wavelengths, centered on a massive 15 Msun protostar in the Cepheus-A region.
The disk, with a radius of about 330 astronomical units (AU) and a mass of 1 to
8 Msun, is detected in dust continuum as well as in molecular line emission.
Its perpendicular orientation to, and spatial coincidence with the central
embedded powerful bipolar radio jet, provides the best evidence yet that
massive stars form via disk accretion in direct analogy to the formation of
low-mass stars.
","[{""version"":""v1"",""created"":""Wed, 21 Sep 2005 15:36:06 GMT""}]","2015-06-24"
