"astro-ph/0509589","Rene' Liseau","R. Liseau (1) and the Odin Team ((1)Stockholm Observatory, AlbaNova
  University Center, Stockholm University, Sweden)","Odin detection of O2","8 pages, 4 Postscript figures (3 in colour), uses iaus.cls",,"10.1017/S1743921306007290",,"astro-ph",,"  We present the detection of molecular oxygen with Odin toward the dense
molecular core rho Oph A, which is part of a region of active star formation.
The observed spectral line is the (N,J = 1,1-1,0) ground state transition of
molecular oxygen at 119 GHz (2.5 mm wavelength). The center of the line is at
the LSR velocity of a number of optically thin lines from other species in the
region and the O2 line also has a very similar, narrow, line width. Within the
10 arcmin beam, the integrated line intensity is 28 mK km/s, which corresponds
to 5 sigma of the rms noise. A standard LTE analysis results in an O2 abundance
of 5E(-8), with an uncertainty of at least a factor of two. We show that
standard methods, however, do not apply in this case, as the coupling of the
Odin beam to the source structure needs to be accounted for. Preliminary model
results indicate O2 abundances to be higher by one order of magnitude than
suggested by the standard case. This model predicts the 487 GHz line of O2 to
be easily detectable by the future Herschel-HIFI facility, but to be out of
reach for observations on a shorter time scale with the Odin space observatory.
","[{""version"":""v1"",""created"":""Tue, 20 Sep 2005 16:16:13 GMT""}]","2015-06-24"
"astro-ph/0509590","HongSheng Zhao","HongSheng Zhao, David J. Bacon, Andy N. Taylor, Keith Horne","Testing Bekenstein's Relativistic MOND gravity with Lensing Data","reduced to 17p, 16 figs, discussed cosmology and constraints on
  mu-function, MNRAS accepted","Mon.Not.Roy.Astron.Soc.368:171-186,2006","10.1111/j.1365-2966.2006.10023.x",,"astro-ph",,"  We propose to use multiple-imaged gravitational lenses to set limits on
gravity theories without dark matter, specificly TeVeS (Bekenstein 2004), a
theory which is consistent with fundamental relativistic principles and the
phenomenology of MOdified Newtonian Dynamics (MOND) theory. After setting the
framework for lensing and cosmology, we derive analytically the deflection
angle for the point lens and the Hernquist galaxy profile, and fit
galaxy-quasar lenses in the CASTLES sample. We do this with three methods,
fitting the observed Einstein ring sizes, the image positions, or the flux
ratios. In all cases we consistently find that stars in galaxies in MOND/TeVeS
provide adequate lensing. Bekenstein's toy $\mu$ function provides more
efficient lensing than the standard MOND $\mu$ function. But for a handful of
lenses [indicated in Table 2,3, fig 16] a good fit would require a lens mass
orders of magnitude larger/smaller than the stellar mass derived from
luminosity unless the modification function $\mu$ and modification scale $a_0$
for the universal gravity were allowed to be very different from what spiral
galaxy rotation curves normally imply. We discuss the limitation of present
data and summarize constraints on the MOND $\mu$ function. We also show that
the simplest TeVeS ""minimal-matter"" cosmology, a baryonic universe with a
cosmological constant, can fit the distance-redshift relation from the
supernova data, but underpredicts the sound horizon size at the last
scattering. We conclude that lensing is a promising approach to differentiate
laws of gravity (see also astro-ph/0512425).
","[{""version"":""v1"",""created"":""Tue, 20 Sep 2005 17:19:16 GMT""},{""version"":""v2"",""created"":""Wed, 21 Sep 2005 18:59:44 GMT""},{""version"":""v3"",""created"":""Tue, 27 Sep 2005 00:03:16 GMT""},{""version"":""v4"",""created"":""Fri, 16 Dec 2005 15:17:54 GMT""}]","2009-11-11"
"astro-ph/0509591","Javier Ballesteros-Paredes","Javier Ballesteros-Paredes (1), Adriana Gazol (1), Jongsoo Kim (2),
  Ralf S. Klessen (3), Anne-Katharina Jappsen (3), and Epimenio Tejero (1).
  (1=Centro de Radioastronom\'ia y Astrof\'isica, UNAM, 2=Korea Astronomy and
  Space Science Institute, 3=Astrophysikalisches Institut Potsdam)","The Mass Spectra of Cores in Turbulent Molecular Clouds and Implications
  for the Initial Mass Function","21 pages, 8 figures. Accepted for publication in The Astrophysical
  Journal","Astrophys.J.637:384-391,2006","10.1086/498228",,"astro-ph",,"  We investigate the core mass distribution (CMD) resulting from numerical
models of turbulent fragmentation of molecular clouds. In particular we study
its dependence on the sonic root-mean-square Mach number $\Ms$. We analyze
simulations with $\Ms$ ranging from 1 to 15 to show that, as $\Ms$ increases,
the number of cores increases as well while their average mass decreases. This
stems from the fact that high-Mach number flows produce many and strong shocks
on intermediate to small spatial scales, leading to a highly-fragmented density
structure. We also show that the CMD from purely turbulent fragmentation does
not follow a single power-law, but it may be described by a function that
changes continuously its shape, probably more similar to a log-normal function.
The CMD in supersonic turbulent flows does not have a universal slope, and as
consequence, cast some doubt on attempts to directly relate the CMD to a
universal Initial Mass Function.
","[{""version"":""v1"",""created"":""Tue, 20 Sep 2005 18:18:19 GMT""}]","2008-11-26"
"astro-ph/0509592","Alexandre Arbey","A. Arbey","Unifying dark energy and dark matter with a scalar field","4 pages, 4 figures, to appear in the XXIst IAP Colloquium ""Mass
  Profiles and Shapes of Cosmological Structures"", Paris 4-9 July 2005, France,
  (Eds.) G. Mamon, F. Combes, C. Deffayet, B. Fort, EAS Publications Series","EAS Publ.Ser. 20 (2006) 257-260","10.1051/eas:2006080",,"astro-ph",,"  The standard model of cosmology considers the existence of two components of
unknown nature, ``dark matter'' and ``dark energy'', which determine the
cosmological evolution. Their nature remains unknown, and other models can also
be considered. In particular, it may be possible to reinterpret the recent
cosmological observations so that the Universe does not contain two fluids of
unknown natures, but only one fluid with particular properties. After a brief
review of constraints on this unifying ``dark fluid'', we will discuss a
specific model of dark fluid based on a complex scalar fluid.
","[{""version"":""v1"",""created"":""Tue, 20 Sep 2005 18:23:35 GMT""}]","2007-05-23"
"astro-ph/0509593","Ummi Abbas","Ummi Abbas (1), Ravi K. Sheth (2) ((1) U. Pittsburgh, (2) U.
  Pennsylvania)","The environmental dependence of clustering in hierarchical models","11 pages, 6 figures, MNRAS in press","Mon.Not.Roy.Astron.Soc.364:1327-1336,2005","10.1111/j.1365-2966.2005.09654.x",,"astro-ph",,"  In hierarchical models, density fluctuations on different scales are
correlated. This induces correlations between dark halo masses, their formation
histories, and their larger-scale environments. In turn, this produces a
correlation between galaxy properties and environment. This correlation is
entirely statistical in nature. We show how the observed clustering of galaxies
can be used to quantify the importance of this statistical correlation relative
to other physical effects which may also give rise to correlations between the
properties of galaxies and their surroundings. We also develop a halo model
description of this environmental dependence of clustering.
","[{""version"":""v1"",""created"":""Tue, 20 Sep 2005 19:11:55 GMT""}]","2009-11-13"
"astro-ph/0509594","Sarah A. Yost","S. A. Yost, K. Alatalo, E. S. Rykoff, F. Aharonian, C. W. Akerlof, M.
  C. B. Ashley, C. H. Blake, J. S. Bloom, M. Boettcher, E. E. Falco, E. Gogus,
  T. Guver, J. P. Halpern, D. Horns, M. Joshi, U. Kiziloglu, T. A. McKay, N.
  Mirabal, M. Ozel, A. Phillips, R. M. Quimby, W. Rujopakarn, B. E. Schaefer,
  J. C. Shields, M. Skrutskie, D. A. Smith, D. L. Starr, H. F. Swan, A.
  Szentgyorgi, W. T. Vestrand, J. C. Wheeler, and J. Wren","Optical Lightcurve & Cooling Break of GRB 050502A","22 pages, including 3 tables and 1 figure, Accepted by ApJ","Astrophys.J.636:959-966,2006","10.1086/498134",,"astro-ph",,"  We present lightcurves of the afterglow of GRB050502A, including very early
data at t-t_{GRB} < 60s. The lightcurve is composed of unfiltered ROTSE-IIIb
optical observations from 44s to 6h post-burst, R-band MDM observations from
1.6 to 8.4h post-burst, and PAIRITEL J H K_s observations from 0.6 to 2.6h
post-burst. The optical lightcurve is fit by a broken power law, where
t^{alpha} steepens from alpha = -1.13 +- 0.02 to alpha = -1.44 +- 0.02 at
\~5700s. This steepening is consistent with the evolution expected for the
passage of the cooling frequency nu_c through the optical band. Even in our
earliest observation at 44s post-burst, there is no evidence that the optical
flux is brighter than a backward extrapolation of the later power law would
suggest. The observed decay indices and spectral index are consistent with
either an ISM or a Wind fireball model, but slightly favor the ISM
interpretation. The expected spectral index in the ISM interpretation is
consistent within 1 sigma with the observed spectral index beta = -0.8 +- 0.1;
the Wind interpretation would imply a slightly (~2 sigma) shallower spectral
index than observed. A small amount of dust extinction at the source redshift
could steepen an intrinsic spectrum sufficiently to account for the observed
value of beta. In this picture, the early optical decay, with the peak at or
below 4.7e14 Hz at 44s, requires very small electron and magnetic energy
partitions from the fireball.
","[{""version"":""v1"",""created"":""Tue, 20 Sep 2005 19:27:28 GMT""}]","2009-11-13"
"astro-ph/0509595","Edward Lu","Edward T. Lu, Stanley G. Love","A Gravitational Tractor for Towing Asteroids","4 pages, 1 figure - to be published in Nature",,"10.1038/438177a",,"astro-ph",,"  We present a concept for a spacecraft that can controllably alter the
trajectory of an Earth threatening asteroid using gravity as a towline. The
spacecraft hovers near the asteroid with thrusters angled outward so the
exhaust does not impinge on the surface. This deflection method is insensitive
to the structure, surface properties, and rotation state of the asteroid.
","[{""version"":""v1"",""created"":""Tue, 20 Sep 2005 19:42:55 GMT""}]","2015-06-24"
"astro-ph/0509596","Pavel Ivanov","J. C. B. Papaloizou, P. B. Ivanov","Oscillations of rotating bodies: A self-adjoint formalism applied to
  dynamic tides and tidal capture","minor changes in proofs, to be published in MNRAS Letters","Mon.Not.Roy.Astron.Soc.Lett.364:L66-L70,2005","10.1111/j.1745-3933.2005.00107.x",,"astro-ph",,"  We consider the excitation of the inertial modes of a uniformly rotating
fully convective body due to a close encounter with another object. This could
lead to a tidal capture or orbital circularisation depending on whether the
initial orbit is unbound or highly eccentric. We develop a general self-adjoint
formalism for the response problem and thus solve it taking into account the
inertial modes with $m=2$ for a full polytrope with $n=1.5.$ We are accordingly
able to show in this case that the excitation of inertial modes dominates the
response for large impact parameters and thus cannot be neglected in
calculations of tidal energy and angular momentum exchange or orbital
circularisation from large eccentricity.
","[{""version"":""v1"",""created"":""Tue, 20 Sep 2005 19:47:57 GMT""},{""version"":""v2"",""created"":""Tue, 18 Oct 2005 15:08:41 GMT""}]","2009-11-13"
"astro-ph/0509597","Vitor Souza FILHO","Vitor de Souza, Gustavo Medina-Tanco, Jeferson A. Ortiz","Acceptance of fluorescence detectors and its implication in energy
  spectrum inference at the highest energies",,"Phys.Rev.D72:103009,2005","10.1103/PhysRevD.72.103009",,"astro-ph",,"  Along the years HiRes and AGASA experiments have explored the fluorescence
and the ground array experimental techniques to measure extensive air showers,
being both essential to investigate the ultra-high energy cosmic rays. However,
such Collaborations have published contradictory energy spectra for energies
above the GZK cut-off. In this article, we investigate the acceptance of
fluorescence telescopes to different primary particles at the highest energies.
Using CORSIKA and CONEX shower simulations without and with the new
pre-showering scheme, which allows photons to interact in the Earth magnetic
field, we estimate the aperture of the HiRes-I telescope for gammas, iron
nuclei and protons primaries as a function of the number of simulated events
and primary energy. We also investigate the possibility that systematic
differences in shower development for hadrons and gammas could mask or distort
vital features of the cosmic ray energy spectrum at energies above the
photo-pion production threshold. The impact of these effects on the true
acceptance of a fluorescence detector is analyzed in the context of top-down
production models.
","[{""version"":""v1"",""created"":""Tue, 20 Sep 2005 19:53:57 GMT""}]","2008-12-18"
"astro-ph/0509598","A. V. Maccio'","Andrea V. Maccio', Marco Miranda (University of Zurich)","The effect of low mass substructures on the Cusp lensing relation","10 pages, 19 figures, Effects of different subhalos concentrations
  discussed, analysis improved, accepted by MNRAS","Mon.Not.Roy.Astron.Soc.368:599-608,2006","10.1111/j.1365-2966.2006.10154.x",,"astro-ph",,"  It has been argued that the flux anomalies detected in gravitationally lensed
QSOs are evidence for substructures in the foreground lensing haloes. In this
paper we investigate this issue in greater detail focusing on the Cusp relation
which corresponds to images of a source located to the cusp of the inner
caustic curve. We use numerical simulations combined with a Monte Carlo
approach to study the effects of the expected power law distribution of
substructures within LCDM haloes on the multiple images.
  Generally, the high number of anomalous flux ratios in the cusp
configurations is unlikely explained by 'simple' perturbers (subhaloes) inside
the lensing galaxy, either modeled by point masses or extended NFW subhaloes.
We considered in our analysis a mass range of 10^5-10^7 Msun for the subhaloes.
We also demonstrate that including the effects of the surrounding mass
distribution, such as other galaxies close to the primary lens, does not change
the results. We conclude that triple images of lensed QSOs do not show any
direct evidence for dark dwarf galaxies such as cold dark matter substructure.
","[{""version"":""v1"",""created"":""Tue, 20 Sep 2005 20:00:20 GMT""},{""version"":""v2"",""created"":""Fri, 27 Jan 2006 10:54:14 GMT""}]","2009-11-11"
"astro-ph/0509599","Steven Diehl","Steven Diehl (Ohio University), Thomas S. Statler (Ohio University)","A Fundamental Plane Relation for the X-Ray Gas in Normal Elliptical
  Galaxies","Astrophysical Journal Letters, accepted","Astrophys.J.633:L21-L24,2005","10.1086/498135",,"astro-ph",,"  We report on the discovery of a new correlation between global parameters of
the hot interstellar gas in elliptical galaxies. We reanalyze archival Chandra
data for 30 normal early-type systems, removing the contributions of resolved
and unresolved point sources to reveal the X-ray morphology of the hot gas. We
determine the half-light radius, R_X, and the mean surface brightness, I_X,
from the gas surface brightness profiles. A spectral analysis determines the
temperature, T_X, of the gas within 3 optical effective radii. We find that the
galaxies lie on an X-ray Gas Fundamental Plane (XGFP) of the form T_X ~
R_X^{0.28} I_X^{0.22}. This is close to, but distinct from, a simple
luminosity-temperature relation. The intrinsic width of the XGFP is only
0.07dex, nearly identical to that of the stellar (optical) fundamental plane
(SFP). This is surprising since X-ray gas masses are typically ~10^{-2} of the
stellar masses. We show that the XGFP is not a simple consequence of the virial
theorem or hydrostatic equilibrium, and that it is essentially independent of
the SFP. The XGFP thus represents a genuinely new constraint on the
hydrodynamical evolution of elliptical galaxies.
","[{""version"":""v1"",""created"":""Tue, 20 Sep 2005 20:01:17 GMT""}]","2009-11-13"
"astro-ph/0509600","Jon Paul Willis","J.P. Willis, F. Courbin, J-P. Kneib, D. Minniti","ZEN and the search for high-redshift galaxies","To appear in proceedings of UC Irvine May 2005 workshop on ""First
  Light & Reionization"", eds. E. Barton & A. Cooray, New Astronomy Reviews, in
  press","New Astron.Rev. 50 (2006) 70-74",,,"astro-ph",,"  We present the ZEN (z equals nine) survey: a deep, narrow J-band search for
proto-galactic Lya emission at redshifts z=9. In the first phase of the survey,
dubbed ZEN1, we combine an exceptionally deep image of the Hubble Deep Field
South, obtained using a narrow band filter centred on the wavelength 1.187
microns, with existing deep, broad band images covering optical to near
infrared wavelengths. Candidate z=9 Lya-emitting galaxies display a significant
narrow band excess relative to the Js-band that are undetected at optical
wavelengths. We detect no sources consistent with this criterion to the 90%
point source flux limit of the NB image, F_NB = 3.28e-18 ergs/s/cm2. The survey
selection function indicates that we have sampled a volume of approximately 340
h^{-3} Mpc3 to a Lya emission luminosity of 10e43 h^{-2} ergs/s. When compared
to the predicted properties of z=9 galaxies based upon no evolution of observed
z=6 Lya-emitting galaxies, the `volume shortfall' of the current survey, i.e.
the volume required to detect this putative population, is a factor of at least
8 to 10. We also discuss continuing narrow J-band imaging surveys that will
reduce the volume shortfall factor to the point where the no-evolution
prediction from z=6 is probed in a meaningful manner.
","[{""version"":""v1"",""created"":""Tue, 20 Sep 2005 20:06:20 GMT""}]","2007-05-23"
"astro-ph/0509601","Ken-Ichi Nishikawa","K.-I. Nishikawa (NSSTC), Y. Mizuno (NRC/MSFC), S. Fuerst (MSSL), K. Wu
  (MSSL), P. Hardee (UA), G. Richardson (UAH), S. Koide (Toyama U.), K. Shibata
  (Kyoto U.), T. Kudoh (NAOJ), G. J. Fishman (NASA/MSFC, NSSTC)","3-D GRMHD Simulations of Disk-Jet Coupling and Emission","4 pages, 1 figure, Proceedings for Astrophysical Sources of High
  Energy Particles and Radiation, AIP proceeding Series, eds . T. Bulik, G.
  Madejski and B. Rudak","AIP Conf.Proc.801:184,2005","10.1063/1.2141858",,"astro-ph",,"  We have performed a fully three-dimensional general relativistic
magnetohydrodynamic (GRMHD) simulation of jet formation from a thin accretion
disk around a Schwarzschild black hole with a free-falling corona. The initial
simulation results show that a bipolar jet (velocity nearly 0.3c) is created as
shown by previous two-dimensional axisymmetric simulations with mirror symmetry
at the equator. The 3-D simulation ran over one hundred light-crossing time
units which is considerably longer than the previous simulations. We show that
the jet is initially formed as predicted due in part to magnetic pressure from
the twisting the initially uniform magnetic field and from gas pressure
associated with shock formation in the region around r = 3r_S. At later times,
the accretion disk becomes thick and the jet fades resulting in a wind that is
ejected from the surface of the thickened (torus-like) disk. It should be noted
that no streaming matter from a donor is included at the outer boundary in the
simulation (an isolated black hole not binary black hole). The wind flows
outwards with a wider angle than the initial jet. The widening of the jet is
consistent with the outward moving torsional Alfven waves (TAWs). This
evolution of disk-jet coupling suggests that the jet fades with a thickened
accretion disk due to the lack of streaming material from an accompanying star.
","[{""version"":""v1"",""created"":""Tue, 20 Sep 2005 20:13:28 GMT""}]","2016-08-30"
"astro-ph/0509602","Alberto Buzzoni","Alberto Buzzoni (INAF Osservatorio Astronomico di Bologna, Italy)","Photometric entropy of stellar populations and related diagnostic tools","13 pages and 9 figures. An invited contribution to ""Resolved Stellar
  Populations"", Cancun (Mexico) Apr 2005. To appear on the proceedings of the
  conference edited by D. Valls-Gabaud & M. Chavez, ASP Conf. Ser. (ASP: San
  Francisco). See http://www.bo.astro.it/~eps/home.html for more info and model
  retrieval",,,,"astro-ph",,"  We discuss, from a statistical point of view, some leading issues that deal
with the study of stellar populations in fully or partially unresolved
aggregates, like globular clusters and distant galaxies. A confident assessment
of the effective number and luminosity of stellar contributors can provide, in
this regard, a very useful interpretative tool to properly assess the
observational bias coming from crowding conditions or surface brightness
fluctuations. These arguments have led us to introduce a new concept of
""photometric entropy"" of a stellar population, whose impact on different
astrophysical aspects of cluster diagnostic has been reviewed here.
","[{""version"":""v1"",""created"":""Tue, 20 Sep 2005 20:15:57 GMT""}]","2007-05-23"
"astro-ph/0509603","Ken-Ichi Nishikawa","K.-I. Nishikawa (NSSTC), P. Hardee (UA), C. B. Hededal (Niels Bohr
  Institute), G. Richardson (UAH), R. Preece (UAH), H. Sol (Observatore de
  Paris-Meudon), G. J. Fishman (NASA/MSFC), C. Kouvelioutou (NASA/MSFC), Y.
  Mizuno (NRC/MSFC)","Particle acceleration in electron-ion jets","2 pages, 1 figure, Proceedings for Astrophysical Sources of High
  Energy Particles and Radiation, AIP proceeding Series, eds . T. Bulik, G.
  Madejski and B. Rudak","AIP Conf.Proc.801:389,2005","10.1063/1.2141908",,"astro-ph",,"  Weibel instability created in collisionless shocks is responsible for
particle (electron, positron, and ion) acceleration. Using a 3-D relativistic
electromagnetic particle (REMP) code, we have investigated particle
acceleration associated with a relativistic electron-ion jet fronts propagating
into an ambient plasma without initial magnetic fields with a longer simulation
system in order to investigate nonlinear stage of the Weibel instability and
its acceleration mechanism. The current channels generated by the Weibel
instability induce the radial electric fields. The z component of the Poynting
vector (E x B) become positive in the large region along the jet propagation
direction. This leads to the acceleration of jet electrons along the jet. In
particular the E x B drift with the large scale current channel generated by
the ion Weibel instability accelerate electrons effectively in both parallel
and perpendicular directions.
","[{""version"":""v1"",""created"":""Tue, 20 Sep 2005 20:20:27 GMT""}]","2009-11-13"
"astro-ph/0509604","Nicola Brassington","N. J. Brassington (1), A. M. Read (2), T. J. Ponman (1) ((1)
  University of Birmingham, (2) University of Leicester)","The X-ray Evolution of Merging Galaxies","4 pages, 1 figure, to appear in the Proceedings of the IAU Symposium
  No. 230",,"10.1017/S1743921306008064",,"astro-ph",,"  From a Chandra survey of nine interacting galaxy systems the evolution of
X-ray emission during the merger process has been investigated. From comparing
Lx/Lk and Lfir/Lb it is found that the X-ray luminosity peaks around 300 Myr
before nuclear coalescence, even though we know that rapid and increasing star
formation is still taking place at this time. It is likely that this drop in
X-ray luminosity is a consequence of outflows breaking out of the galactic
discs of these systems. At a time around 1 Gyr after coalescence, the
merger-remnants in our sample are X-ray dim when compared to typical X-ray
luminosities of mature elliptical galaxies. However, we do see evidence that
these systems will start to resemble typical elliptical galaxies at a greater
dynamical age, given the properties of the 3 Gyr system within our sample,
indicating that halo regeneration will take place within low Lx
merger-remnants.
","[{""version"":""v1"",""created"":""Tue, 20 Sep 2005 20:28:28 GMT""}]","2009-11-11"
"astro-ph/0509605","Nino Panagia","N. Panagia (1), S.M. Fall (2), B. Mobasher (1), M. Dickinson (3), H.C.
  Ferguson (2), M. Giavalisco (2), D. Stern (4), T. Wiklind (1) ((1) ESA/STScI,
  (2) STScI, (3) NOAO/Tucson, (4) JPL)","Direct evidence for an early reionization of the Universe?","6 pages, 2 figures. Accepted for publication in ApJ Letters","Astrophys.J.633:L1-L4,2005","10.1086/498094","STScI Eprint #1688","astro-ph",,"  We examine the possible reionization of the intergalactic medium (IGM) by the
source UDF033238.7-274839.8 (hereafter HUDF-JD2), which was discovered in deep
{\it HST}/VLT/{\it Spitzer} images obtained as part of the Great Observatory
Origins Deep Survey and {\it Hubble} Ultra-Deep Field projects. Mobasher et al
(2005) have identified HUDF-JD2 as a massive ($\sim6\times10^{11}M_\odot$)
post-starburst galaxy at redshift z$\gtrsim6.5$. We find that HUDF-JD2 may be
capable of reionizing its surrounding region of the Universe, starting the
process at a redshift as high as z$\approx 15 \pm5$.
","[{""version"":""v1"",""created"":""Tue, 20 Sep 2005 20:30:24 GMT""}]","2016-08-30"
