"hep-ph/0509270","Leszek Motyka","Leszek Motyka","Nonlinear evolution of pomeron and odderon in momentum space","12+1 pages, 2 eps figures","Phys.Lett.B637:185-191,2006","10.1016/j.physletb.2006.04.039",,"hep-ph",,"  The small x evolution of the QCD pomeron and the QCD odderon is investigated
in the mean field limit of the Color Glass Condensate. The resulting system of
coupled nonlinear evolution equations is transformed to the momentum space and
analyzed at a very small momentum transfer. The main properties of the C-even
and C-odd dipole densities in momentum space are obtained analytically. The
critical scaling dimension is found for the odderon and the universal
asymptotic behavior of the solutions is determined for small and large gluon
momenta. We find that the same saturation scale characterizes both the pomeron
and the odderon and both densities depend on the momentum only through the
geometric scaling variable. The absorptive effects are found to cause a strong
suppression of the odderon exchange amplitude for momenta below saturation
scale and only a moderate suppression for larger momenta.
","[{""version"":""v1"",""created"":""Fri, 23 Sep 2005 23:29:17 GMT""}]","2008-11-26"
"hep-ph/0509271","Giulia Ricciardi","Ugo Aglietti, Giulia Ricciardi, Giancarlo Ferrera","Threshold resummed spectra in B ->Xu l nu decays in NLO (III)","24 pages, no figures. Improved discussion on the BLM scheme","Phys.Rev.D74:034006,2006","10.1103/PhysRevD.74.034006","ROME1/1415/05, DSFNA1/35/2005","hep-ph",,"  We resum to next-to-leading order (NLO) the distribution in the light-cone
momentum p+ = EX - |pX| and the spectrum in the electron energy, in the
semileptonic decays B-> Xu l nu, where EX and pX are the total energy and
three-momentum of the final hadron state Xu respectively. By expanding our
formulas, we obtain the coefficients of all the infrared logarithms alpha^n L^k
at order alpha^2 and at order alpha^3, with the exception of the alpha^3 L
coefficient. We explicitly show that the relation between these semileptonic
spectra and the hadron mass distribution in the radiative decay B -> Xs gamma
is not a purely short distance one. By expanding our result for the p+
distribution and comparing it with the recent O(alpha^2 n_f) computation, we
obtain an explicit and non trivial verification of our resummation scheme at
the two-loop level. We also discuss the validity of the so-called
Brodsky-Lepage-Mackenzie (BLM) scheme in the evaluation of the semileptonic
spectra by comparing it with our results, finding that it is a reasonable
approximation for the leading terms only. Finally, we show that long-distance
phenomena, such as Fermi motion, are expected to have an effect on the electron
spectrum smaller than on the hadron mass distribution.
","[{""version"":""v1"",""created"":""Sat, 24 Sep 2005 11:07:35 GMT""},{""version"":""v2"",""created"":""Wed, 2 Aug 2006 06:17:18 GMT""}]","2008-11-26"
"hep-th/0509184","Sergei Winitzki","Jaume Garriga, Delia Schwartz-Perlov, Alexander Vilenkin, and Sergei
  Winitzki","Probabilities in the inflationary multiverse","18 pages, RevTeX 4, 2 figures. Discussion of the full probability in
  Sec.VI is sharpened; the conclusions are strengthened. Note added explaining
  the relation to recent work by Easther, Lim and Martin. Some references added","JCAP 0601:017,2006","10.1088/1475-7516/2006/01/017",,"hep-th astro-ph gr-qc",,"  Inflationary cosmology leads to the picture of a ""multiverse,"" involving an
infinite number of (spatially infinite) post-inflationary thermalized regions,
called pocket universes. In the context of theories with many vacua, such as
the landscape of string theory, the effective constants of Nature are
randomized by quantum processes during inflation. We discuss an analytic
estimate for the volume distribution of the constants within each pocket
universe. This is based on the conjecture that the field distribution is
approximately ergodic in the diffusion regime, when the dynamics of the fields
is dominated by quantum fluctuations (rather than by the classical drift). We
then propose a method for determining the relative abundances of different
types of pocket universes. Both ingredients are combined into an expression for
the distribution of the constants in pocket universes of all types.
","[{""version"":""v1"",""created"":""Fri, 23 Sep 2005 19:45:19 GMT""},{""version"":""v2"",""created"":""Sun, 2 Oct 2005 01:44:38 GMT""},{""version"":""v3"",""created"":""Sun, 27 Nov 2005 17:45:38 GMT""}]","2011-05-05"
"hep-th/0509185","Osvaldo Chandia","Osvaldo Chandia","D=4 Pure Spinor Superstring and N=2 Strings","Reference added and minor corrections","JHEP0510:105,2005","10.1088/1126-6708/2005/10/105",,"hep-th",,"  We study the compactification of the pure spinor superstring down to four
dimensions. We find that the compactified string is described by a conformal
invariant system for both the four dimensional and for the compact six
dimensional variables. The four dimensional sector is found to be invariant
under a non-critical N=2 superconformal transformations.
","[{""version"":""v1"",""created"":""Fri, 23 Sep 2005 20:41:56 GMT""},{""version"":""v2"",""created"":""Wed, 28 Sep 2005 15:08:01 GMT""}]","2009-11-11"
"hep-th/0509186","Istvan Nandori","U. D. Jentschura, I. Nandori and J. Zinn-Justin","Effective Action and Phase Structure of Multi-Layer Sine-Gordon Type
  Models","15 pages","Ann.Phys.(N.Y.) 321 (2006) 2647-2659","10.1016/j.aop.2006.01.005",,"hep-th",,"  We analyze the effective action and the phase structure of N-layer
sine-Gordon type models, generalizing the results obtained for the two-layer
sine-Gordon model found in [I. Nandori, S. Nagy, K. Sailer and U. D.
Jentschura, Nucl. Phys. B725, 467-492 (2005)]. Besides the obvious field
theoretical interest, the layered sine-Gordon model has been used to describe
the vortex properties of high transition temperature superconductors, and the
extension of the previous analysis to a general N-layer model is necessary for
a description of the critical behaviour of vortices in realistic multi-layer
systems. The distinction of the Lagrangians in terms of mass eigenvalues is
found to be the decisive parameter with respect to the phase structure of the
N-layer models, with neighbouring layers being coupled by quadratic terms in
the field variables. By a suitable rotation of the field variables, we identify
the periodic modes (without explicit mass terms) in the N-layer structure,
calculate the effective action and determine their Kosterlitz-Thouless type
phase transitions to occur at a coupling parameter \beta^2_{c} = 8 N \pi, where
N is the number of layers (or flavours in terms of the multi-flavour Schwinger
model).
","[{""version"":""v1"",""created"":""Sat, 24 Sep 2005 08:29:32 GMT""},{""version"":""v2"",""created"":""Mon, 20 Feb 2006 10:54:26 GMT""}]","2013-09-11"
"math-ph/0509054","Stefan Waldmann","Stefan Waldmann","The Covariant Picard Groupoid in Differential Geometry","12 pages, LaTeX2e. Talk given at the 20th International Workshop on
  Differential Geometric Methods in Theoretical Mechanics in Ghent, August 2005",,,"FR-THEP 2005/10","math-ph math.MP math.QA",,"  In this article we discuss some general results on the covariant Picard
groupoid in the context of differential geometry and interpret the problem of
lifting Lie algebra actions to line bundles in the Picard groupoid approach.
","[{""version"":""v1"",""created"":""Fri, 23 Sep 2005 16:15:41 GMT""}]","2007-05-23"
"math/0509562","Dimitry Leites","Pavel Grozman","Invariant bilinear differential operators","49 pages, LaTeX","Communications in Mathematics, vol 30 (2023) no 3, 129--188",,,"math.RT","http://creativecommons.org/licenses/by/4.0/","  I classified bilinear differential operators acting in the spaces of tensor
fields on any real or complex manifold and invariant with respect to the
diffeomorphisms in 1980. Here I give the details of the proof.
","[{""version"":""v1"",""created"":""Fri, 23 Sep 2005 16:05:19 GMT""},{""version"":""v2"",""created"":""Fri, 20 Jan 2023 11:49:10 GMT""}]","2023-01-23"
"math/0509563","Paul Bressler","Paul Bressler","The first Pontryagin class","The present paper supercedes the earlier notes ``Vertex algebroids I
  and II combining their contents and correcting the errors",,,,"math.AT math.AG",,"  We give a natural obstruction theoretic interpretation to the first
Pontryagin class in terms of Courant algebroids. As an application we calculate
the class of the stack of algebras of chiral differential operators. In
particular, we establish the existence and uniqueness of the chiral de Rham
complex.
","[{""version"":""v1"",""created"":""Fri, 23 Sep 2005 16:17:48 GMT""},{""version"":""v2"",""created"":""Wed, 25 Oct 2006 00:51:20 GMT""}]","2007-05-23"
"math/0509564","Carl Yerger Jr.","Nathaniel G. Watson, Carl R. Yerger","Domination Cover Pebbling: Structural Results","15 pages",,,,"math.CO",,"  This paper continues the results of ""Domination Cover Pebbling: Graph
Families."" An almost sharp bound for the domination cover pebbling (DCP) number
for graphs G with specified diameter has been computed. For graphs of diameter
two, a bound for the ratio between the cover pebbling number of G and the DCP
number of G has been computed. A variant of domination cover pebbling, called
subversion DCP is introducted, and preliminary results are discussed.
","[{""version"":""v1"",""created"":""Fri, 23 Sep 2005 16:23:33 GMT""}]","2007-05-23"
"math/0509565","Khaled Qazaqzeh","Khaled Qazaqzeh","Integral Bases for Certain TQFT-Modules of the Torus","16 pages",,,,"math.GT",,"  We find two bases for the lattices of the SU(2)-TQFT-theory modules of the
torus over given rings of integers. We use variant of the bases defined in
[GMW]for the lattices of the SO(3)-TQFT-theory modules of the torus. Moreover,
we discuss the quantization functors (V_{p},Z_{p}) for p=1, and p=2. Then we
give concrete bases for the lattices of the modules in the 2-theory. We use the
above results to discuss the ideal invariant defined in [FK]. The ideal can be
computed for all 3-manifolds using the 2-theory, and all 3-manifolds with torus
boundary using the SU(2)-TQFT-theory. In fact, we show that this ideal in the
SU(2)-TQFT-theory is contained in the product of the ideals in the 2-theory and
the SO(3)-TQFT-theory under a certain change of cofficients, and it is equal in
the case of a torus boundary.
","[{""version"":""v1"",""created"":""Fri, 23 Sep 2005 16:24:38 GMT""}]","2007-05-23"
"math/0509566","Vladimir Dokchitser","Thanasis Bouganis and Vladimir Dokchitser","Algebraicity of L-values for elliptic curves in a false Tate curve tower","12 pages","Math. Proc. Camb. Phil. Soc. 142 (2007) 193-204","10.1017/S030500410600987X",,"math.NT",,"  Let $E$ be an elliptic curve over $Q$, and $\tau$ an Artin representation
over $Q$ that factors through the non-abelian extension
$Q(\sqrt[p^n]{m},\mu_{p^n})/Q$, where $p$ is an odd prime and $n,m$ are
positive integers. We show that $L(E,\tau,1)$, the special value at $s=1$ of
the $L$-function of the twist of $E$ by $\tau$, divided by the classical
transcendental period $\Omega_{+}^{d^+}|\Omega_{-}^{d^-}|\epsilon(\tau)$ is
algebraic and Galois-equivariant, as predicted by Deligne's conjecture.
","[{""version"":""v1"",""created"":""Fri, 23 Sep 2005 17:19:43 GMT""}]","2016-07-06"
"math/0509567","Paul Hacking","Paul Hacking","The moduli space of curves is rigid","11 pages. v2: Proof rewritten to avoid use of log structures. Example
  of nonrigid moduli space of surfaces added","Algebra and Number Theory 2 (2008), no. 7, 809--818",,,"math.AG","http://arxiv.org/licenses/nonexclusive-distrib/1.0/","  We prove that the moduli stack of stable curves of genus g with n marked
points is rigid, i.e., has no infinitesimal deformations. This confirms the
first case of a principle proposed by Kapranov. It can also be viewed as a
version of Mostow rigidity for the mapping class group.
","[{""version"":""v1"",""created"":""Fri, 23 Sep 2005 18:03:26 GMT""},{""version"":""v2"",""created"":""Thu, 28 Aug 2008 18:36:08 GMT""}]","2010-03-16"
"math/0509568","Gregory Lupton","Martin Arkowitz and Gregory Lupton","Homotopy Actions, Cyclic Maps and their Duals","16 pages, LaTeX 2e","Homology, Homotopy and Applications, vol 7(1) (2005), 169-184",,,"math.AT",,"  An action of A on X is a map F: AxX to X such that F|_X = id: X to X. The
restriction F|_A: A to X of an action is called a cyclic map. Special cases of
these notions include group actions and the Gottlieb groups of a space, each of
which has been studied extensively. We prove some general results about actions
and their Eckmann-Hilton duals. For instance, we classify the actions on an
H-space that are compatible with the H-structure. As a corollary, we prove that
if any two actions F and F' of A on X have cyclic maps f and f' with Omega(f) =
Omega(f'), then Omega(F) and Omega(F') give the same action of Omega(A) on
Omega(X). We introduce a new notion of the category of a map g and prove that g
is cocyclic if and only if the category is less than or equal to 1. From this
we conclude that if g is cocyclic, then the Berstein-Ganea category of g is <=
1. We also briefly discuss the relationship between a map being cyclic and its
cocategory being <= 1.
","[{""version"":""v1"",""created"":""Fri, 23 Sep 2005 19:05:00 GMT""}]","2007-05-23"
"math/0509569","Giovanni Peccati","Giovanni Peccati (LSTA), Jean-Renaud Pycke (DP)","Decompositions of stochastic processes based on irreductible group
  representations","27 pages",,,,"math.PR",,"  Let G be a topological compact group acting on some space Y. We study a
decomposition of Y-indexed stochastic processes, based on the orthogonality
relations between the characters of the irreducible representations of G. In
the particular case of a Gaussian process with a G-invariant law, such a
decomposition gives a very general explanation of a classic identity in law -
between quadratic functionals of a Brownian bridge - due to Watson (1961).
Several relations with Karhunen-Lo\`{e}ve expansions are discussed, and some
applications and extensions are given - in particular related to Gaussian
processes indexed by a torus.
","[{""version"":""v1"",""created"":""Fri, 23 Sep 2005 19:19:40 GMT""}]","2007-05-23"
"math/0509570","Lars Winther Christensen","Lars Winther Christensen and Henrik Holm","Ascent Properties of Auslander Categories","Minor corrections; example added; 30 pp. To appear in Canad. J. Math.
  Also available from authors' homepages
  http://www.math.unl.edu/~lchristensen3/publications.html and
  http://home.imf.au.dk/holm/publications.html",,,,"math.AC",,"  Let R be a homomorphic image of a Gorenstein local ring. Recent work has
shown that there is a bridge between Auslander categories and modules of finite
Gorenstein homological dimensions over R.
  We use Gorenstein dimensions to prove new results about Auslander categories
and vice versa. For example, we establish base change relations between the
Auslander categories of the source and target rings in a homomorphism R -> S of
finite flat dimension.
","[{""version"":""v1"",""created"":""Fri, 23 Sep 2005 19:25:07 GMT""},{""version"":""v2"",""created"":""Thu, 16 Feb 2006 20:27:09 GMT""}]","2007-05-23"
"math/0509571","Spyros Alexakis","Spyros Alexakis","On the decomposition of global conformal invariants I","65 pages, final version, to appear in Annals of Mathematics",,,,"math.DG",,"  This is the first of two papers where we address and partially confirm a
conjecture of Deser and Schwimmer, originally postulated in high energy
physics.
  The objects of study are scalar Riemannian quantities constructed out of the
curvature and its covariant derivatives, whose integrals over compact manifolds
are invariant under conformal changes of the underlying metric. Our main
conclusion is that each such quantity that locally depends only on the
curvature tensor (without covariant derivatives) can be written as a linear
combination of the Chern-Gauss-Bonnet integrand and a scalar conformal
invariant.
","[{""version"":""v1"",""created"":""Fri, 23 Sep 2005 19:40:56 GMT""},{""version"":""v2"",""created"":""Fri, 7 Oct 2005 03:04:08 GMT""},{""version"":""v3"",""created"":""Sun, 26 Mar 2006 03:00:50 GMT""}]","2016-09-07"
"math/0509572","Spyros Alexakis","Spyros Alexakis","On the decomposition of global conformal invariants II","35 pages, final version, to appear in Advances in Mathematics",,,,"math.DG",,"  This paper is a continuation of [2], where we complete our partial proof of
the Deser-Schwimmer conjecture on the structure of ``global conformal
invariants''. Our theorem deals with such invariants P(g^n) that locally depend
only on the curvature tensor R_{ijkl} (without covariant derivatives).
  In [2] we developed a powerful tool, the ``super divergence formula'' which
applies to any Riemannian operator that always integrates to zero on compact
manifolds. In particular, it applies to the operator I_{g^n}(\phi) that
measures the ``non-conformally invariant part'' of P(g^n). This paper resolves
the problem of using this information we have obtained on the structure of
I_{g^n}(\phi) to understand the structure of P(g^n).
","[{""version"":""v1"",""created"":""Fri, 23 Sep 2005 19:46:59 GMT""},{""version"":""v2"",""created"":""Fri, 7 Oct 2005 03:08:37 GMT""},{""version"":""v3"",""created"":""Sun, 26 Mar 2006 03:06:10 GMT""}]","2016-09-07"
"math/0509573","Hideo Takaoka","Carlos E. Kenig and Hideo Takaoka","Global wellposedness of the modified Benjamin-Ono equation with initial
  data in $H^{1/2}$",,,,,"math.AP",,"  We prove that the modified Benjamin-Ono equation is globally wellposed in
$H^s$ for $s\ge 1/2$.
","[{""version"":""v1"",""created"":""Fri, 23 Sep 2005 20:05:38 GMT""}]","2007-05-23"
"math/0509574","John Franks","John Franks, Michael Handel, Kamlesh Parwani","Fixed Points of abelian actions on $S^2$",,,,,"math.DS",,"  We prove that if $F$ is a finitely generated abelian group of orientation
preserving $C^1$ diffeomorphisms of $R^2$ which leaves invariant a compact set
then there is a common fixed point for all elements of $F.$ We also show that
if $F$ is any abelian subgroup of orientation preserving $C^1$ diffeomorphisms
of $S^2$ then there is a common fixed point for all elements of a subgroup of
$F$ with index at most two.
","[{""version"":""v1"",""created"":""Fri, 23 Sep 2005 20:11:40 GMT""},{""version"":""v2"",""created"":""Thu, 29 Dec 2005 18:30:44 GMT""}]","2007-05-23"
"math/0509575","Elchanan Mossel","Constantinos Daskalakis, Elchanan Mossel, Sebastien Roch","Evolutionary Trees and the Ising Model on the Bethe Lattice: a Proof of
  Steel's Conjecture","Second major revision. Updated proofs and statements",,,,"math.PR cs.CE cs.DS math.CA math.CO math.ST q-bio.PE stat.TH","http://arxiv.org/licenses/nonexclusive-distrib/1.0/","  A major task of evolutionary biology is the reconstruction of phylogenetic
trees from molecular data. The evolutionary model is given by a Markov chain on
a tree. Given samples from the leaves of the Markov chain, the goal is to
reconstruct the leaf-labelled tree.
  It is well known that in order to reconstruct a tree on $n$ leaves, sample
sequences of length $\Omega(\log n)$ are needed. It was conjectured by M. Steel
that for the CFN/Ising evolutionary model, if the mutation probability on all
edges of the tree is less than $p^{\ast} = (\sqrt{2}-1)/2^{3/2}$, then the tree
can be recovered from sequences of length $O(\log n)$. The value $p^{\ast}$ is
given by the transition point for the extremality of the free Gibbs measure for
the Ising model on the binary tree. Steel's conjecture was proven by the second
author in the special case where the tree is ""balanced."" The second author also
proved that if all edges have mutation probability larger than $p^{\ast}$ then
the length needed is $n^{\Omega(1)}$. Here we show that Steel's conjecture
holds true for general trees by giving a reconstruction algorithm that recovers
the tree from $O(\log n)$-length sequences when the mutation probabilities are
discretized and less than $p^\ast$. Our proof and results demonstrate that
extremality of the free Gibbs measure on the infinite binary tree, which has
been studied before in probability, statistical physics and computer science,
determines how distinguishable are Gibbs measures on finite binary trees.
","[{""version"":""v1"",""created"":""Fri, 23 Sep 2005 20:22:09 GMT""},{""version"":""v2"",""created"":""Wed, 6 Feb 2008 00:07:32 GMT""},{""version"":""v3"",""created"":""Tue, 28 Jul 2009 03:26:35 GMT""}]","2011-09-30"
"math/0509576","Elchanan Mossel","Elchanan Mossel and Sebastien Roch","Slow Emergence of Cooperation for Win-Stay Lose-Shift on Trees",,,,,"math.PR",,"  We consider a group of agents on a graph who repeatedly play the prisoner's
dilemma game against their neighbors. The players adapt their actions to the
past behavior of their opponents by applying the win-stay lose-shift strategy.
On a finite connected graph, it is easy to see that the system learns to
cooperate by converging to the all-cooperate state in a finite time. We analyze
the rate of convergence in terms of the size and structure of the graph. [Dyer
et al., 2002] showed that the system converges rapidly on the cycle, but that
it takes a time exponential in the size of the graph to converge to cooperation
on the complete graph. We show that the emergence of cooperation is
exponentially slow in some expander graphs. More surprisingly, we show that it
is also exponentially slow in bounded-degree trees, where many other dynamics
are known to converge rapidly.
","[{""version"":""v1"",""created"":""Fri, 23 Sep 2005 20:29:08 GMT""}]","2007-05-23"
"math/0509577","Frederick Cohen","F R Cohen, J Pakianathan","The stable braid group and the determinant of the Burau representation","This is the version published by Geometry & Topology Monographs on 29
  January 2007","Geom. Topol. Monogr. 10 (2007) 117-129","10.2140/gtm.2007.10.117",,"math.AT math.GR","http://arxiv.org/licenses/nonexclusive-distrib/1.0/","  This article gives certain fibre bundles associated to the braid groups which
are obtained from a translation as well as conjugation on the complex plane.
The local coefficient systems on the level of homology for these bundles are
given in terms of the determinant of the Burau representation.
  De Concini, Procesi, and Salvetti [Topology 40 (2001) 739--751] considered
the cohomology of the n-th braid group B_n with local coefficients obtained
from the determinant of the Burau representation, H^*(B_n;Q[t^{+/-1}]). They
show that these cohomology groups are given in terms of cyclotomic fields.
  This article gives the homology of the stable braid group with local
coefficients obtained from the determinant of the Burau representation. The
main result is an isomorphism
  H_*(B_infty; F[t^{+/-1}])-->H_*(Omega^2S^3<3>; F) for any field F where
Omega^2S^3<3> denotes the double loop space of the 3-connected cover of the
3-sphere. The methods are to translate the structure of H_*(B_n;F[t^{+/-1}]) to
one concerning the structure of the homology of certain function spaces where
the answer is computed.
","[{""version"":""v1"",""created"":""Sat, 24 Sep 2005 01:41:06 GMT""},{""version"":""v2"",""created"":""Wed, 25 Mar 2009 19:05:23 GMT""}]","2009-03-25"
"math/0509578","Maxim Braverman","Maxim Braverman and Thomas Kappeler","A Refinement of the Ray-Singer Torsion","6 pages, to apper in Comptes rendus Acad. Sci. Paris",,,,"math.DS math.GT",,"  This is a short version of math.DG/0505537. For an acyclic representation of
the fundamental group of a compact oriented odd-dimensional manifold, which is
close enough to a unitary representation, we define a refinement of the
Ray-Singer torsion associated to this representation. This new invariant can be
viewed as an analytic counterpart of the refined combinatorial torsion
introduced by Turaev.
  The refined analytic torsion is a holomorphic function of the representation
of the fundamental group. When the representation is unitary, the absolute
value of the refined analytic torsion is equal to the Ray-Singer torsion, while
its phase is determined by the eta-invariant. The fact that the Ray-Singer
torsion and the eta-invariant can be combined into one holomorphic function
allows to use methods of complex analysis to study both invariants.
","[{""version"":""v1"",""created"":""Sat, 24 Sep 2005 03:59:56 GMT""}]","2007-05-23"
"math/0509579","Shicheng Wang","Fan Ding, Shicheng Wang and Jiangang Yao","On embedding all $n$-manifolds into a single $(n+1)$-manifold","21 pages, 3 figures",,,,"math.GT math.AT",,"  For each composite number $n\ne 2^k$, there does not exist a single connected
closed $(n+1)$-manifold such that any smooth, simply-connected, closed
$n$-manifold can be topologically flat embedded into it. There is a single
connected closed 5-manifold $W$ such that any simply-connected, 4-manifold $M$
can be topologically flat embedded into $W$ if $M$ is either closed and
indefinite, or compact and with non-empty boundary.
","[{""version"":""v1"",""created"":""Sat, 24 Sep 2005 06:09:07 GMT""}]","2007-05-23"
"math/0509580","Alexander Zimmermann","Alexander Zimmermann (LAMFA)","Invariance of generalised Reynolds ideals under derived equivalences",,,,,"math.RA math.RT",,"  For any algebraically closed field $k$ of positive characteristic $p$ and any
non negative integer $n$ K\""ulshammer defined ideals $T\_nA^\perp$ of the
centre of a symmetric $k$-algebra $A$. We show that for derived equivalent
algebras $A$ and $B$ there is an isomorphism of the centres of $A$ and $B$
mapping $T\_nA^\perp$ to $T\_nB^\perp$ for all $n$. Recently H\'ethelyi,
Horv\'ath, K\""ulshammer and Murray showed that this holds for Morita equivalent
algebras.
","[{""version"":""v1"",""created"":""Sat, 24 Sep 2005 11:01:25 GMT""},{""version"":""v2"",""created"":""Wed, 29 Mar 2006 07:08:34 GMT""}]","2007-05-23"
