"astro-ph/0509796","Luca Zampieri","P. Mucciarelli, P. Casella, T. Belloni, L. Zampieri, P. Ranalli","A variable Quasi-Periodic Ocillation in M82 X-1. Timing and spectral
  analysis of XMM-Newton and RossiXTE observations","First submitted to MNRAS on April 28, 2005. In the process of being
  accepted for publication (minor revisions requested by the referee). 9 pages,
  7 figures of which 1 (Figure 5) as separate jpg file","Mon.Not.Roy.Astron.Soc.365:1123-1130,2006","10.1111/j.1365-2966.2005.09754.x",,"astro-ph",,"  We report results from a spectral and timing analysis of M82 X-1, one of the
brightest known ultraluminous X-ray sources. Data from a new 105 ks {\it
XMM-Newton} observation of M82 X-1, performed in April 2004, and of archival
{\it RossiXTE} observations are presented. A very soft thermal component is
present in the {\it XMM} spectrum. Although it is not possible to rule out a
residual contamination from the host galaxy, modelling it with a standard
accretion disk would imply a black hole mass of $\approx 10^3 M_{\odot}$. An
emission line was also detected at an energy typical for fluorescent Fe
emission. The power density spectrum of the {\it XMM} observation shows a
variable QPO at frequency of 113 mHz with properties similar to that discovered
by Strohmayer & Mushotzky (2003). The QPO was also found in 7 archival {\it
RXTE} observations, that include those analyzed by Strohmayer & Mushotzky
(2003) and Fiorito & Titarchuk (2004). A comparison of the properties of this
QPO with those of the various types of QPOs observed in Galactic black hole
candidates strongly suggests an association with the type-C, low frequency
QPOs. Scaling the frequency inversely to the black hole mass, the observed QPO
frequency range (from 50 to 166 mHz) would yield a black hole mass anywhere in
the interval few tens to 1000 $M_\odot$.
","[{""version"":""v1"",""created"":""Tue, 27 Sep 2005 09:04:07 GMT""}]","2009-11-13"
"astro-ph/0509797","Pawel Pietrukowicz","P. Pietrukowicz, J. Kaluzny, I.B. Thompson, M. Jaroszynski, A.
  Schwarzenberg-Czerny, W. Krzeminski, W. Pych","Cluster AgeS Experiment (CASE): Dwarf Novae and a Probable Microlensing
  Event in the Globular Cluster M22","12 pages, 8 figures, accepted for publication in Acta Astronomica",,,,"astro-ph",,"  We report the identification of a new cataclysmic variable (denoted as CV2)
and a probable microlensing event in the field of the globular cluster M22. Two
outbursts were observed for CV2. During one of them superhumps with
P_sh=0.08875 d were present in the light curve. CV2 has an X-ray counterpart
detected by XMM-Newton. A very likely microlensing event at a radius of 2.3
arcmin from the cluster center was detected. It had an amplitude of
Delta_V=0.75 mag and a characteristic time of 15.9 days. Based on model
considerations we show that the most likely configuration has the source in the
Galactic bulge with the lens in the cluster. Two outbursts were observed for
the already known dwarf nova CV1.
","[{""version"":""v1"",""created"":""Tue, 27 Sep 2005 09:12:55 GMT""}]","2007-05-23"
"astro-ph/0509798","Gilles Chabrier","G. Chabrier (1), I. Baraffe (1), F. Allard (1) and P.H. Hauschildt (2)
  ((1) Ecole Normale Superieure de Lyon, C.R.A.L. (2) Hamburger Sternwarte,
  Hamburg)","Review on low-mass stars and brown dwarfs","Invited review, ""Resolved Stellar Populations"", Cancun, april 2005",,,,"astro-ph",,"  In this review, we examine the successes and weaknesses of modern low-mass
star and brown dwarf theory.(1) We first focus on the mechanical (equation of
state) and thermal (atmosphere) properties and on the evolution. We then
examine the current shortcomings of the theory and we discuss recent
observational analysis which have suggested discrepancies between models and
observations.(2) We then examine the stellar and brown dwarf IMF and suggest
that a power-law above the average thermal Jeans mass (about 1 Msol) rolling
over a lognormal form below this limit adequately reproduces the observations
of field and young cluster stellar and brown dwarf distributions. This yields a
reasonably accurate estimate of the stellar and brown dwarf Galactic census.
Finally (3) we argue that the combination of turbulence driven fragmentation at
large scale and gravity at small scales provides an appealing solution for the
general star and brown dwarf formation mechanism. It also provides a physical
ground for the aforementioned power-law + lognormal form for the IMF, whereas a
series of different power laws lacks such a physical motivation. At last, we
argue that the deuterium-burning limit as the distinction between stars and
planets has no physical foundation in this modern star formation scheme.
Opacity limited fragmentation extending down to a few (< 10) jupiter masses,
due to shocks, anisotropy or magnetic fields, provides a much more robust
limit, even though difficult to determine accurately. Therefore, the various
""direct"" detections of exoplanets claimed recently in the literature are most
likely regular low-mass brown dwarfs and the direct detection of an extrasolar
planet remains for now elusive.
","[{""version"":""v1"",""created"":""Tue, 27 Sep 2005 10:21:22 GMT""}]","2016-08-30"
"astro-ph/0509799","Steen H. Hansen","Steen H. Hansen, Ben Moore, Joachim Stadel","A universal density slope - velocity anisotropy relation","4 pages, 1 figure, to appear in the XXIst IAP Colloquium ""Mass
  Profiles and Shapes of Cosmological Structures"", Paris 4-9 July 2005, France,
  (Eds.) G. Mamon, F. Combes, C. Deffayet, B. Fort, EAS Publications Series",,"10.1051/eas:2006042",,"astro-ph",,"  One can solve the Jeans equation analytically for equilibrated dark matter
structures, once given two pieces of input from numerical simulations. These
inputs are 1) a connection between phase-space density and radius, and 2) a
connection between velocity anisotropy and density slope, the \alpha-\beta
relation. The first (phase-space density v.s. radius) has been analysed through
several different simulations, however the second (\alpha-\beta relation) has
not been quantified yet. We perform a large set of numerical experiments in
order to quantify the slope and zero-point of the \alpha-\beta relation. When
combined with the assumption of phase-space being a power-law in radius this
allows us to conclude that equilibrated dark matter structures indeed have zero
central velocity anisotropy, central density slope of \alpha_0 = -0.8, and
outer anisotropy of approximately \beta_\infinity = 0.5.
","[{""version"":""v1"",""created"":""Tue, 27 Sep 2005 10:27:08 GMT""}]","2015-06-24"
"astro-ph/0509800","Yurij Baryshev","Yurij Baryshev","Conceptual Problems of the Standard Cosmological Model","13 pages, to be published in the Proceedings of the 1st Crisis in
  Cosmology Conference, AIP proc. series","AIP Conf.Proc.822:23-33,2006","10.1063/1.2189119",,"astro-ph",,"  The physics of the expansion of the universe is still a poorly studied
subject of the standard cosmological model. This because the concept of
expanding space can not be tested in the laboratory and because ``expansion''
means continuous creation of space, something that leads to several paradoxes.
We re-consider and expand here the discussion of conceptual problems, already
noted in the literature, linked to the expansion of space. In particular we
discuss the problem of the violation of energy conservation for local comoving
volumes, the exact Newtonian form of the Friedmann equations, the receding
velocity of galaxies being greater than the speed of light, and the Hubble law
inside inhomogeneous galaxy distribution. Recent discussion by Kiang, Davis \&
Lineweaver, and Whiting of the non-Doppler nature of the Lemaitre cosmological
redshift in the standard model is just a particular consequence of the
paradoxes mentioned above. The common cause of these paradoxes is the
geometrical description of gravity (general relativity), where there is not a
well defined concept of the energy-momentum tensor for the gravitational field
and hence no energy-momentum conservation for matter plus gravity.
","[{""version"":""v1"",""created"":""Tue, 27 Sep 2005 10:29:05 GMT""}]","2009-11-13"
"astro-ph/0509801","Ralf Napiwotzki","R. Napiwotzki, G. Tovmassian, M. G. Richer, G. Stasinska, M. Pena, H.
  Drechsel, S. Dreizler, T. Rauch","On the most metal-poor PN and its binary central star","Proceedings of the conference ""Planetary Nebulae as Astronomical
  Tools"", Gdansk, June/July 2005. To appear in AIP conference series","AIP Conf.Proc.804:173-176,2006","10.1063/1.2146265",,"astro-ph",,"  PN G135.9+55.9 is the most metal-poor PN known in our Galaxy. The central
star resides in a short-period binary system with a compact component, probably
a white dwarf. We describe new observations, which allowed us to determine the
orbital period. The lower limit for the combined mass of both stars is close to
the Chandrasekhar limit for white dwarfs, making this binary a possible
progenitor of a supernova type Ia. The binary system must have recently emerged
from a common envelope phase.
","[{""version"":""v1"",""created"":""Tue, 27 Sep 2005 10:32:40 GMT""}]","2009-11-13"
"astro-ph/0509802","Lee Homer","Lee Homer, Paula Szkody, Bing Chen, Arne Henden, Gary Schmidt, Scott
  F. Anderson, Nicole M. Silvestri and J. Brinkmann","XMM-Newton and optical follow-up observations of SDSS
  J093249.57+472523.0 and SDSS J102347.67+003841.2","9 pages, 7 figures, accepted for publication in the Astronomical
  Journal (page formatting corrected)","Astron.J.131:562-570,2006","10.1086/498346",,"astro-ph",,"  We report follow-up XMM-Newton and ground-based optical observations of the
unusual X-ray binary SDSS J102347.67+003841.2 (=FIRST J102347.6+003841), and a
new candidate intermediate polar found in the Sloan Digital Sky Survey: SDSS
J093249.57+472523.0. SDSS J1023 was observed in its low-state, with similar
magnitude/color (V=17.4 and B=17.9), and smooth orbital modulation as seen in
most previous observations. We further refine the ephemeris (for photometric
minimum) to: HJD(TT)_min= 2453081.8546(3) + E* 0.198094(1) d. It is easily
detected in X-rays at an unabsorbed flux (0.01-10.0 keV) of 5x10e-13
erg/cm^2/s. Fitting a variety of models we find that: (i) either a hot (kT>~15
keV) optically thin plasma emission model (bremsstrahlung or MEKAL) or a simple
power law can provide adequate fits to the data; (ii) these models prefer a low
column density ~10e19 cm^-2; (iii) a neutron star atmosphere plus power law
model (as found for quiescent low-mass X-ray binaries) can also produce a good
fit (for plausible distances), though only for a much higher column of about
4x10e20 cm^-2 and a very cool atmosphere kT<~50eV. These results support the
case that SDSS J1023 is a transient LMXB, and indeed places it in the subclass
of such systems whose quiescent X-ray emission is dominated by a hard power law
component. Our optical photometry of SDSS J0932 reveals that it is an high
inclination eclipsing system. Combined with its optical characteristics -- high
excitation emission lines, and brightness, yielding a large F_X/F_opt ratio --
its highly absorbed X-ray spectrum argues that SDSS J0932 is a strong IP
candidate. However, only more extensive optical photometry and a detection of
its spin or spin-orbit beat frequency can confirm this classification.
(abridged)
","[{""version"":""v1"",""created"":""Tue, 27 Sep 2005 10:51:22 GMT""},{""version"":""v2"",""created"":""Wed, 28 Sep 2005 10:26:22 GMT""}]","2008-11-26"
"astro-ph/0509803","Orrarujee Muanwong","Orrarujee Muanwong, Scott T. Kay and Peter A. Thomas","Evolution of X-ray cluster scaling relations in simulations with
  radiative cooling and non-gravitational heating","Accepted for publication in ApJ. Minor changes following referee's
  comments","Astrophys.J.649:640-648,2006","10.1086/506263",,"astro-ph",,"  We investigate the redshift dependence of X-ray cluster scaling relations
drawn from three hydrodynamic simulations of the LCDM cosmology: a Radiative
model that incorporates radiative cooling of the gas, a Preheating model that
additionally heats the gas uniformly at high redshift, and a Feedback model
that self-consistently heats cold gas in proportion to its local star-formation
rate. While all three models are capable of reproducing the observed local
Lx-Tx relation, they predict substantially different results at high redshift
(to z=1.5), with the Radiative, Preheating and Feedback models predicting
strongly positive, mildly positive and mildly negative evolution, respectively.
  The physical explanation for these differences lies in the structure of the
intracluster medium. All three models predict significant temperature
fluctuations at any given radius due to the presence of cool subclumps and, in
the case of the Feedback simulation, reheated gas. The mean gas temperature
lies above the dynamical temperature of the halo for all models at z=0, but
differs between models at higher redshift with the Radiative model having the
lowest mean gas temperature at z=1.5.
  We have not attempted to model the scaling relations in a manner that mimics
the observational selection effects, nor has a consistent observational picture
yet emerged. Nevertheless, evolution of the scaling relations promises to be a
powerful probe of the physics of entropy generation in clusters. First
indications are that early, widespread heating is favored over an extended
period of heating that is associated with galaxy formation.
","[{""version"":""v1"",""created"":""Tue, 27 Sep 2005 10:53:28 GMT""},{""version"":""v2"",""created"":""Thu, 29 Sep 2005 12:13:31 GMT""},{""version"":""v3"",""created"":""Thu, 25 May 2006 16:51:50 GMT""}]","2009-09-29"
"astro-ph/0509804","Charles Bonatto","C. Bonatto, L.O. Kerber, E. Bica, B.X. Santiago","Probing disk properties with open clusters","17 pages and 17 figures",,"10.1051/0004-6361:20053573",,"astro-ph",,"  We use the open clusters (OCs) with known parameters available in the WEBDA
database and in recently published papers to derive properties related to the
disk structure. The sample totals 654 OCs, consisting basically of Trumpler
types I to III clusters. Because of the completeness effects, the observed
radial distribution of OCs with respect to Galactocentric distance does not
follow the expected exponential profile. We simulate the effects of
completeness assuming that the observed distribution of the number of OCs with
a given number of stars above the background, measured in a restricted zone
outside the Solar circle, is representative of the intrinsic distribution of
OCs throughout the Galaxy. As a result we derive completeness-corrected radial
distributions which agree with exponential disks throughout the observed
Galactocentric distance range 5--14\,kpc, with scale lengths in the range $1.5
- 1.9\,kpc$. In particular we retrieve the expected exponential-disk radial
profile for the highly depleted regions internal to the Solar circle.
Extrapolation of the completeness-corrected radial distributions down to the
Galactic center indicates a total number of OCs in the range $\rm(1.8 -
3.7)\times10^5$. These estimates are upper-limits because they do not take into
account depletion in the number of OCs by dynamical effects in the inner parts
of the Galaxy. The observed and completeness-corrected age-distributions of the
OCs can be fitted by a combination of two exponential-decay profiles
characterized by age scales of $\rm\sim100\,Myr$ and $\rm\sim1.9\,Gyr$,
respectively. This rules out evolutionary scenarios based on constant
star-formation and OC-disruption rates. We estimate that 3.4--8\% of the
embedded clusters do actually emerge from the parent molecular clouds as OCs.
","[{""version"":""v1"",""created"":""Tue, 27 Sep 2005 12:06:56 GMT""}]","2009-11-11"
"astro-ph/0509805","Charles Bonatto","C. Bonatto, J.F.C. Santos Jr. E. Bica","Mass functions and structure of the young open cluster NGC\,6611",,"Astron.Astrophys.445:567-577,2006","10.1051/0004-6361:20052793",,"astro-ph",,"  We use 2MASS photometry to study colour-magnitude and colour-colour diagrams,
structure and mass distribution in the ionizing open cluster NGC\,6611.
Reddening variation throughout the cluster region is taken into account
followed by field-star decontamination of the CMDs. The field-star
decontamination showed that the lower limit of the main sequence (MS) occurs at
$\rm\approx5\,\ms$. Based on the fraction of Ks excess stars in the
colour-colour diagram we estimate an age of $1.3\pm0.3$\,Myr which is
consistent with the presence of a large number of pre-main sequence (PMS)
stars. The radial density distribution including MS and PMS stars is fitted by
a King profile with a core radius $0.70\pm0.08\,pc$. The cluster density
profile merges into the background at a limiting radius $6.5\pm0.5\,pc$. In the
halo and through the whole cluster the MFs have slopes $\rm\chi=1.52\pm0.13$
and $\rm\chi=1.45\pm0.12$, respectively, thus slightly steeper than Salpeter's
IMF. In the core the MF is flat, $\rm\chi=0.62\pm0.16$, indicating some degree
of mass segregation since the cluster age is a factor $\sim2$ larger than the
relaxation time. Because of the very young age of NGC\,6611, part of this
effect appears to be related to the molecular cloud-fragmentation process
itself. We detect $362\pm120$ PMS stars. The total observed mass including
detected MS (in the range $\rm5-85\,\ms$) and PMS stars amounts to
$\sim1\,600\,\ms$, thus more massive than the Trapezium cluster. Compared to
older open clusters of different masses, the overall NGC\,6611 fits in the
relations involving structural and dynamical parameters. However, the core is
atypical in the sense that it looks like an old/dynamically evolved core.
Again, part of this effect must be linked to formation processes.
","[{""version"":""v1"",""created"":""Tue, 27 Sep 2005 12:13:03 GMT""}]","2009-11-13"
"astro-ph/0509806","Michal Bejger","J. L. Zdunik, M. Bejger, P. Haensel and E. Gourgoulhon","Phase transitions in rotating neutron stars cores: back bending,
  stability, corequakes and pulsar timing","13 pages, 15 figures, accepted by A&A","Astron.Astrophys. 450 (2006) 747-758","10.1051/0004-6361:20054260",,"astro-ph",,"  The back-bending phenomenon for compact stars is studied by means of
analytical equations of state, for both constant-pressure phase transitions and
the transitions through the mixed-phase region. We restrict ourselves to the
case of normal rotating configurations, with baryon mass below the maximum
allowable baryon mass for non-rotating stars. We use high-precision 2-D
multi-domain spectral code LORENE to search the parameter space for possible
instability regions, and possible changes in the stability character of
rotating stars with phase transitions in their cores. Conditions on the density
jump in constant-pressure phase transitions, leading to the existence of the
unstable segments in the evolutionary sequences of spinning down isolated
normal neutron stars, are derived. Conjectures concerning the existence of two
disjoint families of non-rotating and rotating stationary configurations of
neutron stars are formulated. Particular case of EOSs leading to marginal
instability of static and rotating configurations is also studied: marginal
instability point in non-rotating configurations continues to exist in all
evolutionary spin-down tracks. The fate of rotating stars entering the region
of instability is discussed. The change in radius, energy release, and spin-up
associated with the corequake in rotating neutron star, triggered by the
instability, are calculated. The energy release is found to be very weakly
dependent on the angular momentum of collapsing star.
","[{""version"":""v1"",""created"":""Tue, 27 Sep 2005 12:20:08 GMT""},{""version"":""v2"",""created"":""Wed, 25 Jan 2006 11:54:56 GMT""}]","2007-05-23"
"astro-ph/0509807","Evgeny Kholupenko","E.E. Kholupenko, A.V. Ivanchik and D.A. Varshalovich","CMBR distortion concerned with recombination of the primordial hydrogen
  plasma","6 pages, 7 figures","Grav.Cosmol. 11 (2005) 161-165",,,"astro-ph",,"  CMBR distortion concerned with recombination of the primordial plasma is
calculated in frequency band from 1 GHz to 100 GHz in the frame of the standard
cosmological model for different values of cosmological density parameters:
nonrelativistic matter density $\Omega_m$ and baryonic matter density
$\Omega_b$. Comparison of these results with observational data which will be
obtained from planned experiments may be used for independent determination of
the cosmological parameters $\Omega_m$ and $\Omega_b$.
","[{""version"":""v1"",""created"":""Tue, 27 Sep 2005 13:57:54 GMT""}]","2007-05-23"
"astro-ph/0509808","Julien Siebert","Julien Siebert (LPTHE)","Statistical mechanics of the self-gravitating gases",,"Th\`{e}se de Doctorat, Universit\'{e} Pierre et Marie Curie -
  Paris VI (2005-06-24) - H.J. de Vega (Dir.)",,,"astro-ph",,"  The self-gravitating systems are formed by particles interacting through
gravity. They describe structure formation in the universe. As a consequence of
the long range interaction of gravity, they are inhomogeneous even at thermal
equilibrium. We study the self-gravitating systems with several kinds of
particles and the self-gravitating systems in the presence of the cosmological
constant $ Lambda$. We formulate the statistical mechanics and the mean field
approach describing the gaseous phase. We explicitely compute the density of
particles and thermodynamic quantities. The presence of $ Lambda$ extends the
domain of stability of the gaseous phase. Monte Carlo simulations show that the
mean field describes the gaseous phase with an excellent accuracy. Scalling law
of the self-gravitating systems with several kinds of particles is found. At
the critical point the fractal dimension is independant of their composition
and is $1.6...$~.
","[{""version"":""v1"",""created"":""Tue, 27 Sep 2005 14:10:21 GMT""}]","2007-05-23"
"astro-ph/0509809","Ian Bonnell","I. A. Bonnell, C. L. Dobbs, T. R. Robitaille and J. E. Pringle","Spiral shocks, triggering of star formation and the velocity dispersion
  in Giant Molecular Clouds","9 pages, 6 figures, accepted for publication in MNRAS","Mon.Not.Roy.Astron.Soc. 365 (2006) 37-45","10.1111/j.1365-2966.2005.09657.x",,"astro-ph",,"  We present numerical simulations of the passage of clumpy gas through a
galactic spiral shock and the subsequent formation of giant molecular clouds
(GMCs). The spiral shock forms dense clouds while dissipating kinetic energy,
producing regions that are locally gravitationally bound and collapse to form
stars. The effect of the clumpiness of gas as it passes through the shock is to
generate chaotic internal motions in the gas. The kinematics of these motions
are found to agree with the observed velocity-dispersion/size relation found in
star-forming regions. In contrast to the standard picture where continuously
driven turbulence generates the density inhomogeneities in star-forming clouds,
we find here that it is the clumpiness of the interstellar gas that produces
the chaotic motions as it passes through the spiral shock and initiates the
star formation process. The velocity dispersion can be understood as being due
to the random mass loading of clumps as they converge in the spiral shock. In
this model there is no need for any internal or external continuous driving
mechanism for the 'turbulence'. The coupling of the clouds' internal kinematics
to their externally triggered formation removes the need for the clouds to be
self-gravitating. Indeed, while clearly some parts of the clouds are
self-gravitating and able to form stars, most of the molecular material remains
gravitationally unbound. This can provide a simple explanation for the low
efficiency of star formation.
","[{""version"":""v1"",""created"":""Tue, 27 Sep 2005 14:44:23 GMT""}]","2015-06-24"
"astro-ph/0509810","Kimberly Herrmann","Kimberly A. Herrmann (1) and Robin Ciardullo (1) ((1) Penn State
  University)","Planetary Nebula Studies of Face-On Spiral Galaxies: Is the Disk
  Mass-to-Light Ratio Constant?","4 pages, 4 figures, for ""Planetary Nebulae as Astronomical Tools""
  Conference Proceedings (in Gdansk, Poland June 28-July 2, 2005)","AIP Conf.Proc.804:341-344,2006","10.1063/1.2146307",,"astro-ph",,"  When astronomers study the dark matter halos of spiral galaxies, they
normally assume that the disk mass-to-light ratio is *constant*. We describe a
method of analyzing the kinematics of planetary nebulae (PNe) in nearby face-on
spiral galaxies to test this assumption. Since the restoring force for stellar
motions perpendicular to the galactic disk is proportional to the disk mass
surface density, measurements of the vertical velocity dispersion can be used
to produce an independent measure of the total amount of matter in the disk.
Our steps are: (1) to identify a population of PNe by imaging the host spiral
in several filters, and (2) to isolate the vertical velocity dispersion from
spectroscopic observations of the PNe. Our first results for the PNe of M33
indicate that the mass-to-light ratio of the galaxy's disk actually *increases*
by more than a factor of 5 over the inner 6 disk scale lengths. We have begun
similar studies of the PNe in five more face-on galaxies: M83, M101, M94, NGC
6946, and M74. These data will also produce additional science such as galaxy
distances and constraints on the disk transparency.
","[{""version"":""v1"",""created"":""Tue, 27 Sep 2005 14:50:39 GMT""}]","2009-11-13"
