"math-ph/0509063","Janusz Grabowski","K.Grabowska, J.Grabowski, P.Urba\'nski","Geometrical Mechanics on algebroids","13 pages, minor changes, the version to appear in Int. J. Geom. Meth.
  Mod. Phys","Int. J. Geom. Meth. Mod. Phys. 3 (2006), 559-575.",,,"math-ph math.DG math.MP",,"  A natural geometric framework is proposed, based on ideas of W. M. Tulczyjew,
for constructions of dynamics on general algebroids. One obtains formalisms
similar to the Lagrangian and the Hamiltonian ones. In contrast with recently
studied concepts of Analytical Mechanics on Lie algebroids, this approach
requires much less than the presence of a Lie algebroid structure on a vector
bundle, but it still reproduces the main features of the Analytical Mechanics,
like the Euler-Lagrange-type equations, the correspondence between the
Lagrangian and Hamiltonian functions (Legendre transform) in the hyperregular
cases, and a version of the Noether Theorem. Besides, the constructions seem to
be more natural and simpler.
","[{""version"":""v1"",""created"":""Tue, 27 Sep 2005 12:26:00 GMT""},{""version"":""v2"",""created"":""Wed, 3 May 2006 18:48:24 GMT""}]","2007-12-18"
"math/0509602","Stephen Semmes","Stephen Semmes","Adventures in harmonic analysis","92 pages with index, latex-2e",,,,"math.CA",,"  These informal notes deal with Fourier series in one or more variables,
Fourier transforms in one variable, and related matters.
","[{""version"":""v1"",""created"":""Mon, 26 Sep 2005 17:12:53 GMT""}]","2007-05-23"
"math/0509603","Marc Kesseb\""ohmer","Marc Kesseb\""ohmer and Bernd O. Stratmann","A multifractal analysis for Stern-Brocot intervals, continued fractions
  and Diophantine growth rates","25 pages, 4 figures","Journal fuer die reine und angewandte Mathematik (Crelle's
  Journal) 605 (2007), 133-163","10.1515/CRELLE.2007.029",,"math.NT math.DS",,"  In this paper we obtain multifractal generalizations of classical results by
L\'evy and Khintchin in metrical Diophantine approximations and measure theory
of continued fractions. We give a complete multifractal analysis for
Stern--Brocot intervals, for continued fractions and for certain Diophantine
growth rates. In particular, we give detailed discussions of two multifractal
spectra closely related to the Farey map and the Gauss map.
","[{""version"":""v1"",""created"":""Mon, 26 Sep 2005 18:16:01 GMT""},{""version"":""v2"",""created"":""Fri, 9 Dec 2005 19:17:08 GMT""}]","2007-06-20"
"math/0509604","Karl Rubin","Robert Pollack and Karl Rubin","The main conjecture for CM elliptic curves at supersingular primes","18 pages, published version","Ann. of Math. (2) 159 (2004), no. 1, 447-464",,,"math.NT",,"  At a prime of ordinary reduction, the Iwasawa ``main conjecture'' for
elliptic curves relates a Selmer group to a $p$-adic $L$-function. In the
supersingular case, the statement of the main conjecture is more complicated as
neither the Selmer group nor the $p$-adic $L$-function is well-behaved.
Recently Kobayashi discovered an equivalent formulation of the main conjecture
at supersingular primes that is similar in structure to the ordinary case.
Namely, Kobayashi's conjecture relates modified Selmer groups, which he
defined, with modified $p$-adic $L$-functions defined by the first author. In
this paper we prove Kobayashi's conjecture for elliptic curves with complex
multiplication.
","[{""version"":""v1"",""created"":""Mon, 26 Sep 2005 18:35:55 GMT""}]","2007-05-23"
"math/0509605","Takis Konstantopoulos","Sergey Foss, Takis Konstantopoulos and Stan Zachary","The principle of a single big jump: discrete and continuous time
  modulated random walks with heavy-tailed increments","29 pages","Journal of Theoretical Probability, 20 (2007), No.3, 581-612",,,"math.PR",,"  We consider a modulated process S which, conditional on a background process
X, has independent increments. Assuming that S drifts to -infinity and that its
increments (jumps) are heavy-tailed (in a sense made precise in the paper), we
exhibit natural conditions under which the asymptotics of the tail distribution
of the overall maximum of S can be computed. We present results in discrete and
in continuous time. In particular, in the absence of modulation, the process S
in continuous time reduces to a Levy process with heavy-tailed Levy measure. A
central point of the paper is that we make full use of the so-called
``principle of a single big jump'' in order to obtain both upper and lower
bounds. Thus, the proofs are entirely probabilistic. The paper is motivated by
queueing and Levy stochastic networks.
","[{""version"":""v1"",""created"":""Mon, 26 Sep 2005 18:49:47 GMT""}]","2017-11-29"
"math/0509606","Zhongwei Shen","Zhongwei Shen","Necessary and Sufficient Conditions for the Solvability of the $L^p$
  Dirichlet Problem On Lipschitz Domains",,,,,"math.AP",,"  We study the homogeneous elliptic systems of order $2\ell$ with real constant
coefficients on Lipschitz domains in $R^n$, $n\ge 4$. For any fixed $p>2$, we
show that a reverse H\""older condition with exponent $p$ is necessary and
sufficient for the solvability of the Dirichlet problem with boundary data in
$L^p$. We also obtain a simple sufficient condition. As a consequence, we
establish the solvability of the $L^p$ Dirichlet problem for $n\ge 4$ and
$2-\e< p<\frac{2(n-1)}{n-3} +\e$. The range of $p$ is known to be sharp if
$\ell\ge 2$ and $4\le n\le 2\ell +1$. For the polyharmonic equation, the sharp
range of $p$ is also found in the case $n=6$, 7 if $\ell=2$, and $n=2\ell+2$ if
$\ell\ge 3$.
","[{""version"":""v1"",""created"":""Mon, 26 Sep 2005 19:31:52 GMT""}]","2007-05-23"
"math/0509610","Piotr So{\l}tan","W. Pusz, P. M. So{\l}tan","Analysis on a Homogeneous Space of a Quantum Group",,,,,"math.OA",,"  A detailed account of the construction of a homogeneous space for the quantum
""az+b"" group is presented. The homogeneous space is described by a commutative
C*-algebra which means that it is a classical space. Then a covariant
differential calculus on the homogeneous space is constructed and studied. A
covariant measure and an analogue of the exponential function are used to
introduce elements of Fourier analysis.
","[{""version"":""v1"",""created"":""Mon, 26 Sep 2005 20:15:24 GMT""},{""version"":""v2"",""created"":""Tue, 28 Mar 2006 19:20:46 GMT""},{""version"":""v3"",""created"":""Fri, 28 Apr 2006 06:07:03 GMT""}]","2012-07-26"
"math/0509611","Burak Ozbagci","Tolga Etg\""u and Burak Ozbagci","Explicit horizontal open books on some plumbings","20 pages, 15 figures","Internat. J. Math. 17 (2006), 1013-1031",,,"math.GT",,"  We describe explicit open books on arbitrary plumbings of oriented circle
bundles over closed oriented surfaces. We show that, for a non-positive
plumbing, the open book we construct is horizontal and the corresponding
compatible contact structure is also horizontal and Stein fillable. In
particular, we describe horizontal open books on some Seifert fibered
3--manifolds. As another application we describe horizontal open books
isomorphic to Milnor open books for some complex surface singularities.
Moreover we give examples of tight contact 3--manifolds supported by planar
open books. As a consequence the Weinstein conjecture holds for these tight
contact structures.
","[{""version"":""v1"",""created"":""Mon, 26 Sep 2005 20:46:29 GMT""},{""version"":""v2"",""created"":""Mon, 19 Dec 2005 14:09:02 GMT""}]","2007-05-23"
"math/0509612","Anton Wakolbinger","M. Hutzenthaler, A. Wakolbinger","Ergodic behavior of locally regulated branching populations","Published at http://dx.doi.org/10.1214/105051606000000745 in the
  Annals of Applied Probability (http://www.imstat.org/aap/) by the Institute
  of Mathematical Statistics (http://www.imstat.org)","Annals of Applied Probability 2007, Vol. 17, No. 2, 474-501","10.1214/105051606000000745","IMS-AAP-AAP0214","math.PR",,"  For a class of processes modeling the evolution of a spatially structured
population with migration and a logistic local regulation of the reproduction
dynamics, we show convergence to an upper invariant measure from a suitable
class of initial distributions. It follows from recent work of Alison Etheridge
that this upper invariant measure is nontrivial for sufficiently large
super-criticality in the reproduction. For sufficiently small
super-criticality, we prove local extinction by comparison with a mean field
model. This latter result extends also to more general local reproduction
regulations.
","[{""version"":""v1"",""created"":""Mon, 26 Sep 2005 20:56:51 GMT""},{""version"":""v2"",""created"":""Fri, 30 Mar 2007 11:07:02 GMT""}]","2011-01-04"
"math/0509613","Taekyun Kim","Taekyun Kim","On the alternating sums of powers of consecutive q-integers","5 pages",,,,"math.NT",,"  In this paper we construct $q$-Genocchi numbers and polynomials.
  By using these numbers and polynomials, we investigate the
  $q$-analogue of alternating sums of powers of consecutive
  integers due to Euler.
","[{""version"":""v1"",""created"":""Mon, 26 Sep 2005 23:16:14 GMT""}]","2007-05-23"
"math/0509614","Michael T. Jury","Michael T. Jury","C*-algebras generated by groups of composition operators","25 pages, no figures",,,,"math.OA",,"  We compute the C*-algebra generated by a group of composition operators
acting on certain reproducing kernel Hilbert spaces over the disk, where the
symbols belong to a non-elementary Fuchsian group. We show that such a
C*-algebra contains the compact operperators, and its quotient is isomorphic to
the crossed product C*-algebra determined by the action of the group on the
boundary circle. In addition we show that the C*-algebras obtained from
composition operators acting on a natural family of Hilbert spaces are in fact
isomorphic, and also determine the same Ext-class, which can be related to
known extensions of the crossed product.
","[{""version"":""v1"",""created"":""Mon, 26 Sep 2005 23:55:55 GMT""}]","2007-05-23"
"math/0509615","Scott Simon","Scott Simon","A Dolbeault Isomorphism Theorem in Infinite Dimensions",,,,,"math.CV",,"  For a large class of separable Banach spaces, we prove the real analytic
Dolbeault Isomorphism Theorem for open subsets.
","[{""version"":""v1"",""created"":""Tue, 27 Sep 2005 00:21:57 GMT""}]","2007-05-23"
"math/0509616","Joel David Hamkins","Joel David Hamkins (The City University of New York), Benedikt Loewe
  (Universiteit van Amsterdam, ILLC)","The modal logic of forcing","31 pages",,,,"math.LO",,"  What are the most general principles in set theory relating forceability and
truth? As with Solovay's celebrated analysis of provability, both this question
and its answer are naturally formulated with modal logic. We aim to do for
forceability what Solovay did for provability. A set theoretical assertion psi
is forceable or possible, if psi holds in some forcing extension, and
necessary, if psi holds in all forcing extensions. In this forcing
interpretation of modal logic, we establish that if ZFC is consistent, then the
ZFC-provable principles of forcing are exactly those in the modal theory known
as S4.2.
","[{""version"":""v1"",""created"":""Tue, 27 Sep 2005 01:37:07 GMT""}]","2007-05-23"
"math/0509617","Max Karoubi","Max Karoubi","Stabilization of the Witt group","6 pages ; see also http://www.math.jussieu.fr/~karoubi/",,,,"math.KT math.AT",,"  Using an idea due to R.Thomason, we define a ""homology theory"" on the
category of rings which satisfies excision, exactness, homotopy (in the
algebraic sense) and periodicity of order 4. For regular noetherian rings, we
find P. Balmer's higher Witt groups. For more general rings, this homology
isomorphic to the KT-theory of J. Hornbostel, inspired by the work of B.
Williams. For real or complex C*-algebras, we recover - up to 2 torsion -
topological K-theory.
","[{""version"":""v1"",""created"":""Tue, 27 Sep 2005 01:53:49 GMT""}]","2007-05-23"
"math/0509618","Kazuma Shimomoto","Kazuma Shimomoto","The Frobenius action on local cohomology modules in mixed characteristic","15 pages, to appear in Compositio Math","Compositio Mathematica, 143, no 6, (2007), 1478-1492",,,"math.AC math.NT",,"  R. Heitmann's proof of the Direct Summand Conjecture has opened a new
approach to the study of homological conjectures in mixed characteristic.
Inspired by his work and by the methods of almost ring theory, we discuss a
normalized length for certain torsion modules, which was introduced by G.
Faltings. Using the normalized length and the Frobenius map, we prove some
results of local cohomology for local rings in mixed characteristic, which has
an immediate implication for the subject of splinters studied by A. Singh.
","[{""version"":""v1"",""created"":""Tue, 27 Sep 2005 06:14:01 GMT""},{""version"":""v2"",""created"":""Thu, 11 Oct 2007 23:10:20 GMT""}]","2015-03-09"
"math/0509619","Jean-Fran\c{c}ois Burnol","Jean-Francois Burnol","Spacetime causality in the study of the Hankel transform","24 pages. Final ms, to appear. Improvements on pages 8 and 9, and
  15-16","Ann. Henri Poincar\'e 7 (2006), 1013--1034","10.1007/s00023-006-0274-8",,"math.NT math-ph math.MP",,"  We study Hilbert space aspects of the Klein-Gordon equation in
two-dimensional spacetime. We associate to its restriction to a spacelike wedge
a scattering from the past light cone to the future light cone, which is then
shown to be (essentially) the Hankel transform of order zero. We apply this to
give a novel proof, solely based on the causality of this spatio-temporal wave
propagation, of the theorem of de Branges and V. Rovnyak concerning Hankel
pairs with a support property. We recover their isometric expansion as an
application of Riemann's general method for solving Cauchy-Goursat problems of
hyperbolic type.
","[{""version"":""v1"",""created"":""Tue, 27 Sep 2005 06:34:13 GMT""},{""version"":""v2"",""created"":""Mon, 20 Feb 2006 13:44:39 GMT""},{""version"":""v3"",""created"":""Fri, 3 Mar 2006 10:11:04 GMT""},{""version"":""v4"",""created"":""Sun, 5 Mar 2006 15:14:06 GMT""}]","2007-05-23"
"math/0509620","Denis Krotov","Denis Krotov (Sobolev Institute of Mathematics, Novosibirsk, Russia)","On diameter perfect constant-weight ternary codes","15 pages, 2 figures; presented at 2004 Com2MaC Conference on
  Association Schemes, Codes and Designs; submitted to Discrete Mathematics","Discrete Math. 308(14) 2008, 3104-3114","10.1016/j.disc.2007.08.037",,"math.CO cs.IT math.IT","http://arxiv.org/licenses/nonexclusive-distrib/1.0/","  From cosets of binary Hamming codes we construct diameter perfect
constant-weight ternary codes with weight $n-1$ (where $n$ is the code length)
and distances 3 and 5. The class of distance 5 codes has parameters unknown
before. Keywords: constant-weight codes, ternary codes, perfect codes, diameter
perfect codes, perfect matchings, Preparata codes
","[{""version"":""v1"",""created"":""Tue, 27 Sep 2005 06:39:20 GMT""},{""version"":""v2"",""created"":""Mon, 3 Aug 2009 17:06:26 GMT""}]","2009-08-03"
"math/0509621","Arkadiy Skopenkov","A. Skopenkov","A new invariant and parametric connected sum of embeddings","13 pages, to appear in Fundamenta Mathematicae","Fund. Math. 197 (2007), 253--269",,,"math.GT math.AT",,"  We define an isotopy invariant of embeddings N -> R^m of manifolds into
Euclidean space. This invariant together with the \alpha-invariant of
Haefliger-Wu is complete in the dimension range where the \alpha-invariant
could be incomplete. We also define parametric connected sum of certain
embeddings (analogous to surgery). This allows to obtain new completeness
results for the \alpha-invariant and the following estimation of isotopy
classes of embeddings.
  For the piecewise-linear category, a (3n-2m+2)-connected n-manifold N and
(4n+4)/3 < m < (3n+3)/2 each preimage of \alpha-invariant injects into a
quotient of H_{3n-2m+3}(N), where the coefficients are Z for m-n odd and Z_2
for m-n even.
","[{""version"":""v1"",""created"":""Tue, 27 Sep 2005 07:42:45 GMT""},{""version"":""v2"",""created"":""Tue, 11 Dec 2007 12:02:01 GMT""}]","2008-12-06"
"math/0509622","Jean-Marc Bouclet","Jean-Marc Bouclet","Resolvent estimates for the Laplacian on asymptotically hyperbolic
  manifolds","Replaced with revised version of Tue, 27 September 2005. Typos
  corrected and proof of Proposition 4.3 changed",,"10.1007/s00023-005-0259-z",,"math.SP math.AP",,"  We prove high energy estimates for the boundary values of the weighted
resolvent of the Laplacian on an asymptotically hyperbolic manifold. Our point
is to use weights that fit the pseudo-differential calculus associated with the
asymptotically hyperbolic geometry. Our proof is a combination of a trick using
Mourre theory and of results by Froese-Hislop and Cardoso-Vodev.
","[{""version"":""v1"",""created"":""Tue, 27 Sep 2005 08:06:42 GMT""},{""version"":""v2"",""created"":""Thu, 29 Sep 2005 11:11:05 GMT""}]","2009-11-11"
"math/0509623","Laurent Berger","D. Benois, L. Berger","Th\'eorie d'Iwasawa des repr\'esentations cristallines II","58 pages","Commentarii Mathematici Helvetici 83 (2008), no. 3, 603--677.",,,"math.NT",,"  Let $K$ be a finite unramified extension of $\Qp$ and let $V$ be a
crystalline representation of $\mathrm{Gal}(\Qpbar/K)$. In this article, we
give a proof of the $C_{\mathrm{EP}}(L,V)$ conjecture for $L \subset
\Qp^{\mathrm{ab}}$ as well as a proof of its equivariant version
$C_{\mathrm{EP}}(L/K,V)$ for $L \subset \cup_{n=1}^\infty K(\zeta_{p^n})$. The
main ingredients are the $\delta_{\Zp}(V)$ conjecture about the integrality of
Perrin-Riou's exponential, which we prove using the theory of
$(\phi,\Gamma)$-modules, and Iwasawa-theoretic descent techniques used to show
that $\delta_{\Zp}(V)$ implies $C_{\mathrm{EP}}(L/K,V)$.
","[{""version"":""v1"",""created"":""Tue, 27 Sep 2005 08:21:29 GMT""}]","2010-02-22"
"math/0509624","Ryo Takahashi","Ryo Takahashi","Remarks on modules approximated by G-projective modules","28 pages, to appear in J. Algebra",,,,"math.AC",,"  Let $R$ be a commutative Noetherian Henselian local ring. Denote by
$\mathrm{mod} R$ the category of finitely generated $R$-modules, and by
${\mathcal G}$ the full subcategory of $\mathrm{mod} R$ consisting of all
G-projective $R$-modules. In this paper, we consider when a given $R$-module
has a right ${\mathcal G}$-approximation. For this, we study the full
subcategory $\mathrm{rap}{\mathcal G}$ of $\mathrm{mod} R$ consisting of all
$R$-modules that admit right ${\mathcal G}$-approximations. We investigate the
structure of $\mathrm{rap}{\mathcal G}$ by observing ${\mathcal G}$, ${\mathcal
G}^{\bot}$ and $\mathrm{lap}{\mathcal G}$, where $\mathrm{lap}{\mathcal G}$
denotes the full subcategory of $\mathrm{mod} R$ consisting of all $R$-modules
that admit left ${\mathcal G}$-approximations. On the other hand, we also
characterize $\mathrm{rap}{\mathcal G}$ in terms of Tate cohomologies. We give
several sufficient conditions for ${\mathcal G}$ to be contravariantly finite
in $\mathrm{mod} R$.
","[{""version"":""v1"",""created"":""Tue, 27 Sep 2005 09:34:18 GMT""}]","2007-05-23"
"math/0509625","Bassam Fayad","Bassam Fayad","On the ergodicity of the Weyl sums cocycle",,,"10.4064/aa125-4-1",,"math.NT math.DS",,"  For $\theta \in [0,1]$, we consider the map $T_\a: \T^2 \to \T^2$ given by
$T_\theta(x,y)=(x+\theta,y+2x+\theta)$. The skew product $f_\a: \T^2 \times \C
\to \T^2 \times \C$ given by $f_\theta(x,y,z)=(T_\theta(x,y),z+e^{2 \pi i y})$
generates the so called Weyl sums cocycle $a_\a(x,n) = \sum_{k=0}^{n-1} e^{2\pi
i(k^2\theta+kx)}$ since the $n^{{\rm th}}$ iterate of $f_\a$ writes as
$f_\a^n(x,y,z)=(T_\a^n(x,y),z+e^{2\pi iy} a_\a(2x,n))$.
  In this note, we improve the study developed by Forrest in
\cite{forrest2,forrest} around the density for $x \in \T$ of the complex
sequence ${\{a_\a(x,n)\}}_{n\in \N}$, by proving the ergodicity of $f_\theta$
for a class of numbers $\a$ that contains a residual set of positive Hausdorff
dimension in $[0,1]$. The ergodicity of $f_\a$ implies the existence of a
residual set of full Haar measure of $x \in \T$ for which the sequence
${\{a_\a(x,n) \}}_{n \in \N}$ is dense.
","[{""version"":""v1"",""created"":""Tue, 27 Sep 2005 10:35:58 GMT""},{""version"":""v2"",""created"":""Thu, 2 Feb 2006 10:47:24 GMT""}]","2015-06-26"
"math/0509626","Bassam Fayad","Bassam Fayad and Mariusz Lema\'nczyk","On the ergodicity of cylindrical transformations given by the logarithm",,,,,"math.DS",,"  Given $\a \in [0,1]$ and $\varphi: \T \to \R$ measurable, the {\it
cylindircal cascade} $S_{\a,\varphi}$ is the map from $\T \times \R$ to itself
given by $S_{\a,\varphi} (x,y) = (x+\a,y+\varphi(x))$ that naturally appears in
the study of some ordinary differential equations on $\R^3$. In this paper, we
prove that for a set of full Lebesgue measure of $\a \in [0,1]$ the cylindrical
cascades $S_{\a,\varphi}$ are ergodic for every smooth function $\varphi$ with
a logarithmic singularity, provided that the average of $\varphi$ vanishes.
  Closely related to $S_{\a,\varphi}$ are the special flows constructed above
$R_\a$ and under $\varphi+c$ where $c \in \R$ is such that $\varphi+c>0$. In
the case of a function $\varphi$ with an asymmetric logarithmic singularity our
result gives the first examples of ergodic cascades $S_{\a,\varphi}$ with the
corresponding special flows being mixing.
  Indeed, when the latter flows are mixing the usual techniques used to prove
the {\it essential value criterion} for $S_{\a,\varphi}$, that is equivalent to
ergodicity, fail and we device a new method to prove this criterion that we
hope could be useful in tackling other problems of ergodicity for cocycles
preserving an infinite measure.
","[{""version"":""v1"",""created"":""Tue, 27 Sep 2005 10:43:46 GMT""}]","2016-09-07"
"math/0509627","Frank Schuhmacher","Frank Schuhmacher","Three deformation functors for associative algebras","Corollary 4.4 still holds for projective limits",,,,"math.RA",,"  We show that three deformation functors (deformations of the product, flat
deformations and deformations of the relations) assigned to an associative
algebra are naturally isomorphic.
","[{""version"":""v1"",""created"":""Tue, 27 Sep 2005 12:31:33 GMT""},{""version"":""v2"",""created"":""Tue, 29 Nov 2005 16:33:44 GMT""}]","2007-05-23"
"math/0509628","Hannah Markwig","Andreas Gathmann and Hannah Markwig","Kontsevich's formula and the WDVV equations in tropical geometry","24 pages, minor changes to match the published version","Advances in Mathematics 217 (2008), 537-560",,,"math.AG","http://arxiv.org/licenses/nonexclusive-distrib/1.0/","  Using Gromov-Witten theory the numbers of complex plane rational curves of
degree d through 3d-1 general given points can be computed recursively with
Kontsevich's formula that follows from the so-called WDVV equations. In this
paper we establish the same results entirely in the language of tropical
geometry. In particular this shows how the concepts of moduli spaces of stable
curves and maps, (evaluation and forgetful) morphisms, intersection
multiplicities and their invariance under deformations can be carried over to
the tropical world.
","[{""version"":""v1"",""created"":""Tue, 27 Sep 2005 13:02:55 GMT""},{""version"":""v2"",""created"":""Tue, 9 Sep 2008 19:51:51 GMT""}]","2008-09-09"
"math/0509629","David Forge","Raul Cordovil (IST, Portugal), David Forge (LRI (Orsay), France)","An Orlik-Solomon type algebra for matroids with a fixed linear class of
  circuits","10 pages. Port. Math. to appear",,,,"math.CO",,"  A family C of circuits of a matroid M is a linear class if, given a modular
pair of circuits in C}, any circuit contained in the union of the pair is also
in C. The pair (M,C) can be seen as a matroidal generalization of a biased
graph. We introduce and study an Orlik-Solomon type algebra determined by
(M,C). If C is the set of all circuits of M this algebra is the Orlik-Solomon
algebra of M.
","[{""version"":""v1"",""created"":""Tue, 27 Sep 2005 13:08:16 GMT""},{""version"":""v2"",""created"":""Thu, 27 Oct 2005 18:45:07 GMT""},{""version"":""v3"",""created"":""Wed, 1 Mar 2006 09:30:15 GMT""}]","2007-05-23"
"math/0509630","Katrin Gelfert","Katrin Gelfert, Christian Wolf","Topological pressure via saddle points","19 pages, Replaced with revised version, Accepted for publication in
  Trans. Amer. Math. Soc",,,,"math.DS",,"  Let $\Lambda$ be a compact locally maximal invariant set of a
$C^2$-diffeomorphism $f:M\to M$ on a smooth Riemannian manifold $M$. In this
paper we study the topological pressure $P_{\rm top}(\phi)$ (with respect to
the dynamical system $f|\Lambda$) for a wide class of H\""older continuous
potentials and analyze its relation to dynamical, as well as geometrical,
properties of the system. We show that under a mild nonuniform hyperbolicity
assumption the topological pressure of $\phi$ is entirely determined by the
values of $\phi$ on the saddle points of $f$ in $\Lambda$. Moreover, it is
enough to consider saddle points with ``large'' Lyapunov exponents. We also
introduce a version of the pressure for certain non-continuous potentials and
establish several variational inequalities for it. Finally, we deduce relations
between expansion and escape rates and the dimension of $\Lambda$. Our results
generalize several well-known results to certain non-uniformly hyperbolic
systems.
","[{""version"":""v1"",""created"":""Tue, 27 Sep 2005 13:32:17 GMT""},{""version"":""v2"",""created"":""Fri, 22 Dec 2006 07:17:06 GMT""}]","2007-05-23"
