"cond-mat/0505046","Taner Yildirim Dr.","T. Yildirim, J. Iniguez, and S. Ciraci","Molecular and dissociative absorption of multiple hydrogens on
  transition metal decorated C60","4+ pages, 5 figues, see http://www.ncnr.nist.gov/staff/taner/h2 Phys.
  Rev. B (submitted, 2005)",,"10.1103/PhysRevB.72.153403",,"cond-mat.mtrl-sci",,"  Recently we have predicted [Phys. Rev. Lett. May 2005(cond-mat/0504694)] that
Ti-decorated carbon nanotubes can absorb up to 8-wt% hydrogen at ambient
conditions. Here we show that similar phenomena occurs in light
transition-metal decorated C60. While Sc and Ti prefers the hexagon (H) sites
with a binding energy of 2.1 eV, V and Cr prefers double-bond (D) sites with
binding energies of 1.3 and 0.8 eV, respectively. Heavier metals such as Mn,
Fe, and Co do not bond on C60. Once the metals are absorbed on C60, each can
bind up to four hydrogen molecules with an average binding energy of 0.3-0.5
eV/H2. At high metal-coverage, we show that a C$_{60}$ can accommodate six
D-site and eight H-site metals, which can reversible absorb up to 56 H2
molecules, corresponding to 7.5 wt%.
","[{""version"":""v1"",""created"":""Mon, 2 May 2005 17:28:34 GMT""}]","2009-11-11"
"cond-mat/0505047","Pablo Hurtado","Pablo I. Hurtado","Strong Shock Waves and Nonequilibrium Response in a One-dimensional Gas:
  a Boltzmann Equation Approach","9 pages, 8 figs, published version","Phys. Rev. E 72, 041101 (2005)","10.1103/PhysRevE.72.041101",,"cond-mat.stat-mech cond-mat.soft",,"  We investigate the nonequilibrium behavior of a one-dimensional binary fluid
on the basis of Boltzmann equation, using an infinitely strong shock wave as
probe. Density, velocity and temperature profiles are obtained as a function of
the mixture mass ratio \mu. We show that temperature overshoots near the shock
layer, and that heavy particles are denser, slower and cooler than light
particles in the strong nonequilibrium region around the shock. The shock width
w(\mu), which characterizes the size of this region, decreases as w(\mu) ~
\mu^{1/3} for \mu-->0. In this limit, two very different length scales control
the fluid structure, with heavy particles equilibrating much faster than light
ones. Hydrodynamic fields relax exponentially toward equilibrium, \phi(x) ~
exp[-x/\lambda]. The scale separation is also apparent here, with two typical
scales, \lambda_1 and \lambda_2, such that \lambda_1 ~ \mu^{1/2} as \mu-->0$,
while \lambda_2, which is the slow scale controlling the fluid's asymptotic
relaxation, increases to a constant value in this limit. These results are
discussed at the light of recent numerical studies on the nonequilibrium
behavior of similar 1d binary fluids.
","[{""version"":""v1"",""created"":""Mon, 2 May 2005 18:43:40 GMT""},{""version"":""v2"",""created"":""Mon, 2 May 2005 22:07:42 GMT""},{""version"":""v3"",""created"":""Thu, 20 Oct 2005 12:28:14 GMT""}]","2009-11-11"
"cond-mat/0505048","Alessandro Silva","Markus Mueller, Alessandro Silva","Instanton Analysis of Hysteresis in the Three-Dimensional Random-Field
  Ising Model","Phys. Rev. Lett. 96, 117202 (2006)",,"10.1103/PhysRevLett.96.117202",,"cond-mat.dis-nn cond-mat.stat-mech",,"  We study the magnetic hysteresis in the random field Ising model in 3D. We
discuss the disorder dependence of the coercive field H_c, and obtain an
analytical description of the smooth part of the hysteresis below and above
H_c, by identifying the disorder configurations (instantons) that are the most
probable to trigger local avalanches. We estimate the critical disorder
strength at which the hysteresis curve becomes continuous. From an instanton
analysis at zero field we obtain a description of local two-level systems in
the ferromagnetic phase.
","[{""version"":""v1"",""created"":""Mon, 2 May 2005 19:16:54 GMT""},{""version"":""v2"",""created"":""Mon, 20 Jun 2005 18:28:30 GMT""},{""version"":""v3"",""created"":""Wed, 30 Nov 2005 15:18:01 GMT""},{""version"":""v4"",""created"":""Tue, 21 Mar 2006 15:00:22 GMT""}]","2009-11-11"
"cond-mat/0505049","U. Zuelicke","A.I. Signal, U. Zuelicke (Massey U)","Tunable entanglement generation for mobile-electron spin qubits","3+ pages, 3 figures, RevTex4, v3: figures improved + references
  added, to appear in Appl. Phys. Lett","Appl. Phys. Lett. 87, 102102 (2005)","10.1063/1.2041821",,"cond-mat.mes-hall",,"  Recent studies have shown that linear electron optics can be used to generate
entangled two-particle states from nonentangled ones if additional measurements
of charge or parity are performed. We have investigated such nondeterministic
entanglement production in electronic versions of the Mach-Zehnder
interferometer, where spin-dependent interference occurs due to the presence of
electric-field tunable Rashba spin splitting. Adjustment of the spin-precession
length turns out to switch the entangler on and off, as well as control the
detailed form of entangled output states.
","[{""version"":""v1"",""created"":""Mon, 2 May 2005 23:23:09 GMT""},{""version"":""v2"",""created"":""Sun, 8 May 2005 23:11:01 GMT""},{""version"":""v3"",""created"":""Tue, 16 Aug 2005 03:07:17 GMT""}]","2007-05-23"
"cond-mat/0505050","Antonello Scardicchio","A. Scardicchio","On the connection between Random Waves and Quantum Fields. Duality
  between nodal lines statistic and the Casimir energy","13 pages, no figures","J.Phys. A39 (2006) 2203-2211","10.1088/0305-4470/39/9/014","MIT-CTP 3626","cond-mat.stat-mech hep-th math-ph math.MP",,"  Using the statistical description common to random waves and quantum fields
we show how the probability of having a nodal line close to a (translationally
symmetric) reference curve $\gamma$ is related to the Casimir energy of an
appropriate configuration of conductors.
","[{""version"":""v1"",""created"":""Mon, 2 May 2005 23:49:41 GMT""}]","2015-06-25"
"cond-mat/0505051","Na Sai","Na Sai, Alexie M. Kolpak, and Andrew M. Rappe","Ferroelectricity in ultra-thin perovskite films","4 pages in REVTEX4, 4 epsf figures","Phys. Rev. B 72, 020101(R) (2005)","10.1103/PhysRevB.72.020101",,"cond-mat.mtrl-sci",,"  We report studies of ferroelectricity in ultra-thin perovskite films with
realistic electrodes. The results reveal stable ferroelectric states in thin
films less than 10 \AA thick with polarization normal to the surface. Under
short-circuit boundary conditions, the screening effect of realistic electrodes
and the influence of real metal/oxide interfaces on thin film polarization are
investigated. Our studies indicate that metallic screening from the electrodes
is affected by the difference in work functions at oxide surfaces. We
demonstrate this effect in ferroelectric PbTiO$_3$ and BaTiO$_3$ films.
","[{""version"":""v1"",""created"":""Tue, 3 May 2005 01:27:31 GMT""}]","2007-05-23"
"cond-mat/0505052","Alexander Protogenov","Dmitry I. Iudin (1), Alexander P. Protogenov (1 and 2) ((1) Institute
  of Applied Physics of the RAS, Nizhny Novgorod, Russia, (2) Max Planck
  Institute for Physics of Complex Systems, Dresden, Germany)","Toroid Current States in Doped Mott Insulators","LaTeX2e, 11 pages, 1 figure",,,,"cond-mat.str-el",,"  The free energy bounds for inhomogeneous current states in doped
antiferromagnetic insulators and spatial configurations of spin and charge
degrees of freedom in lightly and heavily underdoped phases of this strongly
correlated electron system are considered. It is shown that states are
characterized by a small parameter of geometric origin, which determines the
degree of packing in the knots of filament manyfolds of the order parameter
distributions. We found a hierarchy of the spatial scales for flat knots, which
gives rise to a free energy gain. A toroid moment in an underdoped state is
found for the first time. It is shown that in the percolation picture of charge
density distributions, that surround antiferromagnetic nanoclusters, the
optimal level of the hole density is in qualitative agreement with the
experimentally observed value.
","[{""version"":""v1"",""created"":""Tue, 3 May 2005 07:59:34 GMT""}]","2007-05-23"
"cond-mat/0505053","Ari Harju","Ari Harju","Variational Monte Carlo for Interacting Electrons in Quantum Dots","34 pages, proceedings of the 1st International Meeting on Advances in
  Computational Many-Body Physics, to appear in Journal of Low Temperature
  Physics (vol. 140, nos. 3/4)",,"10.1007/s10909-005-6308-7",,"cond-mat.mes-hall",,"  We use a variational Monte Carlo algorithm to solve the electronic structure
of two-dimensional semiconductor quantum dots in external magnetic field. We
present accurate many-body wave functions for the system in various magnetic
field regimes. We show the importance of symmetry, and demonstrate how it can
be used to simplify the variational wave functions. We present in detail the
algorithm for efficient wave function optimization. We also present a Monte
Carlo -based diagonalization technique to solve the quantum dot problem in the
strong magnetic field limit where the system is of a multiconfiguration nature.
","[{""version"":""v1"",""created"":""Tue, 3 May 2005 08:04:06 GMT""}]","2009-11-11"
"cond-mat/0505054","Aviad Frydman","S. Chakraverty, A. Frydman, V.G. Pol, S. V. Pol and A. Gedanken","The effect of a weak ferromagnetic matrix on a system of nanomagnetic
  particles","4 pages, 4 figures",,,,"cond-mat.mtrl-sci",,"  The study of system of magnetic nano-particle has received increasing
attention recently both because of the novel physical concepts involved and
also because of their vast potential for application. The influence of
background material (the substrate coating) on magnetic properties of such
systems is a relatively open topic and often a full understanding is missing.
In the present work we discuss our experiments and interpretation for two
systems: Ni nanoparticles coated with graphitic carbon and Ni nanoparticles
coated with Au. While the latter system exibits behavior typical of
superparamagnetic particle systems the former shows several puzzling results
such as extremely high blocking temperature ($T_{B}$), very fast relaxation
time well below $T_{B}$, temperature independent field-cooled magnetization and
very small coercivity and remanent magnetization. We interpret these findings
as being a result of weak ferromagnetism, characteristic of the graphitic
carbon. This induces strong magnetic interactions between the Ni particles in
the presence of small magnetic fields. Such systems give rise to a dramatic
difference in blocking temperature between measurements performed at zero field
and those performed at very small magnetic fields.
","[{""version"":""v1"",""created"":""Tue, 3 May 2005 08:44:48 GMT""}]","2007-05-23"
"cond-mat/0505055","Michiel Snoek","Michiel Snoek, Masudul Haque, S. Vandoren and H.T.C. Stoof","Ultracold Superstrings in atomic boson-fermion mixtures","4 pages, 4 figures; published version",,"10.1103/PhysRevLett.95.250401",,"cond-mat.other hep-th",,"  We propose a setup with ultracold atomic gases that can be used to make a
nonrelativistic superstring in four spacetime dimensions. In particular, we
consider for the creation of the superstring a fermionic atomic gas that is
trapped in the core of a vortex in a Bose-Einstein condensate. We explain the
required tuning of experimental parameters to achieve supersymmetry between the
fermionic atoms and the bosonic modes describing the oscillations in the vortex
position. Furthermore, we discuss the experimental consequences of
supersymmetry.
","[{""version"":""v1"",""created"":""Tue, 3 May 2005 09:04:34 GMT""},{""version"":""v2"",""created"":""Wed, 1 Jun 2005 12:29:45 GMT""},{""version"":""v3"",""created"":""Thu, 22 Dec 2005 14:02:53 GMT""}]","2007-05-23"
"cond-mat/0505056","Amir Kohen","A. Kohen, T. Cren, Th. Proslier, Y. Noat, F. Giubileo, F. Bobba, A. M.
  Cucolo, W. Sacks D. Roditchev N. Zhigadlo, S.M. Kazakov and J. Karpinski","Superconducting vortex profile from fixed point measurements The Lazy
  Fisherman tunnelling microscopy method","The following article has been accepted by APL. After it is
  published, it will be found at http://apl.aip.org/",,"10.1063/1.1939077",,"cond-mat.supr-con",,"  We introduce a mode of operation for studying the vortex phase in
superconductors using scanning tunnelling microscopy (STM). While in the
conventional STM method, the tip is scanned over a sample in which a fixed
vortex pattern is prepared, in our ""Lazy Fisherman"" method the STM tip is kept
fixed at a selected location while the vortices are being moved by varying the
applied magnetic field. By continuously acquiring the local tunnelling
conductance spectra, dI/dV(V), we detect the changes in the local density of
states under the tip due to the vortex motion. With no need for scanning, the
method permits one to extend the study of vortices to samples in which scanning
is difficult or even impossible due to surface nonuniformity and allows one to
study vortex dynamics. Using a statistical analysis of the spectra, we
reconstruct the single vortex zero bias conductance profile. We apply the
method to the c-axis face of an MgB$_2$ single crystal sample and obtain a
vortex profile with a coherence length, xi of 57+-2 nm.
","[{""version"":""v1"",""created"":""Tue, 3 May 2005 09:38:47 GMT""}]","2009-11-11"
"cond-mat/0505057","Douglas Fay","L. Tewordt, D. Fay","Thermal conductivity in the vortex state of the superconductor UPd_2Al_3","12 pages, 3 figures with several parts","Physical Review B 72, 014502 (2005)","10.1103/PhysRevB.72.014502",,"cond-mat.supr-con",,"  The magneto-thermal conductivity kappa is calculated for the vortex state of
UPd_2Al_3 by assuming horizontal gap nodes. The Green's function method we
employed takes into account the effects of supercurrent flow and Andreev
scattering on the quasiparticles due to Abrikosov's vortex lattice order
parameter. The calculated angular dependence of kappa_{yy} for field rotation
theta_0 in the ac-plane depends strongly on field strength H, impurity
scattering, anisotropy of the Fermi velocity, and temperature. For finite
temperatures and the clean unitary scattering limit we get qualitative
agreement with recent experiments for all four proposed gap functions having
horizontal line nodes at ck_z = 0, pi/4, and pi/2.
","[{""version"":""v1"",""created"":""Tue, 3 May 2005 10:36:14 GMT""}]","2009-11-11"
"cond-mat/0505058","Heribert Wilhelm","T. Radu, H. Wilhelm, V. Yushankhai, D. Kovrizhin, R. Coldea, Z.
  Tylczynski, T. Luehmann, and F. Steglich","Bose-Einstein Condensation of Magnons in Cs2CuCl4","5 pages, 4 figures, experiment and theory",,"10.1103/PhysRevLett.95.127202",,"cond-mat.other",,"  We report on results of specific heat measurements on single crystals of the
frustrated quasi-2D spin-1/2 antiferromagnet Cs_2CuCl_4 (T_N=0.595 K) in
external magnetic fields B<12 T and for temperatures T>30 mK. Decreasing B from
high fields leads to the closure of the field-induced gap in the magnon
spectrum at a critical field B_c = 8.51 T and a magnetic phase transition is
clearly seen below B_c. In the vicinity to B_c, the phase transition boundary
is well described by the power-law T_c(B)\propto (B_c-B)^{1/\phi} with the
measured critical exponent \phi\simeq 1.5. These findings are interpreted as a
Bose-Einstein condensation of magnons.
","[{""version"":""v1"",""created"":""Tue, 3 May 2005 10:44:53 GMT""}]","2007-05-23"
"cond-mat/0505059","Wolfgang Langbein","Wolfgang Langbein and Brian Patton","Microscopic measurement of photon echo formation in groups of individual
  excitonic transitions",,"Phys. Rev. Lett. 95, 017403 (2005)","10.1103/PhysRevLett.95.017403",,"cond-mat.other",,"  The third-order polarization emitted from groups of individual localized
excitonic transitions after pulsed optical excitation is measured. We observe
the evolution of the nonlinear response from the case of a free polarization
decay for a single transition, to that of a photon echo for many transitions.
The echo is shown to arise from the mutual rephasing of the emission from
individual transitions.
","[{""version"":""v1"",""created"":""Tue, 3 May 2005 11:00:49 GMT""}]","2015-05-05"
"cond-mat/0505060","Graeme J. Ackland","Graeme J. Ackland","Two-band second moment model for transition metals and alloys",,,"10.1016/j.jnucmat.2006.02.024",,"cond-mat.mtrl-sci",,"  A semi-empirical formalism based on the second moment tight binding approach,
considering two bands is presented for deriving interatomic potentials for
magnetic d-band materials and transition metal alloys. It incorporates an
empirical local exchange interaction, which accounts for magnetic effects
without increasing the computing time required for force evaluation. The
consequences of applying a two-band picture to transition metal alloys and
transition metal impurities is examined, which combined with evidence from {\it
ab initio calculations} leads to some surprisingly simplifying conclusions.
","[{""version"":""v1"",""created"":""Tue, 3 May 2005 11:00:33 GMT""}]","2009-11-11"
"cond-mat/0505061","Philippe Jund","S\'ebastien Blaineau and Philippe Jund","Calculated vibrational and electronic properties of various sodium
  thiogermanate glasses","9 pages, 6 figures; to appear in Chemical Physics (typo. corrected)",,"10.1016/j.chemphys.2005.04.043",,"cond-mat.dis-nn",,"  We study the vibrational and electronic properties of (x)Na$_2$S-(1-x)GeS$_2$
glasses through DFT-based molecular dynamics simulations, at different sodium
concentrations ($0<x<0.5$). We compute the vibrational density of states for
the different samples in order to determine the contribution of the Na$^+$ ions
in the VDOS. With an in-depth analysis of the eigenvectors we determine the
spatial and atomic localization of the different modes, and in particular in
the zone corresponding to the Boson peak. We also calculate the electronic
density of states as well as the partial EDOS in order to determine the impact
of the introduction of the sodium modifiers on the electronic properties of the
GeS$_2$ matrix.
","[{""version"":""v1"",""created"":""Tue, 3 May 2005 11:59:22 GMT""},{""version"":""v2"",""created"":""Wed, 4 May 2005 15:06:14 GMT""}]","2009-11-11"
"cond-mat/0505062","Julien Toulouse","Janos G. Angyan, Iann C. Gerber, Andreas Savin, Julien Toulouse","Van der Waals forces in density functional theory: perturbational
  long-range electron interaction corrections","8 pages, 1 figure, submitted to Phys. Rev. A","Phys. Rev. A 72, 012510 (2005)","10.1103/PhysRevA.72.012510",,"cond-mat.mtrl-sci",,"  Long-range exchange and correlation effects, responsible for the failure of
currently used approximate density functionals in describing van der Waals
forces, are taken into account explicitly after a separation of the
electron-electron interaction in the Hamiltonian into short- and long-range
components. We propose a ""range-separated hybrid"" functional based on a local
density approximation for the short-range exchange-correlation energy, combined
with a long-range exact exchange energy. Long-range correlation effects are
added by a second-order perturbational treatment. The resulting scheme is
general and is particularly well-adapted to describe van der Waals complexes,
like rare gas dimers.
","[{""version"":""v1"",""created"":""Tue, 3 May 2005 12:52:54 GMT""},{""version"":""v2"",""created"":""Wed, 4 May 2005 10:27:34 GMT""}]","2009-11-11"
"cond-mat/0505063","Fedor Jelezko","J. Meijer, B. Burchard, M. Domhan, C.Wittmann, T.Gaebel, I.Popa, F.
  Jelezko, and J. Wrachtrup","Generation of single colour centers by focussed nitrogen implantation","6 pages, 3 figures","Appl. Phys. Lett. 87: Art. No. 261909 (2005)","10.1063/1.2103389",,"cond-mat.mtrl-sci",,"  Single defect centers in diamond have been generated via nitrogen
implantation. The defects have been investigated by single defect center
fluorescence microscopy. Optical and EPR spectra unambiguously show that the
produced defect is the nitrogen-vacancy colour center. An analysis of the
nitrogen flux together with a determination of the number of nitrogen-vacancy
centers yields that on average two 2 MeV nitrogen atoms need to be implanted
per defect center.
","[{""version"":""v1"",""created"":""Tue, 3 May 2005 14:09:49 GMT""}]","2009-11-11"
"cond-mat/0505065","Dominique Vuillaume","Dinesh K. Aswal (IEMN-CNRS), St\'ephane Lenfant (IEMN-CNRS), David
  Guerin (IEMN-CNRS), Jatinder V. Yakhmi, Dominique Vuillaume (IEMN-CNRS)","Tunnel current in self-assembled monolayers of
  3-mercaptopropyltrimethoxysilane","Small, in press","Small, 1(7), 725-729 (2005)",,,"cond-mat.mtrl-sci",,"  The current density-voltage (J-V) characteristics of self assembled
monolayers of 3-mercaptopropyltrimethoxysilane (MPTMS) chemisorbed on the
native oxide surface of p+-doped Si demonstrate the excellent tunnel dielectric
behavior of organic monolayers down to 3 carbon atoms. The J-V characteristics
of MPTMS SAMs on Si are found to be asymmetric, and the direction of
rectification has been found to depend upon the applied voltage range. At
voltages < 2.45V, the reverse bias current was found to be higher than forward
bias current; while at higher voltages this trend was reversed. This result is
in agreement with Simmons theory. The tunnel barrier heights for this short
chain (2.56 and 2.14 eV respectively at Au and Si interfaces) are in good
agreement with the ones for longer chains (>10 carbon atoms) if the chain is
chemisorbed at the electrodes. These results extend all previous experiments on
such molecular tunnel dielectrics down to 3 carbon atoms. This suggests that
these molecular monolayers, having good tunnel behavior (up to 2.5 eV) over a
large bias range, can be used as gate dielectric well below the limits of
Si-based dielectrics.
","[{""version"":""v1"",""created"":""Tue, 3 May 2005 15:27:28 GMT""}]","2016-08-16"
"cs/0505009","Arindam Mitra","Arindam Mitra","Human being is a living random number generator","PDF, Revised",,,,"cs.DS","http://arxiv.org/licenses/nonexclusive-distrib/1.0/","  General wisdom is, mathematical operation is needed to generate number by
numbers. It is pointed out that without any mathematical operation true random
numbers can be generated by numbers through algorithmic process. It implies
that human brain itself is a living true random number generator. Human brain
can meet the enormous human demand of true random numbers.
","[{""version"":""v1"",""created"":""Tue, 3 May 2005 15:42:24 GMT""},{""version"":""v10"",""created"":""Tue, 21 Aug 2007 15:28:48 GMT""},{""version"":""v11"",""created"":""Thu, 23 Aug 2007 15:10:06 GMT""},{""version"":""v12"",""created"":""Wed, 14 Nov 2007 16:04:01 GMT""},{""version"":""v13"",""created"":""Fri, 13 Jun 2008 15:41:34 GMT""},{""version"":""v14"",""created"":""Mon, 14 Jul 2008 13:44:30 GMT""},{""version"":""v15"",""created"":""Thu, 24 Jul 2008 14:43:57 GMT""},{""version"":""v16"",""created"":""Sat, 27 Dec 2008 15:56:26 GMT""},{""version"":""v17"",""created"":""Tue, 16 Jun 2009 10:57:47 GMT""},{""version"":""v2"",""created"":""Thu, 5 May 2005 13:09:26 GMT""},{""version"":""v3"",""created"":""Fri, 8 Jul 2005 06:20:22 GMT""},{""version"":""v4"",""created"":""Thu, 26 Oct 2006 14:34:45 GMT""},{""version"":""v5"",""created"":""Tue, 9 Jan 2007 15:54:27 GMT""},{""version"":""v6"",""created"":""Wed, 31 Jan 2007 12:44:08 GMT""},{""version"":""v7"",""created"":""Wed, 7 Feb 2007 15:48:03 GMT""},{""version"":""v8"",""created"":""Thu, 8 Mar 2007 14:49:33 GMT""},{""version"":""v9"",""created"":""Wed, 18 Jul 2007 15:24:15 GMT""}]","2009-06-16"
"gr-qc/0505013","Alfredo Macias","Alfredo Macias, Hernando Quevedo, and Alberto Sanchez","Gowdy $T^3$ Cosmological Models in N=1 Supergravity","25 pages and 2 figures",,"10.1063/1.2399683",,"gr-qc",,"  We investigate the canonical quantization of supergravity N=1 in the case of
a midisuperspace described by Gowdy $T^3$ cosmological models. The quantum
constraints are analyzed and the wave function of the universe is derived
explicitly. Unlike the minisuperspace case, we show the existence of physical
states in midisuperspace models. The analysis of the wave function of the
universe leads to the conclusion that the classical curvature singularity
present in the evolution of Gowdy models is removed at the quantum level due to
the presence of the Rarita-Schwinger field.
","[{""version"":""v1"",""created"":""Tue, 3 May 2005 03:15:50 GMT""}]","2009-11-11"
