"hep-th/0505185","Jan Gutowski","Jan B. Gutowski, Wafic Sabra","General Supersymmetric Solutions of Five-Dimensional Supergravity","24 pages, references added, uses JHEP3.cls","JHEP 0510 (2005) 039","10.1088/1126-6708/2005/10/039",,"hep-th",,"  The classification of 1/4-supersymmetric solutions of five dimensional gauged
supergravity coupled to arbitrary many abelian vector multiplets, which was
initiated in hep-th/0401129, is completed. The structure of all solutions for
which the Killing vector constructed from the Killing spinor is null is
investigated in both the gauged and the ungauged theories and some new
solutions are constructed.
","[{""version"":""v1"",""created"":""Fri, 20 May 2005 20:28:45 GMT""},{""version"":""v2"",""created"":""Wed, 3 Aug 2005 15:02:22 GMT""}]","2009-11-11"
"hep-th/0505186","Rong-Gen Cai","Rong-Gen Cai, Hong-Sheng Zhang, and Anzhong Wang","Crossing w=-1 in Gauss-Bonnet Brane World with Induced Gravity","Revtex 16 pages including 10 eps files, references added, to appear
  in Comm. Theor. Phys","Commun.Theor.Phys.44:948,2005","10.1088/6102/44/5/948",,"hep-th astro-ph gr-qc",,"  Recent type Ia supernovas data seemingly favor a dark energy model whose
equation of state $w(z)$ crosses -1 very recently, which is a much more amazing
problem than the acceleration of the universe. In this paper we show that it is
possible to realize such a crossing without introducing any phantom component
in a Gauss-Bonnet brane world with induced gravity, where a four dimensional
curvature scalar on the brane and a five dimensional Gauss-Bonnet term in the
bulk are present. In this realization, the Gauss-Bonnet term and the mass
parameter in the bulk play a crucial role.
","[{""version"":""v1"",""created"":""Sat, 21 May 2005 03:40:34 GMT""},{""version"":""v2"",""created"":""Mon, 6 Jun 2005 03:11:50 GMT""}]","2014-11-18"
"math-ph/0505059","Alexander Komech","A.Komech","Lectures on Quantum Mechanics (nonlinear PDE point of view)","229 pages","Lecture Notes of Max Planck Institute for Mathematics in the
  Sciences, No. 25/2005, Leipzig, 2005",,"LN 25/2005","math-ph math.MP math.SP",,"  We expose the Schr\""odinger quantum mechanics with traditional applications
to Hydrogen atom. We discuss carefully the experimental and theoretical
background for the introduction of the Schr\""odinger, Pauli and Dirac
equations, as well as for the Maxwell equations. We explain in detail all basic
theoretical concepts. We explain all details of the calculations and
mathematical tools: Lagrangian and Hamiltonian formalism for the systems with
finite degree of freedom and for fields, Geometric Optics, the Hamilton-Jacobi
equation and WKB approximation, Noether theory of invariants including the
theorem on currents, four conservation laws (energy, momentum, angular momentum
and charge), Lie algebra of angular momentum and spherical functions,
scattering theory (limiting amplitude principle and limiting absorption
principle), the Lienard-Wiechert formulas, Lorentz group and Lorentz formulas,
Pauli theorem and relativistic covariance of the Dirac equation, etc. We give a
detailed oveview of the conceptual development of the quantum mechanics, and
expose main achievements of the ``old quantum mechanics'' in the form of
exercises.
  One of our basic aim in writing this book, is an open and concrete discussion
of the problem of a mathematical description of the following two fundamental
quantum phenomena: i) Bohr's quantum transitions and ii) de Broglie's
wave-particle duality. Both phenomena cannot be described by autonomous linear
dynamical equations, and we give them a new mathematical treatment related with
recent progress in the theory of global attractors of nonlinear hyperbolic
PDEs.
","[{""version"":""v1"",""created"":""Sat, 21 May 2005 14:48:05 GMT""},{""version"":""v2"",""created"":""Tue, 24 May 2005 14:44:03 GMT""},{""version"":""v3"",""created"":""Thu, 26 May 2005 13:19:01 GMT""},{""version"":""v4"",""created"":""Sat, 28 May 2005 15:59:37 GMT""}]","2007-05-23"
"math/0505442","Jim Hoste","Jim Hoste (Pitzer College) and Patrick D. Shanahan (Loyola Marymount
  University)","Computing boundary slopes of 2-bridge links","26 pages, 10 figures",,,,"math.GT math.CO",,"  We describe an algorithm for computing boundary slopes of 2-bridge links. As
an example, we work out the slopes of the links obtained by 1/k surgery on one
component of the Borromean rings. A table of all boundary slopes of all
2-bridge links with 10 or less crossings is also included.
","[{""version"":""v1"",""created"":""Fri, 20 May 2005 21:02:47 GMT""}]","2007-05-23"
"math/0505443","Jean-Baptiste Pomet","David Avanessoff (INRIA Sophia Antipolis), Jean-Baptiste Pomet (INRIA
  Sophia Antipolis)","Flatness and Monge parameterization of two-input systems, control-affine
  with 4 states or general with 3 states",,"ESAIM Control Optim. Calc. Var. 13 (2007), no. 2, 237-264","10.1051/cocv:2007011",,"math.OC",,"  This paper studies Monge parameterization, or differential flatness, of
control-affine systems with four states and twocontrols. Some of them are known
to be flat, and this implies admitting a Monge parameterization. Focusing on
systems outside this class, we describe the only possible structure of such a
parameterization for these systems, and give a lower bound on the order of this
parameterization, if it exists. This lower-bound is good enough to recover the
known results about ""(x,u)-flatness"" of these systems, with much more
elementary techniques.
","[{""version"":""v1"",""created"":""Sat, 21 May 2005 07:07:41 GMT""},{""version"":""v2"",""created"":""Fri, 2 Dec 2005 11:14:46 GMT""}]","2011-12-14"
"math/0505444","Zenghu Li","D. A. Dawson, Zenghu Li","Skew convolution semigroups and affine Markov processes","Published at http://dx.doi.org/10.1214/009117905000000747 in the
  Annals of Probability (http://www.imstat.org/aop/) by the Institute of
  Mathematical Statistics (http://www.imstat.org)","Annals of Probability 2006, Vol. 34, No. 3, 1103-1142","10.1214/009117905000000747","IMS-AOP-AOP0116","math.PR math.ST stat.TH",,"  A general affine Markov semigroup is formulated as the convolution of a
homogeneous one with a skew convolution semigroup. We provide some sufficient
conditions for the regularities of the homogeneous affine semigroup and the
skew convolution semigroup. The corresponding affine Markov process is
constructed as the strong solution of a system of stochastic equations with
non-Lipschitz coefficients and Poisson-type integrals over some random sets.
Based on this characterization, it is proved that the affine process arises
naturally in a limit theorem for the difference of a pair of reactant processes
in a catalytic branching system with immigration.
","[{""version"":""v1"",""created"":""Sat, 21 May 2005 08:36:23 GMT""},{""version"":""v2"",""created"":""Fri, 23 Jun 2006 14:36:22 GMT""},{""version"":""v3"",""created"":""Fri, 30 Jun 2006 08:55:13 GMT""}]","2007-06-13"
"math/0505445","Shen Liang","Liang Shen and Jianlong Chen","Small Injective Rings","14 pages",,,,"math.RA",,"  Let $R$ be a ring, a right ideal $I$ of $R$ is called small if for every
proper right ideal $K$ of $R$, $I+K\neq R$. A ring $R$ is called right small
injective if every homomorphism from a small right ideal to $R_{R}$ can be
extended to an $R$-homomorphism from $R_{R}$ to $R_{R}$. Properties of small
injective rings are explored and several new characterizations are given for
$QF$ rings and $PF$ rings, respectively.
","[{""version"":""v1"",""created"":""Sat, 21 May 2005 12:04:08 GMT""}]","2007-05-23"
"math/0505447","Xi-Ping Zhu","Bing-Long Chen and Xi-Ping Zhu","Uniqueness of the Ricci Flow on Complete Noncompact Manifolds","33 pages (Previous version has some typing errors, the present one is
  correct.)",,,,"math.DG math.AP",,"  The Ricci flow is an evolution system on metrics. For a given metric as
initial data, its local existence and uniqueness on compact manifolds was first
established by Hamilton \cite{Ha1}. Later on, De Turck \cite{De} gave a
simplified proof. In the later of 80's, Shi \cite{Sh1} generalized the local
existence result to complete noncompact manifolds. However, the uniqueness of
the solutions to the Ricci flow on complete noncompact manifolds is still an
open question. Recently it was found that the uniqueness of the Ricci flow on
complete noncompact manifolds is important in the theory of the Ricci flow with
surgery. In this paper, we give an affirmative answer for the uniqueness
question. More precisely, we prove that the solution of the Ricci flow with
bounded curvature on a complete noncompact manifold is unique.
","[{""version"":""v1"",""created"":""Sat, 21 May 2005 15:01:13 GMT""},{""version"":""v2"",""created"":""Thu, 26 May 2005 03:47:24 GMT""},{""version"":""v3"",""created"":""Fri, 27 May 2005 07:05:29 GMT""}]","2007-05-23"
"nlin/0505048","Pandelis Papachristou","P.K. Papachristou, E. Mavrommatis, V. Constantoudis, F. Diakonos, J.
  Wambach","Lyapunov Instability versus Relaxation Time in two Coupled Oscillators","10 pages, 8 figures, submitted to Phys. Rev. E","Phys. Rev. E 73, 016204 (2006)","10.1103/PhysRevE.73.016204",,"nlin.CD",,"  We consider the relation between relaxation time and the largest Lyapunov
exponent in a system of two coupled oscillators, one of them being harmonic. It
has been found that in a rather broad region of parameter space, contrary to
the common expectation, both Lyapunov exponent and relaxation time increase as
a function of the total energy. This effect is attributed to the fact that
above a critical value of the total energy, although the Lyapunov exponent
increases, KAM tori appear and the chaotic fraction of phase space decreases.
We examine the required conditions and demonstrate the key role of the
dispersion relation for this behaviour to occur. This study is useful, among
others, in the understanding of the damping of nuclear giant resonances.
","[{""version"":""v1"",""created"":""Fri, 20 May 2005 16:59:57 GMT""}]","2009-11-11"
"nlin/0505049","Vainshtein","S.I. Vainshtein","Transverse velocities, intermittency and asymmetry in fully developed
  turbulence","3 pages, 2 figures",,"10.1017/S0022112006000280",,"nlin.CD",,"  Using experimental transverse velocities data for very high Reynolds number
turbulence, we suggest a model describing both formation of intermittency and
asymmetry of turbulence. The model, called ""bump-model"" is a modification of
ramp-model suggested earlier, S.I. Vainshtein and K.R. Sreenivasan, Phys. Rev.
Lett., 73, 3085 (1994). The connection between asymmetry and intermittency
makes it possible to study the latter with relatively low moments.
","[{""version"":""v1"",""created"":""Fri, 20 May 2005 18:05:59 GMT""}]","2015-06-26"
"nlin/0505050","Antonio Parravano","Parravano Antonio","Looking at map networks with time delay interactions from a local
  perspective","4 pages, 6 figures, submitted to Physical Review E",,,,"nlin.PS nlin.CD",,"  The evolution of networks of coupled chaotic maps with delayed interactions
can be studied in the usual way by analyzing the evolution of the state of
elements at each iteration time (the ""Simulator"" point of view), or it can be
analyzed from the point of view of a single element (the ""Observer""
perspective) that is receiving delayed information from the other elements in
the system. In the usual""Simulator"" timeframe, an absolute time (i.e. the
number of iterations $t$) is adopted to define the system state at each time
$t$. In the""Observer"" framework, the state of an element in the system is given
by its state at the ""Simulator"" time $t-\tau$, where $\tau$ is the information
travel time between that element and the Observer. We emphasize the convenience
of the analysis of the system dynamics in the ""Observer"" timeframe by showing
that the ""Observer"" dynamics differs substantially from the one in the
""Simulator"" timeframe, and that the system dynamics in the ""Observer"" timeframe
reflects the proper causality of the interactions among the elements.
","[{""version"":""v1"",""created"":""Fri, 20 May 2005 22:41:54 GMT""}]","2007-05-23"
"nucl-ex/0505021","Olga Barannikova","Olga Barannikova (for the STAR Collaboration)","High transverse momentum identified particle spectra in 200 GeV
  collisions from STAR","8 pages, 6 figures. Talk presented at 21st Winter Workshop on Nuclear
  Dynamics, Breckenridge, USA, 2005","Acta Phys.Hung. A25 (2006) 321-328","10.1556/APH.25.2006.2-4.21",,"nucl-ex",,"  Significant baryon over meson enhancement was measured at RHIC in the
intermediate transverse momentum range of $p_T=2-4$ GeV/$c$ (""baryon-meson
puzzle""). With STAR detector we were able to extend particle identification
towards higher transverse momentum offering further insights into the particle
production mechanisms at intermediate to high $p_T$. In this paper we present
results on charged pion, proton and anti-proton spectra and ratios at
intermediate to high $p_T$ exploiting the relativistic rise of the specific
ionization energy loss measured in the STAR Time Projection Chamber. These
measurements provide valuable information about the production mechanisms of
particles at intermediate $p_T$ in relativistic heavy ion collisions, e.g.
coalescence/recombination versus jet fragmentation.
","[{""version"":""v1"",""created"":""Fri, 20 May 2005 16:52:03 GMT""}]","2009-11-11"
"physics/0505142","Dirk Tasche","Dirk Tasche","Measuring sectoral diversification in an asymptotic multi-factor
  framework","LaTeX, 23 pages, 2 figures, forthcoming in Journal of Credit Risk","Journal of Credit Risk 2(3), 2006, 33-55",,,"physics.soc-ph q-fin.PM",,"  We investigate a multi-factor extension of the asymptotic single risk factor
(ASRF) model that underlies the capital charges of the ""Basel II Accord"". In
this extended model, it is still possible to derive closed-form solutions for
the risk contributions to Value-at-Risk and Expected Shortfall. As an
application of the risk contribution formulae we introduce a new concept for a
diversification measure. The use of this new measure is illustrated by an
example calculated with a two-factor model. The results with this model
indicate that, thanks to dependence on not fully correlated systematic sectors,
there can be a substantial reduction of risk contributions by sectoral
diversification effects.
","[{""version"":""v1"",""created"":""Fri, 20 May 2005 18:42:02 GMT""},{""version"":""v2"",""created"":""Wed, 19 Jul 2006 11:17:53 GMT""}]","2008-12-02"
"physics/0505145","Tobia Carozzi","T. D. Carozzi and A. M. Buckley","Deriving the sampling errors of correlograms for general white noise","Submitted to Biometrika",,,,"physics.data-an",,"  We derive the second-order sampling properties of certain autocovariance and
autocorrelation estimators for sequences of independent and identically
distributed samples. Specifically, the estimators we consider are the classic
lag windowed correlogram, the correlogram with subtracted sample mean, and the
fixed-length summation correlogram. For each correlogram we derive explicit
formulas for the bias, covariance, mean square error and consistency for
generalised higher-order white noise sequences. In particular, this class of
sequences may have non-zero means, be complexed valued and also includes
non-analytical noise signals. We find that these commonly used correlograms
exhibit lag dependent covariance despite the fact that these processes are
white and hence by definition do not depend on lag.
","[{""version"":""v1"",""created"":""Fri, 20 May 2005 16:18:10 GMT""}]","2007-05-23"
"physics/0505146","Janusz Mi\'skiewicz Dr","Janusz Miskiewicz and Marcel Ausloos","Influence of information flow in the formation of economic cycles","18 pages,16 figures, to be published in Verhulst 200 Proceedings, M.
  Ausloos and M. Dirickx, Eds. (in press)","in The Logistic Map and the Route to Chaos, M. Ausloos and M.
  Dirickx, Eds. (Springer, Berlin, 2006) pp. 223-238","10.1007/3-540-32023-7_13",,"physics.soc-ph",,"  A microscopic approach to macroeconomic features is intended. A model for
macroeconomic behavior based on the Ausloos-Clippe-Pekalski model is built and
investigated. The influence of a discrete time information transfer is
investigated. The formation of economic cycles is observed as a function of the
time of information delay. Three regions of delay time are recognized: short
$t_d \in (2 IS, 4 IS)$ (IS - iteration steps) - the system evolves toward a
unique stable equilibrium state, medium $t_d =5 IS $ or $t_d =6 IS $, the
system undergoes oscillations: stable concentration cycles appear in the
system. For long information flow delay times, $t_d \geq 7$, the systems may
crash for most initial concentrations. However, even in the case of long delay
time the crash time may be long enough to allow observation of the system
evolution and to introduce an appropriate strategy in order to avoid the
collapse of the e.g. company concentration. In the long time delay it is also
possible to observe an ""economy resonance"" where despite a long delay time the
system evolves for a long time or can even reach a stable state, which insures
its existence.
","[{""version"":""v1"",""created"":""Fri, 20 May 2005 18:52:04 GMT""}]","2015-06-26"
"physics/0505147","Lucas Fern\'andez-Seivane","J. Ferrer, L. Fernandez-Seivane, J. M. Hernando, M. B. Castan, L.
  Garcia, and J. M. Vazquez","On the exposure to mobile phone radiation in trains","9 pages, 1 figure","Appl. Phys. Lett. 86, 224101 (2005) (3 pages)","10.1063/1.1940120",,"physics.soc-ph",,"  This report presents theoretical estimates of the Power Density levels which
may be reached inside trains. Two possible sources of high levels of radiation
are discussed. The first one arises since the walls of the wagons are metallic
and therefore bounce back almost all radiation impinging on them. The second is
due to the simultaneous emission of a seemingly large number of nearby
telephones. The theoretical study presented here shows that Power Densities
stay at values below reference levels always.
","[{""version"":""v1"",""created"":""Fri, 20 May 2005 18:57:11 GMT""}]","2009-09-29"
"physics/0505148","Sophie Royer","Sophie Royer and Antoine Royer","TTRG integration of light transport equations: Azymuthally integrated
  radiances inside a Lambertian foliage",,,,,"physics.comp-ph physics.bio-ph",,"  A method for numerically integrating transport equations, combining transfer
matrices, transmission-reflection matrices, and Green's matrices (TTRG), was
recently proposed. The present paper deals specifically with azymuthally
integrated radiances inside a horizontally homogeneous canopy of Lambertian
leaves. Its main purpose is to test the accuracy of TTRG by applying it to
non-trivial models possessing analytical solutions, that were given in another
paper. Comparison is made with the widely used iterative integration (or
'relaxation' method). Cases of extreme light trapping are given for which
iterative integration is hardly practical, while TTRG remains as accurate and
rapid.
","[{""version"":""v1"",""created"":""Fri, 20 May 2005 19:00:11 GMT""}]","2007-05-23"
"q-bio/0505039","Georgy Karev","Georgy P. Karev","Dynamics of inhomogeneous populations and global demography models","25 pages, 7 figures; submitted to Journal of Biological Systems",,,,"q-bio.PE",,"  The dynamic theory of inhomogeneous populations developed during the last
decade predicts several essential new dynamic regimes applicable even to the
well-known, simple population models. We show that, in an inhomogeneous
population with a distributed reproduction coefficient, the entire initial
distribution of the coefficient should be used to investigate real population
dynamics. In the general case, neither the average rate of growth nor the
variance or any finite number of moments of the initial distribution is
sufficient to predict the overall population growth. We developed methods for
solving the heterogeneous models and explored the dynamics of the total
population size together with the reproduction coefficient distribution. We
show that, typically, there exists a phase of hyper-exponential growth that
precedes the well-known exponential phase of population growth in a free
regime. The developed formalism is applied to models of global demography and
the problem of population explosion predicted by the known hyperbolic formula
of world population growth. We prove here that the hyperbolic formula presents
an exact solution to the Malthus model with an exponentially distributed
reproduction coefficient and that population explosion is a corollary of
certain implicit unrealistic assumptions. Alternative models of world
population growth are derived; they show a notable phenomenon, a transition
from protracted hyperbolical growth (the phase of hyper-exponential
development) to the brief transitional phase of exponential growth and,
subsequently, to stabilization. The model solutions are consistent with real
data and produce relatively accurate forecasts.
","[{""version"":""v1"",""created"":""Fri, 20 May 2005 17:18:14 GMT""}]","2007-05-23"
"q-bio/0505040","Axel Brandenburg","Tuomas Multamaki, Axel Brandenburg (Nordita)","Spatial dynamics of homochiralization","8 pages, 5 figures, Int. J. Astrobiol. (in press)","Int. J. Astrobiol. 4 (2005) 73-78","10.1017/S1473550405002338","NORDITA-2005-34","q-bio.BM",,"  The emergence and spreading of chirality on the early Earth is considered by
studying a set of reaction-diffusion equations based on a polymerization model.
It is found that effective mixing of the early oceans is necessary to reach the
present homochiral state. The possibility of introducing mass extinctions and
modifying the emergence rate of life is discussed.
","[{""version"":""v1"",""created"":""Sat, 21 May 2005 06:19:54 GMT""}]","2015-06-26"
"q-bio/0505041","Axel Brandenburg","M. Nilsson, A. Brandenburg, A.C. Andersen, S. Hoefner","Uni-directional polymerization leading to homochirality in the RNA world","9 pages, 4 figures, submitted to Astrobiology","Int. J. Astrobiology 4, 233-239 (2005)","10.1017/S1473550405002752","NORDITA-2005-35","q-bio.BM",,"  The differences between uni-directional and bi-directional polymerization are
considered. The uni-directional case is discussed in the framework of the RNA
world. Similar to earlier models of this type, where polymerization was assumed
to proceed in a bi-directional fashion (presumed to be relevant to peptide
nucleic acids), left-handed and right-handed monomers are produced via an
autocatalysis from an achiral substrate. The details of the bifurcation from a
racemic solution to a homochiral state of either handedness is shown to be
remarkably independent of whether the polymerization in uni-directional or
bi-directional. Slightly larger differences are seen when dissociation is
allowed and the dissociation fragments are being recycled into the achiral
substrate.
","[{""version"":""v1"",""created"":""Sat, 21 May 2005 06:55:20 GMT""}]","2007-05-23"
"quant-ph/0505151","Jens Eisert","J. Eisert, M.M. Wolf","Gaussian quantum channels","20 pages, LaTeX. Review article, previously unpublished material in
  Sections 3.3 and 5.4","Quantum Information with Continous Variables of Atoms and Light,
  pages 23-42 (Imperial College Press, London, 2007)",,,"quant-ph",,"  This article provides an elementary introduction to Gaussian channels and
their capacities. We review results on the classical, quantum, and entanglement
assisted capacities and discuss related entropic quantities as well as
additivity issues. Some of the known results are extended. In particular, it is
shown that the quantum conditional entropy is maximized by Gaussian states and
that some implications for additivity problems can be extended to the Gaussian
setting.
","[{""version"":""v1"",""created"":""Fri, 20 May 2005 17:26:21 GMT""}]","2009-05-15"
"quant-ph/0505154","Keisuke Goda","Keisuke Goda, Kirk McKenzie, Eugeniy E. Mikhailov, Ping Koy Lam, David
  McClelland, Nergis Mavalvala","Photothermal Fluctuations as a Fundamental Limit to Low-Frequency
  Squeezing in a Degenerate Optical Parametric Amplifier",,"Phys. Rev. A 72, 043819 (2005)","10.1103/PhysRevA.72.043819",,"quant-ph",,"  We study the effect of photothermal fluctuations on squeezed states of light
through the photo-refractive effect and thermal expansion in a degenerate
optical parametric amplifier (OPA). We also discuss the effect of the
photothermal noise in various cases and how to minimize its undesirable
consequences. We find that the photothermal noise in the OPA introduces a
significant amount of noise on phase squeezed beams, making them less than
ideal for low frequency applications such as gravitational wave (GW)
interferometers, whereas amplitude squeezed beams are relatively immune to the
photothermal noise and may represent the best choice for application in GW
interferometers.
","[{""version"":""v1"",""created"":""Fri, 20 May 2005 21:02:02 GMT""}]","2007-05-23"
"quant-ph/0505155","Marcus Aguiar de","A. D. Ribeiro, M. Novaes and M. A. M. de Aguiar","A Uniform Approximation for the Coherent State Propagator using a
  Conjugate Application of the Bargmann Representation","4 pages, 1 figure","Phys. Rev. Lett. 95, 050405 (2005)","10.1103/PhysRevLett.95.050405",,"quant-ph",,"  We propose a conjugate application of the Bargmann representation of quantum
mechanics. Applying the Maslov method to the semiclassical connection formula
between the two representations, we derive a uniform semiclassical
approximation for the coherent state propagator which is finite at phase space
caustics.
","[{""version"":""v1"",""created"":""Fri, 20 May 2005 21:35:15 GMT""}]","2009-11-11"
