"cond-mat/0505519","Dietrich Belitz","S. Tewari, D. Belitz, and T.R. Kirkpatrick","Blue Quantum Fog: Chiral Condensation in Quantum Helimagnets","4pp, 1 eps fig","Phys. Rev. Lett. 96, 047207 (2006)","10.1103/PhysRevLett.96.047207","NSF-KITP-05-31","cond-mat.str-el cond-mat.stat-mech",,"  It is shown that a condensation transition involving a chiral order parameter
can occur in itinerant helimagnets, in analogy to the transition between the
isotropic phase and the phase known as blue fog or blue phase III in
cholesteric liquid crystals. It is proposed that such a transition is the
explanation for recent neutron scattering results in MnSi. Predictions are made
that will allow to experimentally test this proposal.
","[{""version"":""v1"",""created"":""Fri, 20 May 2005 19:02:31 GMT""}]","2007-05-23"
"cond-mat/0505520","Yakov P. Shkolnikov","M. Shayegan","Flatland Electrons in High Magnetic Fields","Review paper, to be published in book series ""High Magnetic Fields:
  Science and Technology"" edited by Fritz Herlach and Noboru Miura, World
  Scientific Co",,"10.1142/9789812774880_0002",,"cond-mat.mes-hall",,"  This paper provides a review of developments in the physics of
two-dimensional electron systems in perpendicular magnetic fields.
","[{""version"":""v1"",""created"":""Fri, 20 May 2005 19:30:47 GMT""}]","2016-11-23"
"cond-mat/0505521","Sergio L. A. de Queiroz","S.L.A. de Queiroz","Roughness of time series in a critical interface model",,"Physical Review E 72, 066104 (2005)","10.1103/PhysRevE.72.066104",,"cond-mat.stat-mech cond-mat.dis-nn",,"  We study roughness probability distribution functions (PDFs) of the time
signal for a critical interface model, which is known to provide a good
description of Barkhausen noise in soft ferromagnets. Starting with time
``windows'' of data collection much larger than the system's internal ``loading
time'' (related to demagnetization effects), we show that the initial Gaussian
shape of the PDF evolves into a double-Gaussian structure as window width
decreases. We supply a physical explanation for such structure, which is
compatible with the observed numerical data. Connections to experiment are
suggested.
","[{""version"":""v1"",""created"":""Fri, 20 May 2005 19:50:01 GMT""},{""version"":""v2"",""created"":""Sun, 30 Oct 2005 16:21:28 GMT""}]","2007-05-23"
"cond-mat/0505522","Alba Theumann","Eduardo M.M.Santos and Alba Theumann","Replica symmetry breaking in the transverse-field Ising spin-glass
  model: Two frmionic representations","16 pages, 4 figures. to appear in Physical Review B",,"10.1103/PhysRevB.72.014447",,"cond-mat.dis-nn",,"  We analyze the infinite range Ising spin-glass in a transverse-field below
the critical temperature by a one step replica symmetry theory(1S-RSB). The set
of n replicas is divided in r blocks of m replicas each. We present results for
different values of the block-size parameter m. The spin operators are
represented by bilinear combinations of fermionic fields and we compare the
results of two models: in the four state (4S)-model the diagonal S^z operator
has two unphysical vanishing eigenvalues, that are suppressed by a restraint in
the two states (2S)-model. In the static approximation we obtain qualitatively
similar results for both models. They both exhibit a critical temperature that
decreases when the transverse field increases,until it reaches a quantum
critical point (QCP) at the same value of the critical field, and they are both
unstable under replica symmetry breaking in the whole spin glass phase. Below
the critical temperature we present results for the order parameters and free
energy.
","[{""version"":""v1"",""created"":""Fri, 20 May 2005 20:15:29 GMT""}]","2009-11-11"
"cond-mat/0505523","Gyorgy Korniss","J.A. Yasi, G. Korniss, and T. Caraco","Invasive Allele Spread under Preemptive Competition","Computer Simulation Studies in Condensed Matter Physics XVIII, edited
  by D.P. Landau, S.P. Lewis, and H.-B. Schuttler, (Springer, Heidelberg,
  Berlin, in press)",,"10.1007/978-3-540-32640-3_23",,"cond-mat.stat-mech q-bio.PE",,"  We study a discrete spatial model for invasive allele spread in which two
alleles compete preemptively, initially only the ""residents"" (weaker
competitors) being present. We find that the spread of the advantageous
mutation is well described by homogeneous nucleation; in particular, in large
systems the time-dependent global density of the resident allele is well
approximated by Avrami's law.
","[{""version"":""v1"",""created"":""Fri, 20 May 2005 20:45:51 GMT""}]","2015-06-25"
"cond-mat/0505524","Aurel Bulgac","Aurel Bulgac","Comment on ""Structure of a Quantized Vortex near the BCS-BEC Crossover
  in an Atomic Fermi Gas""","1 page",,,,"cond-mat.stat-mech",,"  A comment on the letter by M. Machida and T. Koyama, Phys. Rev. Lett. {\bf
94}, 140401 (2005) and also on the preprint by Y. Kawaguchi and T. Ohmi,
cond-mat/0411018.
","[{""version"":""v1"",""created"":""Fri, 20 May 2005 21:55:06 GMT""}]","2007-05-23"
"cond-mat/0505525","Alejandro Gonzalez","Oscar Sotolongo-Costa, Alejandro Gonzalez Gonzalez, Francois Brouers","Generalized Non-extensive Statistical Distributions","11 pages, to be submitted for publication",,,,"cond-mat.stat-mech",,"  We find the value of constants related to constraints in characterization of
some known statistical distributions and then we proceed to use the idea behind
maximum entropy principle to derive generalized version of this distributions
using the Tsallis' and Renyi information measures instead of the well-known
Bolztmann-Gibbs-Shannon. These generalized distributions will depend on q (real
number) and in the limit (q=1) we obtain the ""classical"" ones. We found that
apart from a constant, generalized versions of statistical distributions
following Tsallis' or Renyi are undistinguishable.
","[{""version"":""v1"",""created"":""Fri, 20 May 2005 23:02:02 GMT""}]","2007-05-23"
"cond-mat/0505526","Onkar Nath Srivastava","Kalpana Awasthi, Anchal Srivastava and O.N.Srivastava","Synthesis of Carbon Nanotubes","65 pages, 9 figures. To appear in JNN",,,,"cond-mat.mtrl-sci",,"  Carbon nanotubes play a fundamental role in the rapidly developing field of
nanoscience and nanotechnology because of their unique properties and high
potential applictions. In this article, the different synthesis method of CNTs
are reviewed. From the industrial point of view, the chemical vapor depostion
method has shown advantages over electric arc discharge and laser vaporization
methods. Special CNTs configuration, such as nanocoils, nanohorns,
bamboo-shaped CNTs and carbon cylinder made up from from CNTs are also
discussed.
","[{""version"":""v1"",""created"":""Sat, 21 May 2005 03:03:47 GMT""}]","2007-05-23"
"cond-mat/0505527","Hisatsugu Yamasaki","Hisatsugu Yamasaki, Yuhei Natsume, Katsuhiro Nakamura","A model for conservative chaos constructed from multi-component
  Bose-Einstein condensates with a trap in 2 dimensions","5 pages, 4 figures",,"10.1143/JPSJ.74.1887",,"cond-mat.other cond-mat.soft",,"  To show a mechanism leading to the breakdown of a particle picture for the
multi-component Bose-Einstein condensates(BECs) with a harmonic trap in high
dimensions, we investigate the corresponding 2-$d$ nonlinear Schr{\""o}dinger
equation (Gross-Pitaevskii equation) with use of a modified variational
principle. A molecule of two identical Gaussian wavepackets has two degrees of
freedom(DFs), the separation of center-of-masses and the wavepacket width.
Without the inter-component interaction(ICI) these DFs show independent regular
oscillations with the degenerate eigen-frequencies. The inclusion of ICI
strongly mixes these DFs, generating a fat mode that breaks a particle picture,
which however can be recovered by introducing a time-periodic ICI with zero
average. In case of the molecule of three wavepackets for a three-component
BEC, the increase of amplitude of ICI yields a transition from regular to
chaotic oscillations in the wavepacket breathing.
","[{""version"":""v1"",""created"":""Sat, 21 May 2005 03:07:53 GMT""}]","2009-11-11"
"cond-mat/0505528","H. J. Xiang","H. J. Xiang, W. Z. Liang, Jinlong Yang, J. G. Hou, and Qingshi Zhu","Spin unrestricted linear scaling electronic structure theory and its
  application to magnetic carbon doped BN nanotubes","9 pages 4 figures, to appear in The Journal of Chemical Physics","J. Chem. Phys. 123, 124105 (2005)","10.1063/1.2034448",,"cond-mat.mtrl-sci",,"  We present an extension of density matrix based linear scaling electronic
structure theory to incorporate spin degrees of freedom. When the spin
multiplicity of the system can be predetermined, the generalization of the
existing linear scaling methods to spin unrestricted cases is straightforward.
However, without calculations it is hard to determine the spin multiplicity of
some complex systems, such as, many magnetic nanostuctures, some inorganic or
bioinorganic molecules. Here we give a general prescription to obtain the
spin-unrestricted ground state of open shell systems. Our methods are
implemented into the linear scaling trace-correcting density matrix
purification algorithm. The numerical atomic orbital basis, rather than the
commonly adopted Gaussian basis functions is used. The test systems include O2
molecule, and magnetic carbon doped BN(5,5) and BN(7,6) nanotubes. Using the
newly developed method, we find the magnetic moments in carbon doped BN
nanotubes couple antiferromagnetically with each other. Our results suggest
that the linear scaling spin-unrestricted trace-correcting purification method
is very powerful to treat large magnetic systems.
","[{""version"":""v1"",""created"":""Sat, 21 May 2005 05:36:55 GMT""},{""version"":""v2"",""created"":""Sat, 23 Jul 2005 03:09:45 GMT""}]","2007-05-23"
"cond-mat/0505529","F. D. M. Haldane","F. D. M. Haldane","Luttinger's Theorem and Bosonization of the Fermi Surface","17 pages, 0 figures; A 1993 preprint form of a published but
  hard-to-find article based on lectures presented at the International School
  of Physics ""Enrico Fermi"", Varenna, Italy, July 1992","Proceedings of the International School of Physics ""Enrico Fermi"",
  Course CXXI ""Perspectives in Many-Particle Physics"" eds. R. A. Broglia and J.
  R. Schrieffer (North-Holland, Amsterdam 1994) pp 5-29",,,"cond-mat.str-el",,"  A course of four lectures given at the International School of Physics
""Enrico Fermi"", Varenna, Italy, July 1992, in which the underlying algebraic
structure needed for bosonization of the Fermi surface in two- or
three-dimensions was first described. This is an unchanged 1993 preprint
version of a published but hard-to-find (and often mis-cited) 1994 article in
the Varenna Summer School proceedings. The d > 1 dimensional generalization of
the Kac-Moody algebra on the Fermi surface is presented, and the Gaussian
reduction of the Fermi liquid to harmonic oscilator modes is derived.
One-dimensional bosonization and the symmetries of spin-charge separation are
also reviewed.
","[{""version"":""v1"",""created"":""Sat, 21 May 2005 05:36:59 GMT""}]","2007-05-23"
"cond-mat/0505530","Xin Wan","Xin Wan, D.N. Sheng, E.H. Rezayi, Kun Yang, R.N. Bhatt, F.D.M. Haldane","Mobility gap in fractional quantum Hall liquids: Effects of disorder and
  layer thickness","13 pages, 8 figures","Phys. Rev. B 72, 075325 (2005)","10.1103/PhysRevB.72.075325",,"cond-mat.mes-hall",,"  We study the behavior of two-dimensional electron gas in the fractional
quantum Hall regime in the presence of finite layer thickness and correlated
disordered potential. Generalizing the Chern number calculation to many-body
systems, we determine the mobility gaps of fractional quantum Hall states based
on the distribution of Chern numbers in a microscopic model. We find excellent
agreement between experimentally measured activation gaps and our calculated
mobility gaps, when combining the effects of both disordered potential and
layer thickness. We clarify the difference between mobility gap and spectral
gap of fractional quantum Hall states and explain the disorder-driven collapse
of the gap and the subsequent transitions from the fractional quantum Hall
states to insulator.
","[{""version"":""v1"",""created"":""Sat, 21 May 2005 06:04:59 GMT""}]","2009-11-11"
"cond-mat/0505533","Anna Carbone","A. Carbone, B. K. Kotowska, D. Kotowski","Space-Charge-Limited Current Fluctuations in Organic Semiconductors","corrected proofs","Phys. Rev. Lett. 95, 236601 (2005)","10.1103/PhysRevLett.95.236601",,"cond-mat.dis-nn cond-mat.mtrl-sci",,"  Low-frequency current fluctuations are investigated over a bias range
covering {\em ohmic}, {\em trap-filling} and {\em space-charge-limited current}
regimes in polycrystalline polyacenes. The relative current noise power
spectral density ${\cal S}(f)$ is constant in the {\em ohmic} region, steeply
increases at the {\em trap-filling transition} region and decreases in the {\em
space-charge-limited-current} region.
  The {\em noise peak} at the {\em trap-filling transition} is accounted for
within a {\em continuum percolation model}. As the quasi-Fermi level crosses
the trap level, intricate insulating paths nucleate within the ohmic matrix,
determining the onset of non-equilibrium conditions at the interface between
the insulating and conducting phase. The {\em noise peak} is written in terms
of the free and trapped charge carrier densities.
","[{""version"":""v1"",""created"":""Sat, 21 May 2005 11:56:26 GMT""},{""version"":""v2"",""created"":""Sun, 3 Jul 2005 16:21:05 GMT""},{""version"":""v3"",""created"":""Thu, 12 Jan 2006 13:42:16 GMT""}]","2007-05-23"
"cs/0505054","Mostafa El-Khamy","Mostafa El-Khamy and Robert J. McEliece","The Partition Weight Enumerator of MDS Codes and its Applications","This is a five page conference version of the paper which was
  accepted by ISIT 2005. For more information, please contact the authors",,,,"cs.IT math.IT",,"  A closed form formula of the partition weight enumerator of maximum distance
separable (MDS) codes is derived for an arbitrary number of partitions. Using
this result, some properties of MDS codes are discussed. The results are
extended for the average binary image of MDS codes in finite fields of
characteristic two. As an application, we study the multiuser error probability
of Reed Solomon codes.
","[{""version"":""v1"",""created"":""Sat, 21 May 2005 01:21:27 GMT""}]","2007-07-16"
"gr-qc/0505101","Gonzalo Olmo","Gonzalo J. Olmo","The gravity lagrangian according to solar system experiments","4 pages, revtex4","Phys.Rev.Lett.95:261102,2005","10.1103/PhysRevLett.95.261102",,"gr-qc astro-ph hep-th",,"  In this work we show that the gravity lagrangian f(R) at relatively low
curvatures in both metric and Palatini formalisms is a bounded function that
can only depart from the linearity within the limits defined by well known
functions. We obtain those functions by analysing a set of inequalities that
any f(R) theory must satisfy in order to be compatible with laboratory and
solar system observational constraints. This result implies that the recently
suggested f(R) gravity theories with nonlinear terms that dominate at low
curvatures are incompatible with observations and, therefore, cannot represent
a valid mechanism to justify the cosmic speed-up.
","[{""version"":""v1"",""created"":""Fri, 20 May 2005 16:58:32 GMT""},{""version"":""v2"",""created"":""Sun, 22 May 2005 01:47:50 GMT""}]","2008-11-26"
"gr-qc/0505109","Eduardo Sergio Santini","N. Pinto-Neto (CBPF-ICRA-Rio de Janeiro), E. Sergio Santini (CBPF-ICRA
  and CNEN-Rio de Janeiro) and F. T. Falciano (CBPF-ICRA-Rio de Janeiro)","Quantization of Friedmann cosmological models with two fluids: dust plus
  radiation","27 pages, 6 figures","Phys.Lett. A344 (2005) 131-143","10.1016/j.physleta.2005.06.080",,"gr-qc",,"  The causal interpretation of quantum mechanics is applied to a homogeneous
and isotropic quantum universe, whose matter content is composed by non
interacting dust and radiation. For wave functions which are eigenstates of the
total dust mass operator, we find some bouncing quantum universes which reachs
the classical limit for scale factors much larger than its minimum size.
However these wave functions do not have unitary evolution. For wave functions
which are not eigenstates of the dust total mass operator but do have unitary
evolution, we show that, for flat spatial sections, matter can be created as a
quantum effect in such a way that the universe can undergo a transition from an
exotic matter dominated era to a matter dominated one.
","[{""version"":""v1"",""created"":""Fri, 20 May 2005 22:31:23 GMT""}]","2009-11-11"
"hep-ph/0505183","Joseph Schechter","S. Masood, S. Nasri and J. Schechter","Fine structure of beta decay endpoint spectrum","9 pages, 8 figures","Int.J.Mod.Phys. A21 (2006) 517-532","10.1142/S0217751X06028552",,"hep-ph",,"  We note that the fine structure at the endpoint region of the beta decay
spectrum is now essentially known using neutrino oscillation data, if the mass
of one neutrino is specified. This may help to identify the effects of nonzero
neutrino masses in future experiments. An exact treatment of phase space
kinematics is used. This work is independent of theoretical models. Additional
restrictions due to the assumption of a so-called ""complementary ansatz"" for
the neutrino mass matrix are also discussed.
","[{""version"":""v1"",""created"":""Fri, 20 May 2005 19:13:37 GMT""},{""version"":""v2"",""created"":""Wed, 24 Aug 2005 21:36:42 GMT""}]","2009-11-11"
"hep-ph/0505184","Jiaolin Xu","Jiao Lin Xu","Deducing the Lowest Rest Mass Quarks and Baryons of all Kinds with an
  Expanded Form of Planck-Bohr's Quantization Method","16pages, 1 figures",,,,"hep-ph",,"  Using an expanded form of Planck-Bohr's quantization method and
phenomenological formulae,} {\small we deduce the rest masses and intrinsic
quantum numbers (I, S, C, b and Q) of all kinds of the lowest energy quarks and
baryons, from only one elementary quark family}$\epsilon $ {\small with S = C =
b = 0. The deduced quantum numbers match those found in experiments. The
deduced rest masses are consistent with experimental results. This paper
predicts some quarks $\text{u}_{C}\text{(6073),}$}d$_{S}${\small (9613)}
{\small $\text{and d}_{b}\text{(9333)}$and baryons $\Lambda_{c}^{+}$% (6696),
$\Lambda_{b}$(9959)and $\Lambda $(10239).
","[{""version"":""v1"",""created"":""Fri, 20 May 2005 19:15:16 GMT""},{""version"":""v2"",""created"":""Thu, 26 May 2005 16:31:56 GMT""}]","2007-05-23"
"hep-ph/0505185","Fotis K. Diakonos","N.G. Antoniou, Y.F. Contoyiannis, F.K. Diakonos and G. Mavromanolakis","Critical QCD in Nuclear Collisions","13 pages, 7 figures","Nucl.Phys. A761 (2005) 149-161","10.1016/j.nuclphysa.2005.07.003","UA-NPPS/03/2005","hep-ph",,"  A detailed study of correlated scalars, produced in collisions of nuclei and
associated with the $\sigma$-field fluctuations, $(\delta \sigma)^2= < \sigma^2
>$, at the QCD critical point (critical fluctuations), is performed on the
basis of a critical event generator (Critical Monte-Carlo) developed in our
previous work. The aim of this analysis is to reveal suitable observables of
critical QCD in the multiparticle environment of simulated events and select
appropriate signatures of the critical point, associated with new and strong
effects in nuclear collisions.
","[{""version"":""v1"",""created"":""Fri, 20 May 2005 19:48:49 GMT""}]","2009-11-11"
"hep-ph/0505186","Daniel Boyanovsky","D. Boyanovsky","Neutrino collective excitations in the Standard Model at high
  temperature","32 pages 16 figs. Discussion on screening corrections. Results
  unchanged to appear in Phys. Rev. D","Phys.Rev. D72 (2005) 033004","10.1103/PhysRevD.72.033004",,"hep-ph astro-ph hep-th nucl-th",,"  Neutrino collective excitations are studied in the Standard Model at high
temperatures below the symmetry breaking scale. Two parameters determine the
properties of the collective excitations: a mass scale $m_\nu=gT/4$ which
determines the \emph{chirally symmetric} gaps in the spectrum and
$\Delta=M^2_W(T)/2m_\nu T$. The spectrum consists of left handed negative
helicity quasiparticles, left handed positive helicity quasiholes and their
respective antiparticles. For $\Delta < \Delta_c = 1.275...$ there are two
gapped quasiparticle branches and one gapless and two gapped quasihole
branches, all but the higher gapped quasiparticle branches terminate at end
points. For $\Delta_c < \Delta < \pi/2$ the quasiparticle spectrum features a
pitchfork bifurcation and for $\Delta >\pi/2$ the collective modes are gapless
quasiparticles with dispersion relation below the light cone for $k\ll m_\nu$
approaching the free field limit for $k\gg m_\nu$ with a rapid crossover
between the soft non-perturbative to the hard perturbative regimes for $k\sim
m_\nu$.The \emph{decay} of the vector bosons leads to a \emph{width} of the
collective excitations of order $g^2$ which is explicitly obtained in the
limits $k =0$ and $k\gg m_\nu \Delta$. At high temperature this damping rate is
shown to be competitive with or larger than the collisional damping rate of
order $G^2_F$ for a wide range of neutrino energy.
","[{""version"":""v1"",""created"":""Fri, 20 May 2005 20:30:38 GMT""},{""version"":""v2"",""created"":""Mon, 23 May 2005 21:25:47 GMT""},{""version"":""v3"",""created"":""Thu, 21 Jul 2005 20:34:39 GMT""}]","2009-11-11"
"hep-ph/0505187","Dumitru Ghilencea","D. M. Ghilencea, Hyun Min Lee","Higher Derivative Operators from Transmission of Supersymmetry Breaking
  on S_1/Z_2","29 pages, LaTeX. Added Section 4 (""Phenomenological implications:
  living with ghosts?"") and Appendix B","JHEP 0509:024,2005","10.1088/1126-6708/2005/09/024","DAMTP-2005-34, DESY-05-073","hep-ph hep-th",,"  We discuss the role that higher derivative operators play in field theory
orbifold compactifications on S_1/Z_2 with local and non-local (Scherk-Schwarz)
breaking of supersymmetry. Integrating out the bulk fields generates
brane-localised higher derivative counterterms to the mass of the brane (or
zero-mode of the bulk) scalar field, identified with the Higgs field in many
realistic models. Both Yukawa and gauge interactions are considered and the
one-loop results found can be used to study the ``running'' of the scalar field
mass with respect to the momentum scale in 5D orbifolds. In particular this
allows the study of the behaviour of the mass under UV scaling of the momentum.
The relation between supersymmetry breaking and the presence of higher
derivative counterterms to the mass of the scalar field is investigated. This
shows that, regardless of the breaking mechanism, (initial) supersymmetry
cannot, in general, prevent the emergence of such operators. Some implications
for phenomenology of the higher derivative operators are also presented.
","[{""version"":""v1"",""created"":""Fri, 20 May 2005 21:17:28 GMT""},{""version"":""v2"",""created"":""Sat, 11 Jun 2005 17:37:26 GMT""},{""version"":""v3"",""created"":""Mon, 5 Sep 2005 17:38:53 GMT""}]","2010-11-19"
"hep-th/0505181","Alfonso V. Ramallo","Daniel Arean, Angel Paredes and Alfonso V. Ramallo","Adding flavor to the gravity dual of non-commutative gauge theories","50 pages, 9 figures, LaTeX; v2: minor improvements, references added;
  v3: typos corrected","JHEP0508:017,2005","10.1088/1126-6708/2005/08/017","US-FT-1/05, CPHT-RR 027.0505","hep-th",,"  We study the addition of flavor degrees of freedom to the supergravity dual
of the non-commutative deformation of the maximally supersymmetric gauge
theories. By considering D7 flavor branes in the probe approximation and
studying their fluctuations we extract the spectrum of scalar and vector mesons
as a function of the non-commutativity. We find that the spectrum for very
large non-commutative parameter is equal to the one in the commutative theory,
while for some intermediate values of the non-commutativity some of the modes
disappear from the discrete spectrum. We also study the semiclassical dynamics
of rotating open strings attached to the D7-brane, which correspond to mesons
with large spin. Under the effect of the non-commutativity the open strings get
tilted. However, at small(large) distances they display the same Regge-like
(Coulombic) behaviour as in the commutative theory. We also consider the
addition of D5-flavor branes to the non-commutative deformation of the N=1
supersymmetric Maldacena-Nunez background.
","[{""version"":""v1"",""created"":""Fri, 20 May 2005 17:55:00 GMT""},{""version"":""v2"",""created"":""Thu, 2 Jun 2005 16:59:57 GMT""},{""version"":""v3"",""created"":""Tue, 2 Aug 2005 18:23:18 GMT""}]","2009-11-11"
"hep-th/0505182","Ansar Fayyazuddin","Ansar Fayyauddin and Tasneem Zehra Husain","The Geometry of M-Branes Wrapping Special Lagrangian Cycles","17 pages, correct version","Class.Quant.Grav.23:7245-7256,2006","10.1088/0264-9381/23/24/004","HUTP-05/A0021, BCCUNY-HEP /05-03","hep-th",,"  We characterize the geometry produced by M5-branes wrapping a Special
Lagrangian 3-cycle in a Calabi-Yau 3-fold. The presence of the brane replaces
the the Calabi-Yau by a real manifold with an almost complex structure. We show
that, in this classification, a distinguished (1,1) form as well as a globally
defined (3,0) form play an important role. The requirements of supersymmetry
preservation impose constraints on these structures which can be used to
classify the background.
","[{""version"":""v1"",""created"":""Fri, 20 May 2005 16:13:48 GMT""},{""version"":""v2"",""created"":""Mon, 23 May 2005 16:30:40 GMT""}]","2009-11-11"
