"quant-ph/0505156","Shao-Ming Fei","Sergio Albeverio, Shao-Ming Fei, Debashish Goswami","Local Invariants for a Class of Mixed States","9 pages","Phys. Lett. A 340 (2005) 37-42","10.1016/j.physleta.2005.04.005",,"quant-ph",,"  We investigate the equivalence of quantum states under local unitary
transformations. A complete set of invariants under local unitary
transformations is presented for a class of mixed states. It is shown that two
states in this class are locally equivalent if and only if all these invariants
have equal values for them.
","[{""version"":""v1"",""created"":""Sat, 21 May 2005 02:55:27 GMT""}]","2009-11-11"
"quant-ph/0505157","H. T Cui","H. T. Cui, L. C. Wang, X. X. Yi","Geometric Phase in Entangled Bipartite Systems","5 pages and to be published in Euro. Phys. J. D","Eur. Phys. J. D 41, 385-389 (2007)","10.1140/epjd/e2006-00224-x",,"quant-ph",,"  The geometric phase (GP) for bipartite systems in transverse external
magnetic fields is investigated in this paper. Two different situations have
been studied. We first consider two non-interacting particles. The results show
that because of entanglement, the geometric phase is very different from that
of the non-entangled case. When the initial state is a Werner state, the
geometric phase is, in general, zero and moreover the singularity of the
geometric phase may appear with a proper evolution time. We next study the
geometric phase when intra-couplings appear and choose Werner states as the
initial states to entail this discussion. The results show that unlike our
first case, the absolute value of the GP is not zero, and attains its maximum
when the rescaled coupling constant $J$ is less than 1. The effect of
inhomogeneity of the magnetic field is also discussed.
","[{""version"":""v1"",""created"":""Sat, 21 May 2005 04:40:37 GMT""},{""version"":""v2"",""created"":""Wed, 4 Oct 2006 12:48:35 GMT""}]","2009-11-11"
"quant-ph/0505158","Tabish Qureshi","Tabish Qureshi (Centre for Theoretical Physics, JMI, New Delhi)","Analysis of Popper's Experiment and its Realization","Published version","Prog. Theor. Phys. 127 (2012), 645-656","10.1143/PTP.127.645",,"quant-ph","http://arxiv.org/licenses/nonexclusive-distrib/1.0/","  An experiment proposed by Karl Popper to test the standard interpretation of
quantum mechanics was realized by Kim and Shih. We use a quantum mechanical
calculation to analyze Popper's proposal, and find a surprising result for the
location of the virtual slit. We also analyze Kim and Shih's experiment, and
demonstrate that although it ingeniously overcomes the problem of temporal
spreading of the wave-packet, it is inconclusive about Popper's test. We point
out that another experiment which (unknowingly) implements Popper's test in a
conclusive way, has actually been carried out. Its results are in contradiction
with Popper's prediction, and agree with our analysis.
","[{""version"":""v1"",""created"":""Sat, 21 May 2005 05:34:03 GMT""},{""version"":""v2"",""created"":""Tue, 6 Mar 2012 07:01:40 GMT""},{""version"":""v3"",""created"":""Tue, 17 Apr 2012 07:14:25 GMT""}]","2012-05-03"
"quant-ph/0505159","Gagik Kryuchkyan Yu.","H. Adamyan, J. Bergou, N. Gevorgyan, G. Kryuchkyan","Periodically Pulsed Strong Squeezing","4 pages, 4 figures, Proceedings of conference ""Laser physics - 2004"",
  Ashtarak-2, Armenia",,,,"quant-ph",,"  We report on specific signatures of squeezing for time-modulated light
fields. We show that application of periodically-modulated driving fields
instead of continuous wave fields drastically improves the degree of quadrature
integral squeezing in an optical parametric oscillator. These results
particularly allow for applications in time-resolved quantum communication
protocols.
","[{""version"":""v1"",""created"":""Sat, 21 May 2005 10:03:34 GMT""},{""version"":""v2"",""created"":""Fri, 20 Jan 2006 08:55:12 GMT""}]","2007-05-23"
