"hep-th/0506004","Ralf Hofmann","Ulrich Herbst","The deconfining phase of SU(2) Yang-Mills thermodynamics","72 pages, 14 figures, Diploma thesis Universitaet Heidelberg",,,,"hep-th",,"  Phase and modulus of an energy- and pressure-free, composite and adjoint
field in an SU(2) Yang-Mills theory are computed. This field is generated by
trivial holonomy calorons of topological charge one. It possesses nontrivial
$S_1$-winding on the group manifold. The two-loop contribution to the
thermodynamical pressure of an SU(2) Yang-Mills theory in the electric
(deconfining) phase is computed in the real time formalism of finite
temperature field theory. The result supports the picture of only very weakly
interacting quasiparticles.
","[{""version"":""v1"",""created"":""Wed, 1 Jun 2005 09:23:32 GMT""}]","2007-05-23"
"hep-th/0506005","Jean Iliopoulos","Jean Iliopoulos (LPTENS)","Gauge Theories and Non-Commutative Geometry",,"Fortsch.Phys. 54 (2006) 139-145","10.1002/prop.200510262",,"hep-th",,"  It is shown that a $d$-dimensional classical SU(N) Yang-Mills theory can be
formulated in a $d+2$-dimensional space, with the extra two dimensions forming
a surface with non-commutative geometry.
","[{""version"":""v1"",""created"":""Wed, 1 Jun 2005 11:59:28 GMT""}]","2009-11-11"
"hep-th/0506006","Alexander Burinskii","Alexander Burinskii","Wonderful Consequences of the Kerr Theorem","v.2, added the proof that solutions are exact, plenary talk at the
  Russian conference GR-12 (Kazan', June 2005), and talks at the workshops: SQS
  (Dubna, 27 July) and `Symmetry and Spin' (Prague, August 2005)","Grav.Cosmol.11:301,2005",,,"hep-th gr-qc quant-ph",,"  Kerr's multi-particle solution is obtained on the base of the Kerr theorem.
Choosing generating function of the Kerr theorem $F$ as a product of partial
functions $F_i$ for spinning particles i=1,...k, we obtain a multi-sheeted,
multi-twistorial space-time over $M^4$ possessing unusual properties.
Twistorial structures of the i-th and j-th particles do not feel each other,
forming a type of its internal space. Gravitation and electromagnetic
interaction of the particles occurs via a singular twistor line which is common
for twistorial structures of interacting particles. The obtained multi-particle
Kerr-Newman solution turns out to be `dressed' by singular twistor lines linked
to surrounding particles. We conjecture that this structure of space-time has
the relation to a stringy structure of vacuum and opens a geometrical way to
quantum gravity.
","[{""version"":""v1"",""created"":""Wed, 1 Jun 2005 11:47:39 GMT""},{""version"":""v2"",""created"":""Tue, 18 Oct 2005 12:01:11 GMT""}]","2008-11-26"
"hep-th/0506007","Pedro Bordalo","Pedro Bordalo","Closed string tachyons in a smooth curved background","11 pages, 1 figure",,,,"hep-th",,"  Closed string tachyon condensation has been studied in orbifolds C^2/Z_{N,p}
of flat space, using the chiral ring of the underlying N=2 conformal field
theory. Here we show that similar phenomena occur in the curved smooth
background obtained by adding NS5-branes, such that chiral tachyons are
localised on lens submanifolds SU(2)/Z_{N,p}. We find a level-independent
subring which coincides with that of C^2/Z_{N,p}, corresponding to condensation
processes similar to those of hep-th/0111154. We also study level-dependent
chiral tachyons.
","[{""version"":""v1"",""created"":""Wed, 1 Jun 2005 11:50:38 GMT""}]","2007-05-23"
"hep-th/0506008","Alessandro Zampini","Fedele Lizzi, Patrizia Vitale, Alessandro Zampini","The beat of a fuzzy drum: fuzzy Bessel functions for the disc","30 pages, 8 figures","JHEP0509:080,2005","10.1088/1126-6708/2005/09/080","Report-no: DSF-4-2005, SISSA 37/2005/FM","hep-th cond-mat.mes-hall",,"  The fuzzy disc is a matrix approximation of the functions on a disc which
preserves rotational symmetry. In this paper we introduce a basis for the
algebra of functions on the fuzzy disc in terms of the eigenfunctions of a
properly defined fuzzy Laplacian. In the commutative limit they tend to the
eigenfunctions of the ordinary Laplacian on the disc, i.e. Bessel functions of
the first kind, thus deserving the name of fuzzy Bessel functions.
","[{""version"":""v1"",""created"":""Wed, 1 Jun 2005 12:48:50 GMT""}]","2009-11-11"
"hep-th/0506009","Louis Paulot","Sophie de Buyl, Marc Henneaux, Louis Paulot","Hidden Symmetries and Dirac Fermions","30 pages","Class.Quant.Grav. 22 (2005) 3595-3622","10.1088/0264-9381/22/17/018","ULB-TH/05-13","hep-th",,"  In this paper, two things are done. First, we analyze the compatibility of
Dirac fermions with the hidden duality symmetries which appear in the toroidal
compactification of gravitational theories down to three spacetime dimensions.
We show that the Pauli couplings to the p-forms can be adjusted, for all simple
(split) groups, so that the fermions transform in a representation of the
maximal compact subgroup of the duality group G in three dimensions. Second, we
investigate how the Dirac fermions fit in the conjectured hidden overextended
symmetry G++. We show compatibility with this symmetry up to the same level as
in the pure bosonic case. We also investigate the BKL behaviour of the
Einstein-Dirac-p-form systems and provide a group theoretical interpretation of
the Belinskii-Khalatnikov result that the Dirac field removes chaos.
","[{""version"":""v1"",""created"":""Wed, 1 Jun 2005 13:22:41 GMT""},{""version"":""v2"",""created"":""Mon, 6 Jun 2005 16:59:30 GMT""}]","2009-11-11"
"hep-th/0506010","Murat Gunaydin","M. Gunaydin and O. Pavlyk","Generalized spacetimes defined by cubic forms and the minimal unitary
  realizations of their quasiconformal groups","A typo in equation (37) corrected and missing titles of some
  references added. Version to be published in JHEP. 38 pages, latex file","JHEP 0508:101,2005","10.1088/1126-6708/2005/08/101",,"hep-th",,"  We study the symmetries of generalized spacetimes and corresponding phase
spaces defined by Jordan algebras of degree three. The generic Jordan family of
formally real Jordan algebras of degree three describe extensions of the
Minkowskian spacetimes by an extra ""dilatonic"" coordinate, whose rotation,
Lorentz and conformal groups are SO(d-1), SO(d-1,1) XSO(1,1) and
SO(d,2)XSO(2,1), respectively. The generalized spacetimes described by simple
Jordan algebras of degree three correspond to extensions of Minkowskian
spacetimes in the critical dimensions (d=3,4,6,10) by a dilatonic and extra
(2,4,8,16) commuting spinorial coordinates, respectively. The Freudenthal
triple systems defined over these Jordan algebras describe conformally
covariant phase spaces. Following hep-th/0008063, we give a unified geometric
realization of the quasiconformal groups that act on their conformal phase
spaces extended by an extra ""cocycle"" coordinate. For the generic Jordan family
the quasiconformal groups are SO(d+2,4), whose minimal unitary realizations are
given. The minimal unitary representations of the quasiconformal groups F_4(4),
E_6(2), E_7(-5) and E_8(-24) of the simple Jordan family were given in our
earlier work hep-th/0409272.
","[{""version"":""v1"",""created"":""Wed, 1 Jun 2005 14:05:17 GMT""},{""version"":""v2"",""created"":""Mon, 20 Jun 2005 17:32:59 GMT""},{""version"":""v3"",""created"":""Fri, 26 Aug 2005 17:18:36 GMT""}]","2010-02-03"
"hep-th/0506011","Michel Rausch de Traubenberg","M. Rausch de Traubenberg","Clifford Algebras in Physics","LaTex 38 pages, Lecture given at the Preparatory Lectures of the 7th
  International Conference on Clifford Algebras and their Applications -ICCA7-,
  Toulouse, France, May 19-29, 2005",,,,"hep-th math-ph math.MP",,"  We study briefly some properties of real Clifford algebras and identify them
as matrix algebras. We then show that the representation space on which
Clifford algebras act are spinors and we study in details matrix
representations. The precise structure of these matrices gives rise to the type
of spinors one is able to construct in a given space-time dimension: Majorana
or Weyl. Properties of spinors are also studied. We finally show how Clifford
algebras enable us to construct supersymmetric extensions of the Poincar\'e
algebra. A special attention to the four, ten and eleven-dimensional
space-times is given. We then study the representations of the considered
supersymmetric algebras and show that representation spaces contain an equal
number of bosons and fermions. Supersymmetry turns out to be a symmetry which
mixes non-trivially the bosons and the fermions since one multiplet contains
bosons and fermions together. We also show how supersymmetry in four and ten
dimensions are related to eleven dimensional supersymmetry by compactification
or dimensional reduction.
","[{""version"":""v1"",""created"":""Wed, 1 Jun 2005 14:38:35 GMT""}]","2007-05-23"
"math-ph/0506001","James McCaw","J. M. McCaw, B. H. J. McKellar","On the continuous spectral component of the Floquet operator for a
  periodically kicked quantum system","25 pages, published in Journal of Mathematical Physics","Journal of Mathematical Physics 46, 103503 (2005)","10.1063/1.2035027",,"math-ph math.MP",,"  By a straightforward generalisation, we extend the work of Combescure from
rank-1 to rank-N perturbations. The requirement for the Floquet operator to be
pure point is established and compared to that in Combescure. The result
matches that in McCaw. The method here is an alternative to that work. We show
that if the condition for the Floquet operator to be pure point is relaxed,
then in the case of the delta-kicked Harmonic oscillator, a singularly
continuous component of the Floquet operator spectrum exists. We also provide
an in depth discussion of the conjecture presented in Combescure of the case
where the unperturbed Hamiltonian is more general. We link the physics
conjecture directly to a number-theoretic conjecture of Vinogradov and show
that a solution of Vinogradov's conjecture solves the physics conjecture. The
result is extended to the rank-N case. The relationship between our work and
the work of Bourget on the physics conjecture is discussed.
","[{""version"":""v1"",""created"":""Wed, 1 Jun 2005 06:14:14 GMT""},{""version"":""v2"",""created"":""Tue, 25 Oct 2005 05:57:27 GMT""}]","2007-05-23"
"math-ph/0506002","Anatoly Nikitin","Anatoly G. Nikitin and Oleksander I. Prylypko","Generalized Killing Tensors and Symmetry of Klein-Gordon-Fock Equations","The first version of the paper was published as a preprint in
  Russian: Preprint N 90.23, Kyiv, Institute of Mathematics, 1990, 59 p",,,,"math-ph math.MP",,"  The paper studies non-Lie symmetry of the Klein-Gordon-Fock equation (KGF) in
$(p+q)$-dimensional Minkowsky space. Full set of symmetry operators for the
$n$-order KGF equation was explicitly calculated for arbitrary $n<\infty$ and
$p+q \leq 4$.
  Definition was given for generalized Killing tensors of rank $j$ and order
$s$, and for generalized conformal Killing tensors of rank $j$ and order $s$ as
a complete set of linearly independent solutions of some overdetermined systems
of PDE. These tensors were found in explicit form for arbitrary fixed $j$ and
$s$ in Minkowsky space of dimension $p+q \leq 4$. The received results can be
used in investigation of higher symmetries of a wide class of systems of
partial differential equations.
","[{""version"":""v1"",""created"":""Wed, 1 Jun 2005 07:19:06 GMT""}]","2007-05-23"
"math-ph/0506003","Narciso Roman-Roy","Arturo Echeverria-Enriquez, Manuel de Leon, Miguel C. Munoz-Lecanda,
  Narciso Roman-Roy","Extended Hamiltonian systems in multisymplectic field theories","36 pp. The introduction and the abstract have been rewritten. New
  references are added and some little mistakes are corrected. The title has
  been slightly modified","J. Math. Phys. 48(11) (2007) 112901","10.1063/1.2801875","hdl.handle.net/2117/399","math-ph math.MP",,"  We consider Hamiltonian systems in first-order multisymplectic field
theories. We review the properties of Hamiltonian systems in the so-called
restricted multimomentum bundle, including the variational principle which
leads to the Hamiltonian field equations. In an analogous way to how these
systems are defined in the so-called extended (symplectic) formulation of
non-autonomous mechanics, we introduce Hamiltonian systems in the extended
multimomentum bundle. The geometric properties of these systems are studied,
the Hamiltonian equations are analyzed using integrable multivector fields, the
corresponding variational principle is also stated, and the relation between
the extended and the restricted Hamiltonian systems is established. All these
properties are also adapted to certain kinds of submanifolds of the
multimomentum bundles in order to cover the case of almost-regular field
theories.
","[{""version"":""v1"",""created"":""Wed, 1 Jun 2005 10:48:01 GMT""},{""version"":""v2"",""created"":""Mon, 20 Jun 2005 16:04:31 GMT""},{""version"":""v3"",""created"":""Mon, 19 Jun 2006 14:20:04 GMT""}]","2016-04-11"
"math-ph/0506004","Eugen Paal","Eugen Paal and Jyri Virkepu","Plane rotations and Hamilton-Dirac mechanics","8 pages, LaTeX2e","Czech. J. Phys. Vol 55 (2005), 1503-1508","10.1007/s10582-006-0032-7",,"math-ph math.MP",,"  Canonical formalism for SO(2) is developed. This group can be seen as a toy
model of the Hamilton-Dirac mechanics with constraints. The Lagrangian and
Hamiltonian are explicitly constructed and their physical interpretation are
given. The Euler-Lagrange and Hamiltonian canonical equations coincide with the
Lie equations. It is shown that the constraints satisfy CCR. Consistency of the
constraints is checked.
","[{""version"":""v1"",""created"":""Wed, 1 Jun 2005 11:29:41 GMT""}]","2015-06-26"
"math/0505688","Ines Kath","Ines Kath","Nilpotent metric Lie algebras of small dimension","27 pages, corrections to Prop. 6 and Theorem 1 (classification list)","Journal of Lie Theory 17 (2007), No. 1, 41-61",,,"math.DG math.RT","http://arxiv.org/licenses/nonexclusive-distrib/1.0/","  In math.DG/0312243 we developed a general classification scheme for metric
Lie algebras, i.e. for finite-dimensional Lie algebras equipped with a
non-degenerate invariant inner product. Here we determine all nilpotent Lie
algebras l with dim l'=2 which are used in this scheme. Furthermore, we
classify all nilpotent metric Lie algebras of dimension at most 10.
","[{""version"":""v1"",""created"":""Tue, 31 May 2005 16:28:49 GMT""},{""version"":""v2"",""created"":""Thu, 27 Feb 2014 19:56:33 GMT""}]","2014-02-28"
"math/0505689","Joseph E. Bonin","Joseph E. Bonin and Anna de Mier","The Lattice of Cyclic Flats of a Matroid","15 pages, 1 figure. The new version addresses earlier work by Julie
  Sims that the authors learned of after submitting the first version",,,,"math.CO",,"  A flat of a matroid is cyclic if it is a union of circuits. The cyclic flats
of a matroid form a lattice under inclusion. We study these lattices and
explore matroids from the perspective of cyclic flats. In particular, we show
that every lattice is isomorphic to the lattice of cyclic flats of a matroid.
We give a necessary and sufficient condition for a lattice Z of sets and a
function r on Z to be the lattice of cyclic flats of a matroid and the
restriction of the corresponding rank function to Z. We define cyclic width and
show that this concept gives rise to minor-closed, dual-closed classes of
matroids, two of which contain only transversal matroids.
","[{""version"":""v1"",""created"":""Tue, 31 May 2005 17:28:41 GMT""},{""version"":""v2"",""created"":""Mon, 12 Feb 2007 22:33:42 GMT""}]","2007-05-23"
"math/0505690","Sharad Goel","Sharad Goel, Ravi Montenegro, Prasad Tetali","Mixing Time Bounds via the Spectral Profile","26 pages",,,,"math.PR",,"  On complete, non-compact manifolds and infinite graphs, Faber-Krahn
inequalities have been used to estimate the rate of decay of the heat kernel.
We develop this technique in the setting of finite Markov chains, proving upper
and lower mixing time bounds via the spectral profile. This approach lets us
recover and refine previous conductance-based bounds of mixing time (including
the Morris-Peres result), and in general leads to sharper estimates of
convergence rates. We apply this method to several models including groups with
moderate growth, the fractal-like Viscek graphs, and the torus, to obtain tight
bounds on the corresponding mixing times.
","[{""version"":""v1"",""created"":""Tue, 31 May 2005 17:43:18 GMT""}]","2007-05-23"
"math/0505691","Michael Christ","Jonathan Bennett, Anthony Carbery, Michael Christ, and Terence Tao","Finite bounds for Holder-Brascamp-Lieb multilinear inequalities","15 pages",,,,"math.CA",,"  A criterion is established for the validity of multilinear inequalities of a
class considered by Brascamp and Lieb, generalizing well-known inequalities of
Holder, Young, and Loomis-Whitney. This is a companion to a recent paper by the
same authors, containing a different proof and discussing certain variants.
","[{""version"":""v1"",""created"":""Tue, 31 May 2005 18:09:24 GMT""}]","2007-05-23"
"math/0505692","Alexander Gnedin","Alexander Gnedin and Zbigniew Nitecki","Rank Independence and Rearrangements of Random Variables","29 pages",,,"Mathematica Gottingensis, Schriftenreihe des SFB 170, Heft 20, 1995","math.PR",,"  A rearrangement of $n$ independent uniform $[0,1]$ random variables is a
sequence of $n$ random variables $Y_1,...,Y_n$ whose vector of order statistics
has the same distribution as that for the $n$ uniforms. We consider
rearrangements satisfying the strong rank independence condition, that the rank
of $Y_k$ among $Y_1,...,Y_k$ is independent of the values of $Y_1,...,Y_{k-1}$,
for $k=1,...,n$. Nontrivial examples of such rearrangements are the travellers'
processes defined by Gnedin and Krengel. We show that these are the only
examples when $n=2$, and when certain restrictive assumptions hold for $n\geq
3$; we also construct a new class of examples of such rearrangements for which
the restrictive assumptions do not hold.
","[{""version"":""v1"",""created"":""Tue, 31 May 2005 19:05:05 GMT""}]","2007-05-23"
"math/0505693","Neretin Yurii A.","Yurii A. Neretin","Perelomov problem and inversion of the Segal-Bargmann transform","4pp, final variant","Functional Analysis and Its Applications, 2006, 40:4, 330-333","10.4213/faa854, 10.1007/s10688-006-0049-5","ESI-1657","math.FA math-ph math.MP",,"  We reconstruct a function by values of its Segal-Bargmann transform at points
of a lattice.
","[{""version"":""v1"",""created"":""Tue, 31 May 2005 18:21:29 GMT""},{""version"":""v2"",""created"":""Thu, 5 Jan 2006 17:25:29 GMT""}]","2012-11-27"
"math/0506001","Anamaria Savu","Anamaria Savu","Hydrodynamic scaling limit of continuum solid-on-solid model",,,,,"math.PR math-ph math.MP",,"  A fourth-order nonlinear evolution equation is derived from a microscopic
model for surface diffusion, namely, the continuum solid-on-solid model. We use
the method developed by Varadhan for the computation of hydrodynamic scaling
limit of nongradient models. What distinguishes our model from other models
discussed so far is the presence of two conservation laws for the dynamics in a
nonperiodic box and the complex dynamics that is not nearest-neighbor. Along
the way, a few steps has to be adapted to our new context. As a byproduct of
our main result we also derive the hydrodynamic scaling limit of a perturbation
of continuum solid-on-solid model, a model that incorporates both surface
diffusion and surface electromigration.
","[{""version"":""v1"",""created"":""Tue, 31 May 2005 20:10:20 GMT""}]","2007-05-23"
"math/0506002","Anamaria Savu","Anamaria Savu","Closed and exact functions in the context of Ginzburg-Landau models","17 pages, 7 figures",,,,"math.FA math.PR",,"  For a general vector field we exhibit two Hilbert spaces, namely the space of
so called closed functions and the space of exact functions and we calculate
the codimension of the space of exact functions inside the larger space of
closed functions. In particular we provide a new approach for the known cases:
the Glauber field and the second-order Ginzburg-Landau field, and for the case
of the fourth-order Ginzburg-Landau field.
","[{""version"":""v1"",""created"":""Tue, 31 May 2005 21:01:55 GMT""}]","2007-05-23"
"math/0506004","Jae-Wook Chung","Jae-Wook Chung","The Algebraic Structure of n-Punctured Ball Tangles","Ph.D. Thesis, 91 pages, 17 figures",,,,"math.GT",,"  We consider a class of topological objects in the 3-sphere $S^3$ which will
be called $n$-punctured ball tangles. Using the Kauffman bracket at $A=e^{i
\pi/4}$, an invariant for a special type of $n$-punctured ball tangles is
defined. The invariant $F^n$ takes values in $PM_{2\times2^n}(\mathbb Z)$, that
is the set of $2\times 2^n$ matrices over $\mathbb Z$ modulo the scalar
multiplication of $\pm1$. This invariant leads to a generalization of a theorem
of D. Krebes which gives a necessary condition for a given collection of
tangles to be embedded in a link in $S^3$ disjointly. Furthermore, we provide
the general formula to compute the invariant of the $k_1 + ... + k_n$-punctured
ball tangle determined by $n,k_1,...,k_n$-punctured ball tangles, respectively.
Also, we consider various connect sums among punctured ball tangles and provide
the formulas to compute their invariants. We also address the question of
whether the invariant $F^n$ is surjective onto $PM_{2\times2^n}(\mathbb Z)$. We
will show that the invariant $F^n$ is surjective when $n=0$. When $n=1$,
$n$-punctured ball tangles will be also called spherical tangles. We show that
${\rm det} F^1(S)\equiv 0$ or 1 {\rm mod} 4 for every spherical tangle $S$.
Thus, $F^n$ is not surjective when $n=1$. In addition, we introduce monoid
structures on the class of 0-punctured ball tangles and the class of spherical
tangles and show that the group generated by the elementary operations on
$PM_{2\times2}(\mathbb Z)$ induced by those on the spherical tangles is
isomorphic to a Coxeter group.
","[{""version"":""v1"",""created"":""Wed, 1 Jun 2005 00:04:47 GMT""},{""version"":""v2"",""created"":""Tue, 26 Jul 2005 23:14:16 GMT""}]","2007-05-23"
"math/0506005","Jie Qing","Jie Qing and Gang Tian","On the uniqueness of the foliation of spheres of constant mean curvature
  in asymptotically flat 3-manifolds","22 pages",,,,"math.DG math-ph math.MP",,"  In this note we study constant mean curvature surfaces in asymptotically flat
3-manifolds. We prove that, in an asymptotically flat 3-manifold with positive
mass, stable spheres of given constant mean curvature outside a fixed compact
subset are unique. Therefore we are able to conclude that there is a unique
foliation of stable spheres of constant mean curvature in an asymptotically
flat 3-manifold with positive mass.
","[{""version"":""v1"",""created"":""Wed, 1 Jun 2005 01:07:44 GMT""},{""version"":""v2"",""created"":""Thu, 11 Aug 2005 18:24:05 GMT""}]","2007-05-23"
"math/0506006","Taekyun Kim","T. Kim","A note on q-Volkenborn integration","5pages",,,,"math.NT",,"  In this paper, we construct the new $q$-analogue of the ordinary Euler
numbers and polynomials by using the $q$-Volkenborn integrals.
","[{""version"":""v1"",""created"":""Wed, 1 Jun 2005 03:13:40 GMT""}]","2007-05-23"
"math/0506007","Miklos Abert","Miklos Abert and Laszlo Babai","Finite Groups of Uniform Logarithmic Diameter",,,,,"math.GR",,"  We give an example of an infinite family of finite groups $G_n$ such that
each $G_n$ can be generated by 2 elements and the diameter of every Cayley
graph of $G_n$ is $O(\log (| G_{n}|))$. This answers a question of Lubotzky.
","[{""version"":""v1"",""created"":""Wed, 1 Jun 2005 03:57:54 GMT""}]","2007-05-23"
"math/0506008","Tomohiro Hayashi","Tomohiro Hayashi","On cocycle actions of non-commutative Bernoulli shifts","This paper has been withdrawn by the author",,,,"math.OA",,"  This paper has been withdrawn by the author.
","[{""version"":""v1"",""created"":""Wed, 1 Jun 2005 05:18:09 GMT""},{""version"":""v2"",""created"":""Wed, 8 Jun 2005 07:36:05 GMT""}]","2007-05-23"
"math/0506009","Kai Meng Tan","Kai Meng Tan","Beyond Rouquier partitions","17 pages. This replaces the earlier version entitled 'Some
  decomposition numbers of q-Shcur algebras",,,,"math.RT math.QA",,"  We obtain closed formulas, in terms of Littlewood-Richardson coefficients,
for the canonical basis elements of the Fock space representation of
$U_v(\hat{\mathfrak{sl}}_e)$ which are labelled by partitions having 'locally
small' $e$-quotients and arbitrary $e$-cores. We further show that, upon
evaluation at $v=1$, this gives the corresponding decomposition numbers of the
$q$-Schur algebras in characteristic $l$ (where $q$ is a primitive $e$-th root
of unity if $l \ne e$ and $q=1$ otherwise) whenever $l$ is greater than the
size of each constituent of the $e$-quotient.
","[{""version"":""v1"",""created"":""Wed, 1 Jun 2005 07:28:29 GMT""},{""version"":""v2"",""created"":""Wed, 8 Jun 2005 08:46:30 GMT""},{""version"":""v3"",""created"":""Mon, 18 Sep 2006 15:05:41 GMT""}]","2007-05-23"
"math/0506010","Pomponio Alessio","Alessio Pomponio","Coupled nonlinear Schrodinger systems with potentials","21 pages",,,,"math.AP math-ph math.MP",,"  Coupled nonlinear Schrodinger systems describe some physical phenomena such
as the propagation in birefringent optical fibers, Kerr-like photorefractive
media in optics and Bose-Einstein condensates. In this paper, we study the
existence of concentrating solutions of a singularly perturbed coupled
nonlinear Schrodinger system, in presence of potentials. We show how the
location of the concentration points depends strictly on the potentials.
","[{""version"":""v1"",""created"":""Wed, 1 Jun 2005 15:00:52 GMT""}]","2007-05-23"
