"math/0506180","Marie-Annick Guillemer","Dimitri Grigoriev (IRMAR), Ilia Ponomarenko","Constructions in public-key cryptography over matrix groups",,,,"2005-19","math.GR cs.CR math-ph math.MP",,"  The purpose of the paper is to give new key agreement protocols (a
multi-party extension of the protocol due to Anshel-Anshel-Goldfeld and a
generalization of the Diffie-Hellman protocol from abelian to solvable groups)
and a new homomorphic public-key cryptosystem. They rely on difficulty of the
conjugacy and membership problems for subgroups of a given group. To support
these and other known cryptographic schemes we present a general technique to
produce a family of instances being matrix groups (over finite commutative
rings) which play a role for these schemes similar to the groups $Z\_n^*$ in
the existing cryptographic constructions like RSA or discrete logarithm.
","[{""version"":""v1"",""created"":""Fri, 10 Jun 2005 12:30:51 GMT""}]","2007-05-23"
"math/0506181","Mikhail Shubin","Vladimir Maz'ya, Mikhail Shubin","Can one see the fundamental frequency of a drum?","18 pages, some misprints corrected",,"10.1007/s11005-005-0010-1",,"math.SP math-ph math.MP",,"  We establish two-sided estimates for the fundamental frequency (the lowest
eigenvalue) of the Laplacian in an open subset G of R^n with the Dirichlet
boundary condition. This is done in terms of the interior capacitary radius of
G which is defined as the maximal possible radius of a ball B which has a
negligible intersection with the complement of G. Here negligibility of a
subset F in B means that the Wiener capacity of F does not exceed gamma times
the capacity of B, where gamma is an arbitrarily fixed constant between 0 and
1. We provide explicit values of constants in the two-sided estimates.
","[{""version"":""v1"",""created"":""Thu, 9 Jun 2005 23:47:08 GMT""},{""version"":""v2"",""created"":""Wed, 15 Jun 2005 08:08:39 GMT""},{""version"":""v3"",""created"":""Sun, 9 Oct 2005 06:11:50 GMT""}]","2009-11-11"
"math/0506182","David Glickenstein","David Glickenstein","A combinatorial Yamabe flow in three dimensions","20 pages, 5 figures. The paper arxiv:math.MG/0211195 was absorbed
  into its new version and this paper","Topology 44 (2005) 791-808",,,"math.MG math.GT",,"  A combinatorial version of Yamabe flow is presented based on Euclidean
triangulations coming from sphere packings. The evolution of curvature is then
derived and shown to satisfy a heat equation. The Laplacian in the heat
equation is shown to be a geometric analogue of the Laplacian of Riemannian
geometry, although the maximum principle need not hold. It is then shown that
if the flow is nonsingular, the flow converges to a constant curvature metric.
","[{""version"":""v1"",""created"":""Fri, 10 Jun 2005 00:41:34 GMT""}]","2007-05-23"
"math/0506183","Ngai-Ching Wong","Ngai-Ching Wong","The triangle of operators, topologies, bornologies","33 pages",,,,"math.FA math.OA",,"  This paper discusses two common techniques in functional analysis: the
topological method and the bornological method. In terms of Pietsch's operator
ideals, we establish the equivalence of the notions of operators, topologies
and bornologies. The approaches in the study of locally convex spaces of
Grothendieck (via Banach space operators), Randtke (via continuous seminorms)
and Hogbe-Nlend (via convex bounded sets) are compared.
","[{""version"":""v1"",""created"":""Fri, 10 Jun 2005 02:00:14 GMT""}]","2007-05-23"
"math/0506184","Ngai-Ching Wong","Ngai-Ching Wong","Triple homomorphisms of C*-algebras","6 pages",,,,"math.FA math.OA",,"  In this note, we will discuss what kind of operators between C*-algebras
preserves Jordan triple products
  {a,b,c}= (ab*c + cb*a)/2.
  These include especially isometries and disjointness preserving operators.
","[{""version"":""v1"",""created"":""Fri, 10 Jun 2005 02:23:21 GMT""}]","2016-09-07"
"math/0506185","Gyula Lakos","Gyula Lakos","Notes on Lebesgue integration",,,,,"math.FA",,"  Alternative approaches to Lebesgue integration are considered.
","[{""version"":""v1"",""created"":""Fri, 10 Jun 2005 05:16:21 GMT""}]","2007-05-23"
"math/0506186","Makoto Katori","Makoto Katori","Non-colliding system of Brownian particles as Pfaffian process","LaTeX, 14 pages, 1 figure","RIMS Kokyuroku 1422 (2005) 12-25",,,"math.PR math-ph math.MP",,"  In the paper [7] we studied the temporally inhomogeneous system of
non-colliding Brownian motions and proved that multi-time correlation functions
are generally given by the quaternion determinants in the sense of Dyson and
Mehta. In this report we give another proof of the equivalent statement using
Fredholm determinant and Fredholm pfaffian, and claim that the present system
is a typical example of pfaffian processes.
","[{""version"":""v1"",""created"":""Fri, 10 Jun 2005 06:47:59 GMT""}]","2007-05-23"
"math/0506187","Makoto Katori","Makoto Katori, Hideki Tanemura","Infinite systems of non-colliding generalized meanders and
  Riemann-Liouville differintegrals","LaTeX, 35 pages, v3: The argument given in Section 3.2 was
  simplified. Minor corrections were made","Probab. Th. Rel. Fields 138 (2007) 113-156","10.1007/s00440-006-0015-4",,"math.PR cond-mat.stat-mech hep-th math-ph math.MP nlin.SI",,"  Yor's generalized meander is a temporally inhomogeneous modification of the
$2(\nu+1)$-dimensional Bessel process with $\nu > -1$, in which the
inhomogeneity is indexed by $\kappa \in [0, 2(\nu+1))$. We introduce the
non-colliding particle systems of the generalized meanders and prove that they
are the Pfaffian processes, in the sense that any multitime correlation
function is given by a Pfaffian. In the infinite particle limit, we show that
the elements of matrix kernels of the obtained infinite Pfaffian processes are
generally expressed by the Riemann-Liouville differintegrals of functions
comprising the Bessel functions $J_{\nu}$ used in the fractional calculus,
where orders of differintegration are determined by $\nu-\kappa$. As special
cases of the two parameters $(\nu, \kappa)$, the present infinite systems
include the quaternion determinantal processes studied by Forrester, Nagao and
Honner and by Nagao, which exhibit the temporal transitions between the
universality classes of random matrix theory.
","[{""version"":""v1"",""created"":""Fri, 10 Jun 2005 07:08:26 GMT""},{""version"":""v2"",""created"":""Thu, 7 Jul 2005 00:52:28 GMT""},{""version"":""v3"",""created"":""Wed, 10 May 2006 01:09:16 GMT""}]","2007-05-23"
"math/0506188","Sang Jin Lee","Eon-Kyung Lee and Sang-Jin Lee","A Garside-theoretic approach to the reducibility problem in braid groups","38 pages, 18 figures, published version","Journal of Algebra, vol. 320, no. 2. pp.783-820, 2008","10.1016/j.jalgebra.2008.03.033",,"math.GT","http://arxiv.org/licenses/nonexclusive-distrib/1.0/","  Let $D_n$ denote the $n$-punctured disk in the complex plane, where the
punctures are on the real axis. An $n$-braid $\alpha$ is said to be
\emph{reducible} if there exists an essential curve system $\C$ in $D_n$,
called a \emph{reduction system} of $\alpha$, such that $\alpha*\C=\C$ where
$\alpha*\C$ denotes the action of the braid $\alpha$ on the curve system $\C$.
A curve system $\C$ in $D_n$ is said to be \emph{standard} if each of its
components is isotopic to a round circle centered at the real axis.
  In this paper, we study the characteristics of the braids sending a curve
system to a standard curve system, and then the characteristics of the
conjugacy classes of reducible braids. For an essential curve system $\C$ in
$D_n$, we define the \emph{standardizer} of $\C$ as $\St(\C)=\{P\in
B_n^+:P*\C{is standard}\}$ and show that $\St(\C)$ is a sublattice of $B_n^+$.
In particular, there exists a unique minimal element in $\St(\C)$. Exploiting
the minimal elements of standardizers together with canonical reduction systems
of reducible braids, we define the outermost component of reducible braids, and
then show that, for the reducible braids whose outermost component is simpler
than the whole braid (including split braids), each element of its ultra summit
set has a standard reduction system. This implies that, for such braids,
finding a reduction system is as easy as finding a single element of the ultra
summit set.
","[{""version"":""v1"",""created"":""Fri, 10 Jun 2005 08:14:03 GMT""},{""version"":""v2"",""created"":""Wed, 10 May 2006 13:23:37 GMT""},{""version"":""v3"",""created"":""Thu, 8 Jun 2006 14:01:44 GMT""},{""version"":""v4"",""created"":""Mon, 14 Jul 2008 13:33:15 GMT""}]","2008-07-14"
"math/0506189","Hyun Jae Yoo","Hyun Jae Yoo","A Variational Principle in the Dual Pair of Reproducing Kernel Hilbert
  Spaces and an Application","29 pages",,,,"math.PR math-ph math.MP",,"  Given a positive definite, bounded linear operator $A$ on the Hilbert space
$\mathcal{H}_0:=l^2(E)$, we consider a reproducing kernel Hilbert space
$\mathcal{H}_+$ with a reproducing kernel $A(x,y)$. Here $E$ is any countable
set and $A(x,y)$, $x,y\in E$, is the representation of $A$ w.r.t. the usual
basis of $\mathcal{H}_0$. Imposing further conditions on the operator $A$, we
also consider another reproducing kernel Hilbert space $\mathcal{H}_-$ with a
kernel function $B(x,y)$, which is the representation of the inverse of $A$ in
a sense, so that $\mathcal{H}_-\supset\mathcal{H}_0\supset\mathcal{H}_+$
becomes a rigged Hilbert space. We investigate a relationship between the
ratios of determinants of some partial matrices related to $A$ and $B$ and the
suitable projections in $\mathcal{H}_-$ and $\mathcal{H}_+$. We also get a
variational principle on the limit ratios of these values. We apply this
relation to show the Gibbsianness of the determinantal point process (or
fermion point process) defined by the operator $A(I+A)^{-1}$ on the set $E$. It
turns out that the class of determinantal point processes that can be
recognized as Gibbs measures for suitable interactions is much bigger than that
obtained by Shirai and Takahashi.
","[{""version"":""v1"",""created"":""Fri, 10 Jun 2005 08:28:44 GMT""}]","2007-05-23"
"math/0506190","Stephen Sangwine","Stephen J. Sangwine","Biquaternion (complexified quaternion) roots of -1",,"Advances in Applied Clifford Algebras, 16 (1), February 2006,
  63-68.","10.1007/s00006-006-0005-8",,"math.RA",,"  The roots of -1 in the set of biquaternions (quaternions with complex
components, or complex numbers with quaternion real and imaginary parts) are
studied and it is shown that there is an infinite number of non-trivial
complexified quaternion roots (and two degenerate solutions which are the
complex imaginary operator and the set of unit pure real quaternions). The
non-trivial roots are shown to consist of complex numbers with perpendicular
pure quaternion real and imaginary parts. The moduli of the two perpendicular
pure quaternions are expressible by a single parameter via a hyperbolic
trigonometric identity.
","[{""version"":""v1"",""created"":""Fri, 10 Jun 2005 10:01:16 GMT""}]","2007-05-23"
"math/0506191","Felix Schlenk","K.Cieliebak, H.Hofer, J.Latschev and F.Schlenk","Quantitative symplectic geometry","43 pages, 3 figures",,,,"math.SG math.DG",,"  While symplectic manifolds have no local invariants, they do admit many
global numerical invariants. Prominent among them are the so-called symplectic
capacities.
  Different capacities are defined in different ways, and so relations between
capacities often lead to surprising relations between different aspects of
symplectic geometry and Hamiltonian dynamics. In this paper we present an
attempt to better understand the space of all symplectic capacities, and
discuss some further general properties of symplectic capacities.
  We also describe several new relations between certain symplectic capacities
on ellipsoids and polydiscs. Throughout the discussion we mention many open
problems.
","[{""version"":""v1"",""created"":""Fri, 10 Jun 2005 10:03:06 GMT""}]","2007-05-23"
"math/0506192","Frederic Chapoton","Fr\'ed\'eric Chapoton (ICJ)","Une base sym\'etrique de l'alg\`ebre des coinvariants
  quasi-sym\'etriques","6 pages, 2 figures","The Electronic Journal of Combinatorics 12, 1 (2005) N16",,,"math.QA math.CO",,"  We describe a new basis of the ring of quasi-symmetric coinvariants, which is
stable by the natural reversal of the set of variables. The indexing set is the
set of triangulations of a regular polygon, instead of the set of Dyck paths
used for the known basis. On d\'{e}crit une nouvelle base de l'alg\`{e}bre des
coinvariants quasi-sym\'{e}triques, qui est stable par l'involution naturelle
et index\'{e}e par les triangulations d'un polygone r\'{e}gulier.
","[{""version"":""v1"",""created"":""Fri, 10 Jun 2005 10:08:17 GMT""}]","2007-10-24"
"math/0506193","Intan Muchtadi-Alamsyah","Intan Muchtadi-Alamsyah","Braid action on derived category of Nakayama algebras","27 pages","Communications in Algebra (2008) 36:7, 2544-2569","10.1080/00927870802070165",,"math.RT math.RA","http://arxiv.org/licenses/nonexclusive-distrib/1.0/","  We construct an action of a braid group associated to a complete graph on the
derived category of a certain symmetric Nakayama algebra which is also a Brauer
star algebra with no exceptional vertex. We connect this action with the affine
braid group action on Brauer star algebras defined by Schaps and Zakay-Illouz.
We show that for Brauer star algebras with no exceptional vertex, the action is
faithful.
","[{""version"":""v1"",""created"":""Fri, 10 Jun 2005 10:41:00 GMT""},{""version"":""v2"",""created"":""Wed, 2 Jul 2008 13:54:29 GMT""}]","2008-07-02"
"math/0506194","Francisco J. Plaza Martin","E. G\'omez, J. M. Mu\~noz, F. J. Plaza, S. Recillas, R. E. Rodr\'iguez","A solution of the Schottky-Type problem for curves with automorphisms",,,,,"math.AG",,"  In this paper, an explicit hierarchy of differential equations for the
$\tau$-functions defining the moduli space of curves with automorphisms as a
subscheme of the Sato Grassmannian is obtained. The Schottky problem for
Riemann surfaces with automorphisms consists of characterizing those p.p.a.v.
that are Jacobian varieties of a curve with a non-trivial automorphism. A
characterization in terms of hierarchies of p.d.e. for theta functions is also
given.
","[{""version"":""v1"",""created"":""Fri, 10 Jun 2005 11:18:32 GMT""}]","2016-08-16"
"math/0506196","Hisanobu Shinya","Hisanobu Shinya","On the Gaps between Two Consecutive Prime Numbers","Withdrawn; this is simply a complicated way of rephrasing the
  elementary Greek sieve",,,,"math.GM",,"  In this article, a relation between a gap $d_{k}$ and divisors of composite
numbers between $p_{k}$ and $p_{k+1}$ is established.
","[{""version"":""v1"",""created"":""Fri, 10 Jun 2005 12:02:10 GMT""},{""version"":""v2"",""created"":""Mon, 13 Jun 2005 19:40:41 GMT""},{""version"":""v3"",""created"":""Sun, 11 Sep 2011 00:44:34 GMT""}]","2011-09-13"
"math/0506197","Andrei Agrachev","Andrei Agrachev","Geometry of optimal control problems and Hamiltonian systems","Lecture Notes",,,,"math.OC math.DG math.DS",,"  These notes are based on the mini-course given in June 2004 in Cetraro,
Italy, in the frame of a C.I.M.E. school. Of course, they contain much more
material that I could present in the 6 hours course. The main goal is to give
an idea of the general variational and dynamical nature of nice and powerful
concepts and results mainly known in the narrow framework of Riemannian
Geometry. This concerns Jacobi fields, Morse's index formula, Levi Civita
connection, Riemannian curvature and related topics.
  I tried to make the presentation as light as possible: gave more details in
smooth regular situations and referred to the literature in more complicated
cases.
","[{""version"":""v1"",""created"":""Fri, 10 Jun 2005 12:11:00 GMT""}]","2007-05-23"
"math/0506198","Mohammad Sal Moslehian","Arsalan Hojjat Ansari and Mohammad Sal Moslehian","More on Reverse Triangle Inequality in Inner Product Spaces","12 pages","Inter J. Math. Math Sci., 18 (2005), 2883-2893","10.1155/IJMMS.2005.2883",,"math.FA",,"  Refining some results of S. S. Dragomir, several new reverses of the
generalized triangle inequality in inner product spaces are given. Among
several results, we establish some reverses for the Schwarz inequality. In
particular, it is proved that if $a$ is a unit vector in a real or complex
inner product space $(H;< .,.>)$, $r, s>0, p\in(0,s], D=\{x\in H,\|rx-sa\|\leq
p\}, x_1, x_2\in D-\{0\}$ and $
\alpha_{r,s}=\min\{\frac{r^2\|x_k\|^2-p^2+s^2}{2rs\|x_k\|}: 1\leq k\leq 2 \}$,
then $$\frac{\|x_1\|\|x_2\|-Re< x_1,x_2>}{(\|x_1\|+\|x_2\|)^2}\leq
\alpha_{r,s}.$$
","[{""version"":""v1"",""created"":""Fri, 10 Jun 2005 14:09:22 GMT""}]","2021-07-23"
"math/0506199","Jeremy Schiff","Ilan Degani, Jeremy Schiff","Gaussian Quadrature without Orthogonal Polynomials","11 pages",,,,"math.NA",,"  A novel development is given of the theory of Gaussian quadrature, not
relying on the theory of orthogonal polynomials. A method is given for
computing the nodes and weights that is manifestly independent of choice of
basis in the space of polynomials. This method can be extended to compute nodes
and weights for Gaussian quadrature on the unit circle and Gauss type
quadrature rules with some fixed nodes.
","[{""version"":""v1"",""created"":""Fri, 10 Jun 2005 14:25:52 GMT""}]","2007-05-23"
"math/0506200","Achill Schuermann","Achill Schuermann","On packing spheres into containers (about Kepler's finite sphere packing
  problem)","13 pages, 2 figures; v2: major revision, extended result, simplified
  and clarified proof","Documenta Mathematica 11 (2006), 393--406",,,"math.MG",,"  In an Euclidean $d$-space, the container problem asks to pack $n$ equally
sized spheres into a minimal dilate of a fixed container. If the container is a
smooth convex body and $d\geq 2$ we show that solutions to the container
problem can not have a ``simple structure'' for large $n$. By this we in
particular find that there exist arbitrary small $r>0$, such that packings in a
smooth, 3-dimensional convex body, with a maximum number of spheres of radius
$r$, are necessarily not hexagonal close packings. This contradicts Kepler's
famous statement that the cubic or hexagonal close packing ``will be the
tightest possible, so that in no other arrangement more spheres could be packed
into the same container''.
","[{""version"":""v1"",""created"":""Fri, 10 Jun 2005 15:25:56 GMT""},{""version"":""v2"",""created"":""Sat, 9 Sep 2006 20:39:32 GMT""}]","2011-10-20"
"math/0506202","Li Yuxiang","Yuxiang Li","A simplification of the proof of the existence of the extremal function
  for the Moser-Trudinger inequality","5 pages",,,,"math.AP",,"  In a previous paper, the author proved the existence of extremal function for
the Moser-Trudinger inequality on a compact manifold. In the this paper, we
will give a new proof of one of the key proposition.
","[{""version"":""v1"",""created"":""Fri, 10 Jun 2005 15:02:11 GMT""},{""version"":""v2"",""created"":""Mon, 13 Jun 2005 12:21:17 GMT""},{""version"":""v3"",""created"":""Sun, 19 Jun 2005 11:50:12 GMT""},{""version"":""v4"",""created"":""Tue, 21 Jun 2005 15:23:16 GMT""},{""version"":""v5"",""created"":""Mon, 14 Nov 2005 12:37:10 GMT""},{""version"":""v6"",""created"":""Wed, 13 Sep 2006 17:38:12 GMT""}]","2007-05-23"
"math/0506203","Laurent Bartholdi","Laurent Bartholdi, Illya I. Reznykov","A Mealy machine with polynomial growth of irrational degree","20 pages, 1 diagram","Internat. J. Algebra Comput. 18 (2008), no. 1, 59--82","10.1142/S0218196708004287",,"math.GR math.CO",,"  We consider a very simple Mealy machine (three states over a two-symbol
alphabet), and derive some properties of the semigroup it generates. In
particular, this is an infinite, finitely generated semigroup; we show that the
growth function of its balls behaves asymptotically like n^2.4401..., where
this constant is 1 + log(2)/log((1+sqrt(5))/2); that the semigroup satisfies
the identity g^6=g^4; and that its lattice of two-sided ideals is a chain.
","[{""version"":""v1"",""created"":""Fri, 10 Jun 2005 15:20:44 GMT""},{""version"":""v2"",""created"":""Fri, 12 Jan 2007 07:51:38 GMT""}]","2009-11-27"
"math/0506204","Bertrand Deroin","Bertrand Deroin and Victor Kleptsyn","Random conformal dynamical systems","61 pages","Geom. Funct. Anal. 17 no. 4 (2007) 1043-1105",,,"math.DS math.PR",,"  We consider random dynamical systems such as groups of conformal
transformations with a probability measure, or transversaly conformal
foliations with a Laplace operator along the leaves, in which case we consider
the holonomy pseudo-group. We prove that either there exists a measure
invariant under all the elements of the group (or the pseudo-group), or almost
surely a long composition of maps contracts exponentially a ball. We deduce
some results about the unique ergodicity.
","[{""version"":""v1"",""created"":""Fri, 10 Jun 2005 15:21:50 GMT""}]","2011-12-30"
"math/0506205","Branko Malesevic","Branko Malesevic","Some inequalities for Kurepa's function",,"Journal of Inequalities in Pure and Applied Mathematics, Volume 5,
  Issue 4, Article 84, 2004",,,"math.CV math.NT",,"  In this paper we consider Kurepa's function $K(z)$ \cite{Kurepa_71}. We give
some recurrent relations for Kurepa's function via appropriate sequences of
rational functions and gamma function. Also, we give some inequalities for
Kurepa's function $K(x)$ for positive values of $x$.
","[{""version"":""v1"",""created"":""Fri, 10 Jun 2005 15:35:51 GMT""}]","2007-05-23"
"math/0506206","Anne Moreau","Anne Moreau (IMJ)","Indice et decomposition de Cartan d'une algebre de Lie semi-simple
  reelle","21 pages en francais","Journal of Algebra 303 (1) (2006) 382-406",,,"math.RT",,"  The Iwasawa decomposition $\mathfrak{g}=\mathfrak{k}_0 \oplus
\hat{\mathfrak{a}}_0 \oplus \mathfrak{n}_0$ of the real semisimple Lie algebra
$\mathfrak{g}_0$ comes from its Cartan decomposition
$\mathfrak{g}_0=\mathfrak{k}_0 \oplus \mathfrak{p}_0$. Then we get
$\mathfrak{g}_0=\mathfrak{k}_0 \oplus \mathfrak{b}_0$ where
$\mathfrak{b}_0=\hat{\mathfrak{a}}_0 \oplus \mathfrak{n}_0$. The question of
knowing if the index were additive in the decomposition
$\mathfrak{g}_0=\mathfrak{k}_0 \oplus \mathfrak{b}_0$ goes back M. Ra\""{i}s
\cite{Rais}. In \cite{Moreau3}, I wrote that the index always is additive for
this decomposition. Precisly, I claim that the index of $\mathfrak{b}$ is given
by the following formula : ${\rm ind} \mathfrak{b} = {\rm rk \} \mathfrak{g} -
{\rm rk \} \mathfrak{k}$, where $\mathfrak{b}$ is the complexification of
$\mathfrak{b}_0$. This result is false in general. We actually have an
inequality : ${\rm ind} \mathfrak{b} \geq {\rm rg \} \mathfrak{g} - {\rm rg \}
\mathfrak{k}$. The goal of this paper is to correct this mistake. We resume the
approach of \cite{Moreau3} to obtain this time the previous inequality. Then we
give in more a characterization of the semisimple real Lie algebra
$\mathfrak{g}_0$ for which the index is additive in the decomposition
$\mathfrak{g}_0=\mathfrak{k}_0 \oplus \mathfrak{b}_0$. Moreover, we study in
this paper the quasi-reductive character of some subalgebras of $\mathfrak{g}$.
This is a new part in comparison with \cite{Moreau3}.
","[{""version"":""v1"",""created"":""Fri, 10 Jun 2005 15:35:53 GMT""},{""version"":""v2"",""created"":""Mon, 13 Jun 2005 12:02:28 GMT""},{""version"":""v3"",""created"":""Mon, 29 Jan 2007 14:16:46 GMT""}]","2007-05-23"
"math/0506207","Branko Malesevic","Branko Malesevic","Some inequalities for alternating Kurepa's function",,"Univ. Beograd. Publ. Elektrotehn. Fak., Ser. Mat. 16 (2005), 70-76",,,"math.CV math.NT",,"  In this paper we consider alternating Kurepa's function $A(z)$
\cite{Petojevic_02}. We give some recurrent relations for alternating Kurepa's
function via appropriate sequences of rational functions and gamma function.
Also we give some inequalities for the real part of alternating Kurepa's
function $A(x)$ for values of argument $x>-2$. The obtained results are
analogous to results from \cite{Malesevc_04}.
","[{""version"":""v1"",""created"":""Fri, 10 Jun 2005 15:42:56 GMT""},{""version"":""v2"",""created"":""Sat, 11 Jun 2005 01:57:32 GMT""},{""version"":""v3"",""created"":""Tue, 28 Jun 2005 08:42:10 GMT""}]","2007-05-23"
"nucl-ex/0506013","Spencer Klein","Spencer R. Klein (for the STAR Collaboration)","Photoproduction at Hadron Colliders","Presented at DIS2005, Madision, WI 4 pages with 4 figures",,"10.1063/1.2122093",,"nucl-ex hep-ph",,"  Photoproduction can be studied at hadron colliders by using the virtual
photons associated with the hadron beams. The LHC will reach photonucleon
energies 10 times higher than that available elsewhere. These reactions are
already being studied at RHIC. After introducing photoproduction at hadron
colliders, I will discuss recent results from STAR on $\rho^0$,
$\pi^+\pi^-\pi^+\pi^-$ and $e^+e^-$ production.
","[{""version"":""v1"",""created"":""Thu, 9 Jun 2005 18:50:21 GMT""}]","2019-08-14"
