"math/0501522","Ismail Kombe","Ismail Kombe","Sharp Hardy type inequalities on the Carnot Group","8 pages",,,,"math.FA math.AP",,"  In this paper we establish sharp weighted Hardy type inequalities on the
Carnot group with homogeneous dimension $Q\ge 3$.
","[{""version"":""v1"",""created"":""Fri, 28 Jan 2005 20:08:23 GMT""},{""version"":""v2"",""created"":""Mon, 21 Feb 2005 16:07:49 GMT""}]","2007-05-23"
"math/0501523","Elliott Pearl","A. N. Dranishnikov","Cohomological dimension theory of compact metric spaces","61 pages","Topology Atlas Invited Contributions 6, no. 3 (2001) 61 pp",,,"math.GN math.GT",,"  This is a detailed introductory survey of the cohomological dimension theory
of compact metric spaces.
","[{""version"":""v1"",""created"":""Fri, 28 Jan 2005 22:18:19 GMT""}]","2007-05-23"
"math/0501524","Elliott Pearl","Justin Tatch Moore","A solution to the L space problem and related ZFC constructions","27 pages","J. Amer. Math. Soc. 19 (2006), no. 3, 717--736","10.1090/S0894-0347-05-00517-5",,"math.GN math.LO",,"  In this paper I will construct a non-separable hereditarily Lindelof space (L
space) without any additional axiomatic assumptions. I will also show that
there is a function f from [omega_1]^2 to omega_1 such that if A,B, subsets of
omega_1, are uncountable and x omega_1, then there are a < b in A and B
respectively with f(a,b) = x. Previously it was unknown whether such a function
existed even if omega_1 was replaced by 2. Finally, I will prove that there is
no basis for the uncountable regular Hausdorff spaces of cardinality aleph_1.
Each of these results gives a strong refutation of a well known and
longstanding conjecture. The results all stem from the analysis of oscillations
of coherent sequences {e_i : i < omega_1} of finite-to-one functions. I expect
that the methods presented will have other applications as well.
","[{""version"":""v1"",""created"":""Fri, 28 Jan 2005 22:31:07 GMT""}]","2013-10-08"
"math/0501525","Elliott Pearl","Justin Tatch Moore","A five element basis for the uncountable linear orders","21 pages","Ann. of Math. (2) 163 (2006), no. 2, 669--688","10.4007/annals.2006.163.669",,"math.LO",,"  In this paper I will show that it is relatively consistent with the usual
axioms of mathematics (ZFC) together with a strong form of the axiom of
infinity (the existence of a supercompact cardinal) that the class of
uncountable linear orders has a five element basis. In fact such a basis
follows from the Proper Forcing Axiom, a strong form of the Baire Category
Theorem. The elements are X, omega_1, omega_1^*, C, C^* where X is any suborder
of the reals of cardinality aleph_1 and C is any Countryman line. This confirms
a longstanding conjecture of Shelah.
","[{""version"":""v1"",""created"":""Fri, 28 Jan 2005 22:39:46 GMT""}]","2013-10-08"
"math/0501526","Elliott Pearl","Justin Tatch Moore","Set mapping reflection","11 pages","J. Math. Log. 5 (2005), no. 1, 87--97","10.1142/S0219061305000407",,"math.LO",,"  In this note we will discuss a new reflection principle which follows from
the Proper Forcing Axiom. The immediate purpose will be to prove that the
bounded form of the Proper Forcing Axiom implies both that 2^omega = omega_2
and that L(P(omega_1)) satisfies the Axiom of Choice. It will also be
demonstrated that this reflection principle implies that combinatorial
principle Square(kappa) fails for all regular kappa > omega_1.
","[{""version"":""v1"",""created"":""Fri, 28 Jan 2005 22:44:30 GMT""}]","2013-10-08"
"math/0501527","Elliott Pearl","Justin Tatch Moore","The Proper Forcing Axiom, Prikry forcing, and the Singular Cardinals
  Hypothesis","7 pages","Ann. Pure Appl. Logic 140 (2006), no. 1-3, 128--132","10.1016/j.apal.2005.09.011",,"math.LO",,"  The purpose of this paper is to present some results which suggest that the
Singular Cardinals Hypothesis follows from the Proper Forcing Axiom. What will
be proved is that a form of simultaneous reflection follows from the Set
Mapping Reflection Principle, a consequence of PFA. While the results fall
short of showing that MRP implies SCH, it will be shown that MRP implies that
if SCH fails first at kappa then every stationary subset of S_{kappa^+}^omega =
{a < kappa^+ : cf(a) = omega} reflects. It will also be demonstrated that MRP
always fails in a generic extension by Prikry forcing.
","[{""version"":""v1"",""created"":""Fri, 28 Jan 2005 22:49:51 GMT""}]","2013-10-08"
"math/0501528","Taekyun Kim","C. Adiga, N. Anitha and T. Kim","Transformations of Ramanujan's summation formula and its applications","9pages",,,,"math.NT math.CV",,"  In this paper we obtain some new transformation formula for Ramanujan
summation formula and also establish some eta-function identities. we also
deduce a q-Gamma function identity, n q-integral and some interesting series
representation.
","[{""version"":""v1"",""created"":""Fri, 28 Jan 2005 23:08:42 GMT""}]","2007-05-23"
"math/0501529","Jennifer Morse","L. Lapointe and J. Morse","Quantum cohomology and the k-Schur basis","20 pages, revised version with minor changes",,,,"math.CO math.AG",,"  We prove that structure constants related to Hecke algebras at roots of unity
are special cases of k-Littlewood-Richardson coefficients associated to a
product of k-Schur functions. As a consequence, both the 3-point Gromov-Witten
invariants appearing in the quantum cohomology of the Grassmannian, and the
fusion coefficients for the WZW conformal field theories associated to
\hat{su}(\ell) are shown to be k-Littlewood Richardson coefficients. From this,
Mark Shimozono conjectured that the k-Schur functions form the Schubert basis
for the homology of the loop Grassmannian, whereas k-Schur coproducts
correspond to the integral cohomology of the loop Grassmannian. We introduce
dual k-Schur functions defined on weights of k-tableaux that, given Shimozono's
conjecture, form the Schubert basis for the cohomology of the loop
Grassmannian. We derive several properties of these functions that extend those
of skew Schur functions.
","[{""version"":""v1"",""created"":""Fri, 28 Jan 2005 23:17:35 GMT""},{""version"":""v2"",""created"":""Fri, 27 May 2005 20:17:45 GMT""}]","2007-05-23"
"math/0501531","Taekyun Kim","Taekyun Kim","Sums of powers of consecutive q-integers","4 pages","Advanced Studies in Contemporary Mathematics, 9(2004), no. 1, p.
  15-18",,,"math.NT",,"  We give the q-analogue of the sums of the n-th powers of positive integers up
to k-1.
","[{""version"":""v1"",""created"":""Sat, 29 Jan 2005 00:36:38 GMT""}]","2007-05-23"
"math/0501532","G\'abor Pete","Yuval Peres, Gabor Pete, Ariel Scolnicov","Critical percolation on certain non-unimodular graphs","15 pages, 5 figures. Several corrections to previous version","New York J. of Math., 12 (2006), 1-18.",,,"math.PR",,"  An important conjecture in percolation theory is that almost surely no
infinite cluster exists in critical percolation on any transitive graph for
which the critical probability is less than 1. Earlier work has established
this for the amenable cases Z^2 and Z^d for large d, as well as for all
non-amenable graphs with unimodular automorphism groups. We show that the
conjecture holds for the basic classes of non-amenable graphs with
non-unimodular automorphism groups: for decorated trees and the non-unimodular
Diestel-Leader graphs. We also show that the connection probability between two
vertices decay exponentially in their distance. Finally, we prove that critical
percolation on the positive part of the lamplighter group has no infinite
clusters.
","[{""version"":""v1"",""created"":""Sat, 29 Jan 2005 02:47:14 GMT""},{""version"":""v2"",""created"":""Wed, 25 May 2005 23:03:52 GMT""},{""version"":""v3"",""created"":""Thu, 27 Oct 2005 09:47:03 GMT""}]","2008-03-31"
"math/0501533","Ofer Zeitouni","Maury Bramson, Ofer Zeitouni, Martin P. W. Zerner","Shortest spanning trees and a counterexample for random walks in random
  environments","Published at http://dx.doi.org/10.1214/009117905000000783 in the
  Annals of Probability (http://www.imstat.org/aop/) by the Institute of
  Mathematical Statistics (http://www.imstat.org)","Annals of Probability 2006, Vol. 34, No. 3, 821-856","10.1214/009117905000000783","IMS-AOP-AOP0119","math.PR",,"  We construct forests that span $\mathbb{Z}^d$, $d\geq2$, that are stationary
and directed, and whose trees are infinite, but for which the subtrees attached
to each vertex are as short as possible. For $d\geq3$, two independent copies
of such forests, pointing in opposite directions, can be pruned so as to become
disjoint. From this, we construct in $d\geq3$ a stationary, polynomially mixing
and uniformly elliptic environment of nearest-neighbor transition probabilities
on $\mathbb{Z}^d$, for which the corresponding random walk disobeys a certain
zero--one law for directional transience.
","[{""version"":""v1"",""created"":""Sat, 29 Jan 2005 02:38:39 GMT""},{""version"":""v2"",""created"":""Wed, 28 Jun 2006 13:51:53 GMT""}]","2007-05-23"
"math/0501534","Stavros Papadakis","Stavros Argyrios Papadakis","Type II Unprojection","17 pages, submitted",,,,"math.AG math.AC",,"  Answering a question of M. Reid, we define and prove the Gorensteiness of the
type II unprojection.
","[{""version"":""v1"",""created"":""Sat, 29 Jan 2005 12:59:29 GMT""}]","2007-05-23"
"math/0501535","Stavros Papadakis","Stavros Argyrios Papadakis","Remarks on Type III Unprojection","11 pages, to appear in Communications in Algebra",,,,"math.AG math.AC",,"  Type III unprojection plays a very important role in the birational geometry
of Fano threefolds. It was first introduced by A. Corti on his calculations of
Fano threefolds of genus 6 and 7.
  It seems that at present a general definition of the type III unprojection is
still missing. After proving some general facts about residual ideals, we
propose a definition for the generic Type III unprojection, and prove that it
gives a Gorenstein ring.
","[{""version"":""v1"",""created"":""Sat, 29 Jan 2005 13:13:15 GMT""}]","2007-05-23"
"math/0501536","David Pumberger","David Pumberger, Tristan Riviere","Uniqueness of tangent cones for calibrated 2-cycles","37 pages","Duke Math. J. 152, no. 3 (2010), 441-480","10.1215/00127094-2010-016",,"math.DG math.AP",,"  We prove that tangent cones to 2-dimensional calibrated cycles are unique.
Using this result we prove a rate of convergence for the mass of the blow-up of
a calibrated integral 2-cycle towards the limiting density. With the same
techniques, we can also prove such a rate for J-holomorphic maps between almost
complex manifolds and deduce the uniqueness of their tangent maps.
","[{""version"":""v1"",""created"":""Sat, 29 Jan 2005 15:15:13 GMT""}]","2019-12-19"
"math/0501537","Laura Molino","Laura Molino","The dynamics of maps tangent to the identity and with non-vanishing
  index","to be published in Trans. Amer. Math. Soc., 27 pages",,,,"math.CV",,"  Let f be a germ of holomorphic self-map of C^2 at the origin O tangent to the
identity, and with O as a non-dicritical isolated fixed point. A parabolic
curve for f is a holomorphic f-invariant curve, with O on the boundary,
attracted by O under the action of f. It has been shown that if the
characteristic direction [v] has residual index not belonging to Q^+, then
there exist parabolic curves for f tangent to [v]. In this paper we prove, with
a different method, that the conclusion still holds just assuming that the
residual index is not vanishing (at least when f is regular along [v]).
","[{""version"":""v1"",""created"":""Sat, 29 Jan 2005 15:51:23 GMT""},{""version"":""v2"",""created"":""Fri, 29 Jun 2007 08:34:28 GMT""}]","2011-11-10"
"nucl-th/0501075","Stepan G. Mashnik","M. I. Baznat, S. G. Mashnik, K. K. Gudima, and R. E. Prael","Merging the CEM2k and LAQGSM Codes with GEMINI","Revised version of an ND2004 contribution (2004, Santa Fe, USA):
  minor revision of the text, Fig. 5 revised, references updated. We thank Dr.
  Claude Volant for noticing that the stated values of the fission delay time
  used in GEMINI were in error for several reactions in the earlier version of
  this paper",,"10.1063/1.1945233","LA-UR-05-0559","nucl-th astro-ph nucl-ex",,"  An improved version of the Cascade-Exciton Model (CEM) of nuclear reactions
contained in the code CEM2k and the Los Alamos version of the Quark-Gluon
String Model (LAQGSM) are merged with the well-known sequential-binary-decay
model GEMINI by Charity. We present some results on proton-induced
fragmentation, fission-product yields and on particle spectra predicted by
these extended versions of CEM2k and LAQGSM. We show that merging CEM2k and
LAQGSM with GEMINI allows us to describe many fission and fragmentation
reactions in addition to the spallation and evaporation reactions which are
already described well by these codes. Nevertheless, the current version of
GEMINI we use does not provide a completely satisfactory description of some
complex-particle spectra, fragment emission, and spallation yields for some
reactions, and is not yet a universal tool for applications. Our results show
that GEMINI contains a powerful model to describe
evaporation/fission/fragmentation reactions and often provides better results
when compared to other models, especially for emission of heavy fragments from
reactions on medium-heavy nuclei (where most other models simply fail), but it
must be further extended and improved in order to properly describe arbitrary
reactions.
","[{""version"":""v1"",""created"":""Fri, 28 Jan 2005 18:09:14 GMT""},{""version"":""v2"",""created"":""Wed, 2 Nov 2005 00:52:28 GMT""}]","2009-11-11"
"nucl-th/0501076","Renato Higa","R. Higa (Jefferson Lab), M. R. Robilotta (U. of Sao Paulo), C. A. da
  Rocha (Sao Judas Tadeu U.)","Relativistic $O(q^4)$ two-pion exchange nucleon-nucleon potential:
  parametrized version","7 pages, no figures, revtex",,,"JLAB-THY-05-298","nucl-th",,"  The chiral two-pion exchange nucleon-nucleon interaction has nowadays a
rather firm conceptual basis, but depends on low-energy constants, which may be
extracted from fits to data. In order to facilitate this kind of application,
we present here a parametrized version of our relativistic expansion of this
component of the force to $O(q^4)$, performed recently.
","[{""version"":""v1"",""created"":""Fri, 28 Jan 2005 21:09:56 GMT""}]","2007-05-23"
"nucl-th/0501077","Andriy Kostyuk","Andriy Kostyuk and Horst Stoecker","Evidence for psi' Regeneration in Heavy Ion Collisions","1 page, 1 figure, LaTeX2e","GSI Scientific Report 2003, p. 86",,,"nucl-th hep-ph",,"  The production of the psi' meson in Pb+Pb collisions at CERN SPS is analyzed.
It provides an evidence for charmonium regeneration via charm quark-antiquark
coalescence at hadronization.
","[{""version"":""v1"",""created"":""Fri, 28 Jan 2005 22:37:09 GMT""}]","2007-05-23"
"nucl-th/0501078","James J. Kelly","James J. Kelly","Influence of the Dirac sea on proton electromagnetic knockout","12 pages, 9 figures, to be submitted to PRC","Phys.Rev. C72 (2005) 014602","10.1103/PhysRevC.72.014602",,"nucl-th",,"  We use the relativistic distorted-wave impulse approximation (RDWIA) to study
the effects of negative-energy components of Dirac wave functions on the
left-right asymmetry for (e,e'p) reactions on 16-O with 0.2 < Q^2 < 0.8 and
12-C with 0.6 < Q^2 < 1.8 (GeV/c)^2. Spinor distortion is more important for
the bound state than for the ejectile and the net effect decreases with Q^2.
Spinor distortion breaks Godon equivalence and the data favor the CC2 operator
with intermediate coupling to the sea. The left-right asymmetry for Q^2 < 1.2
(GeV/c)^2 is described well by RDWIA calcuations, but at Q^2 = 1.8 (GeV/c)^2
the observed variation with missing momentum is flatter than predicted.
","[{""version"":""v1"",""created"":""Fri, 28 Jan 2005 22:45:33 GMT""}]","2009-11-11"
"nucl-th/0501079","James J. Kelly","James J. Kelly","RDWIA analysis of 12C(e,e'p) for Q^2 < 2 (GeV/c)^2","19 pages, 14 figures, to be submitted to PRC","Phys.Rev. C71 (2005) 064610","10.1103/PhysRevC.71.064610",,"nucl-th",,"  We analyze data for 12C(e,e'p) with Q^2 < 2 (GeV/c)^2 using the relativistic
distorted-wave impulse approximation (RDWIA) based upon Dirac-Hartree wave
functions. The 1p normalization extracted from data for Q^2 > 0.6 (GeV/c)^2 is
approximately 0.87, independent of Q^2, which is consistent with the predicted
depletion by short-range correlations. The total 1p and 1s strength for E_m <
80 MeV approaches 100% of IPSM, consistent with a continuum contribution for 30
< E_m < 80 MeV of about 12% of IPSM. Similarly, a scale factor of 1.12 brings
RDWIA calculations into good agreement with 12C(e,e'p) data for transparency.
We also analyzed low Q^2 data from which a recent NDWIA analysis suggested that
spectroscopic factors might depend strongly upon the resolution of the probe.
We find that momentum distributions for their empirical Woods-Saxon wave
functions fit to low Q^2 data for parallel kinematics are too narrow to
reproduce data for quasiperpendicular kinematics, especially for larger Q^2,
and are partly responsible for reducing fitted normalization factors.
","[{""version"":""v1"",""created"":""Fri, 28 Jan 2005 23:14:34 GMT""}]","2009-11-11"
"nucl-th/0501080","Kyrill Bugaev","K. A. Bugaev and J. B. Elliott","Exactly Soluble Models for Surface Partition","7 pages and 2 figures","Ukr. J. Phys. 52, (2007) 301-308",,,"nucl-th",,"  The surface partition of large clusters is studied analytically within a
frame-work of the ``Hills and Dales Model''. Three formulations are solved
exactly by using the Laplace-Fourier transformation method. In the limit of
small amplitude deformations, the ``Hills and Dales Model'' gives upper and
lower bounds for the surface entropy coefficient of large clusters. A
comparison with the 2- and 3-dimensional Ising model surface entropy
coefficients is made.
","[{""version"":""v1"",""created"":""Sat, 29 Jan 2005 02:27:24 GMT""}]","2008-02-07"
"physics/0501149","Lei Xu","Lei Xu, Wendy W. Zhang and Sidney R. Nagel","Drop Splashing on a Dry Smooth Surface","11 pages, 4 figures","PRL 94, 184505 (2005)","10.1103/PhysRevLett.94.184505",,"physics.flu-dyn",,"  The corona splash due to the impact of a liquid drop on a smooth dry
substrate is investigated with high speed photography. A striking phenomenon is
observed: splashing can be completely suppressed by decreasing the pressure of
the surrounding gas. The threshold pressure where a splash first occurs is
measured as a function of the impact velocity and found to scale with the
molecular weight of the gas and the viscosity of the liquid. Both experimental
scaling relations support a model in which compressible effects in the gas are
responsible for splashing in liquid solid impacts.
","[{""version"":""v1"",""created"":""Fri, 28 Jan 2005 18:48:23 GMT""}]","2007-05-23"
"physics/0501150","Aditi Mallik","Aditi Mallik, Keith Runge, Hai-Ping Cheng, James W. Dufty","Constructing A Small Strain Potential for Multi-Scale Modeling","24 pages, 7 figures (submitted to Journal of Molecular Simulations)",,,,"physics.comp-ph",,"  For problems relating to fracture, a consistent embedding of a quantum (QM)
domain in its classical (CM) environment requires that the classical system
should yield the same structure and elastic properties as the QM domain for
states near equilibrium. It is proposed that an appropriate classical potential
can be constructed using ab initio data on the equilibrium and weakly strained
configurations calculated from the quantum description, rather than the more
usual approach of fitting to a wide range of empirical data. The scheme is
illustrated in detail for a model system, silica nanorod that has the proper
stiochiometric ratio of Si:O as observed in real silica. The potential is
chosen to be pairwise additive, with the same pair potential functional form as
familiar phenomenological TTAM potential. Here, the parameters are determined
using a genetic algorithm with force data obtained directly from a quantum
calculation. The resulting potential gives excellent agreement with properties
of the reference quantum calculations both for structure (bond lengths, bond
angles) and elasticity (Young's modulus). The proposed method for constructing
the classical potential is carried out for two different choices for the
quantum mechanical description: a transfer Hamiltonian method (NDDO with
coupled cluster parameterization) and density functional theory (with plane
wave basis set and PBE exchange correlation functional). The quality of the
potentials obtained in both cases is quite good, although the two quantum rods
have significant differences.
","[{""version"":""v1"",""created"":""Fri, 28 Jan 2005 18:38:14 GMT""}]","2007-05-23"
"physics/0501151","Hua-Shu Dou","Hua-Shu Dou, Boo Cheong Khoo, and Khoon Seng Yeo","Energy Loss Distribution in the Plane Couette Flow and the
  Taylor-Couette Flow between Concentric Rotating Cylinders","35 pages; 16 figures. (a few words have been corrected in this
  version)","Int.J.Thermal Sci.46:262-275,2007","10.1016/j.ijthermalsci.2006.05.003",,"physics.flu-dyn astro-ph.HE","http://arxiv.org/licenses/nonexclusive-distrib/1.0/","  The distribution of energy loss due to viscosity friction in plane Couette
flow and Taylor-Couette Flow between concentric rotating cylinders are studied
in detail for various flow conditions. The energy loss is related to the
industrial processes in some fluid delivery devices and has significant
influence on the flow efficiency, flow stability, turbulent transition, mixing,
and heat transfer behaviours, etc. Therefore, it is important to know about the
energy loss distribution in the flow domain and to know its influence on the
flow for better understanding of the flow physics. The calculation or
methodology of calculating the energy loss distribution in the Taylor-Couette
flow between concentric rotating cylinders is not readily found in the open
literature. In this paper, the principle and the calculation are given for
single cylinder rotation of either the inner or outer cylinder, and counter and
same direction rotation of two cylinders. For comparison, the distribution of
energy loss in a plane Couette flow is also derived for various flow
conditions. Discussions of the effect of energy loss on the flow behaviour are
carried out from which some findings are suggested.
","[{""version"":""v1"",""created"":""Sat, 29 Jan 2005 03:21:04 GMT""},{""version"":""v2"",""created"":""Sat, 25 Jun 2005 06:38:52 GMT""},{""version"":""v3"",""created"":""Mon, 5 Feb 2007 09:06:34 GMT""},{""version"":""v4"",""created"":""Tue, 15 Jun 2010 08:58:54 GMT""}]","2014-11-18"
"q-bio/0501038","Benjamin Lindner","Benjamin Lindner and Andre Longtin","Comment on: ""Characterization of subthreshold voltage fluctuations in
  neuronal membranes"" by M. Rudolph and A. Destexhe","22 pages, 6 figures; new results have been added including a
  criticism of a recent result for the probability density of the membrane
  voltage by Rudolph and Destexhe",,,,"q-bio.NC",,"  In two recent papers, Rudolph and Destexhe (Neural Comp. {\bf 15},
  2577-2618, 2003; Neural Comp. in press, 2005) studied a leaky integrator
model (i.e. an RC-circuit) driven by correlated (``colored'') Gaussian
conductance noise and Gaussian current noise. In the first paper they derived
an expression for the stationary probability density of the membrane voltage;
in the second paper this expression was modified to cover a larger parameter
regime. Here we show by standard analysis of solvable limit cases (white-noise
limit of additive and multiplicative noise sources; only slow multiplicative
noise; only additive noise) and by numerical simulations that their first
result does not hold for the general colored-noise case and uncover the errors
made in the derivation of a Fokker-Planck equation for the probability density.
Furthermore, we demonstrate analytically (including an exact integral
expression for the time-dependent mean value of the voltage) and by comparison
to simulation results, that the extended expression for the probability density
works much better but still does not solve exactly the full colored-noise
problem. We also show that at stronger synaptic input the stationary mean value
of the linear voltage model may diverge and give an exact condition relating
the system parameters for which this takes place.
","[{""version"":""v1"",""created"":""Fri, 28 Jan 2005 19:47:27 GMT""},{""version"":""v2"",""created"":""Wed, 15 Jun 2005 12:33:30 GMT""}]","2007-05-23"
