"astro-ph/0510018","Drago Alessandro","Alessandro Drago (Ferrara U. & INFN sez. Ferrara), Andrea Lavagno
  (Torino Politecnico & INFN sez. Torino), Giuseppe Pagliara (Torino
  Politecnico & INFN sez. Ferrara)","Gamma Ray Bursts and the transition to Quark Matter in Compact Stars","4 pages, 1 figure, Proceedings QM2005, August 2005 Budapest","Nucl.Phys.A774:823-826,2006","10.1016/j.nuclphysa.2006.06.144",,"astro-ph",,"  We discuss a model for long Gamma-Ray-Bursts in which the central engine is
associated with the conversion process of a metastable hadronic star into a
star containing quark matter. We analyze the observational signatures of the
model, i.e. the Supernova-GRB temporal connection and the existence of long
quiescent times in the temporal structure of Gamma-Ray-Bursts.
","[{""version"":""v1"",""created"":""Sat, 1 Oct 2005 17:59:29 GMT""}]","2009-11-13"
"astro-ph/0510019","Barry Rothberg","B. Rothberg (1), R. D. Joseph (2) ((1) Space Telescope Science
  Institute, (2) Institute for Astronomy)","A Survey of Merger Remnants II: The Emerging Kinematic and Photometric
  Correlations","Accepted Astronomical Journal (to appear in January 2006)","Astron.J.131:185-207,2006","10.1086/498452","STScI Eprint #1692","astro-ph",,"  This paper is the second in a series exploring the properties of 51 {\it
optically} selected, single-nuclei merger remnants. Spectroscopic data have
been obtained for a sub-sample of 38 mergers and combined with previously
obtained infrared photometry to test whether mergers exhibit the same
correlations as elliptical galaxies among parameters such as stellar luminosity
and distribution, central stellar velocity dispersion ($\sigma$$_{\circ}$), and
metallicity. Paramount to the study is to test whether mergers lie on the
Fundamental Plane. Measurements of $\sigma$$_{\circ}$ have been made using the
Ca triplet absorption line at 8500 {\AA} for all 38 mergers in the sub-sample.
Additional measurements of $\sigma$$_{\circ}$ were made for two of the mergers
in the sub-sample using the CO absorption line at 2.29 $\micron$. The results
indicate that mergers show a strong correlation among the parameters of the
Fundamental Plane but fail to show a strong correlation between
$\sigma$$_{\circ}$ and metallicity (Mg$_{2}$). In contrast to earlier studies,
the $\sigma$$_{\circ}$ of the mergers are consistent with objects which lie
somewhere between intermediate-mass and luminous giant elliptical galaxies.
However, the discrepancies with earlier studies appears to correlate with
whether the Ca triplet or CO absorption lines are used to derive
$\sigma$$_{\circ}$, with the latter almost always producing smaller values.
Finally, the photometric and kinematic data are used to demonstrate for the
first time that the central phase-space density of mergers are equivalent to
elliptical galaxies. This resolves a long-standing criticism of the merger
hypothesis.
","[{""version"":""v1"",""created"":""Sat, 1 Oct 2005 18:15:50 GMT""}]","2016-08-30"
"astro-ph/0510020","Renxin Xu","Y. L. Yue (PKU), X. H. Cui (PKU) and R. X. Xu (PKU)","To Understand the UV-optical Excess of RX J1856.5-3754","12 pages, 3 figures, or at:
  http://vega.bac.pku.edu.cn/rxxu/publications/index_P.htm",,,,"astro-ph",,"  The enigma source, RX J1856.5-3754, is one of the so-called dim thermal
neutron stars. Two puzzles of RXJ1856.5-3754 exist: (1) the observational X-ray
spectrum is completely featureless; (2) the UV-optical intensity is about seven
times larger than that given by the continuation of the blackbody model yielded
by the X-ray data. Both the puzzles would not exist anymore if RX J1856.5-3754
is a low mass bare strange quark star, which is in a propeller phase with a low
accretion rate. A boundary layer of RX J1856.5-3754 is suggested and modelled,
from which the UV-optical emission is radiated. Free-free absorption dominates
the opacity of the boundary layer, which results in the opacity to be high in
UV-optical but low in X-ray bands. The star's magnetic field, spin period, as
well as the accretion rate are constrained by observations.
","[{""version"":""v1"",""created"":""Sun, 2 Oct 2005 11:43:59 GMT""}]","2007-05-23"
"astro-ph/0510021","Mariko Kato","Mariko Kato (Keio Univ.) and Izumi Hachisu (Univ. of Tokyo)","A Modeling of the Super-Eddington Luminosity in Nova Outbursts: V1974
  Cygni","8 pages, 4 figures, to appear in ApJL","Astrophys.J.633:L117-L120,2005","10.1086/498300",,"astro-ph",,"  We have modeled nova light curves exceeding the Eddington luminosity. It has
been suggested that a porous structure develops in nova envelopes during the
super Eddington phase and the effective opacity is much reduced for such a
porous atmosphere. Based on this reduced opacity model, we have calculated
envelope structures and light curves of novae. The optically thick wind model
is used to simulate nova winds. We find that the photospheric luminosity and
the wind mass-loss rate increase inversely proportional to the reducing factor
of opacities, but the wind velocity hardly changes. We also reproduce the
optical light curve of V1974 Cygni (Nova Cygni 1992) in the super-Eddington
phase, which lasts 13 days from the optical peak 1.7 mag above the Eddington
luminosity.
","[{""version"":""v1"",""created"":""Sun, 2 Oct 2005 14:30:43 GMT""}]","2009-11-13"
"astro-ph/0510022","Jason X. Prochaska","J. X. Prochaska (1), J. S. Bloom (2), H.-W. Chen (3), R. J. Foley (2),
  D. A. Perley (2), E. Ramirez-Ruiz (4,1), J. Granot (5,4), W. H. Lee (6), D.
  Pooley (2), K. Alatalo (2), K. Hurley (7), et al. ((1) UCO/Lick Observatory,
  (2) UC Berkeley, (3) U Chicago, (4) IAS, (5) KIPAC/Stanford, (6) UNAM, (7)
  SSL/Berkeley)","The Galaxy Hosts and Large-Scale Environments of Short-Hard Gamma-Ray
  Bursts","8 pages, 2 figures. Accepted to ApJ","Astrophys.J.642:989-994,2006","10.1086/501160",,"astro-ph",,"  The rapid succession of discovery of short--duration hard--spectrum GRBs has
led to unprecedented insights into the energetics of the explosion and nature
of the progenitors. Yet short of the detection of a smoking gun, like a burst
of coincident gravitational radiation or a Li-Paczynski mini-supernova, it is
unlikely that a definitive claim can be made for the progenitors. As was the
case with long--duration soft--spectrum GRBs, however, the expectation is that
a systematic study of the hosts and the locations of short GRBs could begin to
yield fundamental clues about their nature. We present the first aggregate
study of the host galaxies of short--duration hard--spectrum GRBs. In
particular, we present the Gemini--North and Keck discovery spectra of the
galaxies that hosted three short GRBs and a moderate--resolution (R~6000)
spectrum of a fourth host. We find that these short--hard GRBs originate in a
variety of low-redshift (z<1) environments that differ substantially from those
of long--soft GRBs, both on individual galaxy scales and on galaxy--cluster
scales. Specifically, three of the bursts are found to be associated with old
and massive galaxies with no current (< 0.1 Msol/hr) or recent star formation.
Two of these galaxies are located within a cluster environment. These
observations support an origin from the merger of compact stellar remnants,
such as double neutron stars of a neutron star--black hole binary. The fourth
event, in contrast, occurred within a dwarf galaxy with a star formation rate
exceeding 0.5 Msol/yr. Therefore, it appears that like supernovae of Type Ia,
the progenitors of short--hard bursts are created in all galaxy types,
suggesting a corresponding class with a wide distribution of delay times
between formation and explosion.
","[{""version"":""v1"",""created"":""Sun, 2 Oct 2005 14:49:20 GMT""},{""version"":""v2"",""created"":""Sat, 11 Feb 2006 02:21:24 GMT""}]","2009-11-13"
"astro-ph/0510023","Raanan Nordon","R. Nordon (1), E. Behar (1), M. Guedel (2) ((1) Technion, Israel, (2)
  PSI, Switzerland)","On Temperature and Abundance Effects During an X-Ray Flare on Sigma
  Geminorum","6 pages, 4 figures, Accepted for publication in A&A",,"10.1051/0004-6361:20054018",,"astro-ph",,"  We compare quiescent and flare X-ray spectra of the RS CVn binary Sigma Gem
obtained with the Chandra and XMM-Newton grating spectrometers. We find that in
addition to an overall 25% flux increase, which can be ascribed to variations
in the system's quiescence activity over the 15 months that passed between the
observations, there is a hot plasma component of kT_e > 3 keV that arises with
the flare. The hot component is manifested primarily by emission from high
charge states of Fe and by a vast continuum. The cooler (kT_e < 2 keV) plasma
remains undisturbed during the flare. We find no significant variations in the
relative abundances during the flare except for a slight decrease (<30%) of O
and Ne.
","[{""version"":""v1"",""created"":""Sun, 2 Oct 2005 15:43:15 GMT""}]","2016-08-30"
"cond-mat/0510016","Siddhartha Lal","M. S. Laad and S. Lal","On charge and spin ordering in a one-dimensional model with frustrating
  interactions","7 pages, 2 figures; several typos corrected",,,,"cond-mat.str-el",,"  We study a one-dimensional extended Hubbard model with longer-range Coulomb
interactions at quarter-filling in the strong coupling limit. We find two
different charge-ordered ground states as the strength of the longer range
interactions is varied. At lower energies, these charge ordered states drive
two different spin-ordered ground states. A variety of response functions
computed here bear a remarkable resemblance to recent experimental observations
for organic TMTSF systems, and so we propose that these systems are proximate
to a quantum critical point (QCP) associated with T=0 charge order. For a
ladder system relevant to Sr_{14}Cu_{24}O_{41}, we find in-chain charge order,
rung-dimer, and orbital antiferromagnetic ordered phases with varying
interchain couplings and superconductivity with hole-doping.
","[{""version"":""v1"",""created"":""Sat, 1 Oct 2005 19:07:17 GMT""},{""version"":""v2"",""created"":""Thu, 6 Oct 2005 14:16:50 GMT""}]","2016-08-31"
"cond-mat/0510017","Jesus M. Cortes","J. M. Cortes, P. L. Garrido, J. Marro and J. J. Torres","Switching between memories in neural automata with synaptic noise","4 pages, 3 figures","Neurocomputing 58-60: 67-71, 2004",,,"cond-mat.stat-mech cond-mat.dis-nn",,"  We present a stochastic neural automata in which activity fluctuations and
synaptic intensities evolve at different temperature, the latter moving through
a set of stored patterns. The network thus exhibits various retrieval phases,
including one which depicts continuous switching between attractors. The
switching may be either random or more complex, depending on the system
parameters values.
","[{""version"":""v1"",""created"":""Sat, 1 Oct 2005 19:14:36 GMT""}]","2007-05-23"
"cond-mat/0510018","Tatsuaki Wada","T. Wada and H. Suyari","$\kappa$-generalization of Stirling approximation and multinominal
  coefficients","9 pages, no figure, RevTeX and amsmath, contribution to the 3rd
  NEXT-Sigma-Phi Conference, Crete, Aug. 2005",,,,"cond-mat.stat-mech",,"  Stirling approximation of the factorials and multinominal coefficients are
generalized based on the one-parameter ($\kappa$) deformed functions introduced
by Kaniadakis [Phys. Rev. E \textbf{66} (2002) 056125]. We have obtained the
relation between the $\kappa$-generalized multinominal coefficients and the
$\kappa$-entropy by introducing a new $\kappa$-product operation.
","[{""version"":""v1"",""created"":""Sat, 1 Oct 2005 23:54:27 GMT""}]","2007-05-23"
"cond-mat/0510019","Chandra Varma","C.M. Varma","Thirty Years of heavy Fermions: Scientific Setting for their Discovery
  and Partial Understanding","This is the text of one of the talks given at the plenary symposium
  entitled ""Thirty years of heavy Fermions"" at the beginning of the
  International conference on Strongly correlated Electrons in Vienna in July
  2005",,"10.1016/j.physb.2006.01.019",,"cond-mat.str-el",,"  Heavy-Fermions provide an extreme example of the utility of the idea of
continuity and analyticity in physics. Their discovery and study in the past
thirty years has added a fascinating chapter to condensed matter physics. I
briefly review the origins of the heavy-fermion problem out of the study of
magnetic moments in metals and the study of mixed-valent rare-earth compounds.
I also review the principal ideas underlying the features understood in their
fermi-liquid phase as well as in their anisotropic superconductivity. The
unsolved issues are also briefly mentioned.
","[{""version"":""v1"",""created"":""Sat, 1 Oct 2005 23:57:01 GMT""},{""version"":""v2"",""created"":""Wed, 5 Oct 2005 18:17:42 GMT""}]","2016-08-31"
"cond-mat/0510020","Amit Acharya","Amit Acharya, Anish Roy","Size effects and idealized dislocation microstructure at small scales:
  predictions of a phenomenological model of Mesoscopic Field Dislocation
  Mechanics: Part I",,,"10.1016/j.jmps.2006.01.009",,"cond-mat.mtrl-sci",,"  A Phenomenological Mesoscopic Field Dislocation Mechanics (PMFDM) model is
developed, extending continuum plasticity theory for studying initial-boundary
value problems of small-scale plasticity. PMFDM results from an elementary
space-time averaging of the equations of Field Dislocation Mechanics (FDM),
followed by a closure assumption from any strain-gradient plasticity model that
attempts to model effects of geometrically-necessary dislocations (GND) only in
work-hardening.
","[{""version"":""v1"",""created"":""Sun, 2 Oct 2005 01:17:49 GMT""}]","2016-08-31"
"cond-mat/0510021","James Lutsko","James F. Lutsko and Gr\'egoire Nicolis","Theoretical evidence for a dense fluid precursor to crystallization","4 pages, 3 figures","Phys. Rev. Lett. 96, 046102 (2006)","10.1103/PhysRevLett.96.046102",,"cond-mat.stat-mech cond-mat.soft",,"  We present classical density functional theory calculations of the free
energy landscape for fluids below their triple point as a function of density
and crystallinity. We find that for both a model globular protein and for a
simple atomic fluid modeled with a Lennard-Jones interaction, it is
free-energetically easier to crystallize by passing through a metastable dense
fluid in accord with the Ostwald rule of stages but in contrast to the
alternative of ordering and densifying at once as assumed in the classical
picture of crystallization.
","[{""version"":""v1"",""created"":""Sun, 2 Oct 2005 11:13:22 GMT""}]","2016-08-16"
"cond-mat/0510022","Alexander Korsunsky","Alexander M. Korsunsky, Gabriel M. Regino, David Nowell","Reconstruction of Residual Stress in a Welded Plate Using the
  Variational Eigenstrain Approach","16 pages, 17 figures",,,,"cond-mat.mtrl-sci",,"  We present the formulation for finding the distribution of eigenstrains, i.e.
the sources of residual stress, from a set of measurements of residual elastic
strain (e.g. by diffraction), or residual stress, or stress redistribution, or
distortion. The variational formulation employed seeks to achieve the best
agreement between the model prediction and some measured parameters in the
sense of a minimum of a functional given by a sum over the entire set of
measurements. The advantage of this approach lies in its flexibility: different
sets of measurements and information about different components of the
stress-strain state can be incorporated. We demonstrate the power of the
technique by analysing experimental data for welds in thin sheet of a nickel
superalloy aerospace material. Very good agreement can be achieved between the
prediction and the measurement results without the necessity of using iterative
solution. In practice complete characterisation of residual stress states is
often very difficult, due to limitations of facility access, measurement time
or specimen dimensions. Implications of the new technique for experimental
analysis are all the more significant, since it allows the reconstruction of
the entire stress state from incomplete sets of data.
","[{""version"":""v1"",""created"":""Sun, 2 Oct 2005 13:10:18 GMT""}]","2007-05-23"
"cond-mat/0510023","Mattias Marklund","M. Marklund and P.K. Shukla","Random phases in Bose-Einstein condensates with higher order
  nonlinearities","3 pages, no figs., to appear in Eur. Phys. J. B","Eur. Phys. J. B 48, 71 (2005)","10.1140/epjb/e2005-00373-2",,"cond-mat.other",,"  We present a statistical description of Bose-Einstein condensates with
general higher order nonlinearities. In particular, we investigate the case of
cubic-quintic nonlinearities, of particular interest for dilute condensates.
The implication of decoherence for the stability properties of the condensate
is discussed.
","[{""version"":""v1"",""created"":""Sun, 2 Oct 2005 13:49:22 GMT""}]","2009-11-11"
"cond-mat/0510024","Maxim G. Vavilov","M. G. Vavilov","Giant Magneto-Oscillations of Electric-Field-Induced Spin Polarization
  in 2DEG","6 pages, 3 figures","Phys. Rev. B 72, 195327 (2005)","10.1103/PhysRevB.72.195327",,"cond-mat.mes-hall cond-mat.mtrl-sci",,"  We consider a disordered two-dimensional electron gas with spin-orbit
coupling placed in a perpendicular magnetic field and calculate the magnitude
and direction of the electric-field-induced spin polarization. We find that in
strong magnetic fields the polarization becomes an oscillatory function of the
magnetic field and that the amplitude of these oscillations is parametrically
larger than the polarization at zero magnetic field. We show that the enhanced
amplitude of the polarization is a consequence of strong electron-hole
asymmetry in a quantizing magnetic field.
","[{""version"":""v1"",""created"":""Sun, 2 Oct 2005 15:47:05 GMT""}]","2016-08-31"
"cond-mat/0510025","G. Khaliullin","Giniyat Khaliullin","Orbital order and fluctuations in Mott insulators","48 pages, 5 figures; typos corrected, journal reference added","Prog. Theor. Phys. Suppl. {160}, 155 (2005)","10.1143/PTPS.160.155",,"cond-mat.str-el",,"  Basic mechanisms controlling orbital order and orbital fluctuations in
transition metal oxides are discussed. The lattice driven classical orbital
picture, e.g. like in manganites LaMnO$_3$, is contrasted to the quantum
behavior of orbitals in frustrated superexchange models as realised in
pseudocubic titanites ATiO$_3$ and vanadates AVO$_3$. In YVO$_3$, the lattice
and superexchange effects strongly compete -- this explains the extreme
sensitivity of magnetic states to temperature and doping. Lifting the $t_{2g}$
orbital degeneracy by a relativistic spin-orbital coupling is considered on
example of the layered cobaltates. We find that the spin-orbital mixing of
low-energy states leads to unusual magnetic correlations in a triangular
lattice of the CoO$_2$ parent compound. Finally, the magnetism of sodium-rich
compounds Na$_{1-x}$CoO$_2$ is discussed in terms of a spin/orbital polaronic
liquid.
","[{""version"":""v1"",""created"":""Sun, 2 Oct 2005 15:51:19 GMT""},{""version"":""v2"",""created"":""Fri, 12 May 2006 12:58:15 GMT""}]","2009-11-11"
"cs/0510003","Giuseppe Abreu","Giuseppe Thadeu Freitas de Abreu","Generalized ABBA Space-Time Block Codes","47 pages, 6 figures, Matlab codes included",,,,"cs.IT math.IT",,"  Linear space-time block codes (STBCs) of unitary rate and full diversity,
systematically constructed over arbitrary constellations for any number of
transmit antennas are introduced. The codes are obtained by generalizing the
existing ABBA STBCs, a.k.a quasi-orthogonal STBCs (QO-STBCs). Furthermore, a
fully orthogonal (symbol-by-symbol) decoder for the new generalized ABBA
(GABBA) codes is provided. This remarkably low-complexity decoder relies on
partition orthogonality properties of the code structure to decompose the
received signal vector into lower-dimension tuples, each dependent only on
certain subsets of the transmitted symbols. Orthogonal decodability results
from the nested application of this technique, with no matrix inversion or
iterative signal processing required. The exact bit-error-rate probability of
GABBA codes over generalized fading channels with maximum likelihood (ML)
decoding is evaluated analytically and compared against simulation results
obtained with the proposed orthogonal decoder. The comparison reveals that the
proposed GABBA solution, despite its very low complexity, achieves nearly the
same performance of the bound corresponding to the ML-decoded system,
especially in systems with large numbers of antennas.
","[{""version"":""v1"",""created"":""Sun, 2 Oct 2005 14:10:11 GMT""}]","2007-07-13"
"gr-qc/0510004","Haret Rosu","H.C. Rosu, P. Ojeda-May","Supersymmetry of FRW barotropic cosmologies","6 pages","Int.J.Theor.Phys. 45 (2006) 1191-1196","10.1007/s10773-006-9123-2",,"gr-qc",,"  Barotropic FRW cosmologies are presented from the standpoint of
nonrelativistic supersymmetry. First, we reduce the barotropic FRW system of
differential equations to simple harmonic oscillator differential equations.
Employing the factorization procedure, the solutions of the latter equations
are divided into the two classes of bosonic (nonsingular) and fermionic
(singular) cosmological solutions. We next introduce a coupling parameter
denoted by K between the two classes of solutions and obtain barotropic
cosmologies with dissipative features acting on the scale factors and spatial
curvature of the universe. The K-extended FRW equations in comoving time are
presented in explicit form in the low coupling regime. The standard barotropic
FRW cosmologies correspond to the dissipationless limit K =0
","[{""version"":""v1"",""created"":""Sun, 2 Oct 2005 02:36:52 GMT""}]","2007-05-23"
"hep-lat/0510009","Akira Ukawa","Akira Ukawa","Hadron Spectrum from Lattice QCD","Talk given at the International Conference on QCD and Hadronic
  Physics, Beijing, June 16-20, 2005. References added and corrected","Int.J.Mod.Phys. A21 (2006) 726-732","10.1142/S0217751X06031958",,"hep-lat",,"  A brief review is given of the lattice QCD calculation of the hadron
spectrum. The status of current attempts toward inclusion of dynamical up, down
and strange quarks is summarized focusing on our own work. Recent work on the
possible existence of pentaquark states are assessed. We touch upon the PACS-CS
Project for building our next machine for lattice QCD, and conclude with a
near-term physics and machine prospects.
","[{""version"":""v1"",""created"":""Sun, 2 Oct 2005 05:35:50 GMT""},{""version"":""v2"",""created"":""Thu, 6 Oct 2005 10:07:41 GMT""}]","2009-11-11"
"hep-lat/0510010","Akira Ukawa","PACS-CS Collaboration : S. Aoki, K.-I. Ishikawa, T. Ishikawa, N.
  Ishizuka, K. Kanaya, Y. Kuramashi, M. Okawa, K. Sasaki, Y. Taniguchi, N.
  Tsutsui, A. Ukawa, T. Yoshie","The PACS-CS Project","6 pages, 2 figures, talk presented at Lattice2005 (Algorithm and
  Machines)","PoS LAT2005 (2005) 111",,,"hep-lat",,"  We describe our plan to develop a large-scale cluster system with a peak
speed of 14.3Tflops for lattice QCD at the Center for Computational Sciences,
University of Tsukuba, as a successor to the current 0.6Tflops CP-PACS
computer. The system consist of 2560 nodes connected by a 16x16x10
three-dimensional hyper crossbar network. Each node has a single low-voltage
2.8GHz Xeon processor and 2GBytes of memory with 6.4GBytes/sec bandwidth, and
160 GBytes of disk in RAID1 mode. The network link in each of the three
directions is made of dual Gigabit Ethernet with the peak throughput of
250MByte/sec. Hence each node has an aggregate network bandwidth of
750MByte/sec. The system will run under Linux and SCore, and an extension of
the PM driver is developed for the network. The system will be developed
jointly with Hitachi Limited. The installation is scheduled in the first
quarter of Japanese Fiscal 2006 (April-June 2006) and the start of operation is
expected in July 2006.
","[{""version"":""v1"",""created"":""Sun, 2 Oct 2005 05:48:57 GMT""}]","2012-08-27"
"hep-ph/0510006","Stefan Sint","Stefan Sint","The Kaon B-parameter in quenched QCD","4 pages, parallel talk at International Conference on QCD and
  Hadronic Physics, Beijing, June 2005","Int.J.Mod.Phys. A21 (2006) 865-868","10.1142/S0217751X06032186","IFT-UAM-CSIC/05-40","hep-ph",,"  I report on a recent determination by the ALPHA collaboration of the kaon
B-parameter using lattice QCD with Wilson type quarks. An effort is made to
control all systematic errors except for the quenched approximation. The
preliminary result for the renormalization group invariant parameter is
$\hat{B}_K = 0.834(37)$, which translates to $B_K^MSbar(2 GeV)=0.604(27)$ in
the MSbar scheme with anticommuting $\gamma_5$.
","[{""version"":""v1"",""created"":""Sun, 2 Oct 2005 00:53:23 GMT""}]","2009-11-11"
"hep-ph/0510007","Firooz Arash","Firooz Arash, and Fatemeh Taghavi","Hadronic Structure from Perturbative dressing in QCD - The Valon Model","4 pages, 6 ps figures, contribution to the Elastic and Diffractive
  Scattering, EDS05, Blois, France, May 15th - 20th, 2005",,,,"hep-ph",,"  In the Framework of {\it{valon model}} we have calculated the parton
distribution in a valon for both the polarized and unpolarized cases. These
distributions are originated purely from the dressing of a valence quark in QCD
and are common to all hadrons. Structure functions, $F_{2}^{p,\pi}$, are
obtained, which agree rather well with the experimental results. A simple
relation between $F_{2}^{p}$ and $F_{2}^{\pi}$ is inferred. For the polarized
structure function, $g_{1}$ while the model gives good agreement with data, it
requires a sizable angular momentum contribution to the spin of the valon, and
hence to that of proton. This contribution is calculated.
","[{""version"":""v1"",""created"":""Sun, 2 Oct 2005 09:32:31 GMT""}]","2007-05-23"
