"hep-ph/0510008","Alessandro Strumia","Thomas Hambye, Martti Raidal, Alessandro Strumia","Efficiency and maximal CP-asymmetry of scalar triplet leptogenesis","12 pages, 6 figures. Interference term added to eq. (16d), figures
  recomputed (the difference is almost invisible)","Phys.Lett.B632:667-674,2006","10.1016/j.physletb.2005.11.007","IFUP-TH/2005-17","hep-ph",,"  We study thermal leptogenesis induced by decays of a scalar SU(2)_L triplet.
Despite the presence of gauge interactions, unexpected features of the
Boltzmann equations make the efficiency close to maximal in most of the
parameter space. We derive the maximal CP asymmetry in triplet decays, assuming
that it is generated by heavier sources of neutrino masses: in this case
successful leptogenesis needs a triplet heavier than 2.8 10^{10} GeV and does
not further restrict its couplings, allowing detectable mu --> e gamma, tau -->
mu gamma rates in the context of supersymmetric models. Triplet masses down to
the TeV scale are viable in presence of extra sources of CP-violation.
","[{""version"":""v1"",""created"":""Sun, 2 Oct 2005 12:07:10 GMT""},{""version"":""v2"",""created"":""Tue, 8 Nov 2005 18:36:39 GMT""},{""version"":""v3"",""created"":""Tue, 16 May 2006 15:36:35 GMT""}]","2009-10-09"
"math-ph/0510006","Jakob Yngvason","K. Schnee, J. Yngvason","Bosons in Disc-Shaped Traps: From 3D to 2D","Corrected version. To be published in Communications in Mathematical
  Physics",,,,"math-ph cond-mat.stat-mech math.MP",,"  We present a mathematically rigorous analysis of the ground state of a
dilute, interacting Bose gas in a three-dimensional trap that is strongly
confining in one direction so that the system becomes effectively
two-dimensional. The parameters involved are the particle number, $N\gg 1$, the
two-dimensional extension, $\bar L$, of the gas cloud in the trap, the
thickness, $h\ll \bar L$ of the trap, and the scattering length $a$ of the
interaction potential. Our analysis starts from the full many-body Hamiltonian
with an interaction potential that is assumed to be repulsive, radially
symmetric and of short range, but otherwise arbitrary. In particular, hard
cores are allowed. Under the premisses that the confining energy, $\sim 1/h^2$,
is much larger than the internal energy per particle, and $a/h\to 0$, we prove
that the system can be treated as a gas of two-dimensional bosons with
scattering length $a_{\rm 2D}= h\exp(-(\hbox{\rm const.)}h/a)$. In the
parameter region where $a/h\ll |\ln(\bar\rho h^2)|^{-1}$, with $\bar\rho\sim
N/\bar L^2$ the mean density, the system is described by a two-dimensional
Gross-Pitaevskii density functional with coupling parameter $\sim Na/h$. If
$|\ln(\bar\rho h^2)|^{-1}\lesssim a/h$ the coupling parameter is $\sim N
|\ln(\bar\rho h^2)|^{-1}$ and thus independent of $a$. In both cases
Bose-Einstein condensation in the ground state holds, provided the coupling
parameter stays bounded.
","[{""version"":""v1"",""created"":""Sat, 1 Oct 2005 22:59:08 GMT""},{""version"":""v2"",""created"":""Mon, 16 Oct 2006 17:51:59 GMT""}]","2007-05-23"
"math-ph/0510007","G. S. Asanov","G. S. Asanov","Finslerian metric function of totally anisotropic type. Relativistic
  aspects",,,,,"math-ph math.DG math.MP",,"  The work focuses upon the relativistic and geometric properties of the
space--time endowed tentatively with the metric function of the Berwald--Moor
type. The zero curvature of indicatrix is a remarkable property of the
approach. We demonstrate how the associated geodesic equations can be solved in
a transparent way, thereby obtaining possibility to introduce unambiguously the
distance, angle, and scalar product. We find convenient indicatrix
representation for the associated tetrads and, by attributing to them naturally
the general meaning of the bases proper of inertial reference frames, elucidate
respective fundamental kinematic relations, including the extensions of Lorentz
transformations and velocity subtraction and composition laws. The invariance
group for the metric tensor is found.
","[{""version"":""v1"",""created"":""Sun, 2 Oct 2005 11:50:51 GMT""}]","2007-05-23"
"math-ph/0510008","Yaakov Friedman","Yaakov Friedman","Geometric tri-product of the spin domain and Clifford algebras","28 pages, 4 figures","Advances in Applied Clifford Algebras, Birkhauser, (2008) 621-645",,,"math-ph math.MP",,"  We show that the triple product defined by the spin domain (Bounded Symmetric
Domain of type 4 in Cartan's classification) is closely related to the
geometric product in Clifford algebras. We present the properties of this
tri-product and compare it with the geometric product.
  The spin domain can be used to construct a model in which spin 1 and spin1/2
particles coexist. Using the geometric tri-product, we develop the geometry of
this domain. We present a geometric spectral theorem for this domain and obtain
both spin 1 and spin 1/2 representations of the Lorentz group on this domain.
","[{""version"":""v1"",""created"":""Sun, 2 Oct 2005 13:27:02 GMT""}]","2010-08-23"
"math/0510013","David Chua","David B. Chua, Eric D. Kolaczyk and Mark Crovella","Network Kriging","16 pages, 9 figures, single-spaced",,,,"math.ST cs.NI stat.TH",,"  Network service providers and customers are often concerned with aggregate
performance measures that span multiple network paths. Unfortunately, forming
such network-wide measures can be difficult, due to the issues of scale
involved. In particular, the number of paths grows too rapidly with the number
of endpoints to make exhaustive measurement practical. As a result, it is of
interest to explore the feasibility of methods that dramatically reduce the
number of paths measured in such situations while maintaining acceptable
accuracy.
  We cast the problem as one of statistical prediction--in the spirit of the
so-called `kriging' problem in spatial statistics--and show that end-to-end
network properties may be accurately predicted in many cases using a
surprisingly small set of carefully chosen paths. More precisely, we formulate
a general framework for the prediction problem, propose a class of linear
predictors for standard quantities of interest (e.g., averages, totals,
differences) and show that linear algebraic methods of subset selection may be
used to effectively choose which paths to measure. We characterize the
performance of the resulting methods, both analytically and numerically. The
success of our methods derives from the low effective rank of routing matrices
as encountered in practice, which appears to be a new observation in its own
right with potentially broad implications on network measurement generally.
","[{""version"":""v1"",""created"":""Sun, 2 Oct 2005 00:18:37 GMT""},{""version"":""v2"",""created"":""Tue, 4 Oct 2005 02:16:32 GMT""}]","2007-06-13"
"math/0510014","Boris Solomyak","Boris Solomyak","Pseudo-self-affine tilings in R^d","16 pages, submitted to a volume dedicated to A. M. Vershik","Zap. Nauchn. Sem. S.-Peterburg. Otdel. Mat. Inst. Steklov. (POMI)
  326 (2005), Teor. Predst. Din. Sist. Komb. i Algoritm. Metody. 13, 198--213,
  282--283; translation in J. Math. Sci. (N. Y.) 140 (2007), no. 3, 452--460",,,"math.DS math.MG",,"  It is proved that every pseudo-self-affine tiling in R^d is mutually locally
derivable with a self-affine tiling. A characterization of pseudo-self-similar
tilings in terms of derived Voronoi tessellations is a corollary. Previously,
these results were obtained in the planar case, jointly with Priebe Frank. The
new approach is based on the theory of graph-directed iterated function systems
and substitution Delone sets developed by Lagarias and Wang.
","[{""version"":""v1"",""created"":""Sun, 2 Oct 2005 08:43:01 GMT""}]","2011-07-20"
"math/0510015","Wujie Shi","Xingzhong You, Guohua Qian and Wujie Shi","A new graph related to conjugacy classes of finite groups","9 pages",,,,"math.GR",,"  In this paper we classify the finite groups satisfying the following property
$P_4$: their orders of representatives are set-wise relatively prime for any 4
distinct non-central conjugacy classes.
","[{""version"":""v1"",""created"":""Sun, 2 Oct 2005 09:12:22 GMT""}]","2007-05-23"
"math/0510016","Julie Clutterbuck","Julie Clutterbuck","Interior Gradient Estimates for Anisotropic Mean Curvature Flow","14 pages; to be published in the Pacific Journal of Mathematics",,,,"math.DG math.AP",,"  In this paper we consider the evolution of a graph-like hypersurface by
anisotropic mean curvature flow, under some restrictions on the anisotropic
area integrand. We find interior estimates (in both time and space) on the
gradient of such hypersurfaces, depending only on the height of the graph and
the anisotropic area integrand.
","[{""version"":""v1"",""created"":""Sun, 2 Oct 2005 12:23:34 GMT""}]","2007-05-23"
"math/0510017","Daisuke Sagaki","Satoshi Naito and Daisuke Sagaki","Crystal structure of the set of Lakshmibai-Seshadri paths of a
  level-zero shape for an affine Lie algebra",,,,,"math.QA",,"  Let $\lambda = \sum_{i \in I_{0}} m_{i} \varpi_{i}$, with $m_{i} \in
\mathbb{Z}_{\ge 0}$ for $i \in I_{0}$, be a level-zero dominant integral weight
for an affine Lie algebra $\mathfrak{g}$ over $\mathbb{Q}$, where the
$\varpi_{i}$, $i \in I_{0}$, are the level-zero fundamental weights, and let
$\mathbb{B}(\lambda)$ be the crystal of all Lakshmibai-Seshadri paths of shape
$\lambda$.
  First, we give an explicit description of the decomposition of the crystal
$\mathbb{B}(\lambda)$ into a disjoint union of connected components, and show
that all the connected components are pairwise ``isomorphic'' (up to a shift of
weights).
  Second, we ``realize'' the connected component $\mathbb{B}_{0}(\lambda)$ of
$\mathbb{B}(\lambda)$ containing the straight line $\pi_{\lambda}$ as a
specified subcrystal of the affinization
$\hat{\mathbb{B}(\lambda)_{\mathrm{cl}}}$ (with weight lattice $P$) of the
crystal $\mathbb{B}(\lambda)_{\mathrm{cl}} \simeq \bigotimes_{i \in I_{0}}
\bigl(\mathbb{B}(\varpi_{i})_{\mathrm{cl}} \bigr)^{\otimes m_{i}}$ (with weight
lattice $P_{\mathrm{cl}} = P/(\mathbb{Q}\delta \cap P)$, where $\delta$ is the
null root of $\mathfrak{g}$), which was studied in a previous paper.
","[{""version"":""v1"",""created"":""Sun, 2 Oct 2005 13:17:50 GMT""}]","2007-05-23"
"math/0510018","Helen Zhou","Hailun Zhou","The Cost of Two-dimensional Rearrangement","6 pages, 2 figures",,,,"math.DS",,"  In this paper, we give an estimate for the energy of a highly mixed
diffeomorphism on a two-dimensional torus.
","[{""version"":""v1"",""created"":""Sun, 2 Oct 2005 13:34:58 GMT""}]","2007-05-23"
"math/0510019","Dimitry Leites","Dimitry Leites, Elena Poletaeva","Defining relations for classical Lie algebras of polynomial vector
  fields","11 pages, Latex","Mathematica Scandinavica, 81, 1997, 5--19",,,"math.RT",,"  We explicitly describe the defining relations for simple Lie algebra of
vector fields with polynomial coefficients and its subalgebras of divergence
free, hamiltonian and contact vector fields, and for the Poisson algebra
(realized on polynomials). We consider generators of these Lie algebras
corresponding to the systems of simple roots associated with the standard
grading of these algebras. (These systems of simple roots are distinguished in
the sense of Penkov and Serganova.
","[{""version"":""v1"",""created"":""Sun, 2 Oct 2005 13:50:30 GMT""}]","2007-05-23"
"physics/0510005","Ira Schwartz","Ira B. Schwartz, Leah B. Shaw, Derek A. T. Cummings, Lora Billings,
  Marie McCrary, Donald S. Burke","Chaotic desynchronization of multi-strain diseases","6 pages with 7 figures accepted to Physical Review E",,"10.1103/PhysRevE.72.066201",,"physics.bio-ph",,"  Multi-strain diseases are diseases that consist of several strains, or
serotypes. The serotypes may interact by antibody-dependent enhancement (ADE),
in which infection with a single serotype is asymptomatic, but infection with a
second serotype leads to serious illness accompanied by greater infectivity. It
has been observed from serotype data of dengue hemorrhagic fever that outbreaks
of the four serotypes occur asynchronously. Both autonomous and seasonally
driven outbreaks were studied in a model containing ADE. For sufficiently small
ADE, the number of infectives of each serotype synchronizes, with outbreaks
occurring in phase. When the ADE increases past a threshold, the system becomes
chaotic, and infectives of each serotype desynchronize. However, certain
groupings of the primary and second ary infectives remain synchronized even in
the chaotic regime.
","[{""version"":""v1"",""created"":""Sat, 1 Oct 2005 16:33:37 GMT""},{""version"":""v2"",""created"":""Wed, 12 Oct 2005 18:19:20 GMT""}]","2009-11-11"
"physics/0510006","Alexander Potekhin","A. Y. Potekhin (1), G. Massacrier (2), G. Chabrier (2) ((1) Ioffe
  Inst., St.Petersburg; (2) ENS-Lyon)","Equation of state for partially ionized carbon at high temperatures","8 pages, 10 figures. Accepted by Phys. Rev. E","Phys.Rev. E72 (2005) 046402","10.1103/PhysRevE.72.046402",,"physics.plasm-ph astro-ph",,"  Equation of state for partially ionized carbon at temperatures T > ~ 10^5 K
is calculated in a wide range of densities, using the method of free energy
minimization in the framework of the chemical picture of plasmas. The free
energy model includes the internal partition functions of bound species. The
latter are calculated by a self-consistent treatment of each ionization stage
in the plasma environment taking into account pressure ionization. The
long-range Coulomb interactions between ions and screening of the ions by free
electrons are included using our previously published analytical model.
","[{""version"":""v1"",""created"":""Sat, 1 Oct 2005 18:58:35 GMT""}]","2007-05-23"
"physics/0510007","Laszlo Gillemot","Laszlo Gillemot, J. Doyne Farmer, Fabrizio Lillo","There's more to volatility than volume","25 pages, 9 figures",,,,"physics.soc-ph q-fin.ST",,"  It is widely believed that fluctuations in transaction volume, as reflected
in the number of transactions and to a lesser extent their size, are the main
cause of clustered volatility. Under this view bursts of rapid or slow price
diffusion reflect bursts of frequent or less frequent trading, which cause both
clustered volatility and heavy tails in price returns. We investigate this
hypothesis using tick by tick data from the New York and London Stock Exchanges
and show that only a small fraction of volatility fluctuations are explained in
this manner. Clustered volatility is still very strong even if price changes
are recorded on intervals in which the total transaction volume or number of
transactions is held constant. In addition the distribution of price returns
conditioned on volume or transaction frequency being held constant is similar
to that in real time, making it clear that neither of these are the principal
cause of heavy tails in price returns. We analyze recent results of Ane and
Geman (2000) and Gabaix et al. (2003), and discuss the reasons why their
conclusions differ from ours. Based on a cross-sectional analysis we show that
the long-memory of volatility is dominated by factors other than transaction
frequency or total trading volume.
","[{""version"":""v1"",""created"":""Sun, 2 Oct 2005 12:01:15 GMT""}]","2008-12-02"
"q-bio/0510003","Jesus M. Cortes","J. M. Cortes, J. Marro and J. J. Torres","Control of neural chaos by synaptic noise","6 pages, 3 figures. To appear in Biosystems, 2005",,,,"q-bio.NC",,"  We studied neural automata -or neurobiologically inspired cellular automata-
which exhibits chaotic itinerancy among the different stored patterns or
memories. This is a consequence of activity-dependent synaptic fluctuations,
which continuously destabilize the attractor and induce irregular hopping to
other possible attractors. The nature of the resulting irregularity depends on
the dynamic details, namely, on the intensity of the synaptic noise and on the
number of sites of the network that are synchronously updated at each time
step. Varying these details, different regimes occur from regular to chaotic.
In the absence of external agents, the chaotic behavior may turn regular after
tuning the noise intensity. It is argued that a similar mechanism might be at
the origin of the self-control of chaos in natural systems.
","[{""version"":""v1"",""created"":""Sat, 1 Oct 2005 18:40:45 GMT""}]","2007-05-23"
"q-bio/0510004","Michael Sadovsky","Michael Sadovsky","The simplest model of spatially distributed population with reasonable
  migration of organisms","7 pages, 1 figure",,,,"q-bio.PE q-bio.QM",,"  The simplest model of a smart spatial redistribution of individuals is
proposed. A single-species population is considered, to be composed of two
discrete subpopulations inhabiting two stations; migration is a transfer
between them. The migration is not random and yields the maximization of net
reproduction, with respect to the transaction costs. The organisms are supposed
to be globally informed. Discrete time model is studied, since it shows all the
features of a smart migrations, while the continuous time case brings no new
knowledge but the technical problems. Some properties of the model are studied
and discussed.
","[{""version"":""v1"",""created"":""Sun, 2 Oct 2005 05:58:47 GMT""}]","2016-09-08"
"quant-ph/0510005","Holger F. Hofmann","Holger F. Hofmann","Generation of a highly phase sensitive polarization squeezed N-photon
  state by collinear parametric downconversion and coherent photon subtraction","7 pages, including 5 figures, improved explanation of interferometry
  (one new figure)","Phys. Rev. A 74, 013808 (2006)","10.1103/PhysRevA.74.013808",,"quant-ph",,"  It is shown that a highly phase sensitive polarization squeezed (2n-1)-photon
state can be generated by subtracting a diagonally polarized photon from the 2n
photon component generated in collinear type II downconversion. This
polarization wedge state has the interesting property that its photon number
distribution in the horizontal and vertical polarizations remains sharply
defined for phase shifts of up to 1/n between the circularly polarized
components. Phase shifts at the Heisenberg limit are therefore observed as
nearly deterministic transfers of a single photon between the horizontal and
vertical polarization components.
","[{""version"":""v1"",""created"":""Sun, 2 Oct 2005 08:31:50 GMT""},{""version"":""v2"",""created"":""Wed, 15 Mar 2006 09:01:52 GMT""},{""version"":""v3"",""created"":""Tue, 23 May 2006 04:26:29 GMT""}]","2009-11-11"
"quant-ph/0510006","Andr\'e Carvalho R. R.","Andr\'e R. R. Carvalho, Marc Busse, Olivier Brodier, Carlos Viviescas,
  and Andreas Buchleitner","Unravelling Entanglement","4 pages, 4 figures",,,,"quant-ph",,"  We show that the time evolution of entanglement under incoherent environment
coupling can be faithfully recovered by monitoring the system according to a
suitable measurement scheme.
","[{""version"":""v1"",""created"":""Sun, 2 Oct 2005 09:54:42 GMT""}]","2016-09-08"
"quant-ph/0510007","G\'eza T\'oth","Geza Toth, Otfried Guehne, Hans J. Briegel","Two-setting Bell Inequalities for Graph States","8 pages including 2 figures, revtex4; minor changes","Phys. Rev. A 73, 022303 (2006)","10.1103/PhysRevA.73.022303",,"quant-ph",,"  We present Bell inequalities for graph states with high violation of local
realism. In particular, we show that there is a two-setting Bell inequality for
every nontrivial graph state which is violated by the state at least by a
factor of two. These inequalities are facets of the convex polytope containing
the many-body correlations consistent with local hidden variable models. We
first present a method which assigns a Bell inequality for each graph vertex.
Then for some families of graph states composite Bell inequalities can be
constructed with a violation of local realism increasing exponentially with the
number of qubits. We also suggest a systematic way for obtaining Bell
inequalities with a high violation of local realism for arbitrary graphs.
","[{""version"":""v1"",""created"":""Sun, 2 Oct 2005 10:36:18 GMT""},{""version"":""v2"",""created"":""Wed, 12 Apr 2006 21:53:55 GMT""}]","2007-05-23"
